User_name,Datetime,Content,Links,Tweet_ID
TeelaJackson,2020-09-28T23:59:34.000Z,"I am much more flexible and accommodating during COVID. That being said, I have an 8 minute rule but even then I’m forgiving and flexible. If they join without acknowledging their tardiness then things turn the unfavorable corner. #Recruiting #interview",https://x.com/hashtag/Recruiting?src=hashtag_click https://x.com/hashtag/interview?src=hashtag_click,1310730904206282752
0Fxckstogive,2020-09-28T23:59:34.000Z,"So since we going back into lockdown, will gas prices drop again",,1310730902511792128
theboardrules,2020-09-28T23:59:33.000Z,Tomorrow a high school classmate gets put to rest due to covid-19. Mr. Trump his death is on your hands. We need to vote this bastard out now!!! #TrumpKnewAndDidNothing,https://x.com/hashtag/TrumpKnewAndDidNothing?src=hashtag_click,1310730900376817667
desmarais_l,2020-09-28T23:59:33.000Z,Why have doctors and nurses worn masks for decades? There is no conspiracy. If this makes you feel important or special..sad. Why don't you help out a senior in your neighborhood or volunteer at a food bank? You will then be special. Now go WEAR A MASK.,,1310730899412180992
auntjody1976,2020-09-28T23:59:32.000Z,"How odd he  wants him to do a drug test ? So petty when our current disaster tweets things a president shouldn’t say , avoids the pandemic to the point still has rallies! #Election2020 #TrumpTaxReturns",https://x.com/hashtag/Election2020?src=hashtag_click https://x.com/hashtag/TrumpTaxReturns?src=hashtag_click,1310730896404893696
beachbucc,2020-09-28T23:59:32.000Z,This is why I wear a mask #granddaughter #baby #feet #babyfeet #WearAMask #CutenessOverload #HamOnt,https://x.com/hashtag/granddaughter?src=hashtag_click https://x.com/hashtag/baby?src=hashtag_click https://x.com/hashtag/feet?src=hashtag_click https://x.com/hashtag/babyfeet?src=hashtag_click https://x.com/hashtag/WearAMask?src=hashtag_click https://x.com/hashtag/CutenessOverload?src=hashtag_click https://x.com/hashtag/HamOnt?src=hashtag_click,1310730894945255425
Jason7453,2020-09-28T23:59:31.000Z,"Second wave? Even after the nazi -like lockdown you did? You deserve first place -  one of the highest death rates out of anywhere in the world. Yeah, you’re a manager alright with your bro as prop arm. You killed NY. Literally. So glad I moved out.",,1310730892688711680
FIENDSQUAD,2020-09-28T23:59:31.000Z,"There's not gonna be a debate. Biden passes peacefully tonight, or contracts ""covid"".",,1310730891824631808
ross_baglin,2020-09-28T23:59:31.000Z,"An activist journalist haranguing a politician from a soapbox.  Nobody considers Jon Snow an honest broker, and that “interview” style is why.    The Covid policy is a mess.  But  journalists who play politics without the bother of standing for election are partly why.",,1310730890612559878
m_kforfreedom07,2020-09-28T23:59:30.000Z,That’s exactly what he’s going to do! A community that doesn’t wear masks or social distancing are not voluntarily going for testing.  These Covid clusters are bs!,,1310730888871903232
RelentlessFredm,2020-09-28T23:59:30.000Z,Stores won't change until the orders go away. Hills commissioners said they would rescind the mask orders when the cty got to 5% rate. We've been there for two months. Now they say they're going to keep the order anyway. Traitors.,,1310730888301473792
SupremeGOAT23,2020-09-28T23:59:30.000Z,It is illegal to not wear a mask in public. By technicality it’s not a law sure but it’s mandated.,,1310730888263725056
ellebee9208,2020-09-28T23:59:30.000Z,"No but I have lost a few in covid, anti-maskers, anti-vaxxers and shockingly, friends that think it’s a hoax.",,1310730887567474688
sinz54,2020-09-28T23:59:27.000Z,"A pandemic that has killed 200,000 Americans thus far and left tens of millions more too afraid to live normal lives is pretty ""chaotic.""",,1310730873994706945
travalogyworld,2020-09-28T23:59:27.000Z,#Travel - Will new quarantine rules scupper my Poland trip? -  ift.tt/3jc5HZ9 #Travalogy,https://x.com/hashtag/Travel?src=hashtag_click https://t.co/0hqd2lJiFA https://x.com/hashtag/Travalogy?src=hashtag_click,1310730873638191107
AlSosa57935569,2020-09-28T23:59:27.000Z,CNN: Beijing orders importers to avoid frozen food from countries with major coronavirus outbreaks. cnn.com/2020/09/28/asi …  via  @GoogleNews,https://t.co/nI6NQXGdq9 https://x.com/GoogleNews,1310730873583484928
Connorhenders0n,2020-09-28T23:59:26.000Z,Hope your keeping your mask on though,,1310730872467976192
Libreinfo,2020-09-28T23:59:26.000Z,CityWatch: New York state’s coronavirus infection rate highest since July  marketwatch.com/news/story.asp …,https://t.co/YoRfeOGjQO,1310730872287449095
Sid37748825,2020-09-28T23:59:26.000Z,When is it going to end ? Why will no one hold them to account ? Why is no one asking how they are allowing schools to remain open with kids getting ill and catching Covid.,,1310730870983208960
AASA_ED,2020-09-28T23:59:26.000Z,"It’s taken a Pandemic to place education above the fold (for those of you that remember what it was like to read a paper). Finally, recognition for the hard work and commitment that educators have for the children we serve.  @AASAHQ",https://x.com/AASAHQ,1310730870895116290
BillyKentUSA,2020-09-28T23:59:26.000Z,So be good little boys and girls. Stay in the house with your mask on and maybe just maybe the unhinged Cuomo will let you watch your silly little football game but then get back in the house and wait for his next self glossing briefing where he will tell you how great he is.,,1310730870693810176
BayBoyTank,2020-09-28T23:59:26.000Z,Only if you smell it thru your mask,,1310730870433738752
therundowntvo,2020-09-28T23:59:26.000Z,Live Now: COVID-19 Urban Flight,,1310730870311931905
irabajia,2020-09-28T23:59:25.000Z,How you could be wukkin in a major  hospital's emergency room ...and you just not wearing a mask.,,1310730866679853059
_bhickman,2020-09-28T23:59:25.000Z,Take off the $75 Billion for Covid testing and tracing.  Stop wasting hard earned taxpayer dollars.,,1310730866361069570
CharlieRoast,2020-09-28T23:59:25.000Z,rpeorters talking through a mask is bad video,,1310730866021163008
JarrodWhittaker,2020-09-28T23:59:24.000Z,Rural health lets medical student be a 'central part of person's health journey' #gippsnews   abc.net.au/news/2020-09-2 …,https://x.com/hashtag/gippsnews?src=hashtag_click https://t.co/AtGdAI8ntx,1310730863861100544
AussieDimsim,2020-09-28T23:59:24.000Z,"Lots of people cant afford a new iphone, so  fix the app - so anyone that wants to use it can.  Also, parents that can, are giving their old phones to kids in case of Covid @ school, would B GR8 if students could use the app on these old phones - sure wld help with <19 tracing!",,1310730863026421760
janeenfxx,2020-09-28T23:59:24.000Z,Nope I'll wait for the coronavirus vaccine and continue to wear my mask.   x.com/TravisAllen02/ …,https://x.com/TravisAllen02/status/1310721954207465473,1310730862212927488
himbofied,2020-09-28T23:59:23.000Z,Damn where's that money for ppl who lost their jobs during the pandemic,,1310730859390152704
diana_rader,2020-09-28T23:59:22.000Z,"Hustling Fully stock mechandice TRUMP souvineers while the rest of the USA is in lock down for COVID 19, ETC. REALLY TRUMP?",,1310730855342579712
Ahurley2Hurley,2020-09-28T23:59:22.000Z,"Biden is going to be quarantined. Anyone want to bet. He was with Gov. Northampton a couple of days ago, and he had COVID. Ha Ha Ha. How planned is this.",,1310730852930916352
trainer1995,2020-09-28T23:59:22.000Z,"@PBATour  Why are all the bowlers who are waiting their turn to bowl not covering their noses with the mask? Correct way to wear a mask is over the nose and mouth. I am glad bowling is back in TV, dont wanna see folks have to quarantine. (Gerard, Prather)",https://x.com/PBATour,1310730852603756544
KOLDNews,2020-09-28T23:59:22.000Z,"UArizona sees improvement in COVID-19 numbers, compliance  kold.com/2020/09/28/uar …",https://t.co/imm59ZUiEu,1310730852247261185
yooniesius,2020-09-28T23:59:21.000Z,BTS LOCKDOWN,,1310730851244670978
lotacharlie,2020-09-28T23:59:21.000Z,"If I'm swimming and I hold my breath for half an hour, do I have to wear a mask.",,1310730850871386112
Newsdailyng1,2020-09-28T23:59:21.000Z,"COVID-19 fund: Account to Ondo people, not NGO ― PDP replies Akeredolu   newsdaily.com.ng/covid-19-fund- …",https://t.co/Gi0bjhSwKR,1310730850531774464
MandahLee_Blue,2020-09-28T23:59:21.000Z,"I have cute Friday hair, but it’s Monday. And you know, a pandemic. V. Frustrating.",,1310730848984014848
HASIT66280270,2020-09-28T23:59:21.000Z,"English lads in Florence, and others, still trapped in quarantine due to false positive testing each week. Officials say they could be there up to 12 months. One lucky to be released after 3 months. PCR tests undeniably unreliable. Ronan, it’s over.  m.youtube.com/watch?v=FrfK74 …",https://t.co/IyLycpJ8Qj,1310730848577167360
endlessnoodling,2020-09-28T23:59:20.000Z,Good read...  One million and counting - The covid-19 pandemic is worse than official figures show | Briefing | The Economist  economist.com/briefing/2020/ …,https://t.co/UQU2D5pL00,1310730845221650432
louiskid502,2020-09-28T23:59:20.000Z,Covid isn't helping but JEEESUUUSSS CHRISSST,,1310730845045567488
stacy_redvirgo,2020-09-28T23:59:20.000Z,The only people that I know that have gotten Covid are Avid mask wearers. Aka liberals.,,1310730844554891264
MeganTrieu,2020-09-28T23:59:20.000Z,I talked to someone today that told me that covid-19 is a hoax... Boiii if you don't get out of my face and please stay 6 feet from me,,1310730844022214656
mogeladze1,2020-09-28T23:59:19.000Z,Effort to change coronavirus rules begins taking shape as Legislature begins session  theadvocate.com/baton_rouge/ne … via  @nolanews,https://t.co/IKvf7ewZMJ https://x.com/nolanews,1310730843644665856
greenedamage,2020-09-28T23:59:19.000Z,Gruden’s rocking that mask,,1310730840767229953
JudyRiuliani1,2020-09-28T23:59:19.000Z,Laura Ingraham told more lies about Covid than Tucker Carlson!,,1310730840675098625
naomi90920556,2020-09-28T23:59:18.000Z,"Wait, wut for? Aren't kids ""virtually immune"", from covid and i thought it effected ""almost no-one"".",,1310730839513210880
DGladden,2020-09-28T23:59:18.000Z,"He sure tried to steal 3 trillion dollars for his wall.  What did he do about Flint?  Hell, what did he do about Puerto Rico.  California is on fire right now. Pandemic is worse everyday.  He takes no responsibility, in his words.",,1310730836849897472
cbsnewspath,2020-09-28T23:59:18.000Z,MAYORS SOTS MON0277 PKG Flint MI Mayor Neely on Decrease in Violent Crime MON0260 SOT Houston Mayor Turner on Coronavirus Cases Update MON0271 SOT Chicago Mayor Lightfoot on Easing Some Restrictions MON0145 SOT NYC Mayor de Blasio Consumer Protection Bills,,1310730836690468866
Nickmaul19,2020-09-28T23:59:18.000Z,"Tested positive for COVID, so I’m quarantined with my son and wife in the quarantine house on the reservation. Ahman Green’s old house. So as a Packer fan, I am extremely moist at the moment!!! #GoPackGo",https://x.com/hashtag/GoPackGo?src=hashtag_click,1310730835956555776
_PhilsGood_,2020-09-28T23:59:16.000Z,Why are people still questioning if covid real?,,1310730830147354624
HIP_Energy,2020-09-28T23:59:16.000Z,If you feel that another rant from Jon Snow needs bringing up again you need medical help despite covid 19.,,1310730829837017091
effortlesslynat,2020-09-28T23:59:16.000Z,do a virtual or social distancing tour pls we need it,,1310730829467987968
S0LUSZOSGALVUS,2020-09-28T23:59:16.000Z,"I mean, “who would it be if it wasn’t Tobias the person behind the mask?” Make that question until your mind turns on and finds out deep into imagination and creativity to give you an answer.",,1310730828834578434
S0LUSZOSGALVUS,2020-09-28T23:59:16.000Z,"First of all, by “UNMASKED” I don’t mean Tobias, I don’t mean the man behind the mask, neither the people behind the ghouls.   This is your own idea, your own picture of “who’s behind the mask?”",,1310730827869937669
mattindctweets,2020-09-28T23:59:15.000Z,CDC director’s view of Trump’s closest #coronavirus adviser: “Everything he says is false.”  theguardian.com/us-news/2020/s …,https://x.com/hashtag/coronavirus?src=hashtag_click https://t.co/6lVH15ug7s,1310730824787070978
Steve_Sailer,2020-09-28T23:59:14.000Z,"COVID took a tragic toll on transportation workers in NYC. At least since Jackie Gleason's ""The Honeymooners,"" the stereotype has been that NY bus drivers are fat. But, they are working and seldom on death's door.  I think Cuomo said 1/6th of NY fatalities were employed.",,1310730822605889537
speakerleakers1,2020-09-28T23:59:14.000Z,Coronavirus treatment has near-perfect success rate: Study  newsbreakapp.com/n/0X7ws6qP?pd= …,https://t.co/DxMl78bfz9,1310730822081818625
kynek99,2020-09-28T23:59:14.000Z,What's the problem since you already have a mask? You're covered.,,1310730821175857152
noyoudin,2020-09-28T23:59:14.000Z,"Abbott BinaxNOW appears to test for influenza A and B, not COVID.  What’s the story? Why ship 100 million “flu” tests? @MaddowBlog  @realDonaldTrump  @GOP  @WhiteHouseHstry",https://x.com/MaddowBlog https://x.com/realDonaldTrump https://x.com/GOP https://x.com/WhiteHouseHstry,1310730820915781633
Coleener,2020-09-28T23:59:14.000Z,But it’s still okay if Trump holds huge indoor campaign rallies with no social distancing or face masks because he doesn’t give a  about us.,,1310730820328583170
FreedomBren,2020-09-28T23:59:14.000Z,"Did anyone in state legislative branch wrote a mask bill, passed it, and did you sign it? No so it's not the law",,1310730819514904577
axiostopstories,2020-09-28T23:59:14.000Z,House Democrats unveil new $2.2 trillion coronavirus relief proposal  Speaker Nancy Pelosi (D-Calif.) on Monday unveiled House Democrats' new $2.2 trillion coronavirus relief proposal.  Why it matters: Negotiations with the Trump administration have stal…  ift.tt/3jgY3wA,https://t.co/tUmJZCX8fc,1310730818751528962
cpomroy63,2020-09-28T23:59:14.000Z,Research Shows Deliberate Chinese Propaganda Campaign Forced World Into Lockdown -  summit.news/2020/09/28/res …,https://t.co/NU0gDNak5p,1310730818743083008
29_Jewels,2020-09-28T23:59:14.000Z,Sorry to hear that. What are Covid toes??,,1310730818583752708
ChrisSm67311592,2020-09-28T23:59:13.000Z,"Just what we need 150 million less accurate COVID test, way to go numb nuts that's just how you get on top of a pandemic by giving less accurate test what's next free headstones?",,1310730816432017408
l_uriza,2020-09-28T23:59:13.000Z,"we just lost a family member due to COVID , this was so sudden if you guys can please donate to help with the expenses and to help his wife and two kids we would really appreciate it anything helps guys   gf.me/u/y2x45w",https://t.co/qSPfnbWV6U,1310730815123238912
DonnaAmato9,2020-09-28T23:59:12.000Z,May as well call it mask to mask e-learning,,1310730811189194757
timesculture,2020-09-28T23:59:11.000Z,"These people — the not all of them, but a segment — have the psychology of the anti-abortion movement. I don’t want to let some crazy person kill me.”  @deerbrian , the journalist who exposed Andrew Wakefield's anti-vax fraud, speaks to  @DeccaJourno  thetimes.co.uk/article/andrew …",https://x.com/deerbrian https://x.com/DeccaJourno https://t.co/4JPEDHGZuc,1310730808077029380
lanier_katiesue,2020-09-28T23:59:11.000Z,#flipclasschat in just a couple minutes. 7pm central time. Hope you'll join the conversation about assessment in the remote learning world. #flipclass,https://x.com/hashtag/flipclasschat?src=hashtag_click https://x.com/hashtag/flipclass?src=hashtag_click,1310730808060268544
Hopkins_UTES,2020-09-28T23:59:11.000Z,Do you know who’s really under the mask? Our first art project were these self portraits. Under our masks are words that describe who we are as a person. There are still a few more who have to finish.,,1310730807594622979
McgrortyThomas,2020-09-28T23:59:11.000Z,"Starting  to  unravel 100 Tory  mp,s tried to raise an amendment  to end the  covid  lockdown,and  were  turned  down  by the  speaker now the  chancellor is positioning  himself ready to make  a statement  soon I would  guess most of the Tories arent in the loop just  the  CABAL",,1310730807229775879
DrNeilHammer,2020-09-28T23:59:11.000Z,#COVID19 : Single-use #plastic impact of #pandemic “will last forever”  bbc.co.uk/news/uk-wales- …,https://x.com/hashtag/COVID19?src=hashtag_click https://x.com/hashtag/plastic?src=hashtag_click https://x.com/hashtag/pandemic?src=hashtag_click https://t.co/Ag4kXURfpp,1310730806491521024
CodyBodacious,2020-09-28T23:59:10.000Z,What makes you look dumber boot cut jeans or wearing your mask below your nose,,1310730805774180352
WillaSquire,2020-09-28T23:59:10.000Z,"This is exactly why he demands testing, tracking and tracing 24/7. He wants every asymptomatic positive he can find to justify his lust for... LOCKDOWNS !",,1310730804167929856
DantonSix,2020-09-28T23:59:10.000Z,"I imagine you're jogging right now, full plates, gas mask, typing as you run and cursing under your breath. ""Yeah! Fuck sandwiches!""   knocking over old ladies because you're not looking where you're going",,1310730803140333570
STForeignDesk,2020-09-28T23:59:10.000Z,Warning signs are flashing ahead of Covid's second US winter  straitstimes.com/world/united-s …,https://t.co/LLjTAMCiLa,1310730802670587904
Shadowarrior315,2020-09-28T23:59:10.000Z,"Wondering how many respiratory therapists “received” the virus during the crazy days of high hospitalizations?  You know the people  who handled the ventilators, especially when the vents’ hoses “ backfired” and spewed the “pandemic” germs all over?",,1310730802532102149
JudithWood5,2020-09-28T23:59:09.000Z,Don’t even compare the two.  Trump underplayed Covid from day one. Saying it’s just like the flu. It will just go away. He never embraced masks or social distancing.  COVID-19 attacks your whole system. Does serious damage that does not just go away.,,1310730800342675459
Marcus1967,2020-09-28T23:59:09.000Z,Yeah we can't shoot them so at least we can make them wear a mask.,,1310730800095268865
officialdprlive,2020-09-28T23:59:09.000Z,ayo wait...if I see him with the mask on..it’s over for me ami  x.com/heIIboyjoon/st …,https://x.com/heIIboyjoon/status/1310701794440425473,1310730800036536320
IgorZepol,2020-09-28T23:59:09.000Z,"#NYT Health: ""Trump Announces Plan to Ship 150 Million Rapid Coronavirus Tests"" by BY KATHERINE J. WU  ift.tt/2FZ2uOo",https://x.com/hashtag/NYT?src=hashtag_click https://t.co/S7O2jgiSw5,1310730799747129346
NodleNetwork,2020-09-28T23:59:09.000Z,Frost & Sullivan Reveals 9 Global Trends Generating Growth Opportunities from COVID-19  iotbusinessnews.com/2020/09/28/002 …  #IoT #network #decentralizaion,https://t.co/LWbskp83jj https://x.com/hashtag/IoT?src=hashtag_click https://x.com/hashtag/network?src=hashtag_click https://x.com/hashtag/decentralizaion?src=hashtag_click,1310730799235424256
LiddleSavages,2020-09-28T23:59:09.000Z,"I think he did it because in his mind it made him look bad. And would go against him in the election, in being re-elected. Also he didn’t have the sense to handle this coronavirus,this pandemic. So he lied about everything, made up stuff. And he’s still making stuff up and lying.",,1310730798123954177
MarnieRose2,2020-09-28T23:59:09.000Z,Coronavirus updates: Trump plan to send out 150M rapid tests deemed 'inadequate'; global death toll nears 1M; New York sees rise in cases  usatoday.com/story/news/hea …,https://t.co/KJz5sZ39oZ,1310730797771567104
RS30002,2020-09-28T23:59:08.000Z,"Cropland could perhaps be reduced with generous application of urban farms, therefore giving back some carbon absorbtion. Maybe covid and the need to have a food source in proximity will accelerate this.",,1310730796597235713
IgorZepol,2020-09-28T23:59:08.000Z,"#NYT Health: ""The Coronavirus Mostly Spares Younger Children. Teens Aren’t So Lucky."" by BY APOORVA MANDAVILLI  ift.tt/3jfkIt9",https://x.com/hashtag/NYT?src=hashtag_click https://t.co/2KcDoW04SL,1310730795208912898
1gigawatt,2020-09-28T23:59:08.000Z,Blame the CDC (covid deflection center),,1310730794751549442
JudithPurcell11,2020-09-28T23:59:08.000Z,"""Herd immunity"" is a pipe dream - too risky.  Nobody should intentionally infect themselves or others.    ‘It’s Not in My Head’: They Survived the Coronavirus, but They Never Got Well  nyti.ms/343iYwI",https://t.co/XIm2dmPN1i,1310730793564737539
_rwinstonsworld,2020-09-28T23:59:08.000Z,Now all I can think about is what mask I’d wear on zoom,,1310730793455693832
AAlbinati,2020-09-28T23:59:08.000Z,"Holy crap. It is about time that this happened. BS out of any level of Govt should not be tolerated - privacy  simple to use  responsible approach  - In reversal, Quebec moves to adopt federal COVID-19 exposure-notification app - The Logic  thelogic.co/news/in-revers …",https://t.co/vl4ABk2Ii4,1310730793401098241
AguluNwoke,2020-09-28T23:59:07.000Z,YOUR PENSION TODAY: COVID-19: Are you worried about your pensions?  telegramnewsnigeria.com/your-pension-t …,https://t.co/AvhVKbBdYK,1310730792595845121
dannynunin,2020-09-28T23:59:07.000Z,Never wear a mask,,1310730792138661888
kennekat,2020-09-28T23:59:07.000Z,"Someday, when Broadway resumes performances, I am going to see Mean Girls the Musical. And Hamilton live. The Disney + release of the film is the only thing that has gotten me thru this pandemic.",,1310730790523682817
jchrist57239072,2020-09-28T23:59:06.000Z,@JuliaHB1   this is a possible reason for long Covid and treatment,https://x.com/JuliaHB1,1310730786153299968
RandallKanna,2020-09-28T23:59:06.000Z,Nice! I like the idea of a how to on networking in the age of covid!,,1310730786107088896
TucsonStar,2020-09-28T23:59:06.000Z,"Ex-Cat will meet with NBA teams in coming weeks, as pandemic has altered the usual pre-draft routine.  tucson.com/sports/arizona …",https://t.co/lOU1K6j5JL,1310730785641705472
ninachristian,2020-09-28T23:59:05.000Z,"If you're marketing to any businesses in Victoria right now (or any location where Covid-19 is impacting operations and the way we live),   keep in mind that businesses are thinking and operating differently right now.",,1310730783741620225
MDougy7,2020-09-28T23:59:05.000Z,This is not a conspiracy. Admitted a polio type 2 vaccine is killing and paralysing people in poor countries after being used as guinea pigs.  zerohedge.com/markets/un-for …,https://t.co/BIbYDh92Rr,1310730783674392576
clevelanddotcom,2020-09-28T23:59:05.000Z,Residents who wish to hand out candy are encouraged to turn on their porch lights.  trib.al/vM1oVSt,https://t.co/AtbxASutBI,1310730783016062977
israelstag,2020-09-28T23:59:04.000Z,"""Coronavirus Briefing: What Happened Today"" by Lara Takenaga and Jonathan Wolfe via NYT  nytimes.com/2020/09/28/us/ …",https://t.co/H9v7njIZrG,1310730779484459009
jbklutsemedia,2020-09-28T23:59:04.000Z,3 top ways of dealing with COVID-19 grief  jbklutse.com/dealing-with-c …,https://t.co/ja03PWyt4z,1310730778666561536
brontyman,2020-09-28T23:59:04.000Z,"206,100 Americans dead in the pandemic. Remember and honor the dead and let us build a nation that cares for her citizens, and that stands for justice for all. Let an America that lives up to her promise be a legacy to those lost.",,1310730777315823616
cadamsKXAN,2020-09-28T23:59:03.000Z,11 new COVID-19 deaths were reported today in Texas.  The 7-day average is now 88 deaths per day (lowest since July 14). @KXAN_News,https://x.com/KXAN_News,1310730772630953985
BoxingAntics,2020-09-28T23:59:01.000Z,"I wear a mask so I won’t be fined or thrown in jail. The fact I have to do that is telling, but also if you were presented with having to take a vaccine to be able to work/do anything would you? That’s the ultimate question. Wearing a mask is one thing. Getting injected another",,1310730765928337408
KevinStott11,2020-09-28T23:59:01.000Z,"United States COVID-19 Deaths: 205,267 Romania COVID-19 Deaths: 279",,1310730764925898752
SriLankanBuzz,2020-09-28T23:59:00.000Z,Bangladesh tour of Sri Lanka postponed again as disagreement over quarantine continues #SriLankanBuzz #SriLanka  es.pn/2HuXaT1,https://x.com/hashtag/SriLankanBuzz?src=hashtag_click https://x.com/hashtag/SriLanka?src=hashtag_click https://t.co/bydCvIqg91,1310730764015644672
airy3rdeye,2020-09-28T23:59:00.000Z,they know damn well they aint social distancing on the buses lmao it be overcrowded they do kick ppl off sometimes tho smh,,1310730763994894337
RednecRenegade,2020-09-28T23:59:00.000Z,I’m sure China’s vaccine is no more dangerous than Trump’s suggestion that we ingest BLEACH!!!,,1310730763839647751
wrestlerun,2020-09-28T23:59:00.000Z,I think people choose to smoke pot. Not get Covid. Also 95%.  Stay in your lane. You are out of your league here,,1310730762413584384
ArnoMichelin,2020-09-28T23:59:00.000Z,Finnair partners with Terveystalo to offer coronavirus testing for travellers #avgeek #FeelFinnair  lnkd.in/gf7rkrg,https://x.com/hashtag/avgeek?src=hashtag_click https://x.com/hashtag/FeelFinnair?src=hashtag_click https://t.co/Wfw7t2ITAK,1310730761331380224
SantinoBros,2020-09-28T23:59:00.000Z,Santino Bros. Wrestling 3-Layer Cotton Mask $7.95 each!  santinobros.net/wp/product/san …,https://t.co/5ruZlfBHAp,1310730760970809344
CommsTeej,2020-09-28T23:58:57.000Z,"“The newly proposed COVID-19 emergency legislation, The Heroes Act, includes $32 billion of emergency #publictransit funding and is a lifeline for our industry.""  apta.com/news-publicati …",https://x.com/hashtag/publictransit?src=hashtag_click https://t.co/pzy1N15Xdm,1310730751126667270
