User_name,Datetime,Content,Links,Tweet_ID
Happyli80729814,2020-07-22T23:57:39.000Z,Dr. Luc Montagnier reveals how Covid-19 is a lab accident. He was awarded the 2008 Nobel Prize in Medicine for the identification of AIDS.He currently works at University in China. The characteristics of the new coronavirus could not have arisen naturally lifewithnofears.blogspot.com/2020/04/dr-luc …,https://t.co/LmSueV78bK,1286088047625371650
Hope4YrMarriage,2020-07-22T23:57:39.000Z,"Online learning is increasingly popular nowadays, and this trend is here to stay.  infl.tv/ibwm",https://t.co/f9cO8L6G0X,1286088046849527808
rq0014,2020-07-22T23:57:39.000Z,Co-trimoxazole for the treatment of severe COVID-19. dx.doi.org/10.2139/ssrn.3 …,https://t.co/yKqNfuaFbY,1286088045918400513
TheSingHopeful,2020-07-22T23:57:39.000Z,fracturing the Repub party & U have Repubs making commercials voting 4 Biden ( google.com/amp/s/www.inde …) many Dems (myself included Rn't happy with Biden). I think there are closer to 4 or 5 political parties  than 2.,https://t.co/iExcgVWEgW,1286088045737865216
TOIPune,2020-07-22T23:57:38.000Z,"Over 36k Covid patients discharged in city, recovery rate 64%  toi.in/8IXqXa8",https://t.co/k5uJv7QDzJ,1286088045016621058
ShelaBlasingim,2020-07-22T23:57:38.000Z,"I knew you would say that, it's definitely not. This is how Hydroxychloroquine works against malaria. How does it work against Covid-45?  lupus.org/resources/why- …",https://t.co/3r9Ld9KDmn,1286088042726514689
MystickWarrior,2020-07-22T23:57:38.000Z,"Hey tribe, AZ Peeps...and virtual peeps everywhere   SAVE THE DATE: 10/10/20 Join my team!  ***This is a virtual event due to COVID-19***  The AZ 2020 Walk to End Lupus with the 'LFA' is upcoming & I'd love for you…  instagram.com/p/CCZX2zJjVip/ …",https://t.co/57dCcNBFmy,1286088041874980865
lynsdy13,2020-07-22T23:57:38.000Z,"Covid death is real, but so is suicide!!",,1286088041107525634
Wolfen733,2020-07-22T23:57:37.000Z,I would feel safe attending games WITHOUT a mask and everyone else without masks.,,1286088040860004357
eringannon,2020-07-22T23:57:37.000Z,"Yes, Dave. YES!  Dave Grohl: Teachers Deserve a Better Plan - The Atlantic  theatlantic.com/culture/archiv …",https://t.co/tLEJtJHMsS,1286088040549617665
KATHLEENFITZG10,2020-07-22T23:57:37.000Z,SUCK IT UP KAREN USE A MASK OR STAY HOME,,1286088040545505280
cwlogan3,2020-07-22T23:57:37.000Z,Yea cause a mask will make it all go away ! How about we vote you away instead !,,1286088040176222209
rm_rm_rm_rm_rm,2020-07-22T23:57:37.000Z,Dingy flat playing doof-doof at 10am to the left of me Guy with woodchipper doing his yard to the right Here I am  Stuck working unproductively from home during a global pandemic,,1286088039047954432
heynowKentucky,2020-07-22T23:57:37.000Z,Fart in her face. She’ll put a mask on   x.com/DaveVescio/sta …,https://x.com/DaveVescio/status/1286071181179641857,1286088038788063232
Sanchie65450523,2020-07-22T23:57:37.000Z,Give her a mask and a private cell.,,1286088038565765121
MrGrumble,2020-07-22T23:57:36.000Z,"She was ‘asked’ about it by the reporter. She then replied: “But that’s not my focus right now. My focus is tackling coronavirus, making sure we are tackling the health implications of the virus by suppressing it and stopping it running out of control again.” #boom",https://x.com/hashtag/boom?src=hashtag_click,1286088036250525696
KiranSreepada,2020-07-22T23:57:36.000Z,"⁦ @GovBillLee ⁩ When THIS White House says you haven’t done enough to fight COVID, you know you really messed up. ⁦ @RepMarkGreen ⁩ still think the Pres is handling this crisis well? #Election2020 #COVID19   tennessean.com/story/news/pol …",https://x.com/GovBillLee https://x.com/RepMarkGreen https://x.com/hashtag/Election2020?src=hashtag_click https://x.com/hashtag/COVID19?src=hashtag_click https://t.co/vCvjBArNpH,1286088034874732550
DolphinMg,2020-07-22T23:57:36.000Z,Please #MaskUp ! This pandemic is NOT a joke! It’s deadly and has killed millions of people! We want to get back to normal soon too please.,https://x.com/hashtag/MaskUp?src=hashtag_click,1286088034593787914
TheWreckingBal5,2020-07-22T23:57:36.000Z,"Peep this LoL   Biden and Obama team up to take aim at Trump's coronavirus response  youtu.be/LVILQfZQD6w via  @YouTube The look on the reporters face “ I sure hope they buy into this narrative, probably not gonna work though “   LoL #MAGA2020",https://t.co/LTXAJpWDsL https://x.com/YouTube https://x.com/hashtag/MAGA2020?src=hashtag_click,1286088033490440194
jiminstruct54,2020-07-22T23:57:36.000Z,"Kidneys, Brain, Skin: New Study Highlights the Whole-Body Damage Caused by Covid-19  gizmodo.com.au/2020/07/kidney … @ Hammond, Indiana  instagram.com/p/CC9q-_Vj1ur/ …",https://t.co/aCoF4A2rZh https://t.co/bY7DdXQn7k,1286088033259986945
gabriellerazo_O,2020-07-22T23:57:36.000Z,Imagine explaining the term “anti-mask” to your December self,,1286088033004126209
allykat150,2020-07-22T23:57:36.000Z,SAME I have enough flight miles for a round trip to some places and my wanderlust is ITCHIN but pandemic,,1286088032790163462
M3EEKS,2020-07-22T23:57:35.000Z,Flu vaccine most likely,,1286088032488128512
edwin_de_jongh,2020-07-22T23:57:35.000Z,Got my private pilot license today! Took a while (thanks Covid) but so happy and excited to keep on flying and learning! Curls came out HARD from the nervous sweats.,,1286088031368130560
michelaellis,2020-07-22T23:57:35.000Z,I’ve become so obsessed with Top Gear and Grand Tour that I now want to plan a post-COVID trip to meet them and drive a lap. Who am i,,1286088031204777984
hhwong,2020-07-22T23:57:35.000Z,Flu season might not be so bad even without a COVID-19 vaccine….  wsj.com/articles/covid …,https://t.co/kQlO8Q1Mi8,1286088031011606528
melifonos,2020-07-22T23:57:35.000Z,"remember in march when a bunch of news outlets, utilities, internet and telephone companies, etc. pledged to keep their services available to everyone, regardless of ability to pay, ""for the duration of the covid-19 pandemic""? lmao",,1286088030130966528
brchapman65,2020-07-22T23:57:35.000Z,"Exactly what else was  @POTUS  supposed to do about #coronavirus ? Early on, he took steps to close the border, restricted travel to the USA from infected countries, put a task force together to formulate a plan to fight the virus, etc ..,",https://x.com/POTUS https://x.com/hashtag/coronavirus?src=hashtag_click,1286088029950676994
lordssyndicate,2020-07-22T23:57:35.000Z,Forbes: New Research Suggests Terpenes And CBD Work 2X’s Better For Covid-19 Inflammation Than Corticosteroid. forbes.com/sites/emilyear …  via  @GoogleNews,https://t.co/cREOfp76IF https://x.com/GoogleNews,1286088029828874240
carman17838926,2020-07-22T23:57:35.000Z,Sad that he wont help the unemployed in Wisconsin! SEN. Ron Johnson net worth only $78 MILLION! He cares not about the unemployed living on that $600 pandemic unemployment benefit! Ron Johnson- Net Worth - Personal Finances,,1286088029761941504
AnaKosakowski,2020-07-22T23:57:35.000Z,Here you have it. beforeitsnews.com/prophecy/2020/ …,https://t.co/ird6xDqhy1,1286088029732405248
TdotHogan88,2020-07-22T23:57:35.000Z,Went to the dr and jumped on the scale like  no more quarantine snacks,,1286088029422133248
labeling66,2020-07-22T23:57:34.000Z,"Neither does a surgical mask, same with N95 masks.  CCP Virus is 0.3 microns, which is smaller than an N95 can filter.  0.3 microns = 0.0003mm  The masks folks are wearing are a useless placebo.",,1286088027895472129
SmockyTubers,2020-07-22T23:57:34.000Z,This fucking clown  thehill.com/homenews/state …,https://t.co/mtlro5NoIw,1286088027274711040
1211Melody,2020-07-22T23:57:34.000Z,"Every time I go out myself and 90% of other people had one on. Why is it so important now and you literally never changed anything that most people weren’t doing already, that stores were not doing already enforcing mask wearing? (Free Market).",,1286088026662346754
britlovesmusic,2020-07-22T23:57:34.000Z,One of these men was tested for COVID-19 (Spoiler alert: he tested positive!) and continued going to work and interacting with people while waiting for his test results to come back. And it wasn't Andrew Cuomo.   Rand Paul has no right to lecture anyone about coronavirus.,,1286088026637000704
hillarygriffith,2020-07-22T23:57:34.000Z,PLEASE SHARE. Wherever you are in the world support this. Do you need an affordable mask? Also waant also to see change in the US and the world? Support this campaign. Help communities that need to get out to vote.  kck.st/2CBmvbW  #Kickstarter #KICKSTARTERcampaign #Vote,https://t.co/9qVLCw7tO2 https://x.com/hashtag/Kickstarter?src=hashtag_click https://x.com/hashtag/KICKSTARTERcampaign?src=hashtag_click https://x.com/hashtag/Vote?src=hashtag_click,1286088025257029632
LGMandelaBarnes,2020-07-22T23:57:33.000Z,"Tomorrow at 10am CT,  @IALtGov  Gregg and I will join the  @Hunt_Institute ’s Governing Principals webinar series to discuss a topic on a lot of our minds: navigating a new school year during the #COVID19 pandemic. Join us by registering here:  bit.ly/2VUFSTO",https://x.com/IALtGov https://x.com/Hunt_Institute https://x.com/hashtag/COVID19?src=hashtag_click https://t.co/Xkp3Nda7QN,1286088023319498754
jazziey0,2020-07-22T23:57:33.000Z,This is how I’m trynna be at the club when corona virus is over so plz wear a mask I’m begging you  x.com/petitetaint/st …,https://x.com/petitetaint/status/1284003604169322496,1286088023080185856
TBren2725,2020-07-22T23:57:33.000Z,SIGN  @MOMSRISING 'S LETTER to your Senator urging them to #savechildcare and extend and expand #paidleaveforall response to the coronavirus pandemic. #COVID19 pandemic. #coronavirus  action.momsrising.org/sign/COVID19_P …,https://x.com/MOMSRISING https://x.com/hashtag/savechildcare?src=hashtag_click https://x.com/hashtag/paidleaveforall?src=hashtag_click https://x.com/hashtag/COVID19?src=hashtag_click https://x.com/hashtag/coronavirus?src=hashtag_click https://t.co/K92WGKjecp,1286088022757343234
ga_lyricbot,2020-07-22T23:57:33.000Z,"i'm gonna go back to a face, no more mask",,1286088021536673792
Angel_City_Buzz,2020-07-22T23:57:33.000Z,Coronavirus surge linked to restaurants in Mammoth Lakes lands county on state watchlist  dlvr.it/Rc9bzG #california #latimes,https://t.co/IEwQpfZeaB https://x.com/hashtag/california?src=hashtag_click https://x.com/hashtag/latimes?src=hashtag_click,1286088021041848320
STPFreak,2020-07-22T23:57:33.000Z,"Unless Charlie is demanding Trump's resignation...what is the point?   Trump's SS best stay the F*CK out of Boston.   Gov. Baker, Vice President Pence to meet on Nantucket this weekend to discuss COVID-19 response  wcvb.com/article/gov-ba …",https://t.co/IfMJQBL3rX,1286088020312182789
dwcp2,2020-07-22T23:57:33.000Z,"@realDonaldTrump  is trying to make COVID go from deadly to tolerable.  If he can make COVID go from deadly to tolerable, what word would you best describe next for COVID better then tolerable?  That’s how he’s winning, you flip the script using their own agenda against them!",https://x.com/realDonaldTrump,1286088020140208128
siamesescalante,2020-07-22T23:57:32.000Z,Princess mononoke mask tattoo today  thanks to the people who trust me their skin.,,1286088019611541504
671leggette,2020-07-22T23:57:32.000Z,I not going no football game wit mask on,,1286088018131136516
MichaelGGG333,2020-07-22T23:57:32.000Z,"Hey an n95 should absolutely be able to stop sheetrock as far as I’m aware. Can you send me a link?  That aside, n95 masks just like cloth masks will block many of the water droplets and other materials that can have the virus in them",,1286088018059649024
Jay_Nice_305,2020-07-22T23:57:32.000Z,"Don't be surprised if Fort Detrick is in fact producing designer diseases for the pharmaceutical/vaccine companies to profit from and to cull the herd of ""useless eaters"".",,1286088017690742784
fuwaffy,2020-07-22T23:57:32.000Z,"You do not see this in cultures where public health is prioritized and everyone knows they are taking care of each other by being cautious and wearing a mask, but here people do have this bloated sense of entitlement under some pretense of “freedom”. it’s disgusting.",,1286088017363365890
DCohenNEWS,2020-07-22T23:57:32.000Z,"""Krome is a COVID dish. It’s a petri dish for COVID infections."" -- immigration attorney Kenny Panzer  Latest  @ICEgov  data shows 94 Krome detainees have tested positive for COVID-19 since February >> 3,736 cases -- and 3 deaths -- nationwide >>  ice.gov/coronavirus",https://x.com/ICEgov https://t.co/zj9Cj4mUte,1286088017103511553
tenkatreats,2020-07-22T23:57:32.000Z,I won't go into why Africa is the only continent to be decimated by the HIV pandemic or why its in a perpetual state of starvation. That's a whisky conversation.... We need new people running things,,1286088016553967617
ForBocaRaton,2020-07-22T23:57:32.000Z,"WASHINGTON (AP) — Laboratories across the U.S. are buckling under a surge of coronavirus tests, creating long processing delays that experts say are actually undercutting...  #4boca #News  4boca.com/nralink/world- …",https://x.com/hashtag/4boca?src=hashtag_click https://x.com/hashtag/News?src=hashtag_click https://t.co/1XGoPrcQdN,1286088016428249091
gfberner,2020-07-22T23:57:31.000Z,"Interesting, that after six months of struggling with a pandemic, Trump finally decides to ""develop a strategy"". But then we all know, Trump's strategy is his ""gut feeling"". And we also know that always ended badly, each and every time.",,1286088014788096000
__ancaa,2020-07-22T23:57:31.000Z,"Idgaf who feel some type of way about it , FUCK THESE MASK BRO!!!!!",,1286088012879867904
AWickystix,2020-07-22T23:57:31.000Z,It’s just raw data. It does show that Obama reduced it in his second term once economy was stabilizing. It also shows it was increasing under Bush ore crash and housing crisis. Also shows Trump has and is increasing it. That’s pre COVID as well. It would be off the charts now.,,1286088012149985285
RoyHull1,2020-07-22T23:57:30.000Z,Yale epidemiologist says hydroxychloroquine could save up to 100K lives if used for coronavirus  washex.am/3jqHv5X,https://t.co/qdrPqHzPur,1286088011537686532
PaulaKirejevas,2020-07-22T23:57:30.000Z,The president gets tested for COVID-19 every day with a result in minutes and is of no danger to anyone when he’s negative. Welcome back to New Jersey  @realDonaldTrump   #maga #womenfortrump #walkaway #njfortrump #turnnjRED #trump2020 #kag,https://x.com/realDonaldTrump https://x.com/hashtag/maga?src=hashtag_click https://x.com/hashtag/womenfortrump?src=hashtag_click https://x.com/hashtag/walkaway?src=hashtag_click https://x.com/hashtag/njfortrump?src=hashtag_click https://x.com/hashtag/turnnjRED?src=hashtag_click https://x.com/hashtag/trump2020?src=hashtag_click https://x.com/hashtag/kag?src=hashtag_click,1286088010887503872
MarkBatin,2020-07-22T23:57:30.000Z,"The radical left is trying to make the pandemic, Trump's Benghazi moment!!! When truthfully, Trumps early action most likely saved thousands!",,1286088008559669249
PopescuCo,2020-07-22T23:57:30.000Z,Italy approves new deficit hike to help coronavirus-hit economy  reut.rs/2CGRnrB via  @Reuters,https://t.co/Wv1RKtVDwp https://x.com/Reuters,1286088007884386304
JMZ75,2020-07-22T23:57:30.000Z,I said nothing about pay etc. I'm in the thick of this pandemic professionally and applaud ALL of the large facilities in their efforts. @LATiffani1 I completely understand and would be concerned as well.,,1286088007859212288
Higgo74,2020-07-22T23:57:29.000Z,23/07/2020 The day Melbourne social media was swamped with face mask pics.  #MaskUpMelbourne,https://x.com/hashtag/MaskUpMelbourne?src=hashtag_click,1286088004944056321
sheamlee,2020-07-22T23:57:29.000Z,Covid has taken over Texas cities.. what are you doing for your state?,,1286088004453498880
nelore1,2020-07-22T23:57:29.000Z,The Pro Covid crowd of patriots,,1286088004436721664
_KarenGranados_,2020-07-22T23:57:29.000Z,"Republicans love claiming that America is the land of the free just to get away with bogus shit like refusing to wear mask. BUT the minute there is peaceful protests for REAL MEANINGFUL change, charges are placed.",,1286088004172427265
chicoma3stro,2020-07-22T23:57:29.000Z,@Dior  make face mask please n thank you.,https://x.com/Dior,1286088003966980103
carigo68,2020-07-22T23:57:29.000Z,"Here it is a guy that is totally out of reality, that is getting our money of the people that is working hard to keep this country alive and has to deal with a pandemic, because of the ineptitude of the president and federal government",,1286088003425718273
bigbandmonty,2020-07-22T23:57:28.000Z,especially when a PANDEMIC is the reason they’re unemployed  t.co/87WlmR6vMr,https://t.co/87WlmR6vMr,1286088000405995520
BerkeleyAid,2020-07-22T23:57:28.000Z,"Wearing masks could help you avoid major illness even if you get coronavirus, experts say  @SFGate  wear your masks folks!  sfgate.com/news/article/W …",https://x.com/SFGate https://t.co/Btyuo8Qfn1,1286087999726313473
KidJoeCool,2020-07-22T23:57:28.000Z,Average recovery time for Covid-19 is like what 11 days to 14? Lol. How the hell them 8 patients (there about) recovered in like 4 days???,,1286087999374188545
SK37829590,2020-07-22T23:57:27.000Z,@realDonaldTrump  We are currently #1 in Covid cases. This is unacceptable these are people's lives. #TrumpVirus,https://x.com/realDonaldTrump https://x.com/hashtag/TrumpVirus?src=hashtag_click,1286087998841339904
WPPresents,2020-07-22T23:57:27.000Z,"America's #1 Eagles Tribute Band  @BESTOFTHEEAGLES  to perform a full concert Sun 7/26, 7PM that will be live streamed from Shea Center  @wpunj_edu  Access is $10. In this time of COVID-19, we're bringing LIVE entertainment to your living room. For tix & info:  wppresents.org",https://x.com/BESTOFTHEEAGLES https://x.com/wpunj_edu https://t.co/C6Ju0vTzFg,1286087998807957510
ABSCBNNews,2020-07-22T23:57:27.000Z,US to buy 100 million doses of potential virus vaccine #COVID19  bit.ly/2D1bYGF,https://x.com/hashtag/COVID19?src=hashtag_click https://t.co/8HVicwMory,1286087997952155648
logosmapping,2020-07-22T23:57:27.000Z,"Related with the estimate of seroprevalence test,  jkms.org/search.php?whe …, As positively identifying the occurrence of disease is usually based upon the presence of antibodies for that disease (SARS-CoV-2), this number is not significant if the specificity of the antibody is low.",https://t.co/spWzjVk0pj,1286087997457231873
n0t_winnie,2020-07-22T23:57:27.000Z,Quarantine has allowed for me to quite literally disassociate myself from people and instead be immersed in literature. I have become so “radicalized” within the past few months alone and tbh this is good and capitalism is THE most destructive system and that’s that on that.,,1286087997314621441
Dolly2000,2020-07-22T23:57:27.000Z,@SiouxsieW  So is testing for COVID 19 only done on one person in a household? Seem to be the case in Northland,https://x.com/SiouxsieW,1286087996987514881
_DexterLee_,2020-07-22T23:57:27.000Z,Melbournians going outside without a mask:  The air on my face is so crisp.... #COVID19Vic #COVID19Aus,https://x.com/hashtag/COVID19Vic?src=hashtag_click https://x.com/hashtag/COVID19Aus?src=hashtag_click,1286087996517707776
ABSCBNNews,2020-07-22T23:57:27.000Z,"World Health Organization says PH needs better contact tracing, not hard lockdowns #COVID19",https://x.com/hashtag/COVID19?src=hashtag_click,1286087996505067521
NewsTimes247,2020-07-22T23:57:27.000Z,Zenke unhappy COVID-19 denied Enyimba 9th league title  newsrantz.com/sports/2020/07 …,https://t.co/UPdGP1YTQ0,1286087995204960256
theurbanecon,2020-07-22T23:57:26.000Z,Lmao piss poor attempt at relabeling a pandemic for political gain. Sad and pathetic,,1286087994680774657
ABSCBNNews,2020-07-22T23:57:26.000Z,'F as in falfak': PH gov't gets failing marks in #COVID19 response from these experts,https://x.com/hashtag/COVID19?src=hashtag_click,1286087993619443712
Russiabottt1011,2020-07-22T23:57:26.000Z,As you wear a fask mask you are being ordered to by Democrat governors.,,1286087993095262208
nickydowlo,2020-07-22T23:57:26.000Z,Hope so,,1286087992893816832
ABSCBNNews,2020-07-22T23:57:26.000Z,"Batanes, Dinagat Islands among provinces with zero #COVID19 cases  bit.ly/39oIG0T",https://x.com/hashtag/COVID19?src=hashtag_click https://t.co/2HX63nM3QM,1286087992159793152
rafi1227,2020-07-22T23:57:26.000Z,Don’t expect first Covid-19 vaccinations until early 2021  careerjobs.co.in/dont-expect-fi …,https://t.co/u6mBuxBIS6,1286087990918422529
ABSCBNNews,2020-07-22T23:57:25.000Z,Metro Manila to be placed under MECQ if #COVID19 cases reach 85K on July 31  bit.ly/3eQaoor,https://x.com/hashtag/COVID19?src=hashtag_click https://t.co/z8DSFLK3kE,1286087990687612928
CharZarBar,2020-07-22T23:57:25.000Z,“Trump Voters Are Old and They Don’t Want to Die”: Why Trump Finally Flip-Flopped on Mask Wearing  #tRumpVirus  #FakePresident  #WorstPresidentInHistory   flip.it/ULwLsi,https://x.com/hashtag/tRumpVirus?src=hashtag_click https://x.com/hashtag/FakePresident?src=hashtag_click https://x.com/hashtag/WorstPresidentInHistory?src=hashtag_click https://t.co/5T8iwj8H16,1286087990029082630
WarmGingerTea,2020-07-22T23:57:25.000Z,The rise in testing is not driving the rise in U.S. coronavirus cases   x.com/i/events/12860 …,https://x.com/i/events/1286060058560864258,1286087989916045314
ABSCBNNews,2020-07-22T23:57:25.000Z,The number of coronavirus infections around the world passed 15 million on Wednesday with more than a quarter of those cases in the United States. #COVID19  bit.ly/2OK6J0O,https://x.com/hashtag/COVID19?src=hashtag_click https://t.co/H6ERZFAfO4,1286087989156646913
TheNutcracker20,2020-07-22T23:57:25.000Z,Classy like making jokes about a pandemic that you did NOTHING about??? #GOPCesspool #TrumpSwamp #VoteGOPOut #RepublicansAreTheProblem,https://x.com/hashtag/GOPCesspool?src=hashtag_click https://x.com/hashtag/TrumpSwamp?src=hashtag_click https://x.com/hashtag/VoteGOPOut?src=hashtag_click https://x.com/hashtag/RepublicansAreTheProblem?src=hashtag_click,1286087987898601473
ABSCBNNews,2020-07-22T23:57:25.000Z,"20 more overseas Filipinos sick with #COVID19; total now at 9,165  bit.ly/32L5o28",https://x.com/hashtag/COVID19?src=hashtag_click https://t.co/s8RV388GE8,1286087987755773952
LesneskiTraci,2020-07-22T23:57:25.000Z,"Interesting read. “It’s as if we’re driving without knowing if the surface is dry pavement or ice, or whether we’re on the freeway or in a neighborhood.” fastcompany.com/90530405/these …",https://t.co/akJsN6Sy2u,1286087986548023301
ABSCBNNews,2020-07-22T23:57:24.000Z,"Some 5.2 million Filipino families experienced involuntary hunger in the past 3 months as the country battled the #COVID19 pandemic, the highest since 2014, an independent Social Weather Stations survey showed.  bit.ly/39iVia1",https://x.com/hashtag/COVID19?src=hashtag_click https://t.co/uBIX1tFH6g,1286087986212302849
christalroper67,2020-07-22T23:57:24.000Z,"Unfortunately no matter what are ask of us to do, we fail to do. People still go out, gather together in large crowds, and when each state had a shut down n stay at home order-it didn't deter half the country.",,1286087986116001803
HR_PaperStacks_,2020-07-22T23:57:24.000Z,he is on the finest of Covid grade cocaine,,1286087985465827328
ABSCBNNews,2020-07-22T23:57:24.000Z,"DOH said the number of people who were given clean bill of health from coronavirus infection rose by 342 to 23,623. The health ministry also reported 6 new fatalities from the contagious disease. #COVID19  bit.ly/30EiH1G",https://x.com/hashtag/COVID19?src=hashtag_click https://t.co/SvCMBVCIRi,1286087984727519232
ABSCBNNews,2020-07-22T23:57:24.000Z,"DAY 131. Here are the stories you need to watch out for today, July 23, 2020, amid the #COVID19 pandemic:   The Philippines on Wednesday reported 1,594 new confirmed COVID-19 cases, raising the nationwide caseload to 72,269.",https://x.com/hashtag/COVID19?src=hashtag_click,1286087982881976320
AlexisDawn92,2020-07-22T23:57:24.000Z,Thank you! I may try to take a walk this weekend. I’m just anxious about it all because of covid.  I could try drawing to (i suck at it though) lol.,,1286087982689255424
RichardBarrow,2020-07-22T23:57:24.000Z,Bangkok Post headlines on Thursday:  Emergency decree extended  bangkokpost.com/thailand/gener … Thailand to be a star player in Covid success story docos  bangkokpost.com/thailand/gener … Phuket set to launch B3bn medical plan  bangkokpost.com/business/19558 …  THAI plans SOS flights to London,https://t.co/uUmL7pgHFP https://t.co/nnDgTrVRo3 https://t.co/xNFyEzLERT,1286087982571597824
EmmaVeen_,2020-07-22T23:57:23.000Z,Living with a toxic parent is even more fun during COVID,,1286087980747313152
BuddyCompo,2020-07-22T23:57:23.000Z,"Basically, the states are on their own in handling a world wide pandemic, but the federal government is all powerful when they want to bring the gestapo in where they are not wanted.",,1286087980063522816
michael407931,2020-07-22T23:57:23.000Z,Why are #UKs and #Europe's covid numbers only a third of ours: they don't cook their records #covid,https://x.com/hashtag/UKs?src=hashtag_click https://x.com/hashtag/Europe?src=hashtag_click https://x.com/hashtag/covid?src=hashtag_click,1286087979832881153
Lanie_Raie,2020-07-22T23:57:23.000Z,I think one of them was me  did you have a cheetah mask lol?,,1286087979522555904
NutterCrypto,2020-07-22T23:57:23.000Z,"a few of my friends are stay at home sons..... seems like a natural progression to stay at home dad....i'll give you their numbers, i'm sure they will answer because they are always home. their parents will thank you. lol",,1286087979518144514
_helowkey,2020-07-22T23:57:23.000Z,You get all the way to the store to realize i forgot that damn mask..,,1286087978637570049
