User_name,Datetime,Content,Links,Tweet_ID
lovepeacedtb,2020-07-20T23:58:23.000Z,@MSNBC  @ReidOutWithJoy  Opportunity to Address Reopening School Challenges #ParentVoice #EducationEquity  @NationalPLTI,https://x.com/MSNBC https://x.com/ReidOutWithJoy https://x.com/hashtag/ParentVoice?src=hashtag_click https://x.com/hashtag/EducationEquity?src=hashtag_click https://x.com/NationalPLTI,1285363458008113153
9janews241,2020-07-20T23:58:23.000Z,Coronavirus: Ballon d’Or 2020 AXED for first time in 64 years  9janews24.com.ng/2020/07/20/cor …,https://t.co/rLSR7HQ9F8,1285363457395773440
drop_tuck,2020-07-20T23:58:23.000Z,"the virus spreads by basically spitting on one another and comparing this to stoping the spread of AIDS you would wear a condom. So, why not mask up and be a part of the solution. it will only help protect others from yourself. it cannot hurt anyone. be responsible be accountable",,1285363457118752770
B82Scottie,2020-07-20T23:58:23.000Z,"Two weeks to slow the spread became perpetually lockdown until not one death happens.   Anyone questioning is met with shrieks of ""stop politicicizing this, one death is too many"".  It's insane.",,1285363456384933888
mini_frosted,2020-07-20T23:58:23.000Z,What’s he soaking that mask in these days?,,1285363455277465600
SeasSprite,2020-07-20T23:58:23.000Z,You have been in quarantine too long. :),,1285363454854008838
tooturnthailey,2020-07-20T23:58:23.000Z,Can covid pack up her bags??? She ain’t even paying rent,,1285363454748983296
stanclarkphotog,2020-07-20T23:58:23.000Z,@jsolomonReports   investigate this dcdirtylaundry.com/gavin-newsom-c …,https://x.com/jsolomonReports https://t.co/31y8CiUA0v,1285363454186893312
voxeu,2020-07-20T23:58:22.000Z,"“If the #US had on 1 April 2020 universally mandated that employees of public-facing businesses use masks, there could have been nearly 40% fewer deaths by the start of June”, find  @VC31415 , Hiro Kasahara & Paul Schrimpf #CovidEconomics #EconTwitter  bit.ly/2DMQLkq",https://x.com/hashtag/US?src=hashtag_click https://x.com/VC31415 https://x.com/hashtag/CovidEconomics?src=hashtag_click https://x.com/hashtag/EconTwitter?src=hashtag_click https://t.co/YhLcyMtDYT,1285363453822029825
Giggerton,2020-07-20T23:58:22.000Z,"Actually, the rest of the world is stopping is. We're not allowed to leave our country because of our horrible handling of Covid",,1285363453687816192
FutrBiz,2020-07-20T23:58:22.000Z,What are the critical fragilities and opportunities that have to be part of the agenda recovery and future development at national and global level? Read Steve Wells’s chapter on Conclusion—The Change Agenda for a Post-Pandemic World.   fastfuture.com/shop/aftershoc … #aftershocks,https://t.co/XAusFYSrAT https://x.com/hashtag/aftershocks?src=hashtag_click,1285363450567417856
HurleySupply,2020-07-20T23:58:21.000Z,"RT WAXIEbuzz ""What is the value you place on clean? Businesses are claiming that they're providing clean environments, yet custodians are not being given the supplies, PPE, training or the respect that they deserve. Worth a read:  hubs.ly/H0sLHFp0 via nytimes #cleaning #c…",https://t.co/R5zcEbWx10 https://x.com/hashtag/cleaning?src=hashtag_click https://x.com/hashtag/c?src=hashtag_click,1285363449258823680
IIceFish4Eyes,2020-07-20T23:58:21.000Z,"Common sense is wearing a mask. Every scientific study has said so. To not wear one is being selfish and petty. ""You're not telling me what to do"".",,1285363448235331584
JYCA1087,2020-07-20T23:58:21.000Z,"Trump: Since the prevention and control of the epidemic has failed, let's throw the blame on others so that I can continue to deceive the American people!",,1285363447962775552
scottlay2,2020-07-20T23:58:21.000Z,Yeah..sounds like the best thing to do would be send them home and quarantine as much as possible until this gets better..wait..that's what we all should be doing.,,1285363447690153985
juanblanco76,2020-07-20T23:58:21.000Z,The State of Hiring Post Quarantine  akkencloud.com/hiringpostquar … #staffing,https://t.co/8ECgsTqTnj https://x.com/hashtag/staffing?src=hashtag_click,1285363447283294209
KohliManny,2020-07-20T23:58:20.000Z,"I’m getting frustrated with people being cavalier that it’s “only a 1% mortality” (use whatever percentage you want). I’ve had covid survivors leave hospital with tracheostomy and peg tubes, Previously totally healthy.  Some survivors don’t survive unscathed.",,1285363445127360517
FroostedFlakess,2020-07-20T23:58:20.000Z,"It’s not wearing a mask that’s the problem, the problem is forcing people to wear one against their will. Everyone should be respectful of others. If you want to wear a mask, then do so, and social distance if you need to. But don’t force others to accommodate you.",,1285363444858990593
philip_boyer,2020-07-20T23:58:20.000Z,"There may be no debates, as Biden cites COVID 19 as the reason he stays away.  At which point, if I am Trump, I invite 3rd party candidates to take Biden's place. If Biden then doesn't show, after 3rd Party candidates are willing to attend, it makes him look even weaker.",,1285363443831365633
MiddleEastTon,2020-07-20T23:58:20.000Z,Pvt Hospital in Cumilla: Treated Covid-19 patients though no deal with govt  bangladesh.timesofnews.com/breaking-news/ …,https://t.co/JZKfmHd2CN,1285363443831320579
MiddleEastTon,2020-07-20T23:58:20.000Z,Pandemic Fallout: About 100 schools go up for sale  bangladesh.timesofnews.com/breaking-news/ …,https://t.co/e6WQH10B7G,1285363443760062472
MiddleEastTon,2020-07-20T23:58:20.000Z,Stop raids amid the pandemic  bangladesh.timesofnews.com/breaking-news/ …,https://t.co/5HkEfJbBxd,1285363443533410306
MisterMichael6,2020-07-20T23:58:20.000Z,"Firmly states  ""there WILL be a pandemic during this administration""",,1285363443260956672
CakeOSaurusRex,2020-07-20T23:58:20.000Z,"I have watched this movie 6 times since quarantine started.   To be fair , that’s about on track with my pre•quarantine watch rate",,1285363443210555392
JesusSonOfGD,2020-07-20T23:58:20.000Z,JESUSSON OF GODINTERVENE WITH DONALD J. TRUMP & TRUMP’S ADMINISTRATION FOR ENDANGERING YOUR CHILDREN GOD. OUR PRESIDENT TRUMP & TRUMP’S ADMINISTRATION IS REOPENING SCHOOL BUT NOT INCLUDING WHITE CHILDREN. AND USING COLOR CHILDREN AS GUINEA PIGS.  vm.tiktok.com/JF8DrWd/,https://t.co/y2SjGsKX8a,1285363442963144706
CanadianKelso,2020-07-20T23:58:20.000Z,"It’s also disheartening to people stuck outside the country that remote really isn’t remote, remote work doesn’t require a w2 or a 1099, it only requires a W8BEN",,1285363442170212352
jtjoelson,2020-07-20T23:58:20.000Z,"Though to be fair, we can’t know the counterfactual where Bernie is the nominee but Trump still massively screws up the pandemic response.",,1285363442069757956
QuestionableAl3,2020-07-20T23:58:20.000Z,forbes.com/#1d092bfb2254 Reopening Setbacks In The Sun Belt Could Cause Long Term Economic Damage ... Reopening plans are now paused or reversed in 80% of the United States as the coronavirus continues to spread,https://t.co/WncvgUsYQV,1285363441578827777
adamhlavac,2020-07-20T23:58:19.000Z,"If they're constantly pushing in response to the state of the country and COVID cases, I'm fine with them delaying and me waiting.  It's when WB says, ""We're releasing this on December 15"" rain or shine that I'm like, ""OK, I'm out.""",,1285363440706482177
exotic_blaze,2020-07-20T23:58:19.000Z,I had a client send me a letter with $200 in it to my job today...all because she feels bad she hasn’t come back to the salon yet and wanted to make sure I’m good . Like this has been happening all of quarantine. I have the best clients everrr,,1285363439918030848
GRUATION,2020-07-20T23:58:19.000Z,"RT  @realDonaldTrump : We are United in our effort to defeat the Invisible China Virus, and many people say that it is Patriotic to wear a face mask when you can’t socially distance. There is nobody more Patriotic than me, your favorite President!",https://x.com/realDonaldTrump,1285363437296648192
blcc_beauty,2020-07-20T23:58:18.000Z,Two of my family members tested positive for covid and then one had to be rushed to the hospital,,1285363435648307200
DJSteezyD,2020-07-20T23:58:18.000Z,I’m just saying. Pretty much literally everything else is open. I totally get we’re going thru our spike phase rn. But at some point until a vaccine is readily available we have to learn how to live with it somehow. It’s not fair one industry is being targeted.,,1285363434788454404
KatieSueAnders2,2020-07-20T23:58:18.000Z,"At tonight’s West Sioix School Board meeting Jason Eygabroad from Beck Engineering have an update on the field turf project. A contractors meeting is scheduled for Friday, July 24 and turf was supposed to be here at the start of next week, however COViD-19 has delayed that.",,1285363434280947712
sapulpatimes,2020-07-20T23:58:18.000Z,"We’re live at the city council meeting. Tonight’s hot item is a discussion and possible action on a mask mandate. The first half of this meeting is going to be pretty routine. We’ll keep you updated. Expecting a proclamation recognizing Louis Martin, Jr.",,1285363433626632193
bemuir_ronkon79,2020-07-20T23:58:17.000Z,Jack Nicklaus says he tested positive for coronavirus (from  @AP )  apnews.com/a0c7909d191298 …,https://x.com/AP https://t.co/ccqp5w9cNA,1285363432640970753
ramenbanks,2020-07-20T23:58:17.000Z,Running uphill in an N95 mask to own the conservatives,,1285363432523366400
K4Climate,2020-07-20T23:58:17.000Z,"Yes, you'd imagine quarantine (cocooning) SD etc, would have to reduce flu mortality, by reducing virus spread.   Many lives could *potentially* have been saved every year.  Doubt anyone will be suggest it for anywhere this year though..",,1285363432045371392
erm___ok,2020-07-20T23:58:17.000Z,you’re right. i could have been kinder. i was angry when i posted that and i still am. masks are the best way we have rn to protect each other (besides staying home). i’m just not inclined to be kind in response to anti mask posts.,,1285363431286218752
normandalehodgr,2020-07-20T23:58:17.000Z,Quarantine 30)90 day's . Talk on the Hill. D. C. . ?Dale Love,,1285363430141104129
usprotec,2020-07-20T23:58:17.000Z,"Malaysia did successfully stop covid-19 with 0 case but why allow those returning home without forced quanrentine to restart covid-19. Recently, so many leaders were not respecting social distancing and wearing masks in activities, and gatherings. Where is leadership by example?",,1285363430006784000
goldenagevlg,2020-07-20T23:58:17.000Z,"This week, we would love to walk you through GAVE's activities and initiatives that we began since the beginning of COVID-19 social distancing.   “Hot Meals for Seniors"" started mid-April and ended June 2020 with funding from The New Horizons for Seniors Program and  @UWGreaterTO .",https://x.com/UWGreaterTO,1285363429382004742
uncleken01,2020-07-20T23:58:17.000Z,Tiny U.K. Company’s Stock Soars 552% as Drug Cuts Covid Risk   bloomberg.com/news/articles/ …,https://t.co/1URo9sqvVX,1285363429016920065
KQED,2020-07-20T23:58:16.000Z,"Sedric Salinas, an East Palo Alto barber who started cutting hair on his grandma's porch at the age of 15, is one of just six barbers invited into the exclusive NBA bubble to give fresh cuts to players.",,1285363428861702145
foes4sports,2020-07-20T23:58:16.000Z,"This almost seems like parameters meant to prevent any learning from occurring which is really disturbing. However, perhaps this resource will help:  asphaltgreen.org/blog/rep-it-ou …. Not sure how you'd get explanations down to a paragraph, but perhaps it's possible 4 some of the options.",https://t.co/kPYFiwdYEs,1285363428572495872
DamnResha,2020-07-20T23:58:16.000Z,Because of COVID they aren’t doing too I tried already!,,1285363428459249666
mustachetoilet,2020-07-20T23:58:16.000Z,"I was in a 5 year relationship until a month into quarantine, so I guess there's that",,1285363428375187456
krispzfn,2020-07-20T23:58:16.000Z,"Wish I had a code but The applications  have been down Bc of COVID 19, so haven’t been able to apply for one",,1285363427691683841
londyloo,2020-07-20T23:58:16.000Z,"Honestly: schools can be doing the right thing by waiving the mcat for the students who are taking it until midnight and risking covid, during police brutality protests.  No other profession is doing this amid covid. Why the gate keeping?  @StanfordMed  @umnmedschool  did it",https://x.com/StanfordMed https://x.com/umnmedschool,1285363427003727876
Tysimbo17,2020-07-20T23:58:16.000Z,Will Cuomo be under quarantine when he gets back from Savannah?,,1285363426936729604
meliwil,2020-07-20T23:58:16.000Z,"while tRumps playing picture pages, people are dying of Covid 19 #IdiotInChief",https://x.com/hashtag/IdiotInChief?src=hashtag_click,1285363425862995974
CMichelleRay,2020-07-20T23:58:16.000Z,Stated in my tweet what Ted should be doing. Use his office & platform to help TX deal w/ a pandemic. To inform us on what US & Austin are doing. Tweet resources. Not weak jabs & arguments. We need sensible gun control. PP isn't going away. If you don't need it. Good. Other do.,,1285363425003155458
DDNSports,2020-07-20T23:58:16.000Z,UPDATE: NFL & NFLPA Signs on for COVID-19 Testing Ahead of Training Camp   ddnsports.tumblr.com/post/624194311 …,https://t.co/uiWhaDauMB,1285363424793292802
CarlsonLawFirm,2020-07-20T23:58:15.000Z,"Despite the decrease in traffic and overall car crashes as a result of the pandemic, speed-related fatalities have increased on Texas roads.  bit.ly/2WH5jbN",https://t.co/4jYh8wSeJx,1285363424667537408
dmac_dam,2020-07-20T23:58:15.000Z,"Also you say ""consequences of their actions..."" but the consequences were of the govts actions and the pandemic, not the returning kiwis.  However National wants them to pay.  It's not kiwi.",,1285363424210202624
mikibarra01,2020-07-20T23:58:15.000Z,chewing strong mint gum while wearing a face mask was a mistake,,1285363423795003393
presidentchamp,2020-07-20T23:58:15.000Z,"Apparently, only frauds like Dr. Fraudci are allowed to throw the first pitch. Will he wear a mask in  this ritual?   #PitcherInPublicCatcherAtHome  x.com/seanmdav/statu …",https://x.com/hashtag/PitcherInPublicCatcherAtHome?src=hashtag_click https://x.com/seanmdav/status/1285310513686208512,1285363423727898626
trstdtravlr,2020-07-20T23:58:15.000Z,"I overhear EU May Ban Travel from US as it Reopens Borders, Citing Coronavirus Failures",,1285363422868234241
TomthunkitsMind,2020-07-20T23:58:15.000Z,"FAILURE TO RESTOCK PPE WILL COST LIVES READ: How Kushner’s Volunteer Force Led a Fumbling Hunt for PPE Young, inexperienced workers scrambled to sort through tips on PPE needed to fight COVID19 while warehouses ran bare & doctors made their own gear. nytimes.com/2020/05/05/us/ … 05",https://t.co/BbWpHGOlhI,1285363422570389510
Rainbow_Golden,2020-07-20T23:58:15.000Z,Masks don’t work: a review of science relevant to Covid-19 social policy  No study exists that shows a benefit from a broad policy to wear masks in public  Why aren't public-health authorities consistently adamant about this established scientific result thewallwillfall.org/2020/06/23/mas …,https://t.co/Zk95x1T5Vf,1285363422570246145
EJPointer,2020-07-20T23:58:15.000Z,"The real reason  @realDonaldTrump  doesn't give a shit that 140,922 American citizens have died of Covid on his watch?  140,922 American citizens are not Donald Trump.  #TrumpThreatensAmerica  #TrumpGenocide",https://x.com/realDonaldTrump https://x.com/hashtag/TrumpThreatensAmerica?src=hashtag_click https://x.com/hashtag/TrumpGenocide?src=hashtag_click,1285363421593178113
ACNetzel,2020-07-20T23:58:15.000Z,Mask wearing perk: You can put off waxing your upper lip for days... weeks. #WearAMask,https://x.com/hashtag/WearAMask?src=hashtag_click,1285363421429600257
WolfDailyNews,2020-07-20T23:58:14.000Z,U.S. Congress girds for a fight over new coronavirus aid bill -  wolfdaily.com/news/u-s-congr …,https://t.co/Yqy4R9BTUo,1285363418963247105
BobBrentTO,2020-07-20T23:58:14.000Z,"It reflects the political & ideological divide in the US over individual freedoms & liberties & any restrictions on them from governments—even when they’re meant to protect citizens from serious harm or death (vaccines, , Covid-19 restrictions)",,1285363418527080449
John81nc,2020-07-20T23:58:14.000Z,"@LAFitness   I returned to my local Arlington, VA club and No masks required. Half staff members in mask and half not. In the weights area, people on top of one another. This bites.",https://x.com/LAFitness,1285363416841048071
Patrici51213233,2020-07-20T23:58:14.000Z,Oh look everyone....!  The one and only time Trump wore his mask...,,1285363416463335424
Ben08891003,2020-07-20T23:58:13.000Z,"Strange how this ""evil regime"" saved more than a million Chinese lives through their coronavirus action and protected millions from being infected including millions of Uighurs.",,1285363415716782080
evochka_vasilen,2020-07-20T23:58:13.000Z,Lanbena Eye Patches Eye Mask Vitamina C Eye Pads Reduces Dark Circles #Bags Eye Lines Repair Nourish Firming Serum Face Skin Care   goto.fyi/5yecc   #aliexpress,https://x.com/hashtag/Bags?src=hashtag_click https://t.co/nkR5PkIWw3 https://x.com/hashtag/aliexpress?src=hashtag_click,1285363415645593605
PhillyInquirer,2020-07-20T23:58:13.000Z,"NFL botching return-to-play protocols as Carson Wentz, Eagles players sound alarms on social media | Marcus Hayes  trib.al/fImKIXz",https://t.co/e4ti4losIt,1285363413963747328
carlolodrew,2020-07-20T23:58:13.000Z,Anong ambag mo?  Inventor: please see the title of my invention.  Title: I invent the equation for solving the forecast of number of COVID-19 cases in the future so to help a country can re open the business as early as possivle in the minimizes of COVID-19.  PH: Non-patentable.,,1285363413766467584
antonhagbox02,2020-07-20T23:58:13.000Z,I believe you get the mystery 24th mask if you do so,,1285363413301039104
YesterdawgLoL,2020-07-20T23:58:13.000Z,Open invitation to all COVID free homies,,1285363412717801473
DaveEvansJr,2020-07-20T23:58:13.000Z,"Or you could just, you know, GO TO THE STORE WITH A MASK ON",,1285363412516712450
gorillastyle,2020-07-20T23:58:12.000Z,"COVID-19 is rising in the country with 145,000 dead and 4 million total cases. Police brutality is still happening (especially in Portland) with more people being beaten & murdered. 46 million americans unemployed.And all Trump cares about is taking healthcare away & re-election.",,1285363411258400768
MeAndMyDogToo,2020-07-20T23:58:12.000Z,"heh, no it's quarantine ""hasn't gotten a hair cut in months"" style!",,1285363410708750336
JBMatthews,2020-07-20T23:58:12.000Z,I was interviewed by the brilliant  @heffnera  for his show  @PBS : The Open Mind - episode airing today.   American Hospitals...Surviving and Treating the Pandemic  pbs.org/video/american … @uchicagosurgery  @UChicagoMed  @UChicago,https://x.com/heffnera https://x.com/PBS https://t.co/Ut9wTNmPsR https://x.com/uchicagosurgery https://x.com/UChicagoMed https://x.com/UChicago,1285363408209092608
ClutterOf,2020-07-20T23:58:12.000Z,"It doesn't. Businesses are closed and windows boarded up because of Covid. There's lots of graffiti on the plywood over the windows and on sidewalks and walls. During the day, totally peaceful, I walk by there almost every day and no problem.",,1285363408158646273
CPEHN,2020-07-20T23:58:11.000Z,"""Doctors are increasingly using telehealth as the safest, most effective means of caregiving. It’s a luxury that low-income seniors who don’t have internet, a computer, or digital skills simply can’t access,"" writes  @laurencedsault  in  @CalMatters .  calmatters.org/california-div …",https://x.com/laurencedsault https://x.com/CalMatters https://t.co/TUkRHKgmzu,1285363405759471616
donovanstake,2020-07-20T23:58:11.000Z,"If u think wearing a mask prevents you from breathing, block me pls",,1285363404606255104
DrMigueQC,2020-07-20T23:58:11.000Z,"If Dr. Shepherd says wear a mask, you wear it. End of discussion",,1285363403817512961
alisonb77,2020-07-20T23:58:10.000Z,Reagan and her Shadow Creek Cheerleaders have a mask fundraiser. Orders can be delivered or shipped (for $3).   Please make sure to include Reagans name when ordering so she gets credit! Orders accepted through July 31! kristitch.net/store/c76/Shad …,https://t.co/gWoupLKwEF,1285363403310194692
janxiety_0,2020-07-20T23:58:10.000Z,Lmaoo I’m so scared for all the new born babies with parents who don’t believe in mask because people took all the baby supplies and toilet paper a few months ago and are still and made think wearing a mask is taking their freedom lol you’re literally going to kill yourself,,1285363402953707520
IAMINKCOGNITO,2020-07-20T23:58:10.000Z,"Reports of a Sudden Surge in Texas Coronavirus Cases Including More Than 80 Infants is FALSE, Officials Say  changedwinds.wordpress.com/2020/07/20/rep …",https://t.co/JDuPFJfPz0,1285363402425212930
elizabethprata,2020-07-20T23:58:10.000Z,"BTW, it IS true. One wonders how long people's lives and livelihoods will be squashed because 83 people died in the US of the virus that week. And according to CDC, death rates decreased EVERY week for 12 weeks straight. COVID threat is disappearing. Time to let us freely live.",,1285363401259180032
gingerschroder,2020-07-20T23:58:10.000Z,This is infuriating. Our state is allegedly dead broke and you galavant on a PR tour. Obey your rule when you come back and quarantine. It'll be the best 14 days New Yorkers have had without having to see you preen in front of the camera. #Cuomosucks,https://x.com/hashtag/Cuomosucks?src=hashtag_click,1285363400822988800
aminjarezatx,2020-07-20T23:58:10.000Z,"My heart is so so broken for these athletes... especially for my class of 2021 kids. We always talked about what their senior year would be like and I just can’t believe their senior season is being taken by COVID... I am so so sorry, y’all.",,1285363400638435334
Ohenekwame416,2020-07-20T23:58:10.000Z,beta.cp24.com/news/2020/7/16 … all this because of a mask,https://t.co/xkxWRfuj6K,1285363400114151426
Elsiesighs,2020-07-20T23:58:09.000Z,"So weird how now that he is tanking in the polls, masks are patriotic and he is going back to daily briefings about Covid 19.  Guess those small ""embers"" in red states have gotten his attention.   Transparent.",,1285363399333826560
cctish,2020-07-20T23:58:09.000Z,Trump says the US has 'the best mortality rate' in the world. That's not true cnn.com/2020/07/20/pol …,https://t.co/1VbGzCbOuf,1285363399103324160
gowdy_phillip,2020-07-20T23:58:09.000Z,The Trump Administration’s failures in mobilizing for coronavirus are even more startling than those US government “failures of the imagination” that led us to the 9/11 disasters.,,1285363398050410496
Renae131,2020-07-20T23:58:09.000Z,"Too little, too late. Your campaign and White House staff were already exposed. You have ludicrous opinions on testing. And you failed to act early on when covid could have been prevented.",,1285363397962485760
mellowmoose,2020-07-20T23:58:09.000Z,*passes the key to unlock the lockdown brain  *,,1285363396720816128
SnazzyKarma,2020-07-20T23:58:09.000Z,"Customer just told me ""I have retard-itis, I don't have to wear a mask.""",,1285363396460924931
westhawaiitoday,2020-07-20T23:58:09.000Z,Kona hospital reports final #COVID19 test results; just one positive among 548 people tested. More at  westhawaiitoday.com/?p=178112 #BigIslandNews #HawaiiNews #HINews #WestHINews #KonaNews,https://x.com/hashtag/COVID19?src=hashtag_click https://t.co/u0oCQ3qfTT https://x.com/hashtag/BigIslandNews?src=hashtag_click https://x.com/hashtag/HawaiiNews?src=hashtag_click https://x.com/hashtag/HINews?src=hashtag_click https://x.com/hashtag/WestHINews?src=hashtag_click https://x.com/hashtag/KonaNews?src=hashtag_click,1285363396146335745
vitamin_jay99,2020-07-20T23:58:09.000Z,Covid has shown me how many people don’t know how to cook,,1285363395362017281
LaurieAnnDee,2020-07-20T23:58:08.000Z,Many schools are making pretty decent adjustments. Students are distanced so when at their desks they do not need to wear masks. What is your suggestion? Wait for the Covid to just disappear?,,1285363395160616961
Chad_T_Douglas,2020-07-20T23:58:08.000Z,@haya2e_jaxa  is scheduled to return to Earth this year...will it be required to quarantine upon its return or will it be staying off the planet until this clears up? #2020 #COVIDー19  @NASA  @JAXA_en  #SpaceMission,https://x.com/haya2e_jaxa https://x.com/hashtag/COVID%E3%83%BC19?src=hashtag_click https://x.com/NASA https://x.com/JAXA_en https://x.com/hashtag/SpaceMission?src=hashtag_click,1285363394271477765
smart_brother,2020-07-20T23:58:08.000Z,What You Don’t Know About the Coronavirus Can’t Hurt Trump  nyti.ms/3jsqlVA,https://t.co/4rlQyusI9F,1285363392967049217
KINGTAX1,2020-07-20T23:58:08.000Z,Well let's just be glad we have this to enjoy during Covid,,1285363392937693184
ajhoward121,2020-07-20T23:58:08.000Z,"step 4.) Take credit for it by saying ""I was telling people to wear a mask and socially distant, but no one was doing it because the liberal media couldn't move past their witch hunt of me for not wearing a mask in my socially distant press conferences and rallies -",,1285363392463634432
MMOBTrueblue,2020-07-20T23:58:07.000Z,@GovParsonMO you are as vile as the orange one.   Kids will get over the Covid -but they will also infect parents and grandparents and teachers you souless asshole. it's not quite this easy - SHAME on you,,1285363390047715330
