User_name,Datetime,Content,Links,Tweet_ID
TruthInGod2020,2020-12-21T23:59:22.000Z,Immoral criminals.  @senatemajldr Got millions in PPP loans for his wife. Voting against aid for Americans.  @KLoeffler  and  @sendavidperdue  benefitted from the pandemic.   #GOPDeathSquad #AntiAmerican,https://x.com/KLoeffler https://x.com/sendavidperdue https://x.com/hashtag/GOPDeathSquad?src=hashtag_click https://x.com/hashtag/AntiAmerican?src=hashtag_click,1341171433540472837
AG37650754,2020-12-21T23:59:22.000Z,Take away the labels and just say they are American Citizens that want their communities opened back up. I certainly am sick of the lockdown and I’m not a proud boy or a BLM. I just want businesses open and students in class,,1341171433053941761
DaBeaverMeister,2020-12-21T23:59:21.000Z,Not playing Beaver basketball.  Need to rediscover rebounding and defending the 3-point line.  I hope the positive COVID test within the program doesn't keep them from practicing.,,1341171432743555072
RyanRadia,2020-12-21T23:59:21.000Z,"That's the delta if the vaccine prevents infection. If it prevents disease, but not infection, the difference among groups is much greater. (Evidence suggests the Moderna vaccine prevents infection.)",,1341171432294854656
danielgerling,2020-12-21T23:59:21.000Z,Asymptomatic and presymptomatic spread are real. Good god.,,1341171431145615362
Rich58627415,2020-12-21T23:59:21.000Z,"Like SHE needs to be in DC?? Gimme a fucking break !!..   ""Ivanka Trump postponed campaign events in Georgia on Monday due to the coronavirus relief bill vote in Congress."" thehill.com/homenews/campa …",https://t.co/XV3QpNvojp,1341171430931644417
PsyberAttack,2020-12-21T23:59:21.000Z,"That's really alarming because 111 only serves as a reliable indicator when we enter explosive growth phases, and there's just too many problematic indicators for this new variant...so I'm absolutely convinced it isn't Johnson playing politics, even though I doubted it initially",,1341171430122278912
patsyjensen,2020-12-21T23:59:20.000Z,"This smart, sweet, funny girl is the absolute best but winter solstice pandemic birthdays are the worst. Big thank you to Kiri's friends for braving the cold to help her celebrate!   instagram.com/p/CJFEA4WFE6AC …",https://t.co/JosZ2tGzdy,1341171428213878790
dailytelegraph,2020-12-21T23:59:20.000Z,WATCH LIVE: Premier Gladys Berejiklian and NSW Chief Health Officer Dr Kerry Chant provide a COVID-19 update for NSW.  dailytelegraph.com.au/news/national/ …,https://t.co/E0xplXMD2v,1341171427672694787
Kathy_Arizona,2020-12-21T23:59:20.000Z,"Just off the phone with my friend in Henderson, NV.  She's just home after 2 weeks in the hospital Covid ward.  She managed to live, but she's perhaps permanently (don't know yet) on oxygen.  Can't even take it out to take a shower.  Her husband tested positive too, asymptomatic.",,1341171427446165504
DGoing5,2020-12-21T23:59:20.000Z,"Exactly there is NO evidence that these mitigation efforts work and frankly this ""pandemic"" is just not anywhere near as worrisome as the fearmongering news makes it out to be: mailchi.mp/tomwoods/bazoo …",https://t.co/PvSlzp1DyJ,1341171427433619457
lizardkingreal,2020-12-21T23:59:20.000Z,not my family trying to bully me for not eating christmas lunch with them when half of them have COVID,,1341171426934599680
EaleyGregory,2020-12-21T23:59:20.000Z,That’s a lot for a bill that can’t get past MCconnel. Are you guy aware we’re still having a pandemic?,,1341171426888396801
packbrewfan,2020-12-21T23:59:20.000Z,And just wait until you get the Covid vaccine & they inject you with a Tracking Device AND a Mind Control thing!!!,,1341171426766688256
mikeinvictor,2020-12-21T23:59:20.000Z,"Sure, from one killer allowing COVID-19 to take lives to another killer of a journalist. Wait, no doubt there were journalists who perished with COVID-19. Both killers have more in common than first thought.",,1341171425164419072
stevetwilightim,2020-12-21T23:59:20.000Z,"HAVE A MERRY LIL XMAS-ONLY 3 TO 6 FAMILY MEMBERS  WEAR YOUR FACE MASK  STOP SPREAD OF DEADLY CONTAGIOUS COVID VIRUS   BE A PATRIOT !  SAVE & PROTECT THOUSANDS OF YOUR FRIENDS' LIVES, YOUR MOTHER OR FATHERS LIFE, YOUR GRANDMAS' LIFE, YOUR AUNTS' & UNCLES' LIVES...   BE A HERO !",,1341171425022005253
eoinneylon,2020-12-21T23:59:20.000Z,"June before we get to vaccination levels NPHET want according to the SBP. Country cannot take 6 more months of this political failure (spurred on by an advisory group with no plan B, and no ability to admit they got the strategy wrong day one... plus media that cheer lead them).",,1341171424598355969
_zellyn,2020-12-21T23:59:19.000Z,i made the same sort of mistake back at the start of the pandemic when they just casually tossed a trillion bucks into the stock market to make number go up,,1341171424061493248
DMac_Cinco,2020-12-21T23:59:19.000Z,You can answer any question with “Covid” and no one will bat an eye.,,1341171423860183043
Orchids1936,2020-12-21T23:59:19.000Z,Cape Coral | Local hospitals prepare to administer COVID-19 vaccines  newsbreakapp.com/n/0Y4GJ60C?s=a …,https://t.co/CtXmiPsJk6,1341171423684005889
jjmaybank,2020-12-21T23:59:19.000Z,i know im hella late but they really tracked charlie’s flight to meet him at the airport? during a PANDEMIC? kinda weird,,1341171423679811584
ctvwinnipeg,2020-12-21T23:59:19.000Z,Manitoba’s health minister proud of COVID-19 vaccination effort  bit.ly/34zb4wa,https://t.co/pOFTy8d3M4,1341171422958411777
MichaelAaronGr1,2020-12-21T23:59:19.000Z,Rolling out covid vaccine like a PR campaign  and knowing absolutely the truth if peoples reactions to the poison  in GB.,,1341171422530400256
Jcdigital27,2020-12-21T23:59:19.000Z,Hopefully covid stuff calms down then lets goooo,,1341171421838364675
shirerat,2020-12-21T23:59:19.000Z,Not good. The cough is crazy. I'm just really sick.  It's scary. I have faith I will recover. I didn't beat cancer twice to be taken out by Covid. It's scary,,1341171421180030977
AmeliaStanley4,2020-12-21T23:59:19.000Z,"@specialreport  @thestoryfnc  @cnnsitroom  @thereidout  @ac360  @maddow  @tuckercarlson  @ngrahamangle #seanhannity   the Russians hacking is an act of war, the Chinese pandemic killing over 315K Americans, and not over yet, is not??  #whereshunter #bejjingbiden #shanghaiswalwell",https://x.com/specialreport https://x.com/thestoryfnc https://x.com/cnnsitroom https://x.com/thereidout https://x.com/ac360 https://x.com/maddow https://x.com/tuckercarlson https://x.com/hashtag/seanhannity?src=hashtag_click https://x.com/hashtag/whereshunter?src=hashtag_click https://x.com/hashtag/bejjingbiden?src=hashtag_click https://x.com/hashtag/shanghaiswalwell?src=hashtag_click,1341171421142257664
hbjbs,2020-12-21T23:59:18.000Z,Tonight! A show which will tower above the pandemic! Join us! It’s Free! Heaps of Holiday cheer!  People funnier and smarter than us!  (And us!)  facebook.com/davekellylive/ …,https://t.co/LCVP7rxlwK,1341171420185808898
Itssouper_ca,2020-12-21T23:59:18.000Z,"How rich would you be if you got a dollar$ for every time you opened your fridge during the 2020 lockdowns? Good thing I'm all about my soups, fruits, and veggies  #quarantinelife #quarantinekitchen #fridgesituation #fridge #QuarantineAndChill #lockdown #soupseason #monday",https://x.com/hashtag/quarantinelife?src=hashtag_click https://x.com/hashtag/quarantinekitchen?src=hashtag_click https://x.com/hashtag/fridgesituation?src=hashtag_click https://x.com/hashtag/fridge?src=hashtag_click https://x.com/hashtag/QuarantineAndChill?src=hashtag_click https://x.com/hashtag/lockdown?src=hashtag_click https://x.com/hashtag/soupseason?src=hashtag_click https://x.com/hashtag/monday?src=hashtag_click,1341171419699437569
UpNorthNewsWI,2020-12-21T23:59:18.000Z,"Whatever you're doing, Wisconsin, keep it up. Coronavirus numbers continue trending in a better direction, even as a second vaccine has been approved and is now making its way to the state. Plus a new federal relief bill is finally approved. More from  @patkreitlow",https://x.com/patkreitlow,1341171418982182912
JohnBap79716388,2020-12-21T23:59:18.000Z,"Politifact named ""Lie of the year"" as the denying and downplaying of the Coronavirus.That means LIAR OF THE YEAR IS TRUMP. Because Trump has done just that for a year.",,1341171418558386177
TheWellbell,2020-12-21T23:59:18.000Z,Nope your not the only one. My in laws got mad we weren’t doing thanksgiving and went to Disney. They came back with COVID and some are still sick so now they get no Christmas . It’s not worth it,,1341171417883226114
jruthkelly,2020-12-21T23:59:18.000Z,'I'm ready': Joe Biden receives coronavirus vaccine live on TV  twib.in/l/r6B4aq4bL4eA via  @guardian,https://t.co/24CaD5V9xZ https://x.com/guardian,1341171417631567872
LollieBacon,2020-12-21T23:59:18.000Z,"Why are you getting this? You didn't support wearing masks, you said Drs. were falsifying covid death rates. How dare you jump the line. Deniers should be last vaccinated.",,1341171416943640576
DavidComan4,2020-12-21T23:59:17.000Z,"@realDonaldTrump  It is highly unlikely you will see this tweet. Nonetheless, I hope you realize where ""WE THE PEOPLE"" are. We can not turn to our government, it has turned against us. 74+ Million Americans will not respond as Venezuelans. The mask, shut down, & election will",https://x.com/realDonaldTrump,1341171415949729792
DrACactivism,2020-12-21T23:59:17.000Z,UK Lockdown - The Poor lose again badly! As the Rich barely suffer of anything. Read! - Dr ACactivism  dracactivism.com/uk-lockdown-th …,https://t.co/EH3rEJzslh,1341171415882579968
theheraldsun,2020-12-21T23:59:17.000Z,"LATEST: Authorities have warned Victorians trying to return from Sydney if they did not come back to Victoria last night, they cannot return until this crisis is over. bit.ly/3h7t4Tr",https://t.co/wHfqe0nXoe,1341171415005851648
wmyb_lynn,2020-12-21T23:59:17.000Z,"ooohhh, its a mutated strand of covid 19 that is in London, so they had to shut down",,1341171413978402817
AntiAqarius,2020-12-21T23:59:17.000Z,Keep wearing you mask and social distancing tho,,1341171412799811586
CNNSOTU,2020-12-21T23:59:17.000Z,State Department reverts to Phase 1 Covid-19 restrictions amid nationwide surge in cases | ⁦ @kylieatwood ⁩,https://x.com/kylieatwood,1341171412413853698
deenie7940,2020-12-21T23:59:17.000Z,California’s Governor Says He Will Enter Quarantine ...Again  weaselzippers.us/461260-califor … via  @weaselzippers,https://t.co/dbCy6SJbbc https://x.com/weaselzippers,1341171412237742081
Metz1245John,2020-12-21T23:59:17.000Z,Mnuchin: Here's When Americans Can Expect to Receive Their Direct Cash Payment  townhall.com/tipsheet/bethb …,https://t.co/O5o748cYpR,1341171411956748289
NESeattleSavage,2020-12-21T23:59:16.000Z,"Hoping non-WSJ subscribers can read the article!  #CytoDyn #Leronlimab #Vyrologix  “After six months of living in an internal prison, I need to try it”  wsj.com/articles/exper … via  @WSJ",https://x.com/hashtag/CytoDyn?src=hashtag_click https://x.com/hashtag/Leronlimab?src=hashtag_click https://x.com/hashtag/Vyrologix?src=hashtag_click https://t.co/malxJK9xhV https://x.com/WSJ,1341171410249510913
CoreyAnthonyInc,2020-12-21T23:59:16.000Z,"#Prayers #Italy #Pandemic #Coronavirus Italy again is struggling with one of the world’s deadliest coronavirus outbreaks. Experts point to inadequate health-care spending, too few doctors and the nation’s older population.   wsj.com/articles/why-a … via  @WSJ",https://x.com/hashtag/Prayers?src=hashtag_click https://x.com/hashtag/Italy?src=hashtag_click https://x.com/hashtag/Pandemic?src=hashtag_click https://x.com/hashtag/Coronavirus?src=hashtag_click https://t.co/8xo29QkHFt https://x.com/WSJ,1341171409830244358
gaygoroakechi,2020-12-21T23:59:16.000Z,i hate these bitches so much the worst thing is that i cant do shit about it during a pandemic when im 16,,1341171409784098816
azwan_,2020-12-21T23:59:16.000Z,Nak approve vaccine pun bureaucratic gila.,,1341171409087647744
moonsvariant,2020-12-21T23:59:16.000Z,i’m bored of covid convos now it’s like talking about the weather sorry,,1341171408718716932
PragmaticAZ,2020-12-21T23:59:16.000Z,"Attention all Trump lemmings: You have been lied to. Everything that trump said about the election was a lie. Everything that trump said about COVID was a lie. In fact, most things that Trump says are lies. Even Pat Robertson acknowledges this. Seek deprogramming immediately!",,1341171408378871810
ABCDNews_24,2020-12-21T23:59:16.000Z,"So Victoria works out — COVID infections increase, go into major lockdown with mandated masks. Squashes the outbreak flat.  #GladysClusterFuck #GladysCluster #auspol #nswpol",https://x.com/hashtag/GladysClusterFuck?src=hashtag_click https://x.com/hashtag/GladysCluster?src=hashtag_click https://x.com/hashtag/auspol?src=hashtag_click https://x.com/hashtag/nswpol?src=hashtag_click,1341171408114597889
delfineline,2020-12-21T23:59:15.000Z,aerial had me go through a 60s phase in the middle of quarantine,,1341171405501677569
linedancepro,2020-12-21T23:59:15.000Z,Covid Conga - no rhythm or brain required,,1341171404604116994
ursonate,2020-12-21T23:59:15.000Z,Good afternoon.  BLACK LIVES MATTER is a message of URGENCY and joy.  Arrest the cops who killed Breonna Taylor.  Keep social distancing. Wear a mask when around others & wash your hands for at least 30 seconds.  Have a great day.,,1341171404193079296
smericat,2020-12-21T23:59:14.000Z,Just wanted to let everyone know you don’t deserve any rewards for following the COVID-19 protocols it’s literally the bare minimum to not be selfish,,1341171402565701632
SabinaWalker18,2020-12-21T23:59:14.000Z,"I hope everyone retweets this - even to #pro_lockdowners  A debate is needed NOW on damaging effects of #lockdown  As you said  1) Lockdowns do NOT save lives. Instead, more lives are LOST (an experiment only) 2) There are NO excess deaths OVERALL. It’s a death #labelling problem",https://x.com/hashtag/pro_lockdowners?src=hashtag_click https://x.com/hashtag/lockdown?src=hashtag_click https://x.com/hashtag/labelling?src=hashtag_click,1341171402439725057
MsKTCG,2020-12-21T23:59:14.000Z,"Fuck off, I actually baked 70 cupcakes and 90 cookies today. Wow  from a lockdown business to this",,1341171400221061121
lover4frogs,2020-12-21T23:59:14.000Z,No the COVID-19 relief is under President Trump #CrookedJoeBiden can’t do shit his records show that 47 years NOTHING stop spreading propaganda and lies plus didn’t Crazy Pelosi and your crooked and corrupt democraps held the relief bill up for political reasons.,https://x.com/hashtag/CrookedJoeBiden?src=hashtag_click,1341171400023916544
Wil_Johnson1,2020-12-21T23:59:14.000Z,'The fleecing of America' .... #VETOTHEPORK   Coronavirus Stimulus Bill Funds Hundreds of Millions in Aid to Palestinians  breitbart.com/middle-east/20 …,https://x.com/hashtag/VETOTHEPORK?src=hashtag_click https://t.co/iyeDzIHtvw,1341171399403180032
RobertHarding,2020-12-21T23:59:13.000Z,"My sister, a health care worker on Long Island, gets her first dose of the vaccine on Tuesday.   A great Christmas gift after her work treating COVID patients this year.",,1341171397897428999
ALBrusey,2020-12-21T23:59:13.000Z,"I agree- t crux of t whole damn Aussie shitshow. My blood is boiling as a Victorian; we endured hard lockdown & all the while we have Murdoch/LNP Hellhounds control t narrative, making it all Andrews' liability. Dan-clearly, a complete hero 4 caring 4 us despite LNP divisive BS",,1341171397821833216
FredCountin,2020-12-21T23:59:13.000Z,Long week ahead  finna come down wit Covid,,1341171396400082955
bdvaughan64,2020-12-21T23:59:13.000Z,President-elect Joe Biden receives first dose of the Pfizer-BioNTech COVID-19 vaccine   x.com/i/events/13411 …,https://x.com/i/events/1341120034433744897,1341171395905011715
sunnydeedoherty,2020-12-21T23:59:13.000Z,Please hurry with the vaccine; Access Hollywood is essentially a true crime TV show now that there are still no celebrity events or premieres,,1341171395577966597
got_cactus,2020-12-21T23:59:12.000Z,Quit with the idiots being planted in CA wearing hockey masks dressed as if it were Halloween. The general public is not stupid. Get help  google.com/amp/s/fox40.co …,https://t.co/Y1R2yTEpv7,1341171394629910528
vtbirkenstock,2020-12-21T23:59:12.000Z,When I think COVID RELIEF... I of course think $193 million for federal HIV/AIDS workers stationed abroad to buy new cars...,,1341171394604888065
rev0lutn,2020-12-21T23:59:12.000Z,"So, the #smithsonian is admittedly an important national entity...but cereally?! $1B ILLION freakin' dollars for THEM while Joe Lockdown get's a lousy 6 pack of Benjamins... WTF #VETO  @realDonaldTrump",https://x.com/hashtag/smithsonian?src=hashtag_click https://x.com/hashtag/VETO?src=hashtag_click https://x.com/realDonaldTrump,1341171394172882945
WinstonFSmith84,2020-12-21T23:59:12.000Z,"@KateGreenSU  and  @Keir_Starmer  still insisting on schools opening 'no ifs no buts?'  WAKE THE FUCK UP AND LISTEN TO THE TEACHERS AND PARENTS!!!!!  ""January school closures considered as fears grow over new Covid strain's spread among children""  telegraph.co.uk/politics/2020/ …",https://x.com/KateGreenSU https://x.com/Keir_Starmer https://t.co/umuOlp9Pi3,1341171394097401856
ifelic,2020-12-21T23:59:12.000Z,"Little Marco Rubio, first in line to get the vaccine, after downplaying the virus! Such a hypocrite. Let's see, he is young, healthy, so why is he among the first?",,1341171392524521474
thinkpuertorico,2020-12-21T23:59:12.000Z,Innovative universal flu vaccine shows promise in first clinical test  sciencemag.org/news/2020/12/i …,https://t.co/LuLJISKsA4,1341171391408861187
Glenn64952082,2020-12-21T23:59:11.000Z,"Masks do not work in the general public. Because you don't use it properly. Do you put a new mask on every time? Once on, don't touch it. If you touch it, your hands are contaminated and should be washed before you touch anything else. ARE YOU HONESTLY DOING THIS AT ALL TIMES???",,1341171390498697217
AMS_Perkins,2020-12-21T23:59:11.000Z,I spent majority of the day finishing up some Christmas shopping. I(and my kids) were the only ones in every store we went into without a mask on. We were very friendly and smiled at everyone & wished everyone a Merry Christmas!  #RaisingAntifragileKids #CheerfullyDifficult,https://x.com/hashtag/RaisingAntifragileKids?src=hashtag_click https://x.com/hashtag/CheerfullyDifficult?src=hashtag_click,1341171390238646273
DoctorHenryCT,2020-12-21T23:59:11.000Z,"On the lead up to the year 2020,I wondered whether as in vision 2020 meant things would be made clearer. It showed me the goodness of people like health care workers who have given up a lot to care for Covid patients and sadly it also showed the depravity of the Republican party.",,1341171389416566790
BayoAdedosu,2020-12-21T23:59:11.000Z,What's Apostle Suleiman's own with covid-19 relief funds in America? Doee he have a registered Church in America? These people are too fraudulent for my liking.,,1341171388711907328
USPolitiHUB,2020-12-21T23:59:11.000Z,This Is the Most Criminal Dereliction of Duty in the History of the American Presidency #politics #news #USPolitiHUB  esquire.com/news-politics/ …,https://x.com/hashtag/politics?src=hashtag_click https://x.com/hashtag/news?src=hashtag_click https://x.com/hashtag/USPolitiHUB?src=hashtag_click https://t.co/BWaGQu4wWb,1341171388707586049
Iruo0,2020-12-21T23:59:11.000Z,You people do this but refuse to get citizens tested for the virus.  The response of the Federal Government led task force to this pandemic is a joke!  But okay.  Make guidelines that will be flouted by everyone and pretend like you are doing anything behind the scenes.,,1341171388456054785
AdamJosephGrant,2020-12-21T23:59:11.000Z,"What I find rather unmotivating is we have the ability to get out of this stronghold of the virus. Yet when protesters burn piles of masks, it becomes hard to be optimistic about enough americans taking the vaccine.   #WearADamnMask",https://x.com/hashtag/WearADamnMask?src=hashtag_click,1341171387629621248
ChadPergram,2020-12-21T23:59:11.000Z,"Pelosi to Hse Dems on COVID bill: The legislation we pass today does acknowledge the role states must play in the distribution and administration of the vaccine, as well as in education and transportation as we go forward.",,1341171387294167040
Lisakno62365,2020-12-21T23:59:10.000Z,2020 and Covid -19  kiss my reindeer,,1341171385331294210
Faenyx17,2020-12-21T23:59:10.000Z,"Not gunna lie, seeing how the government handled COVID and how little our lives mean to them, I really just don't want to live in the United States anymore",,1341171385138331648
galacticonion,2020-12-21T23:59:10.000Z,"Kms, I gotta keep isolating. I’m positive for covid  I will simply pass away.",,1341171384848773121
MiddleEastTon,2020-12-21T23:59:10.000Z,Sinovac’s Covid-19 Vaccine Shown Effective in Brazil Trials  middle-east.timesofnews.com/breaking-news/ …,https://t.co/2JW0L6eZs4,1341171384450502658
hrryyluvr,2020-12-21T23:59:10.000Z,i hate covid 19 so much i hate it i hate it,,1341171383951355907
alllocalpolitic,2020-12-21T23:59:10.000Z,Biden appoints COVID-19 task force and cautions of a ‘very dark winter’ | Science|Business  sciencebusiness.net/covid-19/news/ …,https://t.co/FW2hx2BIma,1341171383754051585
Christi49342689,2020-12-21T23:59:10.000Z,I thought the state of Florida was opened up without mask mandates??,,1341171382923784194
seapigeon1,2020-12-21T23:59:10.000Z,"There was a lot of hope and optimism in the library-turned-vaccination-suite.  We were required to stay 15-30 minutes after the shot for monitoring and it was nice to just talk and laugh with others, to feel like we were sharing a small victory.  It's been in short supply.",,1341171382894424065
BigApeNigga,2020-12-21T23:59:10.000Z,Hope ain’t no Covid-19 on dat shxt,,1341171382630162437
danieljames1925,2020-12-21T23:59:09.000Z,Full Lockdown from Jan to end of April. Fergason will insist upon it as 'the new mutation risks a ' human disaster' according to his latest projections. We know how unreliable he has been in the past.Lockdowns are a disaster for humans.Not for cabinet ministers or Fergasons+Sage.,,1341171381124345858
6dm4,2020-12-21T23:59:09.000Z,on a US COVID Relief Bill - money to a foreign govt. #GeorgiaNeedsOssoff #GeorgiaNeedsWarnock we need them.  x.com/WalkerBragman/ …,https://x.com/hashtag/GeorgiaNeedsOssoff?src=hashtag_click https://x.com/hashtag/GeorgiaNeedsWarnock?src=hashtag_click https://x.com/WalkerBragman/status/1341121311578476544,1341171380268589059
Airchecker,2020-12-21T23:59:09.000Z,Prep: COVID has taught us ways of doing things different. It appears Curbside Pick up is a winner. Buisnesses plan on cont with the fast pitstop Curbside pick up after COVID is long gone.   Get your purchase instantly rather than wait days.Curbside has been very successful.,,1341171378808999936
EquineTherapyUK,2020-12-21T23:59:09.000Z,"When was this filmed?? No social distancing, no mention of covid. Its a bit weird",,1341171378590986243
ManeckiN,2020-12-21T23:59:08.000Z,"Excellent idea! I've got a pulse ox, a BP cuff, a stethoscope & an otoscope. All of it cost me well under $100. Better safe than sorry in #ThePlagueYear!   (Keep in mind, it took 6 hrs for an ambulance to arrive & get my dad to ICU after a life threatening covid collapse.)  x.com/trishgreenhalg …",https://x.com/hashtag/ThePlagueYear?src=hashtag_click https://x.com/trishgreenhalgh/status/1341098466265739264,1341171377512931329
NorthBelle4,2020-12-21T23:59:08.000Z,The Corporate Scramble to Get in Line for Limited Vaccine Supplies is Underway – Mother Jones  motherjones.com/coronavirus-up …,https://t.co/u5su55Xe1v,1341171377299222529
Miezebiene,2020-12-21T23:59:08.000Z,The public can't manage a pandemic without a competent leading. That's why we have current problems after too soft restrictions.,,1341171377143951362
NeeTheQueennn,2020-12-21T23:59:08.000Z,Omg the  @Huawei  Christmas advent made me cry the cafe was closing because of Covid and the homeless people saved up all their money to go eat in the cafe to try keep it open,https://x.com/Huawei,1341171376930107395
Raymmondragon,2020-12-21T23:59:08.000Z,"Joe Biden receives Covid vaccine on live television, encourages Americans to get inoculated  cnb.cx/2KPHkEs Our future President Elect leading by example.",https://t.co/8RfqyNhKQo,1341171376464519176
cann4ing,2020-12-21T23:59:08.000Z,House Democrats Subpoena HHS and CDC Chiefs Over Alleged Political Interference in Covid-19 Response -  go.shr.lc/2WzLdjj via  @commondreams,https://t.co/kuGoGur7eG https://x.com/commondreams,1341171376393109504
DailyMailUK,2020-12-21T23:59:08.000Z,BBC newsreader Huw Edwards reveals he is still experiencing breathlessness NINE MONTHS after battling COVID-19  trib.al/VWJXfCB,https://t.co/YZIK8os35r,1341171375311040523
jprice397,2020-12-21T23:59:08.000Z,"I get it, I work in a small rural agency. But we do have access to info... so why am I the only one in the detective division (9 people) who signed up to get the vaccine. That just makes no sense.",,1341171375285874688
elendirG,2020-12-21T23:59:08.000Z,"Thread by  @firefoxx66 : Is the new UK variant the same as the new South African variant (501Y.V2)? No. They both share the same mutation in spike: N501Y (N->Y at position 501). However, the 2 variants have arisen...…  threadreaderapp.com/thread/1340359 …",https://x.com/firefoxx66 https://t.co/NsPXZEyHMi,1341171374816194563
Gitsie007,2020-12-21T23:59:08.000Z,"Yes, addiction and going through recovery right now is extra tough due to covid restrictions.  Good thing is all meetings are online now which means easier access to them, IMO",,1341171374761463809
