User_name,Datetime,Content,Links,Tweet_ID
FewellJacob,2020-12-21T23:59:08.000Z,if u see me cover my mouth while coughing with a mask on it’s because i’m tryna maintain good habits,,1341171374199513088
burisabadneigh1,2020-12-21T23:59:07.000Z,Should airports disclose COVID-19 outbreaks to passengers?  Let  @fly_BUR  know.,https://x.com/fly_BUR,1341171372702060546
lilerinb,2020-12-21T23:59:07.000Z,because it makes NO SENSE “super salty simon” there isn’t a vaccine for cancer because it ISNT A VIRUS. that’s all the tweet was buddy it’s not my fault you felt the need to speak on something & sound all smart when i never said anything about that  sit down,,1341171371175395329
rich999999,2020-12-21T23:59:07.000Z,But why did AOC get the vaccine. Didn’t know she was over 65 tears old. HAHA.  What a hypocrite,,1341171371141959680
p1nebarrens,2020-12-21T23:59:07.000Z,if you fill up gatorade bottles with tap water don’t worry about whats in the vaccine,,1341171370823200775
CathyGi42274668,2020-12-21T23:59:07.000Z,"@HawleyMO   Senator, what about the unused 455 billion in the Covid Relief Fund that Steve Mnuchin wanted to put into the Treasury's General Fund ...seems to me a Covid Relief Stimulas ck for the people could come out of a Covid Relief Fund !!",https://x.com/HawleyMO,1341171370802229249
jeniport,2020-12-21T23:59:06.000Z,Tropicana apologies for ad campaign suggesting alcohol was the answer to pandemic relaxation  thehill.com/homenews/media …,https://t.co/13k0n0AJGo,1341171369749319681
Americasgoodgrl,2020-12-21T23:59:06.000Z,If I knew I was going to get COVID I would’ve had my sister roll me a few b4 she went back home,,1341171368826720259
EagleSlant,2020-12-21T23:59:06.000Z,Progressives Care More About Politicizing The Vaccine Than Saving Lives  eagleslant.com/?p=561868,https://t.co/Pjoc53xcyK,1341171368315015176
theBreakerNews,2020-12-21T23:59:06.000Z,@adriandix  brushes-off  @ianabailey  question about propriety of   @drbonniehenry  co-authoring a book about the early days of the first wave of the pandemic.  But there are rules about info handling for  @BCPublicService  employees. Henry is equivalent of a Deputy Minister. #bcpoli,https://x.com/adriandix https://x.com/ianabailey https://x.com/drbonniehenry https://x.com/BCPublicService https://x.com/hashtag/bcpoli?src=hashtag_click,1341171367794774016
AssuredFreedom,2020-12-21T23:59:06.000Z,I didn't think so either. This is the fastest vaccine in human history and first one for a coronavirus.,,1341171367778070535
Emiwright88,2020-12-21T23:59:06.000Z,Analysis: Tighter restrictions for longer will lead to slower growth and higher public borrowing. theguardian.com/business/2020/ …,https://t.co/9U0ehdGi3d,1341171367132196873
randgmom,2020-12-21T23:59:06.000Z,"Why do people feel comfortable just touching strangers, strangers’ children, strangers’ babies, strangers’ dogs, anything belonging to someone they don’t know? Stop. Touching. People. Keep your hands to yourself, and not just during the pandemic.",,1341171366842806273
newpaper24,2020-12-21T23:59:06.000Z,Covid: US President-elect Joe Biden gets vaccine live on TV – NEWPAPER24  newpaper24.com/covid-us-presi …,https://t.co/ObjzaOOcR6,1341171366435966979
ektaka,2020-12-21T23:59:06.000Z,You will need to quarantine them and do a second PCR test before releasing them into the general population for this protocol to work. Otherwise it will be as meaningless as the White House testing protocol. All you need is one false negative passenger to cause an outbreak.,,1341171365768916992
MHaanson,2020-12-21T23:59:05.000Z,“Lockdown in Ontario”... You can buy clothes at Costco and Walmart.... You can’t buy clothes at Marks Work Warehouse. Right. Never mind SMALL businesses. It’s a joke. Not a lockdown.,,1341171363638374401
HazeldineR,2020-12-21T23:59:05.000Z,Looks like the #UK is finally getting the international travel ban that should have been implemented all along - just unwillingly! #COVID20 #COVID,https://x.com/hashtag/UK?src=hashtag_click https://x.com/hashtag/COVID20?src=hashtag_click https://x.com/hashtag/COVID?src=hashtag_click,1341171363273273345
CantTurnMeDownn,2020-12-21T23:59:05.000Z,Y’all niggas  gon take the $600 get a bottle of 1942 and some Za  watch the Pandemic pt 2 party’s be lit,,1341171362677874689
MangyLover,2020-12-21T23:59:05.000Z,"December twenty-first  Fatalities caused by Covid-19 are equal to the population of  Henderson, Nevada",,1341171361532833792
PbSULAK,2020-12-21T23:59:04.000Z,"I only started out of desperation over problems with my meds. If wasn't stuck in a nursing home till after COVID dies down, I probably wouldn't have started. Massive anxiety. Everybody else here smokes. The vaping has helped a bit, but last resort. I make most of my own.",,1341171360853331968
Shahena_xo,2020-12-21T23:59:04.000Z,Praying I’m not in lockdown for my bday.,,1341171358278049797
scarlet_mugi,2020-12-21T23:59:04.000Z,wearing a mask if you're sick should totally be a thing in the west after all this's over but my bet is our collective trauma over it will keep it from happening,,1341171357720203265
Captncarty,2020-12-21T23:59:04.000Z,No meeting today... COVID restrictions,,1341171357648707585
fahimmoledina7,2020-12-21T23:59:03.000Z,How Artificial Intelligence Assisting Mobile Operators in Pandemic #ArtificialIntelligence via  twinybots.ch  onpassive.com/blog/how-artif …,https://x.com/hashtag/ArtificialIntelligence?src=hashtag_click https://t.co/iWAHge7rvy https://t.co/aJEeeTxBTU,1341171356587741185
jda95,2020-12-21T23:59:03.000Z,"let’s remember charli xcx announcing, creating and releasing the first quarantine album before anyone had even sneezed",,1341171356285640704
eswords,2020-12-21T23:59:03.000Z,Why is joe wearing a mask over a mask,,1341171355128131586
thekingdrex,2020-12-21T23:59:03.000Z,How people's selfies are gonna look 2 weeks after taking the vaccine,,1341171354742218752
onlinenewsupda1,2020-12-21T23:59:03.000Z,"Ahead Of The Mass Immunization Plan Against Covid-19, BMC Begins Vaccine Training  onlinenewsupdates24x7.com/ahead-of-the-m …",https://t.co/YrQTM4zNjT,1341171353966227458
RepPennyMShaw,2020-12-21T23:59:03.000Z,Newly-released State of Texas vaccine information,,1341171353139994624
AM980News,2020-12-21T23:59:02.000Z,Coronavirus: LHSC predicts hit to operating room capacity in early 2021 amid expected case surge  trib.al/2IKhg6N #ldnont,https://t.co/7eB2FijopN https://x.com/hashtag/ldnont?src=hashtag_click,1341171352649265152
Slate,2020-12-21T23:59:02.000Z,"In some places, mail is piling up at distribution centers because USPS can’t handle the holiday shipping flood.  slate.trib.al/0qfIACL",https://t.co/T4wX04HJoC,1341171352561217537
TheGoodDr03,2020-12-21T23:59:02.000Z,This is why legislation is so damn tough to pass.   Even something so straight-forward as ‘let’s help Americans financially during the pandemic’ has a butt-ton of riders and pork barrel amendments tacked on for good measure,,1341171351487455232
NERAconference,2020-12-21T23:59:02.000Z,"We would like to share a message from NERA President Steven Holtzman about the holidays and COVID-19 Impact on NERA’s plans for 2021. Click the following link to find it:  nera-education.org/presidents_hol … Stay safe, and be well!",https://t.co/aOWezee5ID,1341171351403585542
RedPilledPlayer,2020-12-21T23:59:02.000Z,Devil's advocate:  Could acting SecDef been referring to the military's role in supporting vaccine distribution efforts?  I believe VP Pence was involved in this role. @MikayesFiona,https://x.com/MikayesFiona,1341171351185485827
SportsHotMomma,2020-12-21T23:59:02.000Z,"You’re welcome, Love! I’m trying to be ok w/this pandemic. *whew*",,1341171350464057344
garycmorgan,2020-12-21T23:59:02.000Z,"Now 77% of Australians would get a vaccine for COVID-19 – down 10% points since April 2020. Of all Australians three-in-four (77%, down 10% points on April 2020) say they are willing to be vaccinated for Coronavirus if a new vaccine becomes... #auspol  ow.ly/rNaA30rpDMN",https://x.com/hashtag/auspol?src=hashtag_click https://t.co/1Txc6De0FN,1341171350153678849
rogue_corq,2020-12-21T23:59:02.000Z,A comprehensive and ongoing list of right-wing politicians who denied the virus but still jump the line to get the vaccine [Facepalm]  fark.com/comments/11058 …,https://t.co/DVfq8Jwq21,1341171349440491520
Black_RosaV_,2020-12-21T23:59:02.000Z,I didn't trust the vaccine anyway that shit takes years to make,,1341171349029609472
guardianworld,2020-12-21T23:59:02.000Z,Australia coronavirus live: Gladys Berejiklian to give Covid update amid pressure on NSW to tighten restrictions  theguardian.com/australia-news …,https://t.co/Qzj94KZvkh,1341171349008498689
OmarQadri1,2020-12-21T23:59:01.000Z,"#WTFee,  @comcast ?! Sign  @CRAdvocacy  petition to stop Comcast’s data cap and overage fees during COVID-19.  action.consumerreports.org/20201221_finan …",https://x.com/hashtag/WTFee?src=hashtag_click https://x.com/comcast https://x.com/CRAdvocacy https://t.co/HeaKCGJDd5,1341171348819890181
JimStLeger,2020-12-21T23:59:01.000Z,"Join the nearly 40,000 people on  @LowellObs  YouTube live right now watching the #GreatConjunction of #SaturnJupiterConjunction. What a great pandemic virtual astronomy opportunity!",https://x.com/LowellObs https://x.com/hashtag/GreatConjunction?src=hashtag_click https://x.com/hashtag/SaturnJupiterConjunction?src=hashtag_click,1341171348123525120
SocialismFrom,2020-12-21T23:59:01.000Z,CNN do you guys have anything else to report other than covid and covid vaccine It’s getting boring,,1341171347532238848
renovan89,2020-12-21T23:59:01.000Z,But more likely things people who don’t want the vaccine consume regularly and also don’t know the ingredients of?,,1341171347234414593
daniell44142380,2020-12-21T23:59:01.000Z,This way Harris can’t Covid his a$$!,,1341171347108466689
peggymel2001,2020-12-21T23:59:01.000Z,"To be honest, Covid-19 does not recognise the rich and poor, just as it does not recognise postcodes.   Having this discussion points out the societal divisions that have been sown by the LNP IPA relentless change agenda to redistribute wealth to a few at the expense of the many.",,1341171346957508609
fatheyayallas,2020-12-21T23:59:01.000Z,#Pakistan had the capacity to STOP committing GBV against its Own women. It’s A political responsibility. Stop Killing women please. It’s depleting resources for Covid.  x.com/chigrl/status/ …,https://x.com/hashtag/Pakistan?src=hashtag_click https://x.com/chigrl/status/1341156384579186689,1341171346018021385
catncarattt,2020-12-21T23:59:01.000Z,I refuse to take anyone with a mask under their nose seriously,,1341171345594474501
LesserMegadeath,2020-12-21T23:59:01.000Z,No. NZ was seeded and looking like exponential case numbers. Then we smashed it with out L4 lockdown. It’s a real one.,,1341171345594351616
Phill_John3_16,2020-12-21T23:59:00.000Z,"I'm sorry you think the Church has been MIA during the pandemic, but in your area at least that has not been the case. Just one example is the work coordinated by TPT, feeding over 250 families every week through the summer. See more here:  transformingplymouthtogether.org.uk",https://t.co/dSMP5HD4rg,1341171344638177280
InsiderLife,2020-12-21T23:59:00.000Z,"Photos show what Christmas traditions look like in the coronavirus-era, from mall Santas in snow globes to drive-thru light shows  insider.com/photos-how-chr …",https://t.co/sDh4CHDuO5,1341171343988056069
iam_victuR,2020-12-21T23:59:00.000Z,Its happening again  can covid go away already.,,1341171343946113031
daniel_vdez,2020-12-21T23:59:00.000Z,vaccination and chill?,,1341171343501516808
JSNWNSTNLY,2020-12-21T23:59:00.000Z,"Many obtuse ppl felt it was harsh to kick him out of (poorly named) Sage, as if it was rly about him cucking someone, which no-one cares about. It was the fact that Doc Lockdown didn't feel he or they were under any risk. As he admitted, he made a 'risk-based' judgment. Low risk?",,1341171343342092288
escapeatx,2020-12-21T23:59:00.000Z,Cheap Flights: San Antonio to Belize City $170 r/t [January-March.2021] - Delta  A negative COVID PCR test result is required for entry. escapeatx.com/?p=7099  #Airfare #Flights #Travel,https://t.co/qy8Y0LPjek https://x.com/hashtag/Airfare?src=hashtag_click https://x.com/hashtag/Flights?src=hashtag_click https://x.com/hashtag/Travel?src=hashtag_click,1341171342809423875
UpInTheHills,2020-12-21T23:59:00.000Z,What kind of sicko? This one! The left are sick in the head. #communists  dailywire.com/news/watch-whi …,https://x.com/hashtag/communists?src=hashtag_click https://t.co/2LACT8o61G,1341171342037512193
dylanbrody,2020-12-21T23:59:00.000Z,Here.  Wear this bright red hat to offset the obvious shame-stain on your partiality visible face as you jump the line and wear a mask to protect yourself from a disease to which you abandoned your constituents for almost a year.,,1341171341651660800
ssadek19,2020-12-21T23:59:00.000Z,"Last #COVID19 update for me for 2020 (I hope?) - of course, had to complete the year with a little bang:  Tarrant County reports 265 COVID-19 deaths went unreported during April-Nov. 2020. The latest  communityimpact.com/dallas-fort-wo …",https://x.com/hashtag/COVID19?src=hashtag_click https://t.co/heqYZ2Js1y,1341171341081391109
RegIsTired,2020-12-21T23:59:00.000Z,"Was she on the private jet flying back to Thunder Bay or in the Air Canada lounge without a mask when she wrote this?  I'd make an additional comment about the ""closed"" border actually being wide open, including Roxham Road, but I don't want to be called a racist.",,1341171341035233280
enobeno_,2020-12-21T23:58:59.000Z,mutated strain of Covid?? Naa whatt?!,,1341171339621707778
ZSymphonia,2020-12-21T23:58:59.000Z,Day 22 - Town/Village music. Clock Town - Koji Kondo (TLOZ: Majora's Mask).,,1341171339357523970
Taylor26Susan,2020-12-21T23:58:59.000Z,Rioting and Covid not a good mix at the moment our time will come,,1341171339244265472
parks_alan,2020-12-21T23:58:58.000Z,What was the science telling you when you were getting a hairdo w/o your mask?,,1341171335188328449
KOLUTZ1,2020-12-21T23:58:58.000Z,Sadly there’s no vaccine for stupid.,,1341171334089457669
footydelusion,2020-12-21T23:58:57.000Z,If you want some entertainment type “Jeremy Corbyn” into your twitter search bar and see how many basket cases think coronavirus wouldn’t have existed if he was PM,,1341171330700500994
planets_dying,2020-12-21T23:58:57.000Z,"Did they get it wrong? It seems they were brought in to prioritize money, they provided advice which allowed businesses to open during the busy Christmas shopping period which was the main priority of coming out of lockdown for the gov.",,1341171329777713153
FakeYou_Out_,2020-12-21T23:58:57.000Z,"Yeah in the uk if you have either a severe food, medicine or vaccines they advise against getting the vaccine !!!",,1341171328385216514
JTHEBIGP,2020-12-21T23:58:56.000Z,"I am sad for our future.  I go to work every single day, I have all year,every single day I have to ask somebody to put on a mask. Not only do I have to be concerned about my own safety but my families , people that work for me. If one person gets sick almost 15 people",,1341171327722516486
BarrysAddiction,2020-12-21T23:58:56.000Z,Already disappointed in Burgess. Attacking someone for trying to encourage others to get the vaccine? Come on.,,1341171327302922240
pejvak92,2020-12-21T23:58:56.000Z,"You just contradicted yourself in that statement, Mr. Brian Lilley. What baffles many of us is the stupidity behind the ""lockdown""!",,1341171327177265153
citamares,2020-12-21T23:58:56.000Z,something super creepy about seeing politicians posing and smiling while receiving the vaccine  x.com/SawyerHackett/ …,https://x.com/SawyerHackett/status/1341044105699332104,1341171326644416512
FishingSWFL,2020-12-21T23:58:56.000Z,@drsanjaygupta @NIAIDNews @ChrisCuomo Please offer some validity.   New Drug Completely Blocks Coronavirus Spread In 24 Hours  newsbreakapp.com/n/0Xvu34LO?s=a …,https://x.com/drsanjaygupta https://x.com/NIAIDNews https://x.com/ChrisCuomo https://t.co/yZIOFwPA4O,1341171326598459394
thinkpolca,2020-12-21T23:58:56.000Z,UPDATE: Lockdown to begin for all of Ontario on Boxing Day as cases soar in province  thinkpol.ca/2020/12/21/pre …,https://t.co/sERxhv4M7E,1341171325818208256
Monsteress,2020-12-21T23:58:56.000Z,Was excited to move country in January and live somewhere where the government actually know how to deal with a pandemic,,1341171325558288385
ENirenberg,2020-12-21T23:58:56.000Z,I guess what I'm saying is the hysteria of a new variant of uncertain significance on the part of the popular press confuses me.   Am I missing something or...?,,1341171325398904832
ENirenberg,2020-12-21T23:58:56.000Z,Like I guess it's true that the functional significance of the other mutations are not known but insofar as ORF8 seems to suppress MHC class 1 mediated antigen-presentation and seems to have a role in blunting interferon responses...,,1341171324639711232
yourboy_AK,2020-12-21T23:58:56.000Z,A new strand of COVID...,,1341171324027342853
bellaa_bluee,2020-12-21T23:58:56.000Z,my mon just got the vaccine which is tight cause her hospitals rules are if a person is positive but showing no symptoms they can :) still come :) in :) thank u alta bates :) very cool :),,1341171323897262080
aeb082917,2020-12-21T23:58:56.000Z,That's a possibility. Or more likely due to the testing of flu significantly decreasing to focus on COVID. And the reporting protocol has changed,,1341171323821813765
aspeller7575,2020-12-21T23:58:55.000Z,now match these depression cases vs state and cities that have restricted policies with regard to COVID.,,1341171323654074370
won_really,2020-12-21T23:58:55.000Z,It seems comms are in order. Vaccine = Arrests.   Operation Warp Speed = Military Op to facilitate Arrests?,,1341171322622230529
SheenBWorkn,2020-12-21T23:58:55.000Z,And yes we all went to get Covid tests ahead of time,,1341171322462855173
fact_covid,2020-12-21T23:58:55.000Z,"There’s a reference to around 90% of the cases being aged <60 but no breakdown has been provided.   If it is more transmissible then it could affect more children, but there’s nothing to suggest so far that they’d be any more susceptible than other groups:  assets.publishing.service.gov.uk/government/upl …",https://t.co/JIvd8YvARp,1341171321301037056
JeanBottari,2020-12-21T23:58:55.000Z,"Four years ago millions of Americans voted for you. With your lack of response and compassion with those suffering and who have died from covid, they voted against you. That's not Fake News. That's democracy! Pack your bags already!",,1341171320470552583
CedergrenJodene,2020-12-21T23:58:54.000Z,Thanks'  @AOC  you took a dose of the vaccine away from people like my mother who is 86 and much more vulnerable to covid.,https://x.com/AOC,1341171318365052931
steamywriters2,2020-12-21T23:58:54.000Z,Boris after he’s read a chapter of my #erotic #novel I wrote during #lockdown,https://x.com/hashtag/erotic?src=hashtag_click https://x.com/hashtag/novel?src=hashtag_click https://x.com/hashtag/lockdown?src=hashtag_click,1341171317987524608
_celia_bedelia_,2020-12-21T23:58:54.000Z,No. It’s a the yearly budget with the covid relief added.,,1341171317895262208
NoemVictimCount,2020-12-21T23:58:54.000Z,"And we thank rtump maggot #Covidkristi, w/o her insistence that “no mask, no social distance required” helped not only SD, but MN and other states to speedily & indiscriminately spread the friendly Covid-19 among the US population.  Your place in hell is ready BarbieNoem.",https://x.com/hashtag/Covidkristi?src=hashtag_click,1341171317601669120
evertonw,2020-12-21T23:58:54.000Z,Where did the WHO say they have know about this variant for months? Viruses constantly mutant. that fact is so constant you can track the international spread by looking at 'variants'!,,1341171316787994626
nic_nack95,2020-12-21T23:58:54.000Z,I really don’t like that tv shows are incorporating covid. I really don’t.,,1341171316599111682
BenjaminAD7,2020-12-21T23:58:54.000Z,"They've been pandering to the masses, with certain actors and knowledge of an African African creator of the vaccination. It's deception and manipulation with unproven science to back it...",,1341171315680665601
Brandon35248300,2020-12-21T23:58:53.000Z,"No, actually I stay pretty close to home and I do wear my mask because I can get fired if I don't. The only thing I argue on here is against the folks begging and pleading for something that the CDC's own numbers show doesn't work all that well.",,1341171314493681667
healthygoddess5,2020-12-21T23:58:53.000Z,I’ll strive to do better. I needed a break from logging COVID deaths. I may not have been thinking clearly.,,1341171313533210626
PATRONDONJULIO1,2020-12-21T23:58:53.000Z,"+319,777 COVID-19 DEATHS, CONGRATULATIONS EVIL IDIOT IMPEACHED PRESIDENT",,1341171313210052608
BattleForBrita1,2020-12-21T23:58:53.000Z,"People went through worse in WW2 watching there relatives go off to die. Nightly bomings. Rationing, for six years. But they came together nuckled  down and eventually beat the enemy the Nazis (covid) Same thing a killer without prejudice. Boris is not the only leader to do this.",,1341171312803364865
loulou0706,2020-12-21T23:58:53.000Z,My son has had to isolate 3 times since September due to being near a child who tested positive and once with ALL the symptoms himself.His school have not had a single day since Sept where they haven’t had chn isolating due to COVID,,1341171312706895872
OreganoJeauxns,2020-12-21T23:58:53.000Z,What will we miss about the pandemic?  I know I'll miss reading pandemic fan fiction like this:,,1341171312530636800
ahjobslist,2020-12-21T23:58:53.000Z,Mateo (8 years old):  Hey Dad!  My mask still smells like turkey and stuffing!  Me:  Where did you find that mask?  Mateo:  In the kitty litter box  #calm_down_im_joking,https://x.com/hashtag/calm_down_im_joking?src=hashtag_click,1341171311305887744
3kConner,2020-12-21T23:58:52.000Z,If you still working and BEEN working throughout this pandemic..... tf you complaining about the $600 stimulus check for??,,1341171310878216192
Purge321,2020-12-21T23:58:52.000Z,"I personally don't care what you do bruh. Up to you how many times you get fined. Also up to ppl like you how long this lockdown continues. Keep fighting that ""noble"" fight",,1341171310592987139
RustyRevolver56,2020-12-21T23:58:52.000Z,Tanzania coronavirus kits raise suspicion after goat and pawpaw test positive  independent.co.uk/news/world/afr …   People look at this the Covid tests are rigged,https://t.co/scvtgZgQ0Y,1341171309246435328
villain_tiny,2020-12-21T23:58:52.000Z,"I try to read every single story about people that've died from COVID-19 cos it's really easy to forget that the massive statistic of 300,000 deaths is 300,000 lost *LIVES*.",,1341171308474880001
nysensepulveda,2020-12-21T23:58:52.000Z,"Hospitals in NY State are facing a severe blood shortage, and as COVID-19 cases rise statewide this shortage is becoming more and more critical. I stopped by the 42nd Precinct Blood Drive to donate blood today, and I’m challenging my fellow elected officials to #GiveBloodBX !",https://x.com/hashtag/GiveBloodBX?src=hashtag_click,1341171308307034113
RobertY28178586,2020-12-21T23:58:51.000Z,Please do NOT PASS this package of PORK you call a Covid Relief Package.  This is truly an insult to all Americans. #VetoTheBill  GENDER STUDIES - WTF!   @realDonaldTrump   @tedcruz   @JohnCornyn   @senatemajldr   @JudiciaryGOP   @GOP   UR lack of leadership,https://x.com/hashtag/VetoTheBill?src=hashtag_click https://x.com/realDonaldTrump https://x.com/tedcruz https://x.com/JohnCornyn https://x.com/JudiciaryGOP https://x.com/GOP,1341171306918768640
guelphman73,2020-12-21T23:58:51.000Z,"@bellcanada  At the height of a pandemic + looming lockdown, how is it okay to send these poor sales agents door to door right now peddling Cable TV and Internet?  Asking for a friend?  #fibe #bellfibe #bellcanada #idiocy #shameful #COVID19 #ontariolockdown #FordfailedOntario",https://x.com/bellcanada https://x.com/hashtag/fibe?src=hashtag_click https://x.com/hashtag/bellfibe?src=hashtag_click https://x.com/hashtag/bellcanada?src=hashtag_click https://x.com/hashtag/idiocy?src=hashtag_click https://x.com/hashtag/shameful?src=hashtag_click https://x.com/hashtag/COVID19?src=hashtag_click https://x.com/hashtag/ontariolockdown?src=hashtag_click https://x.com/hashtag/FordfailedOntario?src=hashtag_click,1341171306419646469
GaryALee68,2020-12-21T23:58:51.000Z,"@GillianHTurner ...As you know, anyone in a position of leadership should set the example for others to follow. The people should see their respective leaders get the vaccine.",https://x.com/GillianHTurner,1341171305257824257
JayWontLie2You,2020-12-21T23:58:51.000Z,"Scary as fuck sitting across the world reading the complacent obedience.   Literally a vaccine made in less than a year, that should be enough said.  violationtracker.goodjobsfirst.org/parent/astraze … violationtracker.goodjobsfirst.org/parent/pfizer",https://t.co/gOfXgKvFnJ https://t.co/8LjMdCx3n1,1341171305131864066
ssbs50,2020-12-21T23:58:51.000Z,Ya his own covid farts again,,1341171305043914753
queenspamala,2020-12-21T23:58:51.000Z,"Let’s be honest, they believe a hell of a lot of misinformation. “The election was rigged”, QAnon, fake pedophile ring beliefs. the deep state, anti-mask movements, Anti-Vaxx movements, Covid denial, red scare, “abolishing police”, seizure of guns, communism, “Soros” theories.",,1341171304934719488
