User_name,Datetime,Content,Links,Tweet_ID
fondo_Indela,2020-05-15T23:59:02.000Z,"It’s uncertain whether contact tracing apps will be effective in curbing the spread of the COVID virus. One thing that is certain, however, is that these apps are intensifying surveillance of the public.",,1261446022577840128
khodijahismail,2020-05-15T23:59:02.000Z,"Alhamdulillah finished. As participant of The Web Meeting entitled “Cyber Ethical Challenges of COVID-19” to be held on 12th May, 2020 from 2 pm to 3 pm CET, organized by Cyberlaw University alongwith  Globethics.Net Join Zoom Meeting us02web.zoom.us/j/87252382754? …",https://t.co/1gUikgg5f9 https://t.co/676LlsP0iL,1261446022045118464
RosarioYum,2020-05-15T23:59:02.000Z,This quarantine has me sad as a mf,,1261446021533569027
CleanGreenMLS,2020-05-15T23:59:02.000Z,Coronavirus Graphics  buff.ly/361JpDL #openforbusiness #disinfect with a #professional,https://t.co/BQeVAQEE4g https://x.com/hashtag/openforbusiness?src=hashtag_click https://x.com/hashtag/disinfect?src=hashtag_click https://x.com/hashtag/professional?src=hashtag_click,1261446020774297601
LFC_Radz,2020-05-15T23:59:02.000Z,I don't think they'll let me publish it haha. It's for a class I'm taking during COVID.,,1261446020380180486
GoodDaySac,2020-05-15T23:59:02.000Z,Coronavirus Hot Spot: Free Testing Now Offered By Appointment For Oak Park Residents  gooddaysacramento.cbslocal.com/2020/05/15/oak …,https://t.co/Bi6m8alVAJ,1261446020103237634
mdjonline,2020-05-15T23:59:02.000Z,"On April 28, the #Georgia National Guard provided sanitation and disinfection services to Heritage of Brookstone and Heritage of Sandy Plains, two Solvere Living senior living communities in #CobbCounty. #Business  mdjonline.com/cobb_business_ …",https://x.com/hashtag/Georgia?src=hashtag_click https://x.com/hashtag/CobbCounty?src=hashtag_click https://x.com/hashtag/Business?src=hashtag_click https://t.co/yuF8oboMB6,1261446019172241410
OnSignTV,2020-05-15T23:59:02.000Z,"As many aspects of the Out-of-Home industry battle to return to normal, take a look at those which have surprisingly blossomed.  buff.ly/2Z1ssrC",https://t.co/mYAuYzGHgt,1261446019042213894
DTPORGE,2020-05-15T23:59:02.000Z,(WOW!!!) 113-year-old Spanish woman overcomes coronavirus infection :  aol.it/2TbSpkt via  @AOL,https://t.co/0nGcdhUS5B https://x.com/AOL,1261446018983317509
_FerGM,2020-05-15T23:59:02.000Z,Just what i needed to brighten my quarantine.  Thanks  @caribouband    youtu.be/7N89-pSVfh0,https://x.com/caribouband https://t.co/BpJs1hWSqk,1261446018584854528
5NEWS,2020-05-15T23:59:01.000Z,CDC alerts doctors to childhood coronavirus-related syndrome:  bit.ly/3cD9Gui,https://t.co/B8keF1QftR,1261446017095831554
writeunfiltered,2020-05-15T23:59:01.000Z,"Quarantine has been strange. Millie has been thrilled to have me home more often, though. How are your #pets loving the #stayathome initiative?   #writingunfiltered #fridayafternoon #contentwriter",https://x.com/hashtag/pets?src=hashtag_click https://x.com/hashtag/stayathome?src=hashtag_click https://x.com/hashtag/writingunfiltered?src=hashtag_click https://x.com/hashtag/fridayafternoon?src=hashtag_click https://x.com/hashtag/contentwriter?src=hashtag_click,1261446017079218178
Ifyounoyuknow,2020-05-15T23:59:01.000Z,Look into why in 18 years we still don’t have a SARS vaccine.  ncbi.nlm.nih.gov/pmc/articles/P … Fast forward to “The application of animal models for vaccine development” if you don’t want to read this whole study and make your own conclusions.,https://t.co/rtU0PEYCGi,1261446016798097409
CarlySnyderMD,2020-05-15T23:59:01.000Z,COVID-19 Changed Our Jobs Overnight: 4 Ways To Grow From Hardship buff.ly/2WTabtF,https://t.co/VwfUnPfzi6,1261446015875526658
dbnak2putangina,2020-05-15T23:59:01.000Z,I don’t see why this is not mandatory? You can open up the country with some social distancing and protection.,,1261446015720153089
snddev,2020-05-15T23:59:01.000Z,"One in 10 restaurants has or will close for good because of COVID-19, according to the Texas Restaurant Association.  wfaa.com/article/news/e …",https://t.co/OXmPgEpUIV,1261446015284060160
Hannya_Umaru,2020-05-15T23:59:01.000Z,It’s the quarantine talking sis,,1261446014810099712
poonbot69,2020-05-15T23:59:00.000Z,"Quarantine craft, fashion, AND a fun drunken Olympic sport will be putting it on and taking it off. Simply hours of entertainment.",,1261446013606338560
ChristopherWr11,2020-05-15T23:59:00.000Z,Humans are not resources. Coronavirus shows why we must democratise work | Thomas Piketty and others  theguardian.com/commentisfree/ …,https://t.co/6QxxxGM2bB,1261446013522337794
jimmys_post,2020-05-15T23:59:00.000Z,"Amid lockdown, Subhash Bhowmick resumes coaching online  jimmyspost.com/amid-lockdown- …",https://t.co/nZglgNioJx,1261446012482269198
Hugh83204187,2020-05-15T23:59:00.000Z,Hillary Clinton calls armed Michigan lockdown protests 'domestic terrorism'   thehill.com/homenews/news/ …,https://t.co/KlXa2NMwi9,1261446011425300480
StarTribune,2020-05-15T23:59:00.000Z,"As part of its reorganization into Chapter 11 bankruptcy, troubled department store chain J.C. Penney said it will be shuttering some stores.   strib.mn/3fRKm63",https://t.co/sGBvjZeZCQ,1261446011320295424
NorthAmProject,2020-05-15T23:59:00.000Z,It’s not just pigs; farmers are also dumping fresh milk and destroying fresh vegetables. nytimes.com/2020/05/14/bus …,https://t.co/BUwlwGd8xH,1261446011135733760
fronterasdesk,2020-05-15T23:59:00.000Z,"All stores, including supermarkets and gas stations, will be shut down for 57 hours staring Friday night. @Jill_C_Ryan  reports. bit.ly/362chM1",https://x.com/Jill_C_Ryan https://t.co/jaHgWfnFoy,1261446011035287553
wcl_library,2020-05-15T23:59:00.000Z,When the research supports what you already know. New findings suggest reading books has surged in lockdown  bit.ly/3dQSjGQ via  @GuardianBooks,https://t.co/2a7btByP2n https://x.com/GuardianBooks,1261446011026698240
WNEMTV5news,2020-05-15T23:59:00.000Z,One local elementary school asked students to put their writing to the test in a positive way in midst of the COVID-19 pandemic.  wnem.com/news/local-ele …,https://t.co/SUnJrlPo5t,1261446010972319749
BetancesOwls,2020-05-15T23:58:59.000Z,Covid Support - DCF is providing families with a list of resources for you to use in this time of crisis.  Please feel free to reach out to them for any support you need.  edne.tw/n638211,https://t.co/cAj44zFZ6n,1261446009563090949
PaulHeatonSolo,2020-05-15T23:58:59.000Z,You're sort of right. I've got one of those Insect hotels in my backyard and I've had to close it because of the virus. The ants were the only ones who wouldn't respect the lockdown. Little bastards.,,1261446008455655425
Moncrief102,2020-05-15T23:58:59.000Z,"As US coronavirus death toll mounts, so does the belief by some that it is exaggerated  fxn.ws/3buezok #FoxNews of course the body count is exaggerated because the hospitals upcode to increase revenue",https://t.co/NwmsRLXWEW https://x.com/hashtag/FoxNews?src=hashtag_click,1261446007990054912
marmeaux,2020-05-15T23:58:59.000Z,"As of today, I know of two people I knew who died from the Coronavirus.    Why take chances?  It's not that hard to wear a mask.  You are protecting yourself and others.",,1261446006899535873
spicyspinelli,2020-05-15T23:58:59.000Z,Since quarantine my Gemini moon has taken over,,1261446005972754434
WSAV,2020-05-15T23:58:58.000Z,ONLY ON 3: COVID-19 Survivor talks about his journey one month after being released from the hospital   wsav.com/news/only-on-3 …,https://t.co/VC2tdM2GnF,1261446004735217665
tryinghard1234,2020-05-15T23:58:58.000Z,It's time to end zombie arguments against paid sick leave cnn.com/2020/05/15/opi …,https://t.co/hkaFjUUuUL,1261446004328378368
xscoutie,2020-05-15T23:58:57.000Z,Coronavirus Vaccince Czar Says Finding One by January Is a 'Credible' Goal - The New York Times  nytimes.com/2020/05/15/us/ …,https://t.co/7EOeqQbIPr,1261446001082204161
nescakes_,2020-05-15T23:58:57.000Z,Sugar waxed (myself) and honestly I may never go back to regular waxing after lockdown because WOW,,1261446000817909762
daniellerep93,2020-05-15T23:58:57.000Z,"This quarantine is probably a blessing in disguise for the ladies out there that have dirty eyelash extentions with mites that refuse to take a break from them. Listen to your esthetician, cosmetologist or hair dresser.. we went to school for a reason.",,1261446000360607745
hendyphilhendy,2020-05-15T23:58:57.000Z,BBC News - Coronavirus infection 'R' rate in UK creeps up  bbc.co.uk/news/health-52 …   Perhaps the Conga  line wasn't such a good idea,https://t.co/ihqUBDSbvW,1261445998439796737
stevesgirl56,2020-05-15T23:58:57.000Z,We will surpass WWI deaths - 116516 - by Memorial Day.  Affect of states reopening will kick in next week.,,1261445998204850177
charlamore,2020-05-15T23:58:57.000Z,"My favourite way of getting through lockdown life is baking with headphones in and petals for armour playing, whilst cracking out the awful dance moves and hoping my in laws don't see them (cause they're that bad)! Thank you for such an incredible album",,1261445997932281859
UntilIcanthink,2020-05-15T23:58:56.000Z,If they are preventative why do so many vaccinated people get the virus that the vaccine was supposed to prevent?,,1261445996707319809
vrb1955,2020-05-15T23:58:56.000Z,Pandemic restrictions to ease in 12 more Pennsylvania counties   6abc.com/politics/pande … via  @6abc,https://t.co/mNCZQj6CnY https://x.com/6abc,1261445995847655425
post_asia,2020-05-15T23:58:56.000Z,Coronavirus: Lloyd’s of London says claims to be biggest since 9/11  postofasia.com/coronavirus-ll …,https://t.co/kde8wdteXO,1261445995759456256
guardian,2020-05-15T23:58:56.000Z,Research finds reading books has surged in lockdown,,1261445995461701632
post_asia,2020-05-15T23:58:56.000Z,Coronavirus: Should furloughed workers offer their skills for free?  postofasia.com/coronavirus-sh …,https://t.co/APZSYjnB5G,1261445995306651648
HoopCoachHogue,2020-05-15T23:58:56.000Z,Are you really trying to pub a tourney during a pandemic?,,1261445994522312710
halfeatenmind,2020-05-15T23:58:56.000Z,"HarpersBAZAAR.com: Queen Elizabeth Is in ""Excellent Spirits"" Riding Horses Every Day During Quarantine. harpersbazaar.com/celebrity/late …  via  @GoogleNews",https://t.co/2OuU5lpCx8 https://t.co/t5U54znHfd https://x.com/GoogleNews,1261445993951899648
Ada_Agina,2020-05-15T23:58:55.000Z,Ingenious! Much like school feeding when the country is on lockdown.,,1261445993163182080
sylivialove,2020-05-15T23:58:55.000Z,I feel like the first vaccine they come out with is going to be faulty and kill a lot of people,,1261445993066672132
RonPatton1,2020-05-15T23:58:55.000Z,"BBC News - Coronavirus infection 'R' rate in UK creeps up  bbc.co.uk/news/health-52 … Health secretary Matt Hancock said the R-number was an ""incredibly important figure"" and it was important to note ""we don't THINK that it is above one"". Oh dear, here comes the denial and deceit.",https://t.co/MWoA105AjS,1261445992945074177
samcac509,2020-05-15T23:58:55.000Z,And where was he during the first 2 months of the pandemic? Home on vacation! What an act this is!!!,,1261445991925862400
Redroadmaster,2020-05-15T23:58:55.000Z,"President Trump weighed-in Friday on the nation’s effort to safely re-open the country during C-19 chaps saying “vaccine or no vaccine, we are back, and starting the process.",,1261445991879729153
otaovil24,2020-05-15T23:58:55.000Z,In 1962 an Italian magazine ran a story on what the world would look like in 2022.  #COVID19 #QuarantineLife #Coronavirus,https://x.com/hashtag/COVID19?src=hashtag_click https://x.com/hashtag/QuarantineLife?src=hashtag_click https://x.com/hashtag/Coronavirus?src=hashtag_click,1261445991468679169
Johnboy_Cook,2020-05-15T23:58:55.000Z,For reasons I won’t go into I’ve felt angry and disappointed for the last couple of days.  Wondering why the hell I bother keeping up lockdown when those for whose benefit I’m primarily doing it effectively throw it back in my face.  Genuinely had it to here.,,1261445991099592704
GeorivistaNews,2020-05-15T23:58:55.000Z,Coronavirus: Should furloughed workers offer their skills for free? #business #coronavirus #economiccondition #economy #free #furloughed #... georivista.com/2020/05/15/cor …,https://x.com/hashtag/business?src=hashtag_click https://x.com/hashtag/coronavirus?src=hashtag_click https://x.com/hashtag/economiccondition?src=hashtag_click https://x.com/hashtag/economy?src=hashtag_click https://x.com/hashtag/free?src=hashtag_click https://x.com/hashtag/furloughed?src=hashtag_click https://t.co/fDxiOLXeec,1261445989753327616
TreysonV,2020-05-15T23:58:55.000Z,Contact Tracing : Here They Come! Will You Let Them Take Your Family?!  youtu.be/I1sefJp4NkQ via  @YouTube  #BigBrother2020 #SurveillanceState #privacy #tyranny #COVIDIOTS #propaganda,https://t.co/U9ShkpO5f3 https://x.com/YouTube https://x.com/hashtag/BigBrother2020?src=hashtag_click https://x.com/hashtag/SurveillanceState?src=hashtag_click https://x.com/hashtag/privacy?src=hashtag_click https://x.com/hashtag/tyranny?src=hashtag_click https://x.com/hashtag/COVIDIOTS?src=hashtag_click https://x.com/hashtag/propaganda?src=hashtag_click,1261445989438828547
alexia_hugh,2020-05-15T23:58:55.000Z,GMC Hummer and Cadillac Lyriq EVs on schedule despite pandemic  Mmhmm so I was right about a repeat in the automotive industry . War games . Etc.  flip.it/xGUJey,https://t.co/jQLopjf6Vl,1261445989421858818
gofarinshinycar,2020-05-15T23:58:55.000Z,Pro lifers wya??? We need you lobbying to maintain the economy closed so people don't keep dying of covid.,,1261445989245825024
Paisano,2020-05-15T23:58:54.000Z,This panic pandemic is creating new social circles Thanks #Coronavirus,https://x.com/hashtag/Coronavirus?src=hashtag_click,1261445984971702272
Shantha74969296,2020-05-15T23:58:53.000Z,@CPBlr  Bcz of lockdown no coaching classes so she didn't to pg. One day also she didn't stay in pg but they asked for full rent but we paid for three months sir (12500Rs *3).Now the classroom won't be there they are telling so we told Pg owner that we want to vacate.,https://x.com/CPBlr,1261445984069881857
ckaratnytsky,2020-05-15T23:58:52.000Z,"#SudanUprising   15 May 2020  ""Dr. Mohammed Naji Al-Assam joins volunteer #doctors in support of our white army in the fight against the corona epidemic.""",https://x.com/hashtag/SudanUprising?src=hashtag_click https://x.com/hashtag/doctors?src=hashtag_click,1261445980337123333
leeannimalWY,2020-05-15T23:58:52.000Z,U.S. can't afford to take its eye off the ball as national threats loom beyond COVID-19  washingtontimes.com/news/2020/may/ …,https://t.co/iY3NJuDFVx,1261445977384333312
FutureLifeInLA,2020-05-15T23:58:51.000Z,Niggas really have some nerve trynna holla when i have a mask on,,1261445976025231361
NuttSoOutlaw,2020-05-15T23:58:51.000Z,"Celebrity Cole Clothing"" #outlaw #distrik Face mask Available in different colors order Now!! celebritycoleclothing@gmail.com #nuttsotheoutlawdon #nuttysoprano #seangotti #seancoletheoutlaw  instagram.com/p/CAOlE3upW8I/ …",https://x.com/hashtag/outlaw?src=hashtag_click https://x.com/hashtag/distrik?src=hashtag_click https://x.com/hashtag/nuttsotheoutlawdon?src=hashtag_click https://x.com/hashtag/nuttysoprano?src=hashtag_click https://x.com/hashtag/seangotti?src=hashtag_click https://x.com/hashtag/seancoletheoutlaw?src=hashtag_click https://t.co/LyM5cAWdWC,1261445975882608640
PremierPolitics,2020-05-15T23:58:51.000Z,"They painted social distancing circles at Domino Park, as if it don’t be your own people...",,1261445975719112704
khew27x,2020-05-15T23:58:51.000Z,@SHAQ  only if i had Penny’s on  dont worry my mask it by my side once im out of my bubble,https://x.com/SHAQ,1261445975580618753
HosamNews,2020-05-15T23:58:51.000Z,BBC News - Coronavirus vaccine: Macaque monkey trial offers hope bbc.co.uk/news/health-52 …,https://t.co/Qb1NGboCQ7,1261445975089922048
ACommonSenseWay,2020-05-15T23:58:51.000Z,"God help us, and not one of them with a mask   x.com/mbracemoore/st …",https://x.com/mbracemoore/status/1261395283025502215,1261445974972608513
brownpeter,2020-05-15T23:58:51.000Z,"Hey  @saskboy  . Nice to see small SK town mentality. I, too, was raised on the prairies, Pumphandle SK, and I’m locked down in isolation in Saskatoon.  Vaccine please!",https://x.com/saskboy,1261445974909575168
JJ_Harvill,2020-05-15T23:58:51.000Z,And just like that - the world changed.  ⁦ @nytimes ⁩   nytimes.com/2020/05/15/us/ …,https://x.com/nytimes https://t.co/0PuCAPSeOZ,1261445973810663424
DonPstar,2020-05-15T23:58:51.000Z,"Up next on Quarantine Rewatch: Snow Day. A fun early 2000s Nickelodeon joint.  PS Claire Bonner, <nudge> amirite",,1261445973525463040
WhatstrumpuptoW,2020-05-15T23:58:51.000Z,[] Donald Trump vows to deliver coronavirus vaccine by year-end #FinancialTimes #DonaldTrump  whatstrumpupto.wtf,https://x.com/hashtag/FinancialTimes?src=hashtag_click https://x.com/hashtag/DonaldTrump?src=hashtag_click https://t.co/DyKLpWAu1L,1261445973412155395
MechDara1,2020-05-15T23:58:51.000Z,"A ban on online gaming towards the end of last year followed by the emergence of Covid-19 as a pandemic has not boded well for the real estate market in Sihanoukville, which has gone from boom to bust, local news",,1261445972866953216
irliteach,2020-05-15T23:58:50.000Z,"We have family coming into town for the weekend. We don't know what kind of social distancing they've done. We do know that semi-regularly see people who are going to restaurants, etc. AITA if I don't want to spend time with them?",,1261445972137295873
kirstkorks,2020-05-15T23:58:50.000Z,my dad is watching 8 mile for the seventh time this quarantine,,1261445971931590657
thesummatime,2020-05-15T23:58:50.000Z,"No testing, no epidemic!",,1261445971776376834
MarikoTatenda,2020-05-15T23:58:50.000Z,If i my ask you  @ZANUPF_Official  if ths ladies wre faking hw dd thy managed to end up in Bindura frm Warren park coz with the current lockdown transport blues t me 1 its impsble 2 wth the number of blocs in our rds during this lokdwn you cant go far unles police ar slpng on duty,https://x.com/ZANUPF_Official,1261445971436855304
DanGarrett97,2020-05-15T23:58:50.000Z,The #CCP/#CPC has a lot more reasons than just timing & reputational damage. But every country has a #natsec reason to have their own investigation into the #pandemic that #Xi let loose on the world - & the regime's actions after the outbreak was declared.  #covid19 #coronavirus,https://x.com/hashtag/CCP?src=hashtag_click https://x.com/hashtag/CPC?src=hashtag_click https://x.com/hashtag/natsec?src=hashtag_click https://x.com/hashtag/pandemic?src=hashtag_click https://x.com/hashtag/Xi?src=hashtag_click https://x.com/hashtag/covid19?src=hashtag_click https://x.com/hashtag/coronavirus?src=hashtag_click,1261445971369537537
ThemDems,2020-05-15T23:58:50.000Z,Is it morbid or inappropriate for me to wonder how many trumpet voters have perished from COVID? How will this effect our chances at the ballot box  This is the only time I hope they have outnumbered us.,,1261445970543497219
AlArabiya_Eng,2020-05-15T23:58:50.000Z,#Coronavirus: A three-Michelin-star restaurant in the #US has seated mannequins dressed in 1940’s-style attire to “add a touch of whimsy” and help with social distancing when customers return for indoor dining later this month. english.alarabiya.net/en/coronavirus …,https://x.com/hashtag/Coronavirus?src=hashtag_click https://x.com/hashtag/US?src=hashtag_click https://t.co/kxvgIGhnid,1261445969628917760
tryinghard1234,2020-05-15T23:58:50.000Z,One of the world's best restaurants to return as a wine bar cnn.com/travel/article …,https://t.co/c83UUkA3PH,1261445969528238080
BetsyBasset,2020-05-15T23:58:50.000Z,FYI: Dozens more children in US reported to have developed  potentially lethal inflammatory syndrome that may be linked to coronavirus infections. New York governor confirmed at least 100 children had been diagnosed in NY including 3 who died. 2 died in uk...,,1261445969440321536
DavidFox_Canada,2020-05-15T23:58:50.000Z,Interesting to see you are focusing on things other than the death and misery in Long Term Care in #Ontario! #COVID19 #onpoli  globalnews.ca/news/6950440/c …,https://x.com/hashtag/Ontario?src=hashtag_click https://x.com/hashtag/COVID19?src=hashtag_click https://x.com/hashtag/onpoli?src=hashtag_click https://t.co/H2WMYkNyJi,1261445969331326977
_drethedj,2020-05-15T23:58:50.000Z,"Parents, aunt & uncle finally beat COVID  gracias a dios",,1261445969226240001
jordanlhr_,2020-05-15T23:58:50.000Z,Covid 19 ain’t got nothing on you,,1261445968656023552
its4zahoor,2020-05-15T23:58:50.000Z,@kafilaslam  @Babbarakhan  not to shut him but to use his expertise.  @Pansota1  does Pak Law/Const allow such flexibility? euronews.com/2020/03/20/cor …,https://x.com/kafilaslam https://x.com/Babbarakhan https://x.com/Pansota1 https://t.co/UAGZLNETMs,1261445968618090497
TheNigerianBar,2020-05-15T23:58:49.000Z,COVID-19: Stranded Nigerians returning from abroad to pay for their 2 weeks quarantine  barristerNG.com/covid-19-stran …,https://t.co/4CgayxpuCk,1261445968081432576
alexia_hugh,2020-05-15T23:58:49.000Z,Forestry Ink: News of softwood lumber agreement lost amid COVID crisis - Quesnel Cariboo Observer  Mmhmm thankyou  flip.it/Zh5Mng,https://t.co/ryV8qujN7z,1261445967833739264
sir_mx_a_lot_,2020-05-15T23:58:49.000Z,I’ve been to the dispensary almost as much as the grocery store during this pandemic,,1261445965686304769
DavisLilian,2020-05-15T23:58:49.000Z,"J.C. Penney files for Chapter 11 bankruptcy, plans store closings #SmartNews   usatoday.com/story/money/20 …",https://x.com/hashtag/SmartNews?src=hashtag_click https://t.co/jOEQruHeMo,1261445965648666624
WhoDatDiva016,2020-05-15T23:58:49.000Z,I know who tf ain’t WE.....me. He can go to hell. It’s no way I’d take any vaccine hurried & rolled out by his regime.  Nope. I’ll take my chances with the virus before that happens.,,1261445965317173248
ianbodgerbrown,2020-05-15T23:58:49.000Z,Healthcare Workers Appalled as Trump Says Nurses 'Running Into Death' to Treat Covid-19 Patients Is 'A Beautiful Thing to See'. Another Word Salad from  @realDonaldTrump  - The Fool on the Hill - go.shr.lc/2X1QD6z via  @commondreams,https://x.com/realDonaldTrump https://t.co/mH0fs6MDdn https://x.com/commondreams,1261445964826472449
LallyBH,2020-05-15T23:58:49.000Z,"Under cover of coronavirus, the world's bad guys are wreaking havoc | Jonathan Freedland  theguardian.com/commentisfree/ …",https://t.co/BQ30mRqDYe,1261445964486905856
Whogrigasked,2020-05-15T23:58:48.000Z,"Wonder if Obama foresaw this and 'tapped the lines' to spy on - in attempts of overthrowing - this above board collection of 'patriots', further covering failed Covid-19 tests his admin intentionally left Trump? Or they're all getting info to bring back to WH upon 'discovery'.",,1261445962712494080
vkivlighan,2020-05-15T23:58:48.000Z,"@GovernorVA  @VDHgov  Why is the Central Shenandoah District in Phase 1, re: hot spot along I-81 w a combined case count of 1008? (Harrisonburg/Rockingham) Staunton cases doubled this wk. As people move thru state - more are at risk. #COVID19 #coronavirus  vdh.virginia.gov/coronavirus/",https://x.com/GovernorVA https://x.com/VDHgov https://x.com/hashtag/COVID19?src=hashtag_click https://x.com/hashtag/coronavirus?src=hashtag_click https://t.co/GxfcdSRh7o,1261445962553311232
newt0twitt,2020-05-15T23:58:48.000Z,"@KristiNoem - after but 4 months in office- has, for the sake of her donors, gravely imperiled   @southdakota ’s tourism, the nation’s food supply, and the lives of her constituents. washingtonpost.com/national/south …",https://x.com/KristiNoem https://x.com/southdakota https://t.co/fA3yHL7mXE,1261445962419122181
jackisabharwal,2020-05-15T23:58:48.000Z,And no mask,,1261445962314084352
GDeCoast,2020-05-15T23:58:48.000Z,You need a bigger mask.,,1261445961995309056
lyonsnyc,2020-05-15T23:58:48.000Z,"Atlantic staffers pick books that will resonate during a summer of social distancing, including titles by Yoko Ogawa, R. Eric Thomas, Shirley Hazzard, and more:  theatlantic.com/culture/archiv …",https://t.co/04TAtl97ew,1261445961991118848
heeeyitsjp,2020-05-15T23:58:48.000Z,Thankyou for making our quarantine life meaningful!!   #คั่นกูตอนจบ #2getherTheSeries #2getherTheSeriesep13,https://x.com/hashtag/%E0%B8%84%E0%B8%B1%E0%B9%88%E0%B8%99%E0%B8%81%E0%B8%B9%E0%B8%95%E0%B8%AD%E0%B8%99%E0%B8%88%E0%B8%9A?src=hashtag_click https://x.com/hashtag/2getherTheSeries?src=hashtag_click https://x.com/hashtag/2getherTheSeriesep13?src=hashtag_click,1261445961781370880
Gary31234472,2020-05-15T23:58:48.000Z,You realize that Trump isn’t making the vaccine and it’s trusted doctors. I don’t understand people. It’s like you think that Trump is single handedly doing everything. Also I’m not going to argue with you so bye.,,1261445960778919936
CourtShizzzle,2020-05-15T23:58:48.000Z,I still think quarantine is dumb and everyone that willingly supports it is dumb  like there was no other option for us to do lmaooo,,1261445960455950337
ourboldhero,2020-05-15T23:58:48.000Z,"Quarantine may feel isolating for some, but I feel like I've gotten closer to my best friend (the woman who's toasting in the opening credits when the Cheers logo appears)",,1261445959961190400
AMIMC8,2020-05-15T23:58:47.000Z,Covid-19 severo nejm.org/doi/full/10.10 …,https://t.co/pGNBW4Qmd6,1261445959470333958
Epijobs,2020-05-15T23:58:47.000Z,"Contact Tracing-Epidemiologist Generalist Various Locations, TX      #Epijobs governmentjobs.com/careers/housto … … …",https://x.com/hashtag/Epijobs?src=hashtag_click https://t.co/OflUVaAygZ,1261445959298412544
