User_name,Datetime,Content,Links,Tweet_ID
clubbaseatpitt,2020-03-22T23:59:34.000Z,"Since real baseball is on hold, we’re going virtual with some of the fine folks in the NCBA!   Follow as we try to win Pool H and advance to the playoffs. Games can be streamed live or replayed on Twitch (PCB_Baseball) for some quarantine entertainment.   #PCB // #VirtualVictory",https://x.com/hashtag/PCB?src=hashtag_click https://x.com/hashtag/VirtualVictory?src=hashtag_click,1241877208035139587
suzyveale,2020-03-22T23:59:33.000Z,#Coronavirus treatment trials in New York to begin on Tuesday. Governor Cuomo says he is “optimistic”.    forbes.com/sites/lisettev …,https://x.com/hashtag/Coronavirus?src=hashtag_click https://t.co/kpypof5uc4,1241877207233867779
MaxJReyes,2020-03-22T23:59:33.000Z,Me to my parents after moving home during a global pandemic,,1241877207137517568
powerFPC,2020-03-22T23:59:33.000Z,"New biometric crypto smartcard wallet from CardLab and eSignus features Fingerprint Cards sensor   SmartMetric, supply line issues from the Covid-19 outbreak delaying the final manufacturing. To be delivered to partners within 30 days for presentation  biometricupdate.com/202003/new-bio …",https://t.co/s8igvCyygq,1241877207099805698
GStanley71,2020-03-22T23:59:33.000Z,Viruses we don't have a vaccine for:  AIDS Hepatitis Herpes Chickenpox The Common Fucking Cold  Don't hold your breath for vaccines.,,1241877206424408065
msnygaard,2020-03-22T23:59:33.000Z,This is beyond stupid. Rand Paul couldn’t even take covid 19 serious enough to isolate himself. Unbelievable.,,1241877206382632961
Diamond433,2020-03-22T23:59:33.000Z,"Maryland 1st Grader Cavanaugh Bell, 7, Uses $600 of his Savings to Make Covid-19 Care Packages for Seniors  goodblacknews.org/2020/03/21/mar … via @goodblacknews",https://t.co/w6RwBQ3JFH,1241877206240055297
lori10habs,2020-03-22T23:59:33.000Z,This is very impressive from  @dillonsdistills  and I can vouch for their Cherry Gin as an excellent social distancing companion.,https://x.com/dillonsdistills,1241877205086547968
karebear575,2020-03-22T23:59:33.000Z,"You need to #lockdownmichigan  youtube.com/watch?time_con … Our hospitals are going to be over run anyway, even WITH a lockdown. Not locking down just makes it worse. We need more ICU capacity & PPE now.",https://x.com/hashtag/lockdownmichigan?src=hashtag_click https://t.co/8EMdpp1Tft,1241877203941539840
irizarry_colby,2020-03-22T23:59:32.000Z,"Nothing. The Coronavirus is scarring everyone.  It ain't about you. Stay healthy, jerk off.",,1241877203274645506
jayd_an,2020-03-22T23:59:32.000Z,Weinstein didn't die from coronavirus,,1241877202523701249
twsp_com,2020-03-22T23:59:32.000Z,Senate fails to move forward with coronavirus 'Phase 3' bill amid Dems' opposition -  e-news.us/senate-fails-t …,https://t.co/9KaSmtGNrJ,1241877202096054279
LabergeScott,2020-03-22T23:59:32.000Z,Having a hard time equating this to social distancing,,1241877201550741509
bobh2121,2020-03-22T23:59:32.000Z,Look at this news article from The Daily Caller: FLASHBACK Jan. 14: WHO Tells Everyone Don’t Worry Because China Says Coronavirus Isn’t Contagious  dailycaller.com/2020/03/18/fla …,https://t.co/8ihDJqx7XM,1241877201445957636
im_imran07,2020-03-22T23:59:32.000Z,Social Distancing  @SrBachchan,https://x.com/SrBachchan,1241877201387126789
Boredofwheels,2020-03-22T23:59:32.000Z,"Okay Paul, let's not kill our economy let people go back to work, let pubs and restaurants reopen and get back to normal, let's also kill the NHS whilst were doing this because  that is what will happen as it will collapse under the strain of treating those infected with COVID-19  t.co/KRTEBM3aoF",https://t.co/KRTEBM3aoF,1241877201332682753
grembo_zavia,2020-03-22T23:59:32.000Z,"Wait so, people's concern about the quarantine in China was that it was aUtHoRiTaRiAn? Do those people know what a responsible government looks like?",,1241877201005445121
aileenkelly40,2020-03-22T23:59:32.000Z,"Call me suspicious. But, Harvey is supposed to be away from the general population. I wonderful how he contracted coronavirus.",,1241877200795770882
carol_souza30,2020-03-22T23:59:32.000Z,honestly I can’t wait til this whole COVID-19 is over bc I can’t be home anymore .. I mean I know my friends are gonna invite me out and I’m going to be flaky but at least I know there’s something out there to do.,,1241877200703545344
MintyMangoJobs,2020-03-22T23:59:32.000Z,Coronavirus Threatens More Than 15 Million US Hospitality Jobs  dlvr.it/RSMp9c,https://t.co/DsxQOO40mX,1241877200673976321
Psyysexx,2020-03-22T23:59:32.000Z,"Ok, this Quarantine has made me extra horny ....",,1241877200242016258
Jo_Filan,2020-03-22T23:59:32.000Z,Boris Johnson: Supporting an Emergency Universal Basic Income during the Coronavirus Crisis - Sign the Petition!  chng.it/Fc6yYztJ via  @UKChange,https://t.co/tk0CxwBjfa https://x.com/UKChange,1241877200212824065
Richboxingbets,2020-03-22T23:59:32.000Z,vox.com/world/2020/3/1 …  'The CSO suggested allowing the coronavirus to spread to build immunity.',https://t.co/Yxf8xWniVa,1241877200191840256
zaid__munir,2020-03-22T23:59:32.000Z,High Temperature and High Humidity Reduce the Transmission of COVID-19 (Coronavirus).  #CoronaFreePakistan #COVID19outbreak #CoronavirusPandemic #COVID2019  papers.ssrn.com/sol3/Papers.cf …,https://x.com/hashtag/CoronaFreePakistan?src=hashtag_click https://x.com/hashtag/COVID19outbreak?src=hashtag_click https://x.com/hashtag/CoronavirusPandemic?src=hashtag_click https://x.com/hashtag/COVID2019?src=hashtag_click https://t.co/MN1WRlgZLT,1241877199696904205
bloodyexhausted,2020-03-22T23:59:31.000Z,18-year-old 'youngest' to die in UK as fatalities rise by 48 to 281 news.sky.com/story/coronavi …,https://t.co/I0tPeAuKjj,1241877199545868289
dianemo87846011,2020-03-22T23:59:31.000Z,Paris No-Go Zone Police Overwhelmed Attempting to Enforce Quarantine  breitbart.com/europe/2020/03 …,https://t.co/dzz0eGHUR6,1241877199378137088
StefanVersusTex,2020-03-22T23:59:31.000Z,"Beginning at 11:59 pm Monday,  @DallasCountyTx  residents are under 'shelter-in-place' orders. The first in Texas. @JudgeClayJ   star-telegram.com/news/coronavir …",https://x.com/DallasCountyTx https://x.com/JudgeClayJ https://t.co/CsaNB5vHWp,1241877198723846147
loyyang28,2020-03-22T23:59:31.000Z,Re: Virusgate...  Did someone let Andrew Simonds back into India?? m.hindustantimes.com/india-news/cor …,https://t.co/0xHMHvpdMF,1241877198522298369
mobilenova,2020-03-22T23:59:31.000Z,I found it earlier. But it's not clear what's going on vic.gov.au/coronavirus-st …,https://t.co/feAnxljNNg,1241877198518149120
sarahmcdaid26,2020-03-22T23:59:31.000Z,I think something that we can all take away from #COVID19 is that Donegal people have no time for muckers littering their beaches... And Derry wans think that that's their right because Donegal people buy groceries in Sainsbury.. #COVIDIOTS #COVIDー19 #coronavirus #StayAtHome,https://x.com/hashtag/COVID19?src=hashtag_click https://x.com/hashtag/COVIDIOTS?src=hashtag_click https://x.com/hashtag/COVID%E3%83%BC19?src=hashtag_click https://x.com/hashtag/coronavirus?src=hashtag_click https://x.com/hashtag/StayAtHome?src=hashtag_click,1241877198316978176
graciepam,2020-03-22T23:59:31.000Z,COVID-19 UPDATE: Gov. Justice: “I am trying with all in me to allow our state to be successful in defeating this disease”:  mailchi.mp/wv/covid-19-up …. #SHUTWVDOWN,https://t.co/p1GCyaqzJb https://x.com/hashtag/SHUTWVDOWN?src=hashtag_click,1241877198035959811
erinhale,2020-03-22T23:59:31.000Z,As a recent resident of Hong Kong it’s kind of frustrating watching US media praise the government for its response to coronavirus - it was really citizens who shut it down *in spite* of the government which was very slow to respond. It could have done a much better job.,,1241877197926723584
errbodyhatesJRO,2020-03-22T23:59:31.000Z,Ski mask on guess we robbin’,,1241877197834588160
90DayFckery,2020-03-22T23:59:31.000Z,"Tonight's mood.  Quarantine, #90Dayfiance and chill.  #90dayfiancebeforethe90days",https://x.com/hashtag/90Dayfiance?src=hashtag_click https://x.com/hashtag/90dayfiancebeforethe90days?src=hashtag_click,1241877197671075841
Kevonis1,2020-03-22T23:59:31.000Z,Watch voodookrystal with me on Twitch! She is crazy good at this game! #TheDivision2 #Epidemic #gamergirl #gamersvsCOVID19 #gamergirls,https://x.com/hashtag/TheDivision2?src=hashtag_click https://x.com/hashtag/Epidemic?src=hashtag_click https://x.com/hashtag/gamergirl?src=hashtag_click https://x.com/hashtag/gamersvsCOVID19?src=hashtag_click https://x.com/hashtag/gamergirls?src=hashtag_click,1241877197591392256
wittyhippie,2020-03-22T23:59:31.000Z,"About to cancel all my current subscriptions, since I’m about to be poor!  a possible 12 week quarantine minimum?!",,1241877196060479489
safuwanpk,2020-03-22T23:59:31.000Z,"#COVIDー19 and applicable laws.  Setion 269, 270 & 271 of Indian Penal Code those who are disobeying to quarantine rule and negligent act to spread infection of disease. Also provisions under Disaster Management Act 2005. #AndamanFightsCorona  #COVIDー19",https://x.com/hashtag/COVID%E3%83%BC19?src=hashtag_click https://x.com/hashtag/AndamanFightsCorona?src=hashtag_click https://x.com/hashtag/COVID%E3%83%BC19?src=hashtag_click,1241877196009922561
dvel86,2020-03-22T23:59:31.000Z,"This coronavirus is hindering my sex life, I'm only having sex with the husband.",,1241877195661819904
MikeyJusGlo,2020-03-22T23:59:31.000Z,We on lockdown till April 3 ?,,1241877195615764482
koozyozyo,2020-03-22T23:59:31.000Z,Tomorrow??? Well quarantine ain’t gonna boring anymore we love to see it,,1241877195519393792
Shoq,2020-03-22T23:59:31.000Z,"Well, it took 3 hours of googling, but I found a domestic supplier of a braided cord that surgical mask ear loops could be made of (actual chinese made mask cord is totally out). Now, can they deliver in the quantities needed? I sure hope they rise early in Indiana.",,1241877195410345985
SulymanBashirat,2020-03-22T23:59:30.000Z,"Asa's Lucid album is underrated   Meanwhile don't forget to sit in your house, don't even try to waka jẹjẹ,,, this is the time some of us show off our skills in social distancing...yunno",,1241877195104178184
FleurBaladine71,2020-03-22T23:59:30.000Z,It’s obvious that people cannot observe social distancing guidance (not rules) so why the f**k doesn’t he do more now? #torygenocide #ToryShambles,https://x.com/hashtag/torygenocide?src=hashtag_click https://x.com/hashtag/ToryShambles?src=hashtag_click,1241877194651119616
MOTHERSMILK310,2020-03-22T23:59:30.000Z,Day 3 of quarantine rap like  @CurrenSy_Spitta  zine.la/article/61760e …,https://x.com/CurrenSy_Spitta https://t.co/kRLK9PanAG,1241877194122629121
tg_pix,2020-03-22T23:59:30.000Z,In attempt to make my dad take social distancing seriously I told him he “won’t be laughing when the hospital has no vibrators left” for him.,,1241877194072260609
dgmroz,2020-03-22T23:59:30.000Z,Daily reminder: Covid-19 began in Wuhan China in late November 2019. The Chinese Communist Party actively worked to cover up the ferocity of transmission of the virus. The WHO assisted the CCP hiding the true extend of the virus from the rest of the world until January 2020.,,1241877193892007939
jennstar33,2020-03-22T23:59:30.000Z,@JulianLennon    Africa's mountain gorillas also at risk from coronavirus  wgme.com/news/coronavir …,https://x.com/JulianLennon https://t.co/DzZB8zrfTL,1241877193669697547
Robynneleighe,2020-03-22T23:59:30.000Z,It must be nice to be so insulated by your wealth your only concern during a pandemic is passing a bill that gives bailout funding to corporations & donors with no strings attached & nothing for the people that built your corporations or a health system on the verge of collapse.,,1241877193388462080
HarvelaHarvey,2020-03-22T23:59:30.000Z,WATCH: Anti-Semitic Sermon in New York Links Coronavirus to Jews | United with Israel  unitedwithisrael.org/watch-coronavi …,https://t.co/ao40L3M782,1241877193313013761
blindwray,2020-03-22T23:59:30.000Z,Quarantine and Chill. Come Talk!,,1241877193246081032
HindustanTimes,2020-03-22T23:59:30.000Z,"As coronavirus cases surge in India, 40,000 ventilators for 1.3bn people a worry hindustantimes.com/india-news/as- …",https://t.co/6M5RChIZYC,1241877193170366465
KastenLizzy,2020-03-22T23:59:30.000Z,How am I supposed to kiss the homies goodnight if I’m in quarantine,,1241877192935686145
HumeralO,2020-03-22T23:59:30.000Z,"If you have the AUDACITY to think for even a nanosecond that I am spending any of my my precious precious time during this global pandemic studying anything medically related, then you are UTTERLY and ABSOLUTELY correct because I am at the mercy of a 3-digit number",,1241877192642048006
hiitsrenaC,2020-03-22T23:59:30.000Z,all the people so many people in quarantine,,1241877192243544065
King_Mike231,2020-03-22T23:59:29.000Z,"The got curfew (martial law pretty much) in California, New York, Connecticut, New Jersey and the city of Dallas is going on “quarantine lockdown” People talking about what the government can and cannot do. They can do whatever they damn well please.",,1241877191014715402
nuttyshe11,2020-03-22T23:59:29.000Z,Well the grundnorm has shifted. The election will be on one issue who Phillips or Holness is best able to restore the economy to growth after the ravages of covid 19,,1241877190788165633
preachingterp,2020-03-22T23:59:29.000Z,Senate Democrats block mammoth coronavirus stimulus package  thehill.com/homenews/senat …,https://t.co/r6QTpkHydZ,1241877190704336900
duluthnews,2020-03-22T23:59:29.000Z,Sam Cook: Going our own way in the age of COVID-19 trib.al/f4G8DlN,https://t.co/nS430T3ihY,1241877190393954304
_Evelle,2020-03-22T23:59:29.000Z,Why the fact that McDonald’s has closed in the UK has kicked my anxiety off about the pandemic,,1241877190314082304
Rorramonn,2020-03-22T23:59:29.000Z,They should  Coronavirus: IOC considers postponing 2020 Tokyo Olympics #Coronavirus  x.com/i/events/12190 …,https://x.com/hashtag/Coronavirus?src=hashtag_click https://x.com/i/events/1219057585707315201,1241877190184181760
Cynthiamnrqz,2020-03-22T23:59:29.000Z,I think I’m gonna use this quarantine to work out,,1241877190079365121
bards_logic,2020-03-22T23:59:29.000Z,You'll hear about why on this show:  blogtalkradio.com/bards-logic-po …,https://t.co/QkqOcx0FJw,1241877189534134273
KittyBa90524418,2020-03-22T23:59:29.000Z,What a kind and compassionate gentleman you are.l really do believe this pandemic is bringing out the best and worse in us!,,1241877189429256197
BourneRoot,2020-03-22T23:59:29.000Z,Link:   westernjournal.com/prager-issues- …,https://t.co/0belBRJL5P,1241877187604746241
ghunkinking,2020-03-22T23:59:29.000Z,"Well, I myself can think of many things that I would vote against that would help with the covid-19 virus if I were a Senator.",,1241877187550208004
AdamAda13738950,2020-03-22T23:59:29.000Z,"Most people infected will have a mild illness and recover completely in two weeks.On average,it takes five to six days from the day you are infected while those with more severe cases can take three to six weeks  Understand it from virologists #StayHome  lifewithnofears.blogspot.com/2020/03/dont-p …",https://x.com/hashtag/StayHome?src=hashtag_click https://t.co/13liCowGtd,1241877187546013696
FionaAdorno,2020-03-22T23:59:28.000Z,"Daniel Andrews "" You will not be able to go to the pub cause their closed."" Do not go to your mate's house and get on the beers. Don't be selfish. You will infect others. People will die. #Covid_19australia #StayAtHome #selfisolating thank you, Dan Andrews.",https://x.com/hashtag/Covid_19australia?src=hashtag_click https://x.com/hashtag/Covid_19australia?src=hashtag_click https://x.com/hashtag/StayAtHome?src=hashtag_click https://x.com/hashtag/selfisolating?src=hashtag_click,1241877185540919298
nkayokwudiri,2020-03-22T23:59:28.000Z,Best believe I was social distancing and bored.,,1241877185062895618
yesmylo,2020-03-22T23:59:28.000Z,"That is exactly what it is FOOL! Check the WHO's statement on Covid-19 Dated Feb, 11th, 2020. MORON!",,1241877184987496451
Complex,2020-03-22T23:59:28.000Z,St. Louis Fed. Chair warns that U.S. unemployment rate could hit upwards of 30 percent due to #coronavirus:  cmplx.co/9suBRlf,https://x.com/hashtag/coronavirus?src=hashtag_click https://t.co/it8hqoWRqb,1241877184756830210
Futurearth2,2020-03-22T23:59:28.000Z,"Why were the recorded new cases of coronavirus in the America zero on Saturday, according to the World Health Organisation, when the previous 3 days had between 3000 and 5000 each day! who's not sharing?",,1241877184752414720
ShorelineVic,2020-03-22T23:59:28.000Z,"can't wait to be locked in a house of two-faced whores during quarantine. probably not gonna make it, considering the family hasn't invited me to dinner in 3 days",,1241877183024545794
samuelitimi95,2020-03-22T23:59:28.000Z,What do I need bro? A president that can't say covid nineteen?,,1241877182923845632
badc0da,2020-03-22T23:59:27.000Z,"""AWS to give Coronavirus researchers free cloud""  link.engage.social/linkz/u2kac38h …",https://t.co/CR1RdevUrX,1241877182512861186
hpurrin,2020-03-22T23:59:27.000Z,a small blessing during this quarantine,,1241877182378577925
SiDog1984,2020-03-22T23:59:27.000Z,...The rare bit of liberty it feels like we have. Obviously donning a mask and gloves and then straight back to the prison... I mean office... Err home.  I look forward to being able to use the pool and visit the beach once this has died down a bit. Stay safe.,,1241877182374383616
SweetNeesey,2020-03-22T23:59:27.000Z,Please shut NC down and issue a stay at home order immediately. I like calling NC home and want the state and our good folks to be here after all this terribleness.   @NC_Governor  @ncdhhs,https://x.com/NC_Governor https://x.com/ncdhhs,1241877182282113029
Dr_G_Enigma,2020-03-22T23:59:27.000Z,Singapore's coronavirus playbook: How it fought back against the COVID-19 epidemic   cnet.com/news/singapore …,https://t.co/6mdYihCyn4,1241877182034608130
BrianKDodd,2020-03-22T23:59:27.000Z,Lead Like A Shepherd: The One Book Every Leader Should Read During The Coronavirus COVID-19  ow.ly/bkrs50ySt8S  #SundayThoughts #pastors #business #coaches #leadership  @LarryOsborne,https://t.co/eQWfVSLU3P https://x.com/hashtag/SundayThoughts?src=hashtag_click https://x.com/hashtag/pastors?src=hashtag_click https://x.com/hashtag/business?src=hashtag_click https://x.com/hashtag/coaches?src=hashtag_click https://x.com/hashtag/leadership?src=hashtag_click https://x.com/LarryOsborne,1241877182013636614
rearea_a,2020-03-22T23:59:27.000Z,"In IL it is sort of ""suggested"" kind of described as hey kids in the back not following previously suggested guidelines! Listen up! We were already following stay at home rules so not much changed for us. It's not Marshall Law. Don't want to go out anyway!",,1241877181699153920
Judey_moody,2020-03-22T23:59:27.000Z,Me at beginning of quarantine: I’m gonna watch so many movies!!!  Me one week into quarantine: ive seen the same episode of bar rescue 5 times!!,,1241877179958349824
parnell_daniel,2020-03-22T23:59:27.000Z,A comprehensive list of the latest coronavirus postponed or cancelled sport events #COVID19  snavie.com,https://x.com/hashtag/COVID19?src=hashtag_click https://t.co/yiWk4iWGJZ,1241877179912372224
AngieEr40926749,2020-03-22T23:59:27.000Z,#DrOz offers #coronavirusUSA advice: 'Close the borders of your house'  newsbreakapp.com/n/0OVfubSS?s=a …,https://x.com/hashtag/DrOz?src=hashtag_click https://x.com/hashtag/coronavirusUSA?src=hashtag_click https://t.co/7DDzoN1iVi,1241877179547385858
hozhor,2020-03-22T23:59:27.000Z,This doctor says the government's response to the coronavirus pandemic is nothing short of criminal.  huffpost.com/entry/doctors- …,https://t.co/MQsFgjsyUl,1241877179509637125
Stephan82780984,2020-03-22T23:59:26.000Z,Whew Chile......#PSA #coronavirus #HelpingOthers #DriversEd,https://x.com/hashtag/PSA?src=hashtag_click https://x.com/hashtag/coronavirus?src=hashtag_click https://x.com/hashtag/HelpingOthers?src=hashtag_click https://x.com/hashtag/DriversEd?src=hashtag_click,1241877178578583555
BeigelB,2020-03-22T23:59:26.000Z,Boris Johnson : Medication for Covid 19 - Sign the Petition!  chng.it/RjLcprvy via  @UKChange  @IainDale  @BorisJohnson  @LBCNews  @Lord_Sugar  @KTHopkins  @SkyNewsBreak  @piersmorgan,https://t.co/xCVO6VvEez https://x.com/UKChange https://x.com/IainDale https://x.com/BorisJohnson https://x.com/LBCNews https://x.com/Lord_Sugar https://x.com/KTHopkins https://x.com/SkyNewsBreak https://x.com/piersmorgan,1241877178008166406
robrowlands,2020-03-22T23:59:26.000Z,"Sorry, Alan, you’re wrong:  gov.uk/government/new …",https://t.co/cn7kytvMNF,1241877177760702470
taylor032378,2020-03-22T23:59:26.000Z,"Our gov't response has been fantastic, provinically and federally. So ridiculous that the Conservative faction starts pathetic trends like this and calls themselves ""woke"". Bravo to our Canadian Leaders and their united response in the face of this pandemic.  t.co/OoCrqJ0xwq",https://t.co/OoCrqJ0xwq,1241877176997367809
Nora66BC,2020-03-22T23:59:26.000Z,"And yet we are ok with complete strangers, not tested, not quarantined preparing food for thousands daily. Is the cook getting your wings and fries ready wearing a mask? coughing? #StayAtHome #FlattenTheCuve  @GovPritzker  @CDCgov",https://x.com/hashtag/StayAtHome?src=hashtag_click https://x.com/hashtag/FlattenTheCuve?src=hashtag_click https://x.com/GovPritzker https://x.com/CDCgov,1241877176867225601
th4runi,2020-03-22T23:59:26.000Z,whoever added new rules to karla’s social distancing playlist... my ears are opened. i’m hearing things.,,1241877176326197259
AndreaE456,2020-03-22T23:59:26.000Z,"Stop all the lies about Trump and the NSC pandemic response unit. This will break down the truth for you, though there are so many words, Dems are likely to delete it from their screens after 10 seconds. #FactsMatter #TruthMatters  #COVID19  factcheck.org/2020/03/dems-m …",https://x.com/hashtag/FactsMatter?src=hashtag_click https://x.com/hashtag/TruthMatters?src=hashtag_click https://x.com/hashtag/COVID19?src=hashtag_click https://t.co/rs3IuLiE3V,1241877176171053056
Girgameshu,2020-03-22T23:59:26.000Z,during these quarantine days we should all buy trucks and explore areas of our states and provinces where humans haven't gone,,1241877175990734856
mjfree,2020-03-22T23:59:26.000Z,"Not sure hard working Americans care how hard it is for rich people like Trump, who spent his open mic #KAG2020 mini-rally lamenting the billions being president has cost him, praising  @RandPaul  (who went to social events while awaiting positive Covid-19 test) and mocking Romney.",https://x.com/hashtag/KAG2020?src=hashtag_click https://x.com/RandPaul,1241877175965569024
BookChick58,2020-03-22T23:59:26.000Z,"4/8 Kaden took a breather at the bench while Dom got ready in goal. “Yo, Luc! I see that your fan club is here this morning. What would you do without them to stroke your ego?” Dom said, before flipping his mask down in front of his face. #hockeyfiction #puckreads",https://x.com/hashtag/hockeyfiction?src=hashtag_click https://x.com/hashtag/puckreads?src=hashtag_click,1241877175764168704
TyraMyricks,2020-03-22T23:59:26.000Z,Couldn’t hit brunch today so... turned that crib into Covid-Cafè ... unlimited mimosas and henny colodas.,,1241877175399153664
cogitopacis,2020-03-22T23:59:25.000Z,"Most of the time you didn't need to, because society took care of all your thinking for you. Now is the time you do it for yourself, too.  #think #coronavirus #covid19",https://x.com/hashtag/think?src=hashtag_click https://x.com/hashtag/coronavirus?src=hashtag_click https://x.com/hashtag/covid19?src=hashtag_click,1241877173260234752
Majestic_WP,2020-03-22T23:59:25.000Z,Majestic will be closed Monday and Tuesday do to the Covid-19 Virus and we will assess the situation on Tuesday. Please if you need something just call the shop and leave a message or message us on Facebook. We will be monitoring these sources and we wish everyone our best!...,,1241877173109010432
DeansherryS,2020-03-22T23:59:25.000Z,Desperate and angry state leaders push back on Trump admin claims of mass mask shipments msn.com/en-us/news/pol …,https://t.co/wQwSU9OTgj,1241877172589133826
DerekEvans20,2020-03-22T23:59:25.000Z,I know what will happen your next birthday. Covid 19 wont be fucking up things. Well at least we hope so,,1241877172307914752
dyinfornjh,2020-03-22T23:59:25.000Z,a fun quarantine thing to do that i definitely stole from  @thatblkgrl    please don’t come for me :)))) #HeartbreakWeather,https://x.com/thatblkgrl https://x.com/hashtag/HeartbreakWeather?src=hashtag_click,1241877172270387205
thenightcabbie,2020-03-22T23:59:25.000Z,"Why would I do that? I WANT there to be controls on pricing during a global pandemic! This isn’t a time to  make money, it’s a time to help people.",,1241877172140290050
ChrisRi80029765,2020-03-22T23:59:25.000Z,Senate Democrats unanimously reject McConnell's bullying on coronavirus stimulus  dailykos.com/story/2020/3/2 …,https://t.co/mLWk8himhb,1241877171410546689
