User_name,Datetime,Content,Links,Tweet_ID
mitrebarnet,2020-09-28T23:58:57.000Z,Well said. There did not seem to be any reason for the Govt to move fast on a curfew for pubs and restaurants and by doing so the Govt has tipped many establishments into serious deficit and done nothing for the management of Covid. Please review the curfew.,,1310730748861779970
CartoonCanadian,2020-09-28T23:58:56.000Z,I can see the schools being open. Kids are wise enough to practice the Covid protocol. Seems the adults who demand everything be opened are the same ones that refuse to wear a mask or social distance in many cases. These are what are known as Douche Bags!,,1310730746731147271
bryhami,2020-09-28T23:58:56.000Z,That’s why they gotta do club appearances during a pandemic,,1310730746143952897
zuper_zouma,2020-09-28T23:58:56.000Z,"The vaccine is literally being made for the people with pre existing condition so they don’t die, are you feeling okay",,1310730746101989377
hillary,2020-09-28T23:58:56.000Z,Featured story in Apple’s App Store — download COVID Alert and help stop the spread.   apps.apple.com/ca/story/id152 …,https://t.co/NDTfWV6ezS,1310730746001321985
momwifeme2,2020-09-28T23:58:56.000Z,Well call me confused... google.com/amp/s/www.newm …,https://t.co/hT4fe8dYiE,1310730744944304128
Untd_gammas,2020-09-28T23:58:55.000Z,Join us Tomorrow 9/29 for a Coronavirus Informational through zoom with @untdphpc ! Hope to see you there!   instagram.com/p/CFsxMafgiXg/ …,https://t.co/XEmSJjx8VH,1310730742436188161
AlanT18218386,2020-09-28T23:58:55.000Z,Covid speculation and a meal out. Very light reading...  summatnnowt.weebly.com/1/post/2020/09 … via  @weebly,https://t.co/fsaxUQOJPq https://x.com/weebly,1310730742297624576
piedpipersoty,2020-09-28T23:58:54.000Z,Please my state BANNED mayors from making mask requirements back in June  x.com/slutyjoon/stat …,https://x.com/slutyjoon/status/1310673544016203778,1310730737688215552
simply_stephyy,2020-09-28T23:58:54.000Z,I just wanna be a stay at home mom.,,1310730737503612928
ALOHA77USA,2020-09-28T23:58:54.000Z,With all due respect-better to hold as originally planned. Effective fast testing now-much more fruitful if in person. Best interaction-look each other in the eye&embrace-even with mask. For Peace-Prosperity-Productivity-Meet Personally. Open Hearts-Lead Opening World with G20!,,1310730736396201984
annalise229,2020-09-28T23:58:54.000Z,"I just got in from an evening walk, at least 20% of the people I saw were not wearing masks. No just wearing them incorrectly, but no mask in sight.",,1310730735641395201
DerbySchoolsKS,2020-09-28T23:58:53.000Z,Courtney Goble shared concerns regarding student quarantine and support needs.,,1310730732512448513
Squamish_56,2020-09-28T23:58:53.000Z,#bced VCH still isn’t notifying teachers when one of their students has tested positive. Contact tracing relies on teenagers remembering who they were with and that they were always wearing their masks when close to someone outside of their cohort. F grade to VCH.,https://x.com/hashtag/bced?src=hashtag_click,1310730732436766720
DavidlBennettII,2020-09-28T23:58:53.000Z,"Guess, you've ignored the mythical business leader, who suddenly become the anointed by God! That also cheated on his wives, committed fraud,  was sued for housing discrimination, silent on troop bounties, the severity of Covid & lied about it. Imagine the cost of their deaths!",,1310730730847133696
bymorganmatzen,2020-09-28T23:58:52.000Z,"Public comment is over. Now onto the superintendent report from Dr. Lori Simon. Clarifies difference between quarantine/isolation days, 14 vs. 10.",,1310730728976650241
SanJoseArts,2020-09-28T23:58:52.000Z,BTW:  @CityofSanJose  #Coronavirus relief grants are also available for arts organizations. Same deadline: 5pm tomorrow (9/29):  sanjoseca.gov/your-governmen … #408Creates #FundTheArts #ArtsAreEssential,https://x.com/CityofSanJose https://x.com/hashtag/Coronavirus?src=hashtag_click https://t.co/a75bl6zcDh https://x.com/hashtag/408Creates?src=hashtag_click https://x.com/hashtag/FundTheArts?src=hashtag_click https://x.com/hashtag/ArtsAreEssential?src=hashtag_click,1310730728045334529
auntganana,2020-09-28T23:58:52.000Z,"200,005 US Deaths because knew early & did nothing. You made it a joke, didn’t wear masks, brought crowds together and forbid them to wear masks. The Loss of Those Lives Could Have Been Prevented,   @VP  ! COVID IS THE 3rd Highest cause of death in the US! #YouKnew #YouDoNotCare",https://x.com/VP https://x.com/hashtag/YouKnew?src=hashtag_click https://x.com/hashtag/YouDoNotCare?src=hashtag_click,1310730727840002048
MichaelJamesNCA,2020-09-28T23:58:52.000Z,Since we’re from the same state as one of the MAGA bombers I presume you’re referring to when he said COVID would be a good thing because he wouldn’t have to shake hands with his disgusting supporters anymore the-sun.com/news/1493113/t …,https://t.co/kmAxQfVWTC,1310730726325784584
Cap_Kaveman,2020-09-28T23:58:51.000Z,Is that a Golden Girls mask?,,1310730726107738112
1plus1_is_3,2020-09-28T23:58:51.000Z,"We don't believe a word, nor should we.  Canada needs real covid (and other) leadership.  Florida ends covid restrictions.  Pretty darn rational thought process. Much different than 30 week lockdown was proposed to save the hospitals. Sorry, I meant 2 wk  rationalground.com/governor-desan …",https://t.co/ZtsoExNWwR,1310730725721690112
Nifs_s,2020-09-28T23:58:51.000Z,Enjoy quarantine the rest of your life,,1310730725524680707
Tonilasita,2020-09-28T23:58:51.000Z,And face mask,,1310730723356282880
alittleleader,2020-09-28T23:58:51.000Z,I actually need mostly silence to work (especially read) and bar study during the pandemic was very difficult for me for that reason   AND OP IS STILL ABSOLUTELY THE ASSHOLE,,1310730723284795392
escalatorover,2020-09-28T23:58:51.000Z,"#Covid19 #Denmark now opts for sanity with #Sweden #Norway no #masks, schools normal - while the Victoria Austrealia  still purse policy of mass hysteria. If it's the same #Coronavirus these Scandinavian countries why are why we  acting like #DanAndrews  21stcenturywire.com/2020/09/28/den …",https://x.com/hashtag/Covid19?src=hashtag_click https://x.com/hashtag/Denmark?src=hashtag_click https://x.com/hashtag/Sweden?src=hashtag_click https://x.com/hashtag/Norway?src=hashtag_click https://x.com/hashtag/masks?src=hashtag_click https://x.com/hashtag/Coronavirus?src=hashtag_click https://x.com/hashtag/DanAndrews?src=hashtag_click https://t.co/7b0aFDtKYe,1310730722483646464
Wave01runner,2020-09-28T23:58:50.000Z,"Look at entitled face of white, male, #ChristoFascist privilege of #PeterPoohlievre! Cold, callous, indifferent, mercenary #RepubliCON. How many would die under this  regime w  COVID pandemic? How many uber Wealthy will get richer and richer? #Not4Canada #livesAreMoreThanNumbers",https://x.com/hashtag/ChristoFascist?src=hashtag_click https://x.com/hashtag/PeterPoohlievre?src=hashtag_click https://x.com/hashtag/RepubliCON?src=hashtag_click https://x.com/hashtag/Not4Canada?src=hashtag_click https://x.com/hashtag/livesAreMoreThanNumbers?src=hashtag_click,1310730721699467265
DnD_Life,2020-09-28T23:58:50.000Z,"I've picked up my homebrew once again, after getting caught up in life, and then sorting stuff out due to COVID.  Goblins Of Gruvnir is making progress! (It's a mock cover)  #TTRPG #DnD #DnD5E #DungeonMaster #DungeonsAndDragons #Worldbuilding #Homebrew #GoblinsofGruvnir",https://x.com/hashtag/TTRPG?src=hashtag_click https://x.com/hashtag/DnD?src=hashtag_click https://x.com/hashtag/DnD5E?src=hashtag_click https://x.com/hashtag/DungeonMaster?src=hashtag_click https://x.com/hashtag/DungeonsAndDragons?src=hashtag_click https://x.com/hashtag/Worldbuilding?src=hashtag_click https://x.com/hashtag/Homebrew?src=hashtag_click https://x.com/hashtag/GoblinsofGruvnir?src=hashtag_click,1310730719568617474
OneMoreTruth1,2020-09-28T23:58:50.000Z,"infowars.com/researcher-sug …  RESEARCH SHOWS DELIBERATE CHINESE PROPAGANDA CAMPAIGN FORCED WORLD INTO LOCKDOWN  Communist regime flooded social media with fake videos and bots to whip up COVID hysteria.  Sweden, was also targeted by the bots",https://t.co/Uy2gC064gF,1310730719149211649
AaronReeks,2020-09-28T23:58:50.000Z,"Bloody typical!! I pick the year to join Uni and become a #fresher, at the same time that  @BorisJohnson  &  @MarkDrakeford  close the pubs at 10pm!!! #FreshersWeek2020 #freshersguide20  @OUstudents  @OpenUniversity  #lockdown2 #Covid19UK #covid",https://x.com/hashtag/fresher?src=hashtag_click https://x.com/BorisJohnson https://x.com/MarkDrakeford https://x.com/hashtag/FreshersWeek2020?src=hashtag_click https://x.com/hashtag/freshersguide20?src=hashtag_click https://x.com/OUstudents https://x.com/OpenUniversity https://x.com/hashtag/lockdown2?src=hashtag_click https://x.com/hashtag/Covid19UK?src=hashtag_click https://x.com/hashtag/covid?src=hashtag_click,1310730719136829440
Dawnie64,2020-09-28T23:58:49.000Z,When was the last time your dad stopped killing people with COVID-19? Asking for a friend. And I don’t believe for one second he is donating his salary!,,1310730717421162496
TonyPrice241,2020-09-28T23:58:48.000Z,"""Five point plan to protect humanity against another pandemic"" Really? He's acquired the power of a deity to protect humanity from viruses? I look forward to the time we see him cycling across the Thames on his bike.",,1310730712014819336
everything_NE,2020-09-28T23:58:48.000Z,NEWS: Council bosses slam Matt Hancock's move to impose tougher lockdown in region -  everythingnortheast.co.uk/news-council-b …,https://t.co/VSd6TZDkpJ,1310730709817065477
taitt_m,2020-09-28T23:58:47.000Z,"Somewhere in my tweets that says ""quarantine is when you restict the movement of sick people, tyranny is when you restrict the movement of heathy people.""",,1310730708822917120
MI_Lib1956,2020-09-28T23:58:47.000Z,Yea AFTER Covid.  I spent time in college working crap jobs on Sanibel.  Heat is tough to get use to.,,1310730708705595394
mtmdphd,2020-09-28T23:58:47.000Z,"Treatment of COVID-19 pulmonary failure by targeting BTK [Jul 21, 2020] Steven P. Treon, Dana-Farber Cancer Institute, Boston, Massachusetts via #AACRCOVID  @AACR   ow.ly/7p0k30qZIGf #COVID19 #CCC19 #COVID19nCancer  @COVID19nCCC",https://x.com/hashtag/AACRCOVID?src=hashtag_click https://x.com/AACR https://t.co/IzxGV0TKWV https://x.com/hashtag/COVID19?src=hashtag_click https://x.com/hashtag/CCC19?src=hashtag_click https://x.com/hashtag/COVID19nCancer?src=hashtag_click https://x.com/COVID19nCCC,1310730707946352642
rebeccaMAGA1,2020-09-28T23:58:47.000Z,"Good , bring it on .... I will not wear a mask outside and I’m not getting the vaccine, I don’t get the flu vaccine either.... Enjoy your day and your mask!  x.com/ReddingtonAlic …",https://x.com/ReddingtonAlice/status/1310536538262970368,1310730707585708034
brodinsons,2020-09-28T23:58:47.000Z,"i got the email with the ""safety measures"" outlined yesterday and i'm still furious today  i *understand* that the pandemic is causing severe financial stress to companies but playing with human lives like this endears you to no one, and pretty much ensures i won't be coming back",,1310730706327232512
FernandoRod1,2020-09-28T23:58:47.000Z,We don't talk enough about how the way that the CIA operates abroad puts civilians providing aid or journalist in danger.  scientificamerican.com/article/how-ci …,https://t.co/1EYPLoByfH,1310730705501118464
neufonewhodis,2020-09-28T23:58:46.000Z,"wow he really did just decide to go mask off, huh?",,1310730703978377218
GeneBryant2,2020-09-28T23:58:46.000Z,"Dr. Anthony Fauci, the nation's leading infectious disease expert, on Monday called Florida's full reopening of bars and restaurants ""very concerning,"" fearing it will spark more coronavirus outbreaks.  nbcnews.com/news/us-news/f … via  @nbcnews",https://t.co/RmhgJjSDka https://x.com/nbcnews,1310730703580037120
NineteenDelta,2020-09-28T23:58:46.000Z,"I think masks are bs also, but schools must follow guidelines or risk having sports shut down. My school had a state inspector visit us this past Friday checking for compliance with state guidelines. If it means my daughter get her Sr band year, I'll wear a damn mask",,1310730703500455944
adammarkowitzEA,2020-09-28T23:58:46.000Z,Alright guys. Time to put this away. Let's bring the COVID Cup back to Tampa. #GoBolts,https://x.com/hashtag/GoBolts?src=hashtag_click,1310730701482975232
WonderfulW3K2D,2020-09-28T23:58:46.000Z,If I heard correctly aren’t the officiating crews going to be the same all year based on location? I think it was a Covid protocol thing.,,1310730701243928577
Trader_Joe_LPP,2020-09-28T23:58:45.000Z,$ZM dumping continues  thenextweb.com/hardfork/2020/ …,https://x.com/search?q=%24ZM&src=cashtag_click https://t.co/3QNFtSdQkf,1310730697976377345
twilight2000,2020-09-28T23:58:45.000Z,"Georgia health officials have decided to withhold information about coronavirus infections at each School saying the public has no legal right to information about outbreaks that the state is investigating. I'm sorry, did you want to be sued out of existence?",,1310730697477300225
likethedoll,2020-09-28T23:58:45.000Z,quarantine mood,,1310730697179570181
Swifty_s,2020-09-28T23:58:44.000Z,To throw you off the scent of who is really going to be tracking your every move. contracts.mod.uk/do-features-an … gov.uk/government/new …,https://t.co/bEJF1zlVSG https://t.co/Dokrf7m2pw,1310730696391118848
epbofx,2020-09-28T23:58:44.000Z,"Who knew the ""expendable"" COVID strategy would cost Donald voters who want to live.",,1310730694822420481
jmod101,2020-09-28T23:58:44.000Z,"What a disappointment, corruption can take anyone, it's more contagious than covid",,1310730693585047552
SoucyDaniel2,2020-09-28T23:58:44.000Z,CTV Atlantic News covering Nova Scotia company waiting on Health Canada approval for rapid antigen test for COVID-19 atlantic.ctvnews.ca/nova-scotia-co …,https://t.co/mx2SG5oNB0,1310730693304086529
keelandonovan,2020-09-28T23:58:43.000Z,COVID: 19  @NDFootball : 0  #NotreDame,https://x.com/NDFootball https://x.com/hashtag/NotreDame?src=hashtag_click,1310730690904895488
RadioKnc,2020-09-28T23:58:42.000Z,KNC Radio - KNC Mask Fashion,,1310730688115638275
adamadonaldson,2020-09-28T23:58:42.000Z,"Hofland notes that she's concerned about meeting goals in the next two years, because 2021 will still be COVID, and then 2022 is an election year. Stewart says this plan shouldn't be focused around election years, that's not how you run a corporation.",,1310730688107290624
957CoastFM,2020-09-28T23:58:42.000Z,"Two new COVID-19 cases on Vancouver Island, 267 in B.C over the weekend  mypowellrivernow.com/31416/two-new- …",https://t.co/oY8DTDJUO3,1310730687775830017
AVaQu,2020-09-28T23:58:42.000Z,"Cuadrado before CoVid, he lose a little of his place but still one of our best players last season.",,1310730686303797250
OrangeTheGreat3,2020-09-28T23:58:42.000Z,Fuck these people! Wear the mask! How can any Trump supporter think this is normal? #VoteBlueToEndThisNightmare  x.com/assortedcourts …,https://x.com/hashtag/VoteBlueToEndThisNightmare?src=hashtag_click https://x.com/assortedcourts/status/1310702948012503040,1310730685137723392
MarwekoBae,2020-09-28T23:58:41.000Z,So in Canada we also have a Stimulus ish monthly income for those who cant work due to Covid19  They said in 2 weeks they will stop the paiments yet they said in 2 weekd we will be in red color and again quarantine ...   I guess the monthly checks will keep coming in eh !,,1310730684085014529
ncgazette,2020-09-28T23:58:41.000Z,Woman Arrested After Dispute About Wearing Mask -  northcountrygazette.org/2020/09/28/mas …,https://t.co/BqD1SoWeya,1310730683703267328
st_fulton,2020-09-28T23:58:41.000Z,"As Milan Fashion Week comes to an end, several notable names delivered fine collections despite the current pandemic. Salvatore Ferragamo chose to show a co-ed collection that was luxurious and tasteful. Click the link below to read my review!  #Ferragamo  fultonstcritique.com/reviews/salvat …",https://x.com/hashtag/Ferragamo?src=hashtag_click https://t.co/ZWjX49EDt4,1310730682289840130
PossumDeMenthe,2020-09-28T23:58:41.000Z,"While it can be escapism through abstraction, ""uwu I'm not cute"" furs not only are their own problem, but regularly introduce those problems you mentioned through destructive habits. In many cases, the escapism is cynical at best, a mask for some pretty abusive stuff at worst.",,1310730680431775744
foster_change,2020-09-28T23:58:39.000Z,"As Covid-19 Closes Schools, the World’s Children Go to Work ... in often dangerous and illegal jobs - undoing years of progress for them - and for global efforts on health & social mobility  nytimes.com/2020/09/27/wor …",https://t.co/Nb5r2uq6BY,1310730673905430528
AngelopoulosCon,2020-09-28T23:58:39.000Z,Victorian covid air police!,,1310730673401950209
allastras,2020-09-28T23:58:38.000Z,"How convenient for trump that there’s a pandemic going on. I want to believe we would be out there marching. Taking back our humanity as a nation. I am at high risk for Covid but if I thought my presence could make any sort of an impact, I’d still go.",,1310730668012261377
re_rockstars,2020-09-28T23:58:37.000Z,Listen and learn on State of the Market Episode SOTM 58 (Part 2): Scaling a Real Estate Business - Tips with David Greene  hibandigital.com/stateofthemark … . #DavidGreene #AaronAmuchastegui #linkinbio #realestateinvestors #coronavirus #covid19 #StateoftheMarket #HibanDigital,https://t.co/6zzTarMbeG https://x.com/hashtag/DavidGreene?src=hashtag_click https://x.com/hashtag/AaronAmuchastegui?src=hashtag_click https://x.com/hashtag/linkinbio?src=hashtag_click https://x.com/hashtag/realestateinvestors?src=hashtag_click https://x.com/hashtag/coronavirus?src=hashtag_click https://x.com/hashtag/covid19?src=hashtag_click https://x.com/hashtag/StateoftheMarket?src=hashtag_click https://x.com/hashtag/HibanDigital?src=hashtag_click,1310730665172717568
PlethodoNick,2020-09-28T23:58:37.000Z,"Yeah the lastest switch update banned it (for all games, usernames, etc) also banned coronavirus",,1310730664753459200
alongstoryshrt,2020-09-28T23:58:37.000Z,"Congratulations on the upcoming release. I look forward to seeing your work in the future. I have a proofreading business if you or anyone you know is in need of assistance, please keep me in mind. I hope quarantine hasn't treated you too terribly",,1310730664388550656
SinaAmedson,2020-09-28T23:58:36.000Z,Saudi ain’t coming back until he gets credit for being on top of the mask game with his bitches before all y’all bit his style.,,1310730662865850368
PANGPPOLabrador,2020-09-28T23:58:36.000Z,"DIALOGUE   On September 29, 2020, PNP Personnel of this station under the direct supervision of PCPT MARK D TUBADEZA, OIC conducted dialogue with  market vendors at Brgy. Poblacion this town regarding  Crime Prevention Tips and Safety Protocols on COVID-19.",,1310730662207340546
sanaabidi__,2020-09-28T23:58:32.000Z,* COVID-19 as soon as it’s 12 am on New Years *,,1310730643979096064
NielsANielsen,2020-09-28T23:58:32.000Z,"If you multiply those numbers by 100, they would look about right. Try dividing 200.000 deaths with 330.000.000 (entire US population). That figure, 0,061%, is higher than any of the figures on the screen. And far less than 10% of Americans have been infected with Covid so far.",,1310730643693862913
noyoudin,2020-09-28T23:58:32.000Z,"Abbott BinaxNOW appears to test for influenza A and B, not COVID.  What’s the story? Why ship 100 million “flu” tests? @MaddowBlog  @realDonaldTrump  @GOP  @WhiteHouseHstry",https://x.com/MaddowBlog https://x.com/realDonaldTrump https://x.com/GOP https://x.com/WhiteHouseHstry,1310730642427125760
Elizabe82475682,2020-09-28T23:58:31.000Z,"Oh yes, the tyranny of public health officials during a pandemic. These folks are either deliberately obtuse, or need psychiatric attention.",,1310730641697173504
Vertrucio,2020-09-28T23:58:31.000Z,"Ah yes, another event besides the RNC that requires a COVID-19 lawsuit waiver.",,1310730638740189184
Markwinters069,2020-09-28T23:58:31.000Z,Its the desperation of not having a pot to piss in..trumps gonna spank their lefty bottoms so fkin hard..its now coming true what trump said about corrupt election..hes a good man trump in a very tricky period in history..hes doing well in spite of the covid bollox,,1310730638392262662
Yo_Hablo_,2020-09-28T23:58:30.000Z,Side effect of wearing a mask everyday like a sheep,,1310730637704409089
Morris_Kode,2020-09-28T23:58:30.000Z,"Watch ""Unmasked Heckler Wreaks Havoc at Briefing as NYC Eyes Shutdowns Over COVID Clusters | NBC New York"" on YouTube  youtu.be/C0nM4Vurbn4   Jews are so innocent, positive and victims of evrything. Masks are the new Nazi i guess",https://t.co/HJjR29VF1n,1310730636211236864
DN_Marjorie,2020-09-28T23:58:30.000Z,"Nearly 2,000 COVID-19 cases associated with Utah schools since start of school year  deseret.com/utah/2020/9/28 …",https://t.co/QLZPJ1xRSN,1310730635993116679
lownsbery,2020-09-28T23:58:30.000Z,Grateful today for vendors who negotiate deep cuts in licensing costs because they recognize the importance of Covid relief for school districts. That’s ongoing partnership!! kamiapp.com,https://t.co/OwAe9pNQjf,1310730634403479555
broletariats,2020-09-28T23:58:30.000Z,"Hmmm... I mean, I hear her rage and pain over white people just showing up when it benefits their image. But you’ve also done a lot...? I’ve done the same, I’m high risk and am not going to go out in a global pandemic. I know both of us would if that wasn’t the case.",,1310730634231308288
sr_hampton,2020-09-28T23:58:29.000Z,"(2 of 2)  Another Coronavirus Day, another Party lie, and 205,000+ Americans die...and 205,000+ men, women, and children DID NOT HAVE TO DIE!",,1310730633329565696
james66516498,2020-09-28T23:58:29.000Z,That’s not right. I wouldn’t give any slack. Cops should obey Heath rules just like anyone else. Personally I wouldn’t serve them and tell get a mask,,1310730632646004736
NathanielLeigh1,2020-09-28T23:58:29.000Z,"This includes 9 new cases within the Interior Health Region, there's been 531 cases in the area to date.  lnkr.fm/7dxjs",https://t.co/NrhIN3iZig,1310730631182254088
solw97,2020-09-28T23:58:29.000Z,"When you answer for the 11,000 killed in nursing homes by you order I’ll wear a mask. POS",,1310730631161274369
MillerOval,2020-09-28T23:58:29.000Z,Coronavirus cases rising in 29 states as global death toll nears 1 million  youtu.be/E_zCUFI_XrA via  @YouTube,https://t.co/JbUjQfzXdO https://x.com/YouTube,1310730630343405568
WILD1047,2020-09-28T23:58:29.000Z,"This includes 9 new cases within the Interior Health Region, there's been 531 cases in the area to date.  lnkr.fm/7dxjs",https://t.co/ZdENO8LiWC,1310730629856800771
eye_avizor,2020-09-28T23:58:28.000Z,"@GovRonDeSantis  are you believe in john hopkings numbers,??????????????? are you check if the place with more covid in Florida has democrats authorities???? Do you know more test you do, more cases you have??????????? We need be normal and free again. OPEN, OPEN OPEN ALL FLORIDA.",https://x.com/GovRonDeSantis,1310730627810045958
lifori_,2020-09-28T23:58:28.000Z,yeah.. I hope this pandemic passed quickly take care,,1310730626606092288
_tchofficial,2020-09-28T23:58:27.000Z,quarantine gainz,,1310730625146527744
peggy_blair,2020-09-28T23:58:27.000Z,"So only four more months...dear God. Trying to figure out how long that is in Covid time, LOL.",,1310730623989026816
SeatradeInsider,2020-09-28T23:58:27.000Z,Aranui 5 cancels Marquesas #cruise after 10 crew test positive for COVID-19. None of the 79 passengers were reported infected  bit.ly/2GhUvvy,https://x.com/hashtag/cruise?src=hashtag_click https://t.co/jcaCWeFE5N,1310730623926046722
Asktrumpnow,2020-09-28T23:58:27.000Z,"1/3  @realDonaldTrump  You keep referring to Corona as #ChinaVirus virus- and say that if China told us the truth we would have been better prepared. Since the corona virus originated in China, that country was the least prepared to face the #Coronavirus  @CNN  @foxnews  @maddow",https://x.com/realDonaldTrump https://x.com/hashtag/ChinaVirus?src=hashtag_click https://x.com/hashtag/Coronavirus?src=hashtag_click https://x.com/CNN https://x.com/foxnews https://x.com/maddow,1310730622953029633
Amani92631610,2020-09-28T23:58:27.000Z,Yeah! Keep wearing your mask everyone cause you need your mask to protect yourself from Covid-19.,,1310730621711515648
jpat44,2020-09-28T23:58:26.000Z,Agreed start with PCR testing  PCR testing Your Coronavirus Test Is Positive. Maybe It Shouldn’t Be. nytimes.com/2020/08/29/hea …,https://t.co/NL2hPnE4Px,1310730621392740354
AizenReviews,2020-09-28T23:58:26.000Z,"Really? I ain't know that bro. But I remember he was on top of the world with Quarantine Radio, and he was getting that show money when nobody was allowed to do shows, so it makes sense what you're saying, because outta nowhere this bomb was dropped",,1310730621287895041
SatbirSingh_,2020-09-28T23:58:26.000Z,"Covid-19 update: three changes by the emergency control group. One is no more public skates until Nov. 1 due to the increased cases of COVID.  Community Centre rentals won’t be available, although they were slated to resume Oct. 5.  Administrative offices will also remain closed.",,1310730620352552960
MarcBurnside,2020-09-28T23:58:26.000Z,"Pacers “saved” Lebron from pandemic P, or kept PG from his breakthrough. I was thinking about this earlier.",,1310730619991797766
NoMorePlatosCav,2020-09-28T23:58:26.000Z,No... Waiting on the results of my latest test. It will probably be negative too.  But my Dr is convinced it was/ is covid. The symptoms just won't go away. And some are getting worse.,,1310730618662248449
