User_name,Datetime,Content,Links,Tweet_ID
_WhiteRiverNow_,2020-09-28T23:58:26.000Z,Gary B. runs down COVID-19 stats in regional nursing facilities  whiterivernow.com/2020/09/28/gar …,https://t.co/63uNm6e2p3,1310730617794048001
lunchboxdays13,2020-09-28T23:58:26.000Z,2020 has been exhausting. for reasons beyond covid. beyond protests. beyond events being cancelled. 2020 has shown us people’s true colors. it’s shown us who cares about others and who doesn’t. who is okay with mild inconveniences or who would rather sacrifice a portion of (1),,1310730617647173632
iamthedrifter,2020-09-28T23:58:26.000Z,"If you are careful - mask, hand washing and all I think you will be ok",,1310730617244581888
pwild1982,2020-09-28T23:58:25.000Z,Because of bed space and the amount of new Covid cases they have sent me home to deal with the pain myself.  I may end up back in the hospital but thankful for the nurses and doctors.  So appreciative of each and every one of your comments and messages.  I feel so loved.,,1310730615939936258
Glass_Co_Schdy,2020-09-28T23:58:25.000Z,Does your camera have coronavirus?  Why are you wearing a mask in your profile pic?,,1310730614522482689
pwild1982,2020-09-28T23:58:25.000Z,"So got these out today and sent home. My Covid markers are doing well and they say I am not in a lot of danger. It has caused kidney,lung damage and between the Covid and smoke from all the fires my asthma to be out of control.  The coughing has caused costochondritis and pain.",,1310730614178369539
bigpapamiks,2020-09-28T23:58:24.000Z,I won’t buy a candle if I can’t smell it through my mask,,1310730612907499520
Heather98713071,2020-09-28T23:58:24.000Z,"How Many Americans Have Died From COVID-19?  prageru.com/video/how-many …   ZERO as in 0 have died from the hoax BS , population  elimination and DNA changing & LETHAL  VAxxxX  . HELLO  @AzDailySun  ,  @CoconinoCounty  ,  @DougDucey",https://t.co/kHHEWvPTjg https://x.com/AzDailySun https://x.com/CoconinoCounty https://x.com/DougDucey,1310730608998449154
BABDCATHA2,2020-09-28T23:58:23.000Z,#COVID19 doesn't spare young or deluded  57 yr old US Tony Tenpenny spread tweets questioning COVID pandemic & Govt response   called CDC & WHO “pure lying asses”   died of virus after 5 weeks on ventilator    Wear an effective mask properly!  #COVID19Vic #auspol #springst,https://x.com/hashtag/COVID19?src=hashtag_click https://x.com/hashtag/COVID19Vic?src=hashtag_click https://x.com/hashtag/auspol?src=hashtag_click https://x.com/hashtag/springst?src=hashtag_click,1310730607710748673
imwillclancy,2020-09-28T23:58:23.000Z,Was I always fascinated by why a bunch of crows are squawking loudly nearby or is this COVID related?,,1310730606733451264
michael88larson,2020-09-28T23:58:22.000Z,Your cure is worse than the disease. I sure hope these students in isolation can handle it.  thecollegefix.com/bulletin-board …,https://t.co/Qzh3F6C1gv,1310730604221288449
OrcaWhale_T63,2020-09-28T23:58:22.000Z,"I'll give him a week. Covid-19 positive. Bets, anyone?",,1310730603260768257
theriver997,2020-09-28T23:58:22.000Z,"Two new COVID-19 cases on Vancouver Island, 267 in B.C over the weekend  mycampbellrivernow.com/50433/two-new- …",https://t.co/gkEkavBZAV,1310730602862096384
molten_git,2020-09-28T23:58:22.000Z,I'm celebrating covid coz the planet wants to fuck over one cool person me and I'm not even cool I'm sexy nje,,1310730602346352643
BigDaddyTail,2020-09-28T23:58:22.000Z,"#Florida, because who gives a shit #COVID19 #coronavirus",https://x.com/hashtag/Florida?src=hashtag_click https://x.com/hashtag/COVID19?src=hashtag_click https://x.com/hashtag/coronavirus?src=hashtag_click,1310730602195419136
kath2cats,2020-09-28T23:58:21.000Z,The Toll of Reaching Herd Immunity Without a COVID-19 Vaccine  healthline.com/health-news/vi …,https://t.co/xMNwWT3ER3,1310730598860779525
InconvenientTr5,2020-09-28T23:58:21.000Z,"Biggest #POTUS FAILURE Ever:  #Trump  #Covid_19  Strategy  DENY (publicly).  DELAY action.  Move On.     #TRUMP  LEGACY:   *FAILED* #COVID19 Response Led to 203,000+ DEAD #Americans (410,450 DEAD by JAN. 1).  #Trump still has *NO* effective plan to beat #coronavirus.",https://x.com/hashtag/POTUS?src=hashtag_click https://x.com/hashtag/Trump?src=hashtag_click https://x.com/hashtag/Covid_19?src=hashtag_click https://x.com/hashtag/Covid_19?src=hashtag_click https://x.com/hashtag/TRUMP?src=hashtag_click https://x.com/hashtag/COVID19?src=hashtag_click https://x.com/hashtag/Americans?src=hashtag_click https://x.com/hashtag/Trump?src=hashtag_click https://x.com/hashtag/coronavirus?src=hashtag_click,1310730598659624961
Taraecito,2020-09-28T23:58:21.000Z,It’s me. I’m taking a break too. It’s normally easy to stop but I started up again before we went into full lockdown earlier this year. I’ve wanted to buy weed like 3 times today.,,1310730597497700352
JdeRichards,2020-09-28T23:58:20.000Z,"National Police Remembrance Day. While COVID has cancelled the March and church service, we can still get involved by pausing to remember the officers who have fallen in the line of duty, or by wearing a blue ribbon.  @WINNews_CNS",https://x.com/WINNews_CNS,1310730595085901826
orlandosports,2020-09-28T23:58:20.000Z,Fifth time’s the charm? Taggart confident FAU will open season vs. Charlotte after several COVID-19 delays  bit.ly/3n1tflS,https://t.co/TBBwESbRsf,1310730594930880513
pastry212,2020-09-28T23:58:20.000Z,"It was the Police Commissioner. He admitted that's whaat they do for Hospitals, Pubs & Quarantine when understaffed.",,1310730594746130432
5riuss,2020-09-28T23:58:19.000Z,ayeeee is COVID disappearing or something ??,,1310730590744911874
dej_cole,2020-09-28T23:58:19.000Z,I know this jail so tired of me but I’m more tired of them LIKE THEY LITERALLY PUT THEM ON LOCKDOWN EVERY 3-4 days this shit is so frustrating  Zion I’m really tryna get to you I’m so sorry,,1310730590090661888
GeoConservative,2020-09-28T23:58:19.000Z,Oh that's right  Covid attacks ppl after midnight Government isn't using science they're just control freaks,,1310730589797056512
JayNeckhammer,2020-09-28T23:58:19.000Z,Here I found a link that explains a bit  cnbc.com/2020/09/23/swe …,https://t.co/s751ysT5eS,1310730589386035201
ForgottenPAYE,2020-09-28T23:58:18.000Z,BREAKING NEWS   Ex-Northern Ireland Football Chef Brian Donaldson  @Spurschef  of  @ExcludedNI  is taking legal action against UK govt over exclusion from SEISS @KRWLaw  confirmed judicial review proceedings are to be brought v UK Treasury  Read on  amp.belfasttelegraph.co.uk/news/northern- …,https://x.com/Spurschef https://x.com/ExcludedNI https://x.com/KRWLaw https://t.co/jxwF2glXLq,1310730584596058114
LlamaSalami,2020-09-28T23:58:17.000Z,"Correct.  I agree this “pandemic” is taken WAAAYYYY out of proportion and it seems the more we get to know the virus the dumber the decisions that are being made about it.   Nonetheless, 5.4% for that age group is rather significant and should not be confused for 0.054%",,1310730583564103681
nlptrainingja,2020-09-28T23:58:17.000Z,"""Trump Announces Plan to Ship 150 Million Rapid Coronavirus Tests"" by BY KATHERINE J. WU via NYT New York Times  ift.tt/2FZ2uOo",https://t.co/DjReytiTFy,1310730583291637766
jamesbirch11,2020-09-28T23:58:17.000Z,Some people will need to see the bodies or the constant funerals to believe there is a pandemic. Even then they would keep saying it's no worse than...,,1310730582838710272
PaulMeisel,2020-09-28T23:58:17.000Z,"Good article, and reasonable in normal times and situations.  But -- covid is hurting resorts and office properties, and those assets don't sell fast.  If Trump has to raise cash, he's in deep kimchi.  Also I think the valuation methods are a little generous.",,1310730581211328515
yeonseokbeen,2020-09-28T23:58:17.000Z,Hopefully in PH. But our situation is not good due to pandemic.,,1310730580288442369
nlptrainingja,2020-09-28T23:58:17.000Z,"""The Coronavirus Mostly Spares Younger Children. Teens Aren’t So Lucky."" by BY APOORVA MANDAVILLI via NYT New York Times  ift.tt/3jfkIt9",https://t.co/ETCsY2Z9wy,1310730580028522496
TwitPicNotFound,2020-09-28T23:58:16.000Z,This is such a stupid thing to say  she never said that those lives are not important but rather that the new government regulations are disproportionate to the threat Covid poses,,1310730577838997504
PfMV1cDJdfGZHJA,2020-09-28T23:58:16.000Z,"What about the whole ""invitation only, social distancing"" thing do you find confusing?",,1310730575347474435
Stone_of_Help,2020-09-28T23:58:15.000Z,October is Breast Cancer Awareness Month. Join Ebenezer Warriors in a safe and social distancing environment. #staysafe #blessed #breakthrough #stoneofhelp,https://x.com/hashtag/staysafe?src=hashtag_click https://x.com/hashtag/blessed?src=hashtag_click https://x.com/hashtag/breakthrough?src=hashtag_click https://x.com/hashtag/stoneofhelp?src=hashtag_click,1310730574114455552
brewerenglish,2020-09-28T23:58:15.000Z,"I just want to buy a legit space suit before I go back (likely after X-mas, our Sup is actually doing a great job of responding to Covid data).   I've got asthma personally and two twin babies at home. I don't want any of that.",,1310730574110359554
RivertownsPatch,2020-09-28T23:58:15.000Z,"Plus candidate profiles, virtual fire fair and more: nearby news.  trib.al/pTjD4XU",https://t.co/opYxWL1wQC,1310730572122202119
sp00kley,2020-09-28T23:58:15.000Z,covid thoughts,,1310730571224674304
DanGarrett97,2020-09-28T23:58:14.000Z,"But ""The Donald's"" taxes ... #TheResistance & #NeverTrumpers continue to do their best to distract the #US from real threats (like the ""we knew it was going to fail"" #impeachment that took place as #covid19/#coronavirus was spinning up in the #PRC.)",https://x.com/hashtag/TheResistance?src=hashtag_click https://x.com/hashtag/NeverTrumpers?src=hashtag_click https://x.com/hashtag/US?src=hashtag_click https://x.com/hashtag/impeachment?src=hashtag_click https://x.com/hashtag/covid19?src=hashtag_click https://x.com/hashtag/coronavirus?src=hashtag_click https://x.com/hashtag/PRC?src=hashtag_click,1310730570503262215
RelentlessFredm,2020-09-28T23:58:14.000Z,In Hills also. I tweet daily to cty commissioners & mayor reminding them that their order is unconstitutional & that the CDCs own reports show COVID's infection rates & fatality rates are miniscule at best. I urge you to do the same. I don't wear a mask but stores hold the weight,,1310730570285056002
getretailsphere,2020-09-28T23:58:14.000Z,"Glossier chose to close their locations in New York, London, and Los Angeles in August 2020 after temporarily shuttering them at the start of the Covid-19 pandemic. #storeclosure #covid19 #coronavirus #retail #retailrealestate #cre #commercialrealestate hubs.la/H0x4WMj0",https://x.com/hashtag/storeclosure?src=hashtag_click https://x.com/hashtag/covid19?src=hashtag_click https://x.com/hashtag/coronavirus?src=hashtag_click https://x.com/hashtag/retail?src=hashtag_click https://x.com/hashtag/retailrealestate?src=hashtag_click https://x.com/hashtag/cre?src=hashtag_click https://x.com/hashtag/commercialrealestate?src=hashtag_click https://t.co/gAOIp51WXn,1310730570192891905
natasha367b,2020-09-28T23:58:14.000Z,"I'm in my 60s but think I had Covid already & have some immunity. In my church all wear masks, we have to stay in seats until usher tells us to leave (wave if one needs a washroom) & it's well ventilated at least before it gets cold. But I visited another church not so careful.",,1310730570012528643
RainSeym,2020-09-28T23:58:14.000Z,Kontrol Energy Corp is an incredible company with detection Covid-19 technology! Great to see Canadian made! Have you heard about  @SonaNanotech  - also Canadian and has a rapid Covid-19 test (5-15min) with 3rd party validation (96.7% accuracy). FDA and HC pending approval!,https://x.com/SonaNanotech,1310730569928466432
treacherousfish,2020-09-28T23:58:14.000Z,DUCK MASK DUCK MASK DUCK MASK PLSPLSPLSPLS PLS,,1310730569722916864
icenav57,2020-09-28T23:58:14.000Z,7 presumptive positive cases of COVID-19 reported at Nunavut's Hope Bay Mine  cbc.ca/news/canada/no …,https://t.co/JnqE0x3OWD,1310730569525813249
drpatesblog,2020-09-28T23:58:14.000Z,"flu vaccine, even if it is not a sufficient match to the circulating strain to prevent you from getting the flu, it often is enough that people get a much milder illness than they otherwise would have. However, we do have an odd situation with a COVID re-infection case - the",,1310730568682749952
PasadenaGov,2020-09-28T23:58:14.000Z,"It's working!   Wear a mask Only gather with people you live with Stay at least 6 feet away from others Wash hands frequently Avoid touching your eyes, nose and mouth",,1310730567764246528
Get_TechdOut,2020-09-28T23:58:14.000Z,Second covid pc built over discord.  instagram.com/p/CFsxHTzA3oY/ …,https://t.co/yBikefMrE2,1310730567076335616
drpatesblog,2020-09-28T23:58:14.000Z,"This is good thinking, Jason! You are getting it. Generally, some natural infections or in those cases where we have a vaccine, you can either have protection where you don’t get infected at all, or if you do get infected, you often might get very mild or no symptoms. With the  x.com/kettelfish/sta …",https://x.com/kettelfish/status/1310714378447024129,1310730566929584128
mystalkerisadik,2020-09-28T23:58:13.000Z,Whos watching the Southpark pandemic show on Wednesday?!?!,,1310730563586789378
AlexjFerraro,2020-09-28T23:58:13.000Z,to change wallet type /start and click through the bot again until u get to wallet address and re enter in the new meta mask one which can be copied from where it says account at the top,,1310730562815090688
calgaryherald,2020-09-28T23:58:12.000Z,UPDATED: Surgeries postponed and visitation limited further as result of COVID-19 at Foothills Medical Centre  bit.ly/338zuMF #yyc #COVID19AB,https://t.co/LT2pbTKhIz https://x.com/hashtag/yyc?src=hashtag_click https://x.com/hashtag/COVID19AB?src=hashtag_click,1310730562248880128
madelinem1202,2020-09-28T23:58:12.000Z,@cityofhialeah  is there a mandate for face mask in our city? Is there a city curfew? Unfortunately the information coming from  @GovRonDeSantis  is VERY confusing,https://x.com/cityofhialeah https://x.com/GovRonDeSantis,1310730562009784320
nowhitenonsense,2020-09-28T23:58:11.000Z,"What will you never take for granted again, when the pandemic is over?",,1310730558327025664
straits_times,2020-09-28T23:58:11.000Z,Warning signs are flashing ahead of Covid's second US winter  straitstimes.com/world/united-s …,https://t.co/XEjrjtIeRt,1310730556578164736
SylvieGelinet,2020-09-28T23:58:10.000Z,"You will become an ""augmented Human"" and later a trans-human when Dr Frankenstein has finished with you.   But Don't think about that, just :   DON'T TAKE THE VACCINE !",,1310730552098598913
MRein1995,2020-09-28T23:58:10.000Z,Goodwin open out of season for COVID,,1310730551947649027
Nancy43568587,2020-09-28T23:58:10.000Z,Has anyone ever compared Covid rates to Trump's Rallies? These are Covid crowds. Please let me know where I can find that data.,,1310730551490482176
Carla_Jewel,2020-09-28T23:58:10.000Z,I keep forgetting my mask! I’m boutta tape it to my forehead,,1310730551066755072
straits_times,2020-09-28T23:58:10.000Z,"Quebec imposes new curbs, Ontario warns of 'more complex' second wave as Canada sees Covid-19 cases spike  straitstimes.com/world/americas …",https://t.co/UjU0IJ9Tlh,1310730550987063297
RiverviewSN,2020-09-28T23:58:09.000Z,"Pleasant Valley VB returns to floor after two-week COVID quarantine, shows little rust, sweeps Weaver 25-7, 25-9, 25-10",,1310730550064435201
goIdensungie,2020-09-28T23:58:09.000Z,ya i’ve been quarantined since the 18th but i just got covid last friday so i haven’t seen anyone for like 2 weeks but they were being curious in the gc so i decided to tell them just bc kdbskfnsk,,1310730549913358336
Ungus2112,2020-09-28T23:58:09.000Z,No. The damage to the economy was the closing of businesses and putting working age ppl out of work despite the fact that they have a very very low mortality rate from covid.   You Qtine sick and at risk ppl. Not healthy ppl.,,1310730548743208965
ShiningSeaUSA,2020-09-28T23:58:09.000Z,"Oh you poor whiny babies. Losing your individuality because of a mask that protects other people from a deadly virus. If that’s the individuality you’re protecting, society has no use for you",,1310730547094749184
dman1949,2020-09-28T23:58:09.000Z,@MSNBC  @maddow  @SenSchumer  @SpeakerPelosi  @JoeBiden  @SenKamalaHarris  @KamalaHarris  Ask Trump what happen to the 2.5 Trillion Dollars from the first COVID-19 Stimulus? Why is it that only Trump and Steve Munchin know where it went? Americans want to know?,https://x.com/MSNBC https://x.com/maddow https://x.com/SenSchumer https://x.com/SpeakerPelosi https://x.com/JoeBiden https://x.com/KamalaHarris,1310730546654392322
blazeorangeok,2020-09-28T23:58:08.000Z,Apparently you can just be a husky boy with a cutoff security T-shirt and not wear a mask at planet fitness,,1310730545530376193
basicukegirl,2020-09-28T23:58:08.000Z,the way im supposed to do that this year but i wont bc of covid,,1310730545081573379
hautaps,2020-09-28T23:58:07.000Z,Search engines truly are your friend.  latimes.com/world-nation/s …,https://t.co/DqyIveNyQ9,1310730541570818053
howintensive,2020-09-28T23:58:07.000Z,"i don't think the la clippers should have fired doctor rivers, especially during a pandemic",,1310730541176684545
GlobalNational,2020-09-28T23:58:07.000Z,"Coronavirus outbreaks declared at Yorkton, Sask., hospital, high school, gym  dlvr.it/RhY6Cn",https://t.co/DbA6WE7iXb,1310730539800821760
SDHamiltonVIC,2020-09-28T23:58:07.000Z,"‘The back-and-forth between the State and Federal governments comes as health officials scramble to contain a COVID-19 outbreak on board the Al Kuwait vessel, docked in Fremantle, after six confirmed cases on the ship.’ #Al-Kuwait #auspol #RubyPrincess",https://x.com/hashtag/Al?src=hashtag_click https://x.com/hashtag/auspol?src=hashtag_click https://x.com/hashtag/RubyPrincess?src=hashtag_click,1310730538391494656
Dizzedcom,2020-09-28T23:58:07.000Z,Two family members died of Covid-19. Hear his message to those who won’t wear masks  dizzed.com/two-family-mem …,https://t.co/UcCXIr5WBq,1310730537699475456
fukumimi,2020-09-28T23:58:06.000Z,"don’t let Leopalace blame it in COVID-19, they were never exactly the good guys",,1310730537401606144
Misfit1975,2020-09-28T23:58:06.000Z,"I think much of it depends on where you live and how strict they're being, I'm glad to wear a mask in the grocery store or anywhere I'm going to be indoors around a lot of people. But some places people will get arrested for being away from people outside without one.",,1310730536973934593
GordyMegroz,2020-09-28T23:58:06.000Z,This is the first time I’ve read a  @nytimes  story in which I personally know half the people quoted. An interesting look at how Covid refuges fled to the town over from my hometown.  nytimes.com/2020/09/26/us/ …,https://x.com/nytimes https://t.co/lnXigfkBtk,1310730533651976192
TheCelticTampon,2020-09-28T23:58:05.000Z,"First credit on Bob's Burgers with the Season 11 premiere last night!! So surreal to see my name in the credit of this show.  Working on 2 cartoons, Bob's and BOTB, in the pandemic? Crazy, but exhilarating times. Bob's has an AMAZING crew and talented artists.",,1310730531928064001
CraigSm75820590,2020-09-28T23:58:05.000Z,No one has to wear a mask outside wth is he talking about?,,1310730530317578240
badibulgator,2020-09-28T23:58:05.000Z,Ahhh so THAT’s why he’s so embarrassed with wearing a mask.,,1310730530254655489
velodus,2020-09-28T23:58:05.000Z,"""The American cult of the individual denies not just community but the very idea of society. No one owes anything to anyone. All must be prepared to fight for everything: education, shelter, food, medical care."" rollingstone.com/politics/polit …",https://t.co/q9QsRAqVr4,1310730529503838208
WucherG,2020-09-28T23:58:05.000Z,"Same here. I know he won’t cheat on his taxes, denigrate women or our veterans, will help WE THE PEOPLE get through the worst pandemic of our time, will work on closing the tax loopholes, etc.",,1310730529273188354
CATZINC,2020-09-28T23:58:04.000Z,They've been working straight through the pandemic. And so cheerful ! Thanks.  @BibbSchools,https://x.com/BibbSchools,1310730528811868160
AmberOwens18,2020-09-28T23:58:04.000Z,"Racial disparity of COVID-19 reduced ‘dramatically' in Michigan, data shows  modernhealthcare.com/safety-quality …",https://t.co/fnw05Zgg1f,1310730528572600320
itsnikilee,2020-09-28T23:58:04.000Z,"75,000 Pandemic-Related Deaths of Despair, Yet the Government Won't Provide Mental Healthcare #care2  thepetitionsite.com/tell-a-friend/ …",https://x.com/hashtag/care2?src=hashtag_click https://t.co/yX0ImgBtbp,1310730525351477253
galtervich,2020-09-28T23:58:04.000Z,me and mickey milkovich being red flannel shirt mask wearing besties,,1310730525024321542
milind59523144,2020-09-28T23:58:03.000Z,Water shortages make pandemic hygiene tough in Mexico City  dlvr.it/RhY67h,https://t.co/hJW7vvGb0t,1310730523925295106
Wilkensonknaggs,2020-09-28T23:58:03.000Z,Sweden's unrowded residences may well have slowed coronavirus distribute,,1310730523321405440
LiveSquawk,2020-09-28T23:58:03.000Z,"Bank Of Japan Summary Of Opinions: It Is Appropriate For The Bank To Maintain The Current Monetary Policy For The Time Being And, As Before, Take Additional Measures If Necessary While Closely Monitoring The Impact Of Covid-19",,1310730523082448897
AnthoniaOrji_,2020-09-28T23:58:03.000Z,Nigeria Records 136 New COVID-19 Cases:   Nigeria on Monday reported 136 fresh COVID-19 cases. This is according to the latest update released by the Nigeria Centre for Disease Control (NCDC). The new infections were reported in 12 states of the…  dlvr.it/RhY682,https://t.co/THX6zMIoEM,1310730523040309248
substndrt,2020-09-28T23:58:03.000Z,they say there are mosquitos carrying covid now,,1310730521765384194
demingheadlight,2020-09-28T23:58:03.000Z,NM health officials report COVID-19 related deaths rise to seven in Luna County  rssfeeds.demingheadlight.com/~/636074104/0/ …,https://t.co/LgGtiClZou,1310730521610276871
_SpicyKee,2020-09-28T23:58:03.000Z,I smell COVID already,,1310730521589231617
mattrdebellis,2020-09-28T23:58:02.000Z,"The emergency is that unlike a car, in which accidents occur by some mistake by drivers, the pandemic has claimed over 200,000 lives in America since March alone, and counting. According to the National Safety Council, 38,800 people died in 2019 from car accidents.",,1310730519580114945
vcstar,2020-09-28T23:58:02.000Z,Moorpark Unified School District will be the first in the county to reopen public schools for in-person learning. Here's what we know:  vcstar.com/story/news/202 …,https://t.co/8Us0Gsy1ey,1310730518875516934
medicinehelp,2020-09-28T23:58:02.000Z,The Coronavirus Mostly Spares Younger Children. Teens Aren’t So Lucky.  americanconsultantsrx.services/the-coronaviru …,https://t.co/zaWqtWyXEz,1310730517680197633
KelownaCourier,2020-09-28T23:58:02.000Z,A fifth COVID-19 case has been connected to an outbreak of the disease at a Kelowna church.  kelownadailycourier.ca/news/article_c …,https://t.co/kARO2depyV,1310730517374009345
BattleBornMaga,2020-09-28T23:58:01.000Z,Open Nevada! Remove mask mandates! Obviously people need to get out of their homes.,,1310730513942863873
WXOW,2020-09-28T23:58:01.000Z,Feeling overwhelmed with an overload of information? Here are some coping tips:  wxow.com/2020/09/28/sim …,https://t.co/LHUUJnfo4v,1310730513406197761
ccsurvivor45,2020-09-28T23:58:00.000Z,@JoyAnnReid  my god Florida is going to be very sad very soon #DeSantis #Atlas is wrong spread to homes and businesses will be horrible escalation of Covid and increase deaths and crush health care system! Who but Trump can stop this governor!,https://x.com/JoyAnnReid https://x.com/hashtag/DeSantis?src=hashtag_click https://x.com/hashtag/Atlas?src=hashtag_click,1310730511468306432
ginnymoon2,2020-09-28T23:58:00.000Z,Florida lifts all COVID-19 restrictions  a.msn.com/05/en-us/BB19v … DeSantis belies any definition of being a leader-you can't see the nose-ring but he's led around by one-trust me. Shame on you!!  EGAD!!!!,https://t.co/FfkwY8iOCe,1310730510751002625
ShyGuy16056254,2020-09-28T23:58:00.000Z,*Shy Guy shrieks and holds onto his mask*  “NO!”,,1310730510474174467
Indira_L,2020-09-28T23:58:00.000Z,Black Microbiologists Push for Visibility Amid a #Pandemic - The New York Times  nytimes.com/2020/09/28/sci …,https://x.com/hashtag/Pandemic?src=hashtag_click https://t.co/dEksvzhOX6,1310730508251410434
HappyTigah,2020-09-28T23:57:59.000Z,"I guess you just know LSU fans on the tweeter. Not one fan I know expected us to do much this year. Lost 16 to NFL, 2 more starters to Covid,  and 2 more out for game Sat.   Either way, must suck knowing LSU had the best team in history last year. Now, geaux bang your cousin",,1310730507827793920
5thGen2010,2020-09-28T23:57:59.000Z,"Stalled because they put non pandemic related funding into the bill.  Then instead of making changes that the Senate could agree on, Nancy threw a fit and sent everyone home for months. No attempt to make changes...until today.",,1310730505252372481
RonaldD63535030,2020-09-28T23:57:58.000Z,"WTF? We can’t even travel elsewhere, no other country will have us! WTF?  CDC drops 14-day self-quarantine recommendation for out-of-state, international travelers - Fox News",,1310730503415238656
firingouty,2020-09-28T23:57:58.000Z,"It's been either rain or sun. However today the entire neighbourhood is covered in first fog of the fall.......  Wow, I don't know if it clears by the time dad gets ready to take me to exam centre in another town amidst the pandemic",,1310730502521810944
