User_name,Datetime,Content,Links,Tweet_ID
skift,2020-06-27T23:59:59.000Z,"Hotel owners face rising operational costs to keep up with new coronavirus cleaning standards. While some technology platforms could trim labor costs, these offsets aren't expected to hit until tech-savvy business travel returns.  bit.ly/2AXZoYs",https://t.co/nEasXEYLVQ,1277028939798634497
iOptimizeRealty,2020-06-27T23:59:59.000Z,What Tenants Should Expect from Their Landlords Right Now #CRE #NewNormal #COVID-19 #TenantTips hubs.ly/H0rTfVp0,https://x.com/hashtag/CRE?src=hashtag_click https://x.com/hashtag/NewNormal?src=hashtag_click https://x.com/hashtag/COVID?src=hashtag_click https://x.com/hashtag/TenantTips?src=hashtag_click https://t.co/jRHLv3FiC6,1277028939114913797
WBTV_News,2020-06-27T23:59:59.000Z,The federal government has been sending a foggy message over the past few months about whether people should wear face masks during the pandemic.  wbtv.com/2020/06/27/wha …,https://t.co/DYKY6l9phi,1277028938754281473
spectatorindex,2020-06-27T23:59:59.000Z,"Coronavirus, worldwide.  Cases: 10,070,000  Deaths: 500,500  Recoveries: 5,450,000",,1277028938699571200
FredNGingaBuns,2020-06-27T23:59:59.000Z,10 things from Covid-19 dat will ‘stick’:  1-High price city centre offices will close n ‘office’ work will b done from home 2-Office Work will be done throughout day with no loss of productivity 3-People will not travel for meetings 4-On line orders n deliveries will sky rocket.,,1277028938636840962
ninesautomata,2020-06-27T23:59:59.000Z,holy fucking shit i’ve been thinking what yoko taro looks like is actually hideki kamiya because of that one clip where kamiya is under the emil mask i only just saw an actual picture of him,,1277028938049445888
Crypto88888,2020-06-27T23:59:59.000Z,"Bitcoin Bull Run Was Here, But White Swan Pandemic Put It On Lockdown  cryptosonline.com/2020/06/27/bit …",https://t.co/Y2EGUpGMi9,1277028937525350407
Dovetail,2020-06-27T23:59:59.000Z,Check out the NEW COVID-19 Applications for HR - Dovetail Check Track Trace - Health Screening & Contact Tracing software by Dovetail Software  bit.ly/2Nxv9tV #HR #ContactTracing #FutureOfWork #EmployeeExperience,https://t.co/psQdCZkvXZ https://x.com/hashtag/HR?src=hashtag_click https://x.com/hashtag/ContactTracing?src=hashtag_click https://x.com/hashtag/FutureOfWork?src=hashtag_click https://x.com/hashtag/EmployeeExperience?src=hashtag_click,1277028937407836160
Uenochris,2020-06-27T23:59:59.000Z,For those out there who say Biden and Trump are equally bad.  Biden wears a mask. That ought to be all you need to know.,,1277028936623390721
tha_rhymeanimal,2020-06-27T23:59:58.000Z,2020 Words I’m Sick Of... #SMDH   1. Unpresidented  2. Asymptomatic  3. Quarantine  4. Systemic 5. Closed 6. COVID-19 7. New Normal 8. Physical Distancing  9. Self Isolation  10. CERB,https://x.com/hashtag/SMDH?src=hashtag_click,1277028935042240512
covid_4891,2020-06-27T23:59:58.000Z,That’s awesome!!,,1277028934937456640
Mia_Atoms,2020-06-27T23:59:58.000Z,ik i run my big ass mouth but at least i wear a mask :),,1277028934731915264
TheBenBoothShow,2020-06-27T23:59:58.000Z,"I know the answer is zero in WV, but how many college-age kids have died from Covid-19 in the United States? Also, how many have been hospitalized due to the virus?",,1277028933825855497
chance_layton,2020-06-27T23:59:58.000Z,Have an eating disorder? Try our new COVID tests!,,1277028933800792065
MorwaMNM,2020-06-27T23:59:58.000Z,"Unfortunately 500bn relief fund is finished and government doesn't have money to keep us on lockdown Level 5,but those who want L5 can remain at home while some of us are ready for L2 with our masks and sanitizers ready always...",,1277028933515513856
alexjgoldstein,2020-06-27T23:59:58.000Z,"Remind me why MA is reopening indoor dining? I have nothing but deep sympathy re: the economic consequences for restaurant owners, and fully support serious economic aid, but how does it help them if we open for three weeks and then completely shut down when we surge again?",,1277028933037367296
tdcredrider,2020-06-27T23:59:58.000Z,"@IvankaTrump  @MikePennce   it’s one thing for people to think you’re an imbecile, but to open your mouth and prove it is really helpful to solidify it.  Well play Mr VP! We have to find a way to have your medical coverage revoked on behalf of all that perished. Why do u now mask?",https://x.com/IvankaTrump https://x.com/MikePennce,1277028931745406976
alex_siegal,2020-06-27T23:59:57.000Z,"apparently, if you’re Floridian, you don’t actually have to cover your nose with your mask. who knew",,1277028931422609409
zorabet,2020-06-27T23:59:57.000Z,"Uh, the moving. Not COVID.",,1277028929539313667
SnootyWizard,2020-06-27T23:59:57.000Z,"You aren’t alone. As a parent who lives in a different country from our immediate family, taking vacations is a lot to plan and when you can’t take the one that was planned because of covid, it’s sets the mood. This is a tough year for sure. We will get through it.",,1277028928985739269
FunBags28481740,2020-06-27T23:59:57.000Z,When will  @premierleague  take the knee for all the women murdered each day in the global epidemic of VAWG? Plenty of whom are in the UK.,https://x.com/premierleague,1277028928683679744
jqsnizzle,2020-06-27T23:59:57.000Z,Naw I wear an N95 there,,1277028928415137795
JoAnnPDX,2020-06-27T23:59:57.000Z,"A truly heartwarming story about a shelter model we can continue to build on. So much appreciation for  @pdxjoin ,  @StreetRoots , Raven, and the entire community coalition working with the city to provide a safe place to shelter in place for those most vulnerable to COVID-19.",https://x.com/pdxjoin https://x.com/StreetRoots,1277028927504932865
TheOrigCatfood,2020-06-27T23:59:56.000Z,Facts: azcentral.com/story/news/loc …  Care to debate?,https://t.co/AYCWnMAV0v,1277028927387643906
enzo_the_baker_,2020-06-27T23:59:56.000Z,"Fortunately, that is addressed in the ADA. *Reasonable accommodations * ex. Grocery store, they don't have to let you in, but can offer delivery or pick up. No mask, no legal req. to let you in.",,1277028926796165125
swd2,2020-06-27T23:59:56.000Z,"Right now, deaths are low because we’re much better at treating patients than we were in March/April. But what happens when the drugs run out?  abcnews.go.com/Health/us-shor …",https://t.co/gHmrQupUsm,1277028926460698627
resistanceparti,2020-06-27T23:59:56.000Z,If those are only confirmed Covid there’s probably another 1k patients that are suspected Covid that are waiting for official confirmation.  These are California’s numbers which is already feeling the strain as well.,,1277028925936287745
nolanschmidt19,2020-06-27T23:59:55.000Z,Do be a bitch. Wear a mask!!,,1277028922555850752
admira_la_vida,2020-06-27T23:59:55.000Z,Coronavirus is not the flu. It’s worse.  youtube.com/watch?v=FVIGhz …  admiralavida.com/coronavirus-is …,https://t.co/jUYUtTZCK0 https://t.co/CO2E6ntEIZ,1277028922262077441
HeatherCoplin,2020-06-27T23:59:55.000Z,"@WinCoFoods  Had a man in frozen foods walking up to people daring them to say something about him not wearing a mask, physically threatening your customers and your employees did nothing!",https://x.com/WinCoFoods,1277028921658101760
MrSokkie,2020-06-27T23:59:55.000Z,At least now we know what it takes for Twitter/the media to not talk about Covid for a day or two. #TRE45SON,https://x.com/hashtag/TRE45SON?src=hashtag_click,1277028921612152832
chinesejimi,2020-06-27T23:59:55.000Z,"#Covidhoax #VirusHoax #NoMasks   ""This means that a confirmed unspecific test result is officially sold as specific""  #COVID19 PCR Tests are Scientifically Meaningless  off-guardian.org/2020/06/27/cov …",https://x.com/hashtag/Covidhoax?src=hashtag_click https://x.com/hashtag/VirusHoax?src=hashtag_click https://x.com/hashtag/NoMasks?src=hashtag_click https://x.com/hashtag/COVID19?src=hashtag_click https://t.co/CUFdCnRXek,1277028920404119552
bavsarino,2020-06-27T23:59:55.000Z,Im going to let it play out before assuming. There aren’t any ICU beds left in Arizona right now so it’s certainly a harsh reality that we are still in the midst of this pandemic,,1277028919804387329
NorrSerena,2020-06-27T23:59:54.000Z,Tune into COVID Diaries: NOTES from the Frontlines featuring the Bookstore!  youtu.be/J3d9GFzgKGQ via  @YouTube,https://t.co/3MPMuahwyJ https://x.com/YouTube,1277028918130810886
Highdumpster,2020-06-27T23:59:54.000Z,"Btw I got this because at the park I work at you need a mask to enter. Some lady brought one in but immediately threw hers away, and when I confronted her about it she said “well it feels uncomfortable and it’s not really necessary anyway”",,1277028916486647810
UsernameChucks,2020-06-27T23:59:54.000Z,"The virus leads to black lives matters leads to not wearing a mask leads to civil liberties.... y’all GOP really need to stop listening to Rush, Hannity,  and Graham",,1277028915899437059
DawnMar45506877,2020-06-27T23:59:54.000Z,"Death rate is way lower than we first thought, per  @CDCgov . This is not the zombie apocalypse. technocracy.news/cdc-confirms-e …",https://x.com/CDCgov https://t.co/j4m1bfE0sY,1277028915429638145
CelestDragon09,2020-06-27T23:59:54.000Z,"""I can't wear a mask cuz I have a health condition""  But you're going outside when there is a virus... and even if you can't wear a mask cuz of your autism, don't you have friends or family who can go out for you?? Just wear a goddamn mask, it's the only thing we ask of you.",,1277028914867699713
Mz_BK_Phoenix,2020-06-27T23:59:53.000Z,Gotta take care of ourselves more than ever now. Not even just because of COVID going around. But many of us are older now. Our bodies don't handle stress the same way it did 15 years ago.,,1277028913408102401
nermindaul,2020-06-27T23:59:53.000Z,"I dare come back to this, so sorry. I'm actually now re-watching Hunger Games (don't ask, lockdown & all) & realised the big that we missed in the previous convo is The Capitol! Where? I know, that's almost how wars start... (the 13th district that had been wiped out can wait)",,1277028912053260288
Silva24D,2020-06-27T23:59:53.000Z,"I am nothing if not lazy. I had all the time in the world during this #quarantine to start a tally of how many times my husband forced me to discuss house paint color and I completely let the opportunity slip past me. Oh well, on to the next obsession",https://x.com/hashtag/quarantine?src=hashtag_click,1277028911831035908
10velydreams,2020-06-27T23:59:53.000Z,"These people piss me off so much. I lost my grandpa to Covid-19, he had COPD. Unfortunately, he got sick because my uncle didn't take care when he started feeling symptoms. He didn't wear a mask.",,1277028911747141632
ccarolionn,2020-06-27T23:59:53.000Z,Because protesters are time and time again wearing masks. Almost every single protester in every major protest has worn a mask.,,1277028910971129856
BrianGPowell,2020-06-27T23:59:53.000Z,"#CoVId19 is a #Hoax & #PsyOp  But the #Terrorist attack continues  Do NOT take their tests--some swabs have already been found to be contaminated  Do NOT take their ""#Vaccine""--right now they're testing it on #Africans",https://x.com/hashtag/CoVId19?src=hashtag_click https://x.com/hashtag/Hoax?src=hashtag_click https://x.com/hashtag/PsyOp?src=hashtag_click https://x.com/hashtag/Terrorist?src=hashtag_click https://x.com/hashtag/Vaccine?src=hashtag_click https://x.com/hashtag/Africans?src=hashtag_click,1277028910694367232
Hectorsam60,2020-06-27T23:59:51.000Z,Those kids are safer against Coronavirus in the detention centers. That judge is an idiot and may be sending them to their death.,,1277028904935526400
TruJustice3,2020-06-27T23:59:51.000Z,another time Big Pharm harms people.   Be a smart vaxxer.. do your own research bc these vaccine companies don't care.   Neither does the CDC who is responsible for this!!!!,,1277028904776216577
_BEING_HUMOUR_,2020-06-27T23:59:51.000Z,"#PostponeNEETandJEE this is absolutely not the right time to conduct exams like #JEE & #NEET. Which holds over 1.6 M candidates nation-wide. Keeping in mind the current pandemic situations, I urge Hon.  @DrRPNishank  ji to please  postpone the exams. @HRDMinistry",https://x.com/hashtag/PostponeNEETandJEE?src=hashtag_click https://x.com/hashtag/JEE?src=hashtag_click https://x.com/hashtag/NEET?src=hashtag_click https://x.com/DrRPNishank https://x.com/HRDMinistry,1277028903782146049
heatherkbuen,2020-06-27T23:59:51.000Z,I had to go to  @NorthEastMall  in Hurst and most everyone was wearing a mask,https://x.com/NorthEastMall,1277028903509528577
Tepek13,2020-06-27T23:59:51.000Z,Thank you. Let's hope after Nov 3 I can maybe peace back together some of my heart providing covid 19 dosen't get me first. Thank you again. Pls retweet every where and anywhere. All my va friends are dead. I'm so sad now......,,1277028903136231424
Cindy84529464,2020-06-27T23:59:50.000Z,"Trump visits private golf course as US battles rapid surge in coronavirus cases  news.yahoo.com/trump-visits-p … via  @YahooNews   Leave the President alone! He needs to get away from Washington for awhile! Needs the fresh air, and exercise! He planned to go to NJ, but canceled!",https://t.co/b071SuP0Mj https://x.com/YahooNews,1277028901961846791
Papakahuna,2020-06-27T23:59:50.000Z,Covid kicking black Men asses,,1277028900808294400
DCulottes,2020-06-27T23:59:50.000Z,"Now this is interesting - an account that says Trader Joe meltdown woman staged the whole thing, went through the store deliberately trying to provoke a mask fight.  To what purpose, one wonders?",,1277028900531404805
deonandan,2020-06-27T23:59:50.000Z,. @nntaleb  responds to John Ioannidis perplexing position on COVID extreme reaction,https://x.com/nntaleb,1277028899357167616
Professing_Prof,2020-06-27T23:59:50.000Z,There was no need for a ban. A competent leader would have tested everyone before allowing them into the country. But Trump is not competent. He tested no one. He had no tests made up. Every Covid death is 100% Trump’s fault,,1277028898971299841
evenparadise,2020-06-27T23:59:49.000Z,Why didn’t they just have a monkey mask? Instead of the dark make up? ..she could’ve just avoided it all with the mask LOLOL.... it’s also a shame it can’t be drawn without people saying it’s blackface,,1277028897763348481
ssvikings,2020-06-27T23:59:49.000Z,"J.MAK | Chatham Bars Inn Resort and Spa  guest with a cough, shortness of breath, or other known symptoms of COVID-19.  jmak.com/hotels/chatham …",https://t.co/DuzarBWq4L,1277028897452888065
ALefthandedLady,2020-06-27T23:59:49.000Z,"That means that 80% of particles the virus's size. Not 100% of that 20% will be viruses. That means if I wear a mask, my mask protects me from 20% of particles, which is probably less than 10% virus.  (3)",,1277028895766822912
sunnydaykitty1,2020-06-27T23:59:49.000Z,My mom died of covid and I am pissed the fuck off and devastated that I never got the chance to say goodbye.,,1277028895657779200
PamMktgNut,2020-06-27T23:59:49.000Z,"#Coronavirus in the U.S.: Latest Map and Case Count   12k nursing homes &  long-term care facilities. 282k+ residents /employees infected in those homes, 54k+ died. 40% deaths in USA tied to nursing homes & other long-term care facilities. #covid19   nytimes.com/interactive/20 …",https://x.com/hashtag/Coronavirus?src=hashtag_click https://x.com/hashtag/covid19?src=hashtag_click https://t.co/IgN8TurccM,1277028895238340610
AmuWetty,2020-06-27T23:59:48.000Z,How about posting case summaries of independant research on Covid-19 instead of parroting propoganda.,,1277028893568843776
Badger_Beeps,2020-06-27T23:59:48.000Z,Do you know what the world record for fastest vaccine development is? 4 years. Average is 15. Wear your damn masks please.,,1277028893376098306
Monika_RoyalA,2020-06-27T23:59:48.000Z,"Yes. Except the email & illegal server use to exist. Except for that. Hey those medical experts that said the #PeacefulProtesters rioters, looters, #DemocratsAreDestroyingAmerica  protest ""en masse"" nationwide are they blaming #COVID increases to two #Trump2020 rallies? For real?",https://x.com/hashtag/PeacefulProtesters?src=hashtag_click https://x.com/hashtag/DemocratsAreDestroyingAmerica?src=hashtag_click https://x.com/hashtag/COVID?src=hashtag_click https://x.com/hashtag/Trump2020?src=hashtag_click,1277028892193296384
POCX100,2020-06-27T23:59:48.000Z,"Many unemployed will be moving to Europe to find work post COVID & post Brexit. The EU will recover more quickly, the benefits for highly skilled workers are considerable.  #Brexit voting window cleaners and other geniuses are in high demand and they’ll do well.  #BrexitReality",https://x.com/hashtag/Brexit?src=hashtag_click https://x.com/hashtag/BrexitReality?src=hashtag_click,1277028891706691584
cmail_biz,2020-06-27T23:59:48.000Z,Regional Queensland businesses hit hard by COVID-19 pandemic ⁦ @couriermail ⁩   couriermail.com.au/coronavirus/re …,https://x.com/couriermail https://t.co/4EBvKEu8zs,1277028891375177728
maddiemcelveen,2020-06-27T23:59:47.000Z,add “due to the pandemic” after any twenty one pilots song. i’ll go first: level of concern due to the pandemic. @twentyonepilots  @tylerrjoseph  @joshuadun  #twentyonepilots,https://x.com/twentyonepilots https://x.com/tylerrjoseph https://x.com/joshuadun https://x.com/hashtag/twentyonepilots?src=hashtag_click,1277028889630511106
WatchOurCity,2020-06-27T23:59:47.000Z,"(AP News) Arkansas reports 570 more coronavirus cases, 10 more deaths  watchourcity.com/ap-news/arkans … #BarAndNightClubOperators #Business #ConsumerServices #ContractsAndOrders #CorporateNews #Discrimination #DiseaseOutbreaks",https://t.co/upzJBPJq03 https://x.com/hashtag/BarAndNightClubOperators?src=hashtag_click https://x.com/hashtag/Business?src=hashtag_click https://x.com/hashtag/ConsumerServices?src=hashtag_click https://x.com/hashtag/ContractsAndOrders?src=hashtag_click https://x.com/hashtag/CorporateNews?src=hashtag_click https://x.com/hashtag/Discrimination?src=hashtag_click https://x.com/hashtag/DiseaseOutbreaks?src=hashtag_click,1277028888888082433
robisraelart,2020-06-27T23:59:47.000Z,"Maga face mask ideas so Trump supporters will wear them. First round will be Pepe the Frog, Punisher skull w/ Trump hair, Confederate flag, Tomi Lauren’s face, 1/2 a Coors Lt can, a Q, & of course Maga. I would do a swastika but I doubt they’d give up the game that easily.",,1277028888628072450
FriasRene,2020-06-27T23:59:47.000Z,My Mask Is Fina be Part if my FIT WHEN IM OUT OF Quarantin !,,1277028887516545024
clarbusta,2020-06-27T23:59:47.000Z,UPDATE ON #COVID19 CASES IN ARKANSAS: The ADH reports 10 new deaths today - at least 8 of those are in #NWark and the River Valley.  WASHCO: 3 new deaths (27 total) BENCO: 3 new deaths (18 total) SEBCO: 2 new deaths (4 total) #NWAnews #coronavirus,https://x.com/hashtag/COVID19?src=hashtag_click https://x.com/hashtag/NWark?src=hashtag_click https://x.com/hashtag/NWAnews?src=hashtag_click https://x.com/hashtag/coronavirus?src=hashtag_click,1277028887155924992
bloodofgray,2020-06-27T23:59:46.000Z,"Ok Sarah,no jokes,only interpretations.Unless you joke about the “my mask,my panties;things must breath” lady.:)",,1277028884798676992
Alexturbin04401,2020-06-27T23:59:46.000Z,"Im not an anti mask moron but you have to have a little understanding, they can be suffocating, hot and uncomfortable. Oh wait they can save your life and someone elses!",,1277028883901165571
TweetOfWill,2020-06-27T23:59:46.000Z,"Covid party at 1am anyone? Phoned it in the find out half the street has called it in, gonna watch Netflix til the fuzz arrives and the real entertainment starts.",,1277028883532075013
yeshecant,2020-06-27T23:59:46.000Z,"P.S. I want you to ask yourselves, my fellow Americans, if you think that in other countries, the phrase “face mask debate” is actually getting a lot of usage in daily conversations. Because, I assure you, it isn’t.",,1277028883477540877
1_OfTheseDaze,2020-06-27T23:59:46.000Z,"Free Reality Winner She tried to prevent the very scenario we find ourselves in now. She is still being held in a COVID-19 infested federal prison. She tried to do the right thing; she is a HERO, not a criminal!  #FreeRealityWinner  #RealityWinnerIsAHero #FreeReality",https://x.com/hashtag/FreeRealityWinner?src=hashtag_click https://x.com/hashtag/RealityWinnerIsAHero?src=hashtag_click https://x.com/hashtag/FreeReality?src=hashtag_click,1277028882902810624
RyanLS20,2020-06-27T23:59:46.000Z,"""The promise of reopening wasn’t that there would be no additional cases — most people conceded that there would be. The promise of reopening was that we could begin a necessary return to normal life, while managing new outbreaks, hitting the brakes when and where needed...""",,1277028881472651270
SshuttlesWorthh,2020-06-27T23:59:45.000Z,America’s brainwashing has done a number on these types of people. No one is telling you to wear a mask in your car or at home but if you’re going to go grocery shopping you can’t put a mask on for 30 minutes? Spoiled fucking brats man it’s infuriating.,,1277028880977661956
StephyGrossman,2020-06-27T23:59:45.000Z,Are we 100% sure Rapunzel's hair was so long because her evil stepmom wouldn't let her cut it and NOT because she was too afraid to go to the hairdresser? #pandemic,https://x.com/hashtag/pandemic?src=hashtag_click,1277028879975297026
paulrprichard,2020-06-27T23:59:45.000Z,#COVIDIsReal >95% UK CV Deaths Pre-Existing Condition. Empty Coffins (media silent) paulthepaperbear.wordpress.com/2020/06/12/you …,https://x.com/hashtag/COVIDIsReal?src=hashtag_click https://t.co/CH4WXtgIpA,1277028879883001868
relentlessself,2020-06-27T23:59:45.000Z,Started fear the walking dead. OH MY GOODNESS ITS AWESOME. And feels weirdly current. What did you all think?  #twd #fearthewalkingdead #lockdown,https://x.com/hashtag/twd?src=hashtag_click https://x.com/hashtag/fearthewalkingdead?src=hashtag_click https://x.com/hashtag/lockdown?src=hashtag_click,1277028877936844800
WesleyFSine1,2020-06-27T23:59:44.000Z,Religion is the feeling we hang on to during a crisis.  Church a place where we can feel the spirit and be reassured that God loves us and will carry us through the trials and tribulations of the pandemic and life. Free agency is the key.  Government needs to its exercise,,1277028874610601984
jbayalajr,2020-06-27T23:59:44.000Z,228 new coronavirus cases today for Nueces County.  @kiii3news,https://x.com/kiii3news,1277028874556264448
4f7b9da92b51497,2020-06-27T23:59:44.000Z,So? You repeatedly say this coronavirus is under control and going away yet Florida Arizona and Texas are shutting back down again,,1277028874292023296
jsayler,2020-06-27T23:59:44.000Z,Doctor on Covid-19 task force briefings: 'Stop screwing around' cnn.com/videos/health/ …,https://t.co/cWxV8403QY,1277028872890888192
Fathead826,2020-06-27T23:59:43.000Z,I will never forgive Trump voters.   cbsnews.com/amp/news/feder …,https://t.co/yiv0IA0A2m,1277028869267001344
AdogaMikeOyi,2020-06-27T23:59:42.000Z,"Dear  @myaccessbank  , sorry you just lost a customer. What an incessant deduction in the name of stamp duty. Aren't you guys seeing the hardship on Nigerians occasioned by coronavirus pandemic???. Why this. Bye please.  #accessbank #StampDuty",https://x.com/myaccessbank https://x.com/hashtag/accessbank?src=hashtag_click https://x.com/hashtag/StampDuty?src=hashtag_click,1277028868092768257
LennyMBernstein,2020-06-27T23:59:42.000Z,America's coronavirus failures exposed by new surge in infections - The Washington Post  washingtonpost.com/politics/with- …,https://t.co/DW318HLDi8,1277028867333656578
yenrinie,2020-06-27T23:59:42.000Z,an employee of 18 years in caesars passed away the other day from COVID after he went back to work. It's on the news and my friend's mom also work at Caesars. PLEASE PLEASE PLEASE stay away from the strip for awhile.,,1277028866653970432
SteveInWatford,2020-06-27T23:59:42.000Z,"It seems Brexit has shown these 'great and intelligent people' up for being what they are: fakes. They're fraudsters, confidence tricksters. They plagiarise from the EU and claim it as their own. And this pandemic proving that normal people are actually of greater value hurts.",,1277028865760727042
Luvdemgiants,2020-06-27T23:59:42.000Z,Yes bought some shares in “Big Mask”,,1277028865425039360
philosophybites,2020-06-27T23:59:41.000Z,Here we go...  theguardian.com/world/2020/jun …,https://t.co/FlVg9904SR,1277028863034433536
GLHomeWatch,2020-06-27T23:59:41.000Z,"As Texas and Florida Bars Close Down, Bartenders Fear The Worst  time.com/5860406/barten …",https://t.co/ZWYdieigmY,1277028862493446151
babyruth1994,2020-06-27T23:59:41.000Z,To be fair it is hard to breathe under the mask but that’s because my fat ass is out of shape,,1277028861662773249
dronechris75,2020-06-27T23:59:41.000Z,"Workers removed thousands of social distancing stickers before Trump’s Tulsa rally, according to video and a person familiar with the set-up  washingtonpost.com/politics/worke …",https://t.co/j0yj3THTqe,1277028861440675841
postmodern_mod3,2020-06-27T23:59:40.000Z,"Weekly Reminder that we're still in the middle of a global pandemic and a slow motion economic collapse, yet there's people out there who care more about protecting statues, confederate flags, and their ""right"" to not wear a mask.",,1277028859079086080
mike225jd,2020-06-27T23:59:40.000Z,It’s a shame our lives now deal with these kinds of discussions. Stupid Covid.,,1277028858731134976
sandyswrists,2020-06-27T23:59:40.000Z,"i have never seen a SINGLE PERSON wear a mask here in my town,,, is that normal",,1277028858298957824
divinegyal,2020-06-27T23:59:40.000Z,Post quarantine body still in effect,,1277028857367986181
