User_name,Datetime,Content,Links,Tweet_ID
ikywtred,2020-09-30T23:59:23.000Z,literally my clinic used to give us 1 hr breaks prior to the pandemic & i was like WHY,,1311455634865508352
NewsChantUSA,2020-09-30T23:59:23.000Z,Now at the Boarding Gate: Coronavirus Tests  us.newschant.com/business/now-a …,https://t.co/gyo0ZdR666,1311455633082851328
aza_ber,2020-09-30T23:59:23.000Z,Please keep yourself and Americans safe by wearing your mask and social distancing. Our leaders cannot give us life or take away life. WE need to fight this virus TOGETHER. Please be considerate of others. #wearyourmask,https://x.com/hashtag/wearyourmask?src=hashtag_click,1311455632764080129
YasmeenMonica,2020-09-30T23:59:22.000Z,Good luck everybody and the compact everybody for fighting against on covid pandemics,,1311455631380041729
KindOfWierd,2020-09-30T23:59:21.000Z,South Park pandemic special is about to start :D I'm exited! Lol,,1311455625625305089
markpothier,2020-09-30T23:59:21.000Z,"We're trending in the wrong direction again here in Massachusetts. Cases, deaths, hospitalizations, and infection rates are all up. I'm sure it has nothing to do with college kids. #COVID19  bostonglobe.com/2020/09/30/met … via  @BostonGlobe",https://x.com/hashtag/COVID19?src=hashtag_click https://t.co/wmeQSykw6N https://x.com/BostonGlobe,1311455625352802304
k0kumiii,2020-09-30T23:59:21.000Z,mungkin kalau gaada covid i won't be here and meet u all gengsss,,1311455623666573312
iamnatashalobo,2020-09-30T23:59:20.000Z,Covid 3.0 ??? Nooooo!!,,1311455621779091456
KokeTokyo,2020-09-30T23:59:20.000Z,Why hasn't it been a topic at all durning this pandemic?,,1311455619933704193
oneeyewideshut,2020-09-30T23:59:19.000Z,The mask police are great,,1311455617396203521
ripricoli,2020-09-30T23:59:19.000Z,Real pandemic is ON  #coronavirus #COVID19 #quarentena #TakeCare,https://x.com/hashtag/coronavirus?src=hashtag_click https://x.com/hashtag/COVID19?src=hashtag_click https://x.com/hashtag/quarentena?src=hashtag_click https://x.com/hashtag/TakeCare?src=hashtag_click,1311455615697518592
kathytweetin,2020-09-30T23:59:18.000Z,Unacceptable COVID test result wait time in Markham thanks to the inaction of  @fordnation  @celliottability  @ONgov . A 5-6 day window doesn’t allow for proper contact tracing and reporting of case numbers.  #Ontario should have prepped for this over the summer.,https://x.com/fordnation https://x.com/celliottability https://x.com/ONgov https://x.com/hashtag/Ontario?src=hashtag_click,1311455615043207169
patcofone,2020-09-30T23:59:18.000Z,Bat Style H Embroidered Felt Mask Halloween 2 Sizes  Petend Play Teach Learn Educational Imagination Story Time Play Along Home School  etsy.me/30CYVlR,https://t.co/tMJDn5xrjF,1311455614745313280
SharonShepshan,2020-09-30T23:59:18.000Z,"B.C. counts 125 new COVID-19 cases, up to 1,284 active  goldstreamgazette.com/news/b-c-count …",https://t.co/cDiP79BYId,1311455614451679232
larmmy,2020-09-30T23:59:18.000Z,SOUTH PARK PANDEMIC SPECIAL!!!! #SouthPark,https://x.com/hashtag/SouthPark?src=hashtag_click,1311455613222879232
SpeedSportLife,2020-09-30T23:59:17.000Z,The South Park Pandemic special is starting and I can’t wait for the social commentary,,1311455608999161857
FirebaughNorman,2020-09-30T23:59:17.000Z,Ron Liberty Report Gets Censored by YouTube Hall Monitors for Questioning the Wuhan Virus Lockdown Narrative  libertyconservativenews.com/ron-liberty-re … via  @Liberty  Conservative News,https://t.co/DltuOU32dp https://x.com/Liberty,1311455608172957696
BichiMandu,2020-09-30T23:59:16.000Z,Tomorrow is for Blackpink and Blackpink only. BP LOCKDOWN Y'ALL. #BLACKPINK  @BLACKPINK,https://x.com/hashtag/BLACKPINK?src=hashtag_click https://x.com/BLACKPINK,1311455606625058818
generaltuna19,2020-09-30T23:59:16.000Z,After lockdown,,1311455603332530176
Blayzen375,2020-09-30T23:59:16.000Z,"This hurts. Having been down this road with my own child, I couldn’t imagine trying to do that in a post-Covid school scene. I don’t suppose you know if this child has had any EXTRA support above/beyond the side?",,1311455602879721473
BridgetVonArnim,2020-09-30T23:59:15.000Z,"@BenFordhamLive  @scottmorrisonmp Yeah it was 2% & well before the pandemic   Hey Ben, how about fact checking you incompetent lazy arsewipe  And ScumMo, stop lying you incompetent wanna be loser trump human garbage  PM my bodacious arse",https://x.com/BenFordhamLive https://x.com/scottmorrisonmp,1311455602556592128
MelindaGindy,2020-09-30T23:59:15.000Z,"‘The community esteem for teachers, as front-line service providers, has been significantly enhanced’. Completely agree  @JWatterston ! It’s a shame it took a pandemic for this to occur.  @acelaustralia  #acelglobal2020",https://x.com/JWatterston https://x.com/acelaustralia https://x.com/hashtag/acelglobal2020?src=hashtag_click,1311455601344405504
DailyBaro,2020-09-30T23:59:15.000Z,"Going into fall term, many students may be searching for additional emergency funds due to the COVID-19 pandemic. Two resources available to students struggling are Beavers Care and the Human Services Resource Center. bit.ly/36kwzT3",https://t.co/3d5t6glHLv,1311455599301783553
shal2500,2020-09-30T23:59:15.000Z,#AWCC2020 Partnerships and coalitions. covid 19 is a community wide issue not just a health issue. WIN/WIN. common ground. power of consensus is a SHARED NARRATIVE. example of London,https://x.com/hashtag/AWCC2020?src=hashtag_click,1311455598798467072
qpyoungnews,2020-09-30T23:59:14.000Z,". @faith_a_miller  has poignant quotes from students: • ""It’s been very, very hard being so isolated, and I think the biggest part for me is that it seems like we’re all just kind of scared of each other now."" • With COVID: “That was probably the worst week of my entire life.”",https://x.com/faith_a_miller,1311455598425378816
FloydPerkinson,2020-09-30T23:59:14.000Z,"If Gostkowski kicks like that with a LS who has Covid, can we just get him a spacesuit from NASA?  I finally picked up a great Kicker....and...",,1311455595871047682
scootertrob,2020-09-30T23:59:13.000Z,2.5 people died from Covid while you typed this. I won’t miss you at all. I’ll always miss my mom.,,1311455592532381696
ByronHsu2,2020-09-30T23:59:13.000Z,"The coronavirus pandemic erased all of the jobs gained since November 2016, when Trump won the electoral college vote. He has let the unemployment rate skyrocket with poor direction to state governors about economic lockdowns and face mask usage. It took him months to wear one.",,1311455590976114693
zenitramafesoj,2020-09-30T23:59:12.000Z,IN THE MIDDLE OF A PANDEMIC,,1311455589860478976
og_breeezy,2020-09-30T23:59:11.000Z,"shower meditated, face mask & some fruits is what i call self care",,1311455585448140802
SteveBo37536730,2020-09-30T23:59:11.000Z,"America  This is your ""LAW & ORDER"" President  Telling white supremacist ""Proud Boys""  To STAND BACK AND STANDBY In the Presidential Debate  Be afraid RACE WAR  Please get to the polls And vote AMERICA'S PROUDEST PRESIDENT OUT OF OFFICE  Current US Covid deaths 211,686 10.01.20",,1311455584974180353
positivitypapi,2020-09-30T23:59:11.000Z,This South Parl pandemic special is what we all need rn,,1311455584391225344
Stanley_Tru,2020-09-30T23:59:11.000Z,"That’s the whole point, wear a mask to protect others, of course not when your chilling by yourself and not around anyone.",,1311455583833214977
natfinnonE,2020-09-30T23:59:11.000Z,"For starters, most of the people who like Biden enough to come out and see him aren’t whiny brats who can’t handle wearing a mask. But also...",,1311455583359254529
allidoismix,2020-09-30T23:59:10.000Z,"US TREASURY SECRETARY MNUCHIN SAYS WILL NOT ACCEPT USD 2.2TLN CORONAVIRUS BILL PROPOSED BY DEMOCRATS AND HE MAY SPEAK AGAIN WITH PELOSI TONIGHT BUT DOESN'T THINK PROGRESS WILL BE MADE UNTIL POSSIBLY THURSDAY, ADDS REACHED AGREEMENT ON DIRECT PAYMENTS",,1311455581560098818
tickercotweets,2020-09-30T23:59:10.000Z,"""For another three weeks for our businesses to be shut...thats a long time""  @ChrissieMaus  is one of many business owners who continue to suffer under Melbourne's lockdown.   #TickerTV #TickerNews",https://x.com/ChrissieMaus https://x.com/hashtag/TickerTV?src=hashtag_click https://x.com/hashtag/TickerNews?src=hashtag_click,1311455581371129858
OregonTurfgrass,2020-09-30T23:59:10.000Z,"Wear-a-Mask-Wednesday Meet Kurt, Sean, and Barry. They wear masks in 2020.  Here they are back in 2019, when we were mask free! Thank you to our friends at Simplot, Presenting Sponsor of the  OTF 2020 Golf Tournament @SPWrigt_kurt  @SeanWattsPNW  @SimplotTurf",https://x.com/SPWrigt_kurt https://x.com/SeanWattsPNW https://x.com/SimplotTurf,1311455580641349632
1AceRodforTrump,2020-09-30T23:59:10.000Z,"The flu/pneumonia is as or more dangerous then COVID, why masks now?Why shut our Country down? Why churches can’t congregate & going to School is restricted? Why criminals are allowed to destroy, kill, & loot w/o restrictions?#Silentmajorityrising #Trump2020NowMoreThanEver",https://x.com/hashtag/Silentmajorityrising?src=hashtag_click https://x.com/hashtag/Trump2020NowMoreThanEver?src=hashtag_click,1311455579567661056
BozTheKing,2020-09-30T23:59:10.000Z,"Super bad times due to covid and having diabetes, any help would be appreciated Paypal: jupiterthunderchicken@gmail.com",,1311455578888208385
Helianthus496,2020-09-30T23:59:10.000Z,What new hobbies have you recently developed because of COVID-19? #SuperMAsYouWishQnA,https://x.com/hashtag/SuperMAsYouWishQnA?src=hashtag_click,1311455578187653120
usccrcc,2020-09-30T23:59:09.000Z,"Here's  @m_vaculciakova 's story, focused on a restaurant owner pivoting to serve #refugees in #Moriacamp:  crcc.usc.edu/rns-in-greece- …",https://x.com/m_vaculciakova https://x.com/hashtag/refugees?src=hashtag_click https://x.com/hashtag/Moriacamp?src=hashtag_click https://t.co/udsETUvfx3,1311455576270934016
AdventuresHarry,2020-09-30T23:59:09.000Z,Social Distancing - Self-Isolated  - Stressed ??? Learn how to relax with this book …Stress is harmful to your Health. This new Kindle eBook will help you dramatically reduce the stress in your life and help you live longer. FREE on Kindle Unlimited,,1311455575037882368
XeewTorres,2020-09-30T23:59:09.000Z,The major genetic risk factor for severe COVID-19 is inherited from Neanderthals | Nature  nature.com/articles/s4158 …,https://t.co/jTWbitNc9R,1311455574513651712
ChrisHolman2,2020-09-30T23:59:08.000Z,Figured it out! Mask the beer,,1311455569300131841
EdRonline,2020-09-30T23:59:08.000Z,"Plan to solve #Florida's non-existent #protest problem is pure 'mini-Trump'  Governor #RonDeSantis wants to crack down on #demonstrators to distract from a disastrous pandemic response, critics say theguardian.com/us-news/2020/s …",https://x.com/hashtag/Florida?src=hashtag_click https://x.com/hashtag/protest?src=hashtag_click https://x.com/hashtag/RonDeSantis?src=hashtag_click https://x.com/hashtag/demonstrators?src=hashtag_click https://t.co/JMmQ9cxJgG,1311455569295945736
33newsking,2020-09-30T23:59:08.000Z,"Coronavirus outbreak latest: Oct. 1, 2020  Here are the latest updates from Japan and beyond on the coronavirus outbreak:  As of 11 p.m., Wednesday, Sept. 30 (Japan time)  The Japan Karatedo Federation has revised its guidelines to allow the use of ""kia… english.kyodonews.net/news/2020/10/1 …",https://t.co/5CqD8VavqC,1311455569199259648
WildGrrl14,2020-09-30T23:59:07.000Z,"“There’s not a clear underlying philosophy that drives this administration, other than nationalism. You just can’t predict the next move.”   nytimes.com/live/2020/09/3 …",https://t.co/ZMTVpsQGEm,1311455568788418561
DebraKirkpatr10,2020-09-30T23:59:07.000Z,Coming from someone who sold millions in stocks when Covid hit #loefflerisacriminal,https://x.com/hashtag/loefflerisacriminal?src=hashtag_click,1311455568263958528
K7Row,2020-09-30T23:59:07.000Z,"New month tomorrow, happy October in advance. Two holidays October fest and #Halloween until then stay healthy and safe, don't forget the flu vaccine.",https://x.com/hashtag/Halloween?src=hashtag_click,1311455566582231041
debraegordon,2020-09-30T23:59:06.000Z,Everything You Need to Know to Host a Drive-In Event During a Pandemic  eventbrite.com/blog/host-driv …,https://t.co/AvHErtBjO7,1311455563117744128
DakotaSomervill,2020-09-30T23:59:06.000Z,#InternationalPodcastDay 2Pisces in a Pod Now streaming on  Apple Podcast. Stop by and take a listen to how Jamie and Dakota are pivoting thru the pandemic.  xoxo  #dakotavibe  podcasts.apple.com/us/podcast/rea …,https://x.com/hashtag/InternationalPodcastDay?src=hashtag_click https://x.com/hashtag/dakotavibe?src=hashtag_click https://t.co/9DMURuyEq7,1311455561234423814
Wordsmiter,2020-09-30T23:59:05.000Z,"#AndrewCuomo put the #NursingHome order in writing, and then deleted his order from the New York Health Website. Here is the archive of the order~ web.archive.org/web/2020040710 …",https://x.com/hashtag/AndrewCuomo?src=hashtag_click https://x.com/hashtag/NursingHome?src=hashtag_click https://t.co/RyH4cKaGq0,1311455559925858304
Nartist,2020-09-30T23:59:05.000Z,"Who the F pays salary to a man who pretends to not understand the difference between a group wearing masks outdoors and a group who doesn't in or outdoors during a freaking pandemic so he can be snide? Ask Herman Cain if there's a diff, Sam. Oh wait. You can't. Cause HE'S DEAD.",,1311455559829393409
annahabarth,2020-09-30T23:59:05.000Z,Devastated. Due to COVID protocols at the nursing home I couldn’t fly back to visit my grandma one last time. My heart is crushed. that is something I will never get back,,1311455558508007424
MichaelRedact,2020-09-30T23:59:05.000Z,"I just published ""The South Korean Christian Death Cult That Helped Spread the Coronavirus""  link.medium.com/T4bNZ9Hndab",https://t.co/xs7IeSe4OL,1311455557811871746
regularpocket,2020-09-30T23:59:05.000Z,"Since my towns still in lockdown and I'm bored asf, does anyone want to watch the American presidential debate and make it into a drinking game with me? (Over FaceTime obvs)",,1311455557518274566
smittynumber454,2020-09-30T23:59:04.000Z,And what detailed report is he getting? I’ve read a few lab reports in my time but unsure how Covid is reported.,,1311455555626496002
ZANDIO,2020-09-30T23:59:03.000Z,"But wear a mask , smoke in lungs(?) health issue? You are buzzard bizarre Tommmy",,1311455549620457472
KristiSchell,2020-09-30T23:59:03.000Z,The south park pandemic special is exactly what we need right now!!!,,1311455548924071937
thereidout,2020-09-30T23:59:02.000Z,"""This goes to show you that Lindsey cares more about Washington, DC than the people at home."" @harrisonjaime  on Graham rushing the SCOTUS nominee process but not advocating for covid relief. #TheReidOut",https://x.com/harrisonjaime https://x.com/hashtag/TheReidOut?src=hashtag_click,1311455547514912769
KNWAFOX24,2020-09-30T23:59:02.000Z,University of Arkansas announces 17 new COVID-19 cases  trib.al/Bik3hC5,https://t.co/MXf0dbRyGH,1311455546944491521
Autumnrains5551,2020-09-30T23:59:02.000Z,"I'm a proud Canadian.  People engaged in this reckless behavior are endangering others lives.  Sorry, but my rights to not get covid outweighs stupid reckless behavior",,1311455545627488257
rhys_may,2020-09-30T23:59:02.000Z,It's on my bucket list.. fly over from Oz.. see this. Nhra. World of outlaws. While in a campervan.. but it gonna be years.. costs mega $$$ to holiday right.. plus.. you'll be a Covid country for years.. and that just sucks,,1311455544767475713
chapliznotreal,2020-09-30T23:59:02.000Z,"yo i’d rlly love to not get covid, who else?! #covidbad",https://x.com/hashtag/covidbad?src=hashtag_click,1311455544666918913
That_Vegetable_,2020-09-30T23:59:01.000Z,I poked myself in both eyes while adjusting my mask... Trully a one braincell moment,,1311455543802974212
RePeat_,2020-09-30T23:59:01.000Z,President’s Remarks About COVID-19 At First Debate True To Form And More  dlvr.it/RhhrgQ,https://t.co/maAyHQw5x9,1311455543031021568
manResources12,2020-09-30T23:59:01.000Z,"Most businesses anticipate longer stretch of employees working from home, DEED commissioner says - KSTP  dlvr.it/Rhhrg6",https://t.co/YJgkGd256H,1311455542393495552
AGW_IS_A_HOAX,2020-09-30T23:59:01.000Z,“Longtime Climate Denier Tony Heller Gets YouTube Ban For COVID Denial”  realclimatescience.com/2020/09/longti …,https://t.co/98AerIzEyl,1311455542259245056
govtechnews,2020-09-30T23:59:01.000Z,"Salesforce announces permitting apps, vaccine management  bit.ly/2EMaKjW #govtech #stateandlocal #health  @salesforce  @DaveSRey",https://t.co/1T6x0quAco https://x.com/hashtag/govtech?src=hashtag_click https://x.com/hashtag/stateandlocal?src=hashtag_click https://x.com/hashtag/health?src=hashtag_click https://x.com/salesforce https://x.com/DaveSRey,1311455542217498626
clevelanddotcom,2020-09-30T23:59:01.000Z,"We spoke with 15 NEO businesses that in August signed an open letter to Congress, requesting more federal aid to cope with the shockwaves of the pandemic. Exactly how they’re faring during the pandemic is different:  trib.al/uy44Ql2 ( Exclusive content)",https://t.co/nzAh2s3suy,1311455541282078720
LeadingAge,2020-09-30T23:59:00.000Z,"“Collaborative education and #sharedlearning is critical for our nonprofit nursing home members on the front line of this #pandemic, under often challenging conditions,” Katie Smith Sloan, president and CEO of LeadingAge  skillednursingnews.com/2020/09/backed …  @skilled_nursing",https://x.com/hashtag/sharedlearning?src=hashtag_click https://x.com/hashtag/pandemic?src=hashtag_click https://t.co/7ER0sc3erq https://x.com/skilled_nursing,1311455539453472770
Wolfe321,2020-09-30T23:59:00.000Z,RIGHT NOW on our live NYT coronavirus briefing: A major Boston hospital has a cluster of cases among its staff and patients.  nytimes.com/live/2020/09/3 …,https://t.co/WxnXV7J2cv,1311455537863757824
WNEMTV5news,2020-09-30T23:59:00.000Z,Saginaw County's Toys for Tots toy drive begins Thursday. But it's going to be a rocky start.    wnem.com/news/pandemic- …,https://t.co/n60Qc4ASSZ,1311455537033338882
LearningLiaison,2020-09-30T23:59:00.000Z,"Virtual, face-to-face, simultaneous teachers - here are 3 tips to help you teach during #COVID19  youtu.be/zQtMyc1vS28  We are all in this together.  #coronavirus #classroom #educators #remotelearning #pandemic #anxiety #stress #mentalhealth #school",https://x.com/hashtag/COVID19?src=hashtag_click https://t.co/zKgN74WdZz https://x.com/hashtag/coronavirus?src=hashtag_click https://x.com/hashtag/classroom?src=hashtag_click https://x.com/hashtag/educators?src=hashtag_click https://x.com/hashtag/remotelearning?src=hashtag_click https://x.com/hashtag/pandemic?src=hashtag_click https://x.com/hashtag/anxiety?src=hashtag_click https://x.com/hashtag/stress?src=hashtag_click https://x.com/hashtag/mentalhealth?src=hashtag_click https://x.com/hashtag/school?src=hashtag_click,1311455536626495488
AppleRockUSA,2020-09-30T23:59:00.000Z,"Protect your people and your company the minute anyone enters your office with our new 3-in-1 safety kiosk - thermal scanner, mask and hand sanitizer dispensers.  bit.ly/2Sfm0IF  #applerock #wherebetterideasarebuilt #ppe #protection #safety #getbacktobusiness",https://t.co/I3UHQDAQHD https://x.com/hashtag/applerock?src=hashtag_click https://x.com/hashtag/wherebetterideasarebuilt?src=hashtag_click https://x.com/hashtag/ppe?src=hashtag_click https://x.com/hashtag/protection?src=hashtag_click https://x.com/hashtag/safety?src=hashtag_click https://x.com/hashtag/getbacktobusiness?src=hashtag_click,1311455536236449793
redmeg1053,2020-09-30T23:59:00.000Z,If you call what Trump did debating I have  a bottle of snake oil to sell you. Guaranteed to cure  COVID-19.,,1311455535766659074
JayneCallagha10,2020-09-30T23:58:59.000Z,You took your mask OFF to go in a ...public toilet ...I give up ....,,1311455534223167495
DJMic_EZ,2020-09-30T23:58:59.000Z,What beverage gives u coronavirus...Coffee  GET IT!!!!  P.S. no scientific study has linked the consumption of coffee to actually infecting you with the novelty coronavirus Covid-19.,,1311455533497487360
gellegbs,2020-09-30T23:58:59.000Z,"Not only that but you can get covid again after a few months, which makes the whole herd immunity thing pretty pointless.",,1311455533300318208
stephenbuggy,2020-09-30T23:58:59.000Z,"I exercise 3 times a week (Monday, Wednesday, Friday) and because of covid I walk everywhere.",,1311455532721549317
aliyahsangel,2020-09-30T23:58:59.000Z,Brush your teeth AND tongue even though you got a mask on please,,1311455531379372033
BluelineEditing,2020-09-30T23:58:58.000Z,"When I posted my pay-what-you-can promotion in March, I had no idea it would last this long. But, as promised, it will continue until the pandemic is over. Just tell me what you can afford, and I'll do the copyediting! BluelineEditing.com",https://t.co/CCDvXF93q1,1311455529059844096
agentpeterg,2020-09-30T23:58:58.000Z,One way or another it's coming.... theguardian.com/science/2020/s …,https://t.co/xNSwuq9N6b,1311455528544014339
AbdulCarterMVP,2020-09-30T23:58:58.000Z,The South Park Pandemic Special is gonna be,,1311455527252234243
jomickane,2020-09-30T23:58:57.000Z,"First time in months my tv was on tonight when itv news came on, hospital in scotland apologizing for deaths of 15 patients who got covid in hospital.. .i thought the same thing, surely the staff had ppe, masks, clearly not worked . Or is it just more lies to try to scare people",,1311455524370644994
stephenbuggy,2020-09-30T23:58:57.000Z,But under lockdown my food was one of the few things I could really control.,,1311455523674390530
StigmabaseO,2020-09-30T23:58:57.000Z,"UK | #Egaylity : [1,2] When used in HIV antibody surveillance studies in a low prevalence setting, ... This would…  goo.gl/fb/7Ajn2B",https://x.com/hashtag/Egaylity?src=hashtag_click https://t.co/6ltS2hzHWy,1311455523053735936
arclta,2020-09-30T23:58:56.000Z,what’s the social distancing approved  version of ‘a pinch and a punch for the 1st day of the month’?,,1311455522340519938
DoobieMaine,2020-09-30T23:58:56.000Z,But I had covid thou did you ?,,1311455522093228033
LatestNewsHub1,2020-09-30T23:58:56.000Z,Spanish government imposes strict coronavirus restrictions on Madrid  south-movie.com/spanish-govern …,https://t.co/OvF22HnbD9,1311455521958961158
NewAfricaOnlin1,2020-09-30T23:58:56.000Z,image copyrightEPA  The Spanish government has ordered a lockdown in the capital Madrid and surrounding areas badly affected by coronavirus after a rise in cases.  newafricaonline.com/blog/madrid-co …,https://t.co/HvbnbMo0VC,1311455521069821952
ComedyCentral,2020-09-30T23:58:53.000Z,. @SouthPark : The Pandemic Special starts now. Hope you're ready.,https://x.com/SouthPark,1311455509178920960
davidcoppin,2020-09-30T23:58:53.000Z,sure I heard somewhere that it was the closing of the schools which was the one thing which had a positive impact on reducing the corona figures.  Put it another way all the other (first wave) lockdown measures made no measurable impact!  Oh what to believe?,,1311455508994367488
cathyco51278506,2020-09-30T23:58:53.000Z,If it weren't for the 1 vote from mc cain against repealing Obama care.  Not 1 presidency in past decades has balanced the budget.  PROMISES MADE PROMISES KEPT    whitehouse.gov/briefings-stat …,https://t.co/rbYBYM83LB,1311455508897902592
workfromhomefa2,2020-09-30T23:58:53.000Z,"COVID-19: Work-from-home still &quot;default mode&quot; in Singapore, but more will be allowed back to office workfromhomefast.com/covid-19-work- …",https://t.co/Iz08bJEa3u,1311455507404603393
BarbaraMain07,2020-09-30T23:58:53.000Z,Same but pandemic has added,,1311455506628657159
pancakeliberty,2020-09-30T23:58:53.000Z,Many americans are in the same boat.  The past 3 years have been great for me economically.  Even though Covid.   I barely scraped by during the obama years.,,1311455506444300288
LindaTinoly,2020-09-30T23:58:52.000Z,"Doorbell rang today, went to the front door to find a nice delivery guy with a lovely bouquet.  Wrong address. Is it wrong to be so bummed?  I'm like ""dude, you can't do that to someone 6 months into lockdown.""",,1311455505102106627
CatherineGinso1,2020-09-30T23:58:51.000Z,Two girls one mask.,,1311455500308025346
JBischof91,2020-09-30T23:58:51.000Z,South Park “Pandemic Special” starts at 8pm. Can’t wait for some guaranteed hilarious scenes.,,1311455499204915200
AmyMiranda,2020-09-30T23:58:50.000Z,I'd just like to thank  @Netflix  for helping me through this pandemic. <3,https://x.com/Netflix,1311455497485266948
TayySooPrettyy,2020-09-30T23:58:50.000Z,Them mask be fcking clean over me,,1311455497460031488
mojos55,2020-09-30T23:58:50.000Z,"""unknown pneumonia"", more deadly than COVID-19, appears in Kazakhstan portaldecadiz.com An ""unknown pneumonia"", more deadly than COVID-19, appears in Kazakhstan We have to continue studying what happens in this world with diseases portaldecadiz.com/otras-noticias … via  @portaldecadiz",https://t.co/v6ND5rKiFo https://t.co/xfiXbv5F35 https://x.com/portaldecadiz,1311455494305992706
phillysport,2020-09-30T23:58:49.000Z,Micah Parsons won’t return to Nittany Lions; athletic department says COVID positive rate improves | Penn State notes  trib.al/OPPmFdK,https://t.co/nm8wc7byhV,1311455490375905282
asdchula,2020-09-30T23:58:48.000Z,covid t siento,,1311455489323159552
LouReeseyana42,2020-09-30T23:58:48.000Z,Pandemic special!,,1311455487053963265
ConcordPatch,2020-09-30T23:58:47.000Z,"Following the Massachusetts reopening guidelines, the Concord...  trib.al/gHMrCak",https://t.co/fvgmFvIk4K,1311455484159889409
AnthonyLatessa,2020-09-30T23:58:46.000Z,Excited for the South Park Pandemic Special,,1311455480116584448
AliagaGusty,2020-09-30T23:58:45.000Z,Covid chabonnnn,,1311455476203356160
