User_name,Datetime,Content,Links,Tweet_ID
GlendaH26016842,2020-07-20T23:58:37.000Z,‘He’s surrendered’: Biden slams Trump’s coronavirus leadership in Joy Reid’s debut primetime broadcast  rawstory.com/2020/07/hes-su …,https://t.co/fFAzcYhNrD,1285363514983493634
BWalkerTTAGGG,2020-07-20T23:58:37.000Z,The solution for coronavirus has been in a human trial in Denmark since May 29... with no news coverage at all. It's nicotinamide riboside: clinicaltrials.gov/ct2/show/NCT04 …,https://t.co/hR0gfkr7LJ,1285363514786357248
ItsJodiNewsome,2020-07-20T23:58:37.000Z,If I leave I have to quarantine for work.,,1285363514668920832
UnsilencedSci,2020-07-20T23:58:37.000Z,"Can you believe that this video from yesterday is by a man who died today? He was a progressive liberal with a mind warped by rap music during a historic drug epidemic, but I don't know the cause of death.  Michael Brooks #RIPMichaelBrooks #MichaelBrooks youtube.com/watch?v=tdnKbk …",https://x.com/hashtag/RIPMichaelBrooks?src=hashtag_click https://x.com/hashtag/MichaelBrooks?src=hashtag_click https://t.co/aJQeXkllrB,1285363514534584320
alekswalsh,2020-07-20T23:58:37.000Z,Where is your plan for a safe reopening of schools? Any time spent on that today? #OntarioSpirit,https://x.com/hashtag/OntarioSpirit?src=hashtag_click,1285363514484363265
alifnewsin,2020-07-20T23:58:37.000Z,Let the States decide on reopening of schools: PMK  alifnews.in/let-the-states …,https://t.co/pvMkrtxdOV,1285363514476027910
MaisaCorp,2020-07-20T23:58:37.000Z,"$PTON  is poised for a ""blockbuster"" financial performance for its current quarter as the rise in COVID-19 cases strengthens the potential of more customers seek out its fitness programs to stay in shape at home  The shares have increased from around $30 since the start of 2020.",https://x.com/search?q=%24PTON&src=cashtag_click,1285363513930678272
MRSRedVoteR,2020-07-20T23:58:37.000Z,"Gag me. Mask me. omg, what has happened to my game.",,1285363513448452096
JamieDennisx,2020-07-20T23:58:37.000Z,You introverts are thriving during quarantine meanwhile I’m over here like going into psychosis from being alone too much.,,1285363513188208640
flickafaida,2020-07-20T23:58:37.000Z,The ads for the dud Covid app cost $65 million. No tender process either,,1285363513104334848
CTVLethbridge,2020-07-20T23:58:37.000Z,Small town realtors are seeing a boom because of #Covid + city residents RELIEVED to have Henderson pool open. #yql #lethbridge  calgary.ctvnews.ca/video?clipId=1 …,https://x.com/hashtag/Covid?src=hashtag_click https://x.com/hashtag/yql?src=hashtag_click https://x.com/hashtag/lethbridge?src=hashtag_click https://t.co/yqUbe60Qjo,1285363512806715394
LisaLShumaker,2020-07-20T23:58:36.000Z,"At least 16 states have reported a record number of COVID patients currently hospitalized in July. Nine states set records today -- Alabama, Arkansas, California, Florida, Georgia,  Mississippi, Montana, Nevada and North Dakota  reuters.com/article/us-hea …",https://t.co/qlsud02MFb,1285363512299139072
djjAckisback,2020-07-20T23:58:36.000Z,i’m glad i got to out in a lot of work before the pandemic hit.  the whole entertainment industry is changing rapidly & it seems it’s gonna stay this way awhile.,,1285363511313367040
TheBahnsenGroup,2020-07-20T23:58:36.000Z,"Today’s COVID and Markets has lots of up to date health info, some useful info on the stimulus bill, housing, the Fed, and more. #COVID-19 #markets bahnsen.co/3fP3aCp",https://x.com/hashtag/COVID?src=hashtag_click https://x.com/hashtag/markets?src=hashtag_click https://t.co/t0TV7ppXzT,1285363510512357377
DrWinstonOBoog5,2020-07-20T23:58:36.000Z,"A Dem friend of mine recently said, “The guy we need for this pandemic is GHW Bush.” This is a straight ticket union man who said this, who cares little for Rs. I agree - I slept well at night back then.",,1285363510197846016
sfeldman0,2020-07-20T23:58:36.000Z,Three Coronavirus Vaccine Developers Report Promising Initial Results  dlvr.it/Rc1vth,https://t.co/7eT46eKTz2,1285363509035819010
gords_m,2020-07-20T23:58:36.000Z,First attempt at a #run wearing a disposable surgical #facemask First 3 k’s were pretty easy but then the mask started getting very damp and it felt like I was sucking on a plastic bag with every breath. At least I tried!,https://x.com/hashtag/run?src=hashtag_click https://x.com/hashtag/facemask?src=hashtag_click,1285363508935180289
SmnthaBeeeeee,2020-07-20T23:58:35.000Z,My new favorite mask — can’t wait for all the whiny yt dudes to glare at me while I’m running my essential errands. (Inspired by the “Racism = Small Dick Energy” signs that folx have had during the Black Lives…  instagram.com/p/CCsRaQeJvUm/ …,https://t.co/c3qX9pIJQM,1285363507886686210
Andy_Kermah,2020-07-20T23:58:35.000Z,"People stay safe. Coronavirus Covid-19 is real. This is not about government making money or you waiting to see someone with the virus before you believe. Please stay safe if you love God, your family and people around you. This shit is real!",,1285363506116689925
Kent_Allshouse,2020-07-20T23:58:35.000Z,"SWAC is the next conference to postpone all fall sports. Do the task,  wear a mask.   #Covid_19 #BeSmart #SaveTheFall #BeTheMask www-wdsu-com.cdn.ampproject.org/v/s/www.wdsu.c …",https://x.com/hashtag/Covid_19?src=hashtag_click https://x.com/hashtag/Covid_19?src=hashtag_click https://x.com/hashtag/BeSmart?src=hashtag_click https://x.com/hashtag/SaveTheFall?src=hashtag_click https://x.com/hashtag/BeTheMask?src=hashtag_click https://t.co/RcQchWIYqV,1285363505957425158
ForbesTech,2020-07-20T23:58:35.000Z,Two recent Harvard grads build platform to help furloughed chefs during Covid-19 on.forbes.com/6015GknIW By  @jilliankcanning,https://t.co/J9BgookT0O https://x.com/jilliankcanning,1285363504501993473
multimeloelf,2020-07-20T23:58:34.000Z,dolled up.... to wear a freaking mask   stay safe,,1285363504292065281
noabidingcity_,2020-07-20T23:58:34.000Z,Me ha guh put yuh pon lockdown,,1285363503931502592
ODesmoulin,2020-07-20T23:58:34.000Z,Congrats  @TimDL  and  @WizVille  for launching SafePlaceToShop in the US. A great way to support health workers while helping identifying safe places to shop  forbes.com/sites/miltonez …,https://x.com/TimDL https://x.com/WizVille https://t.co/eTECfuZUeA,1285363503390511105
times_read,2020-07-20T23:58:34.000Z,"Donald Shannon, Times correspondent who covered JFK and the Cold War, dies of COVID-19  timesfamous.com/politics/donal …",https://t.co/8ZgRj7jg9O,1285363503096791040
pinksalt_t,2020-07-20T23:58:34.000Z,That's the way this whole horrible pandemic has been handled. No coherent leadership from Washington and every state and city trying to cope on their own.,,1285363502077673472
sfeldman0,2020-07-20T23:58:34.000Z,"Republicans, Still at Odds Over Aid Package, Eye $1 Trillion Opening Offer  dlvr.it/Rc1vtK",https://t.co/s1a4kkpqTv,1285363501427351552
wilsongolf03,2020-07-20T23:58:34.000Z,"Says the guy that ordered covid-19 positive workers return to work in retirement homes. As a result over 9,000 people have died in those homes. That is the kind of calls this governor makes. Talk about being reckless!",,1285363501309915137
SplendidPsyche,2020-07-20T23:58:34.000Z,"Coronavirus: Almost 900,000 public sector workers get above-inflation pay rise  news.splendidpsyche.com/2020/07/19/cor …",https://t.co/OIeG5WghXh,1285363501112975360
rayray7016,2020-07-20T23:58:34.000Z,Quarantine 15 is real,,1285363500978561025
ChannelNewsAsia,2020-07-20T23:58:34.000Z,"Colombia's COVID-19 cases top 200,000, deaths at nearly 7,000  cna.asia/2WEJ8CW",https://t.co/B6pisIMF0v,1285363500869513216
AlArabiya_Eng,2020-07-20T23:58:34.000Z,Scientists at Oxford University say their experimental #coronavirus vaccine has been shown in an early trial to prompt a protective immune response in hundreds of people who got the shot.  Find out more here: english.alarabiya.net/en/coronavirus …,https://x.com/hashtag/coronavirus?src=hashtag_click https://t.co/u996h8ZpZW,1285363500789923843
globeandmail,2020-07-20T23:58:33.000Z,"Oxford University COVID-19 vaccine shows promising results, researchers sign deal with AstraZeneca  dlvr.it/Rc1vtC",https://t.co/bFbwJybU3c,1285363497765761024
sfeldman0,2020-07-20T23:58:33.000Z,Coronavirus Briefing: What Happened Today  dlvr.it/Rc1vq1,https://t.co/IzW8Ms2kdE,1285363497585410048
atx512tv,2020-07-20T23:58:33.000Z,"subscribe.all512.com This post has local news on the coronavirus pandemic from Monday, July 20. If you have a news tip or question, email us at news@KUT.org .  dlvr.it/Rc1vt1 #atx #austin #all512",https://t.co/q1bIRBjDj8 https://t.co/VpgIQ5iv1w https://x.com/hashtag/atx?src=hashtag_click https://x.com/hashtag/austin?src=hashtag_click https://x.com/hashtag/all512?src=hashtag_click,1285363496662622208
globeandmail,2020-07-20T23:58:33.000Z,B.C.’s top doctor says province is at a ‘tipping point’ due to higher COVID-19 cases,,1285363496633262080
ChannelNewsAsia,2020-07-20T23:58:33.000Z,"Brazil COVID-19 death toll surpasses 80,000  cna.asia/2ZN605a",https://t.co/q4qlNmH9Je,1285363496624902144
huskerfan4life9,2020-07-20T23:58:33.000Z,Is that an Artifact mask? I’ve got one myself,,1285363496599932929
VI2times,2020-07-20T23:58:33.000Z,"My mans was Covid comfy on the stream with the Adidas Track Jacket and the gold chain; scary to think about how many people may have seen a family member, friend, or coworker for the last time many weeks/months ago due to this present situation, and didn't know.",,1285363496503455745
bill_dansky,2020-07-20T23:58:33.000Z,Covid-19 vs Jacksonville's Heat& Humidity. A match made in Hell.,,1285363496130052102
EL44766671,2020-07-20T23:58:33.000Z,huh- you have no clue most COVID-19 on East Coast- yep NC- is from Europe- and your suit will include bunker donnyjohn and MOC like yourself who did nothing? why I's like me will vote for  @CalforNC,https://x.com/CalforNC,1285363496004333569
maryserb17,2020-07-20T23:58:32.000Z,I gather that #Oxford University has something ready.  #COVIDー19 #vaccine,https://x.com/hashtag/Oxford?src=hashtag_click https://x.com/hashtag/COVID%E3%83%BC19?src=hashtag_click https://x.com/hashtag/vaccine?src=hashtag_click,1285363495551340545
WestKelownaNews,2020-07-20T23:58:32.000Z,Another winery in South Okanagan closes due to COVID-19  dlvr.it/Rc1vpk,https://t.co/758AjC9Cfy,1285363495551135744
globeandmail,2020-07-20T23:58:32.000Z,Coronavirus Update: Remembering those we’ve lost to COVID-19 in Canada  dlvr.it/Rc1vql,https://t.co/bzF1pNwIAi,1285363495479869441
InvestWatchBlog,2020-07-20T23:58:32.000Z,"VIRGINIA POSTREL: Reopening Schools Is Critical. Teachers Should Do More to Help: Coronavirus risks can be successfully managed, but a powerful lobby is blocking the classroom door.  investmentwatchblog.com/virginia-postr …",https://t.co/VoonmrE68b,1285363494376796160
LC_Calendar,2020-07-20T23:58:32.000Z,Another winery in South Okanagan closes due to COVID-19  dlvr.it/Rc1vq8,https://t.co/tf9c9TdPde,1285363493542100992
elharroo,2020-07-20T23:58:32.000Z,"Ah, but nobody seems to know. I didn't shut down the economy and wreck millions of lives. Fauci and gottlieb did. And that English guy who built the model saying 2.2m dead Americans. Then he got caught violating quarantine to screw his fat girlfriend. Cuomo killed 10,000 elderly.",,1285363492724379648
TimesBritain,2020-07-20T23:58:32.000Z,"NFL, players union agree on coronavirus testing protocol  timesofbritain.com/2020/07/20/nfl …",https://t.co/1sMjZJ1yol,1285363491910684672
PleonasticGay,2020-07-20T23:58:31.000Z,Fellas is it racist/imperialist to develop a vaccine against a global pandemic,,1285363490673180673
Atomstrawberry,2020-07-20T23:58:31.000Z,He got the vaccine and now he's autistic I guess? ¯\_(ツ)_/¯,,1285363488466939905
Noelisking19,2020-07-20T23:58:31.000Z,Oh ok I was being Fr but you want to post me go ahead but like y’all need to seriously need to chill with this what’s next they need to wear a mask in the house and I get it you got asthma but dude you taking care of yourself you need to stop worrying about others bro,,1285363487678636032
honeyNOTvinegar,2020-07-20T23:58:29.000Z,"Oh look pro-life people are here to take away healthcare, let cops murder innocent black people and actively expose people to a deadly virus bc they think mask wearing is somehow violating their freedom!!",,1285363483110830080
_heatherpalmer,2020-07-20T23:58:29.000Z,"You mean the coronavirus or COVID-19. “China Virus” is divisive, spreading racism and xenophobia.",,1285363482796478465
Mike5517918482,2020-07-20T23:58:29.000Z,trump is waiting for Putin's check for all the Covid Victims.,,1285363482343272448
1NetworkMktg,2020-07-20T23:58:29.000Z,"""Republicans, Still at Odds Over Aid Package, Eye $1 Trillion Opening Offer"" by Emily Cochrane, Jim Tankersley and Nicholas Fandos via NYT  ift.tt/2ZMg4vy Check out  1Network.com - (302) 444-0401. Contact us for all of your small business needs.",https://t.co/J77stTKtjj https://t.co/WVRH4EpThl,1285363481617858567
TuqaHmohamed,2020-07-20T23:58:29.000Z,Quarantine changed my PERSONALITY!!  t.co/MWQAlCLYE6,https://t.co/MWQAlCLYE6,1285363481227796480
FreezePixel,2020-07-20T23:58:29.000Z,Commission are Closed for now it will be reopening later i want to finish my current order plus i want to improve my self more because i think i am not that worthy yet and ye when i come back commission are still 50 percent off and more things coming soon!,,1285363479986094080
Moubayed11,2020-07-20T23:58:29.000Z,Florida likely tighter than most polls suggest but the vocal trump minority is in fact a minority. People are tired. There’s no end in sight to the pandemic and Floridians have been disproportionally affected.,,1285363479466172416
HoffmanHopes,2020-07-20T23:58:29.000Z,"#maga #kag #kag2020 #maga2020 #trump2020 #tcot #ccot #AmericaFirst  A nine-month old baby has died of coronavirus in Minnesota.  The child had no underlying conditions, doctors said.  Meanwhile, cases are spiking in the state. mprnews.org/story/2020/07/ …",https://x.com/hashtag/maga?src=hashtag_click https://x.com/hashtag/kag?src=hashtag_click https://x.com/hashtag/kag2020?src=hashtag_click https://x.com/hashtag/maga2020?src=hashtag_click https://x.com/hashtag/trump2020?src=hashtag_click https://x.com/hashtag/tcot?src=hashtag_click https://x.com/hashtag/ccot?src=hashtag_click https://x.com/hashtag/AmericaFirst?src=hashtag_click https://t.co/w2ifmufG2P,1285363479445209089
ifnotdthenwho,2020-07-20T23:58:28.000Z,The way I’ve been going through these shows during quarantine...,,1285363478635712512
iLoveKentWA,2020-07-20T23:58:28.000Z,Kent Chamber Webinar ‘COVID-19: A Conversation with Washington Retail A  ilovekent.net/2020/07/20/ken … Biz/Finance #business #COVID-19 #Kent,https://t.co/7XOOXQYcha https://x.com/hashtag/business?src=hashtag_click https://x.com/hashtag/COVID?src=hashtag_click https://x.com/hashtag/Kent?src=hashtag_click,1285363478501265408
Dex_Starling,2020-07-20T23:58:28.000Z,How can keeping people apart not stop them being infected? There are studies into the effectiveness of masks  ucsf.edu/news/2020/06/4 … and  files.fast.ai/papers/masks_l … The outbreak in the test and trace centre was caused by a total lack of social distancing. Just look at the US & Brazil,https://t.co/TFiD9x6Hny https://t.co/91sbSDaHjK,1285363478283333633
coop22089074,2020-07-20T23:58:28.000Z,Following 'the Coronavirus Science': Here Are The Studies Proving Schools Should Re-Open This Fall  trendingpolitics.com/following-the- …,https://t.co/TuDwDN1FpA,1285363478279135233
1NetworkMktg,2020-07-20T23:58:28.000Z,"""Coronavirus Live Updates: Republicans Begin New Relief Talks as Outbreaks Dim Recovery Hopes"" by Unknown Author via NYT  ift.tt/30p3rFK Check out  1Network.com - (302) 444-0401. Contact us for all of your small business needs.",https://t.co/G95oGoA6Mq https://t.co/WVRH4EpThl,1285363477717102593
oranglessmoved,2020-07-20T23:58:28.000Z,"5 facts, 5 tags!   I've lived in four different cities I love reading I'm very enthusiastic about unimportant things I play netball (before lockdown :)) I'm pretty new to the art twitter community @charameldraws   @iconografi_shop  @lemonfishu",https://x.com/charameldraws https://x.com/iconografi_shop,1285363477704437761
__JULZY__,2020-07-20T23:58:28.000Z,The way they’ve been handling this health crisis with COVID is pretty scary.,,1285363477650055168
ShayGlenn,2020-07-20T23:58:28.000Z,#Ireland  donates the world’s most successful #ContactTracing app to the #LinuxFoundation  nearform.com/blog/ireland-d …,https://x.com/hashtag/Ireland?src=hashtag_click https://x.com/hashtag/ContactTracing?src=hashtag_click https://x.com/hashtag/LinuxFoundation?src=hashtag_click https://t.co/iv3y6nwQYV,1285363477373165569
ZellzJ,2020-07-20T23:58:28.000Z,"Wearing a mask, not socializing with dozens of people, and working in places with covid precautions(barriers, constant cleaning etc) won’t take away the roof from your head",,1285363476551041024
gistland9ja,2020-07-20T23:58:27.000Z,EU leaders set to seal deal on spending and €750bn Covid-19 recovery plans  gistland9ja.com/eu-leaders-set …,https://t.co/G7DmNjHpea,1285363474936274946
misseskite,2020-07-20T23:58:27.000Z,"I have a double layer fabric mask with a filter insert and moderate but controlled with steroid and albuterol asthma. I can say it can make breathing a little more difficult, and I’m eager to get it off, but my asthma attacks are 10x worse and I still hold above 80% oxygen then.",,1285363474449616896
cctish,2020-07-20T23:58:27.000Z,The 55 most shocking lines from Chris Wallace's interview with Donald Trump cnn.com/2020/07/20/pol …,https://t.co/UvepUf1WG2,1285363473636044805
macbeestje,2020-07-20T23:58:27.000Z,The Cost of Reopening a Restaurant in a Pandemic  detroit.eater.com/2020/7/20/2130 … via  @EaterDetroit,https://t.co/dbzOVjrQLS https://x.com/EaterDetroit,1285363472625045504
MuslimahShenan1,2020-07-20T23:58:27.000Z,No one wants us in their country anymore because of the coronavirus.  #savetheusa #GodHelpUs #vote2020 #helptheusa,https://x.com/hashtag/savetheusa?src=hashtag_click https://x.com/hashtag/GodHelpUs?src=hashtag_click https://x.com/hashtag/vote2020?src=hashtag_click https://x.com/hashtag/helptheusa?src=hashtag_click,1285363472130363393
Yvonne81331203,2020-07-20T23:58:27.000Z,This made me sick !!  & angry !!  Stay safe and Wear a MASK  For you can VOTE Nov 3rd,,1285363472025493507
HokiDokiBloki,2020-07-20T23:58:27.000Z,"If we get to the point where we are forced to wear masks.. I'm going to have a few to choose from. Stormtrooper full helmet. Richie McCaw cardboard one, and a Donald Trump silicon one. Or Zorro. Always liked his mask",,1285363471865921536
digitaltariq,2020-07-20T23:58:27.000Z,Insurers make a killing during Covid pandemic- The New Indian Express  digitaltariq.com/insurers-make- …,https://t.co/fNe2h7NTcc,1285363471073386498
MMJQUEENS,2020-07-20T23:58:26.000Z,QUEENS Hottest Patio where there is ALWAYS Social Distancing w/ a Vibe ...The Sun settled - Lets Go!  #mamajuanacafequeens  #socialdistancing  #6ftapart @ Mamajuana Cafe Queens  instagram.com/p/CC4hZDNjjkn/ …,https://x.com/hashtag/mamajuanacafequeens?src=hashtag_click https://x.com/hashtag/socialdistancing?src=hashtag_click https://x.com/hashtag/6ftapart?src=hashtag_click https://t.co/MwzK7Pmu6z,1285363469974413312
SlayiNSlays,2020-07-20T23:58:26.000Z,*Asymptomatic,,1285363469429231622
KellyWaering,2020-07-20T23:58:26.000Z,#BanTrumpBriefings #FactsMatter Ban LIAR-n-Chief  @realdonaldtrump  from Covid briefings--just the facts! #VoteOutTheGOP EVERY.SINGLE.1!  @ABC  @NPR  @CNN  @BarackObama  @cnnbrk  @MSNBC  @PBS  @NBCNews  @CBSNews  @SenSchumer #Resist #DumpTrump #GOTV! #BlueTsunami   #TraitorTrump #TrumpVirus,https://x.com/hashtag/BanTrumpBriefings?src=hashtag_click https://x.com/hashtag/FactsMatter?src=hashtag_click https://x.com/realdonaldtrump https://x.com/hashtag/VoteOutTheGOP?src=hashtag_click https://x.com/ABC https://x.com/NPR https://x.com/CNN https://x.com/BarackObama https://x.com/cnnbrk https://x.com/MSNBC https://x.com/PBS https://x.com/NBCNews https://x.com/CBSNews https://x.com/SenSchumer https://x.com/hashtag/Resist?src=hashtag_click https://x.com/hashtag/DumpTrump?src=hashtag_click https://x.com/hashtag/GOTV?src=hashtag_click https://x.com/hashtag/BlueTsunami?src=hashtag_click https://x.com/hashtag/TraitorTrump?src=hashtag_click https://x.com/hashtag/TrumpVirus?src=hashtag_click,1285363467772481538
WolfOf38Street,2020-07-20T23:58:26.000Z,You a beta if you wear a mask while driving,,1285363467592126464
Jd2718x,2020-07-20T23:58:26.000Z,"This is NY State Education Department's: ""RECOVERING, REBUILDING, AND RENEWING: THE SPIRIT OF NEW YORK’S SCHOOLS REOPENING GUIDANCE""  It is implicit throughout that the audience is districts  It includes options that de Blasio and Carranza are denying us nysed.gov/common/nysed/f …",https://t.co/4WKpRtMGCi,1285363466933608449
Vernias_T,2020-07-20T23:58:25.000Z,The Grinch who stole COVID-19 funding and put into increasing tourism during the pandemic is really out here telling kids to risk their lives with a deadly illness running rampant just to learn about how the mitochondria is the powerhouse of the cell,,1285363464958103554
IAMINKCOGNITO,2020-07-20T23:58:25.000Z,"Reports of a Sudden Surge in Texas Coronavirus Cases Including More Than 80 Infants is FALSE, Officials Say  changedwinds.wordpress.com/2020/07/20/rep … via  @IAMINKCOGNITO  The Biden/Obama fake news machine using babies to stir chaos",https://t.co/JDuPFIYeaq https://x.com/IAMINKCOGNITO,1285363464613933056
hannahrobmusic,2020-07-20T23:58:25.000Z,Ngl this app would be so beneficial for me everyday with or without a mask  x.com/HealthCoreLTD/ …,https://x.com/HealthCoreLTD/status/1284118755023486980,1285363464312172545
lordbigbunny,2020-07-20T23:58:25.000Z,Some of y’all must be immune to covid ion neva see y’all with masks on,,1285363463070658562
ibk_groit,2020-07-20T23:58:25.000Z,"When you think of Abba Kyari and Isa Funtua, you want to ask if Covid-19 is the apple of 1999.",,1285363462797963264
Holly_A_K,2020-07-20T23:58:25.000Z,"I wasn’t responding to your comment as much as the claim of “propaganda from all sides.” But, how can you view a global pandemic as “Overhyped?” Btw, Insulting  people isn’t persuasive.",,1285363462722531329
NikkiOK1234,2020-07-20T23:58:25.000Z,"142,000 lives too late! Do you agree with that grotesque monster calling COVID-19 the Invisible China Virus? It’s racist and vile! Having almost 4 million cases because of his outrageous failure and despicable incompetence, I refer to it as Trump Virus. #TrumpVirus #142,000Dead",https://x.com/hashtag/TrumpVirus?src=hashtag_click,1285363462504361985
BABDCATHA2,2020-07-20T23:58:24.000Z,"Leading coronavirus expert says face masks should be made compulsory in Sydney 'within days'  abc.net.au/news/2020-07-2 …   Impossible to wear masks in pubs & restaurants? Solution=close them if like  @RACGP  ""we really do believe"" in aerosol trans.  @MarylouiseMcla1  @normanswan  @abc730",https://t.co/t93z61ZmOB https://x.com/RACGP https://x.com/MarylouiseMcla1 https://x.com/normanswan https://x.com/abc730,1285363461791158273
jaredscrog,2020-07-20T23:58:24.000Z,Exactly right. If you die from asthma and aren’t tested for covid then what did you die from?,,1285363461719982080
Bobeedean,2020-07-20T23:58:24.000Z,I hate your mask mandate it seems unconstitutional to me,,1285363461283815424
littlecodingbee,2020-07-20T23:58:24.000Z,"Now speak up for ALL the people who have lost a loved one to Trump’s disastrous inaction on COVID-19 and their opinions on him - ALL of thier opinions on it are 100% correct, right?",,1285363459773923329
endzonedance,2020-07-20T23:58:24.000Z,"Again masks are best used by those that are sick vs the other way around, since you can't be sure who's sick its best if for now everyone wears one. The science why the mask works best on the sick is based on saliva and moisture from talking or breath.",,1285363459736195077
hmagee64,2020-07-20T23:58:24.000Z,"My dear, COVID-19 is not fake news reporting! No, it is not a political fake! Yes, you have been misled! However , it is not too late to wear a mask and practice social distancing. It is not too late to encourage each other to follow rules.  Not too late for leaders to lead!",,1285363458867892224
Telegraphindia1,2020-07-20T23:58:24.000Z,"Trivandrum: Two students, who attended KEAM exam, test positive for Covid-19 | Thiruvananthapuram News – Times of India  telegraphindia24.com/trivandrum-two …",https://t.co/iOUDXeQbBx,1285363458830069760
SequoitFootball,2020-07-20T23:58:24.000Z,Want to limit high school kids contracting covid...have them in their high school sports this fall! #illinoisbubble #nomoretravelingoutofstate #atsportsinsteadofthebeaches  @IDPH  @GovPritzker,https://x.com/hashtag/illinoisbubble?src=hashtag_click https://x.com/hashtag/nomoretravelingoutofstate?src=hashtag_click https://x.com/hashtag/atsportsinsteadofthebeaches?src=hashtag_click https://x.com/IDPH https://x.com/GovPritzker,1285363458809135104
BrookeNicole327,2020-07-20T23:58:24.000Z,@united  is screwing  @r_hollasch  and I out of our refund for a flight we booked prior to 3/31 which they advertised as refundable. The flight was to a hot spot State on the mandatory 14 day quarantine list for NJ. #unitedairlines #CustomerService #COVIDー19,https://x.com/united https://x.com/r_hollasch https://x.com/hashtag/unitedairlines?src=hashtag_click https://x.com/hashtag/CustomerService?src=hashtag_click https://x.com/hashtag/COVID%E3%83%BC19?src=hashtag_click,1285363458561789953
