User_name,Datetime,Content,Links,Tweet_ID
Majeedahmed47,2020-08-18T23:58:19.000Z,UNC-Chapel Hill’s student newspaper editorial calls out university leadership on in-person classes after Covid-19 outbreak  news4global.website/2020/08/18/unc …,https://t.co/V6bQdahc2b,1295872689064808448
megan_alldridge,2020-08-18T23:58:19.000Z,i hope the uk government realise our generation (and anyone currently in an education system in the country) will NEVER forget their deafening silence regarding our learning during the pandemic.,,1295872687244443650
melissacc2020,2020-08-18T23:58:19.000Z,I can’t wait til he crawls back into his pillow and “magically disappears”.   Anderson Cooper has heated exchange with MyPillow CEO over unproven and dangerous COVID-19 treatment   x.com/i/events/12958 …,https://x.com/i/events/1295812413275516929,1295872687122681856
ByCasagrande,2020-08-18T23:58:19.000Z,Alabama football shared this photo of Nick Saban in his practice field mask.,,1295872686929960961
_BayRising,2020-08-18T23:58:18.000Z,"In July, Alameda County extended its eviction moratorium to at least 12/31. This will thankfully keep many in our community in their homes during #ShelterInPlace. But what exactly are our rights? This  @Oaklandside  article answers questions you might have! oaklandside.org/2020/06/17/eve …",https://x.com/hashtag/ShelterInPlace?src=hashtag_click https://x.com/Oaklandside https://t.co/h7yNQ7bEsi,1295872682806763520
cIass_man,2020-08-18T23:58:18.000Z,66 million dollars spent to turn mccormick into a field hospital 38 patients before it closed down in may your tax dollars at work chicago.suntimes.com/2020/8/14/2136 …,https://t.co/VDE6qfaKUi,1295872682517508096
killmebilly,2020-08-18T23:58:18.000Z,Scott's Amazon wish list 1. A vaccine 2. A surplus 3. A hose #auspol,https://x.com/hashtag/auspol?src=hashtag_click,1295872682286751745
Emmytation,2020-08-18T23:58:17.000Z,really want  -a gigantic owlie (if it won’t eat me) -social distancing ball -whatever that bromeliad-thistle-starry-night-water-lily flower is -giant strawberry,,1295872679581495296
sandidge_bill,2020-08-18T23:58:17.000Z,Trying to save some kids! Have ideas for the coronavirus outbreak! Please respond before it gets worse! Thanks!  @BillGates  @melindagates  @gatesfoundation,https://x.com/BillGates https://x.com/melindagates https://x.com/gatesfoundation,1295872678742695938
Pajjr2016,2020-08-18T23:58:17.000Z,It is a propaganda pandemic.  Scart what it does to the less analytical among us.,,1295872678642028544
SarahMeredithAU,2020-08-18T23:58:17.000Z,This COVID crisis is not going to end for anyone until it ends for everyone. I'm proud that @GlblCtznAU is joining partners in the #EndCOVIDForAll campaign in calling for Aus to play its part in stopping this pandemic across the world. Pledge here:  bit.ly/GCAU-ECFA,https://x.com/hashtag/EndCOVIDForAll?src=hashtag_click https://t.co/tE3PlGfSi4,1295872678167867393
TimesBritain,2020-08-18T23:58:17.000Z,The latest coronavirus infection rates in every borough in Greater Manchester  timesofbritain.com/2020/08/18/the …,https://t.co/2q7guTuvXR,1295872677861875712
greenkitten_net,2020-08-18T23:58:16.000Z,Lockdown Diary: Entry 109  greenkitten.net/woah/comic/loc …,https://t.co/jZnfPQrnlD,1295872676679081985
TimesBritain,2020-08-18T23:58:15.000Z,Hundreds of Covid-19 cases reported as students return to college campuses  timesofbritain.com/2020/08/18/hun …,https://t.co/1hdHrxaMCD,1295872672748969987
adunlea,2020-08-18T23:58:15.000Z,Coronavirus: One more death and 190 new cases confirmed in Ireland (via  @thejournal_ie )  jrnl.ie/5178797,https://x.com/thejournal_ie https://t.co/KaPi3ATBXd,1295872669615882240
jakemorrow73,2020-08-18T23:58:14.000Z,I drew this on the outside of my office today during lunch.  Superman is wearing his  @FLPolyU  Phoenix mask. #floridapoly #lakeland,https://x.com/FLPolyU https://x.com/hashtag/floridapoly?src=hashtag_click https://x.com/hashtag/lakeland?src=hashtag_click,1295872666797318145
denverbusiness,2020-08-18T23:58:14.000Z,"S&P 500 closes at a record, erasing last of pandemic losses  dpo.st/2YdcJnM",https://t.co/xDnfcjh5Qr,1295872666608558080
DjhTrading,2020-08-18T23:58:14.000Z,With $IBIO floating around FinTwit thought I'd drop a few little details for those curious. Personally think this just needs one good PR to give it a nice pop. - COVID Play - Increase in Institutional ownership - Seems to have found support around it's current price point.,https://x.com/search?q=%24IBIO&src=cashtag_click,1295872665945878528
drvictoriafox,2020-08-18T23:58:14.000Z,"I find myself agreeing with conservatives on a daily basis. It’s rocked my reality. But also a good sign we came together & found common ground in the fight against the unnecessary, anti-science, liberty crushing, racist, poverty inducing draconian measures used in this pandemic!",,1295872665584975872
M3435Luis,2020-08-18T23:58:14.000Z,Plot twist: todo tiene covid :c,,1295872664901484545
nz_visa_adviser,2020-08-18T23:58:13.000Z,Coronavirus: Just 21 essential health workers granted entry into NZ during first months of border shutdown  stuff.co.nz/national/healt …,https://t.co/bJ4cVniDTH,1295872661021552641
RickORox1,2020-08-18T23:58:13.000Z,Covid my ass... what fools we all are.  x.com/PrisonPlanet/s …,https://x.com/PrisonPlanet/status/1295401608331878400,1295872660295962625
KimMukerjee,2020-08-18T23:58:12.000Z,"Wear your mask. Do the right thing. These kids’ lives, and their growth and development and nutrition and education, literally depend on it.",,1295872660090519552
gwboudreau,2020-08-18T23:58:12.000Z,"10 months too late. 170,000 Americans are dead of covid. #realDonaldTrump is responsible.",https://x.com/hashtag/realDonaldTrump?src=hashtag_click,1295872658094067713
phlcoc,2020-08-18T23:58:12.000Z,News Release! Click the link to read! #phlcocnewsCOVID-19 Sharp Rise Calls for Community Response: Parkland Health  tinyurl.com/y5tny2e6,https://x.com/hashtag/phlcocnewsCOVID?src=hashtag_click https://t.co/s2Lc9b9N07,1295872657968082944
KWXX,2020-08-18T23:58:12.000Z,"Big Island adds 3 COVID, with 22 active, as state adds lowest in a week at 134  kwxx.com/2020/08/18/sta …",https://t.co/RNShRc7e7U,1295872656785498113
jon_excog,2020-08-18T23:58:11.000Z,Having Gov Cuomo talk about COVID is like having Trump talk about using Twitter responsibly.,,1295872655963361280
ohfuckingod,2020-08-18T23:58:10.000Z,1. do you go to parties with no mask every weekend?  2. how many people have you hooked up with from tinder in the last 2 weeks?,,1295872651584471042
rweingarten,2020-08-18T23:58:10.000Z,Health experts have said over and over again: we have to tackle community spread before we can open schools. There is only a fine line between one case and a hot spot when it comes to schools.   vox.com/2020/8/17/2137 …,https://t.co/C8p7r6aA7L,1295872651248963586
whitney_hu,2020-08-18T23:58:10.000Z,"If we don't have a way to actually have community input, then maybe we shouldn't be pushing forward giant rezonings during a pandemic?",,1295872650934390785
trichards189,2020-08-18T23:58:10.000Z,The families of those with loved ones killed by Cuomo’s COVID nursing home decision might disagree... Seemingly nursing home lives don’t matter.,,1295872649915240448
AyushDharDwive3,2020-08-18T23:58:10.000Z,#POSTPONEJEE_NEET #SurakshaBeforePariksha  @PMOIndia  @EduMinOfIndia  @DrRPNishank  @HMOIndia  @MoHFW_INDIA  @drharshvardhan  @AmitShah   ask @DG_NTA  pehli Fursat Mai JEE_NEET postpone karee otherwise covid 19 stats will increase and people vl die... @RealKingbhau   look into the matter,https://x.com/hashtag/POSTPONEJEE_NEET?src=hashtag_click https://x.com/hashtag/SurakshaBeforePariksha?src=hashtag_click https://x.com/PMOIndia https://x.com/EduMinOfIndia https://x.com/DrRPNishank https://x.com/HMOIndia https://x.com/MoHFW_INDIA https://x.com/drharshvardhan https://x.com/AmitShah https://x.com/RealKingbhau,1295872649160097792
ConstitLawAus,2020-08-18T23:58:10.000Z,"The PM (on radio) about the vaccine: ""I would expect it to be as mandatory as you can possibly make it. There are always exemptions for any vaccine on medical grounds but that should be the only basis …"" theguardian.com/australia-news …",https://t.co/uqQxm0kMWs,1295872648988123137
CBCToronto,2020-08-18T23:58:10.000Z,Toronto protesters block sheriffs from conducting evictions amid COVID-19  ift.tt/2YbK6HI,https://t.co/DUqS2zZJEN,1295872648807886855
anxietittiezz,2020-08-18T23:58:10.000Z,"The video of that one conservative angrily getting into his car, ripping off his mask and yelling ""UGHH............. DEMOCRATS"" lives rent free in my head",,1295872648359026688
JNewellPhotos,2020-08-18T23:58:09.000Z,"Added my easy, strapless, no fog, face mask tutorial to Youtube because no one else seemed to have uploaded one. Feel free to share if you think someone might find it useful.  youtube.com/watch?v=Ttiisf …",https://t.co/z52HkbrgU3,1295872647188885505
Thunderburke,2020-08-18T23:58:09.000Z,Exactly. It totally sucks wearing one and takes away big form of non verbal communication. Hating wearing also does not mean that you are anti mask either.,,1295872645783670784
KShow76,2020-08-18T23:58:09.000Z,No. I just voted in my primary today without a mask,,1295872645708185600
lilyalta,2020-08-18T23:58:09.000Z,Gov. board of the largest school district in the state plans to meet at 5PM tomorrow to talk about reopening plans.,,1295872644986728448
F_man8326,2020-08-18T23:58:09.000Z,"Has it been 10 years?  Time flies during COVID…  Yeah, Mo and I have been chatting about AFC for while; and now he literally lives right down the street from me.  Can’t wait to get out of this pseudo-lockdown imposed on us.",,1295872644915564552
_melayyy,2020-08-18T23:58:09.000Z,Does anybody else get a runny nose while wearing their mask?,,1295872644634435584
WarshipCam,2020-08-18T23:58:09.000Z,"USS Coronado (LCS 4) Independence-variant littoral combat ship coming into San Diego - August 18, 2020 #coronado #lcs4",https://x.com/hashtag/coronado?src=hashtag_click https://x.com/hashtag/lcs4?src=hashtag_click,1295872644458393600
Cclaudio88,2020-08-18T23:58:08.000Z,CHAMPIONS COVID 19 LEAGUE SANS MATCH RETOUR FINAL,,1295872640708759552
DrArjana,2020-08-18T23:58:08.000Z,I miss my classroom and my office and my campus so much right now. I’m also all ready for teaching online and super grateful that I have that option. Ugh this pandemic. Ugh.,,1295872640532590593
Agencia_Andina,2020-08-18T23:58:08.000Z,Peru's Health Min: COVID-19 is moving from streets to homes  bit.ly/323I4uu,https://t.co/MqFafXWPro,1295872639601381376
cmencke,2020-08-18T23:58:07.000Z,Effectiveness of Statins in Patients with Severe COVID-19  awesomecapital.wordpress.com/2020/08/18/eff …,https://t.co/tFIYYDO92w,1295872638544482306
merrywish2007,2020-08-18T23:58:07.000Z,A living coronavirus.,,1295872636958830592
Sussex_Jones,2020-08-18T23:58:06.000Z,"BBC NEWS (UK): "" Coronavirus: Care homes ask for insurance cost help ""   bbc.co.uk/news/uk-englan …",https://t.co/GFCv7FzKfP,1295872634715090944
brea_an_lae,2020-08-18T23:58:06.000Z,and these are imported cases in quarantine !! ugh imagine we had travel restrictions like they do that clearly work ??,,1295872634421420032
annacallow0le7,2020-08-18T23:58:06.000Z,Hip Hop Public Health and Doug E. Fresh drop 'Behind the Mask' PSA - Rolling Out  rollingout.com/2020/08/18/hip …,https://t.co/ZAgsEZNVJF,1295872633179975680
rewtoetzi,2020-08-18T23:58:06.000Z,Oh my God! He is not wearing  a mask!,,1295872632483655682
ElkoDaily,2020-08-18T23:58:06.000Z,"SPARKS (AP) — Thousands of students began returning to northern Nevada classrooms Tuesday for the first time since March with masks, social distancing and other precautions to help guard against the spread of the coronavirus.  elkodaily.com/news/state-and …",https://t.co/oi8pXYZXZq,1295872631674220544
b1982lfc,2020-08-18T23:58:06.000Z,"It normally would be like lad but I’m still off work cos of covid lad so got fuck all else to do anyway yeah some effort that lad been worth it last few seasons tho, the ufc kills me off lad 6 bell",,1295872631615389696
marieeberry,2020-08-18T23:58:06.000Z,My wonderful colleague just confessed she has done 34 journal/book reviews since COVID started because she doesn't have kids and wanted to pick up the slack. I'm not even sure what to say other than heroes walk among us.,,1295872631430737920
ErinPascoeee,2020-08-18T23:58:06.000Z,covid take notes,,1295872631409909763
11AliveNews,2020-08-18T23:58:05.000Z,Gov. Kemp announces first allocation of relief funding will go to support education  11alive.com/article/news/e …,https://t.co/0ZHPhrVsD7,1295872629870661632
Warren_Elem,2020-08-18T23:58:05.000Z,"Our bodies may be tired, but our hearts are full!!! What a great 1st Open House we had!!! PreK-2nd grade students and families are amazing!!! (And yes, the picture was just a quick selfie- we were social distancing!!!) #BeTheChange",https://x.com/hashtag/BeTheChange?src=hashtag_click,1295872628801101825
vickdabest7,2020-08-18T23:58:05.000Z,Does anyone know how many of the children that have died from Covid had parents that are anti-Vaxers?  @msnbc  @cnn  @jemelehill  @CariChampion  @RealDLHughley  @shaunking  @RexChapman  @JoyAnnReid,https://x.com/msnbc https://x.com/cnn https://x.com/jemelehill https://x.com/CariChampion https://x.com/shaunking https://x.com/RexChapman https://x.com/JoyAnnReid,1295872627630903298
amandakegs,2020-08-18T23:58:05.000Z,when will school boards learn that covid won’t go along with their in-person back-to-school plans?,,1295872627542818817
Briyamichelle_,2020-08-18T23:58:05.000Z,how u still stink during a pandemic ? u had mad time to get the hygiene together,,1295872627236626432
cna006,2020-08-18T23:58:05.000Z,"“I think chances are very low that that will happen, but I can tell you that we will have our flu vaccine ready in about two or three weeks, so you can get that first,” said Dr  @wttseng   #VaccinesWork get your flu shot pls!!! We start Sept 1 with our flu shots at  @aboutKP",https://x.com/wttseng https://x.com/hashtag/VaccinesWork?src=hashtag_click https://x.com/aboutKP,1295872626951258112
cm93967811,2020-08-18T23:58:04.000Z,"I know a ‘KidsLast’ Robot.  It’s been programmed to repeat empty talking points in a tape loop, to bizarrely veto other leaders’ excellent SafeSept. plans, to hoard Fed$, and to lie about & blame unions. The SL2020 robot will singlehandedly cause the second Covid .  #FireLecce",https://x.com/hashtag/FireLecce?src=hashtag_click,1295872623780540418
MellowSocialist,2020-08-18T23:58:03.000Z,30 million people pre-pandemic no health insurance. 62% of bankruptcies due to medical bills. The wealth gap is outrageous. 78% of Americans live paycheck to paycheck. Monopolies. Many don’t make a livable wage. Rent is skyrocketing. Oh shit pandemic almost forgot!,,1295872621607870467
GwynneFitz,2020-08-18T23:58:03.000Z,"ALSO shout out to  @ryeh  who reliably brings our newsroom tremendous intern talent, and to all the prospective interns out there, you CAN STILL MAKE RADIO during the pandemic, these ladies have proved it!",https://x.com/ryeh,1295872620999712768
Mihi_Forbes,2020-08-18T23:58:03.000Z,Farro Grey Lynn must be Covid free cause heaps of shoppers not wearing masks. Höha,,1295872620869480449
HaePimpcess,2020-08-18T23:58:03.000Z,Children cant even stay at home by themselves my momma use to leave me at home and tell me to lock the door dont open it and set the alarm,,1295872620706004992
AmazonAzure,2020-08-18T23:58:03.000Z,New Yoda mask AND spicy beans for stream tonight!! Join me in my pain!!! Ladiessss night!!!  twitch.tv/amazonazure/,https://t.co/VXgmxzLFMF,1295872620622221312
GwynneFitz,2020-08-18T23:58:03.000Z,"And to  @meganzerez  brings us the story of how subway riders are handling social distance at some of the deepest stations in the country, where avoiding crowded elevators is a near impossibility:  wnyc.org/story/straphan …",https://x.com/meganzerez https://t.co/IYmNneOlUt,1295872620047597571
NevadaAG,2020-08-18T23:58:03.000Z,Nevada's Attorney General eyes multi-state lawsuit over USPS cuts.  @News3LV Story:  news3lv.com/news/coronavir …,https://x.com/News3LV https://t.co/9Xr2DhjzAH,1295872619464372225
adamdepasqua,2020-08-18T23:58:03.000Z,The only thing Democrats and Republicans are trying to provide the American people during a pandemic are conventions with peak levels of cringe.,,1295872619120660484
GwynneFitz,2020-08-18T23:58:03.000Z,and to  @ChloeKLis  who reported on student-run Instagram pages that are calling out sexual harassment in city high schools.  wnyc.org/story/midst-pa …,https://x.com/ChloeKLis https://t.co/CDVQAB3ctx,1295872618973868033
MedusaHere,2020-08-18T23:58:03.000Z,"people here (aka the west) are SO jealous about wuhan lmfao - whine to the shitty government you voted in assholes, whine to the bitches refusing to wear a mask",,1295872618701246464
UpdatesFromYT,2020-08-18T23:58:02.000Z,Culture & Trends manager  @MadelineBuxton  shares insights on the rise of sourdough during quarantine:  yt.be/upwu,https://x.com/MadelineBuxton https://t.co/WQdOo8sEjT,1295872617572896773
adunlea,2020-08-18T23:58:02.000Z,Coronavirus: One more death and 190 new cases confirmed in Ireland (via  @thejournal_ie )  jrnl.ie/5178797,https://x.com/thejournal_ie https://t.co/KaPi3ATBXd,1295872617199673346
pandamicsays,2020-08-18T23:58:02.000Z,You smelt it you d- ...on’t likely have covid.  #PandaMicSays #pandemic #coronavirus #covid19 #quarantine #PandaMic #DIYtesting #snifftest #covidcheck #peeyoo #farts #canyousmellit,https://x.com/hashtag/PandaMicSays?src=hashtag_click https://x.com/hashtag/pandemic?src=hashtag_click https://x.com/hashtag/coronavirus?src=hashtag_click https://x.com/hashtag/covid19?src=hashtag_click https://x.com/hashtag/quarantine?src=hashtag_click https://x.com/hashtag/PandaMic?src=hashtag_click https://x.com/hashtag/DIYtesting?src=hashtag_click https://x.com/hashtag/snifftest?src=hashtag_click https://x.com/hashtag/covidcheck?src=hashtag_click https://x.com/hashtag/peeyoo?src=hashtag_click https://x.com/hashtag/farts?src=hashtag_click https://x.com/hashtag/canyousmellit?src=hashtag_click,1295872615299547136
megbish0713,2020-08-18T23:58:02.000Z,today a lady stopped me and my roommates on campus and asked if we wanted to pet her dog and feed it a treat because they’ve been struggling to socialize the dog with covid... like is that even a question OF COURSE I WILL PET YOUR PUP! I hope this can be a frequent occurrence,,1295872615161135104
Peoplelyzer,2020-08-18T23:58:01.000Z,COVID vaccine available...,,1295872612434763782
geloxDi,2020-08-18T23:58:01.000Z,How the covid 19 started.  x.com/drunkdoinshit2 …,https://x.com/drunkdoinshit21/status/1295723435755282435,1295872612090802177
ArnuMoz,2020-08-18T23:58:00.000Z,Quarantine II. Cuarentena II.  Made with infinite.painter  #quarantine #quarantinelife #mask #television #cuarentena #cubrebocas #covid19 #digitalpainting #dibujodigital #drawing #artedigital #infinitepainter…  instagram.com/p/CEDMf1PFZke/ …,https://x.com/hashtag/quarantine?src=hashtag_click https://x.com/hashtag/quarantinelife?src=hashtag_click https://x.com/hashtag/mask?src=hashtag_click https://x.com/hashtag/television?src=hashtag_click https://x.com/hashtag/cuarentena?src=hashtag_click https://x.com/hashtag/cubrebocas?src=hashtag_click https://x.com/hashtag/covid19?src=hashtag_click https://x.com/hashtag/digitalpainting?src=hashtag_click https://x.com/hashtag/dibujodigital?src=hashtag_click https://x.com/hashtag/drawing?src=hashtag_click https://x.com/hashtag/artedigital?src=hashtag_click https://x.com/hashtag/infinitepainter?src=hashtag_click https://t.co/EZ75zbOO01,1295872608911712256
Kaye2Lady,2020-08-18T23:58:00.000Z,"Worldwide Coronavirus Pandemic!! United States National Crisis!! It’s not disappearing, not a hoax, it’s not safe to go out without a mask!! #ItsNotOk #ItsNotPolitical #ListenToMedicalProfessionals #LackOfLeadership #COVID19 #CoronavirusPandemic #SaveThePostOffice",https://x.com/hashtag/ItsNotOk?src=hashtag_click https://x.com/hashtag/ItsNotPolitical?src=hashtag_click https://x.com/hashtag/ListenToMedicalProfessionals?src=hashtag_click https://x.com/hashtag/LackOfLeadership?src=hashtag_click https://x.com/hashtag/COVID19?src=hashtag_click https://x.com/hashtag/CoronavirusPandemic?src=hashtag_click https://x.com/hashtag/SaveThePostOffice?src=hashtag_click,1295872608852946945
MichaelMaitri,2020-08-18T23:58:00.000Z,Good News! Up To 50% Of Us May Be 'Pre-Immune' To Covid-19  youtu.be/G7TWiweluwA via  @YouTube,https://t.co/4mHaV9MnEx https://x.com/YouTube,1295872608508899328
Clem205,2020-08-18T23:58:00.000Z,"C’mon  @BorisJohnson  take a leaf out of her book and start taking back control of Britain b4 it’s too late. The  Covid restrctions are killing us all (excuse the pun) and totally OTT, ambiguous and inconsistent. Shape up Boris and save Great Britain. Maggie did it; you can too!",https://x.com/BorisJohnson,1295872607749836800
Twheater2,2020-08-18T23:58:00.000Z,Intellectual-property disputes throughout the drug supply chain could hold back a Covid-19 treatment  trib.al/0fpV8V2,https://t.co/gFOImjgwvV,1295872607720321025
abc27,2020-08-18T23:58:00.000Z,A free mobile COVID-19 testing site will be stationed at the apartments located just off of Country Club Drive.   bit.ly/3aDsx8z,https://t.co/8fX4mwvIXL,1295872606646624257
wwmtnews,2020-08-18T23:58:00.000Z,"'That woman from Michigan,' has embraced the nickname, but not the way the Trump administration has fought the pandemic. View the full one-on-one interview with  @GovWhitmer  and @SamWWMT  wwmt.com/news/local/whi …",https://x.com/GovWhitmer https://t.co/ihI5nUdTrW,1295872606592270341
foggybottomgal,2020-08-18T23:57:59.000Z,"NC COVID-19 Update: Daily totals again top 1,200, over 1,000 currently hospitalized  wlos.com/news/local/nc- …",https://t.co/sE0pCYtgOs,1295872604151128064
MikeSLeesburg,2020-08-18T23:57:59.000Z,"I’ve been to hotels 4 times since the pandemic, the funny thing isninfeel@it is very safe there.  They don’t clean your room during your stay.   The hotel is like half empty.  There is no feeling of being in close contact with people you don’t know.",,1295872602645442560
ecotonetwo,2020-08-18T23:57:58.000Z,Maybe he had the spoon elsewhere and it wasn’t curry OR a vaccine he was stirring!  (I’m doing it right now)  #auspol  #ScottyTheSimp,https://x.com/hashtag/auspol?src=hashtag_click https://x.com/hashtag/ScottyTheSimp?src=hashtag_click,1295872601319813122
mamajenniejo,2020-08-18T23:57:58.000Z,How is it that they STILL have wine from 2018? I figure during the pandemic my  @MomsDemand  friends and I would have drank all of 2018 and 2019 in our driveways while talking about #gunsensevoter issues. Tonight I will be enjoying some 2018 while watching the #DNC2020 #watchuswork,https://x.com/MomsDemand https://x.com/hashtag/gunsensevoter?src=hashtag_click https://x.com/hashtag/DNC2020?src=hashtag_click https://x.com/hashtag/watchuswork?src=hashtag_click,1295872601122697216
Chiboss_,2020-08-18T23:57:58.000Z,"I have great used cars for sale at a very good rate, as the covid19 pandemic has forced the hands of the car owners to sell them off.  Grab this opportunity to own that car of your dreams.. All cars are in good condition, neat and clean.  Cars in uae, call today.. +971553055182",,1295872600049156096
TampaGator15,2020-08-18T23:57:57.000Z,"It is funny reading the disbelief & outrage of the anti-science, anti-mask MAGAts in the responses. They think they are the silent majority because they are easily conned by Trump. No, you are in a small right wing fringe cult & on Nov 3 the blue wave will wash you away for good.",,1295872597121363972
PfauLong,2020-08-18T23:57:57.000Z,Check out the article in  @homefrontmag  where Melanie Turner discusses reconsidering transition areas and quiet spaces in the pandemic.  tinyurl.com/y5my53rh   #design #architecture #pfaulongarchitecture #California #customhome  @perkinswill_SF,https://x.com/HomefrontMag https://t.co/rOmj8W4AyC https://x.com/hashtag/design?src=hashtag_click https://x.com/hashtag/architecture?src=hashtag_click https://x.com/hashtag/pfaulongarchitecture?src=hashtag_click https://x.com/hashtag/California?src=hashtag_click https://x.com/hashtag/customhome?src=hashtag_click https://x.com/perkinswill_SF,1295872597020745728
Desireevelez10,2020-08-18T23:57:55.000Z,youtu.be/5TDxlGubzGE Full faces Tiger design. Whether your a mom entertaining kids in quarantine or getting ready for Halloween. Subscribe. #crazyactorlife #facepainttutorial #mysticalsmilesfacespainting,https://t.co/SKKNBI0hMz https://x.com/hashtag/crazyactorlife?src=hashtag_click https://x.com/hashtag/facepainttutorial?src=hashtag_click https://x.com/hashtag/mysticalsmilesfacespainting?src=hashtag_click,1295872587688550400
343FallenBros,2020-08-18T23:57:55.000Z,At least 2 people were smart enough to wear masks! Biggs deserves a good dose of COVID,,1295872587566739456
cyianite,2020-08-18T23:57:55.000Z,"Australia govt are always listen to their people and provide what their people needs. They also have raising cases but they always finds innovative solution and  mitigate the problem.   Meanwhile the Ph, ""let's wait for the vaccine and let our own  people be the quinea pig """,,1295872587210174464
wesleyblevins,2020-08-18T23:57:55.000Z,"Winconsin’s ten electoral votes would not have swung the election, either. The reason Trump won was due to mass-collusion by the top 1% to continue lining their pockets, which has only been intensified during this pandemic. Huge corporations received billions in stimulus dollars.",,1295872587080310790
