User_name,Datetime,Content,Links,Tweet_ID
TizNaija,2020-06-27T23:59:03.000Z,"My wife,  Myself and my Daughter were covid-19 positive- Peter Okoye  tiznaija.net/2020/06/breaki … #PeterPaul #accessbankscam #Peter",https://t.co/EaJ6Vgo9Sc https://x.com/hashtag/PeterPaul?src=hashtag_click https://x.com/hashtag/accessbankscam?src=hashtag_click https://x.com/hashtag/Peter?src=hashtag_click,1277028702874984449
tori_martino,2020-06-27T23:59:03.000Z,I read Ohio at the start of lockdown! It was SO GOOD. I couldn't put it down.,,1277028702229016582
ForbesSports,2020-06-27T23:59:03.000Z,"Amid the uncertainty of the pandemic, five colleges are launching football programs for the first time or are relaunching the sport after a decades-long hiatus  on.forbes.com/6011GOGl1",https://t.co/jcaVG4Uwn3,1277028702040338432
Lisasaraiva489,2020-06-27T23:59:02.000Z,I'm still wondering why in hell doctor falchi has not quit Trump fake Force yet while he still has his credibility intact he should just quit and go work for Biden on his covid-19 task force where we won't be muzzled,,1277028699855097857
AKut47,2020-06-27T23:59:02.000Z,Saturday wedding hype during covid Lol.,,1277028699481792512
marieRealtor,2020-06-27T23:59:02.000Z,"Economist says COVID will cause housing to flourish in suburbs, small towns  buff.ly/2YBpfOA  #realestate #housingmarket",https://t.co/PJkKYeroL7 https://x.com/hashtag/realestate?src=hashtag_click https://x.com/hashtag/housingmarket?src=hashtag_click,1277028697564950528
TheDejectedKing,2020-06-27T23:59:02.000Z,"Unfortunately, I couldn't get the CE this time around.  Covid-19 situation really destroyed my finances. I haven't missed one of your releases yet until now. Maybe next time.",,1277028697212694528
LegalAnalysis,2020-06-27T23:59:01.000Z,COVID-19 and Employee Benefits #4: IRS Releases New CARES Act Guidance  jdsupra.com/legalnews/covi …,https://t.co/3m5c1H6zpf,1277028696382201858
jackcam83641238,2020-06-27T23:59:01.000Z,Co-founder of Maryland group that protested for state to reopen tests positive for coronavirus cnn.com/2020/06/27/pol …:  I believe it’s vital that when instances of individuals who actively demonstrated to disregard scientific evidence be reported. No privacy is warranted.,https://t.co/M9CLSwgv7l,1277028696281530368
ForbesAdvisor,2020-06-27T23:59:01.000Z,"According to the  @CDCgov , the first question to consider when planning a trip is: Is COVID-19 spreading where you’re going? Here are four tools that can help you determine whether you’ll feel safe where you’re heading.  @Forbes  on.forbes.com/6012G3wLG",https://x.com/CDCgov https://x.com/Forbes https://t.co/N68PSnkocP,1277028696063447040
EditsAtelier,2020-06-27T23:59:01.000Z,Teaching  @DonDjorin  Tumblr over twitter DM while half asleep at 2am is a quarantine mood,https://x.com/DonDjorin,1277028695933403141
mrsgjokaj,2020-06-27T23:59:01.000Z,"Macedonia is facing 3 epic crises all at once. The political situation is going crazy, organizing election in time of Covid 19 is insane. Second behavior of the people doesnt have anything to do with the reality, they think Covid19 is a joke. Third the economy is collapsing...",,1277028693639077888
dallasnews,2020-06-27T23:59:01.000Z,5 Dallas stores undergo deep cleans after employees test positive for COVID-19  buff.ly/3eEqi6f,https://t.co/gzBC1ST8Fv,1277028693236494336
CercySashaA,2020-06-27T23:59:01.000Z,South Carolina is a hot spot for Covid right now and it’s so sad. Everyone stopped making efforts and stopped staying home. We haven’t even hit our peak yet but people somehow think it’s okay to go to the beach or the restaurant or the grocery store with no mask on.,,1277028693190283265
KGNSnews,2020-06-27T23:59:01.000Z,"Covid Chronicles, Vol. 3: Opera singer's voice carries during quarantine",,1277028692926124033
sonsue88,2020-06-27T23:59:00.000Z,What's even more cozy is that UW is running one of the HCQ clinical trials. globalhealth.washington.edu/news/2020/03/3 …,https://t.co/W0bDYCbtEe,1277028691533426688
TOPCHEFSIE,2020-06-27T23:59:00.000Z,Scots chef offers new service cooking for people in their garden during lockdown buff.ly/2NvqybM #Chefs #InTheNews,https://t.co/AlWgdzz3A9 https://x.com/hashtag/Chefs?src=hashtag_click https://x.com/hashtag/InTheNews?src=hashtag_click,1277028691390926848
msscarpenter,2020-06-27T23:59:00.000Z,"Not in my area, my friend. Around me, the public gave up social distancing and adhering to the 4 reasons 3-4 weeks before the BLM protest. Lines at bunnings. Carparks packed. Every single weekend. Like it was the lead up to Christmas. It. Has. Been. Effing. Absurd.",,1277028690975576064
lauren_brodauf,2020-06-27T23:59:00.000Z,not the grocery store cashier TAKING OFF HER MASK to sneeze 7 times in a row all over literally everything :))))):):):))):))),,1277028690665312256
reesmarx,2020-06-27T23:59:00.000Z,"What are the #workplace safety considerations and how can your business create a #recovery #strategy for growth, post-Covid19?  If you missed our #webinar with #GlobalChamber, watch the #replay on our website.  #reesmarx #Hiring #Consulting  bit.ly/2YDgT7S",https://x.com/hashtag/workplace?src=hashtag_click https://x.com/hashtag/recovery?src=hashtag_click https://x.com/hashtag/strategy?src=hashtag_click https://x.com/hashtag/webinar?src=hashtag_click https://x.com/hashtag/GlobalChamber?src=hashtag_click https://x.com/hashtag/replay?src=hashtag_click https://x.com/hashtag/reesmarx?src=hashtag_click https://x.com/hashtag/Hiring?src=hashtag_click https://x.com/hashtag/Consulting?src=hashtag_click https://t.co/HOvgCGbH3g,1277028690518573058
BjorkSims,2020-06-27T23:59:00.000Z,But someone who walks into Wal-Mart with a MAGA hat and no mask is committing assault,,1277028690417729536
HeartAlabama,2020-06-27T23:59:00.000Z,"Looking for a way to talk to kids about #COVID19 in an age-appropriate way? Tinydocs, alumni of the AHA’s EmPOWERED To Serve Business Accelerator™, has a cartoon with Dr. Patches that can help!  spr.ly/6012GO6ps",https://x.com/hashtag/COVID19?src=hashtag_click https://t.co/0t8Yk6hjqW,1277028689310560256
sundarivenkat,2020-06-27T23:59:00.000Z,"#Grounded during #lockdown #Covid_19 #TheGroomSeries #3 #Romance #HotNewRelease #indie #indiebooks #romancebooks #romancenovels #indieauthor  @AmazonKDP  @KindleIndia  “Woman, you’re going to be the death of me,” he groaned, letting her have her way with him.  amazon.ca/dp/B089WGLX2H",https://x.com/hashtag/Grounded?src=hashtag_click https://x.com/hashtag/lockdown?src=hashtag_click https://x.com/hashtag/Covid_19?src=hashtag_click https://x.com/hashtag/Covid_19?src=hashtag_click https://x.com/hashtag/TheGroomSeries?src=hashtag_click https://x.com/hashtag/Romance?src=hashtag_click https://x.com/hashtag/HotNewRelease?src=hashtag_click https://x.com/hashtag/indie?src=hashtag_click https://x.com/hashtag/indiebooks?src=hashtag_click https://x.com/hashtag/romancebooks?src=hashtag_click https://x.com/hashtag/romancenovels?src=hashtag_click https://x.com/hashtag/indieauthor?src=hashtag_click https://x.com/AmazonKDP https://x.com/KindleIndia https://t.co/lJpegkz8d3,1277028689293819904
1foodmarketer,2020-06-27T23:58:59.000Z,HERE ARE 6 TIPS FOR ANY #RESTAURANT TO REOPEN NOW AND DO IT PROFITABLY #CHEFS #FOOD #FOODIE #CALIFORNIA #CORONAVIRUS #COVID19 700 FREE VIDEOS FOR FOOD #ENTREPRENEURS  youtu.be/N4Tu9lrmO9U,https://x.com/hashtag/RESTAURANT?src=hashtag_click https://x.com/hashtag/CHEFS?src=hashtag_click https://x.com/hashtag/FOOD?src=hashtag_click https://x.com/hashtag/FOODIE?src=hashtag_click https://x.com/hashtag/CALIFORNIA?src=hashtag_click https://x.com/hashtag/CORONAVIRUS?src=hashtag_click https://x.com/hashtag/COVID19?src=hashtag_click https://x.com/hashtag/ENTREPRENEURS?src=hashtag_click https://t.co/NT0MeQ7r8f,1277028687645421569
JerryBoKnowz,2020-06-27T23:58:59.000Z,"Mannnn, we are on red alert for COVID in Houston.  Neighbors- Let’s throw a BIG party. Hell let’s combine a party with across the street.   It’s a block party folks!!  Reporting next on Jerry Bo news",,1277028685481156614
Natalie09769860,2020-06-27T23:58:59.000Z,"""The real reason many Americans aren’t sure if they need to wear a mask. Forgive the American people if they're in a fog about face masks. President Donald Trump & the federal government have done a number on them"" #DonaldTrump #Covid19 #coronavirus fortune.com/2020/06/27/sho …",https://x.com/hashtag/DonaldTrump?src=hashtag_click https://x.com/hashtag/Covid19?src=hashtag_click https://x.com/hashtag/coronavirus?src=hashtag_click https://t.co/kocAXMa2Cb,1277028684843692036
DataZifu,2020-06-27T23:58:59.000Z,Grants Available for COVID-19 Research that Uses Artificial Intelligence and Big Data #DataZifu #ArtificialIntelligence  bit.ly/37YC9te,https://x.com/hashtag/DataZifu?src=hashtag_click https://x.com/hashtag/ArtificialIntelligence?src=hashtag_click https://t.co/7X3ApjAKuU,1277028684424069120
oatsdoc,2020-06-27T23:58:58.000Z,Decided to get carry-out pizza tonight.  Walked into the resturant to pick up my order and didn’t see a single employee or patron wearing a mask or practicing social distancing. Every booth full. Kansas just had record cases reported yesterday.  Suddenly not hungry for pizza.,,1277028683795103746
voiceofnigeria,2020-06-27T23:58:57.000Z,India coronavirus cases over half a million  von.gov.ng/india-coronavi …,https://t.co/yFsMyIXt1S,1277028679529517058
ElectricNP,2020-06-27T23:58:57.000Z,#nowplaying WAH COVID ADS_A_(ELECTRIC) by   Listen Live:,https://x.com/hashtag/nowplaying?src=hashtag_click,1277028679088996352
_RestoreProject,2020-06-27T23:58:57.000Z,The mask wearers seem pretty confident in their fear eh? Bovinely so.,,1277028678782849025
Cabs_isHere,2020-06-27T23:58:57.000Z,I mean you’ll probably end up being dead from not wearing a mask anyways sooo...,,1277028678732443648
DiannaWith2Ns,2020-06-27T23:58:57.000Z,"I haven’t done anything of note during quarantine and I feel like it’s all been a waste, but that was my fault I guess. I’m just so tired and headachy and done.",,1277028678585790469
flamecrash3223,2020-06-27T23:58:57.000Z,"This is what the Republican disinformation has cost in American lives. The EU is shifted to align the first peaks and scaled to match the US population, but it doesn't assume that the US could have responded any earlier. Data from < europeandataportal.eu/data/datasets/ ……>",https://t.co/JsHWVm11hO,1277028678275411969
monroe2205,2020-06-27T23:58:57.000Z,I’m thinking the average American! Shit they won’t even wear a mask,,1277028677746855937
DiannaWith2Ns,2020-06-27T23:58:57.000Z,Someone asked me how I was doing earlier and I said I was okay but like... I’m not really? I am so sick of everything going on in the world right now. I hate this pandemic. I hate that the person I love is on the other side of the damn country and we’re unable to see each other.,,1277028677700792320
Dyane357,2020-06-27T23:58:57.000Z,I have to wear a #mask. The job requires it. I'm an ICU RN. They work for me.,https://x.com/hashtag/mask?src=hashtag_click,1277028677117673474
URMCPharmRes,2020-06-27T23:58:57.000Z,"Its hard to tell under these masks, but our residents are definitely smiling since graduation was this past Thursday! Because of COVID, things looked a bit different this year, but we are still so proud of all their accomplishments!",,1277028676694130688
yoongich33ks,2020-06-27T23:58:57.000Z,haven’t felt this shitty since the beginning of quarantine,,1277028676673159168
elijah_holbrook,2020-06-27T23:58:56.000Z,I care about you all but I will not burp into my own mask.,,1277028675742052353
bj141cox,2020-06-27T23:58:56.000Z,"These Ignorant folks acting like there’s not a pandemic out there killing a thousand folks daily Cannot wrap my mind around STUPIDITY & quit honestly, it just makes me MAD This is my territory but I don’t go down there anymore. #BransonLanding. #Branson,MO. #MOIsAHotSpot.",https://x.com/hashtag/BransonLanding?src=hashtag_click https://x.com/hashtag/Branson?src=hashtag_click https://x.com/hashtag/MOIsAHotSpot?src=hashtag_click,1277028675322552326
MindyForMA,2020-06-27T23:58:56.000Z,You’re Getting Used to Masks. Will You Wear a Face Shield?  nytimes.com/2020/05/24/hea …,https://t.co/Y7oymUxg1U,1277028675230326784
AGizabi,2020-06-27T23:58:56.000Z,"When governments fail to take care of the people like, the US and Brazil where both have the highest number of casualties in the world, the people themselves step in, or they should.  bit.ly/2Bi1BOf",https://t.co/KgvgGAEowa,1277028674198540294
JHasselberger,2020-06-27T23:58:56.000Z,She’s breathing just fine.  Really well actually.  Screaming requires more oxygen than wearing a mask for 15 minutes.,,1277028672130682881
shambhala69,2020-06-27T23:58:56.000Z,"I just signed a petition to demand that all 50 states offer online voter registration, in response to the COVID-19 crisis. Join me by signing here:  actionnetwork.org/petitions/dema …",https://t.co/4LUh9pxwlH,1277028671681748993
OerbaDiaErin,2020-06-27T23:58:56.000Z,Once there’s like... a vaccine... I really really really want to throw a fancy dress party with everyone,,1277028671602266117
Jeannette_swist,2020-06-27T23:58:56.000Z,"This was the time of the great migration, time of continued immigration, and a time of the 1917-1919 pandemic. Wilson was a Democrat. My mom, first gen US born  told me racism against immigrants with foreign names from Europe was rampant- Pres Wilson insisted on English Lang.",,1277028671593668608
camgrayson_,2020-06-27T23:58:55.000Z,"losing followers on insta cause i called them out for ignoring the pandemic, listen, someone had to.",,1277028670885056519
lifeis010,2020-06-27T23:58:55.000Z,"Heavy af, just what my quarantine needs",,1277028670176026625
aanaibm,2020-06-27T23:58:55.000Z,Finally finished reading a book I’d been reading since thae quarantine started LOL,,1277028670150868992
The_Club_Doctor,2020-06-27T23:58:55.000Z,"Too many people crap on politicians and leadership here in Canada. When you look at #covid19 and how different Nations or even other provinces dealt with pandemic; what grades would you give our country, region and…  instagram.com/p/CB9TQ9Mh4iK/ …",https://x.com/hashtag/covid19?src=hashtag_click https://t.co/NMmx9mU2zd,1277028669022785537
research_er,2020-06-27T23:58:55.000Z,"Top EM stories: Can’t You Wear a Mask for the Sake of Health Care Workers?  nytimes.com/2020/06/26/opi …, see more  tweetedtimes.com/v/9201?s=tnp",https://t.co/KaQbEGpDrG https://t.co/Q5M3i2GcFk,1277028668796276736
bqdrummer96,2020-06-27T23:58:55.000Z,NO ONE is social distancing. Having a mask on with a nose exposed is pointless and idiotic. Either y’all don’t believe COVID is real or y’all are being foolish or pandering.,,1277028667886092290
pragpro,2020-06-27T23:58:55.000Z,"""Trump's decision to forge ahead with its effort to invalidate the Affordable Care Act through the courts may go down as the decision that carried the most risk for Republicans up and down the ballot in 2020.” cnn.com/2020/06/27/pol …",https://t.co/4V0lq1GWRa,1277028667785281536
sabrinakenoun,2020-06-27T23:58:54.000Z,"Clearly, AZ in need of more protection against #COVID -19, and having the option to go to bars and clubs right now isn’t helping. Sign this petition asking  @dougducey  to shut down bars temporarily, please!!  chng.it/VgRsjQQt4k",https://x.com/hashtag/COVID?src=hashtag_click https://x.com/dougducey https://t.co/6hT3yijtjP,1277028667345047552
clarxyxz,2020-06-27T23:58:54.000Z,Happy 18th quarantine birthday @eilleenfmp  Continue to soar high and give happiness to others. Luv ü  cheerleader Yin,,1277028667290345472
WTeach2,2020-06-27T23:58:54.000Z,Why isn't he wearing a mask? I thought you said that was unpatriotic?,,1277028667252715520
YoungWinger,2020-06-27T23:58:54.000Z,Wow! And not a single one of them is wearing a mask. Someone call Biden.,,1277028664756940800
jayc6390,2020-06-27T23:58:54.000Z,cnn.com/2020/06/27/pol … He thought he was having a stroke so he went to the ER but it was Covid19. He downplayed #Covid19 by saying it's like the flu. Maybe Im lucky but I never confused flu symptoms w a stroke. Just bc he didnt die doesnt mean others wont  bc of people like him.,https://t.co/Zqcxt7RSCM https://x.com/hashtag/Covid19?src=hashtag_click,1277028664031481856
WasserIsSehrGut,2020-06-27T23:58:54.000Z,No social distancing?,,1277028663700193282
dannikols,2020-06-27T23:58:54.000Z,Only a morally bankrupt person could go stand in front of the supreme court and ask them to invalidate 20 million people’s insurance in the middle of a pandemic,,1277028663612055558
aduukosia,2020-06-27T23:58:54.000Z,Maybe i been in quarantine too long but this nigga on paternity court kinda cute,,1277028663314259968
firstluvez,2020-06-27T23:58:53.000Z,ma’am some of us have to wear a mask for 9+ hours at work and you can’t even wear it for 30 minutes max in a store? EMBARRASSING.  x.com/RexChapman/sta …,https://x.com/RexChapman/status/1276882898730323968,1277028662781460480
mish,2020-06-27T23:58:53.000Z,"“It took almost three months before the FDA started pulling tests off the market, but by then, many American municipalities had already used the tests to determine whether they could send essential workers like EMTs, policemen and firemen back to work.”  cbsnews.com/news/federal-o …",https://t.co/Zse6d1VYcf,1277028660935983104
mickivoss,2020-06-27T23:58:53.000Z,"Florida man angry over store’s mask rule exposes himself in front of children, deputies say  orlandosentinel.com/news/florida/o …",https://t.co/kLW36NO3wE,1277028660487356416
kilamanthony,2020-06-27T23:58:53.000Z,"just cause you have a mask on doesn’t mean you won’t get corona, you need to be doing more than that",,1277028660436967426
treybritt42,2020-06-27T23:58:52.000Z,"#CyberPunk #apocalypse #TraitorTrump #COVID  Pink and Blue CyberPunk Apocalypse Gas Mask Enamel Pin, Enamel by BrittsEmporium  etsy.me/2Vlt0Ws via  @Etsy",https://x.com/hashtag/CyberPunk?src=hashtag_click https://x.com/hashtag/apocalypse?src=hashtag_click https://x.com/hashtag/TraitorTrump?src=hashtag_click https://x.com/hashtag/COVID?src=hashtag_click https://t.co/PsDFie5ymm https://x.com/Etsy,1277028658645995521
DontTre32775107,2020-06-27T23:58:52.000Z,I agree especially since we have scientific proof via the media that riots and looting don’t cause Covid!,,1277028657202999297
U3_Star,2020-06-27T23:58:52.000Z,Social distancing enforced by bears in #Paris cafés yesterday. We clearly need more bears in Bournemouth.,https://x.com/hashtag/Paris?src=hashtag_click,1277028656871849984
Billy_Ahmed123,2020-06-27T23:58:52.000Z,Thank you Craig what do you suggest I do on my birthday during lockdown,,1277028655949123591
MarcosVq,2020-06-27T23:58:52.000Z,"Curious, so you think Trump and all the governments that treated covid19 as just another flu while there was hundreds of thousands of cases, would have done real actions when China said ""this virus on 100 people will become a global pandemic""?",,1277028655601012736
SandstromJoanna,2020-06-27T23:58:52.000Z,The mask hangs on my doorknob. Can’t forget it,,1277028655563190273
WatieLone,2020-06-27T23:58:52.000Z,The doctor on one of the morning shows caught it and said he wore a mask 100% of the time.  So far .028 % of the population have tested positive.(worldwide),,1277028655009607680
seandoncito,2020-06-27T23:58:52.000Z,BYOM- Bring Your Own Mask,,1277028654992719872
_DixieFlatline_,2020-06-27T23:58:51.000Z,"Covid test, although your confusion is understandable",,1277028654166560769
TundePops,2020-06-27T23:58:51.000Z,Quarantine has been crazy,,1277028653956829184
TonyBeats,2020-06-27T23:58:51.000Z,"Like knowing a degree from Trump University was worthless in reality....  Trump knew, but put it out there anyway because of course he did....  WTF  @realDonaldTrump ?  #TraitorTrump #CovidTesting cbsnews.com/amp/news/feder …",https://x.com/realDonaldTrump https://x.com/hashtag/TraitorTrump?src=hashtag_click https://x.com/hashtag/CovidTesting?src=hashtag_click https://t.co/8y6htr2C3U,1277028651712815110
slaysoncartel,2020-06-27T23:58:51.000Z,"just wait and see how FIRE my body is going to look after quarantine! thank you,  @SportFitness520  for sending me these resistance bands! im super excited to start working out!",https://x.com/SportFitness520,1277028650983006208
thomante,2020-06-27T23:58:51.000Z,Chicago has a unique COVID strain: research  chicagobusiness.com/health-care/ch … via  @crainschicago,https://t.co/nUY4qcXKG1 https://x.com/crainschicago,1277028650815234049
Des716Parker,2020-06-27T23:58:50.000Z,World Leaders: Unite For Our Future and Protect Everyone From Coronavirus  glblctzn.co/e/WVcF6gPHF7 #globalcitizen,https://t.co/Z8uAXOmHom https://x.com/hashtag/globalcitizen?src=hashtag_click,1277028648604835840
concernct11,2020-06-27T23:58:50.000Z,What is our state doing for essential workers who have been forced to work throughout the entire pandemic. Calling members “Heroes” fails as many people we know are making DOUBLE with federal stimulus than what we have been making with less risk.,,1277028648369954821
DeanAstumian,2020-06-27T23:58:50.000Z,"Concern for others would require you to wear a mask whenever you are in someones home, whether they ask or not.  You should feel free to ask the person in the home to wear a mask as well.  Nothing to do with Trump, everything to do with doing what we can to be safe.",,1277028647480840193
WCCO,2020-06-27T23:58:49.000Z,The MDH said The 507 and Rounders Sports Bar & Grill in Mankato are linked to roughly 100 cases of COVID-19 from June 12 and 13. |  cbsloc.al/2BMDib4,https://t.co/iUlQuNwxwN,1277028643575943168
JymCherry,2020-06-27T23:58:49.000Z,Then claims she has condition preventing wearing a mask.,,1277028643315777539
SudaJayvina,2020-06-27T23:58:49.000Z,Like this Mask ? No Thank you,,1277028643290509312
RonaldNHughes,2020-06-27T23:58:49.000Z,"Studies 'suggest that 30 to 60 percent of spreading occurs when people have no symptoms.' It happens in BC care homes due to Dr Henry's heartless refusal to regularly test workers without symptoms. Our seniors are dying. Sheeple of BC, do you care?  nytimes.com/2020/06/27/wor …",https://t.co/X6mPlC5ARH,1277028642900631552
KaloSmith,2020-06-27T23:58:48.000Z,"Suggestions:live stream convention, each state lead casts their ballot. Joe accepts, gives 5 min big picture. Then he introduces each cabinet secretary: 10 min for each to talk big issues/thoughts in their area. Plenty of music. Also cancel debates. No point:Trump lies + COVID.",,1277028641986285571
UtdDaniels,2020-06-27T23:58:48.000Z,"Nah bro that’s too far they should be social distancing, disgrace  t.co/l3Tp6WCHwM",https://t.co/l3Tp6WCHwM,1277028641109684224
NeilMDavidson,2020-06-27T23:58:48.000Z,Toronto FC trains at BMO Field for first time since global pandemic lockdown. #TFCLive   bit.ly/2NxURP1,https://x.com/hashtag/TFCLive?src=hashtag_click https://t.co/n68zprpr2M,1277028639612207105
TheCumberworld,2020-06-27T23:58:48.000Z,NJ probably threatened to quarantine all the staff traveling with him. He won’t admit he was wrong hence the law and order.,,1277028639033393152
marzshadow,2020-06-27T23:58:47.000Z,"Don’t be fooled. @realDonaldTrump  is a white Supremacist who hates blacks, jews, Hispanics, Muslims, Asians. Don’t be fooled. Trump slowed down covid testing for every one else.   But he and the white house staff gets tested daily.",https://x.com/realDonaldTrump,1277028636357545990
froqueeeen,2020-06-27T23:58:47.000Z,Well if ya ever go they moved locations cause of COVID and are now in Mickey’s subs in Armenia,,1277028636323991553
deviatar,2020-06-27T23:58:47.000Z,A mask would be to protect someone else. Not their interest.,,1277028635619332102
stoic008,2020-06-27T23:58:47.000Z,"Waking up to news of new COVID-19 cases in Melbourne - i thought we were better than this, pls don’t get complacent people. The rest of Australia already hinting at shutting us off...",,1277028634063060992
InsidersABC,2020-06-27T23:58:46.000Z,". @shalailah  says young people are suffering particularly from the effects of the coronavirus on the aviation and tourism industry and the possible end of JobKeeper in September is a ""really scary prospect"" for them. #insiders #auspol",https://x.com/shalailah https://x.com/hashtag/insiders?src=hashtag_click https://x.com/hashtag/auspol?src=hashtag_click,1277028633693925376
coltrane_k,2020-06-27T23:58:46.000Z,"I’ve avoided watching this a-hole literally 30 times, scrolled past it again and again. Now I wish I’d avoided it 31 times. WTF is wrong with people? All this over wearing a mask that might save the lives of strangers. People who have families, loved ones. Real people. Geez.",,1277028633652203520
ChochilinoNews,2020-06-27T23:58:46.000Z,Coronavirus: Your pictures on the theme of ‘walking’  chochilino.com/2020/06/28/new …,https://t.co/kiD2lsbRAm,1277028632507154433
sunflowersrep,2020-06-27T23:58:46.000Z,"i’m printing some posters and the guy printing them saw and was like “oh harry styles” and kept saying “the harry styles” and then asked me if he was the one who sang pillow talk,,, good thing i’m wearing a mask bc the face i was making istg",,1277028632309964800
mei0naize,2020-06-27T23:58:45.000Z,bruh i be putting the mask while im on the toilet,,1277028629218762752
scottberry912,2020-06-27T23:58:45.000Z,"Not entirely true, less infections reduce the chances of mutation by a large factor, the reason flu's are annoying because it reached such a high penetration requiring us to regularly change the vaccine, Covid has the infection rate, just needs the Ebola level of mortality.",,1277028628895760385
DailyMail,2020-06-27T23:58:44.000Z,Where are the best value holidays while staying safe from coronavirus?  trib.al/PdEJTkO,https://t.co/afIPBlSis4,1277028624470814720
