User_name,Datetime,Content,Links,Tweet_ID
theMJA,2020-09-30T23:59:59.000Z,Victoria records 15 new coronavirus cases as Melbourne's 14-day average falls to 15.6  abc.net.au/news/2020-10-0 …,https://t.co/nNguXK3zxd,1311455785616990213
Lykapipots,2020-09-30T23:59:59.000Z,"I hope and pray that my country, the Philippines  will recover from this pandemic soon  I urge you to pray with me & live a healthy lifestyle. Please. Please take care & understand that honesty is important thru this crisis we are all facing.",,1311455784795099136
DrSeamie,2020-09-30T23:59:58.000Z,IFR of flu is more like 0.1%. Whereas covid is somewhere between 0.5 and 0.8%.,,1311455780982460416
KingM91,2020-09-30T23:59:58.000Z,And Covid-19 finished him off.  t.co/xHVUnlkQxb,https://t.co/xHVUnlkQxb,1311455779191431169
shinryucosplay,2020-09-30T23:59:58.000Z,"Today I am working a lil bit on Susie. Mask Pattern made by  @IssabelCosplay Mask is made with EVA foam 5mm and 2mm, Filofun,wood glue, acrylic paints, fake blood. Ruler - foamed pvc for now.  #deadbydaylight #deadbydaylightcosplay  @DeadByBHVR",https://x.com/IssabelCosplay https://x.com/hashtag/deadbydaylight?src=hashtag_click https://x.com/hashtag/deadbydaylightcosplay?src=hashtag_click https://x.com/DeadByBHVR,1311455779073994752
jmurray1616,2020-09-30T23:59:57.000Z,"Apparently no need for a mask, time to get rid of the mask mandate in Tampa Jane so we live as freely as you! Do your job. #nomaskjane #onetermjane",https://x.com/hashtag/nomaskjane?src=hashtag_click https://x.com/hashtag/onetermjane?src=hashtag_click,1311455778109353984
PaulGimson,2020-09-30T23:59:57.000Z,The reaction to the removal of some of the changes would have been the same even if the Covid figures had been better. People have got complacent and dont now want to put any effort into the game. It was never going to be forever so deal with it.,,1311455777765437441
Michael9848226,2020-09-30T23:59:57.000Z,Absolutely agree fauci is full of crap. Poor judgement and  hiding efficacy of HCQ and pushing Remdesivir which doesn't work but costs $$$$ and you make him a super hero  You guys deserve Biden for 2020 so stupid is ridiculous!,,1311455776867667968
hhoneymelon,2020-09-30T23:59:57.000Z,time to watch da #SouthPark pandemic special!,https://x.com/hashtag/SouthPark?src=hashtag_click,1311455776284737536
WilloSF,2020-09-30T23:59:56.000Z,"Hey  @SouthwestAir , I've been taking the OAK-BNA nonstop for decades.  In December it's the only way I can safely connect with my family during COVID, and now you changed my non-stop to a TEN HOUR trip with FOUR airports? How is that COVID-safe? WTH is going on over there?",https://x.com/SouthwestAir,1311455774615298048
Wilmington_AD,2020-09-30T23:59:56.000Z,"Due to Covid-19 there will be a strict spectator policy at all ML12 fall events. Athletes from all schools will be given one badge, allowing only one spectator per player. Badges must be visible & worn at all contests.",,1311455773428510720
tangled30,2020-09-30T23:59:56.000Z,I’ve been counting down the days to the #SouthPark pandemic special!!,https://x.com/hashtag/SouthPark?src=hashtag_click,1311455771209748482
deadpixells,2020-09-30T23:59:55.000Z,"@saminating  hi, I love your vids, streams and art style. We need a new killer face mask too",https://x.com/saminating,1311455767916994561
Rucker23,2020-09-30T23:59:54.000Z,Now you can have your own pandemic gun show.   Now that I’ve got you:  Do you know why W.S Gilbert was frequently drunk on his transatlantic crossings?  Because he was a quartered on the portside!  #BuzzKillington,https://x.com/hashtag/BuzzKillington?src=hashtag_click,1311455765400449024
RuthlessLobo,2020-09-30T23:59:54.000Z,"Lobo blares Mask Off by Future on the streets. He likes his music so loud that it makes people's ears bleed.  ""This ain't bad!""",,1311455762695286785
Flutflut1,2020-09-30T23:59:53.000Z,It's love to be a stay at home mom one day! But I don't like cooking or cleaning.,,1311455761847980033
hafta_ichi,2020-09-30T23:59:53.000Z,Coronavirus live news: Madrid lockdown looms; 34m jobs lost in Latin America | World news  hafta-ichi.com/coronavirus-li …,https://t.co/Y4wvAiZpyd,1311455759675330563
Belinda3B,2020-09-30T23:59:53.000Z,"Getting comfy to watch the South Park pandemic episode, Need some funny had enough mad an sad",,1311455758240882688
Taniaagissele,2020-09-30T23:59:52.000Z,"I was really a stay at home mom w nothing to my name , using old ripped hand me down clothes , no money , hardly any food ,  inside alone most of the time , I came a long way let me tell you ...",,1311455756584017920
jennymeyer43,2020-09-30T23:59:52.000Z,"Holy Communion Patman!  1. May I remind you this is a public forum  2. ‘Growth’ is sooo pre pandemic .. I hear the new vibe is ‘Sustainability’  3. Just making a girlie observation .. that’s all.. wot would I know? ...must get back to my flowers, knitting & dirty laundry",,1311455756575674369
druind1,2020-09-30T23:59:52.000Z,Covid-19 loves the Trumps.,,1311455753945849856
AfriGrResources,2020-09-30T23:59:52.000Z,"We are delighted to be featured in  @cnbcafrica ’s latest article on African economies post-COVID-19, authored by Peter Burdin! Thank you to CNBC and to  @burdinpeter  and click below for the full article! #Agriculture #AfricanAgriculture #Economy  cnbcafrica.com/economy/2020/0 …",https://x.com/cnbcafrica https://x.com/burdinpeter https://x.com/hashtag/Agriculture?src=hashtag_click https://x.com/hashtag/AfricanAgriculture?src=hashtag_click https://x.com/hashtag/Economy?src=hashtag_click https://t.co/uKJz1eXjwG,1311455753891348481
WendyWings,2020-09-30T23:59:51.000Z,"I am going to hide all my illegal lockdown garden herbs and veggies soon, can't take the risk of having them forcefully removed from my deck.",,1311455752653996033
AntonioPlanas1,2020-09-30T23:59:51.000Z,Seven volunteers honored for doing “God’s work” during the peak of the Covid-19 crisis. Nassau volunteers recognized for helping front-like workers  newsday.com/news/health/co … via  @Newsday,https://t.co/nfPEIwgIfr https://x.com/Newsday,1311455751060283394
cindi_abbott,2020-09-30T23:59:51.000Z,"Jaime Harrison said Graham went on vacation  wo a care in the world about covid relief bill, yet he is breaking his neck to ram thru this scotus pick to help trumpy if the need arises",,1311455750837989376
dennisedugan,2020-09-30T23:59:50.000Z,"not coronavirus crisis, but rather trump crisis.",,1311455747226710016
zkboomstick11,2020-09-30T23:59:50.000Z,Need the lockdown Tanaka tonight #Yankees,https://x.com/hashtag/Yankees?src=hashtag_click,1311455746358415363
RealRobSeal,2020-09-30T23:59:49.000Z,Excited about South Park's Pandemic Special.,,1311455741442699270
MGM47061,2020-09-30T23:59:49.000Z,Of course this comes from a BIDEN Adviser! You people politicizing the vaccine is PATHETIC!!,,1311455741144948736
lvald13,2020-09-30T23:59:48.000Z,"$opti LA Allows Indoor Malls, Salons To Open Despite Coronavirus Uptick  news.yahoo.com/la-allows-indo … via  @YahooNews",https://x.com/search?q=%24opti&src=cashtag_click https://t.co/epL3YSSJqG https://x.com/YahooNews,1311455740847108096
MedicinesAus,2020-09-30T23:59:48.000Z,"We stand by the #DontWaitMate movement. Although healthcare visits may look different during COVID-19, it's important not to put them off. Keeping up with regular treatments can prevent an illness from developing or getting worse. Don't wait, mate!",https://x.com/hashtag/DontWaitMate?src=hashtag_click,1311455739089567744
luna_startups,2020-09-30T23:59:48.000Z,"How do you build authentic connections in a time of social distancing? According to super networkers,  @jeanette_kc   and Lior Shoham it's all about increasing the surface area of your circle. Here's how:  youtu.be/7635KzyIWiA",https://x.com/jeanette_kc https://t.co/k1SwD18fDm,1311455738997493760
mangybones,2020-09-30T23:59:48.000Z,This rules so severelt but i gotta let u know i AM thinkin abt The Mask,,1311455738502557697
Thunderace4,2020-09-30T23:59:48.000Z,Forced masks = WAR CRIME. Forced lockdown = WAR CRIME. None of these are legitimate health measures. Consent is a basic ethical requirement; quarantine is only for the sick. When do the WAR CRIMINALS get removed from office and tried for WAR CRIMES?,,1311455737743368194
michele_kko,2020-09-30T23:59:47.000Z,And this wasn’t even an organized event and they still wore mask.,,1311455736552013824
ZoeMcLaren,2020-09-30T23:59:47.000Z,Just think of all the Americans struggling right now to hang onto their recovery in the middle of a pandemic. Biden's powerful words will save lives.  x.com/amandalitman/s …,https://x.com/amandalitman/status/1311281881611030530,1311455735079985160
FirestormMinis1,2020-09-30T23:59:47.000Z,"Deborah Waldron Fry 9/30 From the Valley of Vision to the Realms of Heaven and back again with ""Eyes Wide Open."" ""The Majestic Eagles of the New Covenant. ""There is a NEW season we are moving into. Not a silent one. Oh no. The enemy has tried to mask our"" m.facebook.com/photo.php?fbid …",https://t.co/GYMlRfZON4,1311455734886920192
beachcat369,2020-09-30T23:59:47.000Z,Went to AAA today and I was refused entry with no mask. They said businesses can keep the mandate and they are.,,1311455734639587330
brontyman,2020-09-30T23:59:47.000Z,"207,800 Americans dead in the pandemic. In remembrance of those lost, a virtual candle to find the path out of the darkness of grief.",,1311455734429745152
indianweekender,2020-09-30T23:59:47.000Z,#LIVE | Dr Caroline McElnay provides update on new Covid-19 cases in New Zealand  pscp.tv/w/ckPB8zFlV0V5 …,https://x.com/hashtag/LIVE?src=hashtag_click https://t.co/zMh0rKO5gE,1311455734018633729
MarkSwinnerton2,2020-09-30T23:59:46.000Z,"As Australia recovers from COVID 19 pandemic, BHP is committed to doing our bit. That’s why we’ve announced training and funding for 3,500 Australians. The BHP FutureFit Academy is essential to making this happen. That’s good for BHP, and good for Australia.",,1311455732206723072
futureman19,2020-09-30T23:59:46.000Z,"if you are planning to take the Trump vaccine, you should be aware of what's in it. youtu.be/809iSyjwGi0",https://t.co/dMGhiExFwu,1311455731288281089
osuuneko,2020-09-30T23:59:46.000Z,So how has the pandemic changed your daily life nowadays? How are things in other countries?,,1311455730772434945
24x7newsguru,2020-09-30T23:59:46.000Z,"Lockdown In Maharashtra Extended Till 31st October, Hotels, Food Courts, Bars Allowed To Operate From October 5  24x7newsguru.com/2020/09/30/loc …",https://t.co/VG2UGEvYox,1311455730344488960
NunyaPzsda,2020-09-30T23:59:46.000Z,"The new home 45 and his administration is giving Americans, courtesy of 45's COVID-19 response  @GOP",https://x.com/GOP,1311455729740472325
DAnn1296,2020-09-30T23:59:46.000Z,"I usually move my mask really high up and keep my glasses in place, not sure if this helps",,1311455728893333505
jen_litt,2020-09-30T23:59:45.000Z,Falling temps and finishing a nine weeks during a pandemic called for hot chocolate today!! We treated all of our students & staff to hot chocolate this morning! Teachers took students outside to enjoy this treat while social distancing!! 1/2  @LorettoHigh,https://x.com/LorettoHigh,1311455725613387777
PureSalvato,2020-09-30T23:59:45.000Z,"Flu shot day yesterday. Kind of a cluster**** since we had to get it done inside a grocery store. Masks required. Man in line: Oh, did I cut in front of you? (pleased he noticed)  Me: Been waited on, getting flu shots. Man: Well you can have them.  Covid hoax rant began. gah.",,1311455725445554180
jizzbaum,2020-09-30T23:59:45.000Z,"When Joe Biden was VP, 60 MILLION people were infected with H1N1. If H1N1 would have had the fatality rate of covid-19, more than 2 million would have died.",,1311455725256757248
DFSH8150,2020-09-30T23:59:44.000Z,"ANOTHER 827 Americans died from COVID-19 yesterday.  ANOTHER 41,000 Americans were infected with COVID-19 yesterday.  What lies will your dad be telling about COVID today, Donny? #WhyIsTrumpStillPlayingGolf?",https://x.com/hashtag/WhyIsTrumpStillPlayingGolf?src=hashtag_click,1311455723453321219
ParentSecurity,2020-09-30T23:59:44.000Z,#childsafety | Teachers talk remote learning | Republic-Times  parentsecurityonline.com/childsafety-te …,https://x.com/hashtag/childsafety?src=hashtag_click https://t.co/ZJv84HMbAU,1311455721855352834
MrsGreat_Scott,2020-09-30T23:59:44.000Z,"I don’t think ranting, throwing tantrums and yelling over someone talking is called “winning” but then again you call your actions on Covid winning too and look where we are.  #TrumpLiedPeopleDied  #TrumpIsALoser",https://x.com/hashtag/TrumpLiedPeopleDied?src=hashtag_click https://x.com/hashtag/TrumpIsALoser?src=hashtag_click,1311455721255563264
actuallybebe,2020-09-30T23:59:44.000Z,// PANDEMIC SPECIAL TIMEEEEEEEEEEEEE AHHHHHHHHHH!!!!!!!!,,1311455720446005253
ben_moon11,2020-09-30T23:59:43.000Z,Now that I’m cleared to go back to work after having Covid I can say that my experience was absolutely worse than the flu. I mean I can’t even really compare the two because it was so intense.,,1311455719707889664
myfox8,2020-09-30T23:59:43.000Z,Are kids safe from coronavirus in school? Dr. Birx answers COVID-19 questions tonight on NewsNation  myfox8.com/news/are-kids- …,https://t.co/34rv61rRd4,1311455719179329537
MidcoastNews,2020-09-30T23:59:43.000Z,"Pelosi, Mnuchin have ‘extensive’ talks on COVID relief  pressherald.com/2020/09/30/pel …",https://t.co/HoqlmNcHlq,1311455717996466178
livingston_mark,2020-09-30T23:59:42.000Z,Kentucky wouldn’t play PC at the dunk in non conference game couple years ago. I get it. If it was at Kentucky they would’ve played. Covid ruined college ball in my opinion. First time in 8 years I didn’t re new tickets.,,1311455715005992962
_hashbrownnn,2020-09-30T23:59:42.000Z,Ok but like shoutout to quarantine for letting me live my best life,,1311455714380980224
WENYTV,2020-09-30T23:59:41.000Z,"Below is a check on the status of COVID-19 (coronavirus) cases throughout the Twin Tiers on Wednesday, September 30 at 8:00PM.   weny.com/story/42706996 …",https://t.co/Wfj0GX8xSY,1311455711713464320
tha_linds,2020-09-30T23:59:41.000Z,"""At one point, [the CEO of the Seattle  Indian Health Board] requested more coronavirus tests and instead received body bags.""  We have to treat American Indians better.  nytimes.com/2020/09/29/us/ …",https://t.co/rkuj8rPTM2,1311455710752858113
NYLocalIthaca,2020-09-30T23:59:41.000Z,"Below is a check on the status of COVID-19 (coronavirus) cases throughout the Twin Tiers on Wednesday, September 30 at 8:00PM.   weny.com/story/42706996 …",https://t.co/KYwA38Ju9c,1311455710073548802
LoralieBluett,2020-09-30T23:59:41.000Z,Crickets though on O'Tool returning to the HoC without following proper COVID-19 procedures.  Apparently he has the fastest elixir for recovering and testing in Canada.,,1311455709649948672
PopeCarlito,2020-09-30T23:59:41.000Z,Tell him he has to hold it in the COVID ward.,,1311455709385629696
theworldisames1,2020-09-30T23:59:41.000Z,At the beginning of the debate they announced that everyone had to wear a mask to be able to come in.,,1311455709054210048
shairn_,2020-09-30T23:59:41.000Z,Pandemic won't stop me from vibing,,1311455708878180352
kftchampionship,2020-09-30T23:59:41.000Z,"Arts are a cornerstone of the community. If you give to the  @rvasymphony , do it through #birdiesforcharity and add 10% to your gift:  bit.ly/deccbirdies  The Symphony's latest:  richmondsymphony.com  And see how one violinist got creative in COVID: backyardviolinist.com",https://x.com/rvasymphony https://x.com/hashtag/birdiesforcharity?src=hashtag_click https://t.co/K4DcJMBmVN https://t.co/OKk5tFY1uk https://t.co/94gufbYbf8,1311455708811087873
dnunan79,2020-09-30T23:59:39.000Z,"Responding strongly on this occasion as a direct reaction to my surprise given the source  Sorry if this has made you feel you can’t engage Beth  Watching how COVID has highlighted many problems in academic publishing, then to see it come from someone who knows better...  Still",,1311455700766384128
Elaineles1,2020-09-30T23:59:39.000Z,It is now 5 months and 6 days since Jodian Fearon died and no explanation to date from relevant authorities how and why she was found dead on the ground of the  covid ICU. I guess them busy !  JusticeforJodian#,,1311455699738726401
mckeonmk,2020-09-30T23:59:39.000Z,Jimmy Fallon on the debate: 'Felt like getting a Covid test in both nostrils'  theguardian.com/culture/2020/s …,https://t.co/Tzg8xPvupZ,1311455699524878336
ziqrealtor,2020-09-30T23:59:38.000Z,"Haaziq Forney at Solid Source Realty facebook.com/ZIQREALTOR/pho …  Perhaps you or someone you know need a more spacious home? COVID-19 has exposed the functionality of our new reality.    Working from home, virtual learnin",https://t.co/aDVKKU3xoY,1311455698501414913
lexie_warren,2020-09-30T23:59:38.000Z,"We will never get to <5 or less for a rolling average, when the aged care system is still a mess, hotel quarantine is still being run by  @DanielAndrewsMP  bouncers and HCW are being infected from lack of PPE. He will suck every single day out of his six months of SOE powers.",https://x.com/DanielAndrewsMP,1311455697972858885
ShawnieMikes,2020-09-30T23:59:38.000Z,Morning Coffee Question: What’s your favorite homemade cookie? Have you been baking during quarantine?   #wobm #shawnandsue #ocbs #radio #morningshow #morningcoffeequestion @ 92.7 WOBM  instagram.com/p/CFx63RUjyGB/ …,https://x.com/hashtag/wobm?src=hashtag_click https://x.com/hashtag/shawnandsue?src=hashtag_click https://x.com/hashtag/ocbs?src=hashtag_click https://x.com/hashtag/radio?src=hashtag_click https://x.com/hashtag/morningshow?src=hashtag_click https://x.com/hashtag/morningcoffeequestion?src=hashtag_click https://t.co/aK9Xry31oD,1311455696458784769
iJermaine360,2020-09-30T23:59:38.000Z,1 Minute until SP: pandemic special! #SouthPark,https://x.com/hashtag/SouthPark?src=hashtag_click,1311455696412696576
TracyBaxter11,2020-09-30T23:59:38.000Z,"Ivanka tweet, early in this ""covid thing"" : ""welcome to the brave new world.""  x.com/99freemind/sta …",https://x.com/99freemind/status/1311452137470201857,1311455695384932352
RMConservative,2020-09-30T23:59:37.000Z,"Yup, and the lockdown and panic you have sown only contributes to substance abuse, which is now skyrocketing.",,1311455694428745730
MarcusSpecSoln,2020-09-30T23:59:37.000Z,#Hydroxychloroquine didn't prevent #Covid-19 among health care workers in new study cnn.com/2020/09/30/hea …,https://x.com/hashtag/Hydroxychloroquine?src=hashtag_click https://x.com/hashtag/Covid?src=hashtag_click https://t.co/MSt0HObJv6,1311455691564036096
ActivAlewife,2020-09-30T23:59:37.000Z,"#ShoeStrike 4 #ClimateAction - a way to demonstrate the crisis during a pandemic. Demand #SystemicChange returning to ""normal."" There is no time to spare #tippingpoint  @XRBoston  @TTTMediaXR  @Fridays4future   We need to work #TOGETHER  @ProgIntl  Globally  youtu.be/CE5Gywq7r_o",https://x.com/hashtag/ShoeStrike?src=hashtag_click https://x.com/hashtag/ClimateAction?src=hashtag_click https://x.com/hashtag/SystemicChange?src=hashtag_click https://x.com/hashtag/tippingpoint?src=hashtag_click https://x.com/XRBoston https://x.com/TTTMediaXR https://x.com/Fridays4future https://x.com/hashtag/TOGETHER?src=hashtag_click https://x.com/ProgIntl https://t.co/tasED6MjZl,1311455691056574466
sstanic731,2020-09-30T23:59:36.000Z,We need to focus on Recoveries from COVID in a Nation of 340MM.. 90+% cure rate!... need to get that wonderful statistic OUT!,,1311455687424258048
sstanic731,2020-09-30T23:59:35.000Z,"@TuckerCarlson  4.3MM Americans have recovered from COVID. Mainstream news only wants to focus on deaths.  That, is a complete disservice to our heroic front line Medical Workers, Doctors and Nurses.  Report the recoveries.  Yes, one life lost is to many.  Positive messaging!! USA",https://x.com/TuckerCarlson,1311455686077939712
WLOX,2020-09-30T23:59:35.000Z,Search for new job after COVID-19 layoff leaves D’Iberville worker frustrated  ift.tt/34cdP5z,https://t.co/7UgGYC0HtC,1311455685939466240
n0netaken,2020-09-30T23:59:35.000Z,sometimes i wonder how i physically declined to this extent during quarantine and then remember that my diet consists mostly of hot cheetos and honey and i do not go outside...,,1311455684525842432
fuckyofeelins21,2020-09-30T23:59:35.000Z,I'd live in quarantine,,1311455683796234242
josh_afc,2020-09-30T23:59:35.000Z,Mate he's just one guy. I can point to a load others including genuine tactical analysts and clued in former players such as Adrian Clarke. I've also personally been to games and watched the shape changes before lockdown. I don't know why you're being so stubborn on this.,,1311455683758432259
DowntownDet,2020-09-30T23:59:34.000Z,Update from the Downtown Detroit Partnership. -  mailchi.mp/downtowndetroi …,https://t.co/zOS10D1dT1,1311455681917136904
mcdev,2020-09-30T23:59:34.000Z,"More families have been destroyed by addiction than covid, war, cancer, accidents and guns totaled.  Everyone knows an addict or someone impacted by addiction. They do not find it amusing.",,1311455680470155265
goonerszn5321,2020-09-30T23:59:34.000Z,The pandemic. Distancing.,,1311455680189083648
foolerrant,2020-09-30T23:59:34.000Z,I'm going to make the mask removable - so I actually will give Clara a face. That we never will see in the proper art. Which is why I picked Ghoulia - I liked her face structure. After a lot of debate I'm keeping the doll's original skin tone. OG Clara is not gray but doll can be,,1311455678515601409
SoUTHPaRKoLoGY,2020-09-30T23:59:32.000Z,"THE SOUTH PARK PANDEMIC SPECIAL IS ABOUT TO BEGIN, DUDES !!! #SouthPark  #PandemicSpecial",https://x.com/hashtag/SouthPark?src=hashtag_click https://x.com/hashtag/PandemicSpecial?src=hashtag_click,1311455673310482432
PulpNews,2020-09-30T23:59:32.000Z,Depression increase among new moms during coronavirus #era prompts South Bay #mental healt - Sep 30 @ 7:57 PM ET  oddcrimes.com/static/2020/09 …,https://x.com/hashtag/era?src=hashtag_click https://x.com/hashtag/mental?src=hashtag_click https://t.co/evorj0zZCv,1311455672748441600
TweetShirtLLC,2020-09-30T23:59:32.000Z,That's bad news for my enemies!! Wear a mask please #DDTG  tweetshirt.com/collections/ac …,https://x.com/hashtag/DDTG?src=hashtag_click https://t.co/zRgCk4XFLc,1311455670374334465
Jgrov,2020-09-30T23:59:32.000Z,South Park Pandemic special and NBA finals!,,1311455670336663552
swftsos,2020-09-30T23:59:31.000Z,not to mention quarantine has made it sm worse because we're just finally having SOME human interaction again,,1311455667450859520
InvictaOrtho,2020-09-30T23:59:30.000Z,I will get to Aruba at some point. When Covid is over.,,1311455665488044032
castradeva,2020-09-30T23:59:27.000Z,2020 4 Supreme Soviets Belfast Cardiff Edinburgh & London all underfunded the NHS inc Whitehall To protect themselves the twats trashed jobs & the Economy & hindered herd immunity OUR salvation without a vaccine. The death rate in 2020 remains at normal,,1311455652137627653
elson_junior,2020-09-30T23:59:27.000Z,Why people would need remote pass now that you want players to go out in the middle of a pandemic? #BoycottNiantic #BoycottPokemonGo,https://x.com/hashtag/BoycottNiantic?src=hashtag_click https://x.com/hashtag/BoycottPokemonGo?src=hashtag_click,1311455651110039555
KSSS,2020-09-30T23:59:27.000Z,just caught my own reflection in thE mirror like   what am i wearing #Quarantine,https://x.com/hashtag/Quarantine?src=hashtag_click,1311455649646235650
kdbreezey,2020-09-30T23:59:26.000Z,Did your permit expire? Because I don’t think they’re finna let me take my behind the wheel since mine expired during Covid,,1311455648261967873
yuriboats,2020-09-30T23:59:26.000Z,are they just airing the guinea pig episodes again?  South Park Pandemic Special airing on Comedy Central #SouthPark  x.com/i/events/13083 …,https://x.com/hashtag/SouthPark?src=hashtag_click https://x.com/i/events/1308339639359434753,1311455647913910272
NationwideRadio,2020-09-30T23:59:25.000Z,"Prime Minister Andrew Holness, says a High-level United Nations meeting has yielded several options as to how best to deliver much-needed assistance to developing nations in recovering from COVID-19. nationwideradiojm.com/pm-says-un-fin …",https://t.co/TQQShPaHUg,1311455643732148225
YoungEx20,2020-09-30T23:59:25.000Z,Thanks! Worried me for a minute I was tryna decide between having to switch it up cause I'm tryna watch this South Park pandemic special & then Love Island.,,1311455643660890112
StatNano,2020-09-30T23:59:25.000Z,Nanostructured Surface Inactivates SARS-CoV-2 Coronavirus within Six Hours statnano.com/news/68026  #Nanostructured #SARS_CoV_2 #Coronavirus #Biomedical_Technologies #queensland_University_of_Technolog #antiviral #StatNano #NBIC,https://t.co/F7fznPTIbb https://x.com/hashtag/Nanostructured?src=hashtag_click https://x.com/hashtag/SARS_CoV_2?src=hashtag_click https://x.com/hashtag/Coronavirus?src=hashtag_click https://x.com/hashtag/Biomedical_Technologies?src=hashtag_click https://x.com/hashtag/queensland_University_of_Technolog?src=hashtag_click https://x.com/hashtag/antiviral?src=hashtag_click https://x.com/hashtag/StatNano?src=hashtag_click https://x.com/hashtag/NBIC?src=hashtag_click,1311455641735761922
sdwascher,2020-09-30T23:59:24.000Z,Texas: 56% of covid deaths are Latino. In California it is 48%. School with large populations of Latinos should remain virtual. #COVID19 #schoolsreopening,https://x.com/hashtag/COVID19?src=hashtag_click https://x.com/hashtag/schoolsreopening?src=hashtag_click,1311455638292176901
_webbieG,2020-09-30T23:59:24.000Z,Wish this covid shit be over,,1311455637168160774
michcusejac5,2020-09-30T23:59:23.000Z,Um he ended Covid 19 with the wind of god maybe show a little respect,,1311455635725221888
