User_name,Datetime,Content,Links,Tweet_ID
tophernoun,2020-06-27T23:59:23.000Z,"From what I saw at youth baseball in Altoona today, social distancing  doesn’t seem to be much of a priority for Iowans. Don’t want to paint with a broad brush, but it appears as though there’s not much attention to stemming this virus. #ItsStillAThing #StatesSettingRecords",https://x.com/hashtag/ItsStillAThing?src=hashtag_click https://x.com/hashtag/StatesSettingRecords?src=hashtag_click,1277028786442207233
IDOLKOPF,2020-06-27T23:59:23.000Z,"okay so i’m about to walk in a COVID patient’s room in 5 minutes, i suggest you don’t wear a mask and do it yourself.",,1277028785808965632
BeardFaceSean,2020-06-27T23:59:23.000Z,"One of the only things that can redeem 2020, is if #WillyWonka announces that he's reopening his factory to 5 lucky golden ticket finders.",https://x.com/hashtag/WillyWonka?src=hashtag_click,1277028784835710977
EnviroSmartGOP,2020-06-27T23:59:22.000Z,Death Total for #COVID19 is #DiedWith not #DiedFrom even if asymptomatic .,https://x.com/hashtag/COVID19?src=hashtag_click https://x.com/hashtag/DiedWith?src=hashtag_click https://x.com/hashtag/DiedFrom?src=hashtag_click,1277028784609296385
sue_beachcover,2020-06-27T23:59:22.000Z,If one picture encapsulates the UKs management or mismanagement of COVID ......,,1277028784475160578
patkatz,2020-06-27T23:59:22.000Z,That’s not a mask. That’s a cover from a picnic basket,,1277028784093495297
danhacker,2020-06-27T23:59:22.000Z,Does Ohio not have a mask order?,,1277028783640514562
naomiialexiss,2020-06-27T23:59:22.000Z,this glasses plus mask combo? 0/10 would not recommend.,,1277028781459419139
KHQLocalNews,2020-06-27T23:59:22.000Z,Businesses closing because of COVID-19  khq.com/news/businesse …,https://t.co/CAAfjy2rY8,1277028781388107776
bizjournals,2020-06-27T23:59:22.000Z,"Vacation rental units throughout the state were only 9.4% occupied during the month of May, a year-over-year drop of 62 percentage points.  bizjournals.com/pacific/news/2 …",https://t.co/iMGpoBSJj3,1277028781245583361
VancilGirl93,2020-06-27T23:59:21.000Z,What we’ve learned about mask mandates and the “all lives matter bunch”. Y’all just racists. Again we aren’t shocked but just ironic.,,1277028779320389633
JaiW4Women,2020-06-27T23:59:21.000Z,Dying...the maxi pad face mask.,,1277028779043373056
Moura_v_belcher,2020-06-27T23:59:21.000Z,U get the drill.  But I’ll not leave without remembering -windmill cancer -AIDS vaccine - birtherism  -revolutionary war troops in airports - “we inherited a broken test system”  -“I’ve felt it was a pandemic long before every1 was calling it a pandemic” - hurricane sharpie map,,1277028779022594048
fortybuckss,2020-06-27T23:59:21.000Z,Oh shit my mask,,1277028778410205185
wjz,2020-06-27T23:59:21.000Z,Maryland Zoo Now Reopen To The Public  baltimore.cbslocal.com/2020/06/27/mar …,https://t.co/TPmVas1CwQ,1277028777571291137
JaxBizJournal,2020-06-27T23:59:20.000Z,Florida business groups worry about 'patchwork' of mask rules  bizjournals.com/jacksonville/n …,https://t.co/VhQlxXkSfA,1277028776061423619
SFBJNews,2020-06-27T23:59:20.000Z,"The nation's months-long struggle to regain its economic footing amid the Covid-19 pandemic is stretching American consumers to a breaking point, with the latest signs of distress flaring in the U.S. apartment market.  bizjournals.com/southflorida/n …",https://t.co/NHvwHAkws9,1277028776061423618
rajasekharaa,2020-06-27T23:59:20.000Z,"China opened an embassy on a tiny, remote Pacific island during the pandemic. Here’s why  subhodayamsubbarao.com/china-opened-a …",https://t.co/OyViCcawYl,1277028776027860993
davideyoungmd,2020-06-27T23:59:20.000Z,"It is unlikely that Fujifilm Toyoma to sponsor such a study. A clinical study, nevertheless, makes sense. Giving just two days of Remdesivir intravenously followed by another 6 days of oral Favipiravir would be a reasonable.",,1277028775759212544
sonofabitumen,2020-06-27T23:59:20.000Z,Harden ain’t winning it dude. He’s a choker. Covid or no covid.,,1277028775599804416
davideyoungmd,2020-06-27T23:59:20.000Z,h) A combination of antivirals may be our best bet. It is not natural for a pharmaceutical manufacturer to consider combining their medication with that of another company's. It would be unlikely for Gilead to sponsor a clinical study combining Remdesivir with Favipiravir,,1277028775058784256
HOUBizJournal,2020-06-27T23:59:20.000Z,"#Margaritaville Lake Resort, Lake Conroe-Houston officially opened for business June 26, the same day state and local officials ramped up efforts to combat the surging #Covid19 #coronavirus pandemic.  bizjournals.com/houston/news/2 …",https://x.com/hashtag/Margaritaville?src=hashtag_click https://x.com/hashtag/Covid19?src=hashtag_click https://x.com/hashtag/coronavirus?src=hashtag_click https://t.co/jCLNjGjwd3,1277028774094266369
godpropgod,2020-06-27T23:59:20.000Z,Huge fan of the UFC’s “Covid-19” post match interviews.,,1277028774060556288
jeffsnyder72,2020-06-27T23:59:20.000Z,I sit a damn fine couch.  Take that Covid-19.,,1277028773972578310
hardevdahelay,2020-06-27T23:59:20.000Z,"But why the testing in BJP rules states is the lowest. And why Govt is fudging data of those states. 85 % of all covid infection are from Maharashter, Gujrat, Delhi Haryana  Tamil nadu etc.  Pandemic need no politics but United national efforts.",,1277028773561610240
MyABJ,2020-06-27T23:59:20.000Z,One of the most popular restaurants in Austin has closed temporarily because an employee tested positive for Covid-19.  bizjournals.com/austin/news/20 …,https://t.co/vsV4Pacuvt,1277028773452537858
mckalal1,2020-06-27T23:59:20.000Z,"We shut down to take pressure off the hospital systems.  Now the goalpost moved to stopping the virus?  Pfft, Democrat governors killed more people by putting Covid patients in nursing homes than opening the economy that should have never been shut down like that.",,1277028773075070977
n_iania,2020-06-27T23:59:20.000Z,I really fuck up everytime with the gloss and mask combo smh .,,1277028772521357312
davideyoungmd,2020-06-27T23:59:19.000Z,Fujifilm’s study is unlikely to be completed anytime soon given the fact that there are few cases of Coronavirus in Japan at this time.,,1277028771216764928
PreteristUS,2020-06-27T23:59:19.000Z,In Texas there is a law on the books making it legal to wear a mask in public. Train robber days and all!,,1277028770554224640
RiverOaksPrblms,2020-06-27T23:59:19.000Z,I’m not saying a chilled magnum of Dom ‘92 lbs prevents COVID. All I’m saying is it can’t hurt.,,1277028770529120260
fight_nice,2020-06-27T23:59:19.000Z,20 mil infected - 43 percent of all deaths in LTC a long majority of the rest have othe underlying conditions the mortality rate is incredibly low - but people will still wait for a magic vaccine to free us all. Naive and foolish,,1277028770269089792
BusinessCourier,2020-06-27T23:59:19.000Z,"The number of Covid-19 cases in Hamilton County is spiking, and officials said Wednesday they are worried that it is not just because testing capacity has increased dramatically in recent weeks.  bizjournals.com/cincinnati/new …",https://t.co/MVM2fPPfpt,1277028770134863872
timetalks2,2020-06-27T23:59:19.000Z,Seriously?!? By a troll with 11 followers? I have a 4 year college degree in BIOLOGY! Hardly a failure! Ditch the mask it’s damaging your brain!,,1277028769740607489
asiajfuller,2020-06-27T23:59:19.000Z,YALL AMY DUNCAN DOESNT WANNA WEAR A MASK  Charlie’s gonna need all the luck she can get,,1277028769228677120
Darnelouise,2020-06-27T23:59:19.000Z,Mr Rather you know they are just as scared of some of us 40-100 y/o . But they are politicking to base. A mask is not the killer. It looks as though the WH base is trying to kill us all prior to the  November 2020 election.They are in hiding from #Covid19. Got to #VoteBlue2020,https://x.com/hashtag/Covid19?src=hashtag_click https://x.com/hashtag/VoteBlue2020?src=hashtag_click,1277028768784277504
JMacKiter,2020-06-27T23:59:19.000Z,New York Governor Andrew Cuomo is the Second Dumbest Gov. Massachusetts. Gov. Charlie Baker is the first.  Neither paid attention to Covid from Europe & Baker ignored BioGen's Infection & didn't act to Contain and test those 90 people.   1600daily.com/2020/06/24/new …,https://t.co/NXXeD1zjfY,1277028768176111617
WatchTheBias,2020-06-27T23:59:18.000Z,That’s ok. They have been proven to reduce contamination by 95% with the N95. They’re our biggest help with social distancing.  Temporary we can wear them until we get a vaccine. Then life can go back to normal.  mayoclinic.org/diseases-condi …,https://t.co/UlGO2P24mC,1277028768012554247
MattKoenig10,2020-06-27T23:59:18.000Z,"How about a strong order protecting Americans from Covid-19?? Over 125,000 dead Americans.",,1277028767131750402
seraphimfly,2020-06-27T23:59:18.000Z,"47. So far, no less than 200 people have died of the flu epidemic.",,1277028766120685569
ReverseRose,2020-06-27T23:59:17.000Z,"I’m pretty sure everyone has other things to do in life bud, quarantine got me like this man, I’m just tryna have fun dude so how about u go get a life if u don’t have anything positive to say",,1277028763583361026
Clarke15Christy,2020-06-27T23:59:17.000Z,Joe is talking about The Virus. Remember the Covid Virus!! Go back to Queens!,,1277028763461537793
ThisAndThatDude,2020-06-27T23:59:17.000Z,"Stop negative racist depiction ⁦ @theTiser ⁩ , the last two travelers that brought Covid were British and this new piece also talks about army returning from overseas, so why do you think it fit to show this image of a white guy versus a ‘Covid risk brown woman’?",https://x.com/theTiser,1277028762480046080
davideyoungmd,2020-06-27T23:59:17.000Z,c) Remdesivir is scarce and is available only as an intravenous infusion. There are obstacles in proposing a 5 to 8-day treatment of intravenous Remdesivir for Covid19 patients who would typically be at home in quarantine. Remdes should still be considered a valuable  drug.,,1277028761813184512
WillsBossyMom,2020-06-27T23:59:17.000Z,Go do some research.  Why would the president say Covid cases are spiking?   Why is there some much information discussing it?  Why have CA hospitals recognized they are getting cases from south of the border?,,1277028761272291329
davideyoungmd,2020-06-27T23:59:17.000Z,"b) Remdesivir is the one and only antiviral intervention that has been proven to be helpful for Covid19. (There are anti-inflammatory drugs, like Dexamethasone and Tocilizumab that reduce hospitalization and death when given to those ill enough to require hospitalization)",,1277028759942557696
itisfofe,2020-06-27T23:59:17.000Z,Federal officials allowed distribution of COVID-19 antibody tests after they knew many were flawed  cbsnews.com/news/federal-o …,https://t.co/hDyZfvYaTX,1277028759741386752
edensappleband,2020-06-27T23:59:16.000Z,Then fucking do something. Be pro active. And PRO LIFE WEAR A MASK,,1277028759586160641
_bell14,2020-06-27T23:59:16.000Z,"Not entirely true, access to healthcare removes the barrier of cost to an individual, they can more easily know their infection status, and if responsible take appropriate steps to limit spread even if asymptomatic.",,1277028759120547845
davideyoungmd,2020-06-27T23:59:16.000Z,"a) At this moment, 4 months into this epidemic, there is still not treatment to be started in patient who have early Covid19.  At this moment, there are no studies testing treatment for outpatients who have just come down with the disease.",,1277028758835171328
tejasjj,2020-06-27T23:59:16.000Z,That's because Abbott refused to lead. theguardian.com/us-news/2020/j …,https://t.co/3UWhrma8Sf,1277028757191233537
paulrprichard,2020-06-27T23:59:16.000Z,#COVIDIsReal DfE ‘sworn to secrecy’. Covid wrongthink. Action Platform NWO paulthepaperbear.wordpress.com/2020/06/15/you …,https://x.com/hashtag/COVIDIsReal?src=hashtag_click https://t.co/9uJlqPsjQq,1277028756671156226
davideyoungmd,2020-06-27T23:59:16.000Z,"Why is it then, that there are no clinical trials directed toward a treatment for the person who has just been tested positive for Coronavirus?",,1277028756268318720
J_Bologna,2020-06-27T23:59:16.000Z,"Living the dream! . . . global pandemic aside, at least",,1277028756209782785
ResearcherBy,2020-06-27T23:59:15.000Z,"I want to print up t-shirts that say ""I Can't Breathe""  for those rare times I wear a mask and want to make a point.",,1277028755383468033
red_crumbs,2020-06-27T23:59:15.000Z,"If people cared, they would wear a gas mask. A cloth mask says “I care a trivial amount”.",,1277028754909528072
iyanuuuuh,2020-06-27T23:59:15.000Z,A children’s hospice...with no type of mask on,,1277028754489917440
amalkoff,2020-06-27T23:59:15.000Z,Surprising pandemic benefit: countless crusty Massholes discovering their inner kind midwesterners (or other locales where people are generally not default: disgruntled). Let's hope it sticks.,,1277028753022091265
FixMetroMDT,2020-06-27T23:59:15.000Z,Not good social distancing.,,1277028752632025088
AnthonyBuckney,2020-06-27T23:59:14.000Z,"It's hard to believe that Patricia thinks that Labor MP saying China handled Covid well must conclusively be as a result of ""influence"".  What rot. I think they did well. The WHO thinks so. Anyone who is not biased knows they did well.   This shows more about our narrow thinking",,1277028750853410816
Shirley57457661,2020-06-27T23:59:14.000Z,Trump is tweeting wanted posters now in a desperate attempt to shift the conversation away from the covid surge. He's just not happy unless he's causing mayhem.,,1277028750610313216
WILKSTONGUE,2020-06-27T23:59:14.000Z,"Twice now i got to the bus stop, not knowing when the bus was coming, and found one just there. Like wow, how lucky. NOT. Had no mask with me so i had to go back home to get it, then call an uber to avoid being late. I was maaad",,1277028749800812550
seriouslysushi,2020-06-27T23:59:14.000Z,"Keep in mind, there were two black people killed in fucked up circumstances during the lockdown before George Floyd. And then we saw people protesting and yelling in cops faces for haircuts.",,1277028749557608450
DailyMemphian,2020-06-27T23:59:14.000Z,"In the Millington First Baptist Church parking lot, historically black sorority Delta Sigma Theta set up food drive and coronavirus testing stations, hoping to reach people in an area that's low on testing.  dailymemphian.com/article/15135/ …",https://t.co/ny3e7Wxpum,1277028747737210880
imminent_news,2020-06-27T23:59:13.000Z,The Ministry of International Relations and Cooperation says no donation of 4 499 rapid Covid-19 testing kits were sent to Zimbabwe.  #namibia #mostshared  buff.ly/38amwij,https://x.com/hashtag/namibia?src=hashtag_click https://x.com/hashtag/mostshared?src=hashtag_click https://t.co/eUSuREHIw9,1277028746961321984
katiesaurusrex,2020-06-27T23:59:13.000Z,"Oh, I tried making a few different styles of mask and this was totally my favorite!!! It’s a lot easier to wear than the ear loop kind.",,1277028746076119040
fevowl,2020-06-27T23:59:12.000Z,What percentages didnt respect social distancing and discarded tons of litter....their behaviour is indefensible,,1277028741101879296
LindaMDickson3,2020-06-27T23:59:12.000Z,"That really adds up. With the Trump reaction to Covid-19, nobody can make me believe pain patients can't get medicine because Trump wants to save lives.",,1277028740774506496
JDSpedCoach,2020-06-27T23:59:12.000Z,"Liberals attempt to shut things down again. If a Democrat wins covid will disappear Nov. 5th, if not they with take it to the next level",,1277028740602699778
SaraAlcid,2020-06-27T23:59:12.000Z,I think we might need another POD for all of my stationary. Otherwise moving across the country during a pandemic is going to be great!,,1277028739730243585
fuseboxradio,2020-06-27T23:59:11.000Z,"Airlines tried social distancing on board. For many, that experiment is ending. l Washington Post  #CapitalismIsADeathCult News: The Unfriendly Skies Edition   washingtonpost.com/travel/2020/06 …",https://x.com/hashtag/CapitalismIsADeathCult?src=hashtag_click https://t.co/3rSb2yQ8WE,1277028738639835137
may_snap,2020-06-27T23:59:11.000Z,"I wonder if people (*especially all these horrid ""Karens"") would feel different if wearing a mask protected THEMSELVES, not their neighbors. I bet they would wear 2",,1277028738409127941
ChuckPeters13,2020-06-27T23:59:11.000Z,Everyone please wear a mask. Protect everyone. I can't remember reading an article that actually made me shed tears. This is the one. Please wear a mask.,,1277028736286756865
erod214er,2020-06-27T23:59:11.000Z,"You don’t have to be concern just wear a fucking mask and stop down playing over 100 thousand deaths that could have been prevented, it’s because of bad leadership this happened",,1277028735531827200
elmattador3976,2020-06-27T23:59:11.000Z,How many Covid-19 IR Spots should a season long fantasy team have? I’m thinking 3,,1277028734667755520
taylorblaisee,2020-06-27T23:59:10.000Z,I guess I should’ve clarified in my original tweet though:  Why are people *with no underlying conditions and are otherwise in perfect health* so upset about having to wear a mask in public?,,1277028733782642689
thesaw1010,2020-06-27T23:59:10.000Z,So should you have to wear a mask if you have already had it and recovered?,,1277028732885250049
v_bsuzi,2020-06-27T23:59:10.000Z,And the next state to have an “uptick” in covid cases... MO.. go home people... stop the insanity.,,1277028732562214912
thomante,2020-06-27T23:59:10.000Z,"After Rushing to Reopen Amid COVID-19, States Restrict Bars and Restaurants Once Again  eater.com/2020/6/26/2130 … via  @Eater",https://t.co/LblzAHBYDv https://x.com/Eater,1277028732335767565
KenAlexander304,2020-06-27T23:59:10.000Z,"In a Republican ran country there has been 120,00 deaths and rising from covid jobs lost millions of americans unemployed and worst economy ever",,1277028732071546883
Ewanclark94,2020-06-27T23:59:10.000Z,It’s too make republicans look bad for reopening quickly,,1277028730515394561
bridsmith3,2020-06-27T23:59:09.000Z,"you will need to be more honest and the appalling way you handled yourselves during the covid19 pandemic was not good, We would never support a group such as yourselves",,1277028729806630912
LowkeyDokey101,2020-06-27T23:59:09.000Z,MAR pretty much there (~$80)  Can you expand a little bit why you have questions on them?  I think they will burn like $1.5bn from COVID and then by 2022 things should be getting close to 2019 levels...think this should be more like $120 than $80,,1277028729584222208
PhyJoEnterprise,2020-06-27T23:59:09.000Z,"Well, aren't lefties pushing this great #vaccine breakthrough? Betcha they don't take it  Get pre-vax blood sample frm Bill&Melinda #Gates whose PSA 2 make public show of taking vax by certified doc verifying content  Random vial pull, roll sleeve & inject all  They'll decline!  x.com/StephenSpeaksU …",https://x.com/hashtag/vaccine?src=hashtag_click https://x.com/hashtag/Gates?src=hashtag_click https://x.com/StephenSpeaksUp/status/1277025132733763586,1277028729504567298
speckiemom,2020-06-27T23:59:09.000Z,"Amen.  Thank you for standing firm to protect ALL, whether they realize it or not.  And PLEASE require employers to make PROPER MASK WEAR MANDATORY.   Lowes today had several employees with masks at chin.  I love Lowes vs HD but give them ability to enforce.",,1277028728334422026
Frankenfarts,2020-06-27T23:59:09.000Z,I swear to god if I see any anti-mask people wearing a mask on Halloween,,1277028727201959939
PoliticalSister,2020-06-27T23:59:09.000Z,Same place I've been for 3 and a half months due to his deadly mishandling of this coronavirus pandemic.,,1277028726350532608
Tst1933Todd,2020-06-27T23:59:08.000Z,"With Trump leading the way, America’s coronavirus failures exposed by record surge in new infections  washingtonpost.com/politics/with- …",https://t.co/0OazzY8H4d,1277028725062881280
GCAssets,2020-06-27T23:59:08.000Z,"Most coronavirus deaths  US: 128,000 Brazil: 57.070 UK: 43,514 Italy: 34,716 France: 29,778 Spain: 28,341 Mexico: 25,779 India: 16,103 Iran: 10,364 Belgium: 9732 Peru: 9135 Germany: 9026 Russia: 8969 Canada: 8516 Netherlands: 6105 Chile: 5347 Sweden: 5280 Turkey: 5082 China: 4634",,1277028724114948096
Kanage,2020-06-27T23:59:08.000Z,But your right. To be fair...you leave quarantine...you should be responsible  enough to submit to retest...,,1277028723682762752
TexasEDMFamily,2020-06-27T23:59:08.000Z,My mom’s best friend got it with her husband. She was asymptomatic while her husband died in one week. This was a couple weeks ago. He could’ve breathe and was ventilated and he passed...,,1277028723255128064
ccarolionn,2020-06-27T23:59:08.000Z,"If you think beach goers and bar goers are separate groups, you’re wrong.  MOST people I know going to the beach right now are the same people going to the bars after. Without masks. Without social distancing.  It is ALL a problem.",,1277028722445598720
JamesSurowiecki,2020-06-27T23:59:08.000Z,"I'm not calling the ppl out. I'm saying we should be skeptical of concluding from this outbreak that social-distancing can't work, since no one was actually social distancing.",,1277028722378506243
divinegyal,2020-06-27T23:59:07.000Z,my body must think it’s still in quarantine mode i wan eat everything,,1277028721753575427
pcnxo,2020-06-27T23:59:07.000Z,I hope w all my heart and holding hands w Satan and their force of nature that these ppl die of covid,,1277028721275404288
longgonedaddy,2020-06-27T23:59:07.000Z,When pandemic and monument trashing aren’t working.,,1277028720713371649
sarcasticSquirl,2020-06-27T23:59:07.000Z,The hoaxers and anti-mask crowd need to wear a bracelet so they can be triaged out to the parking lot,,1277028720092405760
OneDetroit_PBS,2020-06-27T23:59:07.000Z,Sick of being in quarantine? A little flower power may brighten your day. Or some wearable metal art - or a trip to a drive-in movie to see the #1 film in the U.S. - made in Michigan! Will Glover catches you up on big stories of the week. Full stories at  onedetroitpbs.org,https://t.co/AOjdudXfLu,1277028719220215809
DawnMar45506877,2020-06-27T23:59:07.000Z,@CDCgov  says the death rate for covid is just slightly higher than seasonal flu. We are panicking over a severe flu.  technocracy.news/cdc-confirms-e …,https://x.com/CDCgov https://t.co/j4m1bfE0sY,1277028719186640896
Dan_A_Gillies,2020-06-27T23:59:07.000Z,"To claim that the US got ""back doored"" by Europe is ridiculous. The numbers were being reported early on, that data was available. Canada has closed its border with the US, & the EU is also banning travel of Americans. Trump & admin have totally botched handling of the pandemic.",,1277028718809055233
deathofferings,2020-06-27T23:59:06.000Z,"Folks that refuse to wear a mask out in public really made it political saying ""you can't take away my freedom"" really? All that for a mask?",,1277028717286567939
Mile_Marker_0,2020-06-27T23:59:06.000Z,"Trump knew when he forced West Point graduates to return to campus, quarantine for 14 days in their dorms, then sit and listen to his campaign performance.    He is a pathological liar.   Bolton: Trump always has his personal interests ahead of America’s interests.",,1277028715919224832
SciTJC,2020-06-27T23:59:06.000Z,- don’t use masks during COVID that have a valve like the guy at the beginning of this video. Just let’s all your COVIDy breath out the front. K thx bai,,1277028715503878145
NYDailyNews,2020-06-27T23:59:04.000Z,"Florida city enforced its coronavirus rules, shutting down seven businesses violating them.  The businesses included two bars and five restaurants. Three of the restaurants weren’t social distancing and two were allowing people to sit at their bars. trib.al/2qgKeSn",https://t.co/AJ8mdAEhYk,1277028708956717056
natparksgal,2020-06-27T23:59:04.000Z,"Pretty obvious that she doesn't really have a breathing problem if she's able to yell nonstop like that. Unfortunately, it seems that the mask issue is triggering for people struggling with mental health issues, which is more likely the case.",,1277028708742823938
brandonjnewman_,2020-06-27T23:59:04.000Z,Venn diagramming racism deniers and COVID deniers,,1277028708050747392
GrrrUSA,2020-06-27T23:59:04.000Z,Corrupt Joe Biden said yesterday that we have over “120 million” people dead of Coronavirus!  Here is a clip I just made of that. KEK  #FactsMatter,https://x.com/hashtag/FactsMatter?src=hashtag_click,1277028707673108480
DADDYRAYKAYY,2020-06-27T23:59:04.000Z,ain’t nothing like the feeling when you take that mask off,,1277028707224424449
MrCool1132,2020-06-27T23:59:04.000Z,@TeamTrump  @realDonaldTrump  @WhiteHouse    Are you.the president? Just go back into your #bunker. No wonder US have the most DEATHS & INFECTIONS from COVID 19 . Becuse  of NO LEADERSHIP! THIS IS SO PATHETIC an ad for a so call incumbent.,https://x.com/TeamTrump https://x.com/realDonaldTrump https://x.com/WhiteHouse https://x.com/hashtag/bunker?src=hashtag_click,1277028706847002624
ColoursofFaith,2020-06-27T23:59:04.000Z,"Just wore my mask, about to step out right now",,1277028706771501056
ALefthandedLady,2020-06-27T23:59:03.000Z,"Being that the mask is made of fabric or similar, which is not just aligned holes, but a network of holes that cross each other, the virus would need to navigate that network to penetrate the mask. That is why they have ratings like N95. Cloth is about an N80ish.  (2)",,1277028704309436416
EricNewtonnn,2020-06-27T23:59:03.000Z,"No it’s to buy exclusively in black businesses, therefore boycotting the non-black businesses which are already struggling after lockdown. Brilliant way to stop racism...",,1277028703755698176
