User_name,Datetime,Content,Links,Tweet_ID
EMJr__,2020-03-22T23:59:59.000Z,Do people not understand social distancing??? Like fuck stay home!,,1241877317011607558
lachlantegart,2020-03-22T23:59:59.000Z,"Love my new workspace! Thanks to my lovely bf for the little aspirational nameplate  I hope everyone is a keeping calm, safe and separate during this pandemic. Hoping that mediums like #twitter help us feel less isolated #WorkFromHome #Covid_19australia",https://x.com/hashtag/twitter?src=hashtag_click https://x.com/hashtag/WorkFromHome?src=hashtag_click https://x.com/hashtag/Covid_19australia?src=hashtag_click https://x.com/hashtag/Covid_19australia?src=hashtag_click,1241877316831076352
carluccio7,2020-03-22T23:59:59.000Z,Today’s post: social distancing. #socialdistancing #collagepeople #washitape #washitapeaddict #littlepeople #stayingsafe #stayingsafeandhealthy  instagram.com/p/B-DiR8lppfe/ …,https://x.com/hashtag/socialdistancing?src=hashtag_click https://x.com/hashtag/collagepeople?src=hashtag_click https://x.com/hashtag/washitape?src=hashtag_click https://x.com/hashtag/washitapeaddict?src=hashtag_click https://x.com/hashtag/littlepeople?src=hashtag_click https://x.com/hashtag/stayingsafe?src=hashtag_click https://x.com/hashtag/stayingsafeandhealthy?src=hashtag_click https://t.co/xkIcG0tPuC,1241877316713750537
designmike1,2020-03-22T23:59:59.000Z,Kids doing math at home calculate their parents have a 24 months #ToiletPaperInventory. Now cash short maybe consider doing a return? The suppliers have caught up and the supply chain is filling the vacuum.  tmz.com/2020/03/22/cos …,https://x.com/hashtag/ToiletPaperInventory?src=hashtag_click https://t.co/Jlpj7pNAKr,1241877316659081216
SenshiSammoArt,2020-03-22T23:59:59.000Z,Quarantine sucks so here's a few pics of my cat to make you smile,,1241877316344651777
crizzzaine,2020-03-22T23:59:59.000Z,get me off lululemon’s website  this quarantine is not good for my bank account...,,1241877316331962368
AndyManar,2020-03-22T23:59:59.000Z,"Contact  @serveillinois  if you have Personal Protective Equipment (PPE) including masks, gowns, gloves, & eye protection that can be donated to front line healthcare workers & first responders to fight against COVID-19 in IL.  More information click here:  www2.illinois.gov/sites/serve/Di …",https://x.com/serveillinois https://t.co/hk72olyLH0,1241877316260765696
ReggiegBTW,2020-03-22T23:59:59.000Z,I mean with this quarantine we have nothing but time so let’s do it,,1241877316030140417
skift,2020-03-22T23:59:59.000Z,"This week, travel startups  @bimbleapp  and  @PruvoWeb  announced they had raised more than $1 million each in funding, despite the coronavirus crisis. Keep hope alive.  bit.ly/3949hyr",https://x.com/bimbleapp https://x.com/PruvoWeb https://t.co/7yHfRwoDks,1241877315447148544
Sharon96727956,2020-03-22T23:59:59.000Z,"If you want that very uncomfortable test, go get it. As for me, I’ll stay at home & isolate as requested.",,1241877315052806154
Imi_cycles,2020-03-22T23:59:59.000Z,Is there any actual evidence that young people haven't been practicing social distancing or are we just making bold assumptions based on stereotypes? And then yelling at people for something we don't even know if they've done or not,,1241877314813562880
JudiciaIreview,2020-03-22T23:59:59.000Z,"If they are following government advice re social distancing/self isolation of symptomatic persons, they are not.",,1241877314784210944
8thandWalton,2020-03-22T23:59:59.000Z,Walmart Supports COVID-19 Testing Efforts - 8th & Walton News Now  hubs.ly/H0nMzJK0,https://t.co/eKRo37ChpT,1241877314662793216
TheScientistLLC,2020-03-22T23:59:59.000Z,The shot contains synthetic RNA transcripts that code for a viral protein.,,1241877314620862466
TheIJR,2020-03-22T23:59:59.000Z,"""I think maybe if we sing together, we’ll feel just a little bit better.""  hubs.ly/H0nMSh-0",https://t.co/BY9cTHpB2I,1241877314608267273
ValisaChanel,2020-03-22T23:59:59.000Z,Today...we got the Childish Gambino album. @rihanna ...you are in quarantine. You’re doing NOTHING else. Drop. Your. Album,https://x.com/rihanna,1241877314528567298
rmfnord,2020-03-22T23:59:59.000Z,"I don't usually do endorsements, but Netflix Party is THE best way to continue annoying people by talking over a movie while responsibly social distancing.",,1241877314272665606
KeriCrewsonMD,2020-03-22T23:59:59.000Z,Harbor Freight is willing to donate their supply of N95 masks. Please put in a request for your hospital if in desperate need. #medtwitter #nursetwitter #covid4md  harborfreight.com/ppe-request.ht …,https://x.com/hashtag/medtwitter?src=hashtag_click https://x.com/hashtag/nursetwitter?src=hashtag_click https://x.com/hashtag/covid4md?src=hashtag_click https://t.co/b5e8tJgMwx,1241877314264334338
AnnMartyn4,2020-03-22T23:59:59.000Z,Could these guys stand any closer!!! Social distancing. For everyones sake LEAD BY EXAMPLE,,1241877313500745729
Athebeach12,2020-03-22T23:59:59.000Z,Calling  @JoeBiden  #COVIDー19 #pandemic  @DrBiden  x.com/emptywheel/sta …,https://x.com/JoeBiden https://x.com/hashtag/COVID%E3%83%BC19?src=hashtag_click https://x.com/hashtag/pandemic?src=hashtag_click https://x.com/DrBiden https://x.com/emptywheel/status/1241871405458866176,1241877313421221889
yitzyl,2020-03-22T23:59:59.000Z,What about home delivery this passed week ? Missing our magazine in quarantine.,,1241877312964001793
GPBGeorge,2020-03-22T23:59:59.000Z,Coronavirus: IOC considers postponing 2020 Tokyo Olympics #Coronavirus  x.com/i/events/12190 …,https://x.com/hashtag/Coronavirus?src=hashtag_click https://x.com/i/events/1219057585707315201,1241877312871845891
LekhaPrajapati,2020-03-22T23:59:58.000Z,Quarantine’s Side Effects!,,1241877312007622656
ParhamMansor,2020-03-22T23:59:58.000Z,"Italy, Pandemic’s New Epicenter, Has Lessons for the World  nyti.ms/3bcTDCz",https://t.co/060ln5HjAF,1241877311785295872
jimmypesarchick,2020-03-22T23:59:58.000Z,How everyone’s about to be looking after Day 97 of quarantine and strictly on a push-up only workout plan.,,1241877311491911680
SenatorWagle,2020-03-22T23:59:58.000Z,"The Kansas Legislature recently made changes to the unemployment system in Kansas. For information on unemployment related to COVID-19, please see the sources below.",,1241877309415661570
Illyria13693603,2020-03-22T23:59:58.000Z,"Relax, watch something fun, do stuff around the house.. make cake? ;D  I started painting some furniture and we're not even on official lockdown yet.",,1241877308937572352
LALATE,2020-03-22T23:59:58.000Z,"""Rand Paul ""... was #ASYMPTOMATIC , didnt feel anything, but tested himself because he's ""been traveling alot"" ? And he tested himself even though the current recom is NOT test if you are #ASYMPTOMATIC .  Something doesnt make sense. #RandPaul",https://x.com/hashtag/ASYMPTOMATIC?src=hashtag_click https://x.com/hashtag/ASYMPTOMATIC?src=hashtag_click https://x.com/hashtag/RandPaul?src=hashtag_click,1241877308920627201
AngloSaxon0_0,2020-03-22T23:59:57.000Z,We can't just ignore a pandemic. We're doing our best to control it and its already out of hand. Ignoring it would be far more devastating for the economy.,,1241877308371275776
HundWilliams,2020-03-22T23:59:57.000Z,Quarantine is making someones day at least,,1241877308258111489
funeralbelleart,2020-03-22T23:59:57.000Z,I don’t think dogs can get the covid-19 but I know they definitely can carry other forms of a cornonavirus. The only way they’d be able to get Covid-19 is if it mutates for a 3rd time meaning it would jump from people to animals. Atleast that’s my understanding,,1241877307830284288
wguru,2020-03-22T23:59:57.000Z,#COVID-19 projections under various scenarios  medium.com/@tomaspueyo/co …,https://x.com/hashtag/COVID?src=hashtag_click https://t.co/McJTlmkI6s,1241877307733786624
michaelbloem,2020-03-22T23:59:57.000Z,See a forecast for how long each US state has until COVID-19 overwhelms hospitals and how interventions could flatten the curve:  covidactnow.org #COVIDActNow,https://t.co/dACGvYKtbO https://x.com/hashtag/COVIDActNow?src=hashtag_click,1241877307700232192
ChristinaC40,2020-03-22T23:59:57.000Z,What’s the best part of being in #Quarantine ... #90DayFiance !!! #Isolation #QuaratineLife,https://x.com/hashtag/Quarantine?src=hashtag_click https://x.com/hashtag/90DayFiance?src=hashtag_click https://x.com/hashtag/Isolation?src=hashtag_click https://x.com/hashtag/QuaratineLife?src=hashtag_click,1241877307503136769
BronyW,2020-03-22T23:59:57.000Z,"RT  @grantgriesel666 : Wife and I laughed and laughed when we discussed being in quarantine together.  Her ""All Blacks haka"" throat cutting gestures was taking it a bit far in my opinion.",https://x.com/grantgriesel666,1241877307473756160
cindyhoya,2020-03-22T23:59:57.000Z,@KatyTurNBC  we'll celebrate 36 years in May.  My husband doesn't need a quarantine to remind me fondly of his legendary Gray Y football career often.  As if I might forget!,https://x.com/KatyTurNBC,1241877307440144385
MFhendrix,2020-03-22T23:59:57.000Z,"I just answered  @BernieSanders ' call to donate to groups supporting people and workers during the coronavirus pandemic. Donate:  secure.actblue.com/donate/bernie- …  Seriously, if you’re in a position in which you can donate anything at all. There are people in dire need of help.",https://x.com/BernieSanders https://t.co/GN7yZK7r2o,1241877307209519104
rulebc15,2020-03-22T23:59:57.000Z,Thought you ditched the pandemic team...,,1241877307087671296
weeziebug76,2020-03-22T23:59:57.000Z,90 day time!!! Get your wine get your quarantine snacks and lets  do this! #90DayFiance,https://x.com/hashtag/90DayFiance?src=hashtag_click,1241877305556860932
country_gigi,2020-03-22T23:59:57.000Z,"RT President Trump offers help to NKorea, when NKorea says there has not been a single case, while OUR states have been begging Trump for help & he gets mad @ them and tells them to figure it out themselves. foxnews.com/world/trump-ki …",https://t.co/omYttKPJ4c,1241877305389133827
lavender_rach,2020-03-22T23:59:57.000Z,rand paul and harvey weinstein both got coronavirus i call that a win,,1241877305171075074
starrynigh8,2020-03-22T23:59:57.000Z,Do people not understand that social distancing also means don’t throw gatherings at home?? Whats the point if you have 15 people over every day????,,1241877305007497217
dodofrost,2020-03-22T23:59:57.000Z,@ObserverUK  please can you provide a link to the Imperial College Covid-19 report in today's print edition. I couldn't find it on your website or online,https://x.com/ObserverUK,1241877304999063553
BishopJLMills,2020-03-22T23:59:57.000Z,What can separate us from the love of God? Certainly not COVID-19!,,1241877304630009862
fixit5000,2020-03-22T23:59:56.000Z,Air quality is improving in countries under coronavirus quarantine  buzznews411.blogspot.com/2020/03/air-qu …,https://t.co/BWs5aI85PU,1241877304332242945
Saronimo,2020-03-22T23:59:56.000Z,"For now, yes. But viruses can mutate, which is why the ""herd immunity"" is bs without any immunity data. Eg chickenpox immunity vs colds&flu people get repeatedly. Not trying 2 be alarmist, but staying at home is only good when coupled with mass testing and vaccine development",,1241877304185434112
SteveCinciBiz,2020-03-22T23:59:56.000Z,Donations from  @FifthThird  add to its changes to give relief to borrowers who are struggling to make payments due to coronavirus effects.  bizj.us/1q2uo0,https://x.com/FifthThird https://t.co/tKzXp91abI,1241877303828852740
LaborLibSacto,2020-03-22T23:59:56.000Z,"The Obamacare lawsuit still goes to the Supremes--in a public health crisis--will the Court strike it down? Allow people with pre-existing #coronavirus to be denied coverage? Here is CA AG  @XavierBecerra , haven't heard recently from TX AG  @KenPaxtonTX  on it #COVIDー19",https://x.com/hashtag/coronavirus?src=hashtag_click https://x.com/XavierBecerra https://x.com/KenPaxtonTX https://x.com/hashtag/COVID%E3%83%BC19?src=hashtag_click,1241877303791095808
Livingstone_UK,2020-03-22T23:59:56.000Z,"Yesssss!!  Leave (Get Out) by JoJo, her huge hit from 2004, is still one of my favourite songs! Now reimagined as a coronavirus warning",,1241877303489179649
miss_sanjana92,2020-03-22T23:59:56.000Z,After this whole pandemic home values will be low!!!!,,1241877303015202823
EmpireEnjoyer3,2020-03-22T23:59:56.000Z,Trump’s coronavirus response in the last 36 hours has been sleepy. Let’s bring back the aggressiveness of earlier this week.,,1241877302599974915
TuxguyBot,2020-03-22T23:59:56.000Z,Social distancing; the #little (big) things we took for granted.   tinyurl.com/t7awt4f,https://x.com/hashtag/little?src=hashtag_click https://t.co/Jdqt51gfPE,1241877302536962049
laur_nichole,2020-03-22T23:59:56.000Z,Day 12 of quarantine: officially addicted to tiktok,,1241877302134308867
2Taity,2020-03-22T23:59:55.000Z,me and my mates hitting town the second coronavirus has been and gone  x.com/Bomboclaato/st …,https://x.com/Bomboclaato/status/1241028682791161857,1241877298753699840
BigManSmallBed,2020-03-22T23:59:55.000Z,"The insane, right side of my brain to the logical, left side during #quarantine",https://x.com/hashtag/quarantine?src=hashtag_click,1241877298585862145
RosemaryMcL,2020-03-22T23:59:55.000Z,Tell me that Bernie didn't miss ANOTHER vote regarding the #coronavirus . That's not leadership. That's dredging up memories of a man who couldn't be bothered voting during the Viet Nam era or the Reagan era or any era til he could vote for himself as mayor.,https://x.com/hashtag/coronavirus?src=hashtag_click,1241877298502082561
noodlerodeo,2020-03-22T23:59:55.000Z,"So my mom told me yesterday that my cousin, who is an anesthesiologist in NYC, has no access to PPE. He was in close contact with a COVID patient during surgery with no protection. /1",,1241877298145415169
pdanimae,2020-03-22T23:59:55.000Z,"Bernie’s raising millions of dollars for coronavirus relief and bringing important information directly to the American people (specifically young people, which have been proven to be asymptomatic carriers) and.. we’re.. mad?",,1241877297692540929
jasnature,2020-03-22T23:59:55.000Z,anxiety is through the roof.  from someone who had legionnaires pneumonia a few years ago the thoughts of coming down with covid-19 is the same as playing russian roulette. 1/6  #prayforme,https://x.com/hashtag/prayforme?src=hashtag_click,1241877297034145792
LilSmitty__,2020-03-22T23:59:55.000Z,"Besides going to the gym, school or work I’m really just a homebody so I’m not really struggling with this quarantine shit",,1241877296966819840
IgnoranceCosts1,2020-03-22T23:59:55.000Z,"Can we recall every Gov, politician, political leader who has said US deaths from #coronavirus will exponentially rise in the next few weeks as those in Italy have, if in fact deaths do not rise exponentially, & if majority of those testing positive never exhibit symptoms?",https://x.com/hashtag/coronavirus?src=hashtag_click,1241877296954425345
alienpussy99,2020-03-22T23:59:55.000Z,Ration out that make up too for quarantine selfies,,1241877296908288005
we_mask,2020-03-22T23:59:55.000Z,Do Florida and Texas next please,,1241877296828432384
gpmarx_g,2020-03-22T23:59:55.000Z,"US cases run US up to third place in the world totals, “charts show how fast coronavirus cases are spreading — and what it takes to flatten the curve” #Covid19worldData  flip.it/cnDfIy",https://x.com/hashtag/Covid19worldData?src=hashtag_click https://t.co/F1vAk4t5nN,1241877296673443840
jackiefriedma15,2020-03-22T23:59:55.000Z,Chicago Doctor’s Blunt Speech About COVID-19 Hits Home Across the Country – NBC Chicago  nbcchicago.com/top-videos-hom …,https://t.co/7ipb52Kfjn,1241877296589549568
RyDontLie,2020-03-22T23:59:55.000Z,Man this quarantine turning me to an alcoholic lol,,1241877296455262209
drjeffmbaxter,2020-03-22T23:59:55.000Z,@SenatorLankford  please push for non-profit / churches economic help during this time. #coronavirus,https://x.com/SenatorLankford https://x.com/hashtag/coronavirus?src=hashtag_click,1241877296379617280
bamandaken,2020-03-22T23:59:55.000Z,HARVEY WEINSTEIN TESTED POSITIVE FOR CORONAVIRUS WE GOT HIM GIRLIESSS,,1241877296291680256
tbdnonymous,2020-03-22T23:59:54.000Z,"I'm seeing many people asking for COVID response to be 'federalized'. Do people even know what that means? As for me, I want to say thank you to  @POTUS  for respecting the states different needs, and also for centralized assistance instead of heavy handedness in federal response.",https://x.com/POTUS,1241877295943516166
kenneynryan,2020-03-22T23:59:54.000Z,Ahh yes it was Chita Rivera who made me cry during quarantine,,1241877295100461056
JoannaSheps,2020-03-22T23:59:54.000Z,Quarantine day 9: my mom FaceTimed me to tell me stories about dudes she ghosted in her twenties,,1241877295020867584
acrobatonline,2020-03-22T23:59:54.000Z,Premier League clubs MUST share TV revenue with struggling EFL clubs  mol.im/a/8120701 via  @MailSport,https://t.co/dnT7GJv3Pe https://x.com/MailSport,1241877294492327937
that_fly_girl_T,2020-03-22T23:59:54.000Z,Me realising my senior year is over and we r going to be in quarantine for the rest of the school year,,1241877294114881543
ElizabethMcFinn,2020-03-22T23:59:54.000Z,"Day 125 of lockdown: ""I'm lying in bed, thinking of you my darling. I'm fading away without your sweet presence. Do you want a sex Skype call later?""",,1241877294035144704
wjgordonjr,2020-03-22T23:59:54.000Z,"Here’s a short list of my quarantine accomplishments:  1) started teaching online 2) learned how to make a gif 3) watched my incredible wife give birth to the most beautiful thing I have ever seen 4) nothing else matters anymore, look at this baby",,1241877293586419712
novice2star,2020-03-22T23:59:54.000Z,WOW: Atiku's Son Tests Positive To Coronavirus  novice2star.com/2020/03/22/wow … via  @novice2star  #covid19 #covic,https://t.co/WDgdWZO4Ix https://x.com/novice2star https://x.com/hashtag/covid19?src=hashtag_click https://x.com/hashtag/covic?src=hashtag_click,1241877293255077888
RLeuthen,2020-03-22T23:59:54.000Z,und immer herein damit heidelberg24.de/heidelberg/cor …,https://t.co/77e6oa8T8Z,1241877293158580227
mjjnbla,2020-03-22T23:59:54.000Z,We owe it to them to care.   The federal government is outbidding states on orders of critical medical equipment necessary to aid patients and protect medical professionals from coronavirus.  A Hospital here in Georgia found .57 cent masks being sold for $7.00.,,1241877292881756170
melodee99,2020-03-22T23:59:54.000Z,Social distancing?,,1241877292596379648
mviser,2020-03-22T23:59:54.000Z,"Governors and mayors in growing uproar over Trump’s lagging coronavirus response, by  @costareports  @Post_AG washingtonpost.com/politics/gover …",https://x.com/costareports https://x.com/Post_AG https://t.co/qevNJ2E5An,1241877292340645889
maricallah,2020-03-22T23:59:54.000Z,"OPINION: Vancouver Mayor says nicely, ""The time of asking nicely is coming to an end"" regarding #COVIDIOTS  vancouverisawesome.com/coronavirus-co … via  @viawesome",https://x.com/hashtag/COVIDIOTS?src=hashtag_click https://t.co/gJWwbULQOm https://x.com/viawesome,1241877292264992770
RogersHelps,2020-03-22T23:59:54.000Z,At this time Rogers has closed most retail locations to help minimize the risk of COVID-19 for both employees and customers. Stores that remain open will be practicing social distancing with a limit of 3 customers in each store at any one time. ^ah,,1241877292197892097
foolander,2020-03-22T23:59:53.000Z,BBC News - Coronavirus: What are social distancing and self-isolation?  bbc.com/news/uk-515067 …,https://t.co/HQLHcEKhy2,1241877291665215489
IndivCincy,2020-03-22T23:59:53.000Z,"New York To Begin Clinical Trials For Coronavirus Treatment Tuesday, Cuomo Says  forbes.com/sites/lisettev …",https://t.co/kBPiJMVrwj,1241877291321475074
Othmanabba,2020-03-22T23:59:53.000Z,Let’s do this and communicate all our worries to JALLAJALALAHU specifically this pandemic situation. May we find ease amidst all these. Ameen,,1241877290847481856
wvstatejournal,2020-03-22T23:59:53.000Z,"4 more test positive in WV, bringing total to 16; all are travel related. Gov. Jim Justice defended his efforts in a brief statement Sunday and scheduled his next press briefing for Monday morning. Read all about it: wvnews.com/news/wvnews/fo …",https://t.co/RW5k19N24h,1241877290830757897
SMITH_JACKSON57,2020-03-22T23:59:53.000Z,Video: 15 Ways To Stay Safe and Prevent Coronavirus  thecitypulsenews.com/video-15-ways- …,https://t.co/Qtgx3rzgHU,1241877288062537736
TheMMChief,2020-03-22T23:59:53.000Z,"We finally are testing.  BTW - There are RIGHT NOW likely 330,000 infected in America. To double by May... newsweek.com/coronavirus-co …",https://t.co/hfBLAuPMAp,1241877287928303617
kenzie_bales,2020-03-22T23:59:53.000Z,Social distancing won’t keep me from enjoying this absolutely beautiful weather.,,1241877287684825088
kirsty_wilson,2020-03-22T23:59:53.000Z,Newsletter | It's business as usual for this virtual business - in a world that is far from usual amid COVID-19 >>  mailchi.mp/5aa8995f3d47/a …  #virtualassistant #outsourcing #workfromhome,https://t.co/apKiqj1c1x https://x.com/hashtag/virtualassistant?src=hashtag_click https://x.com/hashtag/outsourcing?src=hashtag_click https://x.com/hashtag/workfromhome?src=hashtag_click,1241877287676641280
__LaLechuga__94,2020-03-22T23:59:52.000Z,I mean what better test of love is there? “Will you be willing to quarantine with me 24/7 for the rest of your life?”,,1241877287206825984
SChenHayes,2020-03-22T23:59:52.000Z,"37 million#USA jobs could be lost in the coronavirus crisis and these workers will be the hardest hit, chart shows  marketwatch.com/story/37-milli …  @aiww  @badiucao",https://t.co/PEi41c3Pym https://x.com/aiww https://x.com/badiucao,1241877286665715714
JyamaSuruNa,2020-03-22T23:59:52.000Z,"We are fully aware the situation once govt decided to lockdown cities and self isolating ourself for the greater good of the society, which I guess urs won’t understand, after all, freedom is all that matters to u",,1241877286250414080
DrJustified,2020-03-22T23:59:52.000Z,"Activist groups should be arrested. Releasing ANY detainees during a time of a Pandemic, is irresponsible and promotes a further crisis! These groups think more of immigrants than they do  Border Patrol agents and  Citizens. Arrest them for their irresponsible actions!",,1241877285483032581
KamaNASii,2020-03-22T23:59:52.000Z,@GraysonDolan  Watch this Movie because I don’t want to be the only emotional one during Quarantine....,https://x.com/GraysonDolan,1241877285424291846
cbtuck62,2020-03-22T23:59:52.000Z,Federal law enforcement document reveals white supremacists discussed using coronavirus as a biow...  news.yahoo.com/federal-law-en … via  @Yahoo,https://t.co/pvsIN0ftKW https://x.com/Yahoo,1241877285080190976
suemessina,2020-03-22T23:59:52.000Z,"'If you act selfishly, people will die': Premier's warning to Victorians  abc.net.au/news/2020-03-2 … via  @ABCNews",https://t.co/W7zCtfyFFp https://x.com/ABCNews,1241877284291657729
DJDiveIn,2020-03-22T23:59:52.000Z,"Not only DJs can’t and aren’t getting paid during this lockdown or quarantine but if you don’t have a certain amount of followers, be signed, or know somebody you will get your live ended and cut off. If you not at a certain level you can’t win.",,1241877284006526979
miss_em_caro_re,2020-03-22T23:59:51.000Z,"Broke my 8 day quarantine to get laundry detergent. Bad Idea. Only saw 5 people total, and came across the rudest person I’ve ever encountered. Rude enough to ruin my day.",,1241877283033485317
imperiumsilver,2020-03-22T23:59:51.000Z,"The amount of people that have reached out to me about my PPE, my cousin making me my own cloth mask, and people saying thank you to me is profound.",,1241877282660257794
50shadesofasia,2020-03-22T23:59:51.000Z,the circle predicted social distancing,,1241877282454634499
betonjake,2020-03-22T23:59:51.000Z,Rich people can do whatever they want. How fast a couple days of self quarantine can affect Americans memory on how America works,,1241877281901031424
luckyruneclub,2020-03-22T23:59:51.000Z,Stay at home.    #COVID19 Update:  Country: Tanzania Total Cases: 12 Total Deaths: 0 Total Recovered: 0 Total Active Cases: 12,https://x.com/hashtag/COVID19?src=hashtag_click,1241877281892638721
__Alexandrinaa,2020-03-22T23:59:51.000Z,Wish I was social distancing somewhere peaceful like  on a private island or something,,1241877281305276417
florentino5012,2020-03-22T23:59:51.000Z,More AUDIO info regarding the  COVID-19  instagram.com/p/B-DiOpNHX-4/ …,https://t.co/tIxdh5sc25,1241877281078947843
LoneWolf907,2020-03-22T23:59:51.000Z,And then there's the numbnuts reporter at the president's press conference that tried to contrast  COVID-19 stats to auto deaths!,,1241877280852291585
IndianNewsBuzz,2020-03-22T23:59:51.000Z,NBA Uncertain About Salary Payments After April 1 Amid Coronavirus Lockdown: Report  theindiannewsbuzz.com/2020/03/22/nba …,https://t.co/ez6lJF6ts4,1241877280391081987
_crisssto,2020-03-22T23:59:51.000Z,How tf do u look so good during quarantine meanwhile I look like I got ran over and I’m homeless,,1241877280181239808
itsDjENoc,2020-03-22T23:59:51.000Z,"When your PRE Covid-19 ""SOCIAL DISTANCING"" behavior comes in handy now  Helping to keep my body AND MIND healthy during these tough times #thequarantinechronicles #homegymlife #socialdistancer @ Las Vegas, Nevada  instagram.com/p/B-Dh2dfDh7x/ …",https://x.com/hashtag/thequarantinechronicles?src=hashtag_click https://x.com/hashtag/homegymlife?src=hashtag_click https://x.com/hashtag/socialdistancer?src=hashtag_click https://t.co/IIZpeuTZv8,1241877279950569472
