User_name,Datetime,Content,Links,Tweet_ID
stefansi,2020-12-21T23:59:59.000Z,A mask,,1341171591967879169
FakeYou_Out_,2020-12-21T23:59:59.000Z,Hopefully it ends up that we can actually get the vaccine but !!!!,,1341171590181101568
PeteDurnell,2020-12-21T23:59:59.000Z,"I can't forget a Sky News host, back in April, repeatedly trying to get a government minister to change the government's message from ""Stay at Home"",  - to ""Stay Indoors"".  He refused to do it.  So  @skynews  ran with ""Stay Indoors"" anyway news.sky.com/story/coronavi …  #UtterlyShameful",https://x.com/skynews https://t.co/NJ36WMQdJz https://x.com/hashtag/UtterlyShameful?src=hashtag_click,1341171589698777091
iOptimizeRealty,2020-12-21T23:59:59.000Z,6 Working From Home Tips During the COVID-19 Pandemic #CRE #WFH #COVID-19 #NewNormal #TenantTips      hubs.ly/H0CP79H0,https://x.com/hashtag/CRE?src=hashtag_click https://x.com/hashtag/WFH?src=hashtag_click https://x.com/hashtag/COVID?src=hashtag_click https://x.com/hashtag/NewNormal?src=hashtag_click https://x.com/hashtag/TenantTips?src=hashtag_click https://t.co/ZVubvGX9dG,1341171589140918273
akbrendarobert,2020-12-21T23:59:58.000Z,Why are we giving money to ANY foreign country in a bill to help Americans re: COVID? This is shameful on the part of both parties & Americans are getting screwed. $600 is an insult & both parties are complicit in screwing over Americans & getting rich in the process.,,1341171587697950722
elendirG,2020-12-21T23:59:58.000Z,"Thread by  @trvrb : With #COVID19 vaccine efficacy of ~95%, I'm looking forward to vaccine distribution in 2021 bringing the pandemic under control. However, I'm concerned that we'll see antigenic drift of SARS-CoV-2 ...…  threadreaderapp.com/thread/1340409 …",https://x.com/trvrb https://x.com/hashtag/COVID19?src=hashtag_click https://t.co/PJ8TbIUBiv,1341171587622596609
garydans,2020-12-21T23:59:58.000Z,I wonder if the people who still support Dan have read the independent reports on the contact tracing and hotel quarantine ? Or do they just listen to spin and propaganda?,,1341171586116669440
MaryCLong,2020-12-21T23:59:58.000Z,"Top story: Washington, DC Anchor Shares How His Mother’s Funeral Became Covid Superspreader Event | TVSpy  adweek.com/tvspy/washingt …, see more  tweetedtimes.com/v/296?s=tnp",https://t.co/HeEEaJL0e9 https://t.co/r9wmKlhJjm,1341171585319890944
SophieM66155839,2020-12-21T23:59:58.000Z,Thankyou  @BJG  and  @KyleKulinski   For standing with those of us who don't have healthcare during a pandemic! I appreciate both of your voices on this #ForceTheVote #MedicareForAllNow,https://x.com/BJG https://x.com/KyleKulinski https://x.com/hashtag/ForceTheVote?src=hashtag_click https://x.com/hashtag/MedicareForAllNow?src=hashtag_click,1341171585235992576
RealDesmondRyan,2020-12-21T23:59:58.000Z,A message worth hearing: A COVID-19 Admonition ***EXPLICIT  youtu.be/e0-2XxgHIXk #StayHome  @HelenORahilly,https://t.co/KKPjkriJyY https://x.com/hashtag/StayHome?src=hashtag_click https://x.com/HelenORahilly,1341171584879517699
JustinWelham,2020-12-21T23:59:57.000Z,Then you dont need to take the vaccine then,,1341171582975164416
TerrySam123,2020-12-21T23:59:57.000Z,Of course she is alive now. Antivaxxers are just pissed that she didn’t die from the vaccine. They would have eaten that shit up like a Snickers bar if she did.,,1341171581955964928
buckfynn,2020-12-21T23:59:57.000Z,"Infuriating COVID-19 ‘stimulus’ bill is loaded with billions in aid… for Sudan, Egypt, Ukraine, and others... Peasants Receive Measly $600   noqreport.com/2020/12/21/inf …",https://t.co/Z016KXx3tc,1341171580961914882
Heyy_Its_Zakkk,2020-12-21T23:59:57.000Z,"I would like to travel in a covid-free world , please",,1341171580467077121
TheRealKiyy,2020-12-21T23:59:57.000Z,I’m a 21 year old college student paying off college tuition loans and other bills I’ve been out of work since the pandemic started and would really appreciate it if you could help me out #KKWHoilday,https://x.com/hashtag/KKWHoilday?src=hashtag_click,1341171580056051715
redisadd,2020-12-21T23:59:57.000Z,"When Biden is sworn into office Jan. 20, the list of crises he will face includes:  A massive Russian cyber intrusion,  A still-raging global pandemic,  A slowing economic recovery &  A lingering reckoning over US racial tensions.  #TrumpCarnage  washingtonpost.com/politics/trump …",https://x.com/hashtag/TrumpCarnage?src=hashtag_click https://t.co/cETGwSVbsw,1341171579720409088
eb454,2020-12-21T23:59:57.000Z,Just in case you were wondering...  townhall.com/tipsheet/bethb …,https://t.co/e0SJ40HvNm,1341171579644825600
drillanwr,2020-12-21T23:59:56.000Z,‘They hate you’: Coronavirus stimulus bill includes no less than $10 million for ‘gender programs’ in Pakistan  twitchy.com/brettt-3136/20 … via  @twitchyteam,https://t.co/n4wTcn0iVJ https://x.com/twitchyteam,1341171579506601991
AhmadDavisPR,2020-12-21T23:59:56.000Z,Prayers up for Famous Dex   In our interview this year he told me that the only silver lining about Quarantine was that he was able to spend time with his kids and focus on being healthy.  I’m happy he’s taking the time to get the help he needs,,1341171579498184704
rtgabriel2,2020-12-21T23:59:56.000Z,"Senator Rubio got his vaccine already... I thought you're supposed to give the vaccine to the old ventriloquist, not the puppet youtube.com/watch?v=2Z1vq3 …",https://t.co/VlWgWcWcgC,1341171578902630402
genadamedia,2020-12-21T23:59:56.000Z,Congress Reaches Deal On $900 Billion COVID-19 Relief Package | TODAY genadamedia.com/video?vid=M5gF …,https://t.co/Ou2NB63DsF,1341171578588049415
lukeinlac,2020-12-21T23:59:56.000Z,And to think a month ago it was left for dead because it was only a “COVID stock”,,1341171578189430784
RobStaback,2020-12-21T23:59:56.000Z,I doubt he can even spell “vaccine”.,,1341171577493233665
cramsay2010,2020-12-21T23:59:56.000Z,If they're recovered and being treated for something else they are not counted as a covid case.,,1341171576163737601
bhargavi_peddi,2020-12-21T23:59:55.000Z,"Given the conditions in the State due to mismanagement of Coronavirus,the 3-Capitals move seemed profoundly ill-timed with plummeting industrial & agricultural output, rising unemployment, and collapsing education and healthcare systems. #371DaysOfAmaravatiProtests #SaveAmaravati",https://x.com/hashtag/371DaysOfAmaravatiProtests?src=hashtag_click https://x.com/hashtag/SaveAmaravati?src=hashtag_click,1341171575060455426
sko_pi,2020-12-21T23:59:55.000Z,Sounds like pandemic emergency inventory to me and likely to be out,,1341171574859321345
realsb4feelings,2020-12-21T23:59:55.000Z,Nobody is dying of covid.. Its only in your mind  Now go away,,1341171574481797120
precioushyunn,2020-12-21T23:59:55.000Z,I BE IN PUBLIC UNDER THE MASK JUST GRRRRRRR LOL,,1341171572879572994
stevetwilightim,2020-12-21T23:59:55.000Z,"HAVE A MERRY LIL XMAS-ONLY 3 TO 6 FAMILY MEMBERS  WEAR YOUR FACE MASK  STOP SPREAD OF DEADLY CONTAGIOUS COVID VIRUS   BE A PATRIOT !  SAVE & PROTECT THOUSANDS OF YOUR FRIENDS' LIVES, YOUR MOTHER OR FATHERS LIFE, YOUR GRANDMAS' LIFE, YOUR AUNTS' & UNCLES' LIVES...   BE A HERO !",,1341171572032352257
milletmedia,2020-12-21T23:59:54.000Z,#Greece sees drop in daily #COVID-19 cases  milletnews.com/view.php?id=19 …,https://x.com/hashtag/Greece?src=hashtag_click https://x.com/hashtag/COVID?src=hashtag_click https://t.co/3V0u5eLM5e,1341171571155726338
Ben2b23,2020-12-21T23:59:54.000Z,Why the hell is this part of a COVID relief bill. That’s the bigger question,,1341171571105394690
Gummbyman32,2020-12-21T23:59:54.000Z,New Jersey Set To Open Virus Vaccine 'Mega-Sites' | Morning Joe | MSNBC  youtu.be/wfg8vHOsh4E via  @YouTube,https://t.co/Wmmwdt1FPW https://x.com/YouTube,1341171571054899200
Udfredii,2020-12-21T23:59:54.000Z,The government also said stay at home. You decided to travel in a pandemic and want the government to test you on your way back?,,1341171567997427712
scottish_brit,2020-12-21T23:59:54.000Z,Does it take the vaccine into account?,,1341171567863205888
kathneedsabath,2020-12-21T23:59:53.000Z,Thinking about the giant Star Wars themed wedding my uncle went to in the middle of a big covid surge in South Carolina where the groom wore a maga hat and for their first dance the groomsmen circled around the couple and lifted red lightsabers above their heads,,1341171566088843264
asheborn57,2020-12-21T23:59:53.000Z,Watch: Joe Biden Makes Admission About Trump and the Vaccine That He Should Have Long Ago (but Didn't)  redstate.com/sister-toldjah …,https://t.co/AvQsBmgmml,1341171565367582721
Moon_bright_,2020-12-21T23:59:53.000Z,"which means that the vaccine also need ""change """,,1341171565203841026
slayser8,2020-12-21T23:59:53.000Z,My fiancé told me he got a headache from the vaccine and then admitted he didn’t have any coffee that day (which gives him a headache on a normal day),,1341171565170487304
Sir_Ruffy,2020-12-21T23:59:53.000Z,"Locking down restaurants is a mistake. Enforce marks and social distancing, and keep the small economy running.",,1341171564553887744
JRHorsting,2020-12-21T23:59:53.000Z,We're #1 in Covid & Crazy Presidents!,,1341171564448911360
emo_amu,2020-12-21T23:59:53.000Z,omg Debra & Brenda have covid  they can’t taste the boots they’re deepthroating,,1341171564214140928
WeemsRw81504398,2020-12-21T23:59:53.000Z,Enough said: UK coronavirus variant may be more able to infect children: scientists: #COVID19 #COVID #teaching   aol.it/3nFlJwF via  @AOL,https://x.com/hashtag/COVID19?src=hashtag_click https://x.com/hashtag/COVID?src=hashtag_click https://x.com/hashtag/teaching?src=hashtag_click https://t.co/GExxyqHs7j https://x.com/AOL,1341171564058959875
AmeliaBee7,2020-12-21T23:59:53.000Z,Exactly! I hardly notice I’m wearing one now and I instinctively make sure I have one on me when I go out. Such a small gesture that is nothing compared to the risk of Covid. Such a no-brainer! WEAR A MASK!!,,1341171563882717186
_celia_bedelia_,2020-12-21T23:59:52.000Z,They’ll get it next year!  Side note: I KNEW this was what they were gonna do with more covid relief - attach it to the appropriations bill.,,1341171562360287232
mochimich_,2020-12-21T23:59:52.000Z,Getting hit on in Viet at your COVID tested by someone who’s learning Viet,,1341171561684877312
mrdabakkle,2020-12-21T23:59:52.000Z,Were experts anti mask or wete they just wanting to reserve medical masks for healthcare workers and the efficacy of homemade masks were nor known.,,1341171560871288837
victoriam444,2020-12-21T23:59:52.000Z,It’s funny how they find a COVID vaccine in only a year but can’t find a cure to cancer,,1341171559524950018
jmarquiso,2020-12-21T23:59:51.000Z,Spreading COVID to own the Libs,,1341171556492328960
Jackshar,2020-12-21T23:59:51.000Z,During covid and brexit this is a little welcome humour,,1341171556412780545
mochalattepeggy,2020-12-21T23:59:51.000Z,The Class of 2020 was royally fucked by both the pandemic and Congress. #CollegeStudentsDeservedBetter,https://x.com/hashtag/CollegeStudentsDeservedBetter?src=hashtag_click,1341171555808776193
MamathebestBear,2020-12-21T23:59:51.000Z,Vote no! We don’t want foreign aid!!! Covid relief for Americans only,,1341171555523543040
Ony_JJ,2020-12-21T23:59:51.000Z,"Brother has coronavirus, Christmas away from home a possibility D:",,1341171555309662213
taylor_lesyk,2020-12-21T23:59:51.000Z,Either Katie or Cassidy said that the 19 vaccine works for 20,,1341171554995068928
Zendoc3,2020-12-21T23:59:51.000Z,Thanks for your great work. Finding it hard to accept 'all in this together' the longer this Pandemic goes on. Each state Premier is trying to 'out-do' each other. Each State for themselves?,,1341171554915287040
4gettispaghetti,2020-12-21T23:59:51.000Z,Bitch draw lips on the mask,,1341171554537807872
matt41985428,2020-12-21T23:59:50.000Z,"I just wanna know why it would be a fake vaccine, please someone explain it to me.",,1341171554084859906
BordenJoel,2020-12-21T23:59:50.000Z,I agree the extremely elderly should get the vaccine first.,,1341171553854251010
GovernerSlugwel,2020-12-21T23:59:50.000Z,I saw it. It’s sad to know the male@lead was taken by Covid... it was his last work,,1341171553753546752
ngamtnterry,2020-12-21T23:59:50.000Z,@RepMoBrooks  Did you vote for this Covid assistance bill?  I pray you did not!,https://x.com/RepMoBrooks,1341171553258582018
genticici,2020-12-21T23:59:50.000Z,That’s where 99.99% of 5400 pages are not really related to COVID.,,1341171553065693187
Korry,2020-12-21T23:59:50.000Z,"As stated. 3 Wrongs do not make a right. What do we do with next mutation, and the next, and the one after that? Lockdown, lockdown, lockdown?  Not realistic. Not what we need or want. Not healthy. Move funds into health and LTC, vs handouts, and open up the province.",,1341171552981839876
Titslegendary,2020-12-21T23:59:50.000Z,"Please, for the love of all that is good, do not devalue our money anymore by passing this coronavirus stimulus package. Just let us go back to work and live a normal life.",,1341171552981663744
ECryptyd,2020-12-21T23:59:50.000Z,I don't think she realizes what a valuable conversation she provided me with. Ive been thinking this all day. She expressed regret that her favourite local businesses were so far away & how with Covid she doesn't want to go too far. 7/,,1341171551987585026
grandtheftautee,2020-12-21T23:59:50.000Z,All of discovery and enterprise have to get tested  they were all so upset that they are stuck on the unit until we know if anyone else has covid. Two staff tested positive,,1341171551882731520
medicinehelp,2020-12-21T23:59:50.000Z,"Ford announces province-wide lockdown in Ontario, says it’s a ‘one-time’ COVID-19 measure  communityassistance.press/ford-announces …",https://t.co/9Tc13BJ3cp,1341171551111008256
MeetingExpert13,2020-12-21T23:59:50.000Z,@SalVulcano  I need to know more about the painting behind you in every episode of #JokersDinnerParty Tks for making us laugh during the quarantine! #ImpracticalJokers,https://x.com/SalVulcano https://x.com/hashtag/JokersDinnerParty?src=hashtag_click https://x.com/hashtag/ImpracticalJokers?src=hashtag_click,1341171551056629760
GerComiskey,2020-12-21T23:59:50.000Z,"@gerlawlor , I know a few people who are still very sick with Covid.",https://x.com/gerlawlor,1341171550989508608
JohnMarron2,2020-12-21T23:59:49.000Z,"Going to see my 86 yr old dad.should I tell him you, a healthy 32 year old, took his vaccine?",,1341171548418355201
DavidSm97429860,2020-12-21T23:59:49.000Z,We should be low. Inslee requires a checkin and mask to take a dump.,,1341171548405653504
Edwouldnot,2020-12-21T23:59:49.000Z,"Whether patient zero are air crew, diplomats, politicians, actors, sports persons or any other of the thousands of quarantine exemption that our “leaders” have allowed to wander mask free ... there’s definitely cover up and failure here.  No exemptions.",,1341171547071889408
DennisKendel,2020-12-21T23:59:48.000Z,Outbreak declared for Saskatoon police platoon after 2 COVID-19 cases | CBC News  cbc.ca/news/canada/sa …,https://t.co/WJXZUvMZ1T,1341171545964650498
Ukeh8,2020-12-21T23:59:48.000Z,"Not surprised we dont have a proactive govt, now de will start bringing several lockdown measures, 500billion naira will be released for their chilling, then finally they will lie the final lie of sharing 100million in 5days....so we are not surprised.",,1341171544815521792
NinPotato1,2020-12-21T23:59:48.000Z,The bullshittery continues.  This lady straight up had fucking covid as she was interviewing me.  That's what she was sick with! She even admitted to working two days she shouldn't have! THEY WANT ME TO COME MEET THE OWNER IN PERSON TOMORROW,,1341171543532040192
pleiades_jpeg,2020-12-21T23:59:48.000Z,this pandemic sucks or else i would have visited u in san mo randomly again,,1341171543230078978
BMirauta,2020-12-21T23:59:47.000Z,UK scientific reports indicate that this is likely a more transmissible variant. Not saying that media does not drive hysteria sometimes.,,1341171541778849797
HappyHeretic2,2020-12-21T23:59:47.000Z,They're currently trying to buy their way to the front of the vaccine line too.,,1341171541329862656
fruitvalelocal,2020-12-21T23:59:47.000Z,Before urging anyone to Vote No here's what's actually in the bill. Decide on facts & not anti Pelosi rhetoric. cnn.com/2020/12/20/pol …,https://t.co/41HPxDt7C1,1341171540981780485
AdrianAnnMiller,2020-12-21T23:59:47.000Z,So how does that work with a blind trial? Do they now tell people that were part of it whether they already got the vaccine?,,1341171540407189504
writerspec,2020-12-21T23:59:47.000Z,Lockdown will meet you there,,1341171539945906177
VE3ZKS,2020-12-21T23:59:47.000Z,How did #LittleMarco qualify for an expedited #covid19 vaccine jab?,https://x.com/hashtag/LittleMarco?src=hashtag_click https://x.com/hashtag/covid19?src=hashtag_click,1341171539643932674
RenscoExecutive,2020-12-21T23:59:47.000Z,One hundred and twelve new cases of COVID-19 confirmed to Rensselaer County Health Department on Monday. County announced death of a 61-year-old Sand Lake man and the death of an 88-year-old East Greenbush man: the county's 75th and 76th COVID-19 deaths:  facebook.com/rensselaercoun …,https://t.co/fqusrtwPGl,1341171538343710720
HenryWHall,2020-12-21T23:59:47.000Z,"Covid deaths in the US every 6 hours? Also no, apparently.",,1341171537811038208
luvto3putt,2020-12-21T23:59:46.000Z,"Funny how all these politicians are getting the COVID-19 vaccine shot before health care workers, teachers, first respondes..  So many of them that are two-face that's right taking about you  @AOC  who said they won't get a shot that   @realDonaldTrump  was able to get done!",https://x.com/AOC https://x.com/realDonaldTrump,1341171535617265667
laragrrrl,2020-12-21T23:59:46.000Z,Ah thats good news! I assumed it wouldn't be possible bc covid but thats made my day,,1341171534518489089
hunter_riker,2020-12-21T23:59:45.000Z,That is a good argument. And I think one of the dlcs gives you a variant that has magic power fists,,1341171532744286209
Chadmandudeguy,2020-12-21T23:59:45.000Z,"Consider that one socialist policy is offering the COVID vaccines for free, without which many poor people would be unable to buy. Your meme account is fine, but I think you can do better",,1341171532106756097
lilpillowcase1,2020-12-21T23:59:45.000Z,there’s a new covid strain?  Nigga what in the fuck,,1341171531875975168
H2Ninja,2020-12-21T23:59:45.000Z,Australia coronavirus live: Gladys Berejiklian to give Covid update amid pressure on NSW to tighten restrictions  theguardian.com/australia-news …,https://t.co/Poqp5IJgjB,1341171531544555521
Awillz4,2020-12-21T23:59:45.000Z,Not a new strand of corona already...this COVID got more updates than iPhone....,,1341171530894602241
Steve_Bohnel,2020-12-21T23:59:45.000Z,"Really good work from over the weekend via  @greg_swatek  on what a pair of ICU nurses at Frederick Health Hospital are experiencing, in a pandemic.  fredericknewspost.com/news/continuin …",https://x.com/greg_swatek https://t.co/1er5sXOkWL,1341171530810728448
BrianKingNeo,2020-12-21T23:59:44.000Z,Should they be getting the vaccine at this stage? Maybe when it opens up to the public they could be high profile earlier adopters?,,1341171529275609090
elizabiiiitch,2020-12-21T23:59:44.000Z,"Glorious, I got the first dose of the covid vaccine at work  hbu?",,1341171529057484800
Shaswar24,2020-12-21T23:59:44.000Z,covid 20 pro max coming soon,,1341171529028169728
GordDavison,2020-12-21T23:59:44.000Z,"Never heard of it, now I have. Hope he recovers weforum.org/agenda/2020/11 …",https://t.co/3fWAcYZNKG,1341171528851984384
matrina2641,2020-12-21T23:59:44.000Z,"I keep saying theres a business in it! Get yourself hairbands, nipple cream, lip balm, so many facemasks, one handed snacks, must spray, hair bobbins, hand cream and a watter bottle with a straw. And so many gorgeous shampoos and conditioners!  Lockdown is hard on new mams 1/2",,1341171528826826752
Up0naStar,2020-12-21T23:59:44.000Z,Got upset for ages because I haven’t accomplished anything this year. It took me ages to remember I actually graduated this year. I managed to finish my 3rd year of uni in the middle of a pandemic. And I just forgot about that... how strange,,1341171527614652417
statepress,2020-12-21T23:59:44.000Z,The project will share the stories from anonymous ASU workers about their experiences with the University during the COVID-19 pandemic.  statepress.com/article/2020/1 …,https://t.co/UKmBCjmwv3,1341171527140536322
MgoKevin517,2020-12-21T23:59:44.000Z,I don't want to wear a mask and you can't make me !!!!!,,1341171526725378048
corpse180,2020-12-21T23:59:44.000Z,"Mutant covid. Honestly give it rest with the bullshit for once, it’s beyond a joke now",,1341171526666752000
ReprtrPatHealey,2020-12-21T23:59:44.000Z,"The cold storage sites will be at the Cape Breton Regional Hospital, Colchester #EastHants Health Centre, Valley Regional Hospital, and Yarmouth Regional Hospital. #Truro #COVID19 #COVID19vaccine  thelaker.ca/four-more-covi …",https://x.com/hashtag/EastHants?src=hashtag_click https://x.com/hashtag/Truro?src=hashtag_click https://x.com/hashtag/COVID19?src=hashtag_click https://x.com/hashtag/COVID19vaccine?src=hashtag_click https://t.co/ARiwYwreRC,1341171526368948225
fox11news,2020-12-21T23:59:43.000Z,"While financial relief in the form of a second stimulus package could soon be on its way, the Wisconsin Restaurant Association says nearly 50% of restaurants could close until the #pandemic passes.  fox11online.com/news/local/wis …",https://x.com/hashtag/pandemic?src=hashtag_click https://t.co/np5fU7w9zW,1341171524317933570
footballmom2754,2020-12-21T23:59:43.000Z,@SpeakerPelosi  I can’t believe that you got the vaccine before front line workers & elderly!  Doesn’t surprise me because you have never cared about anybody but yourself!  You have done nothing for us for 8 months but you jumped the line! BITCH!,https://x.com/SpeakerPelosi,1341171523525197825
Michellemonkey4,2020-12-21T23:59:43.000Z,Covid deniers and anti-maskers should be last to get any vaccine,,1341171523172888578
DrMegVarvoutis,2020-12-21T23:59:43.000Z,What's new | COVID-19 Treatment Guidelines  covid19treatmentguidelines.nih.gov/whats-new/,https://t.co/bZp6wNnbwM,1341171521834856451
ChadPergram,2020-12-21T23:59:43.000Z,Pelosi to Hse Dems on COVID pkg: We advance this bill today as a first step. We have new hope which springs from the vaccine and from the commitment President-elect Biden has to following science. We are ready for the next step.,,1341171521470009345
conservbrownman,2020-12-21T23:59:42.000Z,"Bullshit, Ontario would never have reopened for Christmas from a hard lockdown implemented in late October or November. The public health people and leftists would've said ""let's not reopen until cases are near zero"".   Even the lockdown starting on December 26 will be extended.",,1341171518898880512
JakeAAdler,2020-12-21T23:59:42.000Z,"Last time I commented on a republican club holding a bash during the pandemic it was a thing  ... well what the hell this is reckless , selfish and shameful",,1341171518143926272
CentralGirlsFA,2020-12-21T23:59:42.000Z,"Central 13’s finished the ‘friendly’ league with a 100% record, in difficult times we had to chop & change the team to suit COVID every girl done the club proud. We recognise that all teams had similar issues, thanks for getting games on. Here’s to a less eventful ‘21 Merry Xmas",,1341171517946736640
Beckimus_Rex,2020-12-21T23:59:42.000Z,Obamacare 2: covid boogaloo,,1341171517632081920
amalabdu86,2020-12-21T23:59:42.000Z,Why is Space force getting $2 billion in a stimulus bill? Is there a plan to send covid Out to Space???   t.co/hqb7Afztnh,https://t.co/hqb7Afztnh,1341171517585965057
Air_Rhodesia,2020-12-21T23:59:42.000Z,"Ilhan Omar slams lawmakers including AOC for getting COVID vaccines ahead of elderly, frontline workers.",,1341171517166501889
KurtKatzenberge,2020-12-21T23:59:40.000Z,Day one we will be prepared to take more of your rights away we have using the pandemic and voter rights to steal your latest election and economic rights. Dems are here to f$ck you good in name of dem science,,1341171511059767298
kteforreal,2020-12-21T23:59:40.000Z,And people are worried about what's in the Covid vaccine?,,1341171509369466882
nat_laboss,2020-12-21T23:59:40.000Z,"Might be more likely to get it from an individual covid + patient on a non covid floor than an individual covid + pt in covid unit, but overall your pts have a lower risk of having covid.  Also many schools are vaccinating their preclinical students, who see very few pts",,1341171508354437121
atkjarv,2020-12-21T23:59:39.000Z,"And you  @marcorubio  are essential how exactly? Shouldn't that vaccine be given to the nurses, doctors, healthcare people instead?",https://x.com/marcorubio,1341171507163254784
brianlilley,2020-12-21T23:59:39.000Z,Got my supplies. Ready for the lockdown.,,1341171507029000195
nobby15,2020-12-21T23:59:39.000Z,Couch jumps to COVID rants: Tom Cruise has always been a bit bizarre | The New Daily  thenewdaily.com.au/entertainment/ …,https://t.co/xey4aaa99q,1341171506529759233
tyler_is_comedy,2020-12-21T23:59:39.000Z,Can’t wait to blaze up that new strain of COVID and get more dead than I’ve ever been before,,1341171505800110080
timeToThinkOf,2020-12-21T23:59:39.000Z,It’s the 2021 Appropriations Bill for all U.S.  appropriations — with a section for coronavirus. See TOC page 3: Divisions M and N.,,1341171505699446787
MandyMRush,2020-12-21T23:59:39.000Z,Drinking an 12th Night Variant Thin Mint by  @LCCB_FarmBrews  at  @LCCB_FarmBrews  —  untp.beer/s/c977732293,https://x.com/LCCB_FarmBrews https://x.com/LCCB_FarmBrews https://t.co/GBq5ppVaz9,1341171505657425922
