User_name,Datetime,Content,Links,Tweet_ID
cloneposter,2020-09-30T23:58:13.000Z,They say #The100Finale was finished in the nick of time before the COVID hit. I hope that doesn’t mean Jason Rothenberg and his people made a #SupergirlCW 5X19 disaster of it,https://x.com/hashtag/The100Finale?src=hashtag_click https://x.com/hashtag/SupergirlCW?src=hashtag_click,1311455339745816577
x_WolfMan_41,2020-09-30T23:58:13.000Z,"Here in Colorado, and let me fucking tell you. They don't give a FUCK about covid. So don't let the media sway you that WI is so anomoly lmao",,1311455339267620864
HermanJamer,2020-09-30T23:58:12.000Z,cuz of covid :-p,,1311455337417973764
SoiledUnderoos,2020-09-30T23:58:12.000Z,They'll need to stop testing positive for Covid first...,,1311455336289595392
angie_roo2,2020-09-30T23:58:12.000Z,"Rates in my area are climbing steeply. Latest forecasts are that, unless something radically changes, there is a 75-100% chance of me living in a Covid hotspot within next 2 weeks. Our county has been mainly spared. It’s coming our way. We have 1 not-very-large hospital.",,1311455336101019648
Mike_Sammon,2020-09-30T23:58:12.000Z,Thank you for this. I appreciate your views and they test my belief but I’m afraid I still can’t support indefinite period of restrictions until/if a vaccine comes along as there are far too many left behind with a mental health and economic crisis brewing I feel.,,1311455335643787264
B_Dogs4,2020-09-30T23:58:11.000Z,"Beaver County, PA: Hopewell, Freedom students test positive for covid-19, superintendents say  *Miller said that the district will focus additional attention on cleaning and sanitizing rooms in which the student was present.*  triblive.com/local/regional …",https://t.co/rgOiGQBWYK,1311455333529907201
SpotlightMag12,2020-09-30T23:58:11.000Z,"China's most popular holiday travel destination is in Wuhan, the one-time COVID epicenter  upflow.co/l/L1Fq",https://t.co/miQAQwLZRQ,1311455332028346368
dedwylder_8,2020-09-30T23:58:11.000Z,You're worse than Trump. Covid-19 super spreader,,1311455331994697733
sofiartmedia,2020-09-30T23:58:11.000Z,"Hanukkah Lights Festival Holiday Menorah Card 40% Off Cards, Invitations, Stickers & Labels #zazzle #winter #Invitations, #holiday #decoration #snowflakes #Christmas2020  #hanukkah #watercolor #art #mask #cards #stickers #tag #label #gifts   zazzle.com/hanukkah_light … via  @zazzle",https://x.com/hashtag/zazzle?src=hashtag_click https://x.com/hashtag/winter?src=hashtag_click https://x.com/hashtag/Invitations?src=hashtag_click https://x.com/hashtag/holiday?src=hashtag_click https://x.com/hashtag/decoration?src=hashtag_click https://x.com/hashtag/snowflakes?src=hashtag_click https://x.com/hashtag/Christmas2020?src=hashtag_click https://x.com/hashtag/hanukkah?src=hashtag_click https://x.com/hashtag/watercolor?src=hashtag_click https://x.com/hashtag/art?src=hashtag_click https://x.com/hashtag/mask?src=hashtag_click https://x.com/hashtag/cards?src=hashtag_click https://x.com/hashtag/stickers?src=hashtag_click https://x.com/hashtag/tag?src=hashtag_click https://x.com/hashtag/label?src=hashtag_click https://x.com/hashtag/gifts?src=hashtag_click https://t.co/oPfSvhgNIr https://x.com/zazzle,1311455330895900672
CoffeeBeBestest,2020-09-30T23:58:10.000Z,"Normally, I'd agree with you but Trump let COVID get out of hand.  AND, more importantly, his supporters were cool w old people dying from it... And old people are his backup base.",,1311455329599647744
nightcheese86,2020-09-30T23:58:10.000Z,"I have a basket of them by the door and still forget 1/2 times. It used to be wallet phone keys, now add mask",,1311455329050337280
asterismosjk,2020-09-30T23:58:10.000Z,and dw - im being safe. the theater is empty; im the only one who bought tickets (for me and my sister) which is Unfortunate but good for me bc i dont wanna die of covid,,1311455327758561280
ConrinMichael,2020-09-30T23:58:10.000Z,Covid year every single one of these big sites should be ready to Count a Tuesday game to the week prior.  If not huge misstep by them,,1311455326768689152
coleyvegas,2020-09-30T23:58:09.000Z,We need COVID Nuremberg Trials.,,1311455323509514241
BeckyZalesnik,2020-09-30T23:58:09.000Z,Big Thank You to Dr. Dan (Lung  Specialist) from Chicago for taking the time to share about being on Covid frontlines and Med Careers w our @KHSPanthers STEM kids today.  If You Can See It You Can Be It. #SheldonSTEM,https://x.com/hashtag/SheldonSTEM?src=hashtag_click,1311455323010539520
avgnsdave,2020-09-30T23:58:08.000Z,First new COVID-19 case in a week  cjls.com/2020/09/30/fir …,https://t.co/G7yTV0UeBq,1311455320674312195
torwinaction,2020-09-30T23:58:07.000Z,"Worse numbers..??maybe because they are opening massive numbers of testing stations, and most of these are asymptomatic? Even the President of Nigerua said goats and papaya tested positive!",,1311455314395488256
RE_sports,2020-09-30T23:58:07.000Z,Twin Valley's football team has been shut down after the school district learned Wednesday that a football player at the school is exhibiting coronavirus symptoms. readingeagle.com/sports/high-sc …,https://t.co/46dCngiWRI,1311455313984475143
callmeFission,2020-09-30T23:58:07.000Z,My abs just got back from their quarantine vacation and now they’re leaving again,,1311455313644544000
realSashaBella,2020-09-30T23:58:06.000Z,"@realDonaldTrump  NO HATE, NO LIES, NO RIOTS, NO COVID CAN'T STOP PRESIDENT  TRUMP. GOD AND WE THE PEOPLE ARE WITH YOU MR PRESIDENT!  #TRUMP2020@LANDSLIDE",https://x.com/realDonaldTrump https://x.com/hashtag/TRUMP2020?src=hashtag_click,1311455312466108422
szeer,2020-09-30T23:58:06.000Z,Covid Tracking is a big problem. We don’t have stats from his rallies.,,1311455311392198656
InRoyWeTrust1,2020-09-30T23:58:06.000Z,So much for social distancing,,1311455311199457282
cjguerrero,2020-09-30T23:58:06.000Z,Quarantine hair is long enough to put in a ponytail. Next stop: top knot,,1311455311199236096
bprophetable,2020-09-30T23:58:06.000Z,Where is the Expert Medical Team that should be running #Quarantine??,https://x.com/hashtag/Quarantine?src=hashtag_click,1311455310452719616
paul_manley,2020-09-30T23:58:05.000Z,High af just in time for the South Park pandemic special,,1311455308414423040
senselessrenee,2020-09-30T23:58:05.000Z,"I’m between covid, memories and demand",,1311455308355694593
TeamYouTube,2020-09-30T23:58:05.000Z,"We review appeals 24/7, but due to COVID-19’s impact on our teams & extended workforce, we're experiencing delays. We'll notify you once we finalize the decision. Appreciate your patience.",,1311455307462254592
HarunMaruf,2020-09-30T23:58:05.000Z,WHO chief urges more countries to join COVAX vaccines facility as Covid19 death toll exceeds 1 million,,1311455307328090113
WISN12News,2020-09-30T23:58:05.000Z,Milwaukee County medical examiner says state's coronavirus death count too high,,1311455306862518272
LiveConsumer,2020-09-30T23:58:05.000Z,"If data has a problem and is not swiftly corrected, then #healthcare would have issues. #health #COVID19 #pandemic #consumerlive",https://x.com/hashtag/healthcare?src=hashtag_click https://x.com/hashtag/health?src=hashtag_click https://x.com/hashtag/COVID19?src=hashtag_click https://x.com/hashtag/pandemic?src=hashtag_click https://x.com/hashtag/consumerlive?src=hashtag_click,1311455305662775296
Neevmedianews,2020-09-30T23:58:04.000Z,Coronavirus Deaths Pass One Million Worldwide  neevmedia.co.in/coronavirus-de …,https://t.co/n7xfL49rS2,1311455304605892609
COVID19LiveNow,2020-09-30T23:58:04.000Z,Global toll: Deaths from coronavirus hit 1 million  covid19globalcases.com/global-toll-de …,https://t.co/Sl3QkwD6mU,1311455304362659840
_DFlynn,2020-09-30T23:58:04.000Z,"Trump had a GREAT economy until the pandemic hit, so...",,1311455304165584896
johnnyt54,2020-09-30T23:58:04.000Z,Pence stopped CDC from extending cruise ban into 2021: Axios - Business Insider  businessinsider.com/pence-banned-c …   Is there no end to how much this administration wants Covid-19 to spread?!?,https://t.co/NxJgQUEqO4,1311455303855079424
fckimweird,2020-09-30T23:58:04.000Z,If I hear “ we’re in the middle of a pandemic” one more time in regards to a bill imma cuss,,1311455302672318465
sophienovus,2020-09-30T23:58:04.000Z,Going to be livetweeting the Pandemic Special in ~3 minutes.  #SouthPark,https://x.com/hashtag/SouthPark?src=hashtag_click,1311455302097674240
jbranchini1,2020-09-30T23:58:04.000Z,Jim does the mkt really belong at pre covid levels considering gdp numbers,,1311455301925777410
Pede_Shabazz,2020-09-30T23:58:03.000Z,South Park got a pandemic special bout to come on and im sure its gonna cross every line possible,,1311455300017369094
ArsScience,2020-09-30T23:58:03.000Z,Celebs back away from Trump admin.’s $300M COVID-19 ad campaign  arstechnica.com/science/2020/0 … by  @BethMarieMole,https://t.co/KqMxm52Lgt https://x.com/BethMarieMole,1311455299296002048
arstechnica,2020-09-30T23:58:03.000Z,Celebs back away from Trump admin.’s $300M COVID-19 ad campaign  arstechnica.com/science/2020/0 … by  @BethMarieMole,https://t.co/UtogAtM0UN https://x.com/BethMarieMole,1311455298167635969
JamieYaar,2020-09-30T23:58:02.000Z,"He denied the science, confused the effect and seriousness, people amazingly listen to his ramblings and there you go. Thousands of Citizens returned from hotspots with zero checks, no quarantine and a foggy trump anti mask bullshit political narrative. This isn't that hard.",,1311455295877443585
yhuss72,2020-09-30T23:58:02.000Z,"the NBA bubble has to be one of the best ways to feel any semblance of ""normalcy"" during quarantine...i'd say its pretty normal that the Raptors didnt play the way they could have",,1311455295781179393
nelson_neilson,2020-09-30T23:58:02.000Z,What does having food with your drink have anything to do with covid?,,1311455294866649089
_jb508,2020-09-30T23:58:02.000Z,South Park pandemic special then game 1 of the finals right after? It’s bouta be a great night,,1311455294816387072
noahalatza,2020-09-30T23:58:02.000Z,#LATEST Seaton said 82-year-old resident at Woodmont died Wednesday from the virus.   tristatehomepage.com/news/local-new …  (Via Tristate EN),https://x.com/hashtag/LATEST?src=hashtag_click https://t.co/lkxvrnCIPv,1311455294686474240
adulttamagotchi,2020-09-30T23:58:02.000Z,"But why...this is a staffed event at a place of business, no one gets COVID in those places, only in backyards!",,1311455293369454592
jono_nath,2020-09-30T23:58:02.000Z,"A total distortion of current scientific knowledge on how masks limit contagion during a pandemic. Shows the dangers of an amateur attempting what requires very sophisticated meta-analysis of diverse studies, while ignoring basic scientific facts, here: youtu.be/0Tp0zB904Mc",https://t.co/DVStRp7WpN,1311455292454916096
NZStuffTravel,2020-09-30T23:58:02.000Z,Covid-19: Shakeup for i-Site network could involve Government funding for tier one locations  dlvr.it/Rhhrb6,https://t.co/Y6JbCDQ8Xd,1311455292408832001
TheBryPie,2020-09-30T23:58:02.000Z,"Oh man, all the CW shows that film in Vancouver got shut down due to covid test delays..We're never getting new seasons of shows..",,1311455292358643712
liz_beybey,2020-09-30T23:58:01.000Z,While this is frustrating it is entirely expected...willing to wait for a SAFE vaccine.,,1311455291355983872
adam_lion_123,2020-09-30T23:58:01.000Z,Super thankful for   @nuagebeverages  who is releasing this tape on Friday through his label  @NewVillageTapes ! io was supposed to tour before COVID hit and it is so rad to finally release this music to the world. HUGE props to Matt Nelson for putting this band together,https://x.com/nuagebeverages https://x.com/NewVillageTapes,1311455291003863040
OhheeeeyB,2020-09-30T23:58:01.000Z,The South Park Pandemic special is about to come on!!!,,1311455290785763330
Lifesize,2020-09-30T23:58:01.000Z,"As the world begins to bounce back from COVID-19, your organization will have to make smart, tactical decisions and align business goals with the next normal.  Read on to discover how you can construct a brighter future in the wake of a crisis:  lfsz.vc/3mL1v4K",https://t.co/hJFsX19jfL,1311455290001420292
Pravduh15,2020-09-30T23:58:01.000Z,The reinfected can ALSO spread it to the COVID virgins.   Thus higher saturation is worse not better.,,1311455289598771201
coachfire98,2020-09-30T23:58:01.000Z,A South Park Pandemic Special..I THINK YES!,,1311455289124614145
_BeEnlightened_,2020-09-30T23:58:00.000Z,1. Never Downplayed COVID. It’s been proven the CDC & WHO have provided misleading info. 2. Find ONE instance where Trump says anything about excluding Black people from his plans as President.  I talk about tangibles. Nothing in Trump’s life comes close to the crime bill...,,1311455287669223424
NewsHour,2020-09-30T23:58:00.000Z,The World Health Organization announced nearly $1 billion in new pledges on Wednesday for the effort to battle the coronavirus pandemic and make sure that poor countries get treatments and vaccines against COVID-19.  to.pbs.org/33hPVqc,https://t.co/8kvYscg1q6,1311455287493234688
PaulRev31475758,2020-09-30T23:58:00.000Z,"Asia learned what to do fast during SARS. USA learned in 2016 from EBOLA. Trump and CDC had a playbook, they knew what to do - they knew was airborne, 5-10x deadly vs flu and would infect millions in Feb.    assets.documentcloud.org/documents/6819 …",https://t.co/bLO0EAS6QR,1311455287442890757
PorkNetwork,2020-09-30T23:58:00.000Z,Via  @FJ_PORK : The Iowa Occupational Safety and Health Administration issued a citation to Iowa Premium Beef for a minor record-keeping violation related to COVID-19.  bit.ly/2G0tugr #Swine,https://x.com/FJ_PORK https://t.co/uuLi3zIkBu https://x.com/hashtag/Swine?src=hashtag_click,1311455287015075840
LetranOfficial,2020-09-30T23:58:00.000Z,"ICYMI: Metro Manila will continue to be under General Community Quarantine (GCQ) for the month of October.  Stay safe, Letranites!",,1311455285999935488
HarryDo14624512,2020-09-30T23:58:00.000Z,And the corrupt Trump administration’s impotent response to the pandemic KILLS poor people.,,1311455285547085825
FirstThemNEWS,2020-09-30T23:58:00.000Z,On this afternoon's #HYON news.... #covid19 #OGUN CNN: New York sees startling uptick in Covid-19 cases in Orthodox Jewish neighborhoods. cnn.com/2020/09/30/us/ …,https://x.com/hashtag/HYON?src=hashtag_click https://x.com/hashtag/covid19?src=hashtag_click https://x.com/hashtag/OGUN?src=hashtag_click https://t.co/UHxc27PsbG,1311455284909551617
zdnetasia,2020-09-30T23:58:00.000Z,Singapore touts blockchain use in COVID-19 data management  zd.net/34aIroa,https://t.co/3keIywnbg4,1311455284834041856
_IASPA_,2020-09-30T23:58:00.000Z,It's not March anymore...We're back to chat about reopening schools during a pandemic. What's the same and what's changed in your HR world? Let's chat about that! #IASPAchat,https://x.com/hashtag/IASPAchat?src=hashtag_click,1311455284833873920
afamilyguy,2020-09-30T23:58:00.000Z,My best guess is they did/do a lot more physical distancing and lockdown type of actions,,1311455284338991104
betterauds,2020-09-30T23:57:59.000Z,"This platform is helping people accomplish their learning goals. Meet Danish Khan, Founder of My Learning Guru. #courses #covid #covid19 #covid19pandemic #digitallearning #education #elearning #learnfromhome #learning #learningathome #learningeveryday  betterauds.com/inspirational- …",https://x.com/hashtag/courses?src=hashtag_click https://x.com/hashtag/covid?src=hashtag_click https://x.com/hashtag/covid19?src=hashtag_click https://x.com/hashtag/covid19pandemic?src=hashtag_click https://x.com/hashtag/digitallearning?src=hashtag_click https://x.com/hashtag/education?src=hashtag_click https://x.com/hashtag/elearning?src=hashtag_click https://x.com/hashtag/learnfromhome?src=hashtag_click https://x.com/hashtag/learning?src=hashtag_click https://x.com/hashtag/learningathome?src=hashtag_click https://x.com/hashtag/learningeveryday?src=hashtag_click https://t.co/dZelJiqP8X,1311455283638657026
MasonCoSchools,2020-09-30T23:57:59.000Z,2/2 These parents received a phone call from a Straub teacher or principal. The rest of the school received a one call. We had hoped to not have to utilize this protocol so soon. Masks and social distancing were in place. This move is precautionary.  @WFTMRadio  @MaysvilleNews,https://x.com/WFTMRadio https://x.com/MaysvilleNews,1311455280992079873
EdgyEggplent,2020-09-30T23:57:59.000Z,"Thank god for journos that spoon feed Biden with questions that can be answered always with ""Of course"": ""You do hate violence, even from Antifa, don't you?"", ""You do consider we must keep the country in lockdown another year or two, right?""",,1311455279972782085
TheBigFunk,2020-09-30T23:57:59.000Z,"Can't wait, the  @SouthPark  pandemic special is about to start. They are going to fix the country.",https://x.com/SouthPark,1311455279830175744
MasonCoSchools,2020-09-30T23:57:58.000Z,"1/2 A staff member at Straub tested positive for Covid-19 today. A second verifying test is required. In consultation with the health department, the decision was made to move students in prolonged contact with this person to virtual learning.",,1311455279599570944
martygee56,2020-09-30T23:57:58.000Z,The only vaccine I want is the herd immunity one.,,1311455279486296071
DFSH8150,2020-09-30T23:57:58.000Z,"Over 206,000 Americans have died due to COVID.  Over 7.2 Million  Americans have been infected by COVID.  Over 30 million Americans are unemployed.  What lies about COVID will you be telling Americans today, Mr. President? #WhyIsTrumpStillPlayingGolf?",https://x.com/hashtag/WhyIsTrumpStillPlayingGolf?src=hashtag_click,1311455278345465856
GordonsWord,2020-09-30T23:57:58.000Z,Time for the South Park One Hour Pandemic Special!,,1311455276575404032
ChilliRainbow77,2020-09-30T23:57:57.000Z,"If deep sea projects are uneconomical, why did Equinor drill 2 exploration wells in deep water in 2020 (still out there) during Covid and the resulting crash in oil prices? If it was such a bad economic decision wouldn’t they have walked away?",,1311455275023568902
OccuWorld,2020-09-30T23:57:57.000Z,"Up to half a million sharks could be killed to create global coronavirus vaccines, conservationists warn  reddit.com/user/NationofC …",https://t.co/qHDzyYRtN7,1311455272582356992
Bambam8109,2020-09-30T23:57:57.000Z,It’s a treatment not a vaccine. Jesus.,,1311455272221765635
williammemery,2020-09-30T23:57:56.000Z,"If you want a shirt, or a mask, or a phone case that displays how proud you are to be a Texas Democrat, (designed by yours truly) go get some from the  @podblesstexas  store!",https://x.com/podblesstexas,1311455268333654027
Reblou3Rebecca,2020-09-30T23:57:56.000Z,"Why should you order online when you've already paid for three meals a day? They weren't all ""partying"". Pollock House is mostly international students. They accept the isolation, just want more, better food. You're highly unlikely to catch covid outside, at a distance.",,1311455267138211840
ibuvicki,2020-09-30T23:57:55.000Z,How can a govt funded organisation give themselves a pay rise? Did Scotty cannot them militant unionists holding the country to ranson during this pandemic'?,,1311455266412523520
DinaAKalmeta,2020-09-30T23:57:55.000Z,"Netanyahu: Lockdown will last at least a month, possibly much longer  timesofisrael.com/netanyahu-lock … via  @timesofisrael",https://t.co/YTVEoAijf4 https://x.com/timesofisrael,1311455264969682945
eabra48463,2020-09-30T23:57:55.000Z,quotes from Trump as if they override the actual actions he was taking to fight Covid. They don't. Anyone who watched his daily briefings knows how seriously he and his team were taking Covid. Only brainwashed numbskulls--CNN watchers--believe Trump was doing nothing.,,1311455263560536068
amg_kent,2020-09-30T23:57:55.000Z,"There are different restrictions for different local areas. Unless you plan to travel around the country, you need only know the restrictions that apply in your area. There’s no need for anyone (politicians included) to learn all the differing restrictions. gov.uk/government/col …",https://t.co/c5UTJaWNj1,1311455263296237570
sullivanjeff,2020-09-30T23:57:54.000Z,Feel very strongly the  @SouthPark  pandemic special tonight will be more fruitful than last night's primetime viewing,https://x.com/SouthPark,1311455260951621635
SteveBo37536730,2020-09-30T23:57:53.000Z,"America  This is your ""LAW & ORDER"" President  Telling white supremacist ""Proud Boys""  To STAND BACK AND STANDBY In the Presidential Debate  Be afraid RACE WAR  Please get to the polls And vote AMERICA'S PROUDEST PRESIDENT OUT OF OFFICE  Current US Covid deaths 211,686 10.01.20",,1311455256405069824
BMalley16,2020-09-30T23:57:53.000Z,"All governments have been trying to manage an unknown virus. You can only work with what you know. Too late, too soon, too harsh, too lenient, mask, no masks. Cant win.  I think we haven't done too bad. Deaths were prevented, figures kept down, economy suffers. Cant win.",,1311455255247413249
CrimeWatchMpls,2020-09-30T23:57:52.000Z,"Suspect: Light complexion BM, 40s, black mask, 5'9"", thin build, black jeans. Squad 212",,1311455253427093504
AMC_insurance,2020-09-30T23:57:52.000Z,Reason To Choose AMC are many. Call us to day for all your insurance needs.  We are one stop shop for all insurance solutions #insurance #lifeinsurance #insuranceagent #insurancebroker #covid #healthinsurance #business #carinsurance #autoinsurance #homeinsurance #canada #life #bc,https://x.com/hashtag/insurance?src=hashtag_click https://x.com/hashtag/lifeinsurance?src=hashtag_click https://x.com/hashtag/insuranceagent?src=hashtag_click https://x.com/hashtag/insurancebroker?src=hashtag_click https://x.com/hashtag/covid?src=hashtag_click https://x.com/hashtag/healthinsurance?src=hashtag_click https://x.com/hashtag/business?src=hashtag_click https://x.com/hashtag/carinsurance?src=hashtag_click https://x.com/hashtag/autoinsurance?src=hashtag_click https://x.com/hashtag/homeinsurance?src=hashtag_click https://x.com/hashtag/canada?src=hashtag_click https://x.com/hashtag/life?src=hashtag_click https://x.com/hashtag/bc?src=hashtag_click,1311455253196406790
BrianneSidney,2020-09-30T23:57:52.000Z,Moderna CEO says its COVID-19 vaccine won't be ready until 2021 #SmartNews   cbsnews.com/news/moderna-c …,https://x.com/hashtag/SmartNews?src=hashtag_click https://t.co/uP4FDqZTR0,1311455252906876928
morning_news24h,2020-09-30T23:57:52.000Z,Turkey has only been publishing symptomatic coronavirus cases  albahuth.info/turkey-has-onl …,https://t.co/91GIMfkcv2,1311455252454027265
PalczynskiRich1,2020-09-30T23:57:51.000Z,"The Trump we saw last night is undoubtedly the same Trump in cabinet meetings. He intimidates, he insults, he demeans anyone who speaks up, he lies, he sticks to his opinion despite the facts, and he doesn’t listen or learn. The Trump we saw is why we are in this COVID crisis.",,1311455250092617728
morning_news24h,2020-09-30T23:57:51.000Z,Anti-mask preacher told to mask up for son’s wedding  albahuth.info/anti-mask-prea …,https://t.co/xYyoiZ1Ncj,1311455249975185408
chiefjca,2020-09-30T23:57:50.000Z,I wanna get back in shape but quarantine has conditioned me to become so lazy now,,1311455244644225024
rnz_news,2020-09-30T23:57:50.000Z,Watch live: Director of Public Health gives the latest on Covid-19 cases in New Zealand  rnz.co.nz/news/national/ …,https://t.co/1NbHjeOFAi,1311455244031717376
Gregsanti,2020-09-30T23:57:49.000Z,Time for the pandemic special! #SouthPark,https://x.com/hashtag/SouthPark?src=hashtag_click,1311455241943080965
DFSH8150,2020-09-30T23:57:49.000Z,"Over 206,000 Americans have died due to COVID.  Over 7.2 Million  Americans have been infected by COVID.  Over 30 million Americans are unemployed.  What lies about COVID will you be telling Americans today, Mr. President? #WhyIsTrumpStillPlayingGolf?",https://x.com/hashtag/WhyIsTrumpStillPlayingGolf?src=hashtag_click,1311455241498394625
CavalloAnita,2020-09-30T23:57:49.000Z,Thank you obama. Now do today after months of trumps failed covid response.,,1311455239858421760
mahemoff,2020-09-30T23:57:49.000Z,Melbournians like,,1311455238264549376
fakexit,2020-09-30T23:57:48.000Z,I’m using Amika Soulfood hair mask and olaplex shampoo and conditioner!,,1311455237497131008
esoriram1,2020-09-30T23:57:48.000Z,We don't have covid because we are smart,,1311455235622219777
GForces476,2020-09-30T23:57:48.000Z,‘Shameful’: Nancy Pelosi’s ‘Updated’ Coronavirus Relief Plan Does Not Include Planned $600M Grant To Law Enforcement  dailywire.com/news/shameful- …,https://t.co/ALcdKnSiwA,1311455234779230209
realSashaBella,2020-09-30T23:57:48.000Z,"NO HATE, NO LIES, NO RIOTS, NO COVID CAN'T STOP PRESIDENT  TRUMP. GOD AND WE THE PEOPLE ARE WITH YOU MR PRESIDENT!  #TRUMP2020@LANDSLIDE",https://x.com/hashtag/TRUMP2020?src=hashtag_click,1311455233919397891
perchanceabit,2020-09-30T23:57:47.000Z,"one glaring issue with the new tank items is the lack of mana options. They took mana off of iceborn, righteous glory, and abyssal mask, leaving only frozen heart as a mana option for tanks",,1311455230282928130
GlobalOkanagan,2020-09-30T23:57:46.000Z,"On Wednesday, the care Haro Park Centre said one patient was in hospital, while nine others were being isolated on site. trib.al/9rMdzYW",https://t.co/Lc3hnyiniD,1311455228579938305
thomasss37,2020-09-30T23:57:46.000Z,Whether you agree with mail in ballots or not this is still fucking ridiculous because there would still be a line if covid wasn’t around outside the polling station.  All because we can’t get our shit together over at least opening more stations.  x.com/Politidope/sta …,https://x.com/Politidope/status/1311381258384166917,1311455228227715072
