User_name,Datetime,Content,Links,Tweet_ID
MyTransit_DC,2020-05-15T23:59:30.000Z,"How Montreal, Milan, and D.C. have made more space for walk/bike/transit during COVID - Streetsblog Chicago #WMATA #Transit #WashingtonDC #Transportation #DCMetro :  chi.streetsblog.org/2020/05/15/how …",https://x.com/hashtag/WMATA?src=hashtag_click https://x.com/hashtag/Transit?src=hashtag_click https://x.com/hashtag/WashingtonDC?src=hashtag_click https://x.com/hashtag/Transportation?src=hashtag_click https://x.com/hashtag/DCMetro?src=hashtag_click https://t.co/XG28vNdZBd,1261446139108159490
CatZimmerer,2020-05-15T23:59:30.000Z,The type of virus that is covid 19 only comes around every 100 years.  The other pandemics come every 7-10 years and are much milder by comparison,,1261446138399461377
SkipSodano,2020-05-15T23:59:30.000Z,Tropical Hawaiian Floral Print Cloth Face Mask  zazzle.com/z/gggot6bz?rf= … via  @zazzle,https://t.co/KtZOQ1U0mS https://x.com/zazzle,1261446137787154434
long_km,2020-05-15T23:59:30.000Z,"Please view today’s 5/15/20 County of Ventura COVID-19 Press Conference. We now have over 1,400 businesses registered at  vcreopens.com with their public health plans in regards to COVID-19. We are committed to…  instagram.com/p/CAOlJkTA6ER/ …",https://t.co/L3AI8AgLCD https://t.co/KK2uLV9kD0,1261446137157844992
Ahmed09917979,2020-05-15T23:59:30.000Z,I am an employee with Teleperformance got a call from manager and bhr stating they are putting me on notice if I dont have leave there won't be anything paid I informed them about pandemic but they are not bother aren't even  human to listen we are in lot of stress please help.,,1261446136855818242
alexanderdreki,2020-05-15T23:59:29.000Z,So... how long before an”authorised” person declares we must all vote for Labour as “it might prevent the spread of Covid 19”,,1261446135886970886
altwitme,2020-05-15T23:59:29.000Z,"Covid-19 man it's 2020 and trump has killed 85,000+ citizens when you gonna realize that. Wake up you sleep.",,1261446133991104512
quackyoongi,2020-05-15T23:59:29.000Z,Today was meant to be family day out fun time but instead its family sad depressed stay at home day and i want out,,1261446133303275520
KimmichLouise,2020-05-15T23:59:29.000Z,Most are too young to remember Gerald Ford's plan to eradicate swine flu with a hastily done vaccine. Many developed big problems as a result. It killed some and paralyzed many.,,1261446132993085451
halleebrooke_,2020-05-15T23:59:28.000Z,COVID-19 Prom Edition,,1261446130963025923
PaulCzege,2020-05-15T23:59:28.000Z,"I'm going to say Infinite Past. If the pandemic hadn't caused everyone to shift their face-to-face groups to online, I think people would be playing it. paulczege.itch.io/infinite-past",https://t.co/KI6rX1qjz9,1261446130782461953
JOdonnell587,2020-05-15T23:59:28.000Z,"Coronavirus Scotland: Frontline NHS doctor in England urges public to ‘ignore Boris, listen to Sturgeon’ – The Scottish Sun  thescottishsun.co.uk/news/5586169/c …",https://t.co/r9tafyNWJG,1261446130363183106
2SidesOK,2020-05-15T23:59:28.000Z,"BREAKINGMany jobs are able to work from home. If my boss made sure everyone at work wore a MASK, perhaps I would feel different about showing up.  That's how life works for most Americans. GOP is totally out of touch.",,1261446130187014144
teeballs1,2020-05-15T23:59:28.000Z,Why is no one in Carmel wearing a mask? Everyone is walking around with no worries,,1261446129671004160
tnvolsfan29,2020-05-15T23:59:28.000Z,I went to Walmart today I was one of a handful of people wearing mask so....,,1261446129603903488
Ladybugusa2,2020-05-15T23:59:28.000Z,explain to me if my mask is to protect you  -meaning my “germs” wont go through the mask to infect others why can’t the same mask keep your “germs” away from me if you don’t have a mask on. All I hear is mask is to protect others. Id germs can’t leave same mask won’t let yours in,,1261446129146871809
kateonthinice,2020-05-15T23:59:28.000Z,Blogged about face mask suppliers today - happy to add your mum and sister if you send me the details kateonthinice@gmail.com,,1261446128253501440
ReclinerAnalyst,2020-05-15T23:59:28.000Z,"Only the Girl Scout thought of others and followed CDC guidelines. She “protected” the people who are in the high-risk age group by wearing a mask. Thank you for showing leadership. If haven’t earned that badge, you did today.",,1261446128039456769
Catgodcatgod,2020-05-15T23:59:28.000Z,I would like to trade in my good guy points earned from social distancing 4 sum p000say,,1261446128035389440
ag_butt,2020-05-15T23:59:27.000Z,Poor chart rating for the government’s coronavirus communications strategy  instituteforgovernment.org.uk/blog/poor-char … via  @instituteforgov,https://t.co/6lPBDXSbDE https://x.com/instituteforgov,1261446126294589441
McNamaraWDET,2020-05-15T23:59:27.000Z,I went to Ohio and all I got was drunk and COVID-19,,1261446126261211138
Fu99997777,2020-05-15T23:59:27.000Z,"On January 12, China shared the gene sequence with the WHO. This gene sequence analysis was done independently by China, and the U.S. actually shared the gene sequence in China a day earlier and started developing a vaccine. Where did the U.S. virus samples come from?",,1261446126047092737
knockout_kitten,2020-05-15T23:59:27.000Z,This seems highly ironic during a pandemic,,1261446126034538496
karenehowell,2020-05-15T23:59:27.000Z,Don Draper: “Coronavirus?”,,1261446124914819085
ClaireKelly77,2020-05-15T23:59:27.000Z,"As a constituent & advocate for older adults, I hope you and the assembly will fight against the devastating cuts proposed by the Gov. I care about working Californians & families too, but don't want to fund their recovery on the backs of the people most affected by COVID-19.",,1261446124881080320
HFPortsmouth,2020-05-15T23:59:27.000Z,40+ Water toys to keep you sane in spring quarantine -  eepurl.com/g3Ku3f,https://t.co/X53uya2QvN,1261446124440674306
lizziebethhh__,2020-05-15T23:59:27.000Z,"One thing I can say about being stuck at home and actually cooking, I’ve been eating good all quarantine",,1261446124050608133
jaclyncossarini,2020-05-15T23:59:27.000Z,sometimes I really hate quarantine and then I walk in on my parents shotgunning my white claws on zoom with their friends and I think u know what this isn’t so bad,,1261446123753033728
sciencefandom,2020-05-15T23:59:26.000Z,Pal everyone gets a vaccine and population only increases. GIVE. IT. UP.,,1261446123346104327
BaconOutlaw,2020-05-15T23:59:26.000Z,I still say this is b/c ppl who are habitually on their phones don't have other cars to watch in their peripheral vision. That & speeding.  foxnews.com/us/car-crash-d …,https://t.co/bSu9L7J74k,1261446120485478400
brittyboo114,2020-05-15T23:59:26.000Z,It took alittle over 2 weeks but I think that has to do with COVID but they constantly keep you updated with your order!,,1261446120133111808
frankjames,2020-05-15T23:59:26.000Z,no mask required...  x.com/mdx3232/status …,https://x.com/mdx3232/status/1261396893516492800,1261446119386734592
GuitarSunCat,2020-05-15T23:59:25.000Z,"Look at this perverse, twisted evil from  @FoxNews  and  @MSN  home page! Those armed protesters are TERRORISTS! These LIARS posing as ""news"" say >armed protesters< provide SECURITY! Security from whom or what? No one threatens their dumb protests!  a.msn.com/01/en-us/BB149 …",https://x.com/FoxNews https://x.com/MSN https://t.co/5MQP2oBObZ,1261446117889196032
Samson1176,2020-05-15T23:59:25.000Z,Many people seem to believe that lockdown itself isn’t contributing to excess deaths. Unbelievable really.,,1261446117084082176
jankrolONE,2020-05-15T23:59:25.000Z,"That whole shit show is planned, scrippted and now executing. There is no Trade War, Virus pandemic, Dem vs Rep fight. Its all one agenda.",,1261446116756918272
heyitsamogh,2020-05-15T23:59:25.000Z,Quarantine has literally got us a “room” for improvement,,1261446115892891649
toyakeigo,2020-05-15T23:59:25.000Z,im so glad that i finally have plenty of refs of catra without her helmet mask thing im gonna draw her so much,,1261446115632832514
BroTwenny,2020-05-15T23:59:24.000Z,Tories + Cheltenham(Bookies) =  0.85% of the world’s population 11% of the world’s Covid deaths,,1261446114944794624
ImNotUrMommy,2020-05-15T23:59:24.000Z,"This Oklahoma girl gonna go on and continue social distancing. Meaning I'm not leaving my house except for work and moving. Def not going to any nightclubs. Not a free for all for me, yet. Though I mostly lived like this before all this started so...",,1261446114588450818
QmVirtual,2020-05-15T23:59:24.000Z,"Which is the FIRST member of the European Union to declare an end to the COVID-19 epidemic? While some restrictions remain in place,  EU citizens can now travel to the country without self-isolating.  virtualqm.home.blog/2019/07/17/qui …",https://t.co/VAR4KtGWBw,1261446114261098496
BetterMedia2020,2020-05-15T23:59:24.000Z,How To Work with Recruiters to Get A Job in 2020?  #jobseeker #jobsearchtips #resume #Recruitment #LinkedIn #beprepared #pandemic #COVID19Aus #CareerDevelopment #careeropportunities #career #JobsDuringCorona #recruiter #InterviewTips #interviews #lifehacks,https://x.com/hashtag/jobseeker?src=hashtag_click https://x.com/hashtag/jobsearchtips?src=hashtag_click https://x.com/hashtag/resume?src=hashtag_click https://x.com/hashtag/Recruitment?src=hashtag_click https://x.com/hashtag/LinkedIn?src=hashtag_click https://x.com/hashtag/beprepared?src=hashtag_click https://x.com/hashtag/pandemic?src=hashtag_click https://x.com/hashtag/COVID19Aus?src=hashtag_click https://x.com/hashtag/CareerDevelopment?src=hashtag_click https://x.com/hashtag/careeropportunities?src=hashtag_click https://x.com/hashtag/career?src=hashtag_click https://x.com/hashtag/JobsDuringCorona?src=hashtag_click https://x.com/hashtag/recruiter?src=hashtag_click https://x.com/hashtag/InterviewTips?src=hashtag_click https://x.com/hashtag/interviews?src=hashtag_click https://x.com/hashtag/lifehacks?src=hashtag_click,1261446113711681536
NelsonMandy3,2020-05-15T23:59:24.000Z,"Per the incompetent idiot “vaccine or no vaccine, we’re back”  (me) to ensure 10s of thousands more of our beloved Americans are killed by Covid-19. This is premeditated homicide & genocide.  @JoeBiden  @Morning_Joe  @DrBiden  @chrislhayes  @Lawrence  @RepAdamSchiff  @AOC  @AC360",https://x.com/JoeBiden https://x.com/Morning_Joe https://x.com/DrBiden https://x.com/chrislhayes https://x.com/Lawrence https://x.com/AOC https://x.com/AC360,1261446113648836608
rajisagyallis,2020-05-15T23:59:24.000Z,Hurry up before quarantine is over and I have no time to watch it PLEASE  x.com/rickriordan/st …,https://x.com/rickriordan/status/1261396556344733697,1261446113422446593
mkcentral,2020-05-15T23:59:24.000Z,"When faced with a new disease, how to draw upon both immediate, urgent, practice-based insights and robust RCT-based research findings?   #COVID2019 #COVID19 #COVID   threadreaderapp.com/thread/1260659 …",https://x.com/hashtag/COVID2019?src=hashtag_click https://x.com/hashtag/COVID19?src=hashtag_click https://x.com/hashtag/COVID?src=hashtag_click https://t.co/KmceYY0yzs,1261446111220232192
sarcasm4therapy,2020-05-15T23:59:24.000Z,Hired an artist to paint me in the nude Was all excited  Until she told me it would be a triptych  Damn this COVID body,,1261446111123910661
FaizCafe,2020-05-15T23:59:23.000Z,Quarantine Pizza Offer MadNess! Every SAtuRdAy  Buy 1Get 2 All Varieties Call/WhatsApp:256772957050/256704120950 #FaizcafeKyaliwajala. Also Order Via  Safe BodaApp,https://x.com/hashtag/FaizcafeKyaliwajala?src=hashtag_click,1261446107244232709
DoloresGlennon,2020-05-15T23:59:23.000Z,"He told lies about covid19 there were 15  people infected it might increase it might not it could disappear now while trump plays games talks about all sorts of trash 86,000 people are dead and rising now he’ll have a vaccine for Xmas I still believe he should be locked up",,1261446106614906880
EconomiWorks,2020-05-15T23:59:22.000Z,Read our blog as we discuss considerations for assessing the various pandemic data points and experts as you start to re-open your business:   economiworks.com/blog/f/data-ma …  #economiworks #EconomyNotPolitics #usedata #contextmatters #gigeconomy #pandemic #COVID19 #openforbusiness,https://t.co/BVyGTAoZPn https://x.com/hashtag/economiworks?src=hashtag_click https://x.com/hashtag/EconomyNotPolitics?src=hashtag_click https://x.com/hashtag/usedata?src=hashtag_click https://x.com/hashtag/contextmatters?src=hashtag_click https://x.com/hashtag/gigeconomy?src=hashtag_click https://x.com/hashtag/pandemic?src=hashtag_click https://x.com/hashtag/COVID19?src=hashtag_click https://x.com/hashtag/openforbusiness?src=hashtag_click,1261446106468306945
MissMaSunshine,2020-05-15T23:59:22.000Z,Her staff only got tested for covid two weeks ago.,,1261446106157707264
joek73052829,2020-05-15T23:59:22.000Z,good thing is you haven’t said anything so it’s a blank canvas. just tell the lecturer something believeable but sensitive like that ur gran died from covid or something & they won’t dare question it,,1261446106048684032
WhteRbbnAdvocat,2020-05-15T23:59:22.000Z,No blow-out: Victorian authorities dismiss complaints about long wait for COVID-19 tests | The New Daily  thenewdaily.com.au/news/coronavir …,https://t.co/p5Xtht4OUg,1261446105599848448
Theatre_Y,2020-05-15T23:59:22.000Z,"Episode 5 -'The Italian for ceiling and window'- MY BODY'S IMAGE, DELAYED.   A retrospective of András Visky texts - an experiment in ongoing response to the isolation and silence of the current pandemic. (15 Episodes each Friday at 7pm till July 24, 2020) mailchi.mp/theatre-y/epis …",https://t.co/KgjKJnAF5l,1261446104651984896
jade_susper,2020-05-15T23:59:22.000Z,Thank youuuuuuuuu! It was a great impact. Thank you so much for making our quarantine the best! Lovelots! #2gethertheseriesfinale #2getherlasteps #winmetawin #brightvc @winmetawin  @bbrightvc  @2GETHERSeriesPH  @_champion9,https://x.com/hashtag/2gethertheseriesfinale?src=hashtag_click https://x.com/hashtag/2getherlasteps?src=hashtag_click https://x.com/hashtag/winmetawin?src=hashtag_click https://x.com/hashtag/brightvc?src=hashtag_click https://x.com/winmetawin https://x.com/bbrightvc https://x.com/2GETHERSeriesPH,1261446104375160832
Dan42016,2020-05-15T23:59:22.000Z,"In Macomb County, Chief Medical Examiner Daniel Spitz had a recent case in which an individual died by suicide.  Because they had a family member in the hospital suffering from COVID-19,",,1261446103838461959
ALuciferano,2020-05-15T23:59:22.000Z,"That's NOT accurate because flu vaccine DOES INCREASE people from contracting coronavirus by 36% shown by Pentagon study  So, maybe ABC has no evidence but no evidence demonstrated does NOT mean no evidence exist, especially given covid19 is just recently known.",,1261446103817281536
mass_patriot,2020-05-15T23:59:22.000Z,"No thanks!  I don’t need any more bull in my life than what I have to deal with now, thanks to how badly your lazy Daddy  @realDonaldTrump  botched the COVID response and management. 100k deaths by June—congratulations!  Sick of winning yet, MAGAs?",https://x.com/realDonaldTrump,1261446103205130242
WorldGastroOrg,2020-05-15T23:59:22.000Z,"#WGONEWS - NEW! Personal Protection Equipment for Endoscopy in Low Resource Settings during the COVID-19 Pandemic: Guidance from WGO - Dr. Desmond Leddin, MB, MSc, FRCPC, FRCPI  ow.ly/CFab50zHOOK  #COVID19 #PPE #ENDOSCOPY",https://x.com/hashtag/WGONEWS?src=hashtag_click https://t.co/TlLf7antlT https://x.com/hashtag/COVID19?src=hashtag_click https://x.com/hashtag/PPE?src=hashtag_click https://x.com/hashtag/ENDOSCOPY?src=hashtag_click,1261446103125446656
mantramman,2020-05-15T23:59:21.000Z,Excellent piece!  We could stop the pandemic by July 4 if the government took these steps  washingtonpost.com/outlook/we-cou …,https://t.co/N7kNAwG60q,1261446101413933056
MyMaximus,2020-05-15T23:59:21.000Z,"This, from the bootlicker who said trump wouldn’t allow Covid to come to America.",,1261446100994666496
hartfordcourant,2020-05-15T23:59:21.000Z,"If you are planning an outing to any of the public beaches in Connecticut, here are the new social distancing guidelines:  bit.ly/2Z9ytTc",https://t.co/NoDeYxBet8,1261446100889882624
bgambassadors,2020-05-15T23:59:21.000Z,Cities Need To Continue Investing In Their Music Economies Post-Pandemic via  @forbes  forbes.com/sites/brianpen …,https://x.com/forbes https://t.co/Q304P4tX4j,1261446100839473152
SusanWoodhull1,2020-05-15T23:59:21.000Z,Coronavirus US live: Trump's press conference disrupted by trucker protest,,1261446100470370305
drjohnmorley,2020-05-15T23:59:21.000Z,Interpreting a covid-19 test result  bmj.com/content/369/bm …,https://t.co/Q4IsNjU0VD,1261446100310822912
kjflorek,2020-05-15T23:59:21.000Z,"I just wrote a review on UKAINT 3 ply Earloop Surgical Face Mask (BFE 95%), Pack of 10  yotpo.com/go/tQ1JGGo6 via  @yotpo",https://t.co/qff9HR70Ml https://x.com/yotpo,1261446100138864640
hrkserendipity,2020-05-15T23:59:21.000Z,We didn't know this already? That women are great leaders?  Why Are Women-Led Nations Doing Better With Covid-19?  nyti.ms/3fUPMNo,https://t.co/DmWInur8aI,1261446100101165056
polandjon,2020-05-15T23:59:21.000Z,I'm all for letting people have freedom.  But can we build a list of these people so when they show up in need of medical care they get moved to the back of the line?  With freedom comes responsibility.  #COVIDIOTS.   woodtv.com/news/kent-coun …,https://x.com/hashtag/COVIDIOTS?src=hashtag_click https://t.co/6NgODRZaLG,1261446099883003904
ljcb12,2020-05-15T23:59:21.000Z,NY Times Worries Half of Americans Will Refuse to Take Coronavirus Vaccine -  summit.news/2020/05/14/ny- …,https://t.co/TLrjFpMN7e,1261446099555868672
keithkrueger,2020-05-15T23:59:21.000Z,@JRosenworcel  @AjitPaiFCC  @GeoffreyStarks  @mikeofcc  @BrendanCarrFCC  Help ensure safe remote learning  @CoSN,https://x.com/JRosenworcel https://x.com/GeoffreyStarks https://x.com/BrendanCarrFCC https://x.com/CoSN,1261446099245715456
Sr71Brian,2020-05-15T23:59:21.000Z,Sorry not true.  The hospital had 14 beds occupied with Covid or supposed Covid patients.  The rest of the hospital was empty.   I work an essential job and was there.   Maybe you need to wise up.,,1261446098830286848
Safid_Deen,2020-05-15T23:59:20.000Z,Dolphins planning to open Davie facility on Tuesday — without coaches and players  sun-sentinel.com/sports/miami-d …,https://t.co/zz6Pz3zToz,1261446098092265473
usjayfan01,2020-05-15T23:59:20.000Z,"Sneak preview, page 6 from Trump’s pandemic plan.",,1261446094090797057
KellyCopterv1,2020-05-15T23:59:19.000Z,Thanks Samuel now we know of at least one celebrity who is part of the corrupt vaccine promoting  clown.,,1261446093566554112
Avon_SavoySazz,2020-05-15T23:59:19.000Z,Check out Avon Defense Cloth Mask via  @AvonInsider  avon.com/product/72252? …,https://x.com/AvonInsider https://t.co/AJvuC39Bqy,1261446092639678466
mbhbox,2020-05-15T23:59:19.000Z,"Dr. Giuseppe/Italy:""having seen very strange pneumonia, very severe, particularly in old people in December and even November""  ""This means that the virus was circulating, at least in Lombardy and before we were aware of this outbreak occurring in China."" npr.org/2020/03/19/817 …",https://t.co/2bdGelUZnH,1261446092178157569
NewsfeedsMedia,2020-05-15T23:59:19.000Z,Stanley Tucci has developed a series of quarantine recipes after his viral cocktail video last month newsfeeds.media/stanley-tucci- …,https://t.co/Jl4lXhUlmb,1261446090504548353
smith_dagan,2020-05-15T23:59:19.000Z,"@MattHancock  A protective ring around our care homes?   ""Until 12 March, the government’s advice said it was ‘very unlikely’ people in care homes will become infected.""  @FullFact    #COVID19 #coronavirus #Covid19UK #ToriesOut",https://x.com/MattHancock https://x.com/FullFact https://x.com/hashtag/COVID19?src=hashtag_click https://x.com/hashtag/coronavirus?src=hashtag_click https://x.com/hashtag/Covid19UK?src=hashtag_click https://x.com/hashtag/ToriesOut?src=hashtag_click,1261446090450186241
timesrecordnews,2020-05-15T23:59:19.000Z,Wichita County leaders aim to keep your tax bills about the same in 2021 amid uncertainty of pandemic  timesrecordnews.com/story/news/loc …,https://t.co/72iEHhxjgb,1261446090399911937
Jennabenna24,2020-05-15T23:59:18.000Z,I just grabbed dinner and we had to go up and order at bar and they required a mask every time we needed to go up and order.,,1261446087199490050
GothamCityCrew,2020-05-15T23:59:18.000Z,Of course... just picked a winner a little bit ago.  We will be having more fun giveaways to help during the quarantine,,1261446086918627331
DanGirardi23,2020-05-15T23:59:18.000Z,"Big shout out to my good friend and fantastic pianist Phil Amos, entertaining us every Saturday from his garden during #lockdown. Live show 7.30pm tomorrow night song requests via the link! #rocknroll.  @WalesOnline  #StaySafe #NHSheroes #LocalHeroes",https://x.com/hashtag/lockdown?src=hashtag_click https://x.com/hashtag/rocknroll?src=hashtag_click https://x.com/WalesOnline https://x.com/hashtag/StaySafe?src=hashtag_click https://x.com/hashtag/NHSheroes?src=hashtag_click https://x.com/hashtag/LocalHeroes?src=hashtag_click,1261446086402637825
Krishna10704680,2020-05-15T23:59:17.000Z,What's happening in this country college asking fees in this pandemic situation ...,,1261446085387509761
kcreamio,2020-05-15T23:59:17.000Z,We've reached the point where people think the freedom to not wear a mask in a store is more important than the actual lives of their fellow people.  Volume e xap?  Kapa ke mind blown,,1261446084930359296
IndianExpress,2020-05-15T23:59:17.000Z,"""The risks of exposing patients to perioperative SARS-CoV-2 infection by performing surgery during outbreaks are high, but must be weighed against the risks of protracted treatment delays,"" the study states. bit.ly/362fmeU",https://t.co/v3cPGekDQf,1261446083361730560
FatalAssertion,2020-05-15T23:59:17.000Z,"Trump doesn't want more coronavirus tests! Did you hear about this? (setup) Well the reason he doesn't like tests is because he's really dumb, and his pathetic brain has lead him to fail almost every test he's ever taken. (punchline)  Boom. My resume is done. Send to: Diamond Joe",,1261446083189846017
joneswb66,2020-05-15T23:59:17.000Z,Clever. Not wrong. Somehow the stakes seem higher now. America is broken and people are looking for answers. The issues aren’t going away. We need M4A and UBI to get people past the pandemic. There could be some dark days ahead.  x.com/jacob_posts/st …,https://x.com/jacob_posts/status/1261376331377451008,1261446082535387136
inthehammer,2020-05-15T23:59:17.000Z,"LATEST OUTBREAKS: List of long-term care homes with COVID-19 outbreaks in Hamilton - May 15, 2020  inthehammer.com/latest-outbrea …",https://t.co/i7MxLlKEa0,1261446082522947589
BCISLEMAN,2020-05-15T23:59:17.000Z,That time when we had a complete moron as president during the greatest public health crisis in US history. rawstory.com/2020/05/column …,https://t.co/UBlkxkMTHp,1261446082321453057
schwep_305,2020-05-15T23:59:17.000Z,"It’s disgustingly crowded already. No masks, no social distancing, crowds of people everywhere with no repercussions. #worstdecisionever  #thanksmurphy",https://x.com/hashtag/worstdecisionever?src=hashtag_click https://x.com/hashtag/thanksmurphy?src=hashtag_click,1261446081805717507
marroelmonero,2020-05-15T23:59:16.000Z,OMG !! JIJI  LIKE WAITING QUARANTINE ENDS!!,,1261446080794787840
vrb1955,2020-05-15T23:59:16.000Z,Delaware targets June 1 for phase one of reopening plan  6abc.com/health/delawar … via  @6abc,https://t.co/blrAPZL1EW https://x.com/6abc,1261446080769585153
ENN0TANA,2020-05-15T23:59:16.000Z,when this pandemic is over i will visit you to steal ur dogs but i wont leave without hugging u first,,1261446079700074496
Ericwamono2,2020-05-15T23:59:16.000Z,"I have even come to know strange border points like Elegu, thanks to covid Has anyone also realized that always towards the end of the lockdown, numbers always crazily shoot up. Let me there is no game played",,1261446078450339840
patrickfinley,2020-05-15T23:59:16.000Z,"#Bears coach Matt Nagy is trying to embrace the unknown during a virtual offseason. “You can take everything we’ve done in prior years,” Nagy said, “and you can just throw it out the window.” chicago.suntimes.com/bears/2020/5/1 …",https://x.com/hashtag/Bears?src=hashtag_click https://t.co/UNQw97LHqw,1261446077586092032
EdmundBurkeTrue,2020-05-15T23:59:16.000Z,"World looks on in horror as Trump flails over pandemic:    “O wad some Pow'r the giftie gie us To see oursels as ithers see us! It wad frae mony a blunder free us, An' foolish notion: What airs in dress an' gait wad lea'e us, An' ev'n devotion!” R. Burns  theguardian.com/us-news/2020/m …",https://t.co/HpV0TCZVyr,1261446077418336256
winthingsuk,2020-05-15T23:59:15.000Z,Coronavirus crisis: How summer could stop spread of killer virus in Britain  newsbuzz.co.uk/general/corona …,https://t.co/WVhbCMV3Rk,1261446076738895872
nekonekoz,2020-05-15T23:59:15.000Z,Targets of T cell responses to SARS-CoV-2 coronavirus in humans with COVID-19 disease and unexposed individuals  cell.com/cell/fulltext/ …,https://t.co/9HeS4H0vwZ,1261446076453670912
Mediaite,2020-05-15T23:59:15.000Z,"BREAKING: House Takes Unprecedented Step to Allow Proxy Voting, Remote Hearings During Pandemic  mediaite.com/a/kgzzy",https://t.co/4K9ZKExRpS,1261446075044392960
jjamadorphd,2020-05-15T23:59:15.000Z,Playing tonight at the Quarantine Theatre...   instagram.com/p/CAOlH1NnSU4K …,https://t.co/oOZkvXIqpb,1261446073790246912
FitCoachLaura,2020-05-15T23:59:14.000Z,Unfortunately she would be spreading the virus with no mask on :/,,1261446071818960898
