User_name,Datetime,Content,Links,Tweet_ID
DerekLarsen7,2020-08-18T23:59:07.000Z,"For one, the IFR (at least before the Steroid shot treatment was discovered) is still estimated to be somewhere between .5 and 1 percent.  That the Imperial College team should be commended that they estimated the IFR so accurately so early during the pandemic!",,1295872890491899904
TheJosieMarie,2020-08-18T23:59:06.000Z,"the script I was writing will no longer be shot (for now) because of the pandemic; safety first, pero en este momento we cry",,1295872884494209032
nbcchicago,2020-08-18T23:59:06.000Z,"5 Chicago Restaurants, Bars Temporarily Closed for Weekend Coronavirus Violations  nbcchi.com/H3A8Epd",https://t.co/U7phooZCAq,1295872884414590976
m0rganmitchell,2020-08-18T23:59:06.000Z,I should be going to the Crüe concert this weekend but thx covid,,1295872883391176704
PDRnews,2020-08-18T23:59:05.000Z,"Sauk County’s top health authority assured the Baraboo School Board in a special meeting Monday that he feels the district is doing as much as it can to minimize transmission of COVID-19 when school starts in two weeks, but he…  wiscnews.com/baraboonewsrep …",https://t.co/ySRYl8b0Ng,1295872881654718468
WMUR9,2020-08-18T23:59:05.000Z,Health officials say there's 'low but persistent transmission' of COVID-19 in NH  wmur.com/article/health …,https://t.co/kNMTwYs8Tj,1295872881616998400
bungap_ray,2020-08-18T23:59:05.000Z,This article is a complete BS. Blaming a back yard graduation party of 50 people for coronavirus spread throughout Georgia? No it couldn’t have been the riots occurring at the same time in downtown and Buckhead. Must blame rich white people- that’s what they are there for right?,,1295872880828469248
Krobatz,2020-08-18T23:59:05.000Z,LIVE! TIME TO BATTLE!!!  Link in comments  #youtube #supportsmallstreamers #supportsmallstreams #roadtoaffiliate #shinypokemon #raichu #scizor #gengar #X #Y #pokemonart  #love #shinyhunters #versus #4way #covid_19 #discord #part5 #socialdistancing #retweet #RT #pokemon #poketuber,https://x.com/hashtag/youtube?src=hashtag_click https://x.com/hashtag/supportsmallstreamers?src=hashtag_click https://x.com/hashtag/supportsmallstreams?src=hashtag_click https://x.com/hashtag/roadtoaffiliate?src=hashtag_click https://x.com/hashtag/shinypokemon?src=hashtag_click https://x.com/hashtag/raichu?src=hashtag_click https://x.com/hashtag/scizor?src=hashtag_click https://x.com/hashtag/gengar?src=hashtag_click https://x.com/hashtag/X?src=hashtag_click https://x.com/hashtag/Y?src=hashtag_click https://x.com/hashtag/pokemonart?src=hashtag_click https://x.com/hashtag/love?src=hashtag_click https://x.com/hashtag/shinyhunters?src=hashtag_click https://x.com/hashtag/versus?src=hashtag_click https://x.com/hashtag/4way?src=hashtag_click https://x.com/hashtag/covid_19?src=hashtag_click https://x.com/hashtag/covid_19?src=hashtag_click https://x.com/hashtag/discord?src=hashtag_click https://x.com/hashtag/part5?src=hashtag_click https://x.com/hashtag/socialdistancing?src=hashtag_click https://x.com/hashtag/retweet?src=hashtag_click https://x.com/hashtag/RT?src=hashtag_click https://x.com/hashtag/pokemon?src=hashtag_click https://x.com/hashtag/poketuber?src=hashtag_click,1295872880778063877
WJCLNews,2020-08-18T23:59:05.000Z,Teen focusing on sharpening skills through pandemic  wjcl.com/article/teen-f …,https://t.co/787fwwqntF,1295872880744505348
mindymadson,2020-08-18T23:59:05.000Z,"I eat take out frequently, much more so since COVID.  I say im supporting local businesses but the truth is, i can't feed myself without someone else doing the cooking.",,1295872880631152640
HipHopBulimic,2020-08-18T23:59:05.000Z,Covid Anthem.,,1295872879981211648
bsmar206,2020-08-18T23:59:05.000Z,"@BetsyDeVosED  Batty old Betsy spreading lies and conspiracies that children don’t get sick and don’t spread the Virus. Those early studies were Nationsmtjat shuttered and closed, then had mask mandates. Everything this WH  @Mike_Pence  @realDonaldTrump  Refused. Failure",https://x.com/BetsyDeVosED https://x.com/Mike_Pence https://x.com/realDonaldTrump,1295872879398010880
NZStuff,2020-08-18T23:59:05.000Z,Coronavirus: Hobbiton visitor later tests positive for Covid-19  dlvr.it/RdvfDl,https://t.co/cC5g1UdqX9,1295872879343484928
DowntownBalt,2020-08-18T23:59:04.000Z,"Health Commissioner @DrTishCommish joined this week's Downtown Download webinar with  @CouncilmanETC  and  @ShelondaStokes , fielding questions about #COVID testing, vaccine trials, and how long the shutdown will last. You can watch the recorded show here:  bddy.me/3hbEPav",https://x.com/CouncilmanETC https://x.com/ShelondaStokes https://x.com/hashtag/COVID?src=hashtag_click https://t.co/KNotsMTu7U,1295872877980516352
ColernBarbara,2020-08-18T23:59:04.000Z,they asked for it ) and then never used it .  Trump gave them all he had for governors to make decisions but they inflatrd the numbers by calling everything covid and then blamed trump.  Now they are Ny numbers are less than 1% but cuomo still won’t open us up.  So wrong. Politic,,1295872877565284353
mike_dahlen,2020-08-18T23:59:04.000Z,Is the Covid-19 Pandemic Spreading Affinity for Socialism? It Shouldn’t!  dlvr.it/RdvfC1,https://t.co/kMLIEBOAzO,1295872874394210305
JCSura,2020-08-18T23:59:03.000Z,Coronavirus live news: global cases near 22m as Wall Street record defies economic gloom  dlvr.it/RdvfCD,https://t.co/4KnrghOiYD,1295872873538523137
NASCAR_Drivers,2020-08-18T23:59:03.000Z,"Roush Fenway's Jack Roush says pandemic ""has really hit us hard""  bit.ly/2YfyxPN",https://t.co/xaKmpuVuSH,1295872873521790983
DHmpuk_inactive,2020-08-18T23:59:03.000Z,"Because, Kelly, rules only apply to the slaves not their owners or overseers. See here:  x.com/DavidHoban8/st … That was at the height of social distancing and when cops were smashing down doors after being informed a property’s occupant might have a ‘friend’ with him.",https://x.com/DavidHoban8/status/1262000020238319617,1295872873492557827
NZStuff,2020-08-18T23:59:03.000Z,Testing times for Waikato DHB lab staff swamped by Covid workload  dlvr.it/RdvfDJ,https://t.co/HUlRXZCwjV,1295872873333104641
JagadishChanda3,2020-08-18T23:59:03.000Z,Are describing yourself ? So you do not have evidence to argue but shallow adjectives to shout. Do not play fool to their script. Tanzania has banned wearing mask.,,1295872873161203718
ThurstonChamber,2020-08-18T23:59:03.000Z,"Wear A Mask, Save A Business!  It is our job at the Thurston County Chamber to do all that we can to help businesses prosper and keep the economic environment healthy in our community.  Learn more here:  thurstonchamber.com/wear-a-mask-sa …  #DecidedlyDifferent #ThurstonStrong #ThurstonChamber",https://t.co/iAzhgDTdo9 https://x.com/hashtag/DecidedlyDifferent?src=hashtag_click https://x.com/hashtag/ThurstonStrong?src=hashtag_click https://x.com/hashtag/ThurstonChamber?src=hashtag_click,1295872872943157250
thatsal49868227,2020-08-18T23:59:03.000Z,"#TheReidOut Ms. Urquiza is perfectly correct. This was not a Donny Fuck Up fuck up (because seriously he has fucked up his entire life) but rather his handmaidens in Ducey, in DiStupid, in Gov I Stole This Seat and all the other ones who thought Covid-19 was a POC disease.",https://x.com/hashtag/TheReidOut?src=hashtag_click,1295872872708108288
DeanObeidallah,2020-08-18T23:59:03.000Z,"Trump's ""liberate"" the schools with new plan on parade: Notre Dame, Michigan State suspend in-person instruction   politi.co/318GW9J via  @politico",https://t.co/Fck2RZ3IuT https://x.com/politico,1295872872158760963
Nascar_News,2020-08-18T23:59:03.000Z,"Roush Fenway's Jack Roush says pandemic ""has really hit us hard""  bit.ly/34iwLkZ",https://t.co/n6radUvFHL,1295872872078929921
jules_annan,2020-08-18T23:59:03.000Z,"A Spitfire bearing the names of thousands of heroes of the coronavirus pandemic seen at The Cotswod Airport, Kemble, Gloucestershire., The NHS Spitfire, which also has ""Thank U NHS"" emblazoned on the underside of…  instagram.com/p/CEDMnPOpelm/ …",https://t.co/p0riDUcD9c,1295872872074883073
LegalNews,2020-08-18T23:59:03.000Z,California Releases “Employer Playbook for a Safe Reopening”  jdsupra.com/legalnews/cali … | by  @manatt,https://t.co/1HSpLI1zHl https://x.com/manatt,1295872871659520000
netamakerIndia,2020-08-18T23:59:03.000Z,"For Covid Patients, Testing Negative No Clean Bill Of Health, Say Doctors  dlvr.it/RdvfD7",https://t.co/zinrSTPWBi,1295872871370067968
PattieBaker3,2020-08-18T23:59:03.000Z,What are the covid positive numbers from the Tulsa rally?,,1295872870455939073
nobodycarez2020,2020-08-18T23:59:03.000Z,I'd say $RLFTF. Looks like a higher upside. Unless you tell me something amazing about the other company. It's 52 week high is .015. rlf has a possible covid therapy in testing phase.,https://x.com/search?q=%24RLFTF&src=cashtag_click,1295872870107828227
ewen_tim,2020-08-18T23:59:02.000Z,"I might struggle with naming a good MP full stop. They all seem to be of the same world view. Only two raising issues with Covid fraud, nothing about BLM apart from one, nothing about crashing economy, illegal immigrants............",,1295872869298245633
biyibjorn,2020-08-18T23:59:02.000Z,And COVID-19..,,1295872868019052545
SalemJrHigh,2020-08-18T23:59:02.000Z,Salem Jr High Covid-19 Plan  dlvr.it/RdvfC6,https://t.co/AAM5evVgdx,1295872867947536384
JakeFurr11,2020-08-18T23:59:02.000Z,It will be interesting to see what happens to those fans who have a long standing tradition of going to games. And a place like Arlin Field can really lend itself to social distancing.,,1295872867733835776
NZStuff,2020-08-18T23:59:02.000Z,"Coronavirus: While Covid-19 takes lives around the world, New Zealand's response has led to fewer deaths from all causes  dlvr.it/Rdvf9w",https://t.co/kTIn2HP1z0,1295872867553312768
CurtisLMorriso1,2020-08-18T23:59:02.000Z,"The S&P 500 closed at a record high on Tuesday, rebounding from huge losses triggered by the coronavirus pandemic and crowning one of the most dramatic recoveries in the index’s history.",,1295872866337140736
desakordes,2020-08-18T23:59:01.000Z,"1/23 ¿Lord Pirbright (Henry Rothschild) Bill Gates, George Soros y la Patente del Coronavirus..? #ArrestSoros #ArrestBillGates #ArrestDrTedros #ArrestRothschilds #ArrestFauci #ArrestConte #ArrestSanchez.. americans4innovation.blogspot.com/2020/02/corona …",https://x.com/hashtag/ArrestSoros?src=hashtag_click https://x.com/hashtag/ArrestBillGates?src=hashtag_click https://x.com/hashtag/ArrestDrTedros?src=hashtag_click https://x.com/hashtag/ArrestRothschilds?src=hashtag_click https://x.com/hashtag/ArrestFauci?src=hashtag_click https://x.com/hashtag/ArrestConte?src=hashtag_click https://x.com/hashtag/ArrestSanchez?src=hashtag_click https://t.co/PJFrvPZHWI,1295872864655151104
Praise_Nyambiya,2020-08-18T23:59:01.000Z,Yo just wear a mask.,,1295872864520941574
dallasnews,2020-08-18T23:59:01.000Z,My son is headed back to his college campus during a pandemic. Now’s the time for faith | Commentary  buff.ly/34aTKy5,https://t.co/yVtYgzourE,1295872862914576384
babiejenks,2020-08-18T23:59:01.000Z,So many TV shows abt characters —male and female—completely disconnected from their emotions. Another thing thats happened in quarantine is Ive stopped being able to watch TV because i could feel it trying to program me into being a kind of person i know is super unhealthy to be,,1295872862864244738
AqueousThe,2020-08-18T23:59:01.000Z,Watching our school district's board meeting about the distance learning for the Fall.  I thought my work meetings were bad.  This meeting is painfully dull.  Lots of angry folks in the community participation section.  Lots of bad mask wearing.  This year sucks.,,1295872861962477574
1067WTLC,2020-08-18T23:59:00.000Z,WHO Says COVID-19 Pandemic Is Also Causing Mental Health Crisis  trib.al/sCevMYu,https://t.co/SIz3RYnM1T,1295872861341659142
unlv,2020-08-18T23:59:00.000Z,Please reach out to your advisor or instructor as soon as possible to discuss the situation or email coronavirus@unlv.edu with further questions.  Here is an overview of the safety instructions and steps we are taking for the fall semester:  unlv.edu/news-story/fal …,https://t.co/j4dFjhPyDc,1295872860951437312
dave1agar,2020-08-18T23:59:00.000Z,Significant percentage of GTA students to begin school year online over COVID-19 concerns | CBC News  cbc.ca/news/canada/to …,https://t.co/b3cociyUKG,1295872858170830850
sayalpha,2020-08-18T23:58:59.000Z,I simply blame covid,,1295872855536738304
crazyybrazee,2020-08-18T23:58:59.000Z,Is it a special variant?,,1295872854064496640
yannaakilah,2020-08-18T23:58:58.000Z,i knew MSU was going to do that  i was choosing to  stay at home anyways,,1295872852143607808
rocksnclouds739,2020-08-18T23:58:57.000Z,"Mask bullying is real. If your child experiences. government has ignited one against the other. beware. Who is doing this?  Fellow students and teachers pushing Nazi agenda Are there consequences? Yes, for bully and victim. most laws r on the books stopbullying.gov/resources/laws …",https://t.co/xElVaFlWnx,1295872848876261377
SallySueIam,2020-08-18T23:58:57.000Z,"Countries led by women had nearly half the COVID-19 deaths of men-led ones, study says  miamiherald.com/news/coronavir …",https://t.co/KqPE6Nd8Zb,1295872848385445888
Gwyllim1,2020-08-18T23:58:57.000Z,Another one! newsbreak.com/news/204271484 …,https://t.co/LBa868JL7X,1295872845759864832
Syl_Kane,2020-08-18T23:58:56.000Z,"True, but bacterial pneumonia can follow as an infection secondary to COVID or other infections, or other health issues. My dad just got over bacterial pneumonia that his doc was caused by a pulmonary embolism",,1295872844346392584
sfaza1993,2020-08-18T23:58:56.000Z,Robertson/Trent anyone saying Davies doesn't know ball. Yes he has the potential to be. But right now it's robbo. Just cause you saw him the other day in the UCL doesn't mask a whole season. But as per it's football Twitter. You have people saying Maguire is as good as vvd.  x.com/Futdonk_/statu …,https://x.com/Futdonk_/status/1295869741677117442,1295872844090482688
JulianaTrueJB,2020-08-18T23:58:56.000Z,i think that’s my plan for thursday! i felt like i was inhaling my mask today. 0/10.,,1295872844044410885
alexgetsaround,2020-08-18T23:58:56.000Z,"Hah. At the risk of playing “teaching during covid poker”, (one) plan for us is teaching “a” lecture across many classrooms; broadcasting one academic lecturer across 3 rooms to allow for social distancing. That’s part of the week. The rest - online. It’s a challenge.",,1295872842211430401
MostlyKelly,2020-08-18T23:58:56.000Z,"Emma Donoghue's The Pull of the Stars, about the 1918 flu pandemic, just came out and is terrific.  Amazing that she wrote it before COVID was a thing; so much is so relevant now.",,1295872841863376897
jordy_ilahk,2020-08-18T23:58:56.000Z,Day 7. Student proceeds to take his mask off to show me “the really cool stain from his burgers”,,1295872841775226881
PulpNews,2020-08-18T23:58:56.000Z,"#Derek #Carr, Raiders adjusting to new 'strange' way of life in coronavirus-era NFL - Aug 18 @ 7:57 PM ET  oddcrimes.com/static/2020/08 …",https://x.com/hashtag/Derek?src=hashtag_click https://x.com/hashtag/Carr?src=hashtag_click https://t.co/fTo39lqsJU,1295872841070587905
raacquelv,2020-08-18T23:58:55.000Z,That hair mask was very much needed after this weekend,,1295872840361627649
HaythamMatthews,2020-08-18T23:58:55.000Z,"""Guterres and his allies see that turmoil in global oil markets, combined with massive expansions of national budgets to help economies recover from the coronavirus, is a once-in-a-generation opportunity for them to green national economies."" 2/2",,1295872839694917632
JBrosenburg,2020-08-18T23:58:55.000Z,Meanwhile Georgia is opening its schools and trying to have a football season.  @GovKemp  is doing all he can to make sure COVID-19 infects and kills as many Georgians as he can.   White House says Georgia now leads nation in rate of new virus cases  ajc.com/news/white-hou …,https://x.com/GovKemp https://t.co/HZ1XJcBt0O,1295872839380328452
RSwirling,2020-08-18T23:58:55.000Z,I am alone in quarantine. I have time for all kinds of inconsequential shit.,,1295872837769560065
Weegee,2020-08-18T23:58:54.000Z,"RE: Our movie: ""VInyl Nation"" we're partnering w/ indy movie theaters/record stores/radio stations and live music venues splitting ticket proceeds 50/50. We wanna raise serious money for the music ecosystem decimated by COVID-19. Whom would you like us to raise some cash for?",,1295872834099585024
briTwerk,2020-08-18T23:58:54.000Z,today i went on a starbucks run the first day of my new job and i was wearing scrubs and someone literally tapped me and goes “are those scrubs? how do you feel ab this covid situation” and i had to tell this man i am not a doctor i just work at a doctors office,,1295872833134964738
PhoebeeAlexx,2020-08-18T23:58:54.000Z,Anxiety in lockdown  phoebealexandra.home.blog/2020/08/19/anx …,https://t.co/7jjjGILSJ7,1295872832828772352
KTABTV,2020-08-18T23:58:54.000Z,Texas mother opens up about passing COVID-19 to newborn  trib.al/Jx62aXb,https://t.co/pHzPYKFijL,1295872832543621134
ErikRam48148935,2020-08-18T23:58:54.000Z,"A leader who believes in children's acts when they see inequity advance throughout our nation. We need leaders who are committed to creating #access #change & #opportunity, especially during a pandemic.  @stevenmnuchin1  @MarkMeadows  #Education #FundEducation #Equity #DigitalDivide",https://x.com/hashtag/access?src=hashtag_click https://x.com/hashtag/change?src=hashtag_click https://x.com/hashtag/opportunity?src=hashtag_click https://x.com/stevenmnuchin1 https://x.com/MarkMeadows https://x.com/hashtag/Education?src=hashtag_click https://x.com/hashtag/FundEducation?src=hashtag_click https://x.com/hashtag/Equity?src=hashtag_click https://x.com/hashtag/DigitalDivide?src=hashtag_click,1295872832392503296
jasperward94,2020-08-18T23:58:53.000Z,"The Ministry of Health said yesterday 32 COVID-19 cases were hospitalized.   Today, it said 78 were hospitalized.",,1295872830572306435
politik_nadenik,2020-08-18T23:58:53.000Z,"In the end, brutal lockdowns in the USA will cause more damage than Covid-19. The economical fall out will kill more people in the long run. More suicides, lower quality food, and the 24/7 scaremongering will leave a generation with serious mental problems.",,1295872829649543168
reallypeanut,2020-08-18T23:58:53.000Z,"lrt I had a cinema professor that gave us no assignments whatsoever we just watched movies all semester and then we were supposed to have a final on everything and then when the pandemic hit he emailed us that he'll post the final the next week and then just never did, I got an A",,1295872829091610624
AusAirForce,2020-08-18T23:58:52.000Z,A pathology lab has been set up at Australia's main operating base in the Middle East to provide quick-time results of COVID-19 testing.  Find out more about SQNLDR Helen Webb and how her #STEM background helps her work:  bit.ly/STEM-Saves-Liv …  #AusAirForce #ScienceWeek,https://x.com/hashtag/STEM?src=hashtag_click https://t.co/sRQG3eAcxu https://x.com/hashtag/AusAirForce?src=hashtag_click https://x.com/hashtag/ScienceWeek?src=hashtag_click,1295872827673870336
RevoPT,2020-08-18T23:58:52.000Z,Keep to level up your training from home regime during lockdown?  Check out our top 5 tips to get the most out of your at  home sessions. apple.news/AbYMi117nRyGjc …,https://t.co/GcaDMp14a5,1295872826461704193
StanfordHumRts,2020-08-18T23:58:52.000Z,"On the anniversary of #WomensVote100 in the U.S., #humanrights student Lauryn Johnson sat down with Nicole Baran, an academic/advocate in the field of gender studies, to discuss how #COVID19 is affecting womxn.  Spotify:  spoti.fi/2EdryzJ Apple:  apple.co/3ghHYoh",https://x.com/hashtag/WomensVote100?src=hashtag_click https://x.com/hashtag/humanrights?src=hashtag_click https://x.com/hashtag/COVID19?src=hashtag_click https://t.co/O7GKav5jfR https://t.co/4ANl5ueL0S,1295872826444926976
honolulu_parks,2020-08-18T23:58:52.000Z,"To help spread the word on help available during the pandemic, several info graphics have been repurposed from LA County by  @Oahu_DEM  to inform the hard-hit Pacific Islander community.  Included here are Marshallese, Samoan, Tongan, & Chuukese. More at:  oneoahu.org/translations",https://x.com/Oahu_DEM https://t.co/u0D1DaEWdZ,1295872826197422081
MikoLCFC,2020-08-18T23:58:52.000Z,"Have you heard about the global pandemic? Yes, that might be a problem for any leader.  You try and hide your tears behind the emojis and it really doesn’t work. I can see straight through you. You are upset that you aren’t a success in life and so you try to think mine is fake.",,1295872825098735616
WKRG,2020-08-18T23:58:52.000Z,More border Hispanics added to COVID-19 vaccine human trials in South Texas  bit.ly/3kQGxAq,https://t.co/0lEdf4XfnU,1295872824192782336
waveyabi,2020-08-18T23:58:51.000Z,"Amazing there’s a few songs I’ve been listening to since lockdown that still give me joy, I am cured of depression? Is that what this is",,1295872823228014592
SanDiegoData19,2020-08-18T23:58:51.000Z,Mask pushing.  Lost my vote. #Trump2020,https://x.com/hashtag/Trump2020?src=hashtag_click,1295872821504036864
lawleanne042,2020-08-18T23:58:51.000Z,It's been 5 months and Ohio is under Dewine's control. When is his 4 to 6 mandatory mask BS ending? IMO he will not get rid of the masks mandate. I bet he is ramping up all this testing at school/ colleges so he can lock us down before election.,,1295872821332254720
GarlandLinkenh1,2020-08-18T23:58:51.000Z,Wholesome Australian libraries made thousands of calls to check on elderly members during COVID-19 lockdown   x.com/i/events/12937 …,https://x.com/i/events/1293712071138279427,1295872820556292096
netz_melb,2020-08-18T23:58:50.000Z,The source of Victoria's deadly 2nd Covid19 wave was traced back to Melbourne quarantine hotels.  Why did Daniel Andrews let thousands of isolated people out of hotels when they refused Covid-19 tests? Why were unskilled guards used to manage it?  #springst #covid19vic #CovidDan,https://x.com/hashtag/springst?src=hashtag_click https://x.com/hashtag/covid19vic?src=hashtag_click https://x.com/hashtag/CovidDan?src=hashtag_click,1295872819096481792
allandunaway,2020-08-18T23:58:49.000Z,When you need to sneak out of town without passing a COVID relief bill but also have a fundraiser thrown by one of your swanky wealthy corporate donors #DitchMitch,https://x.com/hashtag/DitchMitch?src=hashtag_click,1295872815061766145
mariwhitehurst1,2020-08-18T23:58:49.000Z,I agree with this statement. Snd I think it’s possible. Trump dismantled GWBs pandemic protocol. I imagine  it kinda pissed the old boy off,,1295872814961106950
PurDistro_CA,2020-08-18T23:58:49.000Z,Kudos to Cos and Mary. This says a lot about people who care about the air you breathe! Taking care of clients and staff is so important during COVID-19.,,1295872814055133184
KevinMBlkbrn,2020-08-18T23:58:48.000Z,"I wasn’t pleased with the mask mandate, if that’s the worst he does, we’re solid.",,1295872810716405761
AhamChriss,2020-08-18T23:58:47.000Z,5th Sunday after covid 19 lockdown,,1295872806824161281
Forbes,2020-08-18T23:58:47.000Z,The University of Notre Dame has joined UNC-Chapel Hill in calling off in-person classes just weeks into the semester  on.forbes.com/6019GlMhf,https://t.co/SSR1xiRaHQ,1295872806815662080
Angie60681708,2020-08-18T23:58:47.000Z,@IAGovernor  is a trump sycophant who wouldn’t dare go against trump. She won’t protect your right to vote by mail during a pandemic. It’s disgusting. #CovidKim needs to go. What a demonstrably idiotic lack of leadership.  x.com/AGIowa/status/ …,https://x.com/IAGovernor https://x.com/hashtag/CovidKim?src=hashtag_click https://x.com/AGIowa/status/1295831521673216000,1295872806362775552
JosephS26172955,2020-08-18T23:58:46.000Z,If GEORGE FLOYD was NOT killed and he only died within the context of discipline or fired BUT FOR a pandemic where Minneapolis was double duty pep rally before and during first wave of Covid so export virus and revolution on account of America's inability to intervene DHS MASKED?,,1295872799924338688
Robinp34399637,2020-08-18T23:58:45.000Z,I’m pretty sure we all know this has been more complicated than anyone knew. Stop blaming the president for this. He didn’t cause it and he took appropriate measures to try to mitigate it. The CDC wasn’t helpful. Wear a mask don’t wear one the narrative changes every day,,1295872797491843072
MattSmithMN,2020-08-18T23:58:45.000Z,"Also we have 5.5 MILLION cases of Covid and 170,000 deaths.  So this pardon means nothing to anyone.  Merely a distraction. And shame on you for pushing it as if it were significant news.",,1295872796954955776
LycorisRadiatta,2020-08-18T23:58:45.000Z,wait until my spotify year summary  shows like 20 versions of beneath the mask for every single month since I made the playlist   it's literally the only thing I listen to anymore,,1295872796892037125
OneJerseySchorr,2020-08-18T23:58:45.000Z,"#COVID19 in New Jersey. What we know: -188,098 positive cases -14,086 deaths -468 people are hospitalized -41 ventilators in use -22 patients discharged yesterday -Rt now at 1.05 -Alaska and Delaware back on the self-quarantine list -Federal judge rules against theater owners",https://x.com/hashtag/COVID19?src=hashtag_click,1295872795117846529
AnnaM99878890,2020-08-18T23:58:45.000Z,"Karenkind. The racist, white, who want her freedom to get her roots done and can't wear her mask...",,1295872794643836929
ChrisinNac,2020-08-18T23:58:44.000Z,"After browsing her timeline and seeing it's NOTHING but covid fear-mongering, I'm okay with this treatment of her...",,1295872792290893826
