User_name,Datetime,Content,Links,Tweet_ID
SWindsorPatch,2020-09-30T23:58:45.000Z,State officials want to purchase the former Manchester Sam's Club to store coronavirus-related personal protective equipment.  trib.al/ftYz5gN,https://t.co/79Xf3cLHT9,1311455473879732224
sfargon,2020-09-30T23:58:45.000Z,Salish Lodge   komonews.com/news/coronavir …,https://t.co/9hERoXxubu,1311455472663195648
TreRutz,2020-09-30T23:58:44.000Z,I’m ready to be a stay at home dad now. Yikes,,1311455470327148546
WHartfordPatch,2020-09-30T23:58:43.000Z,State officials want to purchase the former Manchester Sam's Club to store coronavirus-related personal protective equipment.  trib.al/9xubhuj,https://t.co/W6mCeCa4ky,1311455467001044993
BethesdaCA,2020-09-30T23:58:43.000Z,"Our annual Camp Bethesda was cancelled b/c of COVID. To cheer up the disappointed campers, Camp staff Saundra and Katelyn sent each person a 'package of fun': a photo of each camper, a certificate, and a few small items. Here's Nick looking through the items he received.",,1311455466157821953
japancoalenerg1,2020-09-30T23:58:42.000Z,Covid-19 ship in Australia raises seaborne supply fears  argusmedia.com/ja/news/214572 …,https://t.co/ZcSIuDaGRI,1311455462886260736
conradseitz1,2020-09-30T23:58:42.000Z,COVID-19 in India: large study shows surprisingly low death rates among elderly: ScienceMag.  conradseitz.com/2020/09/30/cov …,https://t.co/INNx73gHpL,1311455460315275264
Karyera_com,2020-09-30T23:58:41.000Z,"Left unemployed because of Covid, many people in their fifties are battling an ageist corporate India, while trying to reinvent themselves to get back in the ga #findajob  mumbaimirror.indiatimes.com/others/sunday- …",https://x.com/hashtag/findajob?src=hashtag_click https://t.co/4lDKZp8MKc,1311455459807842305
DellaMamie,2020-09-30T23:58:40.000Z,Schools Update: Teachers Union Advises City To Shut Down 80 Public Schools In COVID Hot Spots  gothamist.com/news/nyc-schoo … via  @gothamist,https://t.co/J2aDlnZPMr https://x.com/gothamist,1311455455852531715
GaryRey11711720,2020-09-30T23:58:40.000Z,"While Covid-19 has many people working from home, now is a great time to work on your self branding so you can re-enter the workforce on the right foot! Check out this Forbes article on some simple steps that make a big difference!  bit.ly/2SeThDS  #OrgDevFall2020",https://t.co/5PJSPSAXMy https://x.com/hashtag/OrgDevFall2020?src=hashtag_click,1311455455475101696
radionz,2020-09-30T23:58:40.000Z,#LIVE Director of Public Health Dr Caroline McElnay is giving an update on Covid-19 cases in New Zealand.,https://x.com/hashtag/LIVE?src=hashtag_click,1311455451947524097
TheDebbieMia,2020-09-30T23:58:39.000Z,"They'd either have to rely on family. Or fork out big bucks in daycare costs... during a pandemic.  Tho, I know I couldn't switch roles with my partner. I'm not wired for the domestic life.",,1311455451209441280
CuberyHQ,2020-09-30T23:58:39.000Z,The week of Halloween in the US accounts for a staggering 8% of yearly confectionary sales. It will be interesting to see how this stacks up in 2020 with Covid-19.  Here's a look at how 10 product innovations performed in 2019...  #fmcg #cpg #insights cubery.com/blog/innovatio …,https://x.com/hashtag/fmcg?src=hashtag_click https://x.com/hashtag/cpg?src=hashtag_click https://x.com/hashtag/insights?src=hashtag_click https://t.co/zfj3wgJefv,1311455450844413952
SethForestier,2020-09-30T23:58:39.000Z,ITS THE PANDEMIC SPECIAL,,1311455447723974656
MOTHPOSTlNG,2020-09-30T23:58:38.000Z,"totally agree with you on UT’s stupid COVID handling!! but i think what they mean by “quarantine” is, like, the ~actual procedure for what you do if you’ve been exposed to the disease~ versus the broader lockdown/stay-at-home orders we’ve been calling “quarantine” since march",,1311455447178776577
hscheinukphoto,2020-09-30T23:58:38.000Z,Baseball is back at The Box!   #LSU begins fall ball practice during the #coronavirus pandemic. This is the first time we've seen the #Tigers in action since March.  :  bit.ly/3cJuIbE,https://x.com/hashtag/LSU?src=hashtag_click https://x.com/hashtag/coronavirus?src=hashtag_click https://x.com/hashtag/Tigers?src=hashtag_click https://t.co/wCHd0jpH0c,1311455446113411073
NEndoscopy,2020-09-30T23:58:38.000Z,Check out the different pillars on this graph. Must have meant that the amount of COVID in the community was much more than we expected...,,1311455445668761600
bride2b1972,2020-09-30T23:58:38.000Z,"Travel rules, not based on science, were put in place during Covid.  #COVID19  Ski, Party, Seed a Pandemic: The Travel Rules That Let Covid-19 Take Flight  nyti.ms/34bs8HB",https://x.com/hashtag/COVID19?src=hashtag_click https://t.co/o4PBg6POSs,1311455444037177344
fight3fight3,2020-09-30T23:58:37.000Z,Check out this cartoon  theweek.com/cartoons/94082 … via  @TheWeek,https://t.co/NqTaLiAeET https://x.com/TheWeek,1311455442481152001
KaMeLPullin,2020-09-30T23:58:36.000Z,"I work in a lab and take public transit. I walk in the door, take my shoes off, drop pack, remove gloves, then pants, then my jacket, both onto a rack by door, go wash my hands, remove my mask, wash my face. If I go shopping, I let things sit on counter for 3 hours to half day.",,1311455438756548608
removalman123,2020-09-30T23:58:36.000Z,Coronavirus: Dorset festival artwork tribute to victims  kjebusiness.com/coronavirus-do …,https://t.co/OZRkDsaBGl,1311455436516753410
removalman123,2020-09-30T23:58:36.000Z,Covid: Woman ‘heartbroken’ after terminating baby alone  kjebusiness.com/covid-woman-he …,https://t.co/M9gfeebpJq,1311455436449755136
removalman123,2020-09-30T23:58:36.000Z,Bank warned ministers Covid loans were fraud risk  kjebusiness.com/bank-warned-mi …,https://t.co/B4Spo3OW8P,1311455436273524737
KrownedKouture,2020-09-30T23:58:36.000Z,It’s time to confront and change the narrative... Be the oxymoron personified... While wearing your  high of course. . bornkrowned.com/products/bad-t … . #badthingshappeninphiladelphia #philadelphia #philly #fashion #vote #clothes #supportblackownedbusinesses #blackexcellence #love,https://t.co/XvMKahWxnu https://x.com/hashtag/badthingshappeninphiladelphia?src=hashtag_click https://x.com/hashtag/philadelphia?src=hashtag_click https://x.com/hashtag/philly?src=hashtag_click https://x.com/hashtag/fashion?src=hashtag_click https://x.com/hashtag/vote?src=hashtag_click https://x.com/hashtag/clothes?src=hashtag_click https://x.com/hashtag/supportblackownedbusinesses?src=hashtag_click https://x.com/hashtag/blackexcellence?src=hashtag_click https://x.com/hashtag/love?src=hashtag_click,1311455436139302912
Edmontonsun,2020-09-30T23:58:35.000Z,COVID-19: 11 of 15 regions in Edmonton on provincial watch list  edmontonsun.com/news/politics/ …,https://t.co/Ujd7nWOepK,1311455433186570241
LucasFrosst,2020-09-30T23:58:35.000Z,The shit I deal with. Didn’t have a mask and went back to his car and tried to get in with this before I banned him lmao,,1311455430808199169
ClueHeywood,2020-09-30T23:58:34.000Z,If avoiding COVID determined the playoffs the  @Dbacks  would be the number one seed,https://x.com/Dbacks,1311455430258745344
wacko01101,2020-09-30T23:58:34.000Z,"@marykbruce  Love seeing your reports, and look forward every day to see your reporting. Stay safe out there. Wear a mask and try to keep your distance.  @ABC  @GMA  @DavidMuir  @rachelvscott  @GStephanopoulos  @danbharris  @ABCPolitics",https://x.com/marykbruce https://x.com/ABC https://x.com/GMA https://x.com/DavidMuir https://x.com/rachelvscott https://x.com/danbharris https://x.com/ABCPolitics,1311455429877100545
McnicolSalazar,2020-09-30T23:58:34.000Z,It only says consider wearing a face mask. Too chickenshit to insist.,,1311455428128067584
WeTlkFntsySprts,2020-09-30T23:58:34.000Z,"Very excited for this South Park Pandemic special  It is EXACTLY what this country needs after the last six months and last nights disaster of a ""Presidential Debate""",,1311455427872411655
ARealEstateBot,2020-09-30T23:58:33.000Z,#realestate Five Ways The Pandemic Has Influenced Interior Design Trends In 2020  ift.tt/3l1TE18,https://x.com/hashtag/realestate?src=hashtag_click https://t.co/GBGiGGV13n,1311455424294653957
TheWildling,2020-09-30T23:58:32.000Z,"""Definite mask-hair there.""",,1311455421144674305
pollinaire,2020-09-30T23:58:32.000Z,"i only ever go to work, literally, and i wear a mask any time i leave my desk.  the ONLY place i’ve gone is an outdoor memorial ceremony for my great uncle on sunday.  i think odds are good it’s not covid because i’ve been careful, but my cough is definitely getting worse...",,1311455419412471808
arianaspinden,2020-09-30T23:58:32.000Z,I just had a representative tell me that educationally Capellas students aren’t affected but COVID because their courses are online. As if COVID isn’t altering people’s financial situations and their ability to fully focus on school as they normally would. Very disappointing.,,1311455419290787840
real_eric_ohrn,2020-09-30T23:58:32.000Z,On the plus side at least only 918 people died of COVID in the US yesterday!,,1311455418418442240
KrisHol17996510,2020-09-30T23:58:31.000Z,Well said. I like when Sleepy Joe said that covid is killing people in the suburbs lol. What really took the cake was how he said we need psychologists at calls with police officers. He said they should be there to talk police down from using force lol. What a joke.,,1311455416421941249
MysticalKenny,2020-09-30T23:58:31.000Z,"Were.  Perhaps event management isn’t a priority for the U.K.’s population during a pandemic or an economic depression.  During these unprecedented times, who do you think is more important...a supermarket delivery driver, or a sound engineer for a corporate launch event?",,1311455415587270656
sensibleandsome,2020-09-30T23:58:30.000Z,Covid arms seems to fit at the moment,,1311455413854928898
NYCTeacher11,2020-09-30T23:58:30.000Z,"@UFT  Please know that we, teachers want to do the jobs we love in person, but we are risking our lives and our student's lives. YES we are happy to see our students but we will CRY when we hear that our students & their families got COVID. Opening is not SAFE YET!  @MOREcaucusUFT",https://x.com/UFT https://x.com/MOREcaucusUFT,1311455412231827457
Techfans3,2020-09-30T23:58:30.000Z,"Pandemic dashes Apple Days, but fruit, cider is abundant  techfans.co.uk/pandemic-dashe …",https://t.co/zy5wPJscdP,1311455411522998277
JackiBetta,2020-09-30T23:58:30.000Z,There are countries hit by Covid who saved lives AND saved their economies.  Not us. Thanks Trump.,,1311455410239528961
SchMieke,2020-09-30T23:58:30.000Z,You can literally see that EVERYONE is wearing a mask. Wtf is wrong with you?,,1311455410189144064
LuciferaWrey,2020-09-30T23:58:29.000Z,I feel this so much. I've been single since I was 15 and I live in the country so I didn't really see people or have intimacy even before social distancing. Social distancing is just like the nail in the coffin for me I guess lol,,1311455409258090496
ebmcneil2,2020-09-30T23:58:29.000Z,Covid 19.,,1311455408981184513
morning_news24h,2020-09-30T23:58:29.000Z,"This could be the coronavirus cure we’ve been waiting for, and it’s not a vaccine  albahuth.info/this-could-be- …",https://t.co/BJ8jaAcsPe,1311455408016355329
NorthPsych,2020-09-30T23:58:29.000Z,"Remote learning at home can protect kids from COVID-19, but does it set back their social-emotional development? Children’s mental health relies on high-quality relationships within families.   theconversation.com/families-can-s …    northpsych.com.au",https://t.co/oyM8UKrMzv https://t.co/JLtjh5WWaO,1311455407848648705
ThekidJ_c,2020-09-30T23:58:29.000Z,Wonder why Flint wasn’t mentioned last night or if it will be. Trump mentioned how Michigan felt like a prison on lockdown. I’m sure prisons got better water than flint tho smh,,1311455406988898306
maelstrom143,2020-09-30T23:58:29.000Z,ACEP // ACEP-AAEM Joint Statement on Physician Misinformation  acep.org/corona/COVID-1 …,https://t.co/Fh094IixtK,1311455406267478016
Nana_Luigi,2020-09-30T23:58:28.000Z,"Live tweet for the south park pandemic special starts here.  Really hoping its decent, cause it may be the only episode we're getting for a while.",,1311455405294399489
willhammerstrom,2020-09-30T23:58:28.000Z,"You are completely blind not to see the bias, the censorship, the slandering of anyone, no matter how qualified dares question the narrative...hydroxychloroquine/budesonide/Ivermectin are dangerous and don't work, cloth masks work against virus transmission, covid kills seriously",,1311455402333216772
kixxxah,2020-09-30T23:58:28.000Z,"I can’t believe I was going to bring slap ass Friday back and then COVID hit and then I graduated ,now frat guys do it every day of the week",,1311455402056278016
GloriaKepler4,2020-09-30T23:58:27.000Z,"Pass the problem  solvers bill, Top House Democrat: Parties 'much closer' to a COVID deal 'than we've ever been'  newsbreakapp.com/n/0X9xOFzW?s=a …",https://t.co/uhOtvoNCNT,1311455401225990144
Christonic5,2020-09-30T23:58:27.000Z,Can i move to canada with you? I promise i don't have covid. LOL,,1311455399627952128
ArlesmonVTuber,2020-09-30T23:58:26.000Z,"@Mask_Freak  hello, can you do a commission in that style?  Your MD is closed, thus why im asking here.  x.com/RyujisWeebMeme …",https://x.com/Mask_Freak https://x.com/Mask_Freak https://x.com/RyujisWeebMemes/status/1311449621114376192?s=19,1311455396641402881
CBCLondon,2020-09-30T23:58:26.000Z,"Ontario police used COVID-19 database illegally, civil rights groups find  ift.tt/2Gt80s7",https://t.co/TSJJ72LU1F,1311455396545036289
_ThisJustin_,2020-09-30T23:58:26.000Z,Would be hilarious if he wore a Biden mask and said “hey I’m just trying to be treated like a Democrat.”,,1311455396469538816
Jtstar01,2020-09-30T23:58:26.000Z,You know what works better then a mask? Not sending people with the Rona back to the nursing home they came from with at risk people who didn’t have it,,1311455396150812673
Ten_Across,2020-09-30T23:58:26.000Z,'None of Us Are Immune': Growing Number of Elected Officials Diagnosed With Covid-19 - Route Fifty  route-fifty.com/management/202 …,https://t.co/caAnSPAKAt,1311455395509018624
LaurineMc,2020-09-30T23:58:26.000Z,Already over this quarantine stuff #Day2,https://x.com/hashtag/Day2?src=hashtag_click,1311455394271764483
DJcalligraphy,2020-09-30T23:58:26.000Z,Wouldn't it be better if she was wearing you like an N95?,,1311455393386651648
nz_erewego,2020-09-30T23:58:26.000Z,"Eventually, all...no need to ignore a pandemic that hastens there deaths",,1311455393340555264
BakerMegD,2020-09-30T23:58:25.000Z,I’m so excited for the pandemic special of South Park tonight,,1311455392011030529
KnowledgeNameko,2020-09-30T23:58:25.000Z,"Covid to push Hawaii home prices down, UHERO says Pacific Business News (Honolulu)  goo.gl/N9N9hf",https://t.co/3g90udWr7d,1311455391767818240
zimonlinehealt1,2020-09-30T23:58:25.000Z,Coronavirus watch,,1311455389989380100
KnowledgeNameko,2020-09-30T23:58:25.000Z,VIRUS TRACKER - Sept. 30: 121 New COVID-19 Cases In Hawaii Honolulu Civil Beat  goo.gl/N9N9hf,https://t.co/3g90udWr7d,1311455389163159558
PhilBrown62,2020-09-30T23:58:24.000Z,"More bad news for trump supporters...  Neanderthal genes increase risk of serious Covid-19, study claims",,1311455387317493760
DORKpodcast,2020-09-30T23:58:24.000Z,Reminder: South Park Pandemic Special is on in 2 minutes.,,1311455386868867073
ThemoseTV,2020-09-30T23:58:24.000Z,@FortniteGame  can you please put Rippley and the Merry Marauder outfit into the game shop. I was not fortunate to play during those times and I so badly want them. I missed Rippley by a season and would love the skin even if I cannot earn the purple variant!,https://x.com/FortniteGame,1311455385811812354
094736151356q,2020-09-30T23:58:24.000Z,My 7 year old daughter is obsessed with videos of “teens” that I think are 20+ playing Roblox. This is a hell made by COVID and I will never escape.,,1311455385644081153
MikeChopowski,2020-09-30T23:58:23.000Z,Im so ready for this South Park Pandemic Special,,1311455383408594949
aeccarolina,2020-09-30T23:58:23.000Z,"Due to pandemic #Shutdowns, our client's production lines were falling short of demand. #SOLUTION Brad Dowless wraps up a 33% #Productivity #Increase with custom #Hytrol #PalletConveyor and #EndOfLine #Automation.  aec-carolina.com/blog/33-percen …",https://x.com/hashtag/Shutdowns?src=hashtag_click https://x.com/hashtag/SOLUTION?src=hashtag_click https://x.com/hashtag/Productivity?src=hashtag_click https://x.com/hashtag/Increase?src=hashtag_click https://x.com/hashtag/Hytrol?src=hashtag_click https://x.com/hashtag/PalletConveyor?src=hashtag_click https://x.com/hashtag/EndOfLine?src=hashtag_click https://x.com/hashtag/Automation?src=hashtag_click https://t.co/uNhGpb3GlI,1311455380770361344
Brettdecal,2020-09-30T23:58:23.000Z,I don’t think they have gotten worse than before. They have just become the highlight of my day! It’s the small things that help get you through a lockdown.,,1311455380728279040
eilidhfife,2020-09-30T23:58:23.000Z,I have read of a few sightings of these birds - have started a wee bit of birdwatching since lockdown. They're beautiful aren't they?,,1311455380720037889
NathanielParish,2020-09-30T23:58:23.000Z,"""As Mexico continues to grapple with COVID-19, the work of journalists and human rights defenders is essential to guaranteeing an effective public health response and recovery. They play a critical role in providing oversight.""",,1311455380443144194
dukegsu,2020-09-30T23:58:22.000Z,These things had COVID-19 on the controllers in 2001,,1311455379801411584
Pandora_mg,2020-09-30T23:58:22.000Z,"Maybe this is why he’s not interested in fighting it. RT @NadiaOwusu1: Just fact-checked what Biden said in the debate: 1 in 1,000 Black Americans has been killed by COVID.  It's true. But to write that number down and type it into a search engine was still devastating.",,1311455378983411712
angxl_x_bela,2020-09-30T23:58:22.000Z,reason I am voting biden: 1) I leave the country next year if everything goes well and I dont want covid to be a barrier for me to leave.  after that you all are on your own (unless a candidate pledges to end foreign gain tax),,1311455376534110214
JDworetzky,2020-09-30T23:58:21.000Z,"Where are 206,000 people.  Oh that’s right, they died of COVID 19 during President Trump’s term of office.",,1311455375296729088
morning_news24h,2020-09-30T23:58:21.000Z,Doctors might not be able to save you from this one deadly coronavirus complication  albahuth.info/doctors-might- …,https://t.co/2xMQllQeTr,1311455374231379968
EdgarROlivo,2020-09-30T23:58:21.000Z,Check out my new article.  Get Out of Your Head. How Small Business Owners Can Overcome Fear during COVID-19 - Greater Phoenix In Business Magazine  inbusinessphx.com/leadership-man …,https://t.co/BxPJ7CGumH,1311455373807644677
morning_news24h,2020-09-30T23:58:21.000Z,"Ben Stiller, Lily James Join Anne Hathaway, Chiwetel Ejiofor in Doug Liman Heist Film ‘Lockdown’  albahuth.info/ben-stiller-li …",https://t.co/mXAAgU2DWk,1311455372327227393
CAH_Riggs,2020-09-30T23:58:20.000Z,"Two Queens have dropped out of  @canadasdragrace  drive in tour for Toronto  cuz they caught COVID. I feel bad cuz someone bought my ticket, but I really wish they would reschedule the event now. I wanted to see  @thequeenpri  perform so badly. . P.s. Get well soon!",https://x.com/canadasdragrace https://x.com/thequeenpri,1311455371299520512
bjenk,2020-09-30T23:58:20.000Z,The university's letter to staff says paycuts and furloughs could be possible due to a budget shortfall caused by COVID-19.,,1311455370892709889
MHGtweet,2020-09-30T23:58:20.000Z,"Well other than my business cratered, business associates died of Covid, we are stuck inside our house, can’t go to the gym or restaurants, can’t see our relatives and friends, travel, go on vacation. Everything else is great.",,1311455370485825536
Tomleegun,2020-09-30T23:58:20.000Z,Two fences away from his covid loving crowd.  Trump is a Pussy.  It is what it is.,,1311455369194016768
NYCTheMiC,2020-09-30T23:58:20.000Z,"So far today, The Cult of Lundqvist has accused me of being an ex-con, bringing ladies of the light to games, buying followers, starting Covid & eating children. However my favorite tweet is “NO ONE CARES ABOUT HIS OPINION” as they tweet about me for the 100th time. Love it! #nyr",https://x.com/hashtag/nyr?src=hashtag_click,1311455368921460738
AES_Jags,2020-09-30T23:58:20.000Z,"It doesn’t matter how big of mess our accidents cause in the cafeteria, our custodians always come to our rescue with a smile on their faces (even under their mask) and a twinkle in their eyes! We are so grateful to have the best custodiHEROES around!",,1311455368845955072
Tina1wthautism,2020-09-30T23:58:19.000Z,#Social bubbles are ending. Canadian winter coming. The #COVID isolation   x.com/i/events/13113 …,https://x.com/hashtag/Social?src=hashtag_click https://x.com/hashtag/COVID?src=hashtag_click https://x.com/i/events/1311375987683266563,1311455366358630401
ctvregina,2020-09-30T23:58:19.000Z,Potential COVID-19 exposures reported at Regina businesses regina.ctvnews.ca/potential-covi … #yqr #covid19 #sk,https://t.co/oQ5WsWb1Ya https://x.com/hashtag/yqr?src=hashtag_click https://x.com/hashtag/covid19?src=hashtag_click https://x.com/hashtag/sk?src=hashtag_click,1311455366161543172
HannJesch,2020-09-30T23:58:19.000Z,Now at the Boarding Gate: Coronavirus Tests  nytimes.com/2020/09/30/tra …,https://t.co/03f7CG2pYO,1311455364592918530
KimMauger,2020-09-30T23:58:18.000Z,Sorry you two are feeling lousy. Glad it not covid 19. Hope you and the little one are feeling better soon,,1311455363510800384
LiquorstoreWtf,2020-09-30T23:58:18.000Z,"@attell  this how us alcoholics, barfly’s survived Covid-19.",https://x.com/attell,1311455363263336450
VernonDavis,2020-09-30T23:58:18.000Z,"Lina Hidalgo quietly postponing Harris County foreclosures with executive orders: The judge has shut down the Bayou City Event Center on the first Tuesday of the month, the day foreclosure auctions must be held under state law, citing COVID precautions.  buff.ly/2GrxWnX",https://t.co/xyct0TH0ws,1311455361195540480
MDOT_BWB,2020-09-30T23:58:17.000Z,@MichiganDOT  Cash payments not accepted from eastbound  @MDOT_BWB  #BlueWaterBridge customers during the #COVID-19 #coronavirus pandemic. Thank you for your cooperation #MDOT,https://x.com/MichiganDOT https://x.com/MDOT_BWB https://x.com/hashtag/BlueWaterBridge?src=hashtag_click https://x.com/hashtag/COVID?src=hashtag_click https://x.com/hashtag/coronavirus?src=hashtag_click https://x.com/hashtag/MDOT?src=hashtag_click,1311455358980890624
JayTheDT,2020-09-30T23:58:17.000Z,"When is this ""virus scare"" gonna be over with. I'm tired of having asthma attacks because I need to wear a mask to work. #AskWho",https://x.com/hashtag/AskWho?src=hashtag_click,1311455356338401280
AlSosa57935569,2020-09-30T23:58:17.000Z,"ABC News: Pelosi, Mnuchin fail to strike coronavirus stimulus deal but talks will continue. abcnews.go.com/Politics/pelos …  via  @GoogleNews",https://t.co/FCsUPCLcOK https://x.com/GoogleNews,1311455355507888128
Cmullett69,2020-09-30T23:58:16.000Z,"""I'm sitting in the rain, just sitting in the rain.  What a boring feeling, I'm...waiting again.  He's late and he's loud, he just stirs up the crowd.   G-d help us, that we don't get Covid!""  *apologies to Gene Kelly*",,1311455352223916033
patcofone,2020-09-30T23:58:16.000Z,Chldren Felt Koala Bear Mask Farm Animal Woodland Animal Forest Animal Pretend Teach Learn Educational Imagination Home School Party Favor Australian Animal   etsy.me/38mWLd2 #craftychaching,https://t.co/ECzQfkkgOh https://x.com/hashtag/craftychaching?src=hashtag_click,1311455351624142851
sinz54,2020-09-30T23:58:15.000Z,"See, that's the subtext. The chance of death really is significantly lower for white folks below age 60 than for other groups. These COVID deniers are really thinking, ""Why should I make my life miserable in order to help save strangers with whom I have nothing in common?""",,1311455350260936704
pozlit,2020-09-30T23:58:15.000Z,A Covid Marshal,,1311455349568729088
gh0st0fbabyl0n,2020-09-30T23:58:14.000Z,well unlike in the past decades we have a global pandemic on our hands.,,1311455346557321222
Amorionnaise,2020-09-30T23:58:14.000Z,Pogba atm he looked gassed. Still recovering from covid I think,,1311455346402131968
PlayFrisbeer,2020-09-30T23:58:14.000Z,WTF do you do for a living where you still are unable to work or claim the insane benefits they've offered since the pandemic?,,1311455346075086848
dupij,2020-09-30T23:58:14.000Z,"Worried about people behind bars during this #pandemic? Us too. Join  @cut_50 's #EmpathyNetwork to get involved and fight for justice, health, and safety for our incarcerated population.  act.thedreamcorps.org/signup/join-en …",https://x.com/hashtag/pandemic?src=hashtag_click https://x.com/cut_50 https://x.com/hashtag/EmpathyNetwork?src=hashtag_click https://t.co/T3B6fZwf1K,1311455346074898434
poggydoggy,2020-09-30T23:58:14.000Z,"Not accurate numbers. How many flu cases, accidents, cancer deaths. They are ALL CALLED COVID",,1311455344506396675
the_resistor,2020-09-30T23:58:14.000Z,"If  @JoeBiden  were President, we would NEVER have LOST 211,170 Americans to COVID-19.   If  @JoeBiden  were President, we would NEVER have INFECTED 7,417,116 Americans with COVID-19.   Today  @realDonaldTrump  ~ The SUPER SPREADER in Chief heads to Minneapolis to INFECT More Americans",https://x.com/JoeBiden https://x.com/JoeBiden https://x.com/realDonaldTrump,1311455343872864256
Lagos_Car_Plug,2020-09-30T23:58:13.000Z,Social distancing!!!,,1311455341239046145
