User_name,Datetime,Content,Links,Tweet_ID
BearDanforth,2020-07-20T23:59:00.000Z,"But if you forgot your mask in a Tim Hortons, You get choked out and pepper sprayed. Brilliant.",,1285363613218283520
PANAsiaPacific,2020-07-20T23:59:00.000Z,"""Alarmingly,  @amnesty  documented cases where health workers who raise safety concerns in the context of the COVID-19 response have faced retaliation, ranging from arrest and detention to threats and dismissal.""  #FoodAndRightsNow bit.ly/2WACH3M",https://x.com/amnesty https://x.com/hashtag/FoodAndRightsNow?src=hashtag_click https://t.co/EOl3H7UDCe,1285363610315657216
OtterTailCoMN,2020-07-20T23:59:00.000Z,Be like a raccoon and wash your hands often and wear a mask! Together we can slow the spread! #protectothers #bettertogether,https://x.com/hashtag/protectothers?src=hashtag_click https://x.com/hashtag/bettertogether?src=hashtag_click,1285363610202464257
CantonRepdotcom,2020-07-20T23:59:00.000Z,"Gov. Mike DeWine's order to wear masks has little, if any, enforceable consequences. Tonight's poll asks: Should it be criminally enforced? Vote, discuss.  cantonrep.com/news/20200720/ …",https://t.co/LlukF286qz,1285363610039066624
macdonald_julie,2020-07-20T23:58:59.000Z,Oxford researchers take big step forward in race to develop coronavirus vaccine | The New Daily  thenewdaily.com.au/news/coronavir …,https://t.co/RiPgfNfkvN,1285363608742801413
TheLizbeth10,2020-07-20T23:58:59.000Z,. @GOP  only cares about power and keeping others from exercising their constitutional rights.  Bottoms: Kemp trying to ‘restrain’ her from talking to press about mask mandate  fox5atlanta.com/news/bottoms-k …,https://x.com/GOP https://t.co/gzpMpSEulS,1285363608109580289
TxBearCub69,2020-07-20T23:58:59.000Z,Really??? FIFTEEN + WEEKS into the pandemic & you’re going to congratulate him???  WTF?? You’re kidding right?? That’s FIFTEEN WEEKS TO LATE.,,1285363606641618944
Fraff13,2020-07-20T23:58:58.000Z,I’m not talking about Joe Biden. We’re talking about how Trump has dealt with the pandemic. One discussion at a time. Next time I tweet about Biden we can talk about him (no fan of his either)!,,1285363602027950080
247hustlers,2020-07-20T23:58:57.000Z,"Starting today, it's mandatory to wear a mask before going into shop at any Walmart store in the US. hustleovereverything.co/blogs/hustlers …",https://t.co/jMZzhZ0kC1,1285363599146393606
SaveSVTFOE5,2020-07-20T23:58:57.000Z,"How about some special episode for #SVTFOE about covid 19 with moralistic messages?  @DisneyTVA   And also, we can show you that such a rating could generate svtfoe, this would be a test towards the fans",https://x.com/hashtag/SVTFOE?src=hashtag_click https://x.com/DisneyTVA,1285363598865453064
Anushkanayakk,2020-07-20T23:58:57.000Z,I hope lockdown is over soon and you're in a better place,,1285363598621990912
Leo_RoseGold,2020-07-20T23:58:56.000Z,I miss when they called covid 19 the boomer remover :(,,1285363593274368000
gregHog1,2020-07-20T23:58:53.000Z,"After 3 months of refusal to wear mask (& politicizing it) after CDC recommended it, now Trump called his act patriotic and leadership. He keeps twisting facts time & again",,1285363580611641344
donmega1833,2020-07-20T23:58:53.000Z,"Yo he did it once and made fun of people who wore mask.  What do you think people are stupid ? The whole democrat party has been pushing this message for 6 months.   @BrianKempGA  , your boy, is suing Atlanta’s mayor over face coverings. FOH f you and him con artist",https://x.com/BrianKempGA,1285363580376940545
melissakoide,2020-07-20T23:58:52.000Z,Plz ck out  @FinRegLab 's new brief released today on credit reporting during the pandemic.   finreglab.org/wp-content/upl …  @Aarondklein  @thetenthkabir  @jentescher  #creditscore,https://x.com/FinRegLab https://t.co/L9ezuafrfs https://x.com/Aarondklein https://x.com/thetenthkabir https://x.com/jentescher https://x.com/hashtag/creditscore?src=hashtag_click,1285363577898127362
FishxRx,2020-07-20T23:58:52.000Z,"If one more person in my outer circle has a Covid scare I literally might have a heart attack. COVID won’t even make its way to me, I’ll already be dead : - )",,1285363575855472640
skzneos,2020-07-20T23:58:51.000Z,tw // rape  quit using victims of r*pe and s*xual abuse to push your anti-mask agenda. because i’m almost positive you’d be the type of person to turn around and victim blame.  t.co/AItfcORWa1,https://t.co/AItfcORWa1,1285363574488002561
gistland9ja,2020-07-20T23:58:51.000Z,US military medical teams dispatched to California hospitals hard-hit by Covid-19  gistland9ja.com/us-military-me …,https://t.co/HxeqDSX2Fm,1285363574349672448
AnnieAffan,2020-07-20T23:58:51.000Z,@pritipatel  can you please shorten the travel quarantine period for people who test negative before arriving??!! That should count for something!,https://x.com/pritipatel,1285363572852350977
gistland9ja,2020-07-20T23:58:51.000Z,"Coronavirus live news: Trump backs face masks as ‘patriotic’, EU set to agree stimulus  gistland9ja.com/coronavirus-li …",https://t.co/bMj6x3wFi1,1285363572365721603
harryt59_harry,2020-07-20T23:58:51.000Z,not a chance. but he gets a pass from this old guy because of his handling of this world pandemic and economic shutdown.  The liberals have been there for Canadians. No politician is perfect,,1285363572114173953
VianeyyLopez,2020-07-20T23:58:51.000Z,Being a stay at home mom is extremely exhausting . I miss working but I rather take care of my son myself than put him on daycare,,1285363571715715075
terpsfan3040,2020-07-20T23:58:50.000Z,Who exhales drywall dust? The mask is to protect others from you.,,1285363571329826818
alxslzy,2020-07-20T23:58:50.000Z,that vaccine from the UK tho,,1285363569719046145
msjonesIYN,2020-07-20T23:58:50.000Z,Wear a mask.,,1285363568926482435
auzziepatriot17,2020-07-20T23:58:50.000Z,Good to see  @JoeBiden  still social distancing from scrutiny.,https://x.com/JoeBiden,1285363568456511488
connosisseur,2020-07-20T23:58:50.000Z,WHO WOULD'VE FUCKIN GUESSED IT MATE THATS CRAZY ITS ALMOST LIKE CORONAVIRUS WASNT OVER YET,,1285363568142176256
rdpurkey,2020-07-20T23:58:50.000Z,4/5th Math/Sci teacher (all subjects due 2 COVID)  Usually share supplies -NOT this yr.  Many can't buy supplies so I buy out of pocket.  Also need things to keep social distancing.  Any help appreciated!  amazon.com/hz/wishlist/ls…,https://t.co/1aiCSqAE1d,1285363568079142912
Luke_Muckraker,2020-07-20T23:58:50.000Z,If people are made to wear a damn mask and change their way of life then Communist China has won the cold war. When the corruption in the reported numbers is addressed and people find out that cases are inflated by a factor of 10 more people will be totally pissed off at the lies,,1285363567886311424
mydemocracy,2020-07-20T23:58:50.000Z,Too good to miss. Protestors crash #Florida governor's briefing. Watch #DeSantis' ⁦ @GovRonDeSantis ⁩ reaction. #TrumpVirusCatastrophe #COVIDー19 #WearAMask #StayHomeSaveLives #StayHealthy #VoteLikeYourLifeDependsOnIt #Vote #Election2020 cnn.com/videos/politic …,https://x.com/hashtag/Florida?src=hashtag_click https://x.com/hashtag/DeSantis?src=hashtag_click https://x.com/GovRonDeSantis https://x.com/hashtag/TrumpVirusCatastrophe?src=hashtag_click https://x.com/hashtag/COVID%E3%83%BC19?src=hashtag_click https://x.com/hashtag/WearAMask?src=hashtag_click https://x.com/hashtag/StayHomeSaveLives?src=hashtag_click https://x.com/hashtag/StayHealthy?src=hashtag_click https://x.com/hashtag/VoteLikeYourLifeDependsOnIt?src=hashtag_click https://x.com/hashtag/Vote?src=hashtag_click https://x.com/hashtag/Election2020?src=hashtag_click https://t.co/RGThbYK9Yr,1285363567777198081
cnni,2020-07-20T23:58:49.000Z,"Colombia reported 6,727 new coronavirus cases on Monday, bringing the country’s total to 204,005, its health ministry said  cnn.it/2OHGCaP",https://t.co/obgww0B14u,1285363566787297281
CartierDon1,2020-07-20T23:58:49.000Z,It seem like  @GovKemp   dont care about the lives of the people who voted for him. I live in Atlanta and until the coronavirus is over i will continue wearing a mask and we knew he was with the KKK,https://x.com/GovKemp,1285363566531563520
emily_frone,2020-07-20T23:58:49.000Z,"A6: Right now, the big topic is COVID-19, and in the past, many stories and films have been made about similar situations. Students can learn from these sci-fi stories and predict various outcomes in this coming year, especially how to react to the situation. #sschat",https://x.com/hashtag/sschat?src=hashtag_click,1285363563666845697
TomRodgers197,2020-07-20T23:58:48.000Z,13 Tips From Dr. Fauci on How You Can Avoid Coronavirus | Best Life  bestlifeonline.com/fauci-tips/ #SmartNews,https://t.co/ADb6k6AwZ3 https://x.com/hashtag/SmartNews?src=hashtag_click,1285363561481437184
izzysaks,2020-07-20T23:58:48.000Z,It took you waaaay too long. As it’s “Covid/Coronavirus/Covid 19” not “China virus.” And China has Muslims in concentration camps but ya’ll are SILENT about that,,1285363561276088323
samirctc,2020-07-20T23:58:48.000Z,"@policecbecity   Sir,  What is the quarantine rules for those who are traveling from Chennai to Coimbatore ?  Thanks",https://x.com/policecbecity,1285363561120665600
_L0st_Star,2020-07-20T23:58:48.000Z,"—      She only stood there now, her claws digging into his neck. If she didn’t have a mask, he would’ve seen a wide smile.  ‘ say thar again? I couldn’t hear you :) ‘    Her hold only got tighter with that.  t.co/xpRTu1cv2Z",https://t.co/xpRTu1cv2Z,1285363560881762306
AuthenticStyle,2020-07-20T23:58:48.000Z,At the end of the day - feels good to take this off! #mask,https://x.com/hashtag/mask?src=hashtag_click,1285363560260890624
maltiq,2020-07-20T23:58:48.000Z,The Big Winner From COVID-19 Lockdowns Is Nature  popularmechanics.com/science/animal …,https://t.co/yDbfkpwT41,1285363559749128192
DoRtChristians,2020-07-20T23:58:48.000Z,THIS NEEDS THOUSANDS OF RETWEETS. Dr Carrie Madej shares IMPORTANT information on CV19 Vaccine . Thanks  @dahboo7  for finding this.     youtube.com/watch?v=URaZiE …,https://x.com/dahboo7 https://t.co/DV6XES2TId,1285363559518679042
katinbootz,2020-07-20T23:58:47.000Z,They are wasting time and money.  I will not be getting a vaccination.,,1285363557769424896
resparz66,2020-07-20T23:58:47.000Z,All your base out here in Texas that don't wear mask and cause trouble and violence will be disappointed cry babies. Looks like you will loose their votes too!!!!,,1285363557035630594
KaJo503,2020-07-20T23:58:47.000Z,"Trump is ignoring the fact that more than 140,000 people have died in the past 4 months from coronavirus.  In another 4 months that'll double, but he'd rather watch his Sturmabteilung paramilitary troops invade cities in major-Dem-controlled cities, making the chaos worse. 1/2",,1285363556607647745
sayawordortwo,2020-07-20T23:58:47.000Z,Quarantine day 127: I had a very productive day. Who am I?,,1285363556209299458
Orgetorix,2020-07-20T23:58:47.000Z,"Hong Kong third wave: how did city’s scariest surge in Covid-19 cases start, and what did authorities miss?  scmp.com/news/hong-kong … via  @scmpnews",https://t.co/rAyuPbGOrN https://x.com/scmpnews,1285363555253080065
LucyyKT,2020-07-20T23:58:47.000Z,Lol lockdown really changed everything,,1285363554741374977
RealSmokeyFoo,2020-07-20T23:58:46.000Z,I won’t wear a mask  @realDonaldTrump  . I won’t do it . I will not be muzzled .,https://x.com/realDonaldTrump,1285363554267340801
BarryPintu,2020-07-20T23:58:46.000Z,"Ditto, Amy. I really don't understand what's so hard about wearing a mask? Why is there so much resistance? Here in Australia, in the state of Victoria, COVID cases have spiked in some areas, b/c people refused to be tested & wear masks. These are mostly conspiracy theorists.",,1285363553096962049
tranquility22,2020-07-20T23:58:46.000Z,"Lisa, you had a chance to remove Trump from office — but you voted NO. Now look what’s happened. His negligence against COVID-19 has killed thousands of Alaskans.",,1285363552384159746
Debbie26788363,2020-07-20T23:58:46.000Z,"I bet your team threatened No TV until you took a picture in a mask! Yesterday you told Wallace you don’t believe masks help slow the pandemic.  Your not fooling anyone, you saw the real polls numbers yesterday. You don’t care about anyone except yourself.",,1285363552337960960
MohakGuptaMD,2020-07-20T23:58:46.000Z,Yes infact they already are. The Oxford vaccine phase 3 trials which includes children and elderly have been underway since two months.  They are very speedy.   Great read-  bloomberg.com/news/features/ …,https://t.co/Of30wMdVGY,1285363551532507136
KWMRradio,2020-07-20T23:58:46.000Z,Tune in right now (5PM) for the latest ~local~ updates about COVID-19 & more!,,1285363550941306882
jamiedlux,2020-07-20T23:58:46.000Z,That’s not a mask!?,,1285363550882533379
ehinsonhasty,2020-07-20T23:58:45.000Z,"I am not looking for perfection, just actually minimal contact with students in a safe environment.  It could take at least two years for a vaccine.  We can’t delay.",,1285363550119235584
pennylandart,2020-07-20T23:58:45.000Z,"Copied from  hopkinsmwedicine.org COVID-19: There have been approx 606,206 deaths reported worldwide. In the US 140,534 people have died of COVID-19, as of July 20, 2020 Flu: The WHO estimates that 290k to 650k people die of flu-related causes every year worldwide.",https://t.co/gyKYEA85a1,1285363548445724672
mrperks76,2020-07-20T23:58:45.000Z,@MattHancock  Why is Wigston in lockdown??,https://x.com/MattHancock,1285363547581616128
lenegriut,2020-07-20T23:58:45.000Z,"Check out new work on my  @Behance  profile: ""Quarantine""  be.net/gallery/101043 …",https://x.com/Behance https://t.co/1T7PeTbfQz,1285363546906415104
willchatmon,2020-07-20T23:58:45.000Z,I get the mask situation. Y’all ain’t gotta wear em while driving though. Y’all look crazy and light headed,,1285363546906341377
Jays1of1,2020-07-20T23:58:44.000Z,When a vaccination becomes available I wonder what the anti-Vaxer’s will do,,1285363546235207685
cobun,2020-07-20T23:58:44.000Z,"No I just really like ""Data Bridge"" and haven't been able to propose it anywhere!  But I'd be okay with ""Stay at Home Data""  Or  ""Flatten the Privacy """,,1285363545820069888
sunfight1,2020-07-20T23:58:44.000Z,Georgia hospitals divert ambulances as reports of full ICUs continue  11alive.com/mobile/article … via  @11AliveNews    @GovKemp  you're a menace to society and  @realDonaldTrump  that includes you.,https://t.co/3Q1XnMwRAB https://x.com/11AliveNews https://x.com/GovKemp https://x.com/realDonaldTrump,1285363545560031232
theresaboyle,2020-07-20T23:58:44.000Z,Fixed link:  nytimes.com/reuters/2020/0 …,https://t.co/nhTsggNtJ2,1285363545157390341
Texans_4_BETO,2020-07-20T23:58:44.000Z,"So you send your son back. And God forbid, he contracts covid, passing it along to you and your wife. And God forbid, one of them loses their life because of it. You still going to be pushing the same narrative? ""The numbers, the numbers. Her emails.""",,1285363544784080898
24x7_mynews,2020-07-20T23:58:44.000Z,There are 4 main consumption drivers in post-Covid India: Nielsen Global Connect  mynews24x7.in/there-are-4-ma …,https://t.co/Vmztw2jnm6,1285363543353819136
McKennaSusie,2020-07-20T23:58:44.000Z,Hold a public inquiry into the Government's handling of the Covid-19 pandemic  #Covid19 - Sign the Petition!  chng.it/2zq4rrcM via  @UKChange,https://x.com/hashtag/Covid19?src=hashtag_click https://t.co/VFMOrGBcl6 https://x.com/UKChange,1285363542854639620
johnabusch,2020-07-20T23:58:44.000Z,"We have two choices. One, wait until there is a vaccine, or two, commit violence, theft or arson while going about your life. Either protects against the virus.  x.com/seanmdav/statu …",https://x.com/seanmdav/status/1285310513686208512,1285363542745665537
__ice9,2020-07-20T23:58:44.000Z,"Interestingly enough, the Cubans invented recombinant interferon as well.  They were also nice enough to post a prospective cohort study for it in COVID-19, with a crude relative risk ratio of 0.274 against discharge and 0.312 for mortality. medrxiv.org/content/10.110 …",https://t.co/fcdjdeBHGE,1285363542561034241
Phiasco9,2020-07-20T23:58:43.000Z,Does he still bark when you wear a mask?,,1285363541650878464
BluebonnetNews,2020-07-20T23:58:43.000Z,"Liberty County not extending mask order, State order still in effect  bluebonnetnews.com/2020/07/20/lib …",https://t.co/JJ5Lc7dlsv,1285363540522655745
mschrissi830,2020-07-20T23:58:43.000Z,What’s good Covid Kin? #houstonstrong #houstontx,https://x.com/hashtag/houstonstrong?src=hashtag_click https://x.com/hashtag/houstontx?src=hashtag_click,1285363540430290944
OldLiberal55,2020-07-20T23:58:43.000Z,No but to the uneducated the tRUMP loves they beleive absolutely anything he says and he keeps insisting Covid-19 is just a flu and masks don't help.,,1285363540300369920
rebels2008,2020-07-20T23:58:43.000Z,It's bad for children under 2. I had the flu when I was 9 or 10 and I didn't have to go to the hospital. And that still doesn't mean that the coronavirus isn't overall worse than the flu. We have a flu shot but we don't have a vaccine for the coronavirus yet.,,1285363540069625858
inkstainedretch,2020-07-20T23:58:43.000Z,The #Eagles and  @cj_wentz  led the way in a Twitter blitz Sunday that might lead to zero preseason games and better testing protocols as the  #NFL botches its return-to-play plan inquirer.com/eagles/nfl-bot …,https://x.com/hashtag/Eagles?src=hashtag_click https://x.com/cj_wentz https://x.com/hashtag/NFL?src=hashtag_click https://t.co/0uJO3q4yaM,1285363539281158144
julesabes1,2020-07-20T23:58:43.000Z,Living in your early 20’s and dealing w this pandemic is hard. It really does suck,,1285363539205672967
knott_michele,2020-07-20T23:58:43.000Z,. @DrIbram  talks abt equity for remote learning: 1. Access to the internet 2. Access to their own computer  #AntiracistPGC,https://x.com/DrIbram https://x.com/hashtag/AntiracistPGC?src=hashtag_click,1285363538354208775
DepictionsM,2020-07-20T23:58:42.000Z,"Listen to ""WHO July 20 Media Update"" New trials on a possible #covid19 vaccine by  @michaelsclogs  via #spreaker  spreaker.com/user/depiction …",https://x.com/hashtag/covid19?src=hashtag_click https://x.com/michaelsclogs https://x.com/hashtag/spreaker?src=hashtag_click https://t.co/8l5HAkTICa,1285363536441389056
BlueCollarPers1,2020-07-20T23:58:42.000Z,"I'm not an anti vaccine person. But there's no way I'm taking that. Typically, it takes like 10 years to develop a vaccine. Now all the sudden you're going to do it in 18 months. Cool story bro, you try it first",,1285363534667436038
Politiko_Manila,2020-07-20T23:58:42.000Z,Trabaho agad! Joy Belmonte returns to city hall after recovering from COVID-19  metromanila.politics.com.ph/2020/07/21/tra … #MetroManilaNews @officialqcmayor,https://t.co/PIXwGsHpgw https://x.com/hashtag/MetroManilaNews?src=hashtag_click,1285363534621106178
RtSheryl,2020-07-20T23:58:42.000Z,What did you buy stock in a mask company?  You’re over 6 months to late Chump,,1285363534411567109
Pru3tt,2020-07-20T23:58:41.000Z,we went from MCU phase 4 to coronavirus phase 4,,1285363533467852802
liz71562,2020-07-20T23:58:41.000Z,& this ladies and gentlemen is why the fucker wore a mask today. To detract from this story.,,1285363533337825280
SilverSpringJoe,2020-07-20T23:58:41.000Z,"Not on Twitter, but a fb friend I can put you in touch with... sunset.com/lifestyle/well …",https://t.co/Ev2snvpMR9,1285363533044240391
datboichilibowl,2020-07-20T23:58:41.000Z,Pandemic grant,,1285363532306022403
queenbjr,2020-07-20T23:58:41.000Z,"After his tweet saying MI, MN wouldn't let him have his ego rallies, I am not surprised he would do this. Just a continuation of his rallies disguised as a coronavirus briefings.",,1285363531869589505
newpaper24,2020-07-20T23:58:41.000Z,"Coronavirus: scaled-down haj pilgrimage to start July 29, say Saudi officials – NEWPAPER24  newpaper24.com/coronavirus-sc …",https://t.co/2zup3s0n2B,1285363530468921344
WiskyOnTehRocks,2020-07-20T23:58:41.000Z,"Thanks @kandirocksTTV my role isn't new, but I'm using the lockdown as an opportunity to connect with the community. I feel very privileged to be in this role & I'm trying to give something back while I can!",,1285363530078621699
JanSDrew,2020-07-20T23:58:40.000Z,"New artwork for sale! - ""Social distancing"" -  pixels.com/featured/socia …  @shoppixels",https://t.co/6S0FxhOfNK https://x.com/shoppixels,1285363528162041856
mattocko,2020-07-20T23:58:40.000Z,"Welp, looks like no flying. B/c you can’t trust predatory airlines to spend $ to flush cabin air enough  5-12 hour flights at material risk of getting #SARSCoV2 every time you take off your mask to eat or drink - as hundreds around you are taking theirs on & off - isn’t worth it",https://x.com/hashtag/SARSCoV2?src=hashtag_click,1285363528098971649
fromejake1,2020-07-20T23:58:40.000Z,Shelley you’re one of those “Coronavirus isn’t real” people huh,,1285363527797084160
WestwindsWendy,2020-07-20T23:58:40.000Z,Do they live with you? You won’t spread it if you’re asymptomatic- don’t kiss them or share food or sneeze on them. They do need to take steps to fortify their immune systems and you probably should to.,,1285363527398469632
LeagueAlerts,2020-07-20T23:58:40.000Z,Orlando Update: Zero Positive Coronavirus Tests in Recent Testing  leaguealertsofficial.com/2020/07/20/orl …,https://t.co/JXiyJAjAla,1285363526026944513
KrisFabulous,2020-07-20T23:58:39.000Z,Mad cuz you have to wear a mask mad cuz you can’t go to the bars lmfaoaooaoao fukin losers!!!!!,,1285363524961808391
crazyuncletim,2020-07-20T23:58:39.000Z,The article does not give a single bit of evidence that states reopening is responsible for a rise in cases. Other states reopened at about the same time without a rise. It's more likely that southern states are seeing an increase because people indoors and running the AC.,,1285363524290490368
bigpapachuck73,2020-07-20T23:58:39.000Z,My doctor works for the same company. So that's a dud. So it's just mask up and disinfect the fuck out of the cubicle,,1285363523837722624
ChristianAssad,2020-07-20T23:58:39.000Z,"Patient today while rounding with a mask... I introduce myself and she says  ""Oh, Yes! I follow you on TikTok""",,1285363522558398472
rodneystubbs,2020-07-20T23:58:39.000Z,You get the best of both worlds in that you wear a mask all the time and you still die on a respirator from covid,,1285363521845223424
Rebel_parshu,2020-07-20T23:58:39.000Z,Lockdown,,1285363521467760640
kramesey,2020-07-20T23:58:39.000Z,Kinda skimmed the news quickly but isn’t BCG fumbling the covid tracking app with questionable connections... but no matter. Greed and grift know no party allegiance nor public/private distinction. No one is immune.,,1285363521199325186
nopenothankyou4,2020-07-20T23:58:38.000Z,"Cool, so now what do we do about the “Covid party” that is the general populace?",,1285363521010700288
sukiilu,2020-07-20T23:58:38.000Z,"A woman walked by me in all black, from her mask to her thigh highs, and now I’m intimidated in a good way",,1285363520423424000
KCBD11,2020-07-20T23:58:38.000Z,"New passenger traffic data reveals that despite the pandemic, more people are slowly starting to board planes again. From April to June there was a 26% increase of passenger boarding traffic.  kcbd.com/2020/07/20/mor …",https://t.co/lGHO4OQIpe,1285363520217980934
MelissaFellows8,2020-07-20T23:58:38.000Z,"Way to be judged by people in this abnormal, psychotic, torturous year known as 2020: Simply not wear a mask. I'm not affecting anyone if I don't wear a mask. Those things are unnecessary and shouldn't be enforced. Wearing a mask is like building a fence to keep mosquitoes out.",,1285363520134164480
RepSaraHannan,2020-07-20T23:58:38.000Z,Home of the Humanity Shield | Rapid Response PPE.  In case you want a face shield and mask in one!   @benkesslen   #akleg   rapidresponseppe.com,https://x.com/benkesslen https://x.com/hashtag/akleg?src=hashtag_click https://t.co/Y5Na467axZ,1285363520041672705
SJCage,2020-07-20T23:58:38.000Z,"Completely agree. I was very productive WFH for 2+ years in a row, but my productivity has been at an all time low since COVID happened.",,1285363519949606915
anthonyangus5,2020-07-20T23:58:38.000Z,My lockdown project ... Before,,1285363519836295168
JohnDor63581329,2020-07-20T23:58:38.000Z,"And the USA issued a travel ban for EU at the beginning of the pandemic. And now that the EU has issued the travel ban for the USA, Trump barks up the EU's tree. I don't see any difference.",,1285363518783488002
Monica_Wilcox,2020-07-20T23:58:38.000Z,When you need a distraction bigger than a devastating #pandemic...  #COVIDー19,https://x.com/hashtag/pandemic?src=hashtag_click https://x.com/hashtag/COVID%E3%83%BC19?src=hashtag_click,1285363518087278594
justindbergman,2020-07-20T23:58:38.000Z,"Hiya, here's a link to our story on the survey in The Conversation yesterday, by the lead author, Mark Evans from  @UniCanberra :  theconversation.com/australians-hi …",https://x.com/UniCanberra https://t.co/nhqWJJ6jel,1285363517932007424
ChirpLosAngeles,2020-07-20T23:58:37.000Z,"Food Bank Guide Updated!!!  If you know someone in need of food or groceries during the pandemic, please share this information with them. No family should go hungry. #ChirpLosAngeles #FoodPantries #Resource #StayHome     mailchi.mp/chirpla.org/up …",https://x.com/hashtag/ChirpLosAngeles?src=hashtag_click https://x.com/hashtag/FoodPantries?src=hashtag_click https://x.com/hashtag/Resource?src=hashtag_click https://x.com/hashtag/StayHome?src=hashtag_click https://t.co/DY8wYNOkFO,1285363515612516353
