User_name,Datetime,Content,Links,Tweet_ID
mrclemens,2020-05-15T23:59:46.000Z,"There's so much lying wrongness in this statement, but let us not forget that a number of funding requests for pandemic preparedness were axed by the GOP-controlled Congress. PS: stop lying. You only shame yourself.",,1261446205235556352
edotedge,2020-05-15T23:59:46.000Z,COVID-19 LOCKDOWN HAS MADE IT IMPOSSIBLE FOR SOME TO CONTINUE.  USA -118 YEARS TRADING AND  J.C.PENNY BECOMES THE MAJOR RETAIL  COVID-19 LOSS! @nytimesworld Australia also suffering major  business collapses due COVID! They held on...but it was last straw!,https://x.com/nytimesworld,1261446205013258240
NwiloHenry,2020-05-15T23:59:46.000Z,South Africa Fed Up With Lockdown As They Take Painful First Steps Towards Reopening Battered Economy  zonuk.com/news/south-afr …,https://t.co/c7FmRcE29q,1261446204581445637
AinomugishaEve1,2020-05-15T23:59:46.000Z,Covid will finaly come to Ugandans coz of those truck drivers. Why can't they just close the boarders and live us in peace coz the neighborhoods are taking it for granted,,1261446203109183488
KTHL_gvlamm,2020-05-15T23:59:45.000Z,New helmet and tent aim to protect health care workers from the coronavirus  flip.it/p1G-y2,https://t.co/EieCY0BbLA,1261446201267765249
GodSavetheUSA1,2020-05-15T23:59:45.000Z,"No, but I’ve not been in a store in years!  I’ve been social distancing since 2013.",,1261446200995110914
BamjcastA,2020-05-15T23:59:44.000Z,"Oh lord, that means  @michaelburgess  will be paid while sitting at home! With Move to Remote Voting, House Alters What It Means for Congress to Meet  nytimes.com/2020/05/15/us/ …",https://x.com/michaelburgess https://t.co/z7Q0WoKfy2,1261446198080139264
AmnaAliShareef,2020-05-15T23:59:44.000Z,Me during this ramadan/quarantine literally,,1261446197950046208
gunther1970h2,2020-05-15T23:59:44.000Z,What people really don't understand is virus mutates consistently. The yearly influenza is a variation of the Spanish Flu from 1918. We're supposed to come up with a vaccine to cure something that mutates not possible!,,1261446197555986433
semtexsue,2020-05-15T23:59:44.000Z,Is it coronavirus? Good job. Is it a scarf?,,1261446196863909888
wildcat2013,2020-05-15T23:59:44.000Z,@NHLBlackhawks  Strong Interest in ThermalPass Fever Detection System as Businesses Prepare for Life after Lockdown    iotintl.com/blogs/toronto- …,https://x.com/NHLBlackhawks https://t.co/yXdbESYY3K,1261446196716961793
aminu_yusufu,2020-05-15T23:59:44.000Z,Covid 19 virus is malaria in disguise.,,1261446195819544578
Corkyshomebiz,2020-05-15T23:59:44.000Z,@_wintergirl93  @AlaskanCourtney  @OrdyPackard   Helio tail engaged  gfycat.com/plushalienated …,https://x.com/_wintergirl93 https://x.com/AlaskanCourtney https://x.com/OrdyPackard https://t.co/f50sejcMcH,1261446195559399426
Jennife46385280,2020-05-15T23:59:43.000Z,@NYGovCuomo  #NewYorkTough  Mask Video facebook.com/jennifer.richa …,https://x.com/NYGovCuomo https://x.com/hashtag/NewYorkTough?src=hashtag_click https://t.co/VKgaj3CJlK,1261446194577862657
ScottPaterno,2020-05-15T23:59:43.000Z,"Trapped is Lockdown,PA...",,1261446193147756544
kyfam4,2020-05-15T23:59:43.000Z,"Musicians across America, let's help this guy... westernjournal.com/music-store-ow …",https://t.co/1sYGotJAjS,1261446192841580546
post_asia,2020-05-15T23:59:43.000Z,Coronavirus: ‘Lockdown is opportunity of a lifetime for bike lanes’  postofasia.com/coronavirus-lo …,https://t.co/td5f8DI8iM,1261446192627699712
sagastaki,2020-05-15T23:59:43.000Z,My coworker came by to pick up a mask I made him  It was so great to see some else I know in person!!!,,1261446192312942592
BrianWeirich_RN,2020-05-15T23:59:43.000Z,Today I had the opportunity to speak with  @WLFI  about @IUHealthWCR thoughts & readiness for the community to begin opening back up. This pandemic is not over. Please stay safe and continue to follow  @CDCgov  guidelines. #COVID19,https://x.com/WLFI https://x.com/CDCgov https://x.com/hashtag/COVID19?src=hashtag_click,1261446191461490688
nickdotroastem,2020-05-15T23:59:43.000Z,"But they weren’t being tested on their return to America, so i think we can both further blame Trump for making the deaths that much worse   google.com/amp/s/www.axio …",https://t.co/FvSH6HCTvJ,1261446190589067269
nyesigamax,2020-05-15T23:59:42.000Z,The vibe is down.. Covid atumazeko emirembe,,1261446190161211392
theolympian,2020-05-15T23:59:42.000Z,"If you don’t quarantine, you could be fined up to $5,000.  trib.al/ReCaboQ",https://t.co/hdcV1yngqX,1261446189553258497
scott_hays,2020-05-15T23:59:42.000Z,Someone better come up with a way to communicate remotely first!  Oh. I’m being told it’s 2020 and that the technology already exists so that a few hundred people don’t have to gather in the same room during a pandemic. Crazy!,,1261446189431623687
realDinoHammer,2020-05-15T23:59:42.000Z,"The US is doing ok as far as COVID-19 goes. Not terrible, not great.",,1261446189351727106
Prolific25TV,2020-05-15T23:59:42.000Z,Go ahead and click on this stream | !sub !yt   twitch.tv/prolific25 #twitch #twitchaffiliate #callofdutymodernwarfare #fortnite #live #supportsmallstreamers #streaming #ripkobe #warzone #lockdown #quarantineandchill,https://t.co/7qT75s1d0m https://x.com/hashtag/twitch?src=hashtag_click https://x.com/hashtag/twitchaffiliate?src=hashtag_click https://x.com/hashtag/callofdutymodernwarfare?src=hashtag_click https://x.com/hashtag/fortnite?src=hashtag_click https://x.com/hashtag/live?src=hashtag_click https://x.com/hashtag/supportsmallstreamers?src=hashtag_click https://x.com/hashtag/streaming?src=hashtag_click https://x.com/hashtag/ripkobe?src=hashtag_click https://x.com/hashtag/warzone?src=hashtag_click https://x.com/hashtag/lockdown?src=hashtag_click https://x.com/hashtag/quarantineandchill?src=hashtag_click,1261446188102029313
ecoderre,2020-05-15T23:59:42.000Z,Coronavirus spreads in Yemen with health system in shambles  by MAGGIE MICHAEL apnews.com/d90f7e47659508 …,https://t.co/fUfKIpvZBN,1261446187560824832
B_Nelson_Manaus,2020-05-15T23:59:42.000Z,Interpreting Diagnostic Tests for SARS-CoV-2  ja.ma/2X4jVS9,https://t.co/mlt9rE4VHR,1261446186973700096
martinporr,2020-05-15T23:59:41.000Z,Meanwhile in Australia... the country is fast tracked to become a neoliberal wet dream #Australia #auspol theguardian.com/commentisfree/ …,https://x.com/hashtag/Australia?src=hashtag_click https://x.com/hashtag/auspol?src=hashtag_click https://t.co/jn69jfcbW7,1261446184901595136
Robert4787,2020-05-15T23:59:41.000Z,"Maybe #America should go all out and prepare for a dark Winter dominated by a return of a worse strain of #coronavirus, just in case the disease experts are correct. #security #health #USA   goo.gl/alerts/B5HBS",https://x.com/hashtag/America?src=hashtag_click https://x.com/hashtag/coronavirus?src=hashtag_click https://x.com/hashtag/security?src=hashtag_click https://x.com/hashtag/health?src=hashtag_click https://x.com/hashtag/USA?src=hashtag_click https://t.co/WcElxpIZyN,1261446183370682368
NorthBelle4,2020-05-15T23:59:40.000Z,Why are they glaring at someone wearing a mask?,,1261446181315584000
ironandwine11,2020-05-15T23:59:40.000Z,The WHO statement is clear they make no statement about being asymptomatic. Your clip is from the CDC.   Here's is their finding:,,1261446181298765825
sevensparadise,2020-05-15T23:59:40.000Z,when will this pandemic end cause staying in the house doesn't make me feel better at all,,1261446178933104640
charabia539,2020-05-15T23:59:40.000Z,@POTUS  DESTROYEDTrade Chain  FOOD THE Basic NECESSITYFarmers DESTROYING their ProduceProcessing Plant Workers Get Covid & DIE a bottleneck that keeps Shelves Empty & Food Banks UNABLE to COPENo Testing UNLOAD  @realDonaldTrump  NOW @maddow,https://x.com/POTUS https://x.com/realDonaldTrump https://x.com/maddow,1261446178044104710
DoryShute,2020-05-15T23:59:39.000Z,Today my boyfriend told me he loved me and I almost cried. Are we gonna blame pandemic or uterus?,,1261446177741893632
Yogirocket,2020-05-15T23:59:39.000Z,"Karen Bass: Petition to stop H.R.6666 -COVID-19 Testing, Reaching, And Contacting Everyone (TRACE) Act - Sign the Petition!  chng.it/vTzQJ9nj via  @Change",https://t.co/NprkYVl8ZY https://x.com/Change,1261446177351843840
LetsBPakistani,2020-05-15T23:59:39.000Z,"No offence. Sorry to say ppl should have been more sensible to avoid such processions. It's lack of knowledge, ignorance and illiteracy.i m afraid a major outbreak is awaiting in Pakistan due to dumb govt. I wish sense would prevail. COVID Any body can spread it Any body get it",,1261446176622206976
JoinPatriotify,2020-05-15T23:59:39.000Z,Graduation amid coronavirus: People unhappy about virtual ceremonies | Fox News  patriotify.com/2020/05/15/gra …,https://t.co/vEKyKXW3mb,1261446176383004673
thelrningcoach,2020-05-15T23:59:39.000Z,@PDHPETA1  members - join myself  @SimonBoard2  and  @LRobMHS33  as we share the impact of reflective practice and our reflections on remote learning - Tuesday 4:30pm,https://x.com/PDHPETA1 https://x.com/SimonBoard2 https://x.com/LRobMHS33,1261446175812579328
NickOzOz,2020-05-15T23:59:39.000Z,"tes.com/news/coronavir …   65 school staff, 26 of whom were teachers.",https://t.co/YVnu9mheuH,1261446175422656514
HosamNews,2020-05-15T23:59:39.000Z,BBC News - Coronavirus: Trump says US reopening 'vaccine or no vaccine' bbc.co.uk/news/world-us- …,https://t.co/zac6iEflix,1261446175418449920
therundowntvo,2020-05-15T23:59:39.000Z,Live Now: COVID-19: Summer Camps and Can Museums and Galleries Survive?,,1261446174365499393
jakepscott2020,2020-05-15T23:59:39.000Z,"If the pill cost even just $25, everyone buying it would boost GDP by hundreds of billions of dollars, essentially making up for lost production. However, rather than a pill, we have social distancing, which has essentially the exact same effect.",,1261446173899935745
DonMasks,2020-05-15T23:59:38.000Z,Don’t wear a Mask  Do the Research !!!!!!,,1261446170045374464
Blade_theDJ,2020-05-15T23:59:38.000Z,google.com/amp/s/amp.cnn. … — Speaking of PEOPLE WHO ARE PART OF THE PROBLEM: Oy. Our “president”. Things will never really “return to normal” until we have a vaccine to eradicate the virus and is readily available to everyone. #DonaldTrump #CoronavirusPandemic #CoronavirusUSA,https://t.co/mIZCb4uDch https://x.com/hashtag/DonaldTrump?src=hashtag_click https://x.com/hashtag/CoronavirusPandemic?src=hashtag_click https://x.com/hashtag/CoronavirusUSA?src=hashtag_click,1261446169927888896
Petraa_Lewinsky,2020-05-15T23:59:38.000Z,"They just showed a commercial where a lady was born during the last pandemic, and here she is again....crazy",,1261446169680441344
wangxh65,2020-05-15T23:59:38.000Z,Useful and beautiful! African people have keen artistic intuition for color. Lockdown can’t lock down people’s love of beauty.,,1261446169646919680
jakepscott2020,2020-05-15T23:59:37.000Z,"A unique but convincing take that much (though certainly not all) of the drop in GDP as a result of the lockdown is an artifact of how we measure output rather than a ""real drop""  nytimes.com/2020/05/14/bus …",https://t.co/bwFKUBA8a2,1261446168849965056
simong0808,2020-05-15T23:59:37.000Z,4 months of a pandemic later...,,1261446168254410753
OnlyVictoria33,2020-05-15T23:59:37.000Z,"This ""quarantine"" birthday will be a whole weekend of fun! Starting off early, celebrating me!!!! Thank you chappellshow33 for coming home and helping me get this together. Entertaining…  instagram.com/p/CAOlKSppvF86 …",https://t.co/4bpJ7JaRRL,1261446166597840898
Katemac37911759,2020-05-15T23:59:37.000Z,Why do the reporters have to wear mask but she doesn’t ?!,,1261446166530621440
Charenity,2020-05-15T23:59:37.000Z,"IOW, Rand Paul is a liar,  a quack & certainly not in any place 2 be advising anyone on healthcare concerning #COVID~",https://x.com/hashtag/COVID?src=hashtag_click,1261446166438281216
TheOriginalMiaD,2020-05-15T23:59:37.000Z,"In my new article, I discuss how remote Summer B affects first-gen FAMU students. The odds are wholly stacked against them and the summer in-person semester is their time to close in on the gap of privilege wedged between themselves and their peers.  jmagonline.com/articles/covid …",https://t.co/Zv3ZDJ3K4S,1261446165926567937
OoMsBlueEyesoO,2020-05-15T23:59:37.000Z,"""But we're checking everybody's temperature before they enter"" ok, and that does what exactly if they're an asymptomatic carrier? People are being so obtuse about this.  t.co/KEYnk5P5kY",https://t.co/KEYnk5P5kY,1261446165884633088
gerdublin,2020-05-15T23:59:36.000Z,@CaddyNomNomNom  ..Matt Damon..still in lockdown,https://x.com/CaddyNomNomNom,1261446165289000960
TeriMooring,2020-05-15T23:59:36.000Z,The  @bctf  will host two telephone town hall meetings next week with President Teri Mooring and First Vice-President Clint Johnston on COVID-19 and the government’s announcement today about the expansion of some in-school instruction. Check you email for instructions #bced,https://x.com/bctf https://x.com/hashtag/bced?src=hashtag_click,1261446164949241856
sheebadigeebies,2020-05-15T23:59:36.000Z,They didn’t offer that as a service during our 45 min phone call while they reassured me about social distancing and PPE but I’ll see if it’s something they do.,,1261446164940853249
mckeestewart,2020-05-15T23:59:36.000Z,Raylan Givens on social distancing  youtu.be/-gbSIajg538,https://t.co/Jf3yqdZPxu,1261446164706140163
TheSingerLovee,2020-05-15T23:59:36.000Z,Quarantine has made me fall in love with my back yard.. lol,,1261446164462759937
khanundrum,2020-05-15T23:59:36.000Z,How did a Marxist former science teacher protect Kerala's  35 million people from #COVID19? She planned for it.  (And she didn't make it about herself) theguardian.com/world/2020/may …,https://x.com/hashtag/COVID19?src=hashtag_click https://t.co/4bGaYKSR6F,1261446163745525760
cinnaMENA,2020-05-15T23:59:36.000Z,"i’m a mask addict, adding to list.",,1261446163519152133
chadmath,2020-05-15T23:59:36.000Z,"...odd thing is I made it a point to see if my state would follow Trump on his bs (which: they didn't... got my ballot), but -- (obviously, still) no confidence... and I'd be wary of the Orange Dictator pressing more b.s. plays...  washingtonpost.com/politics/house …",https://t.co/GTkZhJmMea,1261446162101329920
jennyraeraerae,2020-05-15T23:59:36.000Z,Today is a really really sad day for me  it’s with heavy heart to say that because of the coronavirus..... I am not able to see  @VINNYGUADAGNINO   in  @Chippendales  tonight.,https://x.com/VINNYGUADAGNINO https://x.com/Chippendales,1261446161287614464
Cinder_Shots,2020-05-15T23:59:35.000Z,"Hey coronavirus,  Fuck you.  Sincerely, Everyone",,1261446160423817216
cheryl_samons,2020-05-15T23:59:35.000Z,Precious baby! Trump needs to try to bring back liability for vaccine manufacturers and this would stop happening. Make them prove their products are safe. No reason to inject all newborns with an STD!,,1261446159773696000
chrisomerville,2020-05-15T23:59:35.000Z,Sad to see people talking about seeing friends at the pub when lockdown is finished and not meeting up to read a big book together instead,,1261446159400226817
johnjbailey,2020-05-15T23:59:35.000Z,trump has lost going on 90k people to covid-19. And counting.,,1261446158745923584
sanden,2020-05-15T23:59:35.000Z,"You mean George W Bush created the National Stockpile so there wasn't a PPE crisis. Of course, Obama used it all up and never replenished the things he took. Now us nurses are dying because we don't have any PPE. Tell me again what exactly Obama did? justthenews.com/politics-polic …",https://t.co/3zCtnq1uMl,1261446158515396610
Dan42016,2020-05-15T23:59:35.000Z,"Spitz had a postmortem test done and found that the individual who died at home was positive for COVID-19. The virus wasn’t their cause of death, but the individual is counted as a COVID-19 death. mlive.Com/public-interes …",https://t.co/txaCOr4b3Q,1261446158385164288
CorinneCarolyn,2020-05-15T23:59:35.000Z,@FLAGALine  trying to get an autograph for a HS Senior who is missing out on his graduation due to COVID-19! Any interest?! #fgl #adoptasenior #ClassOf2020 #countryfan,https://x.com/FLAGALine https://x.com/hashtag/fgl?src=hashtag_click https://x.com/hashtag/adoptasenior?src=hashtag_click https://x.com/hashtag/ClassOf2020?src=hashtag_click https://x.com/hashtag/countryfan?src=hashtag_click,1261446158179844096
ResidentsUae,2020-05-15T23:59:35.000Z,@ICAUAE  @MoFAICUAE  @gulf_news  @khaleejtimes  @DXBMediaOffice  @DXB  Please help stranded UAE Residents #COVID19 #coronavirus,https://x.com/ICAUAE https://x.com/gulf_news https://x.com/khaleejtimes https://x.com/DXBMediaOffice https://x.com/DXB https://x.com/hashtag/COVID19?src=hashtag_click https://x.com/hashtag/coronavirus?src=hashtag_click,1261446157940797441
baldingschemer,2020-05-15T23:59:35.000Z,still not convinced that a quality 6 week beard can’t offer the same or better protection than a mask,,1261446157730889728
MTB_Mason,2020-05-15T23:59:35.000Z,Especially that its mandatory to wear their mask when the one I got doesnt even cove my nose completely,,1261446157160665094
ArafaKamoga,2020-05-15T23:59:34.000Z,"Today, 15 May, 2020, 43 new COVID-19 cases confirmed from 1,838 samples of truck drivers. This brings the total number of COVID-19 cases to 203 in Uganda. All 720 community samples have tested negative for COVID-19.  Total samples tested today: 2558.  @MinofHealthUG  Stop joking.",https://x.com/MinofHealthUG,1261446156506198016
MamulaVickie,2020-05-15T23:59:34.000Z,"Good go after him. He’ll probably be out the day after he is sentenced ,because of coronavirus.",,1261446156447633410
BillGolden13,2020-05-15T23:59:34.000Z,COVID-19 is dead Obama gate is alive and well so open up Texas 100% now,,1261446156321648643
JonahJonahc,2020-05-15T23:59:34.000Z,It's a local celeb talkin' bike access! Be still my beating heart. Here's the most direct route. Let's find a date and I'll don a mask a ride (6-feet away) with you so you can try it out.  ridewithgps.com/routes/32145670,https://t.co/Z3sEGEtbV3,1261446155969236992
jbayalajr,2020-05-15T23:59:34.000Z,"Since Monday, there’s been 99 cases of COVID-19 in Nueces County.  @kiii3news",https://x.com/kiii3news,1261446155076079622
ramblinliv,2020-05-15T23:59:34.000Z,I told y’all quarantine was gonna start showing peoples true colors and if they’ve ever struggled before or if they’ve just been cosplaying the whole time,,1261446154887131136
MarggieNanteza,2020-05-15T23:59:34.000Z,It is in Uganda were the victims of colona virus are working and those who are free from the virus are under lockdown so let us enjoy #NBSKatchup we shall see that later,https://x.com/hashtag/NBSKatchup?src=hashtag_click,1261446154803277824
politicalHEDGE,2020-05-15T23:59:34.000Z,Helicopter apparently equipped with night vision nabs social distancing violators on Australian rooftop — and it’s all on video  hedgeaccordingly.com/2020/04/21/pol …      #Politics,https://t.co/5DAqPjFsfo https://x.com/hashtag/Politics?src=hashtag_click,1261446154400612353
skitttens,2020-05-15T23:59:34.000Z,"accidents in or travelling to/from school  will kill or hospitalise more children than covid. the logical conclusion being to cancel school altogether, obvs",,1261446154211987457
cringetalk,2020-05-15T23:59:34.000Z,Parolee Released Early Due To Coronavirus Murders Woman In Denver  cbsloc.al/3bHif6o#.Xr8sy …,https://t.co/MEzVD9rWVI,1261446153742118912
Alamgir77,2020-05-15T23:59:34.000Z,38 year old.. sir any further details? Confirmed it was covid? Any chain?,,1261446153054322688
dorojustin,2020-05-15T23:59:34.000Z,"Looking for reliable #COVID19 info? Check out  @Covid19Lst , all the newest #COVID research ranked by data quality. Daily digest of 100+ pieces of literature. #COVID19LST #FOAMed  #SciComm #MedTwitter #MedStudentTwitter covid19lst.org  Stay informed. Read less. Do more.",https://x.com/hashtag/COVID19?src=hashtag_click https://x.com/COVID19LST https://x.com/hashtag/COVID?src=hashtag_click https://x.com/hashtag/COVID19LST?src=hashtag_click https://x.com/hashtag/FOAMed?src=hashtag_click https://x.com/hashtag/SciComm?src=hashtag_click https://x.com/hashtag/MedTwitter?src=hashtag_click https://x.com/hashtag/MedStudentTwitter?src=hashtag_click https://t.co/5tAYEJJ67o,1261446152903368707
BKells8,2020-05-15T23:59:34.000Z,@DavidMuir  ALL determined to give their ALL during this COVID-19 pandemic. Have a restful and relaxing weekend. #PersonsofTheWeek,https://x.com/DavidMuir https://x.com/hashtag/PersonsofTheWeek?src=hashtag_click,1261446152752230400
NolaRobb,2020-05-15T23:59:33.000Z,Best thing to come out of COVID is Clay Travis. His Q rating must be off the charts. I will patronize any of his work as a result of his ability to take the road less travelled.,,1261446152370733056
GreenMtnBoy359,2020-05-15T23:59:33.000Z,@cnnbrk From #asymptomatic to lethal: #Coronavirus discrepancies puzzle scientists   washingtontimes.com/news/2020/may/ … via  @washtimes #BREAKING #BreakingNews #Coronavirustruth #Covid_19 #COVID19 #coronavirus,https://x.com/cnnbrk https://x.com/hashtag/asymptomatic?src=hashtag_click https://x.com/hashtag/Coronavirus?src=hashtag_click https://t.co/APo1jUJi53 https://x.com/washtimes https://x.com/hashtag/BREAKING?src=hashtag_click https://x.com/hashtag/BreakingNews?src=hashtag_click https://x.com/hashtag/Coronavirustruth?src=hashtag_click https://x.com/hashtag/Covid_19?src=hashtag_click https://x.com/hashtag/Covid_19?src=hashtag_click https://x.com/hashtag/COVID19?src=hashtag_click https://x.com/hashtag/coronavirus?src=hashtag_click,1261446151317843968
OutrageBh,2020-05-15T23:59:33.000Z,Well I guess after 33 years I made it onto twitter ..... Lockdown made me do it  #lockdown #Twitter,https://x.com/hashtag/lockdown?src=hashtag_click https://x.com/hashtag/Twitter?src=hashtag_click,1261446149879115776
KofiStevenson,2020-05-15T23:59:33.000Z,"*leaves to grab some groceries  Me: Damnit, my mask",,1261446148989935617
HFTaunton,2020-05-15T23:59:33.000Z,40+ Water toys to keep you sane in spring quarantine -  eepurl.com/g3Ku3v,https://t.co/w3G7zJhs9v,1261446148557950978
blaise_real,2020-05-15T23:59:32.000Z,"And just like that, people said ""screw social distancing ""...",,1261446148155375617
jasong8891,2020-05-15T23:59:32.000Z,"The sun has entered a 'lockdown' period, which could cause freezing weather, famine  nypost.com/2020/05/14/the … via  @nypost",https://t.co/un2aSGqj56 https://x.com/nypost,1261446147027107851
GoatGir72720448,2020-05-15T23:59:32.000Z,How can Cuomo even ask for this with a straight face. Does anybody listen to his ridiculous press conferences anymore?  “He’s gaffed it worse than any other Mayor re Covid. Newsom reopening biggest joke and gaff he’s waiting for his aunt to bail him out -  LA hostage,,1261446146523688960
LindaC528,2020-05-15T23:59:32.000Z,The world is waking up to the character of the Chinese Communist Party  The Chinese government’s gross mishandling of the coronavirus pandemic is changing attitudes on China  across countries and inside governments around the world.   washingtonpost.com/opinions/globa …,https://t.co/2O9WL8KdOc,1261446145244573696
PefleyAlCBS12,2020-05-15T23:59:32.000Z,Closing schools to combat coronavirus carries heavy cost for some kids ⁦ @CBS12 ⁩   cbs12.com//news/nation-w …,https://x.com/CBS12 https://t.co/nd8Q2jzScq,1261446144846168064
NYDailyNews,2020-05-15T23:59:31.000Z,"'Pretty unprecedented': NYC’s blood supply dangerously low, possibly two-day supply for region  The blood bank supplies all NYC public hospitals and nearly 200 private hospitals in NY, NJ.   Blood drives nearly ceased amid the pandemic. Donors are needed. nydailynews.com/coronavirus/ny …",https://t.co/RKKkSGFI7i,1261446142522523658
thedoctormom,2020-05-15T23:59:31.000Z,"I love y’all, but I sincerely worry about many of you not taking COVID-19 seriously.",,1261446141851447297
LucreSnooker,2020-05-15T23:59:31.000Z,"“Thus, most convalescent plasmas obtained from individuals who recover from COVID-19 without hospitalization do not contain high levels of neutralizing activity.”  biorxiv.org/content/10.110 …",https://t.co/R3vvQMIUA3,1261446141419249664
bcoughlin23,2020-05-15T23:59:30.000Z,Flattening a curve means to move to the endemic phase which means you can control outbreaks and end the spread. We are no where near that. You can’t have a curve flattening and an increasing projecteded death toll at the same time bro.  usatoday.com/story/news/hea …,https://t.co/q1lJkHldLt,1261446139968057344
Terranomaly,2020-05-15T23:59:30.000Z,"1. Only 11,000 have died (slightly more than half of last year's flu numbers) 2. Giving billions to States who are guilty of stealing and wasting billions already makes no sense 3. There is no pandemic, just a dempanic. 4. Are YOU wearing a mask while you drive?",,1261446139766640640
clay_coach,2020-05-15T23:59:30.000Z,"Due to the COVID-19 pandemic,teams all across the country were not able to participate in spring football. Woodrow Wilson High School decided to still make sure families had an opportunity to enjoy the Spring Game! This game is a simulation on NCAAFootball '14 with custom rosters",,1261446139548557313
ColmanOfGuaire,2020-05-15T23:59:30.000Z,"'Yes - the deadly second wave of Covid 19 has already begun. The hospital that used to be behind me is no longer there - it collapsed in its own footprint under the sheer weight of thousands of obese Covid victims crammed into its wards, corridors and waiting rooms.'",,1261446139154501632
RightsFest,2020-05-15T23:59:30.000Z,The same justification the entire GOP is using for not helping states and municipalities in new COVID-19 legislation. They don't need a justification because no one is making them justify anything.,,1261446139141861376
