User_name,Datetime,Content,Links,Tweet_ID
dwatercolors,2020-07-22T23:59:29.000Z,Before the twitter purge I stumbled upon some cray cray Q person saying he was being controlled and he would patiently wait for the true messages and there was no way Trump was being fooled by these corrupt mask wearing alarmist I didn't engaged just blocked with a heavy sigh,,1286088510223667201
DTaxidermy,2020-07-22T23:59:29.000Z,"A new etsy store from a good friend of ours  etsy.com/shop/thriftybb … Selling vintage and handmade clothes from a professional seamstress with credits in productions like poldark amoung others. check it out, more coming soon   #vintage #handmade #etsy #clothing #jewellery #mask",https://t.co/LZxFeKdzZb https://x.com/hashtag/vintage?src=hashtag_click https://x.com/hashtag/handmade?src=hashtag_click https://x.com/hashtag/etsy?src=hashtag_click https://x.com/hashtag/clothing?src=hashtag_click https://x.com/hashtag/jewellery?src=hashtag_click https://x.com/hashtag/mask?src=hashtag_click,1286088509900685314
Comandr_n_tweet,2020-07-22T23:59:29.000Z,"Mark my words they will terminate folks if they won’t wear masks, and... require you to get the vaccine or you will be terminated, bank on it",,1286088508495585280
mattyofkrakoa,2020-07-22T23:59:29.000Z,"It's gonna be hilarious when I start school next month and when they ask, ""what have you been up to during the pandemic?"" I'm gonna have to be like, I just spent the past 4 months liking a bunch of cute guys' pictures on twitter",,1286088508227149824
AHumannature,2020-07-22T23:59:28.000Z,How is wearing a mask patriotic?  What if all of the left stopped wearing masks bc he politicized it and tried to make it a plus on his side! dumbass couldn't just say using a mask is not a weakness!  How dumb are his followers that they will start wearing one bc its patriotic?,,1286088503797874689
DrDawnFNguyen1,2020-07-22T23:59:26.000Z,"@GovHerbert  you said you aren't convinced that the data show mandatory masking reduces COV2 - what data are you referring to?  Is your background in epidemiology, public health or science?  @MittRomney  @BenMcAdams #pioneerdayforcovid deseret.com/utah/2020/7/22 …",https://x.com/GovHerbert https://x.com/MittRomney https://x.com/BenMcAdams https://x.com/hashtag/pioneerdayforcovid?src=hashtag_click https://t.co/4V2sdyf4Gn,1286088496919261186
RPegio,2020-07-22T23:59:26.000Z,"Ellen, I absolutely love The Drum - wouldn’t miss it for quids, BUT I’m issuing a challenge - could we have one episode where these words are not even mentioned once - Covid 19, pandemic, masks, epidemiologist  Etc. I’m sure you get the drift. There must be other news about.",,1286088496856236032
Fanboy944,2020-07-22T23:59:26.000Z,"""CHINA VIRUS "" , I'm telling It Again   Coronavirus = ""CHINA VIRUS""",,1286088494712987650
ForgottenConce1,2020-07-22T23:59:24.000Z,"Should read, Chuck Todd: "" on the mask front the president has once again trapped himself in the corner"".",,1286088487985266688
NinaThomasAU,2020-07-22T23:59:19.000Z,"Challenging times often require and result in very creative thinking. I just love this idea of using nature to create socially distant spaces.  I'm keen to hear of new ideas you've had, or who and what is inspiring you at the momen… lnkd.in/dDuJHeJ  lnkd.in/dT79xx7",https://t.co/JoIAd2rDDI https://t.co/Gws4atTffY,1286088467634696199
otokoonikoroshi,2020-07-22T23:59:19.000Z,What if only the radical left took the vaccine?  Would we still get herd immunity?,,1286088466078429184
Kevin_Craine,2020-07-22T23:59:19.000Z,"Coronavirus is changing the landscape of #business and #marketing. As a result, podcasting will take off as a perfect ""socially distant"" way of reaching out. Want to start a show for your company? I can help.  CraineGroup.com/audio",https://x.com/hashtag/business?src=hashtag_click https://x.com/hashtag/marketing?src=hashtag_click https://t.co/kEifOvAUnz,1286088465227157504
_BagsOfMoney1_,2020-07-22T23:59:18.000Z,I never take my mask off at work I barely drink or eat for 12 hours like this covid shit is real,,1286088464111489024
TheVideoGameCR1,2020-07-22T23:59:18.000Z,And than they will stop giving u promos in April around the draft lmao and ull sit back and watch 2k drop content after content lmao but maybe they will blame it on wave 2 of the coronavirus in the fall not to make joke of something serious but they do this i hate ea,,1286088461200642049
sixtotan_,2020-07-22T23:59:16.000Z,"Me be like: ""Oh shocks, yung mask ko""  Spiderman ka gOrlL?",,1286088454921543680
DeeVP,2020-07-22T23:59:11.000Z,"I was in Nashville at the very beginning of the pandemic. Of my group, I was the only one worried and felt very uncomfortable just walking down Broadway (packed, no masks), and totally refused to go out to a honky tonk after. I see nothing has changed since early March.",,1286088433505570819
yangleicq,2020-07-22T23:59:11.000Z,Wear a mask! Not kidding,,1286088432867930112
namiventura,2020-07-22T23:59:09.000Z,What can you do today to prevent the spread of #COVID19? Small actions can create big change! Wearing a face mask and staying home if you are sick can help prevent the spread of #COVID19.   #YourActionsSaveLives #InThisTogether #CaliforniaStrong #SlowTheSpread #WeCare #NAMIVC,https://x.com/hashtag/COVID19?src=hashtag_click https://x.com/hashtag/COVID19?src=hashtag_click https://x.com/hashtag/YourActionsSaveLives?src=hashtag_click https://x.com/hashtag/InThisTogether?src=hashtag_click https://x.com/hashtag/CaliforniaStrong?src=hashtag_click https://x.com/hashtag/SlowTheSpread?src=hashtag_click https://x.com/hashtag/WeCare?src=hashtag_click https://x.com/hashtag/NAMIVC?src=hashtag_click,1286088424534024192
ONELINER19,2020-07-22T23:59:09.000Z,ASK 4 MASK! Face Masks are like CTP- for others to be safe!,,1286088424366080000
JadeyJoestar_,2020-07-22T23:59:09.000Z,Here's a shading/color variant,,1286088423284113410
bubbabobobfett,2020-07-22T23:59:06.000Z,"If #Twitler had said ""Wear a mask"" right from the start we wouldn't have this mask issue. Now all the #COVIDIOTS he created won't wear one now. No protest area has appeared as a hot spot, so protesters aren't an issue.",https://x.com/hashtag/Twitler?src=hashtag_click https://x.com/hashtag/COVIDIOTS?src=hashtag_click,1286088411632357377
NYMag,2020-07-22T23:59:06.000Z,Trump abandoned the vaguely presidential tone he displayed yesterday for his usual mix of false claims and self-promotion  nym.ag/2WLQxkc,https://t.co/WVEryVQ3rs,1286088410986422274
SussexHenryVIII,2020-07-22T23:59:06.000Z,Not to mention Charles traveled to Scotland (with COVID) when travel was restricted.,,1286088410453561345
CamGuthrie,2020-07-22T23:59:06.000Z,Staff are working with the COVID Assessment Centre to see if can be relocated.,,1286088410235641856
Rosiema89432144,2020-07-22T23:59:05.000Z,"You’re an adult. Think you could not manage to fidget, touch your face while wearing a mask. Wear the damn mask.  If people had followed that suggestion, we wouldn’t be where we are.  Other countries aren’t whiny, self absorbed citizens.",,1286088408134291456
wbir,2020-07-22T23:59:05.000Z,VERIFY: Common misconceptions about COVID-19 in Tennessee  wbir.com/article/news/h …,https://t.co/cEpLNOLlpw,1286088406007713792
mrserinacosta,2020-07-22T23:59:04.000Z,The sad thing I saw in this pic is that a tool like Elon can wear a fucking mask but the governor  @GregAbbott_TX  doesn’t have one anywhere in sight,https://x.com/GregAbbott_TX,1286088405445537793
FatalBabo,2020-07-22T23:59:04.000Z,Wearing a mask is a sign of compassion. If you have one on I automatically assume you’re a better person than someone not wearing one.,,1286088405206458368
TheRealGOP,2020-07-22T23:59:04.000Z,"I wear a cloth mask when I shop, because it's the law. But I also know that they are security theater. The virus (aerosol, not droplets) go right through the cloth. Droplets don't. So it makes people feel safe. All the good science shows this. N95 masks work",,1286088402056732672
KennMono,2020-07-22T23:59:02.000Z,"This is your Goliath. So practically,  your story doesn't end here. This is exactly where it starts. Fight it with faith and bravety and you are sure we are as world united in prayer against covid. You shall overcome.",,1286088397191356416
PatriceBoivin,2020-07-22T23:59:01.000Z,"Actual Covid-19 case count could be 6 to 24 times higher than official estimates, CDC study shows  statnews.com/2020/07/21/cdc … via  @statnews",https://t.co/5WgR6FU3Hg https://x.com/statnews,1286088391835226114
TonyVan15,2020-07-22T23:59:01.000Z,Australia must invest to produce the vaccine  facilities in Australia not oversea.  Australia must  export vaccine and no dependency to China materials right now.  We produce  more and more for cheapest prices.,,1286088390220210176
STForeignDesk,2020-07-22T23:59:00.000Z,Texas county stores bodies in trucks as state sets one-day record for Covid-19 deaths  straitstimes.com/world/united-s …,https://t.co/DNzORDqnIJ,1286088387099791365
reMARQable_,2020-07-22T23:59:00.000Z,I partially don’t wanna go bc I don’t have time to quarantine tbh,,1286088385665421318
DerekMilman,2020-07-22T23:58:58.000Z,Just gonna leave this here. Good luck to you all. Stay safe.  nytimes.com/2020/07/22/us/ …,https://t.co/K1PU58Ihm1,1286088380728717312
michaelpholland,2020-07-22T23:58:58.000Z,Funnily you only ask shoppers that believe the scaremongering going on esp from BBC - why not have a few shoppers who disagree with the mask wearing or at least say it should not be mandatory - BBC bias again!!! Pathetic!,,1286088380225388544
Tigerwoodsgirls,2020-07-22T23:58:57.000Z,"So I was just talking to my mom, now my younger sister has it and my bonus dad. #Covid_19 they’re okay but tired. Tomorrow I’ll be dropping off groceries for them.",https://x.com/hashtag/Covid_19?src=hashtag_click https://x.com/hashtag/Covid_19?src=hashtag_click,1286088373778644993
beryl626,2020-07-22T23:58:57.000Z,Patient trying to take off doctor's mask  reddit.com/r/PublicFreako …,https://t.co/cP8H4kQnFA,1286088373203922944
r5dmare,2020-07-22T23:58:57.000Z,arguing with an anti-masker on instagram and he really just compared wearing a mask to slavery lol not surprised tho he has a gun as his pfp,,1286088372981833728
NPSchools_VA,2020-07-22T23:58:55.000Z,"In a virtual special call meeting held 7/22, the School Board voted 6-1 on a 100 percent virtual reopening of NPS for the first quarter (first nine weeks) of the 2020-21 school year.  Full release here:  bit.ly/2CH0Z5F.  #RisingToTheChallenge #NPSInThisTogether #WeAreNPS",https://t.co/l1qVpexocF https://x.com/hashtag/RisingToTheChallenge?src=hashtag_click https://x.com/hashtag/NPSInThisTogether?src=hashtag_click https://x.com/hashtag/WeAreNPS?src=hashtag_click,1286088367055294464
PrettyBlac_Ki,2020-07-22T23:58:55.000Z,"Body scrub and oil, Face mask, Meditation, and Anita Baker radio",,1286088367046893570
ishaa4life,2020-07-22T23:58:55.000Z,"Kassie: well I’m going casual, jeans and a shirt with some makeup  me: *looks down at my outfit* well I think we have two different versions of casual bc I’m wearing a t-shirt, sweats, and sliders and I’m feelin pretty casual now sooo  quarantine has my bar so dangerously low",,1286088366002323456
Kgomi67,2020-07-22T23:58:53.000Z,Ok this isn't funny anymore kgane psl ga e boe naa gape Covid has got katsande thinking he's a model who can dance,,1286088359039897600
PetalumaPegleg,2020-07-22T23:58:53.000Z,There are almost none that say it doesn't help and absolutely zero who show any negatives from wearing a mask,,1286088356464480257
KDMVPSeason,2020-07-22T23:58:51.000Z,Where the dislike button .. Acting like you DONT know he is there to fill a Covid players spot to make a full roster,,1286088349221093391
j_waller3,2020-07-22T23:58:49.000Z,"What?  Stay at home orders are bad enough for Covid-19.  Now people have to also stay at home to avoid  being shot, roughed up, tear gassed, flash banged or unlawfully arrested by unidentified Federal security officers?  No thanks.",,1286088342480670720
lovelyti,2020-07-22T23:58:48.000Z,buff.ly/2D2CIGM  Two Chinese hackers charged with trying to steal COVID-19 vaccine research,https://t.co/XBs3miWSUI,1286088337279901699
Konagalvo,2020-07-22T23:58:48.000Z,Don't care about sports anymore   Millionaires kneeling while I'm paying their salaries  Not one second   won't be missed either.....  Thank you Covid  just fine without it,,1286088337275715584
Imadancer821,2020-07-22T23:58:46.000Z,U.S. Government Engages Pfizer to Produce Millions of Doses of COVID-19 Vaccine |  Newsmax.com  newsmax.com/health/health- …,https://t.co/1TmvdjuWCC https://t.co/gx0J3txVg2,1286088327381356545
mechack_kainda,2020-07-22T23:58:46.000Z,“It’s hard for small businesses to weather the storm when they don’t know when this will be over.” The spike in Covid cases has dashed hopes for a quick recovery.  wsj.com/articles/small …,https://t.co/bWMTg5wn8h,1286088326475182080
qmadeit__,2020-07-22T23:58:45.000Z,Yeah yeah yeah I’ll wear a mask in public but I’m not getting that vaccine. They got a nigga fucked up.,,1286088325548445696
yoongillian,2020-07-22T23:58:44.000Z,Tell me I didn’t see a sign that says “wearing a mask violates religious freedom”,,1286088319282151428
ONELINER19,2020-07-22T23:58:43.000Z,ASK 4 MASK! Face Masks are like CTP- for others to be safe!,,1286088314215206913
WilmingtonApple,2020-07-22T23:58:40.000Z,"BRAND: ""Wearing a mask for an entire school day everyday of the week is simply going to be far too difficult for our younger students & splitting the time with half in school & half out will provide a far more humane situation. #WilmingtonMA",https://x.com/hashtag/WilmingtonMA?src=hashtag_click,1286088305138860032
martharealty,2020-07-22T23:58:40.000Z,4 Tips for Navigating Property Showings During the Pandemic  magazine.realtor/for-brokers/ne …  #RealEstatebusiness,https://t.co/OXXoIehHJR https://x.com/hashtag/RealEstatebusiness?src=hashtag_click,1286088304845357056
Jana98j,2020-07-22T23:58:40.000Z,What is wrong with you. Why are you trying to get people against each other by calling the once that don’t wear a mask an enemy. I’m not against the mask but your statement will cause more issues between people. Don’t we have enough problems already,,1286088303947780096
drewxmed,2020-07-22T23:58:40.000Z,mask it or casket,,1286088301812867073
PopeWonka,2020-07-22T23:58:37.000Z,"Wrestling Twitter 90 Days Ago: ""Holy shit, I can't believe WWE fired all those Wrestlers in the middle of a pandemic just to protect their profit margin. Such bullshit but at least those workers can go somewhere else now.""",,1286088292648095744
toddbishop,2020-07-22T23:58:37.000Z,"“What we’re seeing right now is a high demand in the buying market, less inventory, and we’re not anticipating that to change anytime soon."" - Tushar Garg of  @RealFlyhomes , a finalist for Startup CEO of the Year in the #GeekWireAwards.   geekwire.com/2020/geekwire- …",https://x.com/RealFlyhomes https://x.com/hashtag/GeekWireAwards?src=hashtag_click https://t.co/3wkzIAarvs,1286088290022486016
DrawKill,2020-07-22T23:58:37.000Z,Bart had a little trip to the pet hospital and me and Cakes had to stand outside until 1am because they don't let anyone inside for Covid. Now I have to give him this awful goopy medication again cause friggen kitten parasites won't go away.,,1286088289791774720
small_tex,2020-07-22T23:58:35.000Z,i cant wait for covid to be gone so i can kiss her,,1286088281352859653
Brianycus,2020-07-22T23:58:33.000Z,"So my sister and I were talking since we’re the ones who are asymptomatic to COVID and we think when we tested positive, we were probably in our last days with COVID and when we got the results, we may not have it (so like now)  Still I’m staying home and chilling just in case",,1286088272268210179
delbak86,2020-07-22T23:58:31.000Z,Gutted is an understatement! Before lockdown we wanted to consolidate playoff spot... nearly bagged auto tonight (should have)... let ourselves down but time to make amends now... onto Sunday !!  @BrentfordFC  #beelieve,https://x.com/BrentfordFC https://x.com/hashtag/beelieve?src=hashtag_click,1286088267360808965
EllisDarryl,2020-07-22T23:58:31.000Z,Will they wear masks on release? I do hope security firms are advised of their identities I hope they don’t get jobs guarding quarantine hotels. #DanielAndrewsMP even the red shirts can’t support u in this place today. Just go please.,https://x.com/hashtag/DanielAndrewsMP?src=hashtag_click,1286088266144350208
kikkoman323,2020-07-22T23:58:31.000Z,There’s a pandemic on right now. Places are closing back up that just opened. Millions are becoming unemployed again.  Trump is destroying national parks and clean air and water. We should be able to enjoy them before they’re gone,,1286088265922224133
JABSTHENSTRIKE,2020-07-22T23:58:31.000Z,wearing a mask at the gym got me ready to pass out fr,,1286088264336773120
CacheJewels,2020-07-22T23:58:29.000Z,Moms with eggs perhaps?? LOL They couldn't see if the gas mask is dirty. It would need to be taken off. No more gas perhaps?? Should mom's egg em? Army beaten by a bunch of moms cookin it up! haha,,1286088255599976454
INFPaully,2020-07-22T23:58:29.000Z,"Assume they are until proven otherwise (you know, just like having Covid-19). Did they break down a locked gate? Do you think guns are the only arms people carry? Do you understand the word ""if"" in the context of a hypothetical statement?",,1286088255042203648
Peace_Love_Josh,2020-07-22T23:58:28.000Z,"For one, there were a handful of lbs that were only reporting positive tests resulting in a 100% positively rate.  google.com/amp/s/www.tamp …",https://t.co/SNQC4ICToX,1286088254111064064
musicalmollay,2020-07-22T23:58:28.000Z,Burt Quixote quarantine revival THE PEOPLE WANT IT,,1286088253108629504
Phydeauz,2020-07-22T23:58:26.000Z,What does Bill Gates think of the Pfizer vaccine? I'm with Bill on this one!  x.com/itsJeffTiedric …,https://x.com/itsJeffTiedrich/status/1286073922652442624,1286088243323248642
questkindly,2020-07-22T23:58:26.000Z,Did you just realize there is a pandemic happening? Maybe stop doing collabs and hanging with ppl. I mean after all there is a policy/law that says stay home with only the ppl in your household in LA. You are an influencer and should take that into account.,,1286088242975010818
InTheGables,2020-07-22T23:58:25.000Z,COVID-19 UPDATES & RESOURCES -  mailchi.mp/a70343845a6f/g …,https://t.co/sojvNkBmu8,1286088240177590272
times_read,2020-07-22T23:58:25.000Z,Dr. Fauci to Testify Next Week to House Coronavirus Subcommittee  timesfamous.com/uncategorized/ …,https://t.co/Hm64Zp4huV,1286088238973804544
CommonSense2d,2020-07-22T23:58:25.000Z,"#PutinPuppetTrump, #MoscowMitch, #GOPTraitors:  Knew of COVID-19 Nov. 2019 -- Concealed it.  Promised to protect your Healthcare, While Suing to Terminate it.  #1 in Deaths. #1 in Lies, #1 in Hate. ""The science should not stand in the way of this [more US Deaths for BFF Putin].""",https://x.com/hashtag/PutinPuppetTrump?src=hashtag_click https://x.com/hashtag/MoscowMitch?src=hashtag_click https://x.com/hashtag/GOPTraitors?src=hashtag_click,1286088238608912393
annerein,2020-07-22T23:58:25.000Z,"This is evidence-based reassurance. I found it helpful. The role of the T cells in the immune system make an appearance. ""Can You Get Covid Again? It’s Very Unlikely, Experts Say""  nytimes.com/2020/07/22/hea …",https://t.co/vNbtfPWQcM,1286088238185185284
surendrasnaagar,2020-07-22T23:58:24.000Z,The US-India friendship has scaled many heights in the past. Now it is time our partnership plays an important role in helping the world bounce back faster after the pandemic: PM  @narendramodi  ji,https://x.com/narendramodi,1286088238151557121
Antifearmnger,2020-07-22T23:58:24.000Z,Need a reason for vaccine? Can’t have people thinking they have any sort of  immunity ?,,1286088237560344580
LLofDevon,2020-07-22T23:58:23.000Z,"The Prince thanked #emergencyservices for their work, sharing resources during the pandemic  @DevonCC   @exetercouncil  devon.and.cornwall.police  @swasFT  @ Middlemoor Fire Station  instagram.com/p/CC9rE-ZH8dJ/ …",https://x.com/hashtag/emergencyservices?src=hashtag_click https://x.com/DevonCC https://x.com/exetercouncil https://x.com/swasFT https://t.co/N5j7jYlPGz,1286088232313159681
EmilOttoman,2020-07-22T23:58:23.000Z,"OK, so, you're telling me this is America now? Fuck you. Wear a mask, wash your hands, burn it all down.",,1286088231876988933
jmjllimited,2020-07-22T23:58:22.000Z,"A test is only useful for 3 days unless you quarantine, so how often should you test?",,1286088229691641857
howard19721,2020-07-22T23:58:21.000Z,"Coronavirus: Foo Fighters frontman Dave Grohl criticises move to reopen schools, saying 'teachers want to teach, not die' news.sky.com/story/coronavi …",https://t.co/Rjxo6d8sDm,1286088224050491393
queenannarhi,2020-07-22T23:58:19.000Z,Nah we tried that one time and he chewed up a rug and the carpet on our steps plus the drainage spout outside lol  We got Thor cause he was $50 and we were at home 90% of the time cause of the pandemic so it was easier training him. We ain’t got that luxury anymore,,1286088214420348929
mrjoshuaperry,2020-07-22T23:58:18.000Z,The pandemic hasn’t stopped the CFB news! We even toss in a little NFL talk at the end. Check out this episode of Press Pass,,1286088211622748160
kpodnar,2020-07-22T23:58:17.000Z,LinkedIn is not the only one org that is cutting jobs amidst the pandemic. The economic downturn is obviously rippling beyond low-wage retail & restaurant work to better-paying jobs. We may see more of these types of headlines in the near future.   reuters.com/article/us-lin …,https://t.co/iHbZ8ZN3FU,1286088207877234688
djhoedown,2020-07-22T23:58:17.000Z,Damn first Kanye now Michael?!  chilechilaca.mx/2020/03/13/mic …,https://t.co/O9tNdpKbsj,1286088207675699200
dewaynegrice,2020-07-22T23:58:17.000Z,EGRMC CEO Stephen Pennington Discusses COVID-19 Impact: VIDEO  griceconnect.com/2020/07/22/egr …,https://t.co/vvSK7R2AGN,1286088204790181888
intheamparadox,2020-07-22T23:58:16.000Z,I GoT CoRONaVIrUS,,1286088204177874945
LeftySr,2020-07-22T23:58:16.000Z,You can deflect blame where you want through your cult glasses but Trump is the president. This is his pandemic response.   He himself said as much when Obama was president. Kind of how that works.,,1286088203305455618
ClePicks,2020-07-22T23:58:13.000Z,Tomorrows MLB plays will go to current and VIPs that were stopped bc of Covid. Again those who had their packages stopped bc of Covid in March will resume on Friday the 24th.  If you would like to join my VIPs you can here pickscity.com/products/cle-p … @PicksCity,https://t.co/bN9pra6h0N https://x.com/PicksCity,1286088188977655808
shnickyy1,2020-07-22T23:58:13.000Z,Scroll down for the fact check on this- one day old  weny.com/story/42395940 …,https://t.co/5dFI9Fe1lx,1286088188868661250
dahg___,2020-07-22T23:58:13.000Z,We're never going back to no stay at home order? WE ARE SICKLY LIT I know it's not funny but find some fucking humor in it,,1286088188621012992
BADMANDRIS,2020-07-22T23:58:13.000Z,bouta host spanish music only parties after the pandemic lmao!,,1286088187971084291
tickercotweets,2020-07-22T23:58:10.000Z,Mask Up Melbourne!   Ticker's Holly Stearnes reports live from the one of Melbourne's most popular exercise tracks - as exemptions are given to mask wearing for exercise.  #tickertv #ausbiz #covid19 #masks,https://x.com/hashtag/tickertv?src=hashtag_click https://x.com/hashtag/ausbiz?src=hashtag_click https://x.com/hashtag/covid19?src=hashtag_click https://x.com/hashtag/masks?src=hashtag_click,1286088178168823808
xrajesh_chauhan,2020-07-22T23:58:10.000Z,"Nearly 15% Indians may already have Covid-19 antibodies: Thyrocare  edtr.ai/1dn0    For video news and more, download the editorji app-  edtr.ai/getapp",https://t.co/kTZn5vPDUH https://t.co/ntxdn3mqo1,1286088176738562049
Just4lyn1,2020-07-22T23:58:10.000Z,"Tour boats at Niagara Falls show contrast between U.S., Canadian approach to COVID-19 cbc.ca/news/canada/ha …",https://t.co/FavmiUOArz,1286088176529027075
DiMusa4U,2020-07-22T23:58:10.000Z,You knew what you'd get: lib blame game to let 5 ignorant state governors off the hook. Blame T for what governors were responsible for handling. Same but in reverse will come about the rioting cities. No-win: Wrong for NOT interfering in covid but wrong TO interfere in riots.,,1286088175841169413
goskagit,2020-07-22T23:58:10.000Z,The deadline is approaching for small businesses and nonprofits in Skagit County to apply for COVID-19 relief money.  skagit.ws/3hwrp93 #skagit,https://t.co/nJyuhRKbcF https://x.com/hashtag/skagit?src=hashtag_click,1286088175354429441
RichPAnderson,2020-07-22T23:58:10.000Z,I want to see interviews with Joe Blow Trumpsters being asked what they think about their Great Leader now telling them to wear a mask? Please share if you have seen examples of this.,,1286088175346233345
eric_bautista22,2020-07-22T23:58:09.000Z,My grandparents finally covid free,,1286088174410727427
darkmoodie,2020-07-22T23:58:08.000Z,Ok...well up here I guess we’re doing this  globalnews.ca/news/7204384/c …,https://t.co/9NPUwmWjZd,1286088168249257986
PastorMEBellSr,2020-07-22T23:58:08.000Z,Donald Trump calls himself combating crime by sending Federal Officers into Democratic Mayor cities where the Mayor’s have not asked but Trump will not Federally combat the coronvirus pandemic crisis,,1286088167662268419
KitsapHealth,2020-07-22T23:58:07.000Z,We need your help to slow the spread of COVID-19 in Kitsap.   lnks.gd/2/Jpjwmr,https://t.co/Rcp8XVmflO,1286088166563352577
