User_name,Datetime,Content,Links,Tweet_ID
Lorena48047771,2020-08-18T23:59:34.000Z,"While you are there, why don’t you tell him that Maricopa County just set the mask mandate to indefinitely for no damn reason!!!!",,1295873003935457286
gender_redacted,2020-08-18T23:59:34.000Z,"on the one hand, I know we should still be in quarantine. on the other hand, god what has quarantine done to me, I am finding companionship in a fucking moth",,1295873003759296512
JustoeTheUnruly,2020-08-18T23:59:34.000Z,Trump with the BS....they not getting funded. I finally got my face mask I been ordered.,,1295873002916261890
TajDarielle,2020-08-18T23:59:34.000Z,"Lockdown, but make it double",,1295873002509402112
HoltMarcia4511,2020-08-18T23:59:34.000Z,"Tennessee refuses to release information about COVID-19 cases in schools  a.msn.com/01/en-us/BB187 … Not reporting the truth just convinces all of us that you are hiding the truth so you can keep schools open, even though the statistics prove they should be closed to keep kids safe.",https://t.co/kwpQG4beAE,1295873002379399169
NaanFatKat,2020-08-18T23:59:34.000Z,In recognition of Dr. Rhodes tcu360.com/2020/08/profes …,https://t.co/61x5x4O2SV,1295873000630366208
mybip,2020-08-18T23:59:33.000Z,Dwell Covid-19 International Instances and Deaths News  mybip.com/dwell-covid-19 …,https://t.co/hPnfZsr6LJ,1295872999695036416
KaranShelvin,2020-08-18T23:59:33.000Z,Waile.. It's a contact tracing app and not covid positive tracing app.,,1295872999225094144
patriotrjm,2020-08-18T23:59:33.000Z,Typical communist ploy especially during a world crisis. Leverage a vaccine and extort weak governed country's to comply with China's imperatives. This action is right out of cold world tactics playbook. Trump is a factor China cannot handle. Desperate measure by the dragon!,,1295872998939992065
COVIDChildDiab,2020-08-18T23:59:33.000Z,The  @ONgov  shares additional steps to ensure safe school reopening in the fall @mch_childrens  @HamHealthSci  @hamhealth  @McMasterU  @DiabetesCanada  @ispad_org   Read more here: covid19childhooddiabetes.com/2020/08/14/the …,https://x.com/ONgov https://x.com/mch_childrens https://x.com/HamHealthSci https://x.com/hamhealth https://x.com/McMasterU https://x.com/DiabetesCanada https://x.com/ispad_org https://t.co/vbViuuT00i,1295872998793195520
emmaward2550,2020-08-18T23:59:33.000Z,"Yes, CA is slowly but surely becoming a dictatorship.  We have very few covid testing sites.  They lie.  x.com/BuzzPatterson/ …",https://x.com/BuzzPatterson/status/1295857099956555778,1295872998524612609
engrswiftie13,2020-08-18T23:59:33.000Z,"Students/faculty/anyone with a brain: we are concerned that campus will become a breeding ground for COVID. We shouldn’t be having F2F classes.  SIU: We see you, we hear you, so here’s some snow cones.",,1295872996872196096
Omzworld81,2020-08-18T23:59:33.000Z,"this is horrifying - and people have embraced authoritarianism so much that they can't see the problem with making a vaccine rushed to market compulsory. My body my choice doesn't just apply to the abortion argument, and informed consent is the right of ALL patients.",,1295872996117282816
ltravel395,2020-08-18T23:59:32.000Z,Telangana: Covid positive woman delivers baby in 108 ambulance  gotravelblogger.com/telangana-covi …,https://t.co/cr729avKHa,1295872994129182720
sohosultry,2020-08-18T23:59:31.000Z,We in a pandemic too like damn y’all couldn’t shave a couple thousand off these fees?,,1295872991306436609
cbccolleenjones,2020-08-18T23:59:31.000Z,A new study is under way to look at how are the kids feeling through the Covid pandemic and now reopening of schools. @DalhousieU  researchers  @sflkirk  and  @camille4heart  want to find out.  The say kids voices are underrepresented Survey.dal.ca to take part. Story below,https://x.com/DalhousieU https://x.com/sflkirk https://x.com/camille4heart https://t.co/YzYJVtzTi2,1295872989670645768
ih8league,2020-08-18T23:59:31.000Z,even if they dont believe in covid the fact a customer is coughing all over stuff that other customers are going to put in their mouth......nah,,1295872987887996934
Tigrawai,2020-08-18T23:59:31.000Z,"US a country who lost over 170,000 people to covid-19 pandemic is holding an election.  #Ethiopia on the other hand  postponed an election indefinitely with less infection rate and death in comparison.  #coronavirus politics  @PMEthiopia  #TigrayElection2020",https://x.com/hashtag/Ethiopia?src=hashtag_click https://x.com/hashtag/coronavirus?src=hashtag_click https://x.com/PMEthiopia https://x.com/hashtag/TigrayElection2020?src=hashtag_click,1295872987690926085
Charley2021,2020-08-18T23:59:30.000Z,A good read. I would trade climate change fight for the current covid crisis in a heartbeat. Might end up in the same place but hopefully with more of our rights and freedoms intact.,,1295872985245585408
PulpNews,2020-08-18T23:59:30.000Z,Person positive for COVID-19 spent more than 5 hours at Sturgis biker bar during rally - Aug 18 @ 7:58 PM ET [video onsite]  oddcrimes.com/static/2020/08 …,https://t.co/Jlizq0oUvt,1295872983752482817
Trump2020Masks,2020-08-18T23:59:30.000Z,Cuomo needs this mask. And he needs it NOW   trump2020masks.com/products/trump …,https://t.co/n2EgQ5xcBb,1295872983500828672
simongterry,2020-08-18T23:59:29.000Z,Remote work can mean that stresses & failures are hidden until it is too late for individuals & for organisations. Anticipating this in the design of work & acting on mitigation is critical to prevent catastrophic disasters.   simonterry.com/2020/08/19/fat … #futureofwork #wfh #Fatigue,https://t.co/4aQEsOmBen https://x.com/hashtag/futureofwork?src=hashtag_click https://x.com/hashtag/wfh?src=hashtag_click https://x.com/hashtag/Fatigue?src=hashtag_click,1295872982439432193
AutismTreehouse,2020-08-18T23:59:29.000Z,"""What do you call a person who runs towards danger to save others? Who is undaunted by disease, famine, drought, floods, earthquakes, tsunamis, locusts, conflict zones—and now the COVID-19 pandemic?  Would you call that person a hero? We would, too."" #WorldHumanitarianDay",https://x.com/hashtag/WorldHumanitarianDay?src=hashtag_click,1295872982020128768
MarieDaily5,2020-08-18T23:59:29.000Z,There is a petition to the White House with nearly a million signatures of Gates & his wife for crimes against humanity. Africa and India gave him the boot for his vaccine damage.,,1295872981995053059
DaVasilias,2020-08-18T23:59:29.000Z,Soul-searching in the middle of a pandemic? Goodness.,,1295872981751693312
taemeri,2020-08-18T23:59:29.000Z,I am getting my hair done for the first time since December and eyebrows since quarantine started next Saturday. I'm excited to look like a girl again lmao but idk if y'all will be seeing a selfie,,1295872980694847497
WillRinehart,2020-08-18T23:59:28.000Z,Yes please. “Introducing The AIRism Mask | UNIQLO US”  uniqlo.com/us/en/page/fea …,https://t.co/pwbhAvpKwO,1295872977683329026
Aaron_Adams15,2020-08-18T23:59:28.000Z,"Dang, if you sit quiet enough in the room at the clinic you get to hear all of the drama/tea. Donna's man is being lazy at home? Larry has Covid? Erika is having an affair? Even got to hear some shit talking about a client before calling them hahaha",,1295872977347719172
BoneJeni,2020-08-18T23:59:28.000Z,Covington. Could that name be more ironic in pandemic times?,,1295872977234300929
XPartyxxx,2020-08-18T23:59:28.000Z,Hi poke I am a big fan my name is XxxVibes_PartyxxX and I am noob that got a mask,,1295872976009789442
KeithElementary,2020-08-18T23:59:27.000Z,Please be sure to check out these helpful parent tips for learning from home. Please know how much we appreciate your help and support with remote learning amazing Dragon families!   @KeithElemPTA  @MarciAugenstein  @WalledLkSchools,https://x.com/KeithElemPTA https://x.com/MarciAugenstein https://x.com/WalledLkSchools,1295872974445146112
PeterFaberSP,2020-08-18T23:59:27.000Z,"Where did you get 20%?  Florida: 579,932 cases Population: 21,477,737  |Percentage: 2,7% worldometers.info/coronavirus/co …",https://t.co/ddK4tPw9y0,1295872971840552960
s01181969,2020-08-18T23:59:26.000Z,He will soon be selling MY MASK. Only $9.95 Wear it for two  years and the virus will be gone. Replace it once a week. Some proceeds will go to RNC.,,1295872969105760256
kianasource,2020-08-18T23:59:25.000Z,Wear a mask,,1295872962776780802
fuwap15,2020-08-18T23:59:24.000Z,"Country post offices  @auspost  go 'above and beyond' to support communities during COVID-19. So why then is their worth to your Government  @JoshFrydenberg  , only a paltry payment of $145.26 per month?  #auspol",https://x.com/auspost https://x.com/JoshFrydenberg https://x.com/hashtag/auspol?src=hashtag_click,1295872961094668288
theEmilioShow,2020-08-18T23:59:24.000Z,I Could Have Showed Leadership During COVID-19: but I was too busy writing this book.,,1295872960939450369
Cardillon95,2020-08-18T23:59:24.000Z,I was sitting at a table full of educated nurses the other day who said they always get the flu from the flu vaccine.... do people not pay attention in school?,,1295872958209110016
RedWishDotCom,2020-08-18T23:59:23.000Z,"You can add ""COVID"" to the list of words he says weirdly  #covert #covet #covit",https://x.com/hashtag/covert?src=hashtag_click https://x.com/hashtag/covet?src=hashtag_click https://x.com/hashtag/covit?src=hashtag_click,1295872957135441920
Nabe2SaveRH,2020-08-18T23:59:23.000Z,"onlinelibrary.wiley.com/doi/full/10.11 … Among facilities with at least one death, every 20‐minute increase in RN staffing significantly predicted 26% fewer COVID‐19 deaths. But as owners were granted immunity from any dereliction of duty it wouldn't matter?",https://t.co/5x5GPhfXPc,1295872955969351680
MRidge_ES,2020-08-18T23:59:23.000Z,Day 2 of Remote Learning at the Mission!! Our teachers working hard to make sure our Owls learn!!  #TeamSISD #leaveaHEARTPRINT,https://x.com/hashtag/TeamSISD?src=hashtag_click https://x.com/hashtag/leaveaHEARTPRINT?src=hashtag_click,1295872954744610816
jasperward94,2020-08-18T23:59:23.000Z,The Ministry of Health reported 12 additional COVID-19 recoveries today.,,1295872953918382081
steelrzgirl,2020-08-18T23:59:22.000Z,lol that is a silver lining.  Those assholes have brought together a nation in a pandemic state.,,1295872953071132675
modpeanuts,2020-08-18T23:59:22.000Z,"Deaths:  H1N1 = 12,469  COV-19 = 169,870 (+ counting) cdc.gov/flu/pandemic-r … covidtracking.com/data",https://t.co/IZAnRwAhwj https://t.co/2qQultPD7K,1295872951015727104
joexoftheday,2020-08-18T23:59:21.000Z,"""This is a Warning For What's Coming!"" - Veteran and California Business Owner Fed Up with Covid Lockdown Orders Puts County Board of Supervisors on Notice (VIDEO)  thegatewaypundit.com/2020/08/warnin … via  @gatewaypundit",https://t.co/aZlF3tBt4k https://x.com/gatewaypundit,1295872948360761345
readsector,2020-08-18T23:59:21.000Z,"THE PRUDENT INVESTOR: Covid cost me, and I still fear a second wave   readsector.com/the-prudent-in …",https://t.co/qAn6pCiJhm,1295872948339970053
ARadicalTeacher,2020-08-18T23:59:21.000Z,"Numbers are a function of quarantine behavior. If numbers go down it’s because we aren’t opening schools. If we open schools later, they will go up. It’s very simple",,1295872947652091904
hilarygroos,2020-08-18T23:59:21.000Z,Wake the f**k up everyone! We need to reboot our COVID-19 protection measures.  This is NOT GOOD AT ALL!! #yyj  cbc.ca/news/canada/br …,https://x.com/hashtag/yyj?src=hashtag_click https://t.co/yh6aMB072d,1295872947622559744
VaddepalliSri10,2020-08-18T23:59:21.000Z,Give free covid treatment to Telangana people,,1295872947161186305
Cali_Dr3amin,2020-08-18T23:59:20.000Z,I need to chill with the smiling with a mask on,,1295872945349210112
ford_kr,2020-08-18T23:59:20.000Z,3.5 hours teaching today for me! Gait analysis and running biomechanics - I think I saw them all smile through their #mask - what do u say  @HighPointU   #dpt students? Was it an awesome afternoon?! And we used the OWL  for the 1st time!,https://x.com/hashtag/mask?src=hashtag_click https://x.com/HighPointU https://x.com/hashtag/dpt?src=hashtag_click,1295872945219305472
aus10j4d,2020-08-18T23:59:20.000Z,Think about the tuition waivers and scholarships they could offer if tuition was lowered. Or if someone died from Covid. Freeing up all the funds,,1295872944414105600
shannonfordUSA,2020-08-18T23:59:20.000Z,Leading from behind a mask might work too.,,1295872944032247808
TME291310,2020-08-18T23:59:20.000Z,"""This is a Warning For What's Coming!"" - Veteran and California Business Owner Fed Up with Covid Lockdown Orders Puts County Board of Supervisors on Notice (VIDEO)  thegatewaypundit.com/2020/08/warnin … via  @gatewaypundit",https://t.co/029pNSYwKu https://x.com/gatewaypundit,1295872942778101761
PaulSpottswood,2020-08-18T23:59:19.000Z,Big food=big advertising $s=corruption of our global medical and nutritional industries=epidemic of global obesity and metabolic disease. Follow the money. These people have no souls.,https://x.com/search?q=%24s&src=cashtag_click,1295872940538507266
therundowntvo,2020-08-18T23:59:19.000Z,Live Now: Pandemic Planning for Cities  pscp.tv/w/cgsRVzFXTEtS …,https://t.co/Z0nU6NGMDl,1295872940320284672
wilr,2020-08-18T23:59:19.000Z,Level 2 Covid restrictions are odd. The gym bottle re-filler is closed.  The sign directs people to fill bottles using the tap in the bathroom.  I’m pretty sure you’d catch something worst from that.,,1295872940282490881
jthom1,2020-08-18T23:59:19.000Z,"Yes, but if you leave the Edmonton bubble, you have to go through a 4-day quarantine and a series of COVID-19 tests once you return before they let you play again.",,1295872939800383488
travalogyworld,2020-08-18T23:59:19.000Z,#Travel - Brittany Ferries axes routes as passengers cancel crossings due to quarantine -  ift.tt/2Q6ldZG #Travalogy,https://x.com/hashtag/Travel?src=hashtag_click https://t.co/MkywGY2Vxo https://x.com/hashtag/Travalogy?src=hashtag_click,1295872939406102531
cgtlasnewswire,2020-08-18T23:59:18.000Z,Before pandemic it was a nice place to play,,1295872935509598208
BarbedoSheepMan,2020-08-18T23:59:18.000Z,Anderson Cooper clashes with MyPillow creator over unproven therapeutic - CNN Video  cnn.com/videos/busines …,https://t.co/wz1xF01H7s,1295872934016430081
MedicalScitech,2020-08-18T23:59:18.000Z,"KG-COVID-19: a framework to produce customized knowledge graphs for COVID-19 response »  biorxiv.org/content/10.110 … Data scientists created KG-COVID-19, a flexible framework that ingests and integrates biomedical data to produce knowledge graphs (KGs) for #COVID19 response.",https://t.co/UV3fQNwxxx https://x.com/hashtag/COVID19?src=hashtag_click,1295872933659914241
tdawgsmitty,2020-08-18T23:59:17.000Z,Chat says ten gifted for a win in the Batman skin wearing the Batman mask. Done    #fortnite | #Batman | @J4LOrg,https://x.com/hashtag/fortnite?src=hashtag_click https://x.com/hashtag/Batman?src=hashtag_click,1295872932674252801
badatt2de,2020-08-18T23:59:17.000Z,@Nationals  The Team/MLB should consider inviting fans to pay to have a photo/cutout made for the stadium. Donate proceeds to Local COVID relief.,https://x.com/Nationals,1295872931009101824
TimesBritain,2020-08-18T23:59:17.000Z,‘Shifting deckchairs’ and scrapping PHE all part of Covid-19 blame game  timesofbritain.com/2020/08/18/shi …,https://t.co/HoGxtG52sF,1295872931004911616
WLOX,2020-08-18T23:59:17.000Z,"Stone County jail on lockdown as COVID-19 spreads in prisoners, guards  ift.tt/2CEI0IZ",https://t.co/ZRR0MAINxA,1295872930254131201
WSJMag,2020-08-18T23:59:16.000Z,"“For the first six weeks [of quarantine] I was like, this is so freeing. I got to actually be creative again. And then the heaviness of the world started coming in. You started hearing that there was more death,” says  @janetmock .  on.wsj.com/2CyQocS",https://x.com/janetmock https://t.co/XaAwQURo0O,1295872928567963650
ungodlyhrry,2020-08-18T23:59:16.000Z,"a bittersweet moment. thank you bil for making quarantine a little bit fun, i love you #meandadradio :(",https://x.com/hashtag/meandadradio?src=hashtag_click,1295872928446373889
RealRodLacroix,2020-08-18T23:59:16.000Z,I can remember a time before this pandemic where I was just moderately alcoholic,,1295872928383369217
RosaRubicon,2020-08-18T23:59:16.000Z,Still waiting to hear Nastyguy's explanation for more believers dying of #Covid-19 than non-believers.  rosarubicondior.blogspot.com/2020/06/covidi …,https://x.com/hashtag/Covid?src=hashtag_click https://t.co/r9J6348vNv,1295872928303796229
KidKohls72,2020-08-18T23:59:16.000Z,"That's if we elect a Democrat to office, Trump will not let this continue if he is in the WH....The bigger issue is people are allowing this to happen....Wear a Mask and wash your hands, it's time to open up, our Country is bigger than a Virus..",,1295872927401828352
IIceFish4Eyes,2020-08-18T23:59:16.000Z,"Actually, destroying the country is ignoring your own health advisors during a pandemic.",,1295872926718341120
KingCoatTails,2020-08-18T23:59:16.000Z,Y’all have to wear mask in shop?,,1295872926416277504
erwinloh,2020-08-18T23:59:16.000Z,SARS-CoV-2 #renal tropism associates with acute #kidney injury - SARS-CoV-2 #RNA was found in 60% of #COVID19 patients. Presence of SARS-CoV-2 #coronavirus RNA in the kidney was associated with older age and an increased number of coexisting conditions. (… lnkd.in/gAd-myU,https://x.com/hashtag/renal?src=hashtag_click https://x.com/hashtag/kidney?src=hashtag_click https://x.com/hashtag/RNA?src=hashtag_click https://x.com/hashtag/COVID19?src=hashtag_click https://x.com/hashtag/coronavirus?src=hashtag_click https://t.co/p5YyALn9Ig,1295872926340673536
STEPSGroup,2020-08-18T23:59:16.000Z,"""What do you call a person who runs towards danger to save others? Who is undaunted by disease, famine, drought, floods, earthquakes, tsunamis, locusts, conflict zones—and now the COVID-19 pandemic?  Would you call that person a hero? We would, too."" #WorldHumanitarianDay",https://x.com/hashtag/WorldHumanitarianDay?src=hashtag_click,1295872926021976067
wanderdaponderv,2020-08-18T23:59:16.000Z,...and why are we still wearing masks and social distancing and keeping many business on lockdown or half speed?  t.co/nDDkOFyG3U,https://t.co/nDDkOFyG3U,1295872925657006080
aThirdOfDuane,2020-08-18T23:59:15.000Z,It’s a quarantine hairdo,,1295872924029616128
mypyrlife,2020-08-18T23:59:15.000Z,Does pillow racist guy have covid?,,1295872923648102402
Trestresjolie,2020-08-18T23:59:15.000Z,"Yah, it's a bad sign usually---------COVID-19-infected family allowed to walk around quarantine hotel  mol.im/a/8639239 via  @MailOnline",https://t.co/2f46NqEqLy https://x.com/MailOnline,1295872923626958848
lovingfreedomz,2020-08-18T23:59:15.000Z,True story  #vaccine #youtube #censorship #covid #coronavirus #BigPharma #orwell,https://x.com/hashtag/vaccine?src=hashtag_click https://x.com/hashtag/youtube?src=hashtag_click https://x.com/hashtag/censorship?src=hashtag_click https://x.com/hashtag/covid?src=hashtag_click https://x.com/hashtag/coronavirus?src=hashtag_click https://x.com/hashtag/BigPharma?src=hashtag_click https://x.com/hashtag/orwell?src=hashtag_click,1295872922658189320
NaChiKyoTsuki97,2020-08-18T23:59:15.000Z,LRT since when was Chinese people *checks notes* having fun shocking?  They kicked COVID's ass and now they get to EDM.,,1295872921693347846
kroy88,2020-08-18T23:59:15.000Z,CCP Insider: Many In Communist Party Turning Against President Xi Over COVID Response  infowars.com/ccp-insider-ma …,https://t.co/l5r72xg1At,1295872921437528064
livcaisley,2020-08-18T23:59:15.000Z,ADF Surgeon-General Sarah Sharkey told the COVID inquiry yesterday that ADF responders were being confronted with difficult and challenging situations at coronavirus-riddled nursing homes.  theaustralian.com.au/nation/defence …  @australian,https://t.co/qvcXBWA4m2 https://x.com/australian,1295872921210990592
Irish_Jeff,2020-08-18T23:59:15.000Z,Mike Lindell and Donald Trump need to be locked in a room padded with My Pillows. These two are crazier than hell with their snake oil cures to the coronavirus. LOL #BidenHarris2020,https://x.com/hashtag/BidenHarris2020?src=hashtag_click,1295872921139924992
NovaAlmazan,2020-08-18T23:59:14.000Z,@PinoyAkoBlog Ma'am totoo kaya Ito? Vladimir Putin’s daughter DIES after second dose of COVID vaccine  torontotoday.net/2020/08/15/vla …,https://x.com/PinoyAkoBlog https://t.co/t1YEpFcabI,1295872920191791104
novakglobal,2020-08-18T23:59:14.000Z,Quote: “Scientists working on the vaccine believe that one dose may not be enough to protect against COVID-19 infections.” Annual ‘booster’ vaccinations!!,,1295872919550140418
BloomTV1,2020-08-18T23:59:14.000Z,Mental Health Risks Associated With Social Distancing for People With Disabilities @Great38tv  @WFLA  @WFLAGayleG  wfla.com/bloom/mental-h …,https://x.com/WFLA https://x.com/WFLAGayleG https://t.co/wOcmDWwAr4,1295872918279331842
wwjoshdew,2020-08-18T23:59:14.000Z,Thanks  @Bungie  @BungieStore  for making such a dope face mask!  @DestinyTheGame  @A_dmg04  @Cozmo23,https://x.com/Bungie https://x.com/BungieStore https://x.com/DestinyTheGame https://x.com/A_dmg04 https://x.com/Cozmo23,1295872917692178440
lizcullen13,2020-08-18T23:59:14.000Z,"The sky is your private dancer, social distancing. Thong cloud.",,1295872917134245889
_kingBEE,2020-08-18T23:59:14.000Z,I waited for a order from shein for damn near three months we all know shipping is fucked locally and elsewhere it’s a pandemic,,1295872916320550912
DesJack1,2020-08-18T23:59:14.000Z,Reopening My Recruitment.,,1295872916215783424
hazel376bk,2020-08-18T23:59:13.000Z,"People are starving... WHAT ABOUT THE KID'S?... Can't afford rent, daycare and if they can go back their jobs their hours and days are cut because of the pandemic.... YOU GUY'S WORK FOR AMERICANS.... We voted you all into office because of your promises. HELP US OUT!!!",,1295872915779604486
CodeNinjas4,2020-08-18T23:59:12.000Z,Sign up for next week's Remote Learning |  Drop-In program gets an A+ -  mailchi.mp/codeninjas/cod …,https://t.co/g5RyDyskBL,1295872910620590081
vetoaIIthenoms,2020-08-18T23:59:12.000Z,Austin put your damn mask on weir^o  x.com/AustinAshburn4 …,https://x.com/AustinAshburn4/status/1295871192927109121,1295872910591250438
imminent_news,2020-08-18T23:59:12.000Z,"Now: Uruguay is on the list of countries to receive the Oxford vaccine against COVID-19 to be produced in Argentina, Health Minister Daniel Salinas told  @elpaisuy .  Learn more in minutes at #uruguay  #mostshared  ww.elpais.com.uy",https://x.com/elpaisuy https://x.com/hashtag/uruguay?src=hashtag_click https://x.com/hashtag/mostshared?src=hashtag_click https://t.co/A8lyX3kxqk,1295872910352158720
rightingteacher,2020-08-18T23:59:12.000Z,A former student going to school in Buffalo tells me no testing before heading to campus and only freshman quarantine but for seven days. What kind of half-baked plan...?!,,1295872909181952007
1776DrRick,2020-08-18T23:59:11.000Z,"I am so very sorry to hear this. This is as about as antiscience as a gets,  given that it has been shown kids do not infect adults and barely have any impact when they themselves get COVID.",,1295872906963095552
kurtspoet,2020-08-18T23:59:11.000Z,Don't forget ventilators! That killed not covid and the numbers? No autopsy hmm,,1295872905562259457
stevedoyel,2020-08-18T23:59:11.000Z,So Carlos Martinez was hospitalized with Covid? #stlcards,https://x.com/hashtag/stlcards?src=hashtag_click,1295872905415450624
AvocadoDrexx,2020-08-18T23:59:11.000Z,"Wait, so hes saying this isnt as bad as theyre making it out to be? okay , here let me attach an image that says other wise. we will be surpassing 1 million deaths due to Covid 19. Every single soul here matters as much as the next. god speed.",,1295872905352339457
BroMark13,2020-08-18T23:59:11.000Z,"All I remember for 6 weeks was Covid-19 was  a “Democratic Hoax” and not once worked to test nor sought companies to begin making PPE’s. No, it was all a big “Hoax” to the Donald.",,1295872905230741504
Tsupachii,2020-08-18T23:59:11.000Z,I'm raising money for Help a Roommate Move out during pandemic. Click to Donate  gofundme.com/f/help-a-rooma …,https://t.co/BNW8eWia4z,1295872904299601920
DrMonicaMalta,2020-08-18T23:59:10.000Z,"As the coronavirus pandemic continues to hemorrhage 1,000 lives daily in the U.S., #COVID19 now ranks third for cause of death in this country.  The leading causes of death in the U.S. are heart disease and cancer, but COVID-19 is gaining fast nydailynews.com/coronavirus/ny …",https://x.com/hashtag/COVID19?src=hashtag_click https://t.co/9EM2cNsPRQ,1295872902080991233
SharonAddison7,2020-08-18T23:59:10.000Z,So it's designed to help the pandemic? What about the rest of the people of Britain that don't have covid-19 but are very ill? What help will they recieve?,,1295872899966996480
berenddeboer,2020-08-18T23:59:10.000Z,"Great story from Stuff on the people behind the scenes, doing all the hard #covid19nz lab work  stuff.co.nz/national/healt …",https://x.com/hashtag/covid19nz?src=hashtag_click https://t.co/rLE20GFcFQ,1295872899522297856
KiraSmira,2020-08-18T23:59:09.000Z,Glad to see CVS has cut down the length of their receipts amidst a global pandemic...,,1295872896632524800
douglas607,2020-08-18T23:59:08.000Z,Can you say coronavirus,,1295872894489198592
PAWarnhoff,2020-08-18T23:59:08.000Z,"Or, the very thing he thinks is nothing more then a light dose of the flu..covid-19 virus.",,1295872893453103104
KTLA,2020-08-18T23:59:08.000Z,"Riverside County reports 48,200 coronavirus cases with 913 deaths; more than half of those infected have recovered, officials estimate",,1295872891980980224
