User_name,Datetime,Content,Links,Tweet_ID
stillsafe,2020-05-15T23:59:59.000Z,#Coronavirus : Estimated speed of coronavirus #infections rises over past week  news.sky.com/story/coronavi …,https://x.com/hashtag/Coronavirus?src=hashtag_click https://x.com/hashtag/infections?src=hashtag_click https://t.co/QSmKXMjqWW,1261446260847808512
ignatios_,2020-05-15T23:59:59.000Z,51 on me; 91 on  @andystav83 ; 62 on @mickykou looks like I’m the lockdown defender,https://x.com/andystav83,1261446260025749504
iOptimizeRealty,2020-05-15T23:59:59.000Z,Office Space & The New Normal #CRE #COVID-19 #Office #NewNormal #TenantTips  hubs.ly/H0qsytT0,https://x.com/hashtag/CRE?src=hashtag_click https://x.com/hashtag/COVID?src=hashtag_click https://x.com/hashtag/Office?src=hashtag_click https://x.com/hashtag/NewNormal?src=hashtag_click https://x.com/hashtag/TenantTips?src=hashtag_click https://t.co/RYUN9VJ9sM,1261446258977320960
anymanfitness,2020-05-15T23:59:58.000Z,"For sure. Everywhere, pretty much.   We’ve been following every rule for 9 weeks.   Our reward has been stricter rules, more rules, and a disregard for our concerns.   Thus is life in The Great Quarantine Dilemma.",,1261446257119125504
SoCal_Chemistry,2020-05-15T23:59:58.000Z,You know what I hate? When some doctor's offices are closed on the weekends (even before the lockdown). Bad things can still happen on the weekends.,,1261446256301273088
Darslifemate,2020-05-15T23:59:58.000Z,"Replace Trump And Bolster The CDC, A Leading Medical Journal Urges  npr.org/sections/coron …",https://t.co/29onClnFKH,1261446255059714048
nutellaeuphoria,2020-05-15T23:59:58.000Z,@riteaid  please enforce social distancing - the store in Hempstead Ave in Queens was too crowded and customers were too close on the line. #COVID19,https://x.com/riteaid https://x.com/hashtag/COVID19?src=hashtag_click,1261446254338494468
AJ_Saulnier,2020-05-15T23:59:57.000Z,by gutting it by 80% he DID dismantle the pandemic response office. It exist in name only,,1261446253092708355
djh112771,2020-05-15T23:59:57.000Z,Just curious it anyone else is wondering why it's been crickets as far as the hundreds of children pulled put of the NYC tunnels ??? You remember the scary pics of the deformed kids being aided while we were being thrown into lockdown? Anyone?,,1261446252798996480
ivanterribly2,2020-05-15T23:59:57.000Z,Get my art printed on awesome products. Support me at Redbubble #RBandME:   redbubble.com/i/mask/Rogue-L … #findyourthing #redbubble,https://x.com/hashtag/RBandME?src=hashtag_click https://t.co/hRBsRuxSWi https://x.com/hashtag/findyourthing?src=hashtag_click https://x.com/hashtag/redbubble?src=hashtag_click,1261446252786405376
mikaylaleww,2020-05-15T23:59:57.000Z,Navajo Nation has more coronavirus cases per capita than any state in the country. The US continues to fail them and its so sad.,,1261446252392116225
Odigitaljosh,2020-05-15T23:59:57.000Z,Well.. all I know is the gov don't give 2 F's about us the citizens and if they're mandating a lockdown it has to be paying them some way or the other. And vise versa. You can only speak for your self. Be safe.,,1261446251788320768
Jazzyyyyy,2020-05-15T23:59:57.000Z,at least he’s entertained during quarantine lol,,1261446251658137600
RAFAEL_SAN_,2020-05-15T23:59:57.000Z,this was sick.   hypebeast.com/2020/5/seatbel …,https://t.co/FPSFts0xx7,1261446251637125123
RamonEGarcia2,2020-05-15T23:59:57.000Z,"School Superintendents Dismiss White House, Will Follow Leaked CDC Guidance on Reopening  flip.it/6pMECW",https://t.co/oc6WawKXlv,1261446251012186117
ChaosFyre,2020-05-15T23:59:57.000Z,For the people who are saying you can get CO2 poisoning from wearing a mask; haven’t you seen a mascot before? They keep that head on for hours and never pass out.,,1261446249208623107
GaryHershorn,2020-05-15T23:59:56.000Z,"Masks, shields, gloves, glasses and a sunset in New York City tonight seen from Jersey City, NJ #NewYork #newyorkcity #nyc  @EmpireStateBldg  #sunset  @agreatbigcity  #coronavirus",https://x.com/hashtag/NewYork?src=hashtag_click https://x.com/hashtag/newyorkcity?src=hashtag_click https://x.com/hashtag/nyc?src=hashtag_click https://x.com/EmpireStateBldg https://x.com/hashtag/sunset?src=hashtag_click https://x.com/agreatbigcity https://x.com/hashtag/coronavirus?src=hashtag_click,1261446247321198592
LizardKing1893,2020-05-15T23:59:56.000Z,"If this pandemic has shown anything, it’s that we are a nation of Karens.",,1261446246956441600
AZw_hyj,2020-05-15T23:59:56.000Z,Thank you Mr. President Donald John Trump. I Believe America Will Win the Coronavirus War Against Coronavirus with God’s Grace and in the Name of Jesus Christ. Amen.,,1261446245454766082
GurajpalSangha,2020-05-15T23:59:56.000Z,"If you walk around the Truckee Meadows, you could see a sign posted at businesses showing they are complying with the COVID guidelines.  kolotv.com/content/news/L …",https://t.co/sxIVgabT09,1261446245207302144
BrianKeevan,2020-05-15T23:59:55.000Z,"As for COVID, I still do not know one person who has it.  Not. One.  But, since I’m stupid & backwards, what do you & Dr. Fauci suggest I do to “not get” something that I’ve, thus far, “not gotten?”  Please enlighten me.",,1261446244855156736
dsd8404,2020-05-15T23:59:55.000Z,"For the first time in my life, I live in a country that is being pitied by the rest of the world  #TrumpHasNoPlan #TrumpDeathToll85K #Trump2020  #Trump #COVID19 #coronavirus",https://x.com/hashtag/TrumpHasNoPlan?src=hashtag_click https://x.com/hashtag/TrumpDeathToll85K?src=hashtag_click https://x.com/hashtag/Trump2020?src=hashtag_click https://x.com/hashtag/Trump?src=hashtag_click https://x.com/hashtag/COVID19?src=hashtag_click https://x.com/hashtag/coronavirus?src=hashtag_click,1261446244716576769
iamRintuGhosh,2020-05-15T23:59:55.000Z,Good #Morning Lockdown 3.0 : Day 13 #StayHome,https://x.com/hashtag/Morning?src=hashtag_click https://x.com/hashtag/StayHome?src=hashtag_click,1261446244695592960
svbizjournal,2020-05-15T23:59:55.000Z,How do #SiliconValley #restaurants balance the books with the need to keep workers and patrons safe during the #Covid19 #pandemic? Here's how some in #SanJose are managing.  bizjournals.com/sanjose/news/2 …,https://x.com/hashtag/SiliconValley?src=hashtag_click https://x.com/hashtag/restaurants?src=hashtag_click https://x.com/hashtag/Covid19?src=hashtag_click https://x.com/hashtag/pandemic?src=hashtag_click https://x.com/hashtag/SanJose?src=hashtag_click https://t.co/4pUxEEbskM,1261446244041359360
prattlesnake,2020-05-15T23:59:55.000Z,"The small reprieve ends. As  @CityPortland  and #Maine frantically re-open despite inability to properly trace/test, the zealous policing of the homeless ratchet up in lockstep. #mepolitics  mainebeacon.com/portlanders-pr …",https://x.com/CityPortland https://x.com/hashtag/Maine?src=hashtag_click https://x.com/hashtag/mepolitics?src=hashtag_click https://t.co/v5jc61zbHJ,1261446243756249090
dekebelden,2020-05-15T23:59:55.000Z,They weren’t obeying quarantine,,1261446243185811456
Kerwin_Gonzalez,2020-05-15T23:59:55.000Z,"dude it was already hard enough for me to try to get people to laugh before quarantine, but when this is over, it’s gonna be, like, nigh impossible dude, my standup career’s gonna be over",,1261446242208382976
CubaLib93040133,2020-05-15T23:59:55.000Z,How about a planned Parenthood death click as to how many babies have been murdered!!!!! newsweek.com/trump-death-cl …,https://t.co/6PlV56FnDn,1261446242065715200
InnocentIntech,2020-05-15T23:59:55.000Z,So this is the guy everyone is  talkin about - - - #covid19 #coronavirus #wholesomememes #nochill #lmao #memes  instagram.com/p/CAOlMrynFT3/ …,https://x.com/hashtag/covid19?src=hashtag_click https://x.com/hashtag/coronavirus?src=hashtag_click https://x.com/hashtag/wholesomememes?src=hashtag_click https://x.com/hashtag/nochill?src=hashtag_click https://x.com/hashtag/lmao?src=hashtag_click https://x.com/hashtag/memes?src=hashtag_click https://t.co/U75rJHSYBV,1261446241747001344
KiriTheCAG,2020-05-15T23:59:55.000Z,"Mapping 6,544 resident cases in Pa. nursing and personal care homes: April 25 county-by-county details  pennlive.com/coronavirus/20 …",https://t.co/qJcJ5IX3nK,1261446241680011270
Pragyan94343117,2020-05-15T23:59:55.000Z,@Ganjam_Admin   this two photos of accomodation of covid care doctors of Berhampur and Bhanjanagar.,https://x.com/Ganjam_Admin,1261446241214324737
amg_kent,2020-05-15T23:59:54.000Z,"it is the unions who are letting teachers down.  Many have worked throughout this pandemic, keeping schools open for key workers and supplying work remotely to their students. There was (and hopefully still is) a lot of goodwill, but the unions risk ruining this.",,1261446240375431170
igallupd,2020-05-15T23:59:54.000Z,"""Who’s Enforcing Mask Rules? Often Retail Workers, and They’re Getting Hurt""  nytimes.com/2020/05/15/us/ …",https://t.co/XiuVWmywtr,1261446240132161536
phxbizjournal,2020-05-15T23:59:54.000Z,"Despite a rough ride the past few months, the company said it is now able to take some bookings for some of its luxury properties now that stay-at-home orders are being lifted. #phoenix  bizjournals.com/phoenix/news/2 …",https://x.com/hashtag/phoenix?src=hashtag_click https://t.co/RJULUtlE0I,1261446238765043719
WorldWideStori,2020-05-15T23:59:54.000Z,WHO: Coronavirus Might Stay Forever  worldwidestories.com/who-coronaviru … via  @WorldWideStori    #worldwidestories #worldwidenews #world #stories #WHO #WorldHealthOrganization #CoronaVirusUpdate #CoronavirusPandemic #Covid_19 #COVID19Pandemic,https://t.co/VP2tqK782X https://x.com/WorldWideStori https://x.com/hashtag/worldwidestories?src=hashtag_click https://x.com/hashtag/worldwidenews?src=hashtag_click https://x.com/hashtag/world?src=hashtag_click https://x.com/hashtag/stories?src=hashtag_click https://x.com/hashtag/WHO?src=hashtag_click https://x.com/hashtag/WorldHealthOrganization?src=hashtag_click https://x.com/hashtag/CoronaVirusUpdate?src=hashtag_click https://x.com/hashtag/CoronavirusPandemic?src=hashtag_click https://x.com/hashtag/Covid_19?src=hashtag_click https://x.com/hashtag/Covid_19?src=hashtag_click https://x.com/hashtag/COVID19Pandemic?src=hashtag_click,1261446238743953416
flogirl1752,2020-05-15T23:59:54.000Z,@tyhenrymedium did you see this Pandemic coming?,,1261446238605414401
LogicPup,2020-05-15T23:59:53.000Z,This is huge! Deaths WITH covid are not the same as deaths BY covid. Every state needs to audit their death count.,,1261446234205650944
OWFLacrosse,2020-05-15T23:59:53.000Z,"COVID-19 Update OLA further extends pause of all in person lax activities in the province until @ least June 15, 2020. The OWFL continues to monitor/assess the situation closely & will provide further updates specific to women’s field lacrosse members as they b/c available",,1261446234130149381
simonbg12,2020-05-15T23:59:53.000Z,Johnson is under threat from MPs within his own party over lockdown  app.independent.co.uk/2020/05/14/for …,https://t.co/ExGBvUhmQZ,1261446233912033280
dltamorale,2020-05-15T23:59:53.000Z,"It’s crazy, the last time I flew was to Indy on early March. The rona was legit not even a scare at that point. Shaking hands, going to restaurants, basketball games in close quarters, no masks (for me at least)...and then a week later...lockdown.",,1261446233668780033
Arrechit0,2020-05-15T23:59:53.000Z,"This is your daily reminder that a threat to freedom anywhere, is a threat to freedom everywhere. Don't believe? Secrecy in #China and we have a world pandemic. Do your numbers #coronavirus",https://x.com/hashtag/China?src=hashtag_click https://x.com/hashtag/coronavirus?src=hashtag_click,1261446233471811585
KCBizJournal,2020-05-15T23:59:53.000Z,"#SportingKC still hasn't received guidance from #MLS, which means CEO Jake Reid is ""game planning for 50 different scenarios"" until the team receives more direction.  bizjournals.com/kansascity/new …",https://x.com/hashtag/SportingKC?src=hashtag_click https://x.com/hashtag/MLS?src=hashtag_click https://t.co/6HaveZ3IoQ,1261446233438240770
pedge07,2020-05-15T23:59:53.000Z,"Great #art project by Fi....benefit of #covid_19 is taking time to do things you would not normally do....... @ North Vancouver, British Columbia  instagram.com/p/CAOk9Wah7azB …",https://x.com/hashtag/art?src=hashtag_click https://x.com/hashtag/covid_19?src=hashtag_click https://x.com/hashtag/covid_19?src=hashtag_click https://t.co/lblBeiTZEF,1261446233429692417
Dukimus72,2020-05-15T23:59:53.000Z,"""is likely"".  Also I didn't see that they said cloth mask.  There was also no definitive conclusion that I could see. Maybe they do help I don't know.  But the jury is definitely still out and for people to act like people don't care if they decide not to wear a mask is silly.",,1261446232746143745
GoodKindHappy,2020-05-15T23:59:52.000Z,"As US coronavirus death toll mounts, so does the belief by some that it is exaggerated | Fox News  foxnews.com/us/as-u-s-coro …",https://t.co/qteURixD3V,1261446231550648320
tden10,2020-05-15T23:59:52.000Z,Doesn’t bode well for the proposed Transat deal...  reut.rs/2T67mV2,https://t.co/FQ4knWaCCg,1261446231236046848
HeidiAitken10,2020-05-15T23:59:52.000Z,"The sun has entered a 'lockdown' period, which could cause freezing weather, famine  nypost.com/2020/05/14/the … via  @nypost",https://t.co/owcgA0nyJ1 https://x.com/nypost,1261446231210983425
HokieinSA,2020-05-15T23:59:52.000Z,"Which then leads us into next year. I've seen proposals that include things like staggered schedules, needing to maintain social distancing and added precautions for older teachers. (Side note: since I'm 50, an I am 'older teacher'? Please say no.)",,1261446231164887047
MarthaLeah2,2020-05-15T23:59:52.000Z,"Nah, she’s in training to be the new, younger Kellyanne Conway.",,1261446230246256640
MKEBizJournal,2020-05-15T23:59:52.000Z,Milwaukee Mayor Tom Barrett would not commit to a specific date for lifting his city of Milwaukee stay-at-home order but predicted restrictions will loosen over the next couple of weeks.  bizjournals.com/milwaukee/news …,https://t.co/Iazr6OPgct,1261446230028279809
FOX26Houston,2020-05-15T23:59:52.000Z,The Abbott Laboratories test is used daily at the White House to test Trump and key members of his staff.  fox26houston.com/news/fda-givin …,https://t.co/wtmE7c6MbW,1261446230019883008
pjustin23,2020-05-15T23:59:52.000Z,Here’s why. In order to wear a mask I’d have to touch my face. Touching my face will increase my chances of catching the Wuhan flu.,,1261446229986365441
AngAZHII,2020-05-15T23:59:52.000Z,The great thing about Hawaii is beautiful weather & less Covid issues,,1261446228467838976
SamSobolewski,2020-05-15T23:59:51.000Z,For one blissful moment I forgot about the pandemic when I saw how little data I used last month on my phone bill and couldn’t understand how it was possible,,1261446228111273984
kirkcohall,2020-05-15T23:59:51.000Z,Why do I get the feeling y’all thought warm weather ≠ COVID  some of y’all big wildin out here,,1261446227905802240
tpdtweets,2020-05-15T23:59:51.000Z,"As the Canadian & US governments gear up to reopen the economy, what precautions must companies take? This week’s ""Co-Existing with #COVID19"" blog shares snippets from various news sources to help employers answer this question:  bit.ly/2X0eRhl #HRTips #InvestingInPeople",https://x.com/hashtag/COVID19?src=hashtag_click https://t.co/GqfgAU8ebt https://x.com/hashtag/HRTips?src=hashtag_click https://x.com/hashtag/InvestingInPeople?src=hashtag_click,1261446226735661056
TriadBizJournal,2020-05-15T23:59:51.000Z,Some recommendations would come off as outlandish if not for Covid-19.  bizjournals.com/triad/news/202 …,https://t.co/2TQjAyQbO4,1261446226542813185
JoinPatriotify,2020-05-15T23:59:51.000Z,Juan Williams claims Trump using Flynn controversy to ‘try to distract people’ from coronavirus failures | Fox News  patriotify.com/2020/05/15/jua …,https://t.co/Cqi8hTLRJi,1261446226140180483
GHRYorksCoast,2020-05-15T23:59:51.000Z,"NEWS:  Matt Bellamy on going solo, lockdown and what's next for Muse  yorkshirecoastradio.com/news/showbiz/3 …",https://t.co/V9J61KhFHL,1261446225766817794
Playlistgh,2020-05-15T23:59:51.000Z,Tina Brown Africa – Pandemic Lyrics  is.gd/n0UXKz,https://t.co/a3UmTIR9rD,1261446225355661312
denverpostlite,2020-05-15T23:59:51.000Z,Colorado changes the way it reports coronavirus deaths as COVID-19 cases continue to rise in state,,1261446225221410819
virtualzeph,2020-05-15T23:59:51.000Z,i was just getting on a routine of getting it once a week and then they put me under fucking quarantine? i’m dying . i’ve been craving it for months but it’s not like i can drive where i want,,1261446225104121856
aiyumva,2020-05-15T23:59:51.000Z,People's behaviors are making me sick in this lockdown. Blame them to everything,,1261446224500195328
KRemainechau,2020-05-15T23:59:51.000Z,"If enough red States can pass off Covid deaths as something else, we can get the numbers down!",,1261446224286306304
bizjournals,2020-05-15T23:59:51.000Z,"""We survived the winter and then as soon as we come out of winter we get Covid — we're cursed or something. We can't continue.""  bizjournals.com/louisville/new …",https://t.co/RMox3dMY71,1261446224030265345
flutter_rob,2020-05-15T23:59:51.000Z,Many of us suspect reason it is assumed children do not get infected much with COVID19 is because they are asymptomatic and never tested. Some research starting to come from overseas that mass testing shows very little difference in infection rates. Further investigation required,,1261446224026013696
tidesoftime44,2020-05-15T23:59:50.000Z,Maybe The President has mask on them to show us and the deep state who is in control.,,1261446223652773889
abo_basil14,2020-05-15T23:59:50.000Z,The Federal Reserve warns that stock and other asset prices could suffer “significant declines” should the coronavirus pandemic deepen  bloomberg.com/news/articles/ … عبر  @markets,https://t.co/HNn6owxXjd https://x.com/markets,1261446223543795712
GeorgiaNews66,2020-05-15T23:59:50.000Z,"Here's an updated list of case numbers in the state, given by the Georgia Department of Public Health.  13wmaz.com/mobile/article …",https://t.co/zsBKC92cu2,1261446223086735360
okiaster,2020-05-15T23:59:50.000Z,You should take some lessons on how to wear a mask- look simple when you don’t get it,,1261446222490943488
malley_graceo,2020-05-15T23:59:50.000Z,"Just what we need during a pandemic, the highest death rate in the world and a reality tv show.  Lindsey?",,1261446221538881537
DavisLilian,2020-05-15T23:59:50.000Z,"Markey: $2,000 Monthly Check Plan Needed ‘As We Get Closer To 1930s Depression-Era Economic Conditions’ #SmartNews   boston.cbslocal.com/2020/05/15/ed- …",https://x.com/hashtag/SmartNews?src=hashtag_click https://t.co/bw6LSXqnI8,1261446221379461120
RSRINIVASABABU1,2020-05-15T23:59:50.000Z,"Lockdown: With documents and tokens, migrant workers wait outside Pune railway station to head back home  timesofindia.indiatimes.com/videos/city/pu …",https://t.co/64tziRWrPb,1261446219978567681
reazonozaer,2020-05-15T23:59:49.000Z,"Oh yeah, I absolutely expect another round of protests to hit once a vaccine comes out especially if it's developed in a non-western country.",,1261446218728833027
kaleygerhards,2020-05-15T23:59:49.000Z,Hopefully the cart full of plants I just bought at Home Depot cures my quarantine depression,,1261446218200186880
__KyleGarrett,2020-05-15T23:59:49.000Z,BREAKING NEWS !! Check out #BUTV as  @KingSyncereDMV  &  @RozMula  talk various topics as far as #urlcrucible #TworkVsKShine #coronavirus and more #subscribe  youtu.be/tZje-LvkRTs #OSBL #News #PODCAST #BattlerapMedia #Retweet #Share,https://x.com/hashtag/BUTV?src=hashtag_click https://x.com/KingSyncereDMV https://x.com/RozMula https://x.com/hashtag/urlcrucible?src=hashtag_click https://x.com/hashtag/TworkVsKShine?src=hashtag_click https://x.com/hashtag/coronavirus?src=hashtag_click https://x.com/hashtag/subscribe?src=hashtag_click https://t.co/wAyxul8coI https://x.com/hashtag/OSBL?src=hashtag_click https://x.com/hashtag/News?src=hashtag_click https://x.com/hashtag/PODCAST?src=hashtag_click https://x.com/hashtag/BattlerapMedia?src=hashtag_click https://x.com/hashtag/Retweet?src=hashtag_click https://x.com/hashtag/Share?src=hashtag_click,1261446218149851137
Moguldom,2020-05-15T23:59:49.000Z,"Private jet companies Clay Lacy and Jet Linx, whose owners or founders made big donations to Donald Trump, got huge bailouts.  moguldom.com/279385/at-leas …",https://t.co/9DzHpt5Wp5,1261446217126510592
BruceLeshan,2020-05-15T23:59:49.000Z,"Reopening met with mixed emotions, some stay in, others go out |  wusa9.com  wusa9.com/article/news/h …",https://t.co/9WiRlgeATp https://t.co/s5fbZTUTb6,1261446216862162945
plays_harris,2020-05-15T23:59:49.000Z,This pandemic could have been better handled if  @realDonaldTrump  had taken the warning he was given serious. People are loosing their lives because of his bad decision making and he does not even care he makes me ill!,https://x.com/realDonaldTrump,1261446216841220097
nightowl5268,2020-05-15T23:59:49.000Z,"You've been in quarantine too long, you're definitely hallucinating!",,1261446216325509123
KristenLock1,2020-05-15T23:59:49.000Z,"Granted, measles vax programmes were (presumably) introduced as population natural exposure costs were deemed more than vaccine costs. I wonder with such huge scales involved and such little Covid data/history how to evaluate the cost/benefit of action. Time will tell I guess",,1261446216308662272
jordangdov1,2020-05-15T23:59:48.000Z,are you f*cking kidding a bug just flew in my mask,,1261446215490605056
GoldingCath,2020-05-15T23:59:48.000Z,"Head teachers have been fed to the wolves. You sort it, your problem. Every school is unique, but non have the capacity for social distancing. You can't tell the polpulation to do one thing and schools and kids do do the opposite. Totally wrong",,1261446215448662016
omarr_padilla,2020-05-15T23:59:48.000Z,Op-Ed: Mexico's president is as heedless as Trump in the coronavirus crisis   latimes.com/opinion/story/ …,https://t.co/LjFrvfx9r7,1261446214958092289
RamonPrudente,2020-05-15T23:59:48.000Z,Coronavirus: Traveling now is like nothing I've seen before  cnn.com/travel/article …,https://t.co/eJmbWMOBe5,1261446214907764743
Orgetorix,2020-05-15T23:59:48.000Z,Trump's hint at severing ties with China set to further roil relations  str.sg/JAMY via @STcom,https://t.co/FUqth3sjMk,1261446214454841346
reaperstinky,2020-05-15T23:59:48.000Z,conexion.cinvestav.mx/Publicaciones/ … BRING ME GATELL!!!,https://t.co/uyUj1czi9a,1261446213196374017
Mia4Jah,2020-05-15T23:59:48.000Z,The House on Friday adopted historic rule changes to allow lawmakers to cast votes & conduct committee meetings remotely during the pandemic in an effort to resume legislative work that has been on hold amid safety concerns over gathering in the Capitol.   apple.news/A1DJNiP0aRYOsg …,https://t.co/YMusKylGdK,1261446212676390912
RaptureForums,2020-05-15T23:59:48.000Z,Is the CDC Actually a Corrupt Vaccine Company? -  raptureforums.com/politics-cultu …,https://t.co/kqCTOj5zD4,1261446212403806208
yoskustiyono_,2020-05-15T23:59:48.000Z,"Don't be arrogant, remember that you are screwed by the covid b19 virus",,1261446212399464448
DigitalGwp,2020-05-15T23:59:48.000Z,Kane is back training and raring to go after injury and lockdown frustration gwpdigital.co.ke/sports/kane-is …,https://t.co/sOv13ykjGN,1261446212097466368
APPFEL,2020-05-15T23:59:47.000Z,Pandemic planning becomes political weapon as deaths mount  a.msn.com/01/en-us/BB149 …,https://t.co/CNbIjWMU8c,1261446211195727873
LouDaddie_RDC,2020-05-15T23:59:47.000Z,Wassup with me and cookies lately? I never been a cookie guy.. smh quarantine lls,,1261446211162083328
lulriahh2,2020-05-15T23:59:47.000Z,yeah im social distancing may give 4 fr,,1261446211107557377
_emilyeckert,2020-05-15T23:59:47.000Z,i recently found out that my 92y/o grandma with severe dementia has to be tested for covid bc someone in her assisted living building tested positive and all i have to say is fuck everyone that is still calling this a hoax,,1261446211044651008
jaljr,2020-05-15T23:59:47.000Z,"It's no longer about the medicine or the science. The politicians have taken the wheel. God help us As US coronavirus death toll mounts, so does the belief by some that it is exaggerated  fxn.ws/3buezok #FoxNews",https://t.co/EFY866m1nX https://x.com/hashtag/FoxNews?src=hashtag_click,1261446209610215424
sneakin,2020-05-15T23:59:47.000Z,Nobody imagined a coronavirus pandemic  @SenToddYoung ? Over at  @RoseHulman  we have Prof. O'Connor. @SenatorBraun   heraldbulletin.com/indiana/news/r …,https://x.com/SenToddYoung https://x.com/RoseHulman https://t.co/JTO0xEUaUr,1261446209438224385
newsjokindia,2020-05-15T23:59:47.000Z,Coronavirus Outbreak: BMC directs MCA to hand over Wankhede Stadium for potential creation of quarantine facility – Firstpost  newsjok.com/coronavirus-ou …,https://t.co/H9cTYFgusU,1261446208876359680
morfiqali,2020-05-15T23:59:47.000Z,Quarantine now,,1261446208788164608
peter_teese,2020-05-15T23:59:46.000Z,"Thank god Dan Andrews has taken a sober approach to the pandemic , I think if you need a drink publicly that much you might seek some counsel or go home and drink ... I will always value humans over $$$ & caution over egos !  t.co/oVAZiqjk6M",https://t.co/oVAZiqjk6M,1261446206401548288
NJASANews,2020-05-15T23:59:46.000Z,7 N.J. children confirmed to have rare inflammatory illness that may be linked to coronavirus  nj.com/coronavirus/20 …,https://t.co/iANGts6AOn,1261446205483241474
