User_name,Datetime,Content,Links,Tweet_ID
jcmaggi,2020-12-21T23:59:39.000Z,"Just remember, these dipsh*ts lied to you about the severity of the pandemic, ignored these sorts of restrictions, and are now jumping to the front of the line for the vaccine while they keep pumping their lemmings with the same BS  x.com/RexChapman/sta …",https://x.com/RexChapman/status/1341170416279236614,1341171505523113984
j_hance_,2020-12-21T23:59:37.000Z,"I’ll never forget the day of Four Seasons Total Landscaping. November was a stressful month and this colossal  mistake made me laugh harder than I had during the entire pandemic so far. The Trump era in a nutshell, and a great read by  @Olivianuzzi",https://x.com/Olivianuzzi,1341171498900402182
Oldguy_54,2020-12-21T23:59:37.000Z,"Why are we sending money to foreign countries for OUR covid ""relief"".",,1341171497717657601
tkpipedreams,2020-12-21T23:59:37.000Z,Now let's everyone stay healthy and get the vaccine so we can buy $125 tickets and $9 beers to see App vs ECU in an NFL stadium together.,,1341171497604435968
ProfJuanRGarcia,2020-12-21T23:59:37.000Z,WTF are you ranting about now. Look into your dark soul and ask for your God’s forgiveness for all the people you have killed because of your incompetence during this pandemic.,,1341171497134555136
BoilerFanTalk,2020-12-21T23:59:37.000Z,I wouldn’t be at all because Alabama like OSU is clear as day one of the best 4 teams in the country.   OSU was dodging an Illinois team that also had huge Covid issues is fucking hilarious. Ok.    Talking deserved when you’re a fan of a team that got smacked a day ago.,,1341171496782360582
GreenDecoreRugs,2020-12-21T23:59:37.000Z,"They know the longest night is about to pass and next year will be a better year than this! Stay safe everybody, the vaccine is being rolled out and there's hope for a brighter 2021 :)",,1341171495821856769
debleg58,2020-12-21T23:59:36.000Z,Republicans that didn't respect the mask mandate should not have been given the vaccine before my Mother who lives in a nursing home.,,1341171495469518849
Mmklop_,2020-12-21T23:59:36.000Z,I love coronavirus,,1341171494110572545
richardhyland,2020-12-21T23:59:36.000Z,WHO. you mean the people who delayed declaring a pandemic and covered up china’s case levels?,,1341171493716324355
THE__WAC,2020-12-21T23:59:36.000Z,Was she not the hottest woman on the planet when she was in The Mask?,,1341171491820474368
DMC0821,2020-12-21T23:59:36.000Z,"Oh look, a Ben Shapiro fan telling me the GOP isn't heartless...after they worked to get rid of my healthcare during a global pandemic.  Fuck outta my mentions.",,1341171491707219968
ErinSandersNP,2020-12-21T23:59:35.000Z,What/who do you love most in this world?  What brings you joy to just talk about? #NurseTwitter #MedTwitter #Surviving2020 #COVID   @AlexAndersonMD  @londyloo  @tmprowell  @acweyand  @kimacquaviva  @SaskiaPopescu  @drjessigold,https://x.com/hashtag/NurseTwitter?src=hashtag_click https://x.com/hashtag/MedTwitter?src=hashtag_click https://x.com/hashtag/Surviving2020?src=hashtag_click https://x.com/hashtag/COVID?src=hashtag_click https://x.com/londyloo https://x.com/tmprowell https://x.com/acweyand https://x.com/kimacquaviva https://x.com/SaskiaPopescu https://x.com/drjessigold,1341171491505881088
JONEEFRY,2020-12-21T23:59:35.000Z,"There's so many things I want to say about this, and none of them are good.  This is NOT ABOUT COVID RELIEF and it never was. It's just a primer for the progressive agenda, and it fuckin sickens me !",,1341171489639415808
miss_syone,2020-12-21T23:59:35.000Z,"put your mask on, atiny",,1341171489370898432
starsrewritten,2020-12-21T23:59:35.000Z,maybe step inside a hospital and work as a healthcare worker for 5 seconds if you want to try and talk about how covid is impacting hospitals,,1341171488368549889
Chiminy_26,2020-12-21T23:59:35.000Z,Y sin covid,,1341171488343404545
JTHEBIGP,2020-12-21T23:59:35.000Z,Would have to go on quarantine. It literally takes common decency to put on a mask for less than 5 minutes.,,1341171487471001601
Jessswim,2020-12-21T23:59:34.000Z,I'm often at a loss for words when trying to describe my feelings about NCAA during Covid-times. Now I can just point to this article. Great work  @nkalamb  @Derekcrim  &  @JohannaMellis  and shout outs to  @wagesofwins  @mirarose88  time.com/5922163/colleg …,https://x.com/nkalamb https://x.com/Derekcrim https://x.com/JohannaMellis https://x.com/wagesofwins https://x.com/mirarose88 https://t.co/YfOK53StQb,1341171485549969408
CB_Express,2020-12-21T23:59:33.000Z,Sydney Airport boss reveals true toll of COVID-19  ift.tt/3pbLjKe,https://t.co/2ksz4K5N65,1341171483037601792
jaromjordan,2020-12-21T23:59:33.000Z,"Gonzaga, San Diego & Pacific have had COVID issues.   Hoping those teams come out of it OK.  I'm hoping nobody has any more cancellations but it's realistic that BYU has games postponed/canceled in WCC play.",,1341171482202951680
tbird_05,2020-12-21T23:59:33.000Z,"I mean, when their dear leader throws a tantrum about masks, Covid, elections, etc., they all follow suit.",,1341171481988931585
sallybuggz,2020-12-21T23:59:33.000Z,If I see an antimasker or covid denier I’m literally be*ting them to de*th,,1341171481846444032
SpittinVenoms,2020-12-21T23:59:33.000Z,"Like the last one, I'm giving all mine to my ex old lady. The federal govt made that decision for me. Nothing wants to make you get back with your crazy baby mama quite like a pandemic.",,1341171481418588162
EShuder,2020-12-21T23:59:33.000Z,This COVID Relief Bill is a serious slap in American citizens’ faces. Foreign countries are receiving more aid then our own citizens. Also seems like every Representative and Senator is getting their own agendas/desires out of this Bill.,,1341171480965632008
GuardianMC,2020-12-21T23:59:33.000Z,"Unintentionally got a LONG weekend. Won't know my results for a few days, can't go back to work until Monday at the earliest, and I feel too shitty to enjoy the next (minimum of) six days off.  Love that the barhopping COVID deniers at work have avoided it but I might get it. -_-",,1341171479355027456
45and46,2020-12-21T23:59:33.000Z,Maybe because when people don’t shower or bathe social distancing comes naturally. No enforcement required,,1341171479313076225
Growing_Up_Sus,2020-12-21T23:59:33.000Z,I have an ongoing Playlist called después de la cuarentena (after quarantine) and its so good! I can't wait to be drunk with my friends dancing to it,,1341171479124140033
qbengrl,2020-12-21T23:59:32.000Z,@CDCgov  @GovWhitmer  @MichiganHHS  follow the science...mask and lockdowns DO NOT MAKE A DIFFERENCE!,https://x.com/CDCgov https://x.com/GovWhitmer https://x.com/MichiganHHS,1341171478281281538
Prowlo_File,2020-12-21T23:59:32.000Z,"In addition, about 50% of the food Britons consume—and up to 85% of the fresh fruit and vegetables the country eats—come from the EU, much of it shipped by trucks which cross the English Channel on ferries or the Eurotunnel train from France. It says here fortune.com/2020/12/21/the …",https://t.co/dbqBiM1m4T,1341171478268669952
realJonGormley,2020-12-21T23:59:32.000Z,"Gave a fun interview for Let’s Link Up via LinkedIn.  Talked a little bit about my acting background, life in the pandemic, and Harrison Ford.  Check it out : letslinkup.wixsite.com/website/post/s …  #actor #acting #webseries #filmmaking #Filmmaker #harrisonford #independentfilm #actorslife",https://t.co/JDUUVUA5Oa https://x.com/hashtag/actor?src=hashtag_click https://x.com/hashtag/acting?src=hashtag_click https://x.com/hashtag/webseries?src=hashtag_click https://x.com/hashtag/filmmaking?src=hashtag_click https://x.com/hashtag/Filmmaker?src=hashtag_click https://x.com/hashtag/harrisonford?src=hashtag_click https://x.com/hashtag/independentfilm?src=hashtag_click https://x.com/hashtag/actorslife?src=hashtag_click,1341171478159486976
jjcoolau,2020-12-21T23:59:32.000Z,Only if they let it grow into 800 deaths through incompetent quarantine management.,,1341171476775374850
ScreaminEagle28,2020-12-21T23:59:32.000Z,"You mean this vaccine? That apparently isn't proven to stop you getting it, or transmitting it... and still requires muzzles and anti social distancing. It will change nothing.",,1341171476150575105
mtfreepress,2020-12-21T23:59:32.000Z,COVID strategies could change under Gianforte  dlvr.it/Rp66G8 #mtnews,https://t.co/ddgpCDgGUe https://x.com/hashtag/mtnews?src=hashtag_click,1341171475739365376
ColinArdill,2020-12-21T23:59:32.000Z,Keep Ski hills open this winter.  chng.it/VcBXsnT4wX,https://t.co/zgXOdwO9XI,1341171475374628864
Tehaazz,2020-12-21T23:59:31.000Z,It's almost like it's Christmas and capitalism doesn't care about the pandemic  Q-Rona virus' pandemic? More like a capitalism's BANDEMIC,,1341171471167545344
KBweinberg,2020-12-21T23:59:31.000Z,The vaccine contains the church music for a child who has a little memory.,,1341171470978994176
SFDEM_MEC,2020-12-21T23:59:31.000Z,Everyday we are vaccinating more of our front line health care workers and responders.  Today Medic 65 got their first dose.  There are many people working behind the scenes at Covid Command to make this happen and we are all grateful.  @SFFDPIO  @SF_DPH  @SF_emergency,https://x.com/SFFDPIO https://x.com/SF_DPH https://x.com/SF_emergency,1341171470869831680
Mumbler100,2020-12-21T23:59:30.000Z,youtu.be/GQwJOoMky7M COVID shelling #FireInTheSpoof,https://t.co/SuVBqEkTDP https://x.com/hashtag/FireInTheSpoof?src=hashtag_click,1341171470316285952
ShantillynLace,2020-12-21T23:59:30.000Z,"There's something called a Living Will - good time for those 25 to sign one, stating no hospital care if Covid related.",,1341171468873424900
XJustified,2020-12-21T23:59:30.000Z,"Feel good games are always a good fall back. I also played more older games this year, but mostly because the pandemic was an excuse to plow through my backlog.",,1341171468734967808
Nervardia,2020-12-21T23:59:30.000Z,"But thousands of virologists and immunologists, vaccine scientists and DOCTORS disagree with them.",,1341171467354968065
imminent_news,2020-12-21T23:59:30.000Z,"Angelica Chica Morales, victim of covid-19, was fired with honor street. He was chief nurse at a hospital in Antioquia. A week ago, her baby was born. Here's the story ►   #colombia #mostshared  bit.ly/2Jezp32",https://x.com/hashtag/colombia?src=hashtag_click https://x.com/hashtag/mostshared?src=hashtag_click https://t.co/QU3qnP1u2D,1341171467195695104
ahmerdrufae,2020-12-21T23:59:30.000Z,"December should know be considered as Wedember. It’s either you are a groom,grooms family, bride, brides family or a victim of latecomer or cousin. In anyway you are a part of the wedding.YES NOW  Here comes Lockdown 2.0",,1341171467090874369
KObradovich,2020-12-21T23:59:30.000Z,Audit: Iowa Lottery revenues dropped nearly 5% as pandemic isolated gamblers #COVID19  iowacapitaldispatch.com/2020/12/21/aud … via  @iowacapdispatch,https://x.com/hashtag/COVID19?src=hashtag_click https://t.co/vUZr51WNbt https://x.com/iowacapdispatch,1341171466876956672
Madmaximillion,2020-12-21T23:59:29.000Z,@StrangRobert All you people who told me restaurants are closed go help stop the spread of covid-19 but this is allowed...,,1341171465601900544
MaryGui67384361,2020-12-21T23:59:29.000Z,Because she knows the truth! And a vaccine isn’t needed.,,1341171465383776256
davidallenN17,2020-12-21T23:59:29.000Z,No one seems happy with their government’s handling of covid. Perhaps the UK is not uniquely awful after all?,,1341171464645570569
California_Morn,2020-12-21T23:59:29.000Z,It's the US COVID stimulus package. All 5500 pages.,,1341171463366164480
lvaroGm51830374,2020-12-21T23:59:29.000Z,Covid??,,1341171462909157376
Djadesolah,2020-12-21T23:59:28.000Z,"50,400 for all private labs doing open PCR.",,1341171462149787650
jeprvt,2020-12-21T23:59:28.000Z,Dear @OntarioCitizens... Stop whining about the lockdown!!  Suck it up and just do what PH asks for 28 days.  We are the solution so buck up and get it done!!,,1341171458630934534
Anthony_Lanati,2020-12-21T23:59:27.000Z,"I mean really..  he is a magical fat man who eats loads of cookies, doesn’t have diabetes, and pops down chimneys without getting stuck or dirty.  I think it’s safe to say Covid couldn’t infect Santa because he’s magical.",,1341171457817255937
duquesnemike,2020-12-21T23:59:27.000Z,"Rand Paul in June, ""We shouldn't presume that a group of experts somehow knows what's best for everyone."" What we should say to Rand Paul now that there is a vaccine, 'GET THE FUCK TO THE BACK OF THE LINE!""",,1341171457171353600
BrodysGrandma,2020-12-21T23:59:27.000Z,"My daughter in law is a nurse who was diagnosed covid positive this morning. She's been sick for two days and I'm scared for her,  my son, and my two year old grandson. Please pray for them.",,1341171457053913093
PeasantBoy17,2020-12-21T23:59:27.000Z,"Pathetic, an honors chemistry/biology high school student could explain the components of the vaccine. It’s not complex. Politicians didn’t make it, scientists did. If you’re too stupid to listen to the people who have devoted their life to science then you deserve to catch it.",,1341171456965828612
colin1111111111,2020-12-21T23:59:27.000Z,injecting myself with the 'funny' vaccine,,1341171456596709379
djjonuk,2020-12-21T23:59:27.000Z,Lockdown - DJ Jon  youtu.be/fjrfgBf2YtA via  @YouTube,https://t.co/uYHzhK3VZC https://x.com/YouTube,1341171456038875136
lesliechester2,2020-12-21T23:59:27.000Z,"Because there isn't a ""catastrophic"" rise in cases, just a rise in positive test results using the useless PCR test",,1341171455992672257
StevenWillcox2,2020-12-21T23:59:27.000Z,That's not part of the covid relief part.,,1341171455204024320
arguablywrong,2020-12-21T23:59:27.000Z,"nextstrain.org is very useful and all, but you're limited to thousands of samples, so they have to subsample.  Do that badly and you miss things.  Do it well and you miss small stuff early.  If you just want to do variant calling and analysis, you can do millions easy.",https://t.co/xdxQYpuKOY,1341171454155444224
susanktroxell,2020-12-21T23:59:27.000Z,And it wasn't just the dance line - I did not see a mask in the place.,,1341171454042238976
boringfileclerk,2020-12-21T23:59:26.000Z,Have you gotten the vaccine yet?,,1341171453572521984
SCCraftDesigns1,2020-12-21T23:59:26.000Z,Face Masks Cotton 2 Layered |FaceMask |  Flannel |  Non- Medical Masks | Dust Mask | Washable and Reuseable | Cotton Facemask  tuppu.net/bc899ec #Woodsigns #Interiordecor #Homedecor #Gifts #Coasters #Resin #Keychain #Wallart #Facemask,https://t.co/f964qC3WVs https://x.com/hashtag/Woodsigns?src=hashtag_click https://x.com/hashtag/Interiordecor?src=hashtag_click https://x.com/hashtag/Homedecor?src=hashtag_click https://x.com/hashtag/Gifts?src=hashtag_click https://x.com/hashtag/Coasters?src=hashtag_click https://x.com/hashtag/Resin?src=hashtag_click https://x.com/hashtag/Keychain?src=hashtag_click https://x.com/hashtag/Wallart?src=hashtag_click https://x.com/hashtag/Facemask?src=hashtag_click,1341171453434220545
STVASTG,2020-12-21T23:59:26.000Z,All 2020 goals has been achieved except for 2. 1) Over 100K signatures  chng.it/4wB8pPQK 2) Fundraising goal of $2.5 mill.  gofund.me/65cb20a4 The pandemic pushed everything back but in some areas we had record progress. Let's go! We can do it! 2020 hasn't ended yet!,https://t.co/ucmnn6mTow https://t.co/mKCvrzW4nv,1341171453316784129
arinalewisxo,2020-12-21T23:59:26.000Z,If you eat the hotdogs from Costco  or Canadian tire don’t worry about what’s in the vaccine.,,1341171451685122048
ABSCBNNews,2020-12-21T23:59:26.000Z,Singapore gets Asia's first batch of Pfizer's #COVID19 vaccine  bit.ly/3h9Agyl,https://x.com/hashtag/COVID19?src=hashtag_click https://t.co/qU1Bf5nGuJ,1341171451307544577
PoliticalOdor,2020-12-21T23:59:26.000Z,"Just want to make sure, because you are a FAKE CHRISTIAN, is why you got the vaccine before front-line health workers got it, right?  Hypocrit much?",,1341171450636623874
Frissy8,2020-12-21T23:59:26.000Z,Look at this witch here...I'm a teacher... teaching virtually and in person simultaneously and I'm still waiting for the vaccine...this country sucks!,,1341171450313650176
Brooklynncudi,2020-12-21T23:59:26.000Z,I’m getting sick of seeing people post that they’re out with a bunch of people as if there isn’t a spike in covid rn/:,,1341171450149883904
ABSCBNNews,2020-12-21T23:59:26.000Z,Palace: IATF to consider ban on British travelers over new coronavirus strain  bit.ly/2J9d1I8,https://t.co/Bnp4hYiHqH,1341171449864671232
Alex65977506,2020-12-21T23:59:25.000Z,"You see, Biden was responsible and held very few rallies because...well...pandemic. Also, plenty of people voted against Trump and not for Biden per se, myself included. Republicans included. Sorry we're not all obsessed with our candidate of choice.",,1341171449160114177
TheJeffC,2020-12-21T23:59:25.000Z,"If you drink Aquafina or Dasani water, don’t worry about what’s in the vaccine",,1341171449042710530
ABSCBNNews,2020-12-21T23:59:25.000Z,20% of PH population to get #COVID19 vaccine next year through COVAX  bit.ly/3ha0ocu,https://x.com/hashtag/COVID19?src=hashtag_click https://t.co/XQK9s7aClj,1341171448438648833
Holdmypint,2020-12-21T23:59:25.000Z,Time to dismiss the ayatollah and the #nphet mullahs. They have been completely inept. Their solution to everything is another lockdown.,https://x.com/hashtag/nphet?src=hashtag_click,1341171448304590848
FOX61News,2020-12-21T23:59:25.000Z,Here are some questions and answers on what’s known about the virus so far.  fox61.com/article/news/h …,https://t.co/c08hmH6rvN,1341171447935463426
laurenbove,2020-12-21T23:59:25.000Z,"Superspreader, doomscrolling, quarantini, social distancing,aerosol droplets, systemic racism, panic shopping, hoarding, contact tracing, blursday, flatten the curve, ventilator, hydroxychloroquine, Regeneron, regeneron ballot. Mail in ballot. Absentee ballot, PPE, n95...",,1341171447813861377
Marie28880819,2020-12-21T23:59:25.000Z,Vote no the stimulus check. Outside of USA are getting the money. $600 no thanks and you have to get covid19 vaccine to get that money. My health is more than a $600. Congress is a joke,,1341171446970806272
ABSCBNNews,2020-12-21T23:59:25.000Z,"Philippines to get 30 million doses of Novavax #COVID19 vaccine, says Locsin  bit.ly/2WxLOCd",https://x.com/hashtag/COVID19?src=hashtag_click https://t.co/pVIDHaPX7H,1341171446941290497
caramelxcouture,2020-12-21T23:59:25.000Z,"2020 - moved to Vegas, FUCKING COVID, found myself and who I am, ROCK BOTTOM to get there   But there’s always a light at the end of the tunnel",,1341171446781919233
top1percentile,2020-12-21T23:59:25.000Z,"Did you see that the UK Regulator, the MHRA, are procuring an AI based IT system to record & analyse ""the expected high volume of Covid-19 vaccine Adverse Drug Reaction (ADRs)"". ted.europa.eu/udl?uri=TED:NO …",https://t.co/KVK3mBwVAt,1341171446668808192
paradise_lost11,2020-12-21T23:59:25.000Z,"According to the 2011 census 889 people live there, are you telling me this is the #covid epicentre? Just 89 lucky individuals don't have it. Delete this tweet and go to bed.",https://x.com/hashtag/covid?src=hashtag_click,1341171445657972737
Susan_forDan,2020-12-21T23:59:24.000Z,Here is another summary. Scott Morrison government failed in their responsibility for quarantine adminstration. They Palmer it off to the states with 3 days notice to set up quarantine programs.,,1341171445318074369
ABSCBNNews,2020-12-21T23:59:24.000Z,Philippines seeks $325-million ADB loan for coronavirus vaccines  bit.ly/3h707a6,https://t.co/i48RwDLaVu,1341171445309861890
Eddie_ONeill,2020-12-21T23:59:24.000Z,"@AOC  You are one selfish individual. You denied a vaccine to people who are at more risk than you. Have you no shame ? Typical politician, put your interests first. An honourable person would have refused it and given priority to at risk individual’s  You make me sick #vaccine",https://x.com/AOC https://x.com/hashtag/vaccine?src=hashtag_click,1341171444940726273
OndaCronica,2020-12-21T23:59:24.000Z,INFORME #Covid-19 21-12-20,https://x.com/hashtag/Covid?src=hashtag_click,1341171444408082435
SheilaHolly3,2020-12-21T23:59:24.000Z,@AHS_Warranty  beyond disappointed with your service so far. Why would it take over five days for you to approve a new water heater during a global pandemic?? It is ridiculous that we are boiling water just to wash dishes and bathe our children. Can anyone actually help us!?!,https://x.com/AHS_Warranty,1341171444189818880
gcorteen,2020-12-21T23:59:24.000Z,Because he doesn't want the vaccine right now?,,1341171444127035392
myiah_whitley,2020-12-21T23:59:24.000Z,Honestly surprised I didn’t do this during quarantine. I smell another one coming tho so this will for sure come in handy!,,1341171443514662915
ChristineEasda1,2020-12-21T23:59:24.000Z,Strange how BLM never causes COVID spikes.  t.co/wIyfG9hZme,https://t.co/wIyfG9hZme,1341171442633887745
ABSCBNNews,2020-12-21T23:59:24.000Z,Malacañang denied on Monday that Metro Manila's 12 million people will be locked down during the Christmas and New Year's holidays to arrest the spread of the novel coronavirus.   bit.ly/37EDh6H,https://t.co/RyN7hldEQm,1341171442109431809
AlbertaLeonidas,2020-12-21T23:59:24.000Z,"No they dont, u know we have on average 273 abortions a day in Canada. We have accepted that number as a cost of choice.  And again those deaths are with covid not of covid ffs",,1341171441681670144
LindaStewartFL,2020-12-21T23:59:24.000Z,"Trump administration political appointees tried to block or change more than a dozen government reports that detailed scientific findings about the spread of the coronavirus, a House panel investigating the alleged interference said Monday. floridapolitics.com/archives/39015 …",https://t.co/hilUblVXYM,1341171441593704454
Viv94161093,2020-12-21T23:59:24.000Z,"PCR= main tool to sabotage world economy and instaure dictature on citizens. you are right, none of this would have happened without the ""tests"". Expose PCR fraud and the whole damn thing might collapse in a few days.",,1341171441337835520
infinitesteez__,2020-12-21T23:59:23.000Z,Saint Laurent Mask was def top 3 on here,,1341171441010696192
TheZaneSimon,2020-12-21T23:59:23.000Z,Didn't he have to wait tables without the pandemic while in the UFC and them raking in money? Seems more like the UFC holding him down than me. I want to see him taken care of. Way better than the UFC has done for him.,,1341171440834363392
OKnox,2020-12-21T23:59:23.000Z,I'm laid off. COVID cut.,,1341171440733843458
ABSCBNNews,2020-12-21T23:59:23.000Z,"The total number of #COVID19 cases in the Philippines reached 461,505 on Monday after the Department of Health reported 1,721 additional infections.  bit.ly/3h6DOS9",https://x.com/hashtag/COVID19?src=hashtag_click https://t.co/zUkEpNV6Cd,1341171440607846400
cohnkaren,2020-12-21T23:59:23.000Z,Gvernor Cuomo demonstrating wrong way to wear a mask  google.com/amp/s/champ.go …,https://t.co/5LOeuYqY5Y,1341171440121303040
TJGIII,2020-12-21T23:59:23.000Z,"Look how quickly the ones not wearing a mask, downplaying the virus and calling it a hoax are lining up ahead of those that care for the sick and elderly that truley need it",,1341171439802658818
joeross1800,2020-12-21T23:59:23.000Z,"If you cared about communities you wouldnt enable superspreader events by selling fucking party supplies during a global pandemic that has killed 1.7 million people.  Oh, and to whoever is admining this page: Is the money really worth it to shill for these greedy bastards?  t.co/r2H8PKr2oJ",https://t.co/r2H8PKr2oJ,1341171439773380609
ManuelP67469404,2020-12-21T23:59:23.000Z,"Come on Georgia, the Country is depending on you to come through for this Country.  Democrats need these 2-Senate seats.  If you want Pandemic support, President-Elect Joe Biden needs your vote.  Republican McConnell and Senate Republicans do not want to help!",,1341171439722967049
Roberttimestwo,2020-12-21T23:59:23.000Z,I agree - I think he's the messenger from trump's former patrons (you know they people who made billions during the pandemic) they got their money but now want trump out - he's always been just a useful idiot,,1341171439194546179
Sandbog,2020-12-21T23:59:23.000Z,Liked to see you staff wearing a mask on NBC nightly news!  Good promotion from your staff.,,1341171439123120128
ABSCBNNews,2020-12-21T23:59:23.000Z,"DAY 283. Here are the stories you need to watch out for today, December 22, 2020, amid the #COVID19 pandemic:",https://x.com/hashtag/COVID19?src=hashtag_click,1341171438816907265
chunky_moisture,2020-12-21T23:59:23.000Z,This Karen just copped an attitude with me because I told her she has to wear a mask if she’s going to shop here.,,1341171438598848514
tania_leets,2020-12-21T23:59:23.000Z,"via  @WPLGLocal10  : ""I can understand the argument, ‘This could be grandpa’s last Christmas,’ but if he gets COVID it probably definitely will be,” said Andrew Pastewski, the ICU medical director at Jackson South Medical Center.""   #WearYourMask #MaskUpMiami",https://x.com/WPLGLocal10 https://x.com/hashtag/WearYourMask?src=hashtag_click https://x.com/hashtag/MaskUpMiami?src=hashtag_click,1341171437495873537
being_human_x1,2020-12-21T23:59:23.000Z,Agreed but why the flight ban to / from UK for only 72 hours? Do you want to deal with the new strain of the virus also?   globalnews.ca/news/7533898/f …,https://t.co/ofJk9GpTbj,1341171437126569984
joshf313,2020-12-21T23:59:22.000Z,@senatemajldr you are giving us 600 could you live off 600 after this long? Oh wait@you don’t have to you still get your pay through this whole lockdown! We the people want to take your pay away and see how@much faster you get results for the people.,,1341171435671351297
