User_name,Datetime,Content,Links,Tweet_ID
rayzer2,2020-03-22T23:59:42.000Z,Congratulations! Steve Lookner  @Lookner  just read your entire Covid thread on his internet broadcast.,https://x.com/Lookner,1241877242453659655
Pcsst,2020-03-22T23:59:42.000Z,Pelosi says House will draft its own coronavirus funding bill | TheHill  thehill.com/homenews/house … #SmartNews,https://t.co/e9QTdwUtf5 https://x.com/hashtag/SmartNews?src=hashtag_click,1241877242323427328
Victoria4Texas,2020-03-22T23:59:42.000Z,"As a result, I am supporting Dallas County Judge Clay Jenkins’ call for our community to unite by following the Stay-At-Home initiative. The Stay-At-Home initiative is necessary to slow the spread of the virus and allow health care facilities to handle the increase in patients.",,1241877241862279168
nymanmedia,2020-03-22T23:59:42.000Z,Are we losing our minds? Getting back to reality in the age of realtime data  bit.ly/39b7aZN #coronavirus #media,https://t.co/l7PGDniDVt https://x.com/hashtag/coronavirus?src=hashtag_click https://x.com/hashtag/media?src=hashtag_click,1241877241748803584
Geminibreeze,2020-03-22T23:59:42.000Z,This cause is close to my heart - please sign:  sign.moveon.org/petitions/prio …,https://t.co/Mts4o7Rr3y,1241877241635598336
twsp_com,2020-03-22T23:59:41.000Z,"Rand Paul Tests Positive for Covid-19, Fueling Anxiety in the Capitol -  e-news.us/rand-paul-test …",https://t.co/wcX2Sg9hd4,1241877241044312070
log1caLidiot,2020-03-22T23:59:41.000Z,"What about the kids? #quarantine #dark #park @ Lima, Peru  instagram.com/p/B-DiPtrDJ-v/ …",https://x.com/hashtag/quarantine?src=hashtag_click https://x.com/hashtag/dark?src=hashtag_click https://x.com/hashtag/park?src=hashtag_click https://t.co/UnTSDuuSqf,1241877240918544386
Zakurex,2020-03-22T23:59:41.000Z,African Swine Fever Vaccine May Worsen Outbreaks of the Disease in...  thevaccinereaction.org/2020/03/africa …,https://t.co/ExoxTTAUdF,1241877240876601346
Kristie_PF,2020-03-22T23:59:41.000Z,"Here is an excellent one-stop resource for those working in #EarlyChildhood, especially #SPED. @ECTACenter intends to continue to update this page:  ectacenter.org/topics/disaste …",https://x.com/hashtag/EarlyChildhood?src=hashtag_click https://x.com/hashtag/SPED?src=hashtag_click https://t.co/sIIK9m6Zh7,1241877240780148737
Briani_arlyn,2020-03-22T23:59:41.000Z,Bro  i know yall all in quarantine  so can yah go vote for me  link is in my bio. Help a hispanic young female win this shit. It’ll help me showcase my tats world wide. CLICK THE LINK BELOW cover.inkedmag.com/2020/brianis-f …,https://t.co/7H1jhyYN1x,1241877240524275714
NTVNewsNL,2020-03-22T23:59:41.000Z,How to stay fit at home during COVID-19 pandemic  ntv.ca/how-to-stay-fi …  @bethpenneyNL,https://t.co/esgqHuptFx https://x.com/bethpenneyNL,1241877240394194948
KareemGongora,2020-03-22T23:59:41.000Z,"You know in quarantine, those hours are like days.",,1241877240024952832
YouDreamZai,2020-03-22T23:59:41.000Z,My quarantine bae not feeling as freaky as me rn and I’m like a dog in heat rn,,1241877239383326721
jasonedrich,2020-03-22T23:59:41.000Z,"Really wish that my mom could send me all my old LEGO’s rn... I’d make the most epic quarantine playground for my LEGO people. But also staying the LEGO equivalent of 6ft from each other, obviously.",,1241877239278559234
IndivCincy,2020-03-22T23:59:41.000Z,"Coronavirus: 38 test positive in New York City jails, including Rikers Island  theguardian.com/us-news/2020/m …",https://t.co/Yk0W50bW8z,1241877238859120644
zakfromthe_6,2020-03-22T23:59:41.000Z,smoke sum soon before dis quarantine shit get real,,1241877238699581440
dave_etheridge,2020-03-22T23:59:41.000Z,"However bad Coronavirus gets, it would have been 100 times worse if you clowns in Labour had been running the country. We have a majority-elected government, so we don’t need you or your ragbag of hangers-on sticking your oar in, thanks very much ...",,1241877238355767296
MN2FLA,2020-03-22T23:59:41.000Z,If ever there was a time for the #Avengers to assemble... @RobertDowneyJr  @ChrisEvans  @MarkRuffalo  @chrishemsworth  @Renner4Real  #coronavirus,https://x.com/hashtag/Avengers?src=hashtag_click https://x.com/RobertDowneyJr https://x.com/ChrisEvans https://x.com/MarkRuffalo https://x.com/chrishemsworth https://x.com/Renner4Real https://x.com/hashtag/coronavirus?src=hashtag_click,1241877238238384133
EzraGigi,2020-03-22T23:59:41.000Z,Social distancing and isolation is normal  for Programmers.,,1241877238108188672
robbycaughey1,2020-03-22T23:59:41.000Z,"Giving people money they need to live on while they are staying home has benefits for many other Americans. This is a no-brainer! Provide everyone with $2,000 a month so they will stay at home and reduce spread.",,1241877237936164868
MendocinoMusic,2020-03-22T23:59:41.000Z,Ticket sales open 10 AM Monday 3/23; COVID-19 refund policy -  mailchi.mp/mendocinomusic …,https://t.co/x4g4qp9ITK,1241877237764407300
BrianMoreno8694,2020-03-22T23:59:41.000Z,I’m gonna run out of shows to watch with this quarantine,,1241877237739270144
nhoodpublicist,2020-03-22T23:59:41.000Z,Y’all my mama put the ice cream in the microwave and then tried to yell at me because she couldn’t find it. Social distancing already got her losing it,,1241877237412040704
ElMori106,2020-03-22T23:59:40.000Z,That’s why you don’t go outside when you suppose to be on quarantine,,1241877237017657344
RODNEYCSLANG,2020-03-22T23:59:40.000Z,NIALL HORAN   ARIANA GRANDE   PRAY FOR 14682 SPIRIT BY CORONAVIRUS AND MANCHESTER 22 SPIRIS AND MAC MILLER              Niall Horan - Slow Hands (One Love Manchester)  youtu.be/nuS0lTxbL8Q via  @YouTube,https://t.co/zet1rGcvbL https://x.com/YouTube,1241877236959100931
cortney_hamons,2020-03-22T23:59:40.000Z,"Turned off all the lights, turned on the fireplace lit some candles and pored me a a large glass of wine. Now this is the life in quarantine",,1241877236598308864
_Tristan_Max,2020-03-22T23:59:40.000Z,"Imagine being sent to prison for 23 years, contracting coronavirus and dying all within the same year  Cya Mr Weinstein",,1241877235948290050
NAElliottdc,2020-03-22T23:59:40.000Z,Really clear exposition of the difference between normal flu and this coronavirus and why it requires different behaviour.,,1241877235914747906
Victoria4Texas,2020-03-22T23:59:40.000Z,"From State Representative Victoria Neave: We must continue our efforts to get in front of the novel coronavirus – COVID-19. As a community spread area, it is necessary to consider all possible solutions to protect our health and public safety.",,1241877235671486465
aftjae,2020-03-22T23:59:40.000Z,"Yes. It's not the people who're self-isolating. It's those who are not 'social distancing' and just hanging out. Those that are, need support 2 feel connected not isolated when quarantined. Also need support 4 those who live with e.g. domestic violence & mental health conditions.",,1241877235147124739
MsSoleSurvivor,2020-03-22T23:59:40.000Z,"Jackbox Games for Quarantine Days - Join for free fun, laughs, and the occasional WTF twitch.tv/mssolesurvivor  #jackboxgames #partygames #remotegames #playonline #twitch #jackbox #gaming",https://t.co/3rULglryhB https://x.com/hashtag/jackboxgames?src=hashtag_click https://x.com/hashtag/partygames?src=hashtag_click https://x.com/hashtag/remotegames?src=hashtag_click https://x.com/hashtag/playonline?src=hashtag_click https://x.com/hashtag/twitch?src=hashtag_click https://x.com/hashtag/jackbox?src=hashtag_click https://x.com/hashtag/gaming?src=hashtag_click,1241877235147124737
mrverrall,2020-03-22T23:59:40.000Z,This weekend people have basically been panic buying the outdoors. #coronavirus #COVID19,https://x.com/hashtag/coronavirus?src=hashtag_click https://x.com/hashtag/COVID19?src=hashtag_click,1241877235117760517
JJBrent,2020-03-22T23:59:39.000Z,Wow. Check this one out. I AM NASHVILLE - A Love Letter To America's IT City Under Lockdown,,1241877232626302978
LuxHippie,2020-03-22T23:59:39.000Z,My fan fic going dumb bc of this quarantine lmao,,1241877232601178118
DanicaDelRey,2020-03-22T23:59:39.000Z,just realized this dude has been social distancing me via all social media before the quarantine started,,1241877232546709506
Almijisti,2020-03-22T23:59:39.000Z,"Yes; plus they directly traced everyone associated with the superspreader event at the Daegu church.  And social-distancing is second nature for koreans, as is cleanliness and masks (at least in Seoul). 1/2 Korean here, so I speak from experience.",,1241877232274092040
meggacoll,2020-03-22T23:59:39.000Z,same gurl same. was down 25. went to the gym 5 days a week for the last 5 weeks with out missing a day and some 2 a days. quarantine comes and all i did this week was one weak ass bike ride. my whole flow has been fucked up,,1241877231837818881
theragingbull,2020-03-22T23:59:39.000Z,Speaker Nancy Pelosi said House Democrats would introduce their own legislation as stimulus talks continue  Get it together the people that put you in office need you to act.   wsj.com/articles/admin …,https://t.co/S7QXuGV5Gw,1241877230659293186
Sasha_637,2020-03-22T23:59:39.000Z,God bless you.  I was the positive one when my husband had the worst variant of GBS in 2008.  @ 45 he recovered well with some minor permanent side effects...ankles and feet don't stretch out like they did...some eye issues that wearing contacts 24/7 isn't good. Prayers 4 you.,,1241877230352990210
dunbargreetings,2020-03-22T23:59:39.000Z,COVID-19  person can save lives  Under quarantine please play safe #canada #vancouverbc  instagram.com/p/B-DiPd5AB_z/ …,https://x.com/hashtag/canada?src=hashtag_click https://x.com/hashtag/vancouverbc?src=hashtag_click https://t.co/7pqrjpDpRM,1241877230139006976
DonAlfredo1949,2020-03-22T23:59:39.000Z,@TomLlamasABC some of the images on America’s Strong not following social distancing,,1241877230105415680
Azurephoenix33,2020-03-22T23:59:39.000Z,"Need some quarantine friends, add me!  instagram.com/p/B-DiFNqpEQBW …",https://t.co/5s2sbRRaKU,1241877230067896327
WFSJ,2020-03-22T23:59:39.000Z,Why is Japan still a coronavirus outlier?  By Oscar Boyd japantimes.co.jp/opinion/2020/0 …,https://t.co/la1t1wLD9W,1241877229841383424
NPP_Sports,2020-03-22T23:59:39.000Z,"NPHS Update: Long interview with  @nphs_activities  AD Jordan Cudney. Lots of great information! COVID update, Winter sports wrap up, the future of the GNAC! Check it out!!  northplattepost.com/posts/5e77fb28 …",https://x.com/nphs_activities https://t.co/drAPxgmzK9,1241877229128294402
ESB_Immigration,2020-03-22T23:59:38.000Z,"COVID-19: USCIS, US Embassy and Consulate Closures for In-Person Appointments.   March 19, 2020.  Consular sections of US embassies around the world, as well as US Citizenship and Immigration Services, are beginning to announce can… lnkd.in/eYxMQyD  lnkd.in/eUC7u9K",https://t.co/XxTpdgE34Z https://t.co/tAVl29Z1Ui,1241877228725641227
leggie,2020-03-22T23:59:38.000Z,"Tell @senatemajldr and  @SpeakerPelosi  to protect people from financial hardship due to the #coronavirus pandemic. Put people first, not corporations.  Sign the  @CRAdvocacy  petition:  pic.x.com/VB2jfybPiR  action.consumerreports.org/finance2020032 …",https://x.com/SpeakerPelosi https://x.com/hashtag/coronavirus?src=hashtag_click https://x.com/CRAdvocacy https://x.com/CRAdvocacy/status/1241088755823501314/photo/1 https://t.co/2PWuGmHMBR,1241877228683776003
sa_meow,2020-03-22T23:59:38.000Z,Today Nico reminded me that we’ve only been “hanging out for a few years” & that I shouldn’t “get excited” so I guess during my time in quarantine I was demoted from girlfriend to chill partner kewlllll,,1241877228616646658
Seth_Horwitz,2020-03-22T23:59:38.000Z,"It’s not difficult to get “trust” when your people have no free access to information. Tell us all about the ills of Xenophobia while your government has Uighurs in concentration camps, during a global pandemic of your government’s creation. Spare me the propaganda.",,1241877228549439495
CTVNews,2020-03-22T23:59:38.000Z,Rand Paul is first U.S. senator to test positive for coronavirus  ctvnews.ca/health/coronav …,https://t.co/qBxR3ZULvN,1241877228213997568
Reddaddy1989,2020-03-22T23:59:38.000Z,Hey  @CandyCrushSaga  for social distancing and to encourage people to stay in maybe we could give some free unlimited lives and maybe some free boost. I can’t beat this level!!! Thinking on going out if I can’t beat it :( #comeon #CandyCrushchallenge #SocialDistancing,https://x.com/CandyCrushSaga https://x.com/hashtag/comeon?src=hashtag_click https://x.com/hashtag/CandyCrushchallenge?src=hashtag_click https://x.com/hashtag/SocialDistancing?src=hashtag_click,1241877226653732867
ayladwt_,2020-03-22T23:59:38.000Z,what if this pandemic happened several years from now when I could be one of the frontliners sacrificing for the welfare of the country? I can't imagine the situation of health professionals who are far away from their families & homes to be in service to the ppl  #COVIDー19,https://x.com/hashtag/COVID%E3%83%BC19?src=hashtag_click,1241877226489933830
RamirezJnr,2020-03-22T23:59:38.000Z,He’s a smart man but he’s purposely spreading a lie that nobody warned about COVID-19 in January. The federal government was warned about COVID-19 in January and given a detailed plan on what to do by WHO.,,1241877225210695681
GraceSm16250397,2020-03-22T23:59:38.000Z,"CNN said the viral pandemic is due to climate change, which must be true of the 1918 viral pandemic.",,1241877224984281088
HillSii_arts,2020-03-22T23:59:38.000Z,Yeah I've been issued another two weeks of quarantine xxdxdxddx,,1241877224753696774
carriegravenson,2020-03-22T23:59:37.000Z,I hate Harvey Weinstein but I don’t delight in him having coronavirus. I want him to be physically healthy enough to be emotionally miserable for all the days he’s in prison. I have friends who have the virus. I don’t want to praise it for picking any one person over another.,,1241877223977766914
IDB1127,2020-03-22T23:59:37.000Z,Doors locked due to quarantine.,,1241877223604396035
WeBussin,2020-03-22T23:59:37.000Z,Quarantine really fuckin with some of yall brains.,,1241877223524700161
hesitantlyworm,2020-03-22T23:59:37.000Z,i feel like i was scammed out of spring break. by the time i got home it was halfway over and it’s still extremely stressful dealing with a pandemic and neither me nor my family is immunocompromised or otherwise disadvantaged. i can’t imagine what some others are going through,,1241877223424118784
COVID19LiveNow,2020-03-22T23:59:37.000Z,Launches from Europe's spaceport are suspended due to COVID-19  covid19globalcases.com/launches-from- …,https://t.co/PAxtWCBP7F,1241877223264698369
mohd_tata_,2020-03-22T23:59:37.000Z,Let’s fight covid first now..,,1241877222912294912
SyedaAbbastv,2020-03-22T23:59:36.000Z,"Social distancing with this microphone and doing  facetime interviews. Although we are in uncertain times it’s important to remember we are all in this together. Kindness, hope & love are not cancelled. Stay safe.",,1241877219498250240
TheRiseNation,2020-03-22T23:59:36.000Z,The last series came down to a nail biting overtime in which we fell short. GG's to #Quarantine. Time to look forward and focus on our next match.   #RISEGOW  La Familia   (OFF STREAM) We will keep everyone updated.,https://x.com/hashtag/Quarantine?src=hashtag_click https://x.com/hashtag/RISEGOW?src=hashtag_click,1241877219456188416
Bogglethemind81,2020-03-22T23:59:36.000Z,"Restocking the shelves. Life is still going on. The thing is that you need to plan for the eventuality that you MAY be sick and would, in that case, need to stay home. Or you and your spouse would need to self-quarantine, then you should have enough supplies to get by during that",,1241877219032682499
jayne_golden,2020-03-22T23:59:36.000Z,"Truckers brave coronavirus outbreak to deliver goods: 'If we stop, the world stops' - USA TODAY  apple.news/AlFqcf1b6SUyic …",https://t.co/a0lQFHuCEc,1241877218789396481
VancouverSun,2020-03-22T23:59:36.000Z,"COVID-19: Vancouver firefighters haul in a ""contactless"" pizza delivery  vancouversun.com/news/covid-19- …",https://t.co/6sUq22gttn,1241877218684518402
CentervilleOH,2020-03-22T23:59:36.000Z,A recap of the latest stay-at-home rules from Governor Dewine. Local information is available at  centervilleohio.gov/coronavirus.,https://t.co/CTCGCN0MhC,1241877217774370817
cocomahtin,2020-03-22T23:59:36.000Z,"The senator from Kentucky is asymptomatic, and swam in a pool and worked out at the gym while waiting for his results, so he doesn’t really need anyone’s sympathy.",,1241877217690308608
alexragone,2020-03-22T23:59:36.000Z,The Doctor Who Helped Defeat Smallpox Explains What's Coming(via  @Pocket ) #longreads  pocket.co/xdAnCM #coronavirus #onenewjersey #onenewyork,https://x.com/Pocket https://x.com/hashtag/longreads?src=hashtag_click https://t.co/Jl4Pb5FgR0 https://x.com/hashtag/coronavirus?src=hashtag_click https://x.com/hashtag/onenewjersey?src=hashtag_click https://x.com/hashtag/onenewyork?src=hashtag_click,1241877217564655618
_ghost_piss_,2020-03-22T23:59:36.000Z,Me and my quarantine bf.,,1241877217229094913
TheLadyArcher77,2020-03-22T23:59:36.000Z,"Chicago Police Announce 2 New Sworn Officers Test Positive For Coronavirus, Bringing Total To 3  a.msn.com/01/en-us/BB11y …",https://t.co/XQMQQZ47ks,1241877217220505601
DriFit_Don,2020-03-22T23:59:36.000Z,Quarantine really beating you up... but these pictures of y’all putting lion king characters in actual clothes are hard  x.com/LIBGyal/status …,https://x.com/LIBGyal/status/1241873536995729408,1241877216880807937
Teacloc,2020-03-22T23:59:35.000Z,"Good. We can't have illegal aliens spreading the virus for fear of deportation when testing.  Immigration can be addressed later. If you're already here, we need to fight this pandemic together.",,1241877214754476041
asia_magwood,2020-03-22T23:59:35.000Z,The answer now seems to be quarantine quarantine quarantine we were living at times were fuck it seems to be the attitude if your on the side that dont take precautions to be safe #lockdownTheUsa,https://x.com/hashtag/lockdownTheUsa?src=hashtag_click,1241877214561435652
Postal18,2020-03-22T23:59:35.000Z,“F*ck you Joe Buck!” -  @YungRalf  to catcher  @johnbuck44  after making the last putout against the Mets to which John Buck took off his mask and smiled and replied “F*ck you!”,https://x.com/YungRalf https://x.com/johnbuck44,1241877214444105731
s_zvmorv,2020-03-22T23:59:35.000Z,wow this quarantine made her go from “omg ily” to calling me a damn hater,,1241877214276268034
JoJoBeatMeizter,2020-03-22T23:59:35.000Z,Playin Resident Evil in the middle of a pandemic was a mistake...,,1241877214229958656
ArchangelAmongU,2020-03-22T23:59:35.000Z,Most of you have no memory of watching children die of smallpox or polio. People in Africa are still dying of diseases that could be eradicated by vaccine. You’ve been taught to fear with false conspiracy theories so that you can once again be controlled.,,1241877213995085824
MongoGamingX,2020-03-22T23:59:35.000Z,"Could be having this high rate since nvoc is able to trick the initial response from our immune systems, would explain high level of asymptomatic cases, yet the virus is still damaging the CV and Resp.",,1241877213848522753
MarakiaYa,2020-03-22T23:59:35.000Z,Mr President Hage please i want this to happen in our country because some people still behind about Covid-19 kavuuditeko ovehole puukamba pe bar tog we are in QUARANTINE,,1241877213651316742
pearltayo,2020-03-22T23:59:35.000Z,"As of February 22nd, Spain had 2 confirmed coronavirus cases and 0 deaths. Today March 23, Spain has 28,572 confirmed cases and 1,756 deaths.  1 month ago, Italy had only 20 cases.  It has 59,138 confirmed cases as at today and 5,476 death.   Stay Safe Guys",,1241877213315829762
WethersfldPatch,2020-03-22T23:59:35.000Z,Coronavirus update/ Restaurant lays off staff/ Deli offers free toilet paper with sandwich/ CT man threatened to kill Rep. Adam Schiff: Feds  trib.al/nmTwXwG,https://t.co/O5ePryPpQe,1241877213198376961
xxxtrajoss,2020-03-22T23:59:35.000Z,"Mass testing won't cure the disease. If its purpose is to prevent the spread then the lockdown is doing that already. It's a redundant & costly solution. It only creates a false sense of security. If you get tested now, it doesn't mean that you can't get the virus in the future.",,1241877213168824321
MtVernonNYPatch,2020-03-22T23:59:35.000Z,Coronavirus update/ Restaurant lays off staff/ Deli offers free toilet paper with sandwich/ CT man threatened to kill Rep. Adam Schiff: Feds  trib.al/iGXlyGo,https://t.co/gf2eoag2xN,1241877212711845888
pjmsmiley,2020-03-22T23:59:35.000Z,our quarantine life will be saved,,1241877212690702337
LaurenPokedoff,2020-03-22T23:59:34.000Z,BERNADETTE PETERS IS COMING LIVE FROM MY LIVING ROOM IN A FACE MASK. #RosieODonnellShow,https://x.com/hashtag/RosieODonnellShow?src=hashtag_click,1241877212103573505
ManchstrCTPatch,2020-03-22T23:59:34.000Z,Coronavirus update/ Restaurant lays off staff/ Deli offers free toilet paper with sandwich/ CT man threatened to kill Rep. Adam Schiff: Feds  trib.al/UKIoQc3,https://t.co/oVY49v1csU,1241877211076079617
RfieldPatch,2020-03-22T23:59:34.000Z,Coronavirus update/ Restaurant lays off staff/ Deli offers free toilet paper with sandwich/ CT man threatened to kill Rep. Adam Schiff: Feds  trib.al/PzBSkmN,https://t.co/JSNuPKdtEC,1241877210866298881
BohemianTarot,2020-03-22T23:59:34.000Z,3 Card Tarot Readings for $23.93 !!!!  619-929-4092 #PHONE  or #FACETIME !!! To honor the #safety & #health of the #world during the #coronavirus #pandemic #bohemiantarot #bohemian #tarot #tarotreader #tarotreading #tarotcards #gypsy #psychic #witch #witchcraft #wicca,https://x.com/hashtag/PHONE?src=hashtag_click https://x.com/hashtag/FACETIME?src=hashtag_click https://x.com/hashtag/safety?src=hashtag_click https://x.com/hashtag/health?src=hashtag_click https://x.com/hashtag/world?src=hashtag_click https://x.com/hashtag/coronavirus?src=hashtag_click https://x.com/hashtag/pandemic?src=hashtag_click https://x.com/hashtag/bohemiantarot?src=hashtag_click https://x.com/hashtag/bohemian?src=hashtag_click https://x.com/hashtag/tarot?src=hashtag_click https://x.com/hashtag/tarotreader?src=hashtag_click https://x.com/hashtag/tarotreading?src=hashtag_click https://x.com/hashtag/tarotcards?src=hashtag_click https://x.com/hashtag/gypsy?src=hashtag_click https://x.com/hashtag/psychic?src=hashtag_click https://x.com/hashtag/witch?src=hashtag_click https://x.com/hashtag/witchcraft?src=hashtag_click https://x.com/hashtag/wicca?src=hashtag_click,1241877210635497473
FalcoSydney,2020-03-22T23:59:34.000Z,"If you don’t believe what medical science says, you get a pandemic; if you don’t believe what climate science says, you get Armageddon.  Thank god we have the worst president ever to protect us.",,1241877210442510336
arquisze,2020-03-22T23:59:34.000Z,"New Zealand reports 36 new coronavirus cases, total crosses 100  grupoajudaalimentos.wordpress.com/2020/03/22/new …",https://t.co/ztmzQMES5o,1241877210325229569
Jonesls,2020-03-22T23:59:34.000Z,CBS Stars Vow ‘We’re All in This Together’ in PSA to Calm Coronavirus Fears  adweek.it/2x36p7N,https://t.co/Rdome4ns4t,1241877209817759744
iwin__youlose,2020-03-22T23:59:34.000Z,WE ON A LOCKDOWN?!,,1241877209805193217
coexistish,2020-03-22T23:59:34.000Z,Because we don't want an a**hole leader like Maduro.,,1241877209738096640
Lukledinio,2020-03-22T23:59:34.000Z,I won 21 achievements in Pandemic: The Board Game for 3471 points on #TrueAchievements,https://x.com/hashtag/TrueAchievements?src=hashtag_click,1241877209276649476
TMalczewski,2020-03-22T23:59:34.000Z,"WTF is wrong with him?  He needs to step aside. ""'Gee, that's too bad': President Trump responds to Mitt Romney's self-quarantine""   x.com/i/events/12418 …",https://x.com/i/events/1241868096064720896,1241877209268322304
AFSCMECT4,2020-03-22T23:59:34.000Z,Attn #CTStateWorkers: check out latest SEBAC updates & analysis on  @GovNedLamont  administration’s response to #COVIDー19 pandemic.  @AFTCT  @CSEA_CT  @SEIU1199_NE  @4CsSEIU1973  @CSUAAUP  @CEUI_SEIU_511  @ConnAFLCIO  @UCHCAAUP   ctstateemployees.org/news-interest/ …,https://x.com/hashtag/CTStateWorkers?src=hashtag_click https://x.com/GovNedLamont https://x.com/hashtag/COVID%E3%83%BC19?src=hashtag_click https://x.com/AFTCT https://x.com/CSEA_CT https://x.com/SEIU1199_NE https://x.com/4CsSEIU1973 https://x.com/CSUAAUP https://x.com/CEUI_SEIU_511 https://x.com/ConnAFLCIO https://x.com/UCHCAAUP https://t.co/2REdwXoKbN,1241877209230577665
HamiltonHcsw,2020-03-22T23:59:34.000Z,"#cdnpoli #nowaroniran Justin Trudeau promised in 2015 to restore full diplomatic relations with Iran but never did. Like the US, Canada still levies economic sanctions against Iran even in the middle of a pandemic.",https://x.com/hashtag/cdnpoli?src=hashtag_click https://x.com/hashtag/nowaroniran?src=hashtag_click,1241877208794267653
MemeMahlik,2020-03-22T23:59:34.000Z,There are two types of friend groups out there during this quarantine: those that are daring their friends to do push ups and the other making their friends take shots. It is infinitely clear which friend group I’m in #ClubQuarantine,https://x.com/hashtag/ClubQuarantine?src=hashtag_click,1241877208760586240
JustinGrahamPap,2020-03-22T23:59:34.000Z,Just Watching TV... Corona lockdown Day 6 | !discord,,1241877208576262145
