User_name,Datetime,Content,Links,Tweet_ID
meredithtupper,2020-07-22T23:58:07.000Z,"New York City dropped $52M on a coronavirus hospital that served fewer than 80 patients  washingtonexaminer.com/news/extreme-d … But shove all those COVID-positive patients into nursing homes because who has room to treat them, right Cuomo?",https://t.co/jP9M7tz50Q,1286088165930012672
ConstructHard,2020-07-22T23:58:07.000Z,Article from yesterday.  Addresses both of your arguments into the ground.  Lol. npr.org/2020/07/21/893 …,https://t.co/aJoejfodrR,1286088165699268609
AJ_Furch,2020-07-22T23:58:07.000Z,I'm think it was felony assault before the pandemic. It should always be enforced; however during a pandemic I wish there was a strict standard in place that deterred that behavior. I haven't heard of any charges being filed against people that intentionally spread their germs.,,1286088165468581888
TajDarielle,2020-07-22T23:58:06.000Z,They did but ine want the COVID-19 idiots in my mentions tonight. Rudeness on high,,1286088160020172801
smokecarbon13,2020-07-22T23:58:06.000Z,"Message from SmokeCarbon13 ""Wear a mask"".",,1286088159026176005
SauersRobert,2020-07-22T23:58:04.000Z,It will be a bigger travesty when they let him out of prison for COVID claiming that it makes us safer.,,1286088154085171200
anthonyleaton,2020-07-22T23:58:03.000Z,"Startups Are Key To Post-COVID Recovery, But Prospects Are Bleak  trbr.io/4afLqIO via  @AdiGaskell",https://t.co/rPNkwwJG9j https://x.com/AdiGaskell,1286088149152800774
CatsN_Tats,2020-07-22T23:58:03.000Z,The start of Covid and quarantine feels like decades ago.,,1286088147311288322
TselisoMoejane,2020-07-22T23:58:03.000Z,"I heard news surrounding this veteran that he together with his wife tested positive for covid 19. We wish them a speedy recovery, him and all people of the mountain kingdom and Africa and all parts of the world.  Fola Mokola",,1286088147298914308
schoolmoneyorg,2020-07-22T23:58:03.000Z,College students use new program to cope with COVID-19 anxiety - Yahoo News  dlvr.it/Rc9c1K,https://t.co/55pHtm2Rob,1286088147139346433
yellowtulips,2020-07-22T23:58:03.000Z,Social distancing with a Remember the Maine cocktail. A good friend is the bartender. So happy for this moment. @ Japps Since 1879  instagram.com/p/CC9rCckhSSe/ …,https://t.co/btL3xu8RGp,1286088146820706313
RobbinScarberry,2020-07-22T23:58:03.000Z,I didn’t see that you won. That’s awesome. I’d been hoping you would. That’s a cool one to win. It took a while to get mine but that was the last race before the pandemic started. They did send me a nice hat since it took so long.,,1286088146439086081
minimurthy1234,2020-07-22T23:58:03.000Z,New coronavirus mutation causes outbreaks to spread more quickly: expert  nypost.com/2020/07/22/new … via  @nypost,https://t.co/o7ZHd4GkzB https://x.com/nypost,1286088146283831296
WPoliticked,2020-07-22T23:58:02.000Z,NEW EPISODE: Matt gets retested (and re-retested) for COVID-19 and Scott and Matt discuss the process and the consistently inconsistent results.  traffic.libsyn.com/politicked/Cov …,https://t.co/J5VCJe2bH1,1286088145637867520
NellySpeaks,2020-07-22T23:58:02.000Z,People need to start holding customers accountable for their actions. You think because I’m on the clock you have the right to mistreat me? Never that! He caught the right one on the right day. Threatening to spit on someone while COVID is happening? You thought wrong!,,1286088145260486656
GuruCowboy,2020-07-22T23:58:02.000Z,If he wanted to help crime in ABQ He'd: Bring investigators to handle case backlog. Fund education. Provide healthcare. Fund job training. Fund addiction treatment. Fund homeless shelters. Provide Covid testing. We already have enough armed yahoos running around.,,1286088145260298240
Mrs_Groce,2020-07-22T23:58:02.000Z,"I have experienced in my life crack, war on drugs, wars, AIDS, gang violence, 9/11, recessions, heroin/opioid epidemic,  and now a global health pandemic but every damn time I see the political corruption under Trump it’s the #craziestdamnthing #TheReidOut",https://x.com/hashtag/craziestdamnthing?src=hashtag_click https://x.com/hashtag/TheReidOut?src=hashtag_click,1286088144652308483
tds4a,2020-07-22T23:58:02.000Z,I'm using the exact same outfit and mask,,1286088144480169985
riley1999,2020-07-22T23:58:02.000Z,"Texas is damn lucky.   You  @GregAbbott_TX  , as a gov of that very fine state, are damn lucky, so you better keep Texas RED.   Stop sending signals out like you are kowtowing to the Letist/covid/Marxists.",https://x.com/GregAbbott_TX,1286088144018964481
Illuminauaughty,2020-07-22T23:58:02.000Z,"Well wearing a mask would stop the virus from spreading in the first place, it's not like putting a bandaid on a place that hasn't been cut, its putting body armour on before getting shot.",,1286088143817515008
KellyO,2020-07-22T23:58:02.000Z,Among the many things I miss this campaign year under covid... the thrill of covering the convention floor with great colleagues and all those balloons.  Throwback to this week in 2016.,,1286088143809196033
Venomnymous,2020-07-22T23:58:01.000Z,There are no cases to prove your claim. Asymptomatic in general is very rare according to the WHO.,,1286088137588891648
JoeDoesNews,2020-07-22T23:58:01.000Z,Victoria coronavirus update 11am .. Premier  @DanielAndrewsMP   Watch live on the  @abcnews  channel - pending the economic update from Canberra,https://x.com/DanielAndrewsMP https://x.com/abcnews,1286088137538588672
justbeingme2022,2020-07-22T23:58:00.000Z,"Maggies university set would be great,I would love to see her student life. I just wonder with COVID they might just keep safe space as it was expensive build so maybe have Macy’s lab in there somewhere?And I love the thought of them visiting hilltown , it would be very emotional",,1286088137438093312
NECXInc,2020-07-22T23:58:00.000Z,Digital transformation is surging at banks due to COVID-19. Are you incorporating #AI into your technology strategy? Our SX-Aurora TSUBASA solution can help you stay competitive. Via  @ComputerWeekly   computerweekly.com/news/252484369 …,https://x.com/hashtag/AI?src=hashtag_click https://x.com/ComputerWeekly https://t.co/tdd0c5uST9,1286088136922202113
dpvils,2020-07-22T23:58:00.000Z,"We know teachers need coaches, but when schools closed and parents had to become the teachers, #dpvils coaches extended their coaching to the caregivers. See how @wetzel_jillian in  @SAISD  & José Gonzalez in  @ComptonUnified  engaged their students’ families:  bit.ly/2OM3kP5",https://x.com/hashtag/dpvils?src=hashtag_click https://x.com/SAISD https://x.com/ComptonUnified https://t.co/7xRHQdZFgS,1286088136897048576
dahlenr,2020-07-22T23:58:00.000Z,DAVE GROHL Argues Against Reopening Schools Amid Coronavirus Pandemic  blabbermouth.net/news/dave-groh …,https://t.co/FizRgrDkNk,1286088136527876100
kneekoo,2020-07-22T23:58:00.000Z,"Completely irrelevant to Covid-19. 145K Covid-19-related deaths in the USA should make people do a better job at protecting themselves. But I'm just a European who thinks health is not politics. Come on, man. You are definitely smart enough to know the same.",,1286088136292999169
Quest02083914,2020-07-22T23:58:00.000Z,"Thank God, we will see how soon people think Corona is a pandemic when the gibs run out",,1286088135311581186
jlindenmediator,2020-07-22T23:58:00.000Z,"Snother Subject:  How much would you bet that O’bama just couldn’t sit there ine more minute, and he even got Trump to admit it was a “pandemic!!!” Unbelievable!!!",,1286088134023876608
kitchencone,2020-07-22T23:58:00.000Z,"Butt the point is your pants can slow down your farts, especially the little ones, so they stay inside your pants.   The mask will slow down virus particles on droplets, unless you give out an especially explosive sneeze.  Masks keep your little breath particles to yourself.",,1286088133675749376
kaplajk,2020-07-22T23:58:00.000Z,"very good point. also I think one could make the point that I don't need to wear a mask in the grocery store because who's to say what a ""fleeting moment"" is?. yes backwards is a good way to put it.",,1286088133625421829
hergesadventur1,2020-07-22T23:57:59.000Z,Excellent as long as you don't pass it to someone who has a friend/relative/colleague/patient who is at risk! How do u know? America is after all leading the way with controlling it covid!  #Deluded #Selfish #Covidiot,https://x.com/hashtag/Deluded?src=hashtag_click https://x.com/hashtag/Selfish?src=hashtag_click https://x.com/hashtag/Covidiot?src=hashtag_click,1286088132467851264
TheCSP2019,2020-07-22T23:57:59.000Z,"I’ll have what she’s having , due to the pandemic.",,1286088131733794817
ErikaGuevaraR,2020-07-22T23:57:59.000Z,Keeping your children in detention or getting separated from them indefinitely during a pandemic…that’s a choice no parent should have to make. I demand  @ICEgov  &  @DHS_Wolf  #FreeTheFamilies! They deserve to be #SafeAndTogether.  @amnestyusa,https://x.com/ICEgov https://x.com/DHS_Wolf https://x.com/hashtag/FreeTheFamilies?src=hashtag_click https://x.com/hashtag/SafeAndTogether?src=hashtag_click https://x.com/amnestyusa,1286088131620421632
JMuzyl,2020-07-22T23:57:59.000Z,Why do asymptomatic COVID-19 cases even happen?  flip.it/eyH5vt,https://t.co/3PTDmjl7FE,1286088130542497797
j_lifeexplorer,2020-07-22T23:57:59.000Z,"Very much so, i.e. notice. Was listening today! I did notice, he mentioned (almost to a mumble) that there R good results w/ Remdesivir, not mentioning HCQ. What I found heartwarming & as if msg to us all, was his heartwarming declaration re home-care centers & all will be better",,1286088130219540487
jaykobxx,2020-07-22T23:57:59.000Z,"""but the mask only protects other people, not you. so why bother wearing one?""   seriously just shut the fuck up you stupid fucking moron. jesus christ u mfers really only think about yourselves no wonder yall are sexist and racist. fuck you",,1286088130131423232
dawsobr,2020-07-22T23:57:59.000Z,I provided 3 separate summaries of studies by 3 educational institutions. Each provides details as to support the effective use of masks to reduce the transmissibility of COVID. Here is a more detailed research paper.  thelancet.com/journals/lance …,https://t.co/LUYdlWmGrz,1286088129363865600
twobblermangrov,2020-07-22T23:57:58.000Z,"Also, Fauci was referring to HCQ as a treatment for Covid and not being proven effective. Whatever he said 5 years ago for completely different reasons is completely irrelevant",,1286088128911073280
snowycats,2020-07-22T23:57:58.000Z,Morrison cancels Parliament due to COVID-19 — and Dan Andrews  independentaustralia.net/politics/polit …  @IndependentAus      Kennett claims Leigh Sales showed bad manners.  That's coming from one of the biggest bullies to grace politics ever.,https://t.co/Lu2Adu1KDc https://x.com/IndependentAus,1286088128692772864
TedTratt,2020-07-22T23:57:58.000Z,I believe the proof is there to show it is more difficult to catch virus outside. So why are CMOs telling all to wear a mask? Seems pointless if there are some who don’t need to comply. Let’s test it with everyone wearing a mask? The result will be obvious.,,1286088127862280192
TheGameVeda,2020-07-22T23:57:55.000Z,"Trump Daily Coronavirus Briefing:  Reporter ""would you like to respond  to  @JoeBiden  who described you as the first racist President""    @realDonaldTrump  ""Prior to the China Plague...""",https://x.com/JoeBiden https://x.com/realDonaldTrump,1286088115459940352
Bryan1949,2020-07-22T23:57:55.000Z,"The MSM is so freaking biased! We have  COVID briefing and they throw a federal law enforcement question! BTW,  @realDonaldTrump  hit a home run.  #NoShowJoe ? Walks away and the press gives him a pass!  #MSMSucks",https://x.com/realDonaldTrump https://x.com/hashtag/NoShowJoe?src=hashtag_click https://x.com/hashtag/MSMSucks?src=hashtag_click,1286088115074084865
ButtToucherIRL,2020-07-22T23:57:55.000Z,"I do this to my dude friends in person...this pandemic is really killing my, ""bro that shirt looks sick"" and ""nice hair cut my man"" compliment game. Feel like sending random compliments over DM would be a weird thing lol",,1286088115073949697
liz_hart1,2020-07-22T23:57:55.000Z,Honey trump will threw you under the bus....it’s the state’s fault on COVID...it’s time you stand up for Floridian,,1286088113782247424
cdykes90,2020-07-22T23:57:54.000Z,Exactly my point.. their right to wear a mask or be scared won’t infringe on my right to keep living my life.,,1286088109654933504
youngbdot23,2020-07-22T23:57:50.000Z,Top covid hobbies besides the great outdoors. GO!,,1286088095423762434
semco48,2020-07-22T23:57:50.000Z,"How about give us the latest suicide numbers, will wearing a mask stop ppl from killing themselves? How about wearing a mask when they were tearing down statues. I watched a homeless guy today take a shit in the local park, he wasn’t wearing a mask. #Resign",https://x.com/hashtag/Resign?src=hashtag_click,1286088091548098562
rickhoward,2020-07-22T23:57:50.000Z,"And everyday I have to go the grocery store I see people without masks, Dan Forest holding maskless rallies or people posting on social media, ""Gubbernor Goober can't make me wear a darn ol' mask""..... #NC #COVID19",https://x.com/hashtag/NC?src=hashtag_click https://x.com/hashtag/COVID19?src=hashtag_click,1286088091426525187
mjj1434,2020-07-22T23:57:49.000Z,Canadians wisely limit it to 6 passengers!!!! Tourist boats highlight US-Canada social distancing differences  standard.co.uk/news/world/nia …,https://t.co/aZ5yRI1Rfs,1286088091216707584
Joey_G_615,2020-07-22T23:57:49.000Z,Biden won already?  Or did Trump quit on the election like he’s quit on defending our troops or fighting Covid?,,1286088090373836804
ScrewballSq,2020-07-22T23:57:49.000Z,Dark Side of the Ring will be back though.  Everything since quarantine has given it an entire season's worth of material.,,1286088090310696961
YCSWURadio,2020-07-22T23:57:49.000Z,Ep. #76 feat.  @walkwithgerald  is out now!!! (LINK IN BIO) --  -- #youcantsitwithusradio #radio #podcast #phoneinterview #dope #nashville #tn #newyork #ny #linkinbio #geraldwalker #anchorfm #coronavirus #76…  instagram.com/p/CC9rAl4jhQI/ …,https://x.com/walkwithgerald https://x.com/hashtag/youcantsitwithusradio?src=hashtag_click https://x.com/hashtag/radio?src=hashtag_click https://x.com/hashtag/podcast?src=hashtag_click https://x.com/hashtag/phoneinterview?src=hashtag_click https://x.com/hashtag/dope?src=hashtag_click https://x.com/hashtag/nashville?src=hashtag_click https://x.com/hashtag/tn?src=hashtag_click https://x.com/hashtag/newyork?src=hashtag_click https://x.com/hashtag/ny?src=hashtag_click https://x.com/hashtag/linkinbio?src=hashtag_click https://x.com/hashtag/geraldwalker?src=hashtag_click https://x.com/hashtag/anchorfm?src=hashtag_click https://x.com/hashtag/coronavirus?src=hashtag_click https://t.co/U8QOIZxBYv,1286088088188604419
jschucomedy,2020-07-22T23:57:49.000Z,If you don’t wear a mask you probably don’t wash your hands after you take a dump either. #dontbeadick,https://x.com/hashtag/dontbeadick?src=hashtag_click,1286088088180031490
lilhoekagee,2020-07-22T23:57:49.000Z,the way the state of hawaii is handling covid-19 is a fucking joke,,1286088087248842752
Lumines1313,2020-07-22T23:57:48.000Z,"John, you’re scaring me with the mask and the cleaver knife ... just saying",,1286088085957160960
NumbersMean,2020-07-22T23:57:47.000Z,Obama only created twice as many jobs for black people (before Covid).,,1286088082329083906
fran_keller,2020-07-22T23:57:47.000Z,Working with @IrisBright12 and  @RingtailDave  at the  @bohart_museum  today. We are not social distancing but we are #PhysicalDistancing  A mini  @belizebugs  reunion. #belizebugs,https://x.com/RingtailDave https://x.com/bohart_museum https://x.com/hashtag/PhysicalDistancing?src=hashtag_click https://x.com/belizebugs https://x.com/hashtag/belizebugs?src=hashtag_click,1286088079925628928
coach_sanabria,2020-07-22T23:57:46.000Z,"Finding a gym in NY to help these kids was hard enough before the pandemic, it’s been even harder now",,1286088078365536258
JhayCasin,2020-07-22T23:57:46.000Z,Quarantine ft. na Ghost,,1286088078201720832
NewAnandabazar,2020-07-22T23:57:46.000Z,"Bengaluru lockdown: Here are the fresh guidelines for e-commerce, food delivery services  blrtimes.com/bengaluru-lock …",https://t.co/tIfstdbVjC,1286088077316952064
King_Benjammin,2020-07-22T23:57:46.000Z,"And yet, it wasn’t used.   This is why there was overflow into nursing homes.  nytimes.com/2020/04/02/nyr …",https://t.co/v4TWNoqpTB,1286088077199339520
Duanecia,2020-07-22T23:57:46.000Z,"I got the  @newly_named  kit when we got engaged, so that made things a little easier. Right now, I can't get the first step done because COVID will have its way lol",https://x.com/newly_named,1286088077002366978
SunflowersUSA,2020-07-22T23:57:46.000Z,"Most people who stated they will not take the vaccine are not ""anti-vaxxers"". I've had vaccines, so have my kids & grandkids. Our issue is them pushing a vax that has not been properly tested. Less than a year of ""testing"" will not provide enough data regarding long term effects.",,1286088076901658630
Obsessedabroad,2020-07-22T23:57:46.000Z,Drs are the most underpaid. During a pandemic who you gonna call? I know. An actor or a football player.,,1286088076901654534
mybiogate,2020-07-22T23:57:46.000Z,"More than 160 groups are working on #COVID19 #vaccines, and 24 candidates have already reached human testing, according to the World Health Organization. When they are, the vaccine makers will have to answer one big question: At what price?    fiercepharma.com/pharma/where-d …",https://x.com/hashtag/COVID19?src=hashtag_click https://x.com/hashtag/vaccines?src=hashtag_click https://t.co/gSES40Jlwv,1286088076041818112
citynewscalgary,2020-07-22T23:57:46.000Z,One Calgary school isn’t waiting for the city’s mask bylaw to take effect August first.,,1286088075895099394
tutuusen,2020-07-22T23:57:45.000Z,"back then we don't have covid 19, it's either we are positive with bieber fever or one direction infection but in my case, due to my weak immune system, i have both",,1286088073768402945
akiryu26,2020-07-22T23:57:45.000Z,One of my friends here was planning on going there to hang with a friend but since he'd have to quarantine when he'd get back decided he prob won't go.,,1286088073542074370
Jstrazz22,2020-07-22T23:57:45.000Z,"I think sports games need a “pandemic” mode. Shorten season, have players sit out, vote on type of season. That would be a wild game to play",,1286088073420431360
SpenceNicholson,2020-07-22T23:57:45.000Z,Do you literally not understand what an infectious disease pandemic is? Are you actually that dense?,,1286088073197916160
LICHTSWIFE,2020-07-22T23:57:45.000Z,"+ of you during the night."" Erise hummed thoughtfully, actually considering it, the joke flying over her head. ""We'll have to figure something out so that I don't get sick, maybe I'll wear a mask or something?""",,1286088072598347780
TimesBritain,2020-07-22T23:57:45.000Z,Which sports will make it through COVID-19 in 2020? Ranking them most to least likely  timesofbritain.com/2020/07/22/whi …,https://t.co/AaP56a62HX,1286088072107569159
CLA,2020-07-22T23:57:45.000Z,"New relief program offers unrestricted $1,000 grants for individuals in California impacted by COVID-19 pandemic by  the  @CalArtsCouncil    Apply here  arts.ca.gov/news/prdetail. … #relieffund #artist #covidー19 #covid19pandemic",https://x.com/CalArtsCouncil https://t.co/m0ojJmH0XA https://x.com/hashtag/relieffund?src=hashtag_click https://x.com/hashtag/artist?src=hashtag_click https://x.com/hashtag/covid%E3%83%BC19?src=hashtag_click https://x.com/hashtag/covid19pandemic?src=hashtag_click,1286088071570546690
AaronPogue,2020-07-22T23:57:45.000Z,Trump didn't put on a mask to stop resisting the science. He did it to pace-and-lead the stay-at-home-moms back out into the world.  That's the shift you're seeing in his rhetoric now.,,1286088071050604545
loumoore12,2020-07-22T23:57:45.000Z,me: the NBA bubble isn't going to work. I can't believe they're trying to play in the middle of a pandemic.   also me after I see there's bubble basketball:,,1286088070878633984
enewsjammu,2020-07-22T23:57:44.000Z,"Recovered Covid-19 cases cross 7.5 lakh mark; Record 28,472 people recover in last 24 hours",,1286088069750259712
whatshisdan28,2020-07-22T23:57:44.000Z,In need of a muzzle at a time of needing only a mask. So simple. I hope to God that no-one is paying attention to his commentary.,,1286088069557321728
Barbara04950723,2020-07-22T23:57:44.000Z,Check out Tie Die Peace Face Mask Sunset! Available for the next 1 day via @Teespring:  tspr.ng/c/tie-die-peac …,https://t.co/ZYgV4jU2A4,1286088069502971906
AUSDNews,2020-07-22T23:57:44.000Z,"Second agenda item:  Recommendation to adjust graduation requirements from a total of 230 credits to 220 for class of 2021, due to pandemic.  ow.ly/991Q50AFGMX #alamtg",https://t.co/2ny93vBq1p https://x.com/hashtag/alamtg?src=hashtag_click,1286088068873715718
limlamlimlegend,2020-07-22T23:57:44.000Z,"He didn’t kill shit, COVID-19 did.",,1286088068471103495
AxelSavage4,2020-07-22T23:57:44.000Z,I call for the ENTIRE Federal Government to be impeached!! msn.com/en-us/news/pol …,https://t.co/IVwne5j4rs,1286088068026396672
GrimRea36694938,2020-07-22T23:57:44.000Z,She did a great job of pulling her mom out of a nursing home just before they were all stuffed into a covid infested space with no way out,,1286088068018196480
mankvill,2020-07-22T23:57:44.000Z,it should not be this hard to schedule a coronavirus test,,1286088066747314178
FranklinH3000,2020-07-22T23:57:43.000Z,Rand Paul cannot do something good without undermining it with something stupid within 24 hours. It's simply beyond him.  thehill.com/homenews/state …,https://t.co/ZXYNwwKBnd,1286088065769930752
WordSaladeater,2020-07-22T23:57:43.000Z,"I'll have what she's having, due  to the pandemic.",,1286088065702821894
FreakyHair,2020-07-22T23:57:43.000Z,Here in Canada the government is paying them $2000/month in Covid pay,,1286088065484718083
PetalumaPegleg,2020-07-22T23:57:43.000Z,You can be asymptomatic and contagious.  So you already managed to completely ignore a major vector,,1286088063341355008
hopelessforkin1,2020-07-22T23:57:43.000Z,"And this duty should be fulfilled first in fighting the coronavirus. The president has failed miserably in this area. He’s a bully, likes inflaming division. To fulfill those needs, he’s fabricating facts on “anarchists” running states.",,1286088063328956416
MHealthFairview,2020-07-22T23:57:42.000Z,"Stop the spread of #COVID19, reduce the burden of the disease, and save lives: The evidence is clear that wearing a mask in public is critical to these goals",https://x.com/hashtag/COVID19?src=hashtag_click,1286088058903961600
POPD2Mono104,2020-07-22T23:57:42.000Z,"First if I know it’s fake when you see the comment about Gorgoe Flyod and your an BLM advocate! They need to have several seats in the back of the bus and be taught some manners. COVID is really bringing the ugly out of people. Uugh,",,1286088058769510400
Pom_Bazooka,2020-07-22T23:57:42.000Z,"Autism isn’t an epidemic. Prevalence hasn’t necessarily increased; diagnoses have.  If you’re cool with vaccines, that’s good.",,1286088058031370240
danaecm,2020-07-22T23:57:41.000Z,I just got new pillows because my old ones were not up to par with the new sheets. I think I’m quarantine nesting?,,1286088057670848512
SDScoop,2020-07-22T23:57:41.000Z,MIT researchers designed reusable N95 face mask for healthcare workers  cnbc.com/2020/07/21/mit …,https://t.co/Dfn6oRre4D,1286088056705912832
josephbvarner,2020-07-22T23:57:41.000Z,"Given the red meat recently tossed out by the Liberals first the Bloc leader, then the GG, MND and Cabinet failure to act early on Covid-19, can only assume the next channel changer will be the Finance Minister and the Clerk and then saying no to Hauwei in that act tough moment.",,1286088055384940545
WaveSinatraJr,2020-07-22T23:57:41.000Z,I hope we all can get use to winning together after this pandemic,,1286088054571245569
bdchen21,2020-07-22T23:57:41.000Z,"Just in: there are 2 versions of the #TrumpVirus. The 1st is covid-19, ravaging America because of tRump's incompetence. The 2nd tRump virus is corruption, hate, and greed. This 2nd virus is spreading like wildfire thru the gop. Oddly, it appears most democrats are immune.",https://x.com/hashtag/TrumpVirus?src=hashtag_click,1286088054382313474
julesBCE,2020-07-22T23:57:40.000Z,"“Around 20% of America’s 110 million renters face eviction by the end of September, according to the COVID-19 Eviction Defense Fund, a Colorado-based legal group fighting eviction and homelessness, with Latinx and African American renters most affected”.  apple.news/AIU4GAeT_R8ibO …",https://t.co/Rg0haQnU2B,1286088052050243584
dhpsny,2020-07-22T23:57:40.000Z,"The dog (and fawn) days of summer. The 1918 flu pandemic finally abated in July 1919, marking the end of the last pandemic and giving us a new perspective of one of our favorite summer images from the NY State…  instagram.com/p/CC9q_vNDc_I/ …",https://t.co/DVhQKxjPly,1286088052004331521
ReneeLamb10,2020-07-22T23:57:40.000Z,Dr. Carrie Madej Has an Urgent Warning about the Upcoming COVID-19 Vaccines  bitchute.com/video/IqQJ3KYt … #BitChute,https://t.co/dQ1p2yAVzc https://x.com/hashtag/BitChute?src=hashtag_click,1286088049986871298
