User_name,Datetime,Content,Links,Tweet_ID
Cherwood4,2020-06-27T23:59:40.000Z,@realDonaldTrump  Why are you trying to kill the ACA when you have nothing to replace it with DURING a pandemic?  Are you out of your mind?  DAMN!,https://x.com/realDonaldTrump,1277028856218583040
_AllHailTiffany,2020-06-27T23:59:40.000Z,I hate how this corona stuff really bout to drag out until a vaccine or something come out & that might take forever,,1277028856206028802
ItsMrTumnus,2020-06-27T23:59:39.000Z,That’s my biggest question. When is the conversation: “how do we adjust to life with COVID” instead of “we have to prevent every possibility of contracting COVID at ANY cost..”,,1277028855807528960
TribuneSportsPh,2020-06-27T23:59:39.000Z,"Ivanisevic is part of Djokovic’s coaching team and was the director of the now-abandoned Adria Tour, which led to several top players becoming infected with coronavirus.  tribune.net.ph/index.php/2020 …",https://t.co/Kt5IQtExxB,1277028855513927680
jimallison,2020-06-27T23:59:39.000Z,This is inciedbly concerning  @AmericanAir  and  @united  why are you putting your customers at risk like this?   chicago.suntimes.com/2020/6/26/2130 …,https://x.com/AmericanAir https://x.com/united https://t.co/pB13mEpnih,1277028855073566722
DrSuperWomanInc,2020-06-27T23:59:39.000Z,"1 before the pandemic, but 6 now   x.com/nwulls/status/ …",https://x.com/nwulls/status/1276497752424353794,1277028854859804672
PrinceO49116595,2020-06-27T23:59:39.000Z,Covid-19 youtu.be/OTOxy3QfUlg,https://t.co/5sNNQmMqvf,1277028853387534337
jschulman54,2020-06-27T23:59:39.000Z,You had 2 years with complete Republican control but you were only interested in giving yourself a tax cut. Now 3 years later and still no plan. Your plan is no health care unless your employer has one or your rich. The US has 4% of the world pop and over 25% of Covid  deaths.,,1277028852930404352
AnDy_SaMbErGeR,2020-06-27T23:59:39.000Z,THANK YOU SO MUCH FOR DOING THat - it was so fun and a good way to pass time whilst in quarantine:) also my heart rate kept going  whilst waiting for top 10,,1277028852590620672
DamoneRodgers,2020-06-27T23:59:38.000Z,"Remember when “flat earthers ” was something for social ridicule? Why wasn’t that as politicized as wearing a mask? I mean weren’t people scared of falling of the edge... I wonder what f there’s a correlation, if you’re a flat earther are you also not wearing a mask?",,1277028851474972674
suzanne1162,2020-06-27T23:59:38.000Z,"I keep hearing that Covid-19 doesn't know race ,political party etc. yet I'm also hearing that blacks and Hispanics are vulnerable to it. Idk what's going on",,1277028850191470592
ao_murph,2020-06-27T23:59:38.000Z,"Today I’m joining  @glblctzn  &  @EU_Commission  for the #GlobalGoalUnite Concert — where scientists, artists, comedians will perform for equal access to COVID-19 healthcare. Check local listings to tune-in  glblctzn.me/UniteForOurFut …",https://x.com/glblctzn https://x.com/EU_Commission https://x.com/hashtag/GlobalGoalUnite?src=hashtag_click https://t.co/AXqjt7iczh,1277028849847582722
SpiritofBellamy,2020-06-27T23:59:38.000Z,"Most of the ""Mob"" wear masks.  They are at least outside. Covid-19 loves indoor, air conditioned places, which is why it thrives in prisons, nursing homes, food factories, etc",,1277028849281310722
mckenzi84474502,2020-06-27T23:59:38.000Z,I set this up to help a friend and my god daughter. She is trying to get a plce for her and her baby. She is about to loose everything after loosing her job to covid. Please retweet and send this to anyone who can help gofundme.com/f/momma-and-ba …,https://t.co/5NvVAGWMOE,1277028847729418240
politicalmath,2020-06-27T23:59:37.000Z,"I'd have to know what kind of scale we're talking about.  There weren't any cases associated with our earlier smaller protests, but some of these protests are coming in at 60,000 or larger in COVID hot zones.",,1277028846051553280
PeeWeeDelFl,2020-06-27T23:59:37.000Z,"Brazil is being mismanaged by Bolsonaro along with a group of generals who behave in the Chavista style!  Meanwhile, the coronavirus devastates the country in an overwhelming way and the fires in the Amazon Forest doubled during the pandemic.",,1277028845317754883
jmscrimshaw,2020-06-27T23:59:36.000Z,This guy wears a mask so should you.,,1277028843358810112
feetetweet,2020-06-27T23:59:36.000Z,Have you tested the Logitech ?  This sounds like a fun creativity challenge for our team whilst in quarantine!,,1277028842754895872
ResisterNell,2020-06-27T23:59:36.000Z,Dr. Gupta: Governors must lead on COVID-19 because Trump won't  msnbc.com/11th-hour/watc … via  @msnbc,https://t.co/wWpKFVib4X https://x.com/msnbc,1277028842390130689
MMGQuise,2020-06-27T23:59:36.000Z,Who would’ve known KNEELING & N95 MASKS would piss yt people off so much,,1277028839802261505
LeyCastaway,2020-06-27T23:59:36.000Z,"Didn't realize quarantine ended, all these people at brunch, dinner, and bars. That's cooooollll",,1277028839395340288
v10l3nc3against,2020-06-27T23:59:35.000Z,"Signed, someone who had just got off work and got really mad at the amount of people that wanted to be seated while not wearing a mask",,1277028838996762625
sidebarnola,2020-06-27T23:59:35.000Z,We're LIVE from The SideBar! Tune to  sidebarnola.com to enjoy and support SideBar and support the musicians!  #livemusic #nola #quarantine,https://t.co/KoOXM7wXVx https://x.com/hashtag/livemusic?src=hashtag_click https://x.com/hashtag/nola?src=hashtag_click https://x.com/hashtag/quarantine?src=hashtag_click,1277028838942408705
PrivacyFdn_NZ,2020-06-27T23:59:35.000Z,"Privacy Foundation welcomes new privacy law ""Covid-19 has highlighted how essential it is for individuals and society to have secure means of communication and to be able to have confidence that organisations will protect their personal information""  privacyfoundation.nz/wp-content/upl …",https://t.co/nsBDxJPYOJ,1277028837927182336
KennethChan01,2020-06-27T23:59:35.000Z,"More than 1/2 of US states, particularly in the South & West, have seen spikes in Covid cases... Yes opening of our economies should be the goal; but doing it too fast, without a plan is dangerous, reckless and stupid. #BeSmart #DontBeACovidiot #WearAMask  lnkd.in/gZuT8-3",https://x.com/hashtag/BeSmart?src=hashtag_click https://x.com/hashtag/DontBeACovidiot?src=hashtag_click https://x.com/hashtag/WearAMask?src=hashtag_click https://t.co/OSr4BZtc2S,1277028835557380096
tr0skinz,2020-06-27T23:59:35.000Z,"Why do you think people litter? Is it out of disrespect for the environment or disrespect for the community?  If you run the community then why work to disenfranchise them further?   Government prepared riots cos of Brexit, imagine after a recession & coronavirus lockdown rules.",,1277028835284996096
chrisoliversyd,2020-06-27T23:59:35.000Z,"Wearing a facemask to help protect yourself and others from COVID isn't bullshit, Toby, any more than wearing a condom would have been bullshit if you were dry humping Freddie Mercury.",,1277028835142197251
mandeemagooo,2020-06-27T23:59:34.000Z,And drink a petri dish of Covid while listening to Ted Nugent and Kid Rock on loop at full volume.,,1277028833313452032
searby,2020-06-27T23:59:33.000Z,Rise of Covid in the US. Is it surprising when hordes protesting and not distancing roam cities. Instead of blaming Trump the media to should face the politically unpleasant truth.,,1277028830465724419
xtraTimer,2020-06-27T23:59:33.000Z,"Would the Bunker Boy say no mask after his bunker inspection, oh wait he is out golfing?  Are you guys allow to say the m word?",,1277028828020269058
barrydunham5,2020-06-27T23:59:33.000Z,PETITION: No to mandatory contact tracing and government surveillance for the coronavirus | LifePetitions  lifepetitions.com/petition/urge- …,https://t.co/OGL9GoFc8t,1277028827580059648
NbkSabo,2020-06-27T23:59:33.000Z,"Your right Hal. My mum and father in law died within 12 weeks of each other from covid. Both caught it in hospital meaning someone, somewhere is not taking precautions and passing it onto NHS staff who are unwittingly killing patients.",,1277028827303219205
NaijaFab,2020-06-27T23:59:32.000Z,FAAN Commences Dry Run For Reopening Of Flight Operations  dlvr.it/RZVp5H,https://t.co/pY6fvytedw,1277028826346688512
HistologyNews,2020-06-27T23:59:32.000Z,"COVID-19 patients can rapidly generate virus-attacking T cells, shows study  dlvr.it/RZVp5f",https://t.co/a2qp7JEte1,1277028825986031616
m__erc,2020-06-27T23:59:32.000Z,hi! do you ship to canada with the whole covid situation?,,1277028824740397057
RationalMale,2020-06-27T23:59:32.000Z,"“Seems like men aren’t complying with the COVID mask ritual this time around. What can we do to get them to comply?”  “I dunno, shame ‘em for ‘insecure masculinity’? That always works and it make women feel smart too.”",,1277028824664793090
JosephJeska,2020-06-27T23:59:32.000Z,"1/2 No there actually isn’t. There’s minuscule amount of research on this comparably and I’m suspicious there’s not a recorded instance of a person dying from wearing a mask. Again, particularly when dealing large numbers of people, it’s about increasing",,1277028824601919489
darkest_roasted,2020-06-27T23:59:32.000Z,"N95 masks work one way.  They’re designed to keep the virus out, and people are fitted for them.",,1277028824081821697
ripsugurugeto,2020-06-27T23:59:31.000Z,karens be like “i have a breathing problem i cant wear a mask”. like maam me too and i can still work a 8 hr shift just fine,,1277028821204680715
tim04043510,2020-06-27T23:59:31.000Z,God did not add at the speedway for not wearing a mask we live in with a bunch of idiots,,1277028820743335936
PeeWeeDelFl,2020-06-27T23:59:31.000Z,"Brazil is being mismanaged by Bolsonaro along with a group of generals who behave in the Chavista style!  Meanwhile, the coronavirus devastates the country in an overwhelming way and the fires in the Amazon Forest doubled during the pandemic.",,1277028820428734471
roseg,2020-06-27T23:59:31.000Z,"Who was one of the first helped by our government when Covid hit, to the tune of $700m. Whose company has cash reserves and plenty to draw on to ride this out but won’t because shareholder interest reigns supreme.",,1277028820038500353
CoyleMalcolm,2020-06-27T23:59:31.000Z,United Nations: End the next COVID-19: Ban global wet markets and illegal slaughterhouses now - Sign the Petition!  chng.it/VzNDhTvQ via  @UKChange,https://t.co/cSjFdMhhv6 https://x.com/UKChange,1277028819656982528
dwc1David,2020-06-27T23:59:31.000Z,A mask covering up Rich Mitch’s mug would be welcome by all!,,1277028818755022849
Sam_Schulman,2020-06-27T23:59:30.000Z,Lockdowns make us unable to fight new infections.  telegraph.co.uk/news/2020/06/2 …,https://t.co/5Xqv9kuQCe,1277028817408872451
KezCharz,2020-06-27T23:59:30.000Z,Especially when people can go on flights soon with no social distancing. Doesn't makes sense,,1277028816410554368
bonelynights,2020-06-27T23:59:30.000Z,"Yup, it’s rot to be against people dying from COVID. Solid and totally unronic choice of metaphor, my dude.",,1277028816163164163
dittos88,2020-06-27T23:59:30.000Z,What kind of mask do you wear for that? #maskareforslaves,https://x.com/hashtag/maskareforslaves?src=hashtag_click,1277028815198355456
CJMannMD,2020-06-27T23:59:30.000Z,"And finally, being Black in America when your life is NOT viewed with the same respect as others.  WEAR THE FRIGGING MASK    #covid19 #healthcaredisparities #WearAMaskSaveALife",https://x.com/hashtag/covid19?src=hashtag_click https://x.com/hashtag/healthcaredisparities?src=hashtag_click https://x.com/hashtag/WearAMaskSaveALife?src=hashtag_click,1277028814984564736
hutchsamantha,2020-06-27T23:59:30.000Z,me everyday forgetting my mask in the car  x.com/sydeeofSin/sta …,https://x.com/sydeeofSin/status/1276640050567098368,1277028814816546816
CJMannMD,2020-06-27T23:59:29.000Z,"- Not having enough expendable cash to make ends meet, and having to ration food to “get by” - Male lawmakers making policies regarding what WOMEN can and cannot do with their own uterus  - The dismal state of healthcare disparities in this country, magnified by COVID",,1277028813881462784
HawgTexas,2020-06-27T23:59:29.000Z,"I flatly refused to wear a mask until  @GovAbbott  asked me politely yesterday and said please do it for Texas and for our vulnerable folks. I would NEVER wear one if scolded or ordered, all he had to do was ask nicely.",https://x.com/GovAbbott,1277028813768179712
arune,2020-06-27T23:59:29.000Z,"Driving back on Highland today, saw a bar just both of Barham completely packed with people wearing no masks.   Mask wearing rate today (based solely on my interactions) is around 10% at best.",,1277028813117898752
BarbarianScien1,2020-06-27T23:59:29.000Z,You're straight-up right there!  Let's hope nobody tells politicians about logarithmic scales during the #COVID19 #pandemic...  #science #sciencejokes,https://x.com/hashtag/COVID19?src=hashtag_click https://x.com/hashtag/pandemic?src=hashtag_click https://x.com/hashtag/pandemic?src=hashtag_click https://x.com/hashtag/pandemic?src=hashtag_click https://x.com/hashtag/science?src=hashtag_click https://x.com/hashtag/sciencejokes?src=hashtag_click,1277028812597805056
Anthony23831253,2020-06-27T23:59:29.000Z,Crown Pneumonia a new risk coming on the back of covid 19,,1277028812534906880
marinastrez,2020-06-27T23:59:29.000Z,Yet @brookeforward2 failed to wear a mask during her swearing in ...  x.com/Curious_Kurz/s …,https://x.com/Curious_Kurz/status/1276914023162949632,1277028812400852992
CJMannMD,2020-06-27T23:59:29.000Z,#thread Can we all just commit to wearing a mask for the greater good of society & STOP complaining about how uncomfortable it is?   Let me tell you what IS uncomfortable: - Children separated from their parents at detention centers  - Losing a patient/loved one to gun violence,https://x.com/hashtag/thread?src=hashtag_click,1277028811687825410
catherine_kneen,2020-06-27T23:59:29.000Z,Yeah initially with the low numbers and emphasis on social distancing they saw masks on people not sick as giving us a false sense of security and people wouldn’t distance or stay home. With them trying to reopen I wonder if the advice will change.,,1277028810597122056
OGS1n,2020-06-27T23:59:28.000Z,"I think he's talking about the mask. If I'm correct it's the brain washing of wearing mask during COVID. Honestly, I hope  @drjack24  is right and those of us wearing mask are stupid. Then at least I only worried and never got sick. But the disease has me scared from what I've seen",https://x.com/drjack24,1277028809322176513
67donnalynn,2020-06-27T23:59:28.000Z,"Cuomo already said people who travel from hot spots have to self-quarantine, who knows if people will, or how they will it's enforced.",,1277028808596602883
queen_incendi,2020-06-27T23:59:28.000Z,"3 days ago, the Trump administration began pulling funding from Coronavirus testing sites.",,1277028808474996737
naazishahmed,2020-06-27T23:59:28.000Z,Hey how many days did they ask u to quarantine in a hotel?,,1277028808185524231
fakehistoryhunt,2020-06-27T23:59:28.000Z,"It looks like this story has now finally been put to rest, on twitter anyway. I'm still waiting for more information on lovely Bambi, but it may take a while because of the pandemic. If I learn more, I'll update the story.",,1277028807992623104
masteradrian,2020-06-27T23:59:28.000Z,[Florida: 9500 infections in ONE single day! Stupidity is NEVER under control!] BBC News - Coronavirus: Florida and Texas reverse reopening as infections surge  bbc.com/news/world-us- …,https://t.co/2Kg8FdvGWW,1277028807275433986
Cherdav25,2020-06-27T23:59:28.000Z,Would LOVE for you to get covid so you can tell us ALL how OVERREACHING it is Karen....,,1277028807044521984
KEdge23,2020-06-27T23:59:28.000Z,"Disgusted. I’m the biggest party goer, but people are taking the piss now. Could mean the loss of more lives & a surge in covid cases, like they’re seeing in USA. That will mean we are locked down again, barely after the pubs have re-opened. People need to grow the fuck up. #Marr",https://x.com/hashtag/Marr?src=hashtag_click,1277028806121881600
lelsunshin,2020-06-27T23:59:28.000Z,Thank you Trader Joe’s on helping to protect your employees and customers - unlike  @HarborFreight  who doesn’t care and allows customers without masks or  social distancing.,https://x.com/HarborFreight,1277028806050496513
UM_CARINI,2020-06-27T23:59:27.000Z,That may be true. Let’s run it back when you’re both out of quarantine,,1277028804515573765
Tiaraphobia,2020-06-27T23:59:27.000Z,So I'm guessing quarantine is now dramantine,,1277028804381286402
OH_sportsdude,2020-06-27T23:59:27.000Z,I can’t do basic things without someone. If wearing a mask is too hard for people I would be happy to trade lives with them.,,1277028803680915456
DaltonKuhnore,2020-06-27T23:59:27.000Z,"Oh no, your work is making you wear a mask to protect those around you and you don’t wanna wear it cause it’s a tiny inconvenience? Here’s the worlds smallest violin for you, stop being selfish.",,1277028803596791808
MackenzieJScott,2020-06-27T23:59:27.000Z,"An increase in coronavirus cases in Melbourne could cause residential property prices to fall by up to 30 per cent, as the “worst case” for the housing market plays out. theaustralian.com.au/business/prope …",https://t.co/QVuqIYVVxS,1277028803416436736
bunnefufu,2020-06-27T23:59:27.000Z,Liar if you have a breathing problem as I do my Doctor tells me I must wear a mask. If you had a breathing problem you could not be yelling like that and spreading your germs to poor people that are working or shopping. Wear a mask !,,1277028803378917376
sarah_carpen_03,2020-06-27T23:59:27.000Z,"That’s right same wave different day if you listen to the government this virus thatFauci help make by giving to China plus money will be waving at you the rest of your life , this is all about the tracking vaccine they want you to take not knowing there is a chip in it ,wake up",,1277028802460295168
christinoflores,2020-06-27T23:59:26.000Z,The doctor says the x rays look like it’s most likely Covid because the infection is all over my lungs and it’s not in one specific place. But that it’s also more concentrated in one specific area which is why she said it’s also bronchitis.,,1277028800685985792
USAFarmer44,2020-06-27T23:59:26.000Z,I would like to know if all of the people who test positive for covid wore a mask.,,1277028800409337856
RamanFrey,2020-06-27T23:59:26.000Z,"“Was mich nicht umbringt macht mich stärker.""  - Friedrich Nietzsche -  This is now officially America's slogan.   No pity for the weak.   All respect for the willfully ignorant. washingtonpost.com/politics/with- …",https://t.co/ElrGudRTkJ,1277028800396554241
JamesRunnelsIV,2020-06-27T23:59:26.000Z,"Hey brother, the segment's over. You went one on one with the great one, the one, 2-1! He gave you some airtime probably gave you some followers too! It's done now no need to reply cuz you on Primetime now and time is money and health is wealth in these times Mask up stay safe.",,1277028800019271681
bridgetfa,2020-06-27T23:59:26.000Z,"I don't care that much about myself. I've been lucky enough to have been brought up so many times I feel guilty when they bring me up knowing there are so many other people we haven't seen. My hope is that by the time this quarantine is over, we will have gotten to see everyone!",,1277028798454775810
RealAme11532540,2020-06-27T23:59:25.000Z,"Yes, I live in tri-state area, and have known about demon Trump for many years. The only surprise is COVID-19.",,1277028796307136512
CanucksUk,2020-06-27T23:59:25.000Z,As I watched social media explode with NHL players travelling between states and countries to get back to their teams I have started to consider whether or not the season should be resumed! America are very much in the peak of this pandemic and the NHL has players flying to,,1277028795594215424
SueLaniMadsen,2020-06-27T23:59:25.000Z,"Sigh . . . it wasn't a summary of the entire body of science related to masks, viruses & public health. It was 3 examples of finding science to fit conclusions. How to evaluate studies, data & stats is an entirely different lede. Like this one:  fivethirtyeight.com/features/coron …",https://t.co/M44XLjMwrZ,1277028794755358720
Davebriers2,2020-06-27T23:59:25.000Z,Miami-Dade beaches closed for 4th of July weekend due to recent spike in COVID-19 cases,,1277028794663124994
_RandomTweeter_,2020-06-27T23:59:25.000Z,I think it's on  Jacksonville.com but I'm getting an ad blocker. Here's the link I found though.  jacksonville.com/news/20200627/ …,https://t.co/TuxYYazW2u https://t.co/Gn7hJwdSsZ,1277028794507853831
RonnieBallard11,2020-06-27T23:59:25.000Z,Hospitals have floors for covid whole floors  people,,1277028794088525825
concernct11,2020-06-27T23:59:25.000Z,What is our state doing for essential workers who have been forced to work throughout the entire pandemic. Calling members “Heroes” fails as many people we know are making DOUBLE with federal stimulus than what we have been making with less risk.,,1277028793719324672
pianoman123046,2020-06-27T23:59:24.000Z,Darth Cheney/war criminal is only wearing a mask to protect himself.  He and Bill Barr came out of the same ugly pod.,,1277028792972783618
dzadzi55,2020-06-27T23:59:24.000Z,"If you have a problem breathing, then shouldn’t that be a reason TO wear a mask???",,1277028792511365127
kilosdlrey,2020-06-27T23:59:24.000Z,"today, 1,099 cases of Covid-19 was reported in Nevada, but y’all want to go to Fremont or the casinos so bad LMAOO smh",,1277028792230219776
DavidOsorio_24,2020-06-27T23:59:24.000Z,FUCK!!! COVID - 19,,1277028792083644416
FantasySavvy,2020-06-27T23:59:24.000Z,Vaccinss kill people all the time. That's why they have a vaccine compensation fund. For injuries and deaths.,,1277028791269969920
oddkitten__,2020-06-27T23:59:24.000Z,"Not gonna lie, I directly corellate not wearing a mask with low intelligence lol.",,1277028791198638081
columbusbiz1st,2020-06-27T23:59:24.000Z,Home sales continue to sputter even as the Covid-19 recession recovery begins.  bizjournals.com/columbus/news/ …,https://t.co/zEqUwYbyio,1277028790431092737
HamedBateni,2020-06-27T23:59:24.000Z,Just put this one together based on what's available  @nytimes . It seems that the rushed reopening in the US has backfired really bad! Hope we see some positive changes soon otherwise not sure if school openings in fall is a rational decision! #CoronaVirusUpdates,https://x.com/nytimes https://x.com/hashtag/CoronaVirusUpdates?src=hashtag_click,1277028790309453827
TheJonGrubb,2020-06-27T23:59:24.000Z,"I am against mask-mandates, but can you articulate how Section 242 of Title 18 could specifically refer to the mandating of masks as being unconstitutional?  I genuinely want to be able to point to a clear and specific reason for why we're protected under this Title. Thanks.",,1277028789952720896
Johnson20XX,2020-06-27T23:59:24.000Z,Right?? I'd rather look cute in a mask than gamble with my life during a pandemic. It's okay to be smart and look out for each other,,1277028789915193351
TriadBizJournal,2020-06-27T23:59:24.000Z,"“We are in a very precarious position with very few resources to address this tidal wave,"" says Dr. Stephen Sills, professor of sociology  @uncg , during a #Covid19 Impact Forum organized by East Greensboro Now. #housing #healthcare""  bizjournals.com/triad/news/202 …",https://x.com/uncg https://x.com/hashtag/Covid19?src=hashtag_click https://x.com/hashtag/housing?src=hashtag_click https://x.com/hashtag/healthcare?src=hashtag_click https://t.co/sisxS3ycVp,1277028789634113536
Sacbiz,2020-06-27T23:59:23.000Z,Covid-19 raised questions about the beauty industry's future. But new projects centered on beauty and personal care are still moving forward in the Sacramento area.  bizjournals.com/sacramento/new …,https://t.co/8L8010A0Ni,1277028788984057856
pattavina_chris,2020-06-27T23:59:23.000Z,#TraitorTrump #TraitorInChief  You and your administration don’t know how to do anything but lie. While people are dying from your non-response to Covid 19 you’re spending your time golfing and trying to start a race war! Just resign now and do something to help the country.,https://x.com/hashtag/TraitorTrump?src=hashtag_click https://x.com/hashtag/TraitorInChief?src=hashtag_click,1277028788338069506
SFBusinessTimes,2020-06-27T23:59:23.000Z,Haircuts will have to wait a little longer.  bizjournals.com/sanfrancisco/n …,https://t.co/AZPCBOyAnO,1277028788019363842
Whenuwish_,2020-06-27T23:59:23.000Z,They never cease to amaze me  she needs a mask in her own garden,,1277028787868311552
jenebene,2020-06-27T23:59:23.000Z,@billmcstrib  I have been spending my COVID downtime perfecting my tambourine technique.,https://x.com/billmcstrib,1277028787469922306
MBJMemphis,2020-06-27T23:59:23.000Z,"The ordinance tells businesses to ""take all reasonable steps to prohibit any member of the public who is not wearing a face covering from entering and must not serve that person if those efforts are unsuccessful.""  bizjournals.com/memphis/news/2 …",https://t.co/nda6AJroci,1277028787331510285
phxbizjournal,2020-06-27T23:59:23.000Z,A day after being called out by Arizona Gov. Doug Ducey the owner of the Maya Day & Night Club in Old Town Scottsdale announced it will close down to help slow the spread of Covid-19.  bizjournals.com/phoenix/news/2 …,https://t.co/n1Jtgy7wcO,1277028787214004225
