User_name,Datetime,Content,Links,Tweet_ID
mjcmason,2020-03-22T23:59:51.000Z,Spare a thought for the key workers who had to drag their children to school and risks exposing them to CoVid more than the rest of the population #howtheotherpeoplelive #StayAtHome,https://x.com/hashtag/howtheotherpeoplelive?src=hashtag_click https://x.com/hashtag/StayAtHome?src=hashtag_click,1241877279707291650
whatevsnv,2020-03-22T23:59:50.000Z,For trump it’s covid,,1241877278742556672
DavidZipper,2020-03-22T23:59:50.000Z,"A theory: With many transit agencies waiving fares b/c of COVID-19,  the virus could catalyze the overall “free transit” movement (a la Kansas City).  I know at least one transit exec who hopes not to resume collecting fares when all this is over.",,1241877278604304391
wmkornblum66,2020-03-22T23:59:50.000Z,National Poll Reveals Skepticism Over Media’s Reaction To Coronavirus Pandemic lifeandlibertynews.com/2020/03/20/nat …,https://t.co/zWvPUFsIpf,1241877277559808001
perinnert,2020-03-22T23:59:50.000Z,I wish I could toggle between “serious covid19 news updates” and “funny quarantine memes” on my feed because the whiplash is too much,,1241877277547216896
ashkir1200,2020-03-22T23:59:50.000Z,"worldwide covid 19 cases 329,000 and death has topped 14000",,1241877277098553353
Matajib9,2020-03-22T23:59:50.000Z,Covid-19 our new government!  x.com/JalalMisai_2/s …,https://x.com/JalalMisai_2/status/1241559853266432000,1241877276590891008
Moores_au,2020-03-22T23:59:50.000Z,"To help organisations respond effectively to COVID-19, Moores has developed a COVID-19 Employer Response Pack.   For more information, click here:  moores.com.au/covid-19-emplo …",https://t.co/mfHyVzFxZ0,1241877276461084673
VikingWoodsman,2020-03-22T23:59:50.000Z,"Not really bored during this quarantine at all, but it is kind of funny that in one bag of rice there are 8765 grains and only 8752 in a different bag (Same brand) #COVIDー19 #coronavirus",https://x.com/hashtag/COVID%E3%83%BC19?src=hashtag_click https://x.com/hashtag/coronavirus?src=hashtag_click,1241877276280717312
aubazette123,2020-03-22T23:59:50.000Z,"I have coronavirus, come save me  t.co/5U4MPZMNB7",https://t.co/5U4MPZMNB7,1241877276137930753
HollySci101,2020-03-22T23:59:50.000Z,Exclusive: U.S. axed CDC expert job in China months before virus outbreak - Reuters  The Trump PLAN was to TRUST the Chinese COMMUNISTS to be open and honest?!?!!!   #COVIDIOT   reuters.com/article/us-hea …,https://x.com/hashtag/COVIDIOT?src=hashtag_click https://t.co/oTzH02Nxid,1241877276045840389
gypsyphototaker,2020-03-22T23:59:50.000Z,Trump's Coronavirus Response Will Be His Toxic Legacy - Rolling Stone  apple.news/AvlznWz1hQCes4 …,https://t.co/dNHKedtCv8,1241877275613835264
kimnella_srz,2020-03-22T23:59:50.000Z,Bih arat mcdo after quarantine?  missin' the fries but I miss you more,,1241877275378774016
Zack_Eaton,2020-03-22T23:59:50.000Z,Quarantine season has me meal prepping and pulling the weeds on my island in #AnimalCrossingNewHorizon,https://x.com/hashtag/AnimalCrossingNewHorizon?src=hashtag_click,1241877275244716032
ShellyChattS,2020-03-22T23:59:50.000Z,"This is heart-wrenching. Keep in mind, though, that everyone should have advanced directives/wills/etc, even w/o a pandemic. But the process is too complicated, time-consuming, & expensive for many (eg, #medical residents). How can we (esp #lawyers) change that?  #A2J #legaltech",https://x.com/hashtag/medical?src=hashtag_click https://x.com/hashtag/lawyers?src=hashtag_click https://x.com/hashtag/A2J?src=hashtag_click https://x.com/hashtag/legaltech?src=hashtag_click,1241877275185799168
okkie48,2020-03-22T23:59:50.000Z,Senate falls far short of votes needed to advance coronavirus bill as clash between Republicans and Democrats intensifies  a.msn.com/01/en-us/BB11x …,https://t.co/4jPPrGxCWh,1241877275173404673
hcextrak,2020-03-22T23:59:50.000Z,"With the new coronavirus, every man is an island: Today's Toon  usatoday.com/picture-galler … via  @USATODAY",https://t.co/jOeT5AdTS5 https://x.com/USATODAY,1241877275118837762
Dr_A_Edwards,2020-03-22T23:59:49.000Z,"We provided proper guidance on self-quarantine and that they should just assume they’re positive, but from an epidemiological standpoint, this is ridiculous.  We simply cannot know how many people are actually out there with COVID19 if we cannot test for it.  /8",,1241877274628182016
ZackMartlaw,2020-03-22T23:59:49.000Z,Or it’s a risk we’ve known about for *years* but failed to prepare for.  cdc.gov/media/releases …,https://t.co/eNrCkVhwaj,1241877273827033088
AyoMojoyin,2020-03-22T23:59:49.000Z,Video: 15 Ways To Stay Safe and Prevent Coronavirus  thecitypulsenews.com/video-15-ways- …,https://t.co/ry5D4pJRrt,1241877273780813832
NorthInnsbruck,2020-03-22T23:59:49.000Z,Living with COVID-19.,,1241877271855718400
TylerHeline,2020-03-22T23:59:49.000Z,Quarantine day 78: Had to get outside so I took Puck on a hike near one of the buildings I work at. @ Coyote Song Trail  instagram.com/p/B-DiQliptaD/ …,https://t.co/bO8pexy7vc,1241877271830564872
tgeducation,2020-03-22T23:59:49.000Z,Paolo Maldini has a positive test for covid-19  football-italia.net/151419/paolo-a …,https://t.co/EEfXGRERlQ,1241877271390179330
oliviab_14,2020-03-22T23:59:48.000Z,"Interrupting my Twitter break to say that Coronavirus might’ve ruined our plans, but it’s all a part of His plan!",,1241877270593179649
973KISSFM,2020-03-22T23:59:48.000Z,Neil Diamond performs COVID-19 version of 'Sweet Caroline' on Twitter  ihe.art/QhnWlMN,https://t.co/c4RQh8D25D,1241877270148583427
tepathome,2020-03-22T23:59:48.000Z,These would make our quarantine more “bearable”  @mckatl  @retireddenise  @ssmina1,https://x.com/mckatl https://x.com/retireddenise https://x.com/ssmina1,1241877269297205248
lshfoster,2020-03-22T23:59:48.000Z,"Just replaced all the filters in our vacuum and had to be like, “Giiirl, are you a global pandemic? Because you suck SO HARD right now!!!”",,1241877269280247810
Ayasedere,2020-03-22T23:59:48.000Z,A variant of the BFG. It shoots like a gun instead of having a wave kill them all.,,1241877268927926279
Kal1_Furies,2020-03-22T23:59:48.000Z,He is ready for people who arent social distancing :),,1241877268751736832
Ironlady_i,2020-03-22T23:59:48.000Z,"Tell @senatemajldr and  @SpeakerPelosi  to protect people from financial hardship due to the #coronavirus pandemic. Put people first, not corporations.  Sign the  @CRAdvocacy  petition:  pic.x.com/jNVUrQ5esw  action.consumerreports.org/finance2020032 …",https://x.com/SpeakerPelosi https://x.com/hashtag/coronavirus?src=hashtag_click https://x.com/CRAdvocacy https://x.com/CRAdvocacy/status/1241088755823501314/photo/1 https://t.co/CDw7eaIRzR,1241877268055515136
Woodcock1866,2020-03-22T23:59:48.000Z,⁦⁩  To all of those affected by the Covid-19. We’re here for you. Stay strong! #marriottstrong @sheratonboston ⁦ @MarriottIntl ⁩,https://x.com/hashtag/marriottstrong?src=hashtag_click https://x.com/SheratonBoston https://x.com/MarriottIntl,1241877267925684224
Hutch379,2020-03-22T23:59:48.000Z,"Went to my parents for dinner tonight and my mom told my sister, brother, and I that we are better prepared for the quarantine because when we were kids she made us come inside at 7pm during the summer while all our friends were still outside playing.",,1241877267652976651
HEB,2020-03-22T23:59:48.000Z,"When H-E-B was made aware of the unconfirmed social media dialogue we took immediate precautionary measures and sanitized the shopping area. Additionally, we contacted the individual and were informed that she has not been diagnosed with COVID-19 and is not exhibiting symptoms.",,1241877267300696064
paul_lander,2020-03-22T23:59:48.000Z,"Time to send in R Kelly, he’s only in danger around COVID-14 and younger!",,1241877266872713217
DestinyAshenfe1,2020-03-22T23:59:47.000Z,"Why is it only the rich get the coronavirus test? A sports star just got it WITHOUT symptoms,  yet I have family with symptoms  and no one will test them. We are important, too!",,1241877266579304451
HaydenMerryn,2020-03-22T23:59:47.000Z,Dudes are really trying to “hangout” during #Quarantine - It didn’t happen before when there was no risk of getting #coronavirus what makes you think it’s going to happen now?,https://x.com/hashtag/Quarantine?src=hashtag_click https://x.com/hashtag/coronavirus?src=hashtag_click,1241877265081745409
dani3ll_c,2020-03-22T23:59:47.000Z,"I need a quarantine buddy  Someone to talk to all day to get through these days, to send cute pictures and videos",,1241877263966240768
jina_huh,2020-03-22T23:59:47.000Z,How are other #caregivers for #theelderly doing? What are the issues you are facing right now? Happy to share advice. Much love to you all!  #coronavirus #COVID19,https://x.com/hashtag/caregivers?src=hashtag_click https://x.com/hashtag/theelderly?src=hashtag_click https://x.com/hashtag/coronavirus?src=hashtag_click https://x.com/hashtag/COVID19?src=hashtag_click,1241877263932678148
OccupyOcupy,2020-03-22T23:59:47.000Z,Trump orders emergency medical stations for coronavirus hot spots | AFP  youtube.com/watch?v=SK_Uen …  fedgeno.com/trump-orders-e …,https://t.co/4YU2JbPc8c https://t.co/7QrqYkqk9u,1241877263727169538
AmastrisDratwka,2020-03-22T23:59:47.000Z,"Okay fool. Then why don't you ask Los Angeles County Health Dept, not run by Trump but by Democrats who run the city, WHY when they HAVE TESTS they're stopping TESTING but only for those ILL coming into HOSPITALS NOW?! latimes.com/california/sto …",https://t.co/vCpg9ognR1,1241877263450124295
alik_rainey,2020-03-22T23:59:47.000Z,"#MartialLaw  is coming I warned about this  , #Coronavirus live updates: National Guard to be deployed in NY, California, Washington -  @ABC  News  abcn.ws/2QCr0H1",https://x.com/hashtag/MartialLaw?src=hashtag_click https://x.com/hashtag/Coronavirus?src=hashtag_click https://x.com/ABC https://t.co/Uc6Zm0zml8,1241877263332843521
SpaceBitchAndy,2020-03-22T23:59:47.000Z,"I'm working on a whole new album, with new singles to drop, and working on my first music video!  But right now everything is girls, video games, and quarantine.  stay safe everyone, and listen to my music please!  open.spotify.com/artist/6ISPfbU … youtube.com/channel/UCWpZj …",https://t.co/BX8mz0TZz4 https://t.co/cdVpujHdcW,1241877263265574912
itsCornPop,2020-03-22T23:59:47.000Z,We need to start incentivizing people not to get Coronavirus...,,1241877262884048903
acj1971,2020-03-22T23:59:47.000Z,Simon PEGG and Nick FROST made a SHAUN OF THE DEAD Quarantine PSA and it...  youtu.be/DSFrRnPNIPw via  @YouTube,https://t.co/YYH7gaBHph https://x.com/YouTube,1241877262678421505
beltline_pres,2020-03-22T23:59:47.000Z,". NSW health department will hold cruise ships until respiratory issues tested for COVID . 2,647 passengers allowed to leave ship in Sydney despite group reporting flu-like symptoms during cruise . 3 tested positive to self-isolate for 14 days .",,1241877262598721536
Jeannie5554,2020-03-22T23:59:46.000Z,newsweek.com/8-senate-repub …   We will remember too 8 Republicans voted against the relief bill.,https://t.co/TfQ1Q2Ajuw,1241877262070210563
junkholmez,2020-03-22T23:59:46.000Z,"*  At New York prison, Harvey Weinstein put in isolation after contracting virus | Covid-19 |  niagara-gazette.com - #test",https://t.co/uTikbgs59l https://x.com/hashtag/test?src=hashtag_click,1241877262011531269
damiduende,2020-03-22T23:59:46.000Z,when we went shopping for quarantine a couple days ago I kept saying it’s called TREAT YOURSELF!! and now I dont have any spare money bc its all for bills and im hoping when I request my unemployment it comes in time for rent lmaaaoo,,1241877261864796160
itsjozzrenee,2020-03-22T23:59:46.000Z,if y’all have nothing to do during this quarantine ... you could idk ... watch my new video maybe ...   youtu.be/98igmTwP8aY,https://t.co/MZX40ZNFqN,1241877261415936000
FondOfBeetles,2020-03-22T23:59:46.000Z,"The state of them, since two weeks ago.   And now not mitigating the pandemic they unleashed but the political position.  They were told. And they ignored. And many thousands of people are going to die because of them.",,1241877261147672578
kari_123_,2020-03-22T23:59:46.000Z,"Cardi B questions U.S. govt's response to coronavirus as millions remain in quarantine: 'Are y'all gonna take our temperature to see if we got it?' I know I can’t find a thermometer anywhere- since supposedly, it’s 1 of 1st symptoms- so, WHO will take my temp? #coronavirus",https://x.com/hashtag/coronavirus?src=hashtag_click,1241877260723838976
FabulousFolksPA,2020-03-22T23:59:46.000Z,We are still closed. Practicing  social distancing with Padfoot #dogsofinstagram  instagram.com/p/B-DiQO5DcNi/ …,https://x.com/hashtag/dogsofinstagram?src=hashtag_click https://t.co/3u8HvahWlb,1241877260434538497
Sydneyquid,2020-03-22T23:59:46.000Z,". @realdonaldtrump  . @GOP  . @teamtrump  Donald is a failure, does not have any idea how to take care of our country. He is a hollow narcissist. Governors and mayors in growing uproar over Trump?s lagging coronavirus response - The Washington Post  washingtonpost.com/politics/gover …",https://x.com/realdonaldtrump https://x.com/GOP https://x.com/teamtrump https://t.co/iKY4agJF8l,1241877259830661121
RichinWriterss,2020-03-22T23:59:46.000Z,White House Coronavirus Task Force briefing  richinwriters.com/white-house-co …,https://t.co/6vGjcwKM0P,1241877259553775622
FitDaddyYEG,2020-03-22T23:59:46.000Z,"It started in November...where was the media back then?  Love or hate Trump, the media shouldn't revolve around him theguardian.com/world/2020/mar …",https://t.co/fWpzmbyrE3,1241877259465588737
DSGCGOLF,2020-03-22T23:59:46.000Z,We are following all precautionary measures and offering a place for families to get out of the house while following social distancing recommendations.,,1241877259046313985
111CT,2020-03-22T23:59:46.000Z,"@WHO  is wrong, both Japanese & Chinese studies proved asymmetric carriers are still infectious & even more dangeous. That's why wearing masks in public is vital on top of washing hands, disinfecting. Learn to make yr own masks on youtube. #COVID19pandemic   mol.im/a/8140551",https://x.com/WHO https://x.com/hashtag/COVID19pandemic?src=hashtag_click https://t.co/tt5bDjqOqL,1241877258698215424
_TC1__,2020-03-22T23:59:46.000Z,all dis quarantine shit is bs,,1241877258664476672
karrrrrren,2020-03-22T23:59:46.000Z,I better have the clearest skin after this quarantine all I’m doing is skin care,,1241877258647805956
whteverusaygil,2020-03-22T23:59:45.000Z,u know u hit a low when ur friends don’t answer ur call during QUARANTINE,,1241877257351770115
Aneetchkoo,2020-03-22T23:59:45.000Z,"I think I called it again. I said the stimulus bill would be argued back and forth between both parties, with the end result being that NOTHING would get passed regarding payments to the general public. And now Senate Republicans will use the excuse of going into self-quarantine",,1241877257192439809
needs_essential,2020-03-22T23:59:45.000Z,@JohnLegere  dm us and let’s work in a partnership to distribute the 100k mask we have been making daily. Seems like the governmental red tape causing the shortage. You changed the carrier game now it’s time to change the healthcare issue.  @TMobile  #PPEshortage,https://x.com/JohnLegere https://x.com/TMobile https://x.com/hashtag/PPEshortage?src=hashtag_click,1241877257083400195
Shelshand,2020-03-22T23:59:45.000Z,"Flights From Coronavirus Epicentres China, Iran, Italy STILL Landing In UK breitbart.com/europe/2020/03 …",https://t.co/lxSfVB45tT,1241877256869416966
LStarr13,2020-03-22T23:59:45.000Z,"I think Trump is trying to pull the rug out from under the vaccine/Big Pharma industry, and he is meeting resistance all the way!",,1241877256731086848
Marty1117,2020-03-22T23:59:45.000Z,"Quarantine aside, my life is great right now. Future lookkng REAL bright.",,1241877256248725510
kilee_lindsey,2020-03-22T23:59:45.000Z,"if you want to talk to me literally just text me, i’m the nicest person ever and we’re all in quarantine",,1241877256122912768
Victoria4Texas,2020-03-22T23:59:45.000Z,"To engage in an outdoor activity WHILE COMPLYING with social distancing requirements (Walking, hiking, biking, and running are allowed, if comply with social distancing)  To perform work providing essential products and services at an Essential Business.",,1241877256034811905
menderes_kurt,2020-03-22T23:59:45.000Z,The Neo-Malthusian World of the Coronavirus  nationalinterest.org/blog/buzz/neo- …,https://t.co/Oh2wVmFwcg,1241877256009584649
freejsoo,2020-03-22T23:59:45.000Z,"no content, quarantine, no wonder they need a tissue",,1241877255913115648
re_anderson21,2020-03-22T23:59:45.000Z,Watch until the very end!!! #Quarantine #CoronavirusPandemic,https://x.com/hashtag/Quarantine?src=hashtag_click https://x.com/hashtag/CoronavirusPandemic?src=hashtag_click,1241877255682482180
TrainsongGaming,2020-03-22T23:59:45.000Z,"*puts Belgium on my post-COVID-19 bucket list*  Hey,  @sprunty2000 , wanna join me?  x.com/jkbckr/status/ …",https://x.com/sprunty2000 https://x.com/jkbckr/status/1241855802358415360,1241877255414046720
Cross_Reference,2020-03-22T23:59:45.000Z,Government: 'Please practise social distancing and stay at home'  British People: '...today is the perfect day to climb the tallest mountain in Wales with the rest of the population.',,1241877254885576705
daxdyn,2020-03-22T23:59:45.000Z,Please take a photo now our Mother Earth  We want to see the difference before and now during Lockdown,,1241877254721896448
GuerryHerbert,2020-03-22T23:59:45.000Z,"#coronavirus News: ""Death toll in Georgia rises to 20."" (= 13 deaths per 100k population.) Better headline: ""Death in GA per 100k:  Heart disease, 163; Cancer, 149; Accidents, 48; Asama, etc., 39; Stroke, etc., 37; Dementia, 30;  Diabetes, 21; Flu & Pneumonia, 14; Suicide, 13.""",https://x.com/hashtag/coronavirus?src=hashtag_click,1241877254533197826
tehs85,2020-03-22T23:59:45.000Z,Delinquent selfish Brits I have no words I am ashamed this is how my country is handling a global pandemic woooow ..UK needs a full lockdown,,1241877254520614919
machines_time,2020-03-22T23:59:45.000Z,On the right track.......coronavirus deaths in USA plateauing? youtu.be/Ts5MdqAAK3M,https://t.co/AoHUuIokF6,1241877254159900673
BrimhallJudith,2020-03-22T23:59:44.000Z,@realDonaldTrump   Please step aside and let those who care and are competent handle this pandemic.  You KNEW in 2018 that we were not prepared & you did nothing.  You even cut CDC personnel.  A crisis is here & you walked around for 2 months playing it down and confusing people.,https://x.com/realDonaldTrump,1241877253702610944
ToxicTOJag,2020-03-22T23:59:44.000Z,Just rolled up to my local McDonald's to get food and a dude was in the back wearing a giant pink wizard hat with 2020 new years sunglasses cheering for the quarantine LMAO,,1241877253463650312
ttwarrior1,2020-03-22T23:59:44.000Z,Pelosi Is Blocking Direct Cash Payments To  Citizens.WTF?  youtu.be/NKtB9f2ezzg via  @YouTube  #nancypelosi #coronavirus,https://t.co/WaOu4F1B5f https://t.co/n1D0N8U4RL https://x.com/YouTube https://x.com/hashtag/nancypelosi?src=hashtag_click https://x.com/hashtag/coronavirus?src=hashtag_click,1241877253149114368
eclecticericka,2020-03-22T23:59:44.000Z,everyone social distancing and liking my tweets dm me and be my friend please!!!,,1241877253065265153
djenneah1,2020-03-22T23:59:44.000Z,Quarantine day 6:  snacks/groceries depleting.  which n*gga can I get food out of,,1241877252888911873
323Talent,2020-03-22T23:59:44.000Z,"Tell @senatemajldr and  @SpeakerPelosi  to protect people from financial hardship due to the #coronavirus pandemic. Put people first, not corporations.  Sign the  @CRAdvocacy  petition:  pic.x.com/ldHpk7n3lu  action.consumerreports.org/finance2020032 …",https://x.com/SpeakerPelosi https://x.com/hashtag/coronavirus?src=hashtag_click https://x.com/CRAdvocacy https://x.com/CRAdvocacy/status/1241088755823501314/photo/1 https://t.co/3UoMdJVGQ4,1241877252859498496
THEHYPERGATE,2020-03-22T23:59:44.000Z,This is how you use fear to manipulate the market$$$ #CoronaVirus,https://x.com/hashtag/CoronaVirus?src=hashtag_click,1241877252221980672
bravesfan90,2020-03-22T23:59:44.000Z,"To sum up, Rand Paul was near someone who tested positive for Coronavirus.  Decided to get tested himself.   In the meantime he refused to self-quarantine, continued to work in the Senate, continued to work out at a gym, and voted against Coronavirus relief bill.  Resign.  Now.",,1241877251827871744
Jprimrose2002,2020-03-22T23:59:44.000Z,"Surviving a Pandemic, in 1918  daily.jstor.org/surviving-a-pa … via  @JSTOR_Daily",https://t.co/2yAdAWiaIX https://x.com/JSTOR_Daily,1241877251630776320
TheReal_33,2020-03-22T23:59:44.000Z,When you in quarantine and you see mfs start turning into zombies outside,,1241877250796068865
bionicglamour,2020-03-22T23:59:44.000Z,Tell us  @senatorloeffler  is this one of the stocks you bought? Before or after your intelligence briefing? We Live in Zoom Now  nyti.ms/2x5Q9Tq,https://x.com/senatorloeffler https://t.co/TdAf9KNQFL,1241877250762563585
rahulch65021828,2020-03-22T23:59:44.000Z,Sir i'm disabled from one leg and despite of this pandemic my company has force us to work ..sir i request you please look into this matter..i'm residing in sec 18 gurgugram..,,1241877250363932673
STLien_,2020-03-22T23:59:43.000Z,I'm still stuck on inmates gettin it #coronavirus #COVIDー19,https://x.com/hashtag/coronavirus?src=hashtag_click https://x.com/hashtag/COVID%E3%83%BC19?src=hashtag_click,1241877248472428544
AveryFlores2001,2020-03-22T23:59:43.000Z,"I swear to the man upstairs, the second this virus is over with and off of quarantine....I’m going on an insane sneaker shopping spree. :)",,1241877248308887554
CartoonessToo,2020-03-22T23:59:43.000Z,"You can blame California's #lockdown on Barbara Ferrer at  @lapublichealth . She whispers in  @GavinNewsom  ear 1 or 2 deaths and he jumps sky high. We're up to 5 dead in an area of 10.7 million people. Meanwhile, tobacco shops all open to kill everyone, but we have lost #freedoms",https://x.com/hashtag/lockdown?src=hashtag_click https://x.com/lapublichealth https://x.com/GavinNewsom https://x.com/hashtag/freedoms?src=hashtag_click,1241877247440502784
alcaprari23,2020-03-22T23:59:43.000Z,LATEST: Austin Public Health reports 79 positive cases of COVID-19 in Travis County. Jumped from 62 yesterday.   Again - we will continue to see this number go up as testing becomes more readily available in our area. It's important to keep your social distance at this time.,,1241877247394492422
Victoria4Texas,2020-03-22T23:59:43.000Z,"WHO:  Order applies to every resident of Dallas County, including residents of Mesquite, Garland, and Dallas.   WHAT:  Everyone must stay at their place of residence--#StayAtHome.  Everyone must practice 6 feet of social distancing when they are outside their residence.",https://x.com/hashtag/StayAtHome?src=hashtag_click,1241877247256133633
LOLGOP,2020-03-22T23:59:43.000Z,"I think ""The corrupt guy who dithered for months as the worst pandemic of this century swept our shores because he only cares about stocks shouldn't get $500 billion to bail out himself and his friends as the country crashes"" is a principle you *could* run on in November.",,1241877247155470349
Erosab75,2020-03-22T23:59:43.000Z,Vaccination is Inneficient and dangerous!  youtu.be/dlUsAxWObzk via  @YouTube,https://t.co/9hUqePlj5i https://x.com/YouTube,1241877246056562689
1anhaga,2020-03-22T23:59:43.000Z,deferral of payments is not really any help. cbc.ca/news/business/ …,https://t.co/xfkoSNOibY,1241877246010257410
Victoria4Texas,2020-03-22T23:59:43.000Z,"We are already following similar action, but here is what the Stay-At-Home Order means:",,1241877246001983489
aaspenbby,2020-03-22T23:59:42.000Z,idc how hard quarantine get i’m not doing “tbh” or “rates”,,1241877245628686336
TeamToxicure,2020-03-22T23:59:42.000Z,Social Distancing Party!,,1241877245108469760
newpaper24,2020-03-22T23:59:42.000Z,Is Latin America prepared to fight coronavirus? – NEWPAPER24  newpaper24.com/is-latin-ameri …,https://t.co/0Rntt6Qdxs,1241877244710137860
TrumpGal4,2020-03-22T23:59:42.000Z,"Mark Levin on House Dems' coronavirus plan: 'People are sick and dying and Pelosi is playing games' foxnews.com/media/mark-lev …  She’s an evil, vile, viciously hateful partisan who doesn’t give a rats ass about Americans. She’s in it for her own twisted glory and country be damned.",https://t.co/p2RtpXZy26,1241877244664000515
Victoria4Texas,2020-03-22T23:59:42.000Z,"We are asking you to please Stay-At-Home because we care about you, we love you, and we want you to be around for your family in years to come.",,1241877244655648768
asecglobal,2020-03-22T23:59:42.000Z,President Buhari speaks on the Coronavirus pandemic (video)  hypercitigh.com/coronavirus/pr …,https://t.co/5GvJxmZo72,1241877244097724418
chuchme,2020-03-22T23:59:42.000Z,Coronavirus infecting Harvey Weinstein is its way to apologize for infecting tom hanks,,1241877243841982464
NextLevel49,2020-03-22T23:59:42.000Z,"Due to COVID-19, Our gym may be closed but we’ve got some amazing workouts that we will SHARE with you...   Get ready to workout!!!!   Stay tuned!!! Our first Home Workout Challenge STARTS TOMORROW!!!  Who’s ready???  instagram.com/p/B-DiP1Qghr4/ …",https://t.co/EpLyFOLJhH,1241877243477057538
Victoria4Texas,2020-03-22T23:59:42.000Z,"While we understand the inconvenience and hardship it is placing on our local residents and businesses, all options must be on the table to prevent the further loss of life as the coronavirus spreads.",,1241877243313471489
