User_name,Datetime,Content,Links,Tweet_ID
Mita_Floria,2021-01-11T23:59:24.000Z,I have every episode saved on my dvr I watched it so much during lockdown  They’re all hilarious,,1348781588335775745
DebsF319,2021-01-11T23:59:24.000Z,Celtic draw with Hibs despite 13 players isolating after positive Covid-19 test  theguardian.com/football/2021/ …,https://t.co/DrRObPKCUs,1348781587492720642
Charley2021,2021-01-11T23:59:23.000Z,With some indications that previous cov2 infections complicate the vaccine response.  @fordnation,https://x.com/fordnation,1348781586024697856
AmyGreatorex,2021-01-11T23:59:23.000Z,"For the first time in a while, I’ve looked at my notifications from all apps... this is a big thing as I usually avoid them like the plague (or covid these days ) #positive #pma #feelinggood #mentalhealth #avoidancetechnique #notificationanxiety",https://x.com/hashtag/positive?src=hashtag_click https://x.com/hashtag/pma?src=hashtag_click https://x.com/hashtag/feelinggood?src=hashtag_click https://x.com/hashtag/mentalhealth?src=hashtag_click https://x.com/hashtag/avoidancetechnique?src=hashtag_click https://x.com/hashtag/notificationanxiety?src=hashtag_click,1348781585903063040
ElBeardsley,2021-01-11T23:59:23.000Z,France's Seine River Is A Place Of Solace During COVID-19 Pandemic,,1348781585630457857
Juice_Spur,2021-01-11T23:59:23.000Z,. @Leah_Sottile  thank you for this podcast. Wells and super insightful. Look forward to the 5G Nashville guy and anti vaccination groups sometime in the future  podcasts.apple.com/us/podcast/two …,https://x.com/Leah_Sottile https://t.co/f163tS7QS3,1348781585135386625
rmartorell65,2021-01-11T23:59:23.000Z,"i know they did it with the press and The WHO,and that Pharma are doing billions with a non necessary vaccine and an overrated flu.They are making money and exercise a power grab ,tyranny stile, with no precedent in history.",,1348781585097781255
lisajaws04,2021-01-11T23:59:23.000Z,That 80 year old hag withheld necessary stimulus and other Covid related protections for 8 months! It’s time for her to go!,,1348781584334393352
FirebaughNorman,2021-01-11T23:59:23.000Z,"Days Before Democrats Take Control, Biden Vows to 'Defeat the NRA and End Our Epidemic of Gun Violence' via @WestJournalism  westernjournal.com/days-democrats …",https://t.co/NgDinnVhie,1348781583155798016
Khalid_Saghir,2021-01-11T23:59:22.000Z,3 gorillas test positive for COVID-19 at San Diego Zoo—first in the world flip.it/si0xnc,https://t.co/h6nJ4WAe71,1348781581356380160
tdbt71,2021-01-11T23:59:22.000Z,Watergate=controlled response over short time period - laws were ultimately respected/even the AG was charged/news media went deep (no pun intended)  This chaos was deliberately planned years ago and has not even begun to run its course - polarization is a disease w/o a vaccine,,1348781580316270594
wrusry,2021-01-11T23:59:22.000Z,How long did it take for the ivermectin to affect your long covid symptoms?,,1348781579418669056
notsameucountry,2021-01-11T23:59:22.000Z,"""Immunity from Moderna Inc’s COVID-19 vaccine should last at least a year,""  Vale the copy editors of yesteryear.",,1348781578110054403
redblueorange3,2021-01-11T23:59:21.000Z,@govchrissununu  I guess a pandemic wasn't enough for 2020. It was a missing a little bit of Christian ethnic cleansing. I hope you don't consider yourself Christian because you'd be a disgusting traitor. You must really love that gold at AAZ. #RecognizeArtsakh #SanctionTurkey  x.com/ASBMilitary/st …,https://x.com/govchrissununu https://x.com/hashtag/RecognizeArtsakh?src=hashtag_click https://x.com/hashtag/SanctionTurkey?src=hashtag_click https://x.com/ASBMilitary/status/1348490208409432078,1348781577916989440
ScientistSwanda,2021-01-11T23:59:21.000Z,"I have the best group of friends helping to spread accurate information about SARS-CoV-2 vaccines!   so thankful to everyone who watches, shares, and continues to ask great questions - we're just getting started!   x.com/AzulPinoba/sta …",https://x.com/AzulPinoba/status/1348771653812166658,1348781577879384069
DanielleMedek,2021-01-11T23:59:21.000Z,I spent the Christmas period binge-listening. I liked the part with the donut days and vaccine roll-out. Wondering what plot twists are in store in season 2.,,1348781577845633025
DiogenesQuest,2021-01-11T23:59:21.000Z,CREEPING TOWARD AUSCHWITZ  Trump's locking asylum seekers in animal cages DURING A PANDEMIC betrays the same cold-blooded contempt for human life that Hitler showed the Jews at Auschwitz.  #CreepingTowardAuschwitz,https://x.com/hashtag/CreepingTowardAuschwitz?src=hashtag_click,1348781577304637440
nazsenior,2021-01-11T23:59:21.000Z,Nothing is going to happen they are saying it to make sure people stay at home,,1348781576977403904
HeaneyrP,2021-01-11T23:59:21.000Z,Is it just me or has the entire world gone irretrievably mad?   The whole Covid LD narrative being pushed by Govt and MSM is morally evil.  They have zero credibility in pushing this policy either on  scientific or ethical grounds.,,1348781576826597379
Firiniels_End,2021-01-11T23:59:21.000Z,"It's masks on for the next week or so in my area, and I got kinda bored during our lockdown",,1348781576600002560
Gibney_Jim,2021-01-11T23:59:21.000Z,Imagine how losers she would be if she found out Pelosi flew in a COVID positive member of Congress to ensure she got the votes to remain Speaker. Oh wait. She did find out but for some reason didn't care. Clowns.,,1348781576524607494
WizardOnARock,2021-01-11T23:59:21.000Z,"Some obsessions are unhealthy. Some are, CES today is one of those healthy obsessions. I've been streaming for twelve solid hours today. Future technologies are exciting in so many different ways in so many different areas. CES2021 is using the pandemic to better lives.Its day 1!",,1348781575547318272
sherry16260559,2021-01-11T23:59:21.000Z,And we know how effective flu vaccine is!,,1348781573928177666
RickNeale1,2021-01-11T23:59:20.000Z,I'm running again this year:  @Florida_Today  column on worsening child hunger during COVID-19 pandemic by  @MBellaby    floridatoday.com/story/news/202 …,https://x.com/Florida_Today https://x.com/MBellaby https://t.co/5vleW0gnqQ,1348781573500510210
CarttiiSzn,2021-01-11T23:59:20.000Z,Sad thing is they don’t care about Covid,,1348781573500375043
maureenm2000,2021-01-11T23:59:20.000Z,"2 gorillas test positive for COVID-19 at San Diego Zoo So #WearAMask to save the ANIMALS too! They dont, but please #WashYourHands too! Accept some social, community #responsibility! #SocialDistancing #COVID19 flip.it/Ns6W.f",https://x.com/hashtag/WearAMask?src=hashtag_click https://x.com/hashtag/WashYourHands?src=hashtag_click https://x.com/hashtag/responsibility?src=hashtag_click https://x.com/hashtag/SocialDistancing?src=hashtag_click https://x.com/hashtag/COVID19?src=hashtag_click https://t.co/xzVQxaGWnW,1348781573215191046
am4brew,2021-01-11T23:59:20.000Z,Check them for recording devices and Covid before they come close to past and present President Biden and Vice President Harris  t.co/QM9XctKhck,https://t.co/QM9XctKhck,1348781572200275971
DemFelicia,2021-01-11T23:59:20.000Z,So during the coup attempt  @LindseyGrahamSC  tore off his mask and screamed in the face of a Capitol police officer demanding to know why they failed to protect the Capitol.,https://x.com/LindseyGrahamSC,1348781571789131776
margielascript,2021-01-11T23:59:20.000Z,"if u shared masks during any point in this pandemic, don’t worry about what’s in the vaccine",,1348781571734728706
el_beets,2021-01-11T23:59:19.000Z,He wasnt on vacation he was making vaccine deals for the province spelling correction needed,,1348781569398378497
TorranceCoste,2021-01-11T23:59:19.000Z,"I'm aware of the relationship between respiratory illness and humidity. We've always had cold season.  But if you're saying we wouldn't have had more opportunity to transmit covid to each other in the last two months without the restrictions, I don't know what to tell you.",,1348781569087991810
sandieshoes,2021-01-11T23:59:19.000Z,Oh fcuk off had enough of you bloody moaners.   You bloody covid deniers do my head in.,,1348781568777715713
TweetsDulwich,2021-01-11T23:59:19.000Z,Re: what to do if a shop is not taking covid seriously  eastdulwichforum.co.uk/forum/read.php … via  @circleboom,https://t.co/H5NHAm99jv https://x.com/circleboom,1348781567540416518
FSBigBob,2021-01-11T23:59:19.000Z,Just saw a news story that the USA is wasting thousands of doses of the vaccine by just not giving the extra doses away to anyone who would want at vaccine locations...  Ummm just throwing it out there if anyone has a bonus squirt of vaccine laying around I will take it,,1348781567532019712
Hmm_suree,2021-01-11T23:59:19.000Z,When is Cuomo writing a book about his terrible rollout of the vaccine?,,1348781567280369666
JohnnyEffinUtah,2021-01-11T23:59:19.000Z,We live in a world where Draymond is held more accountable than officials committing open treason in the middle of a pandemic.,,1348781566160367619
dr_ryan,2021-01-11T23:59:17.000Z,Got an email today that I qualified for the current round of Covid vaccination for healthcare providers in Oregon. Getting my first shot on Friday.  Lets go!,,1348781558799298561
EJSullivan61,2021-01-11T23:59:15.000Z,Any of Kurt's fans who refuse to wear a mask sure are.,,1348781552776437760
stormspottersue,2021-01-11T23:59:15.000Z,We need to hear from  @VP  as head of the WH Coronavirus Task Force before he leaves office too.,https://x.com/VP,1348781550515716097
TwiterHero,2021-01-11T23:59:15.000Z,Headlines: Japanese Scientists Find Variant of Coronavirus Different From UK and South Africa - HW News English  youtube.com/watch?v=wG0uyl … via  @GoogleNews   Go 2021,https://t.co/9vKO28Ude7 https://x.com/GoogleNews,1348781550029180929
GottaBernNow,2021-01-11T23:59:15.000Z,COVID Vaccine: Israel’s most lethal disregard for Palestinian lives yet  haaretz.com/middle-east-ne … #Apartheid,https://t.co/btkv7DqRQU https://x.com/hashtag/Apartheid?src=hashtag_click,1348781549664174081
espiritu_az,2021-01-11T23:59:15.000Z,"⁦⁦ @dougducey ⁩   10,000 Arizona residents are dead from Covid.   You are an abject failure of a Governor.",https://x.com/dougducey,1348781549110509569
Paulop1980,2021-01-11T23:59:10.000Z,Maybe they died of the pandemic you helped mismanage.,,1348781529481273344
HansNiesund,2021-01-11T23:59:10.000Z,About that asymptomatic transmission not being a thing ...  papers.ssrn.com/sol3/papers.cf …,https://t.co/RjmmCvsexZ,1348781528772464643
Courtne93070036,2021-01-11T23:59:10.000Z,"Oh and how, pray tell, would you have handled the pandemic?",,1348781528290095104
chicagotribune,2021-01-11T23:59:10.000Z,The head of the Illinois Department of Veterans’ Affairs stepped down Monday amid ongoing criticism of the agency’s handling of a coronavirus outbreak that has killed 36 veterans who lived at a state facility in LaSalle. trib.al/3jwGpIa,https://t.co/Q1P3B4kVR4,1348781528080388100
rosso_neri,2021-01-11T23:59:09.000Z,"On one hand it seems utterly foolish to even attempt any kind of normal inauguration ceremony now (both coz of Covid & coz of potential violence/disruption) but also on other hand can see some arguing that they need the normal process to like ""reset"" things...",,1348781527396704256
MS_LapisLazuli,2021-01-11T23:59:09.000Z,"End the Cruel and Deadly Fur Trade, Before it Causes the Next Pandemic - Sign the Petition!  chng.it/bzjdnDsN via  @Change",https://t.co/cXKMp4nLam https://x.com/Change,1348781526335451139
GlamourMagUK,2021-01-11T23:59:09.000Z,"Currently in the UK, pregnant women are being advised to wait until after the birth to have the Covid-19 vaccine...  trib.al/sowh6Po",https://t.co/vW55gOd9Ns,1348781525916127232
NYTObits,2021-01-11T23:59:09.000Z,"Nancy Bush Ellis, sister of President George Bush and aunt of President George W. Bush, dies at 94 of complications of Covid-19. Unlike most of her family, she was for a time a liberal Democrat. Obit by  @kseelye  trib.al/vzjNoJq",https://x.com/kseelye https://t.co/41ZcTIQZf0,1348781525811277834
KFOX14,2021-01-11T23:59:09.000Z,#ElPaso County leaders said there is a way vaccine distribution can be even more efficient.  kfoxtv.com/news/coronavir …,https://x.com/hashtag/ElPaso?src=hashtag_click https://t.co/Dod4IKf8tA,1348781523990933505
Hephaestus7,2021-01-11T23:59:08.000Z,COVID-19 immunity: how long does it last? theconversation.com/covid-19-immun …,https://t.co/HGnZvGXJ1u,1348781523231764482
sarahgroh,2021-01-11T23:59:08.000Z,"We were in this room. @AyannaPressley  & I were so uncomfortable re the COVID risks we negotiated our way out & to a less secure location.  On the way out I was told “If we move, we move. She’ll be left behind when we evacuate.”",https://x.com/AyannaPressley,1348781522678120448
Maximil86429959,2021-01-11T23:59:08.000Z,"I heard you tested positive for covid-19 last week?  ""Yep""  So you must be feeling really sick by now?  ""Nope""",,1348781521939869699
NeonatologyUnmc,2021-01-11T23:59:08.000Z,"With minimal data for pregnant and breastfeeding women on the COVID vaccine, Dr. Emily Patel shares what we know. #breastfeeding #neonatology #liquidgold #CovidVaccine",https://x.com/hashtag/breastfeeding?src=hashtag_click https://x.com/hashtag/neonatology?src=hashtag_click https://x.com/hashtag/liquidgold?src=hashtag_click https://x.com/hashtag/CovidVaccine?src=hashtag_click,1348781520450953216
TravelThoughts1,2021-01-11T23:59:08.000Z,"Living out of #travelodges is the lynchpin of our new travelling strategy, at least until #lockdownuk  is over. Our latest video summarises our travel during #covid and lockdown   youtube.com/watch?v=tFs2Zq …",https://x.com/hashtag/travelodges?src=hashtag_click https://x.com/hashtag/lockdownuk?src=hashtag_click https://x.com/hashtag/covid?src=hashtag_click https://t.co/o2Aix2fSJ5,1348781520140558338
dmsn1316,2021-01-11T23:59:08.000Z,Ted Nugent absolutely destroyed leftists and the coronavirus vaccine and people are going insane  culturewatchnews.com/ted-nugent-abs …,https://t.co/E1wHXtFS17,1348781520048291842
TahirisRivera,2021-01-11T23:59:07.000Z,Covid,,1348781519117160448
Dr__Dickweed,2021-01-11T23:59:07.000Z,"Medicare for All is dead. Big Pharma is in a comfortable position since they came through with the vaccine so they're not going to be challenged on anything any time soon. Just carry on, and be thankful they didn't raise the price to $2,750. God Bless America.",,1348781519003906048
merumairieux,2021-01-11T23:59:07.000Z,"IT WAS A VERY GOOD EXPERIENCE!!! meeting seiyuus at conventions are always  i was looking forward to the one last year and this year but you know, pandemic",,1348781518949380097
SmallcageGG,2021-01-11T23:59:07.000Z,Nothing. Drew McIntyre tested positive for the covid and is in quarantine. Apparently a couple of selfish superstars went partying and we're hoping that non of them came into contact with Roman,,1348781517934374912
supremegrafz,2021-01-11T23:59:07.000Z,Literally my birthday couple days before lockdown looking like mans locked up this year doe,,1348781517905006592
WLKY,2021-01-11T23:59:06.000Z,At least 2 gorillas at San Diego Zoo Safari Park test positive for COVID-19  wlky.com/article/at-lea …,https://t.co/LgSLJpPI0E,1348781514868338695
CVSteveBennett,2021-01-11T23:59:06.000Z,WVC BOYS  HOOPS: Crestwood boys basketball team will quarantine for 10 days. Dallas waiting to hear from Department of Health for further guidance. No games or practices for both teams until further notice. League play starts Friday.,,1348781514293727232
ckouros,2021-01-11T23:59:06.000Z,"Mainstream media:  Last week: Trump administration has failed in getting  vaccine distributed to the country  What's changed: Trump has finally been defeated  This week: There's no problem with vaccine distribution, Governors need to open more vaccine centers  Softballs for Biden",,1348781513840717827
dhnews,2021-01-11T23:59:06.000Z,Oregon State’s women’s basketball game at Arizona State scheduled for Friday night has been postponed due to COVID-19 protocols within the Sun Devils’ program.  democratherald.com/corvallis/spor …,https://t.co/hms3Kka5Qw,1348781513647808514
gtnews,2021-01-11T23:59:06.000Z,Oregon State’s women’s basketball game at Arizona State scheduled for Friday night has been postponed due to COVID-19 protocols within the Sun Devils’ program.  gazettetimes.com/sports/beavers …,https://t.co/fGeD7xEgip,1348781513438097409
Chito_Pito_420,2021-01-11T23:59:06.000Z,Just realized mfs at work can’t even see me smiling at them cause of my mask they just see me squinting at them,,1348781513131712513
DougYoung2009,2021-01-11T23:59:06.000Z,"Are any of these players symptomatic? Asymptomatic spread is not a thing. If the tests are cranked up to high cycle thresholds, they're not necessarily even finding infection, just junk nucleotides. They should be using tests w/CT of 30 or lower for symptomatic players only.",,1348781512724865030
SteveHi68263998,2021-01-11T23:59:06.000Z,If you stop and chat you will out that not many people have a serious reaction to covid so they must stop you from talking to,,1348781512678920198
wolfe_rowan,2021-01-11T23:59:06.000Z,Masks?! Masks!?!?! You can't tell ppl to wear a mask!!! Lol..... i totally agree with you.,,1348781512372547589
edgewoman3000,2021-01-11T23:59:06.000Z,What's this garbage in my mailbox?  The Epoch Times -sample issue. en.wikipedia.org/wiki/The_Epoch … and  cbc.ca/news/canada/ep … not even for birdcage!,https://t.co/c1Q3asegmw https://t.co/twcc4ere7y,1348781511630327810
jq6008,2021-01-11T23:59:06.000Z,Covid best guess. There was a rumor all week that a position group had been affected.,,1348781511361888257
DAndreWay,2021-01-11T23:59:06.000Z,Rosters should’ve been expanded. Covid going on and you still wanna run with 15 man rosters. Should be atleast 18-20 players per team,,1348781510963453954
Comedydaddy,2021-01-11T23:59:05.000Z,Using pandemic eyes.,,1348781509088604167
LeeNasty9point4,2021-01-11T23:59:05.000Z,They won’t cause you have covid,,1348781508950167553
simonmccarthy4,2021-01-11T23:59:05.000Z,Vaccine immunity lasts a year,,1348781508534927360
Yung_Hunnid,2021-01-11T23:59:04.000Z,I thought COVID is a hoax,,1348781506341298176
CBU_capital,2021-01-11T23:59:04.000Z,"Factbox: What's in the U.S. COVID-19 bill? Unemployment, $600 checks, 'three martini lunch' deduction - Reuters India in.reuters.com/article/health …",https://t.co/U6gI2BoKvQ,1348781506135793664
JANEMCARTHUR11,2021-01-11T23:59:04.000Z,"Pandemic message I'm struggling to reconcile w/ is ""children are resilient"". Seems to me we're expecting a lot of children in absence/excusing of structural #Covid19 mitigation measures. Yes, kids will overcome & learn things from this time. But we owe them better now.  #onted",https://x.com/hashtag/Covid19?src=hashtag_click https://x.com/hashtag/onted?src=hashtag_click,1348781505322119175
Thirteenvillain,2021-01-11T23:59:04.000Z,LMFAOOOOOO nah remember shorty who they said was like this after the swine flu vaccine?,,1348781504512614404
Seeseerider2,2021-01-11T23:59:04.000Z,"Get the doses to seniors you had nothing to do with the creation of the vaccine,Trump got that done in warped speed soJoey it is  now the time to show us what you will do for us!!  Get it done.  NOW! Keep Cardinal@Fauci far away",,1348781503975747584
ProperGuide,2021-01-11T23:59:04.000Z,The airlines want a coronavirus bailout. Should they get it? -  devicedaily.com/pin/the-airlin … #content,https://t.co/j8FEBJpEGl https://x.com/hashtag/content?src=hashtag_click,1348781503711424514
Joypear27472467,2021-01-11T23:59:04.000Z,My heart goes out to Governors around the United States having to deal with the virus the vaccine threat and  possible armed demonstrations at  capitals Governor Cuomo looks very tired\stressed peace /health to him stay safe governor stay brave,,1348781503375937544
iamAtheistGirl,2021-01-11T23:59:04.000Z,every single thing we are dealing with right now from the out of control covid to the insurrection comes from one thing.  the ease of spreading disinformation.,,1348781502583205893
freespiritus,2021-01-11T23:59:03.000Z,New Mask study.  #bced #bcpoli #CanadianSheild,https://x.com/hashtag/bced?src=hashtag_click https://x.com/hashtag/bcpoli?src=hashtag_click https://x.com/hashtag/CanadianSheild?src=hashtag_click,1348781500733423617
Philip_Porter,2021-01-11T23:59:03.000Z,I’m absolutely fed up with supposedly smart people banging on about 24 hour vaccination centres.  We don’t need them.,,1348781500364419072
ibra_sid,2021-01-11T23:59:03.000Z,ever since i first watched haikyuu ive wanted to try volleyball but this stupid pandemic wont let me man,,1348781499626237952
MillerRosePhoto,2021-01-11T23:59:03.000Z,"Meet my friend Bob. It’s that time of year again, continuing qualification training. Just finished all 14 door/window evacuations. Shew! They offered a late training, 2-10pm, due to COVID. I’m liking it! #crewlife",https://x.com/hashtag/crewlife?src=hashtag_click,1348781499315871746
HouseTrevethan,2021-01-11T23:59:02.000Z,"buff.ly/3nx7Dgl The global pandemic had an impact on every business. From a digital marketing standpoint, what will 2021 bring? Several digital marketing leaders shared their thoughts on coming trends. #toptrends #digitalmarketingtrends #globalpandemic #HouseTrevethan",https://t.co/a0jU2OA0Zv https://x.com/hashtag/toptrends?src=hashtag_click https://x.com/hashtag/digitalmarketingtrends?src=hashtag_click https://x.com/hashtag/globalpandemic?src=hashtag_click https://x.com/hashtag/HouseTrevethan?src=hashtag_click,1348781496874782722
360mediaX,2021-01-11T23:59:02.000Z,Congresswoman tests positive for COVID-19 after Capitol attack  dlvr.it/RqN10m,https://t.co/PR6pgX5X3Z,1348781496753037313
Exetlos_GDA,2021-01-11T23:59:02.000Z,"KEVtalks Episode 15: Cybersecurity Challenges in a Post-Pandemic Hyper-Digital World.: Forty-two per cent of companies say they don't believe they are a target for a cyberattack, and there is declining diligence in keeping security software ...  dlvr.it/RqN116 EXETLOS",https://t.co/peWq5lTrVr,1348781496060968960
English_Slav,2021-01-11T23:59:02.000Z,"With this slight down trend in COVID, this would be the best time to put into effect a mask mandate.",,1348781495369027592
DillonHowington,2021-01-11T23:59:02.000Z,Isn’t the 2 dose moderna vaccine 98% effective?,,1348781495297708038
Jerri_M_Green,2021-01-11T23:59:02.000Z,Or do you mean like my state senator  @BrianKelsey  who is introducing language to force parents to send their kids back to crowded classrooms while covid rages in our state - literally the worst hot spot in the world?,https://x.com/BrianKelsey,1348781494924410880
nickmurftweets,2021-01-11T23:59:00.000Z,"There’s also not a clamour for staying home & wearing mask but they’re making us do that and rightly so. They aren’t limiting hours coz of we don’t fancy it, they’re doing it coz they don’t have enough vaccines. And I’d fully support them if they just fucking said as much.",,1348781487248826371
CTVNationalNews,2021-01-11T23:59:00.000Z,"More than 350,000 COVID-19 vaccinations have now been administered across Canada.  Four provinces have vaccinated more than 1% of their population.  Bookmark our tracker here:  ctv.news/2FvhG6F",https://t.co/SnXBcbtYcv,1348781486686703617
fox7austin,2021-01-11T23:59:00.000Z,#FOX7Austin at 6 :  @KoskionFOX7  on business capacity rollbacks due to COVID-19 : Latest on COVID-19 vaccines in Austin : Update on  @ATXConventions  opening as alternative care site for COVID-19 patients WATCH:  fox7austin.com/live,https://x.com/hashtag/FOX7Austin?src=hashtag_click https://x.com/KoskionFOX7 https://x.com/ATXConventions https://t.co/Fgat2wIiY5,1348781486565019648
LynntendoWii,2021-01-11T23:58:59.000Z,"If pandemic life has granted me anything, it's this. I've played more games and watched more movies in the past year than in the past 7 years combined.  I will admit, the guilt is still there though... just quieter.",,1348781485713731585
katieAL,2021-01-11T23:58:59.000Z,"Yes amazing media & govt not making more noise about how nhs website and studies say take #vitaminD3 to reduce risk from #COVID19  (studies say also flu, colds, cancer) nhs.uk/conditions/cor …",https://x.com/hashtag/vitaminD3?src=hashtag_click https://x.com/hashtag/COVID19?src=hashtag_click https://t.co/M11b7Mccj2,1348781484300242947
Baldy_Bassey,2021-01-11T23:58:59.000Z,"It did but look at the team now. 21 wins, 2 draws and 0 defeats in the league meanwhile Celtic are crumbling even more as the weeks go by. Lockdown was the best thing that could’ve happened to Rangers.",,1348781483939532801
lekzandr,2021-01-11T23:58:59.000Z,New year new mask,,1348781483423625217
Shropsh17793278,2021-01-11T23:58:59.000Z,Opinion... It's a shame that prisoners will get the Covid vaccine before a person who is over 60 will. I guess that I should have committed a crime to get incarcerated so that I could get the vaccine in a timely manner. I must say that NC is not doing a good job so far...,,1348781482060488705
DavidClem007,2021-01-11T23:58:58.000Z,"No only the right wing have the trolls to do it.  If they had bollocks we would have seen the back of this dreadful Tory Government by now.  Instead of calling out a girl maybe call out Johnson, Tory Quangos and the dreadful handling of a Pandemic among other cock ups.",,1348781481376833544
ThePou_Lin126tm,2021-01-11T23:58:58.000Z,"If I do the goose step,or do a flat hand straight arm salute will covid 19 go away ,Please no more covid 19 news please I m so sick if covid how about vaccines instead many other nations have given many millions of vaccinations but not here way less than one million how come WTF!",,1348781480823169026
cericconnor,2021-01-11T23:58:58.000Z,The vaccine can't come soon enough,,1348781480147869697
