User_name,Datetime,Content,Links,Tweet_ID
Angelica1117,2021-01-11T23:58:36.000Z,Seriously?  You’re gonna spend time and money on that while people dying of covid and starving children,,1348781388678443008
Petethecynik,2021-01-11T23:58:36.000Z,It was a political decision on the mask wearing. Not the science.  The end.,,1348781388225503235
dosbake,2021-01-11T23:58:36.000Z,I don’t remember the Colts having anything Covid related. I’m probably wrong but I just don’t follow them.,,1348781388103823361
TwiterHero,2021-01-11T23:58:36.000Z,Headlines: Japanese Scientists Find Variant of Coronavirus Different From UK and South Africa - HW News English  youtube.com/watch?v=wG0uyl … via  @GoogleNews,https://t.co/9vKO28Ude7 https://x.com/GoogleNews,1348781387839635457
gerardoalvmtz,2021-01-11T23:58:36.000Z,COVID-19 Champions,,1348781386723954690
R2_D2_YO,2021-01-11T23:58:36.000Z,Why are we even having a big public event? The pandemic is RAGING!  x.com/hugolowell/sta …,https://x.com/hugolowell/status/1348622597886521346,1348781386019315715
KDVR,2021-01-11T23:58:36.000Z,New COVID-19 vaccine trial opens in Colorado  trib.al/RgvkvQv,https://t.co/QDa7x5oLCQ,1348781385213947911
sserve,2021-01-11T23:58:35.000Z,The U.S. has administered 9.27 million doses so far. See more with Bloomberg's vaccine tracker.  bloomberg.com/graphics/covid … via  @bbgvisualdata,https://t.co/qQfwgqpl9s https://x.com/bbgvisualdata,1348781384916234240
BillGroner1,2021-01-11T23:58:35.000Z,It’s a game. In ‘16 the Dems threw a fit over Hillary losing...not a Trump scale fit but still objecting. Now in ‘20...fuel in covid restrictions...Fox’s need for ratings and the republicans are objecting fueled by Trump. I wish they’d let Biden start since Trump’s checked out.,,1348781384664539136
DHmpuk_inactive,2021-01-11T23:58:35.000Z,"ffs… dailymail.co.uk/news/article-9 … Could you get any lower,  @WMPolice , is that even possible?",https://t.co/pyGjjbWdpq https://x.com/WMPolice,1348781383255281664
qlomoney,2021-01-11T23:58:35.000Z,@WholeFoods  you guys suck at regulating covid procedures in your stores. Managers don’t seem to care that other customers won’t wear masks properly nor will they social distance. No wonder the health department keeps showing up,https://x.com/WholeFoods,1348781380994416641
mamadunn6,2021-01-11T23:58:34.000Z,"Disgusting, I can feel that vile smirk on his face through the mask.",,1348781379971031040
chasbottom,2021-01-11T23:58:34.000Z,"A visably confused and disoriented #JoeBiden gets second dose of COVID-19 vaccine. 'These things are great' he said with a grin, 'they keep you regular.' thesouthern.com/news/national/ …",https://x.com/hashtag/JoeBiden?src=hashtag_click https://t.co/Rmsjf6FDsw,1348781379224535048
Faffiiee,2021-01-11T23:58:34.000Z,Come through sis... once this panoramic lockdown is lifted,,1348781378603802626
dsnokc,2021-01-11T23:58:34.000Z,"Embarrassed to see several Congressmen refused to wear a mask while locked down for safety, including @RepMullin . Shameless and disappointing!  google.com/amp/s/www.buzz …",https://t.co/amip4Rd8VH,1348781378394062849
bostonandbaby1,2021-01-11T23:58:34.000Z,Healthcare Workers Are Refusing the COVID Vaccine Because No One Is Immune to Bad Ideas  vice.com/en/article/v7m … via  @vicenews,https://t.co/s8TtXXP76K https://x.com/vicenews,1348781378058522625
William57955160,2021-01-11T23:58:34.000Z,Fine but can we please have a virtual/remote inaugural bc we don’t want any people to be gathering during a pandemic. And the minute after you’re sworn in head right to work. There’s a lot to do and we don’t have a minute to spare.,,1348781377483927552
Independent,2021-01-11T23:58:34.000Z,Boom in wild deer numbers poses threat to woodlands  independent.co.uk/environment/co …,https://t.co/MNlzHOVUhm,1348781376988979201
joeydidthatwell,2021-01-11T23:58:34.000Z,"@JoeBiden  America, the world needs aditxscore, this is a game changer in the fight against covid, please look into it. Needs EUA approval and funding/fast track. Let’s goooo!!!",https://x.com/JoeBiden,1348781376833773569
shieldaroundme,2021-01-11T23:58:33.000Z,#PelosilovesTrump so much that she spends every minute of every day thinking about him.  Even when she is eating her $30 a pint ice cream & getting one of her beauty make overs  while not wearing a mask.,https://x.com/hashtag/PelosilovesTrump?src=hashtag_click,1348781376133230592
Angl3nA,2021-01-11T23:58:33.000Z,Two gorillas at San Diego Zoo test positive for COVID-19  reut.rs/38xzIje,https://t.co/w96mgvbIg0,1348781373121769472
Caromel1989,2021-01-11T23:58:33.000Z,That face mask is a hell of a flex!,,1348781372735946762
ShimSingh,2021-01-11T23:58:32.000Z,Covid-19: Government denies 'snubbing' BT's wi-fi for pupils offer  dlvr.it/RqN0zR,https://t.co/PG532betMk,1348781372307951616
Alyssaaah_,2021-01-11T23:58:32.000Z,I miss the days where I could put my fenty lip gloss on without a mask ruining it,,1348781371800621056
Tommynoo,2021-01-11T23:58:32.000Z,They took a reckless decision to appease electorate and interest groups; tragic miscalculation. Blaming Uk variant is all they have left.,,1348781371280527362
JMauro28,2021-01-11T23:58:32.000Z,"Real medical doctor who previously spread blatant falsehoods about COVID 19, then disavowed by his own university.... is concerned about his number of followers. Just FYI.  t.co/8Krl0m39WA",https://t.co/8Krl0m39WA,1348781369351147529
dartimist,2021-01-11T23:58:32.000Z,Two people in my circles have chosen to end their lives. I don’t know of anyone who’s died of Covid.  x.com/JohnMcEwen21/s …,https://x.com/JohnMcEwen21/status/1348767662730575873,1348781368357113859
bouncersdream1,2021-01-11T23:58:31.000Z,And how long the vaccine gives protection for,,1348781368034140161
nicholasphilp,2021-01-11T23:58:31.000Z,"I have a niece in Boston who is scheduled to fly to us 6th February...things are a little tense at present because her son is just over Covid, yet she & husband & daughter all living in the same house remained negative on all 3 tests! She must get a -ve test 72hrs before flying",,1348781366972874752
curiocat13,2021-01-11T23:58:31.000Z,"My family of 4 would scoff this in a day, two at the most. What kind of monsters shortchange the poor & most vulnerable in society like this, mid pandemic. #DickensianMonsters #ToryCorruption #UtterlyShameful #JohnsonGovtOut",https://x.com/hashtag/DickensianMonsters?src=hashtag_click https://x.com/hashtag/ToryCorruption?src=hashtag_click https://x.com/hashtag/UtterlyShameful?src=hashtag_click https://x.com/hashtag/JohnsonGovtOut?src=hashtag_click,1348781366931021829
CraigSobey,2021-01-11T23:58:31.000Z,"Would u please put ur mask back on to restrict ur oxygen & impair ur brain functions? Ur not supposed to think Comrade. U don't want to b on #dictatordan #omnibus? Best stay at home, watch #snakenews, #UN_THUNK & go to sleep.. #auspol #ccp #covid #hoax #muppets #un #WHO #gates",https://x.com/hashtag/dictatordan?src=hashtag_click https://x.com/hashtag/omnibus?src=hashtag_click https://x.com/hashtag/snakenews?src=hashtag_click https://x.com/hashtag/UN_THUNK?src=hashtag_click https://x.com/hashtag/auspol?src=hashtag_click https://x.com/hashtag/ccp?src=hashtag_click https://x.com/hashtag/covid?src=hashtag_click https://x.com/hashtag/hoax?src=hashtag_click https://x.com/hashtag/muppets?src=hashtag_click https://x.com/hashtag/un?src=hashtag_click https://x.com/hashtag/WHO?src=hashtag_click https://x.com/hashtag/gates?src=hashtag_click,1348781366029156352
harrybenbow,2021-01-11T23:58:30.000Z,trying to write but I can’t stop thinking about seeing brendan fraser in a movie again . real carrot and stick approach to make me get through this lockdown,,1348781363084853249
wezeldog,2021-01-11T23:58:30.000Z,"OH NO! Those sweet, sweet followers cut off in their prime. Idea. Just spit-balling. Let's develop a vaccine for that.",,1348781362145214466
hammerlady_1966,2021-01-11T23:58:30.000Z,I am exempt because I have COPD and REFLUX but I cough a lot. I alway wear a mask in shops to protect others.,,1348781361864331270
Mulletmobb,2021-01-11T23:58:29.000Z,Your getting this worked up because i didn’t research a photo of McGregor  your existence is false you hide behind mask because in reality your a loser... I love my life bro And I hope one day you find happiness then hopefully you won’t have to be nasty to strangers,,1348781358919917570
Mainkersh,2021-01-11T23:58:29.000Z,Sounds all a bit too familiar.... newstatesman.com/politics/uk/20 …,https://t.co/iZ7wcEqSsu,1348781358273982465
MakeupStorePRO,2021-01-11T23:58:28.000Z,"Oh dear, did Covid destroy all your brain cells.... Aw.",,1348781355652538369
pergolj,2021-01-11T23:58:28.000Z,"#MAGAts Dr. Faucci has been 100% correct about everything related to Covid. 375,000 dead. Won't take long to get to 400,000 with all the idiots refusing to wear a simple mask. Morons.",https://x.com/hashtag/MAGAts?src=hashtag_click,1348781355375550466
iamjohnk2,2021-01-11T23:58:28.000Z,"@RussellChillman The NBA season is going to be complete bullsh*t by the time it’s done. So many players missing multiple games due to Covid protocols, that they wouldn’t have otherwise missed. Messes with the integrity of team records. It was a bad idea from the start.",,1348781355329409024
T3MP3STT,2021-01-11T23:58:28.000Z,"Vaccines could conquer Covid today, cancer tomorrow   x.com/i/events/13486 …",https://x.com/i/events/1348666460323852288,1348781355128287232
HealthFreedomIE,2021-01-11T23:58:28.000Z,"If this were a real pandemic, this propaganda wouldn’t be necessary. For some perspective, only 6% of total cases have been hospitalised with 0.7% requiring ICU. Only 159 of the total 2263 COVID-19 decedents to date were admitted to ICU. hpsc.ie/a-z/respirator …",https://t.co/y5jjTDCbaj,1348781354008383490
MichelleMirand4,2021-01-11T23:58:28.000Z,‘Candle in a dark room’: Healthcare workers begin receiving 2nd dose of vaccine #TeamSutter  bit.ly/3i1QR7Q,https://x.com/hashtag/TeamSutter?src=hashtag_click https://t.co/86mmfBKoll,1348781353374863362
DebbieMonterrey,2021-01-11T23:58:28.000Z,"I miss  @circusflora ! There was no show under the Big Top  @GrandCenter  in 2020, but their Clowns on Call program continued on during the pandemic helping hospitalized kids.  @KranzbergArts    kranzbergartsfoundation.org/2021/01/11/cir …",https://x.com/circusflora https://x.com/GrandCenter https://x.com/KranzbergArts https://t.co/zhRMIc0s3t,1348781352171266048
22Pats1,2021-01-11T23:58:28.000Z,Invest in a COVID Herd Immunity business where for a fee people can pack themselves ina small room without masks.,,1348781351865094145
peoplestownhall,2021-01-11T23:58:27.000Z,"also seems like they must compare sales to the past, which might rule out any restaurants that opened up during this pandemic.",,1348781349231013889
stufalk,2021-01-11T23:58:27.000Z,"In Kashmir’s Stillness, Hopes Wither and Houseboats Sink. The turbulent region has long weathered violence and political strife, but India’s security crackdown and the coronavirus have brought life in the tourist-dependent region to a near halt.   nytimes.com/2021/01/11/wor …",https://t.co/cWGwqY9uzn,1348781348975046656
TravelandHome_,2021-01-11T23:58:27.000Z,What new #coronavirus rules could #Switzerland announce this week?  thelocal.ch/20210111/what- …,https://x.com/hashtag/coronavirus?src=hashtag_click https://x.com/hashtag/Switzerland?src=hashtag_click https://t.co/TZ10WxsEzn,1348781347385565184
acgonthier,2021-01-11T23:58:26.000Z,On the lighter side - Through this pandemic I've developed two new skills. The first is starting to play the piano (emphasis on starting) and the other is to communicate in GIFs. I'm definitely more adept on the latter. #WhoElseUsesGIFs,https://x.com/hashtag/WhoElseUsesGIFs?src=hashtag_click,1348781347142324225
micheltcosta,2021-01-11T23:58:26.000Z,COVID-19,,1348781346764763137
DrStephenLeeb,2021-01-11T23:58:26.000Z,HOW YOU CAN PROSPER IN A SHATTERED ECONOMY You already know about the devastating pandemic we were amidst... which is also why you should know we are headed for a #recession and #Economic implosion worse than the #tech #bubble  StephenLeeb.com,https://x.com/hashtag/recession?src=hashtag_click https://x.com/hashtag/Economic?src=hashtag_click https://x.com/hashtag/tech?src=hashtag_click https://x.com/hashtag/bubble?src=hashtag_click https://t.co/3EKNiwHjPC,1348781345133088768
hitchenstribute,2021-01-11T23:58:26.000Z,When are you going to start delivering COVID TESTS to your employees?,,1348781344520720384
wormbucket1845,2021-01-11T23:58:26.000Z,That's true the flu is much more deadly for children and young adults than covid. It's the opposite for the elderly.,,1348781344013365250
smallpoisons,2021-01-11T23:58:26.000Z,every single time  my mom will be like can you stop touching stuff and it's hard with covid now too cause im not sure about surfaces,,1348781343484862464
Benchwarmerz1,2021-01-11T23:58:25.000Z,You really think closing down during a pandemic was all political? Not to save any lives like literally every country in the world?,,1348781342658424835
erinncahill_,2021-01-11T23:58:25.000Z,Bear in the big blue house coulda had this covid-19 shit sorted in one episode...tell me I’m wrong,,1348781341073154048
popey0266,2021-01-11T23:58:24.000Z,"Gluttony, greed, sloth, pride, envy, wrath, lust. 6 of these constantly showing on Twitter at the moment and one banned unless you wear a face mask",,1348781338627858433
e_snacks,2021-01-11T23:58:24.000Z,"And look at THIS fierce raving beauty who now has Covid because her COLLEAGUES wouldn't wear masks while locked in a room hoping not to be ambushed!!! Traitors, cowards, losers, zombies.",,1348781338296537088
UKCryptoKing247,2021-01-11T23:58:24.000Z,"The tests dont work, the track and trace doesnt work, what about the vaccine? You make a good point, but its probably for the best.",,1348781337830944772
DionysusElegu,2021-01-11T23:58:24.000Z,"From ppl who think masks work, when there is & never has been clear evidence - look at what's happened to cv 'cases'. Think about why you believe masks work, stop taking the easy route & criticising those who don't mask, like me, who're aren't going to ever explain why to you...",,1348781337319243777
GlockySaquon,2021-01-11T23:58:24.000Z,They giving 1000 racks to test out the covid vaccines . ???? SIGN ME THE FUCK UP,,1348781337302495232
slackactivist,2021-01-11T23:58:24.000Z,@the_tpa    Can you direct me to your critical investigation of the govt's processes for issuing contracts to private firms and corporations for covid related expenditure and of your surveillance of the govt's use of taxpayer funds for these purposes?,https://x.com/the_tpa,1348781336971141121
dr0lst0n,2021-01-11T23:58:24.000Z,"Country struggles with vaccination of it's citizens.   We shouldn't be talking about this but simply do something about it.     Its just the logistics of an entire vaccine delivery system.    We can fucking do this, the answer is math and science.",,1348781335805009921
Aaron_Oathout,2021-01-11T23:58:24.000Z,Need that vaccine fr,,1348781335259860994
xtavex,2021-01-11T23:58:23.000Z,Dis year we livin in the moment not for the future cus next thing u know you’re In a lockdown for a year cus of a pandemic,,1348781332206284802
NYNHCARE,2021-01-11T23:58:23.000Z,You would have a better chance of winning the NYS Lottery than you would getting a COVID vaccine.,,1348781332097327105
abreucarol_,2021-01-11T23:58:22.000Z,"nobody, absolutely nobody: a  me: did  @antsharwood  made ‘coxinha’ during the quarantine?",https://x.com/antsharwood,1348781328804798464
candlekwan,2021-01-11T23:58:22.000Z,imagine an idol on masked singer. but wearing a plague doctor mask.,,1348781328238473217
marctoronto,2021-01-11T23:58:22.000Z,Please look at pressure on health canada for at-home antigen rapid tests. One of few remaining tools that can help break chains of spread at reasonable cost and easy to implement.,,1348781327970148353
sho0onya,2021-01-11T23:58:21.000Z,"Our real pandemic is not #covid, its #covidiots. Whichever country has MORE of them, they are sadly taking the brunt. Once covidiots are controlled, covid is easy to control. The same applies to counties/states within a country like US-",https://x.com/hashtag/covid?src=hashtag_click https://x.com/hashtag/covidiots?src=hashtag_click,1348781325860397056
Cheermaster500,2021-01-11T23:58:21.000Z,Damn it thank you coronavirus ugh!,,1348781325344514050
cry_fieri_,2021-01-11T23:58:21.000Z,@boxycharm  is wild for having jet lag mask for $12 but yes I bought 2,https://x.com/boxycharm,1348781325323546627
PatrickBrangan,2021-01-11T23:58:21.000Z,"Covid antibodies now still live going on 8 months now ... I guess the ""experts"" on immunity were wrong again",,1348781324639870976
HannahNickeya,2021-01-11T23:58:21.000Z,Forget the pandemic for a moment... let’s about this attack that’s being planned,,1348781324035715072
blacbutterflies,2021-01-11T23:58:21.000Z,honestly might come out of lockdown 3.0 with the other side of my nose pierced if i stop being a pu$$y,,1348781323574509575
_thislineismine,2021-01-11T23:58:21.000Z,I'm so anxious I'm going for return to work and give someone Covid. This shit is so contagious,,1348781322752372741
dianejarrell5,2021-01-11T23:58:21.000Z,"What’s the hypocrisy?  Supporting any means of curbing the spread of Covid which is killing 4000 people a day.  Or Agreeing with private businesses, Republican seditionists should not be rewarded for insurrection?  Hmmm",,1348781322253307904
MiramichiLeader,2021-01-11T23:58:21.000Z,Pandemic-induced virtual racing to continue in 2021  bddy.me/2Lg4sfX,https://t.co/I0orQySlnY,1348781322144280576
DrewTheShim,2021-01-11T23:58:20.000Z,"So what's the point of a Vaccine if the vaccine itself technically doesn't do anything for you? Please someone explain this shit. Because all im hearing is excuses to pump you full of someshit  they call a ""vaccine""",,1348781321481555971
RuffShenanigans,2021-01-11T23:58:20.000Z,Someone should tell Lindsay Graham since Sherrod Brown just said on MSNBC he was screaming less than 6 feet away without a mask at a Capital Police officer about why they weren’t protecting the Senators better,,1348781321146011648
MrKrisMcD,2021-01-11T23:58:20.000Z,"Me too. Nurse comes in. ""do you have a mask?"" / no but I have this lanyard / whats wrong? / well ur not allowed to ask but it's for XXXX / could you not just wear one for a few minutes while I take your blood sample / no, sorry / session continued in awkward silence. A nurse !!",,1348781320466440196
UbaidKhan1281,2021-01-11T23:58:19.000Z,"For some, these Covid masks are a real blessing, aren't they?",,1348781316591022080
vksandhumd,2021-01-11T23:58:19.000Z,"Please be smart, people. You see a pop up tent that says ‘free covid test’ on a hand written board, you should question it. Shut down by police.  #cityofcorona #neighborhood #covid",https://x.com/hashtag/cityofcorona?src=hashtag_click https://x.com/hashtag/neighborhood?src=hashtag_click https://x.com/hashtag/covid?src=hashtag_click,1348781316364406786
DrSalliePNP,2021-01-11T23:58:18.000Z,I saw your bio said covid orphan. Sending comfort and peace vibes.,,1348781310987431937
CharlieHardbake,2021-01-11T23:58:17.000Z,"No. But I for one could see that some of his decisions were most certainly coloured by his views. I think his decisions were instrumental in it taking so long to deliver Brexit. Which incidentally, had it been delivered sooner we’d be over the hump before the Coronavirus pandemic",,1348781308152066054
TNTDOC1,2021-01-11T23:58:17.000Z,"Wearing masks & social distancing help reduce your chance of being exposed to the virus or spreading it to others, but these measures are not enough. Vaccines will work with your immune system so it will be ready to fight the virus if you are exposed.  cdc.gov/.../vaccines/v …",https://t.co/AmD1LH9SWd,1348781307854266368
Canoe,2021-01-11T23:58:17.000Z,Two gorillas at San Diego Zoo test positive for COVID-19  canoe.com/news/world/two …,https://t.co/V7sihW7BjA,1348781307288023041
studiodancewear,2021-01-11T23:58:17.000Z,Oh she’s beautiful  I’ve everything crossed for schools reopening in the not too distant future.,,1348781307099111424
Seredynskyi,2021-01-11T23:58:17.000Z,"You prohibited the mass distribution of life-saving vaccines. Reports of dumped doses as they couldn’t find potential patients. You have failed New York State on every corner possible. It started with deadly Covid patients in nursing homes, and you still make bad decisions.",,1348781306814070786
hey_connie_,2021-01-11T23:58:17.000Z,"I... didn’t even understand what you said.  But if a mask “dehumanizes” you, sounds like you’ve got bigger issues.",,1348781306784620546
mansoor__A,2021-01-11T23:58:17.000Z,Definitely reporting this to KDSG.  you're violating COVID protocols,,1348781305530634242
bunnitale,2021-01-11T23:58:17.000Z,Dream Heatwaves Fan-art. (DNF) (This is my first true attempt at drawing fanart so don't judge me if it isn't the best- I also wanted to draw the mask somewhere but i didn't know where so yk),,1348781305442541588
TheLeftyLuke,2021-01-11T23:58:17.000Z,Fun fact: I recorded and shot a “quarantine cover” video of First Date by Blink-182 back in May/June.   Pulled it b/c there were more important conversations that needed to be had than goofy #poppunk covers.   Maybe we’ll resurrect it sometime this year? Drop a  if you’d watch,https://x.com/hashtag/poppunk?src=hashtag_click,1348781305417314311
79jordanm,2021-01-11T23:58:16.000Z,Covid would probably be a more knowledgeable field for you. You can’t be a professor of everything,,1348781303529922564
James27932526,2021-01-11T23:58:16.000Z,It also deals with long covid  2x 6mg per day  Vit d ...depending on deficiency ( blood test ) Zinc unknown amount prob one a day I don't wanna break the law  But this is what I see,,1348781302074531841
S550_Leo,2021-01-11T23:58:15.000Z,If you go to a any of these you have covid,,1348781300698771457
TheThomahawk,2021-01-11T23:58:15.000Z,"No bit we also don't completely kill our economy for the flu ever year either. Covid is probably going to be like the flu, get a shot every year or don't up to you, and everything goes back to normal. Sooner everyone realizes this the better.",,1348781299557920769
mylesmill,2021-01-11T23:58:15.000Z,"his boss has coronavirus, he has the responsibility of leading the entire department, and qualifies. don’t see an issue.",,1348781299432001537
dyn_5V,2021-01-11T23:58:14.000Z,That green tea mask brand must be a industry plant. Seeing everyone & everything promote that brand,,1348781295468470272
simon2307,2021-01-11T23:58:14.000Z,"Five ways to manage your screen time in a lockdown, according to tech experts  theconversation.com/five-ways-to-m … via  @ConversationUK",https://t.co/QQUoDq9d4t https://x.com/ConversationUK,1348781293992079381
GimmeDeezy,2021-01-11T23:58:14.000Z,Prolly gonna get that vaccine next couple months,,1348781293467705346
TarnueSeepah,2021-01-11T23:58:14.000Z,“In the middle of a pandemic?” bitch stfu and suck my balls,,1348781293283074048
DeejayChrisJohn,2021-01-11T23:58:13.000Z,Bring Your Mask,,1348781292465364995
Christi90711921,2021-01-11T23:58:13.000Z,"Lots to unpack here. The Democrats wanted everybody to wear a mask so that the virus wouldn’t spread and everyone could go about their business. Unfortunately, Trump pooh-poohed masks and, here we are. Over 350,000 Americans dead.",,1348781290066243584
tshawn1212,2021-01-11T23:58:13.000Z,"AZDHS has a lot of info, locations and pre-registrations  azdhs.gov/documents/prep …",https://t.co/9vAkyOKAqd,1348781289826967552
allard_wanda,2021-01-11T23:58:13.000Z,Today in the Farm Boy beside Lisgar (block away from Elgin) a middle aged man was not wearing a mask inside.  2 staff persons tried to get him to mask up.  Inside the dollar store on Elgin customers removed & pocketed their masks out of sight of staff.,,1348781289722273794
repooc211,2021-01-11T23:58:12.000Z,Not being facetious. Someone explain the logic behind reduced hours = reducing risk of Covid spreading? Doesn’t this equate to a greater density of people in a business if their hours are reduced?,,1348781288518541312
DuaneABentley,2021-01-11T23:58:12.000Z,Question: is it COVID deaths?  Why:  Does no one know a COVID fatality that was health and young   And  Why are the annual death numbers consistent INCLUDING THIS YEAR???,,1348781285741793280
LibDemsStIves,2021-01-11T23:58:12.000Z,Munira questions Govt on problems in Covid-19 vaccination supply chain  ift.tt/3bzqrsL,https://t.co/0i5rYTyrxK,1348781285511196677
CotoBlogzz,2021-01-11T23:58:12.000Z,"Come on Kim: It was NEVER  about Trump the pandemic or the opposition  It's about absolute power  Trump warned us- but MSM, Dems & RINOs mocked him  Today BigTech came after Trump & his supporters.   Tomorrow they will purge liberals &MSM   #AOC won't survive   #WAPO may",https://x.com/hashtag/AOC?src=hashtag_click https://x.com/hashtag/WAPO?src=hashtag_click,1348781284764446721
sstat1948,2021-01-11T23:58:11.000Z,And you’ll be able to afford it because all the seniors will be dead from Covid because you didn’t provide vaccine in time. Hope you sleep at night. Not,,1348781283208556545
CFRAOttawa,2021-01-11T23:58:11.000Z,Some Canadian snowbirds are still flying south this winter and there are those who are hoping to get a COVID-19 vaccine while they're there. #ottnews  iheartradio.ca/580-cfra/news/ …,https://x.com/hashtag/ottnews?src=hashtag_click https://t.co/gLutqp6yAN,1348781282919067648
