User_name,Datetime,Content,Links,Tweet_ID
Barrabarra5,2021-01-11T23:58:58.000Z,". @SenSherrodBrown  said just now on  @AriMelber  that during the mob riot  @LindseyGrahamSC  took his mask off and shouted at #CapitolPolice ”Why didn’t you protect us, that is your job!”  Hey Lindsey— America asks: “Why didn’t you protect us, that is your job!”",https://x.com/SenSherrodBrown https://x.com/AriMelber https://x.com/LindseyGrahamSC https://x.com/hashtag/CapitolPolice?src=hashtag_click,1348781479912996872
AlilemMPS,2021-01-11T23:58:58.000Z,Dialogue conducted to a walk-in client of the station re COVID-19 health protocols  and republic act 8353 the Anti Rape Law.   @pnpdpcr  @pro1officialtw  @isurppo,https://x.com/pnpdpcr https://x.com/pro1officialtw https://x.com/isurppo,1348781479493398529
LanakilaMiller,2021-01-11T23:58:58.000Z,Not soon enough. You should have been out in the office back in November & many of these events wouldn’t have happened. Possibly many people wouldn’t have died from CoVid either.,,1348781479254396928
sam_laughs,2021-01-11T23:58:57.000Z,Wear a mask so I can watch my  @PredsNHL  x.com/scruched/statu …,https://x.com/PredsNHL https://x.com/scruched/status/1348332172575453184,1348781475882291205
Carrie51205847,2021-01-11T23:58:57.000Z,I have extreme Sjorgens syndrome! I don’t make saliva and a mask makes things impossible! I’ve had to start taking Pilocarpine gain( horrible side effects) due to wearing a mask!,,1348781475299262465
rajasekharaa,2021-01-11T23:58:57.000Z,US House member tests positive for COVID-19 after Capitol siege  subhodayamsubbarao.com/us-house-membe …,https://t.co/jCGED9HQKQ,1348781474619813888
Cerri,2021-01-11T23:58:57.000Z,Awesome.. Also great mask!,,1348781473436987394
DzLe77,2021-01-11T23:58:56.000Z,"Refer to Slovakia, the country ordered shutdown the whole country for some weeks and mass tested all population with antigen, where they are now? Bad. Set the target, find out how to get it perfectly and how to maintain it?",,1348781472782503936
sandykxo_,2021-01-11T23:58:56.000Z,"Im not having a baby shower bc I’m scared of covid, I’m not having one bc the nurses looked me dead in my face and told me how horrid your delivery will be so if you test positive. From HAVING to wear a mask while laboring to NOT being able to leave the maternity unit.",,1348781472568782849
clam_pie,2021-01-11T23:58:56.000Z,"Online returns can cost retailers $10–20/item.   Return rates normally hover between 25–30% but more online shopping and bracketing (buying multiple sizes of the same item) during the pandemic have pushed that percentage higher. In 2020, returns rose 70% year-over-year.",,1348781470865739776
seeker375,2021-01-11T23:58:56.000Z,"Albert Einstein, probably the world's greatest ever scientist, said to doubt was to be human. He never subscribed to absolutism... So many do in the age of Covid. That belief system should be a warning to all humanity... #YardleyYeadon #SackVallance #SackWhittty #DirtyWarontheNHS",https://x.com/hashtag/YardleyYeadon?src=hashtag_click https://x.com/hashtag/SackVallance?src=hashtag_click https://x.com/hashtag/SackWhittty?src=hashtag_click https://x.com/hashtag/DirtyWarontheNHS?src=hashtag_click,1348781470593261568
LauraJoanKraft,2021-01-11T23:58:56.000Z,"The pandemic sucks, but I just had the most wonderful birthday that I have ever had with friends who were happy to text, doorbell drop gifts, and do a masked and distanced walk!   We can do this, folks. #SoGrateful #PositivePandemicMemories",https://x.com/hashtag/SoGrateful?src=hashtag_click https://x.com/hashtag/PositivePandemicMemories?src=hashtag_click,1348781470530367488
milliejeram,2021-01-11T23:58:56.000Z,"So I’m covid positive, and fell asleep at 10 to 9. Mum just wakes me up all ppe’d up by popping her head through the door like ‘you okay babes? I’m going to bed now’ yeah cheers mum hun but I was asleep",,1348781470211575808
theotherdraper,2021-01-11T23:58:56.000Z,"As public data is being used for tracking terrorists to COVID, it begs tomorrow’s question “Law, Tech, and Justice: How Much is Public Data Worth?” Jan 12 at 5:00 PM CST on  @joinclubhouse . Join us!  joinclubhouse.com/event/VxLAz2KM",https://x.com/joinclubhouse https://t.co/zjduvuhWnv,1348781470006050817
BernadetteFry18,2021-01-11T23:58:55.000Z,"Open SmartNews and read ""L.A. is overwhelmed. How Sacramento hospitals are trying to avoid their own COVID crisis"" here:  share.smartnews.com/x8a2  To read it on the web, tap here:  share.smartnews.com/QrUX",https://t.co/qrzJOejlPh https://t.co/vXYViRs7uJ,1348781467262881795
BaybuttDave,2021-01-11T23:58:55.000Z,. It starting to drive me insane seeing all the mask wearer's,,1348781466843566081
Yozons1,2021-01-11T23:58:55.000Z,"Still counting the obese and sickly three Americans?  I guess it works for Covid death counts, too.",,1348781466793111552
enrej,2021-01-11T23:58:55.000Z,"Although I’m sad about no real carnival season this yeAr, I’m glad about it for several reasons. 1. People will be disgustingly close and drunk  2. I’m not ready for all that. 3. Dancing and walking for 10 miles with a mask on will be hell...",,1348781466763882505
JoyceSmileBig,2021-01-11T23:58:55.000Z,#NoFlyLists #NoFlyList has had my attention all day. Love seeing them cry. Remember how they cried their freedom was being taken away cause they didn't want to wear mask? Now they can't fly and this one in jail tells his mommy he won't eat. Hi karma! x.com/RexChapman/sta …,https://x.com/hashtag/NoFlyLists?src=hashtag_click https://x.com/hashtag/NoFlyList?src=hashtag_click https://x.com/RexChapman/status/1348758639071404032?s=19,1348781465274867716
gupdiver,2021-01-11T23:58:54.000Z,New York Gov. Andrew Cuomo gets heat for apparent pivot on reopening economy foxbusiness.com/economy/new-yo …,https://t.co/s16LcX7T6o,1348781464385683459
JillianKozyra,2021-01-11T23:58:54.000Z,"Honestly, I don't know _who_ thought this was a good idea.  theguardian.com/world/2021/jan …",https://t.co/Nz4fOfQ0LG,1348781464368738304
whdumpsterfire,2021-01-11T23:58:54.000Z,"Please don't get me wrong. We order out from the same restaurants we were eating in pre-COVID, and we are leaving the same 20-25% tip. I'm fortunate to have a job not affected by COVID so my stimulus check is donated to my local food bank.",,1348781462921891840
verroox_,2021-01-11T23:58:54.000Z,yea we need that lockdown,,1348781462443667458
dinixluna,2021-01-11T23:58:54.000Z,How y’all more scared of Lysol than Covid  x.com/JupiterDreamCo …,https://x.com/JupiterDreamCo/status/1348676497859620866,1348781461772578818
solidstomak,2021-01-11T23:58:54.000Z,Which vaccine did you get? O: I got the first dose of Moderna. But still waiting for the second dose. First dose wasn't bad,,1348781461743173633
JasonSheridan,2021-01-11T23:58:54.000Z,I think I should get the vaccine before anyone who attended the Capitol Riot.,,1348781461344645120
starwarspoli,2021-01-11T23:58:53.000Z,???? wanna clarify on that 4th point or is it just mask off now?  x.com/prageru/status …,https://x.com/prageru/status/1348778387335118848,1348781460359176193
PegasusFly_,2021-01-11T23:58:53.000Z,"And then today we have Trump being pushed towards an impeachment, Illinois COVID cases slowing down, and Rudy Giuliani possibly being expelled from the bar in NYC?  That's a great day all around.",,1348781459725815809
Doink69940008,2021-01-11T23:58:53.000Z,"Why should ""non mask wearers"" be allowed to potentially spread a deadly virus?",,1348781457620291590
djaplasticman,2021-01-11T23:58:53.000Z,"Couple cocktails a beer ,Insurrection/pandemic  Monday, excuuuuuse me. Ask Andi.",,1348781457192476674
DiOgEnE_O_0_LaE,2021-01-11T23:58:53.000Z,Yankee's propaganda at it's best !  Headlines : the Chinese vaccine is garbage.  The article : two anonymous worker's at chitty local news paper tell as that they think it's ineffective ! And brazilian's health authority call it speculation and shit talking !,,1348781456403922951
Viper_3276,2021-01-11T23:58:52.000Z,So they had to shut down the steelers facility because of covid.What if somehow they can prove this was passed on by the Brown's.,,1348781455418273795
jane61991507,2021-01-11T23:58:52.000Z,Covid cures the seasonal flu. Amazing. Science wins again.,,1348781455195967488
Hed4k,2021-01-11T23:58:52.000Z,I would rather have the vaccine at my local GP surgery and not at a mass vaccine centre. I know it would be done in a safe way as they did the flu vaccines.,,1348781454306795527
CarlZha,2021-01-11T23:58:52.000Z,BBC’s  @StephenMcDonell  went in search of Chinese public opinion post-COVID,https://x.com/StephenMcDonell,1348781454180851712
cuppycup,2021-01-11T23:58:52.000Z,have to get that tactical vaccination  x.com/Ad_Inifinitum/ …,https://x.com/Ad_Inifinitum/status/1348654332187713537,1348781452889120769
BournJoe,2021-01-11T23:58:52.000Z,The build-to-rent market was already on fire and then the pandemic poured gasoline on it! ow.ly/GSKO50D5Q2Y,https://t.co/6lb996yTni,1348781452532592643
VictoryStoned,2021-01-11T23:58:52.000Z,I let it slide bc of last night but leave the mask alone it’s my pops. Lol,,1348781452218036225
taplier,2021-01-11T23:58:51.000Z,@1250AMTheFan I almost made it through the first episode of the new 2:00-6:00 show but just can’t handle another hour of Covid talk. I’ll still listen to The Big Show though.,,1348781452046061568
richardzussman,2021-01-11T23:58:51.000Z,"On running out of Pfizer vaccine, Dr. Henry says the Moderna vaccine is committed. Says they are trying to be nimble with federal partners. #bcpoli",https://x.com/hashtag/bcpoli?src=hashtag_click,1348781449999130624
EdDole3,2021-01-11T23:58:51.000Z,"It’s ok if you did, we will put you on the right claim as long as you are affected by COVID. If you are not then you might receive a disqualification notice. For now it’s best to wait to receive the info that your claim was filed.",,1348781448929501184
JFC_risTINA,2021-01-11T23:58:50.000Z,"After 5 years of cravenness & complicity,  @LindseyGrahamSC  with his spine made of gypsum dust, had the audacity to scream (mask less) in the face of a Senate officer that he failed to protect them. SHAME ON YOU.  #InvestigateLindseyGraham #AccountabilityBeforeUnity",https://x.com/LindseyGrahamSC https://x.com/hashtag/InvestigateLindseyGraham?src=hashtag_click https://x.com/hashtag/AccountabilityBeforeUnity?src=hashtag_click,1348781447826571264
Paul__Bee,2021-01-11T23:58:50.000Z,"This pandemic will continue unless measures are put in place to help everybody. In the main people are respecting lockdown. The rules aren't clear enough. Essential is not both you & your partner shopping, when one of you could go. 3 million have no option but to carry on working",,1348781447717543941
GPBikeStation,2021-01-11T23:58:50.000Z,PM under pressure over bike ride seven miles from No 10  theguardian.com/politics/2021/ …,https://t.co/wJIgsClR18,1348781447142895616
aleelucero_,2021-01-11T23:58:50.000Z,Not Univision showing Maria Antioneta getting the COVID vaccine to show Hispanics that if she got it yall should to,,1348781446878670850
Nattie_Wiz,2021-01-11T23:58:50.000Z,"You never called it a Chinese Covid-19. Respect my country South Africa, and her people.",,1348781446857711618
BFHD,2021-01-11T23:58:50.000Z,"Add #WANotify to your smartphone today. It is a new, private way to help stop the spread of COVID-19. The more people who use it, the more effective it is. For more information visit  wanotify.org",https://x.com/hashtag/WANotify?src=hashtag_click https://t.co/CF8e0uNLcP,1348781446094315520
Amie_Just,2021-01-11T23:58:49.000Z,"NEWS | The Saints made more roster moves today in addition to signing two veteran specialists.  For one, D.J. Swearinger is off the COVID-19 list.  All the moves: nola.com/sports/saints/ …",https://t.co/yU0vfhMY9m,1348781443217035271
ChrisBaker67,2021-01-11T23:58:49.000Z,On sky your Chief Exec Simon Roberts said security guards on the door WILL be enforcing mask wearing. Is this true now?,,1348781442965319680
cob1706,2021-01-11T23:58:49.000Z,"What do you care, you don’t require your doctors or surgeons or dentists to wear a mask because, according to you, they DON’T WORK!",,1348781442847764480
jaquix173,2021-01-11T23:58:49.000Z,"Mark McGowan has kept his state virus free, and economy continue, people move freely without fear of being infected.  NSW has put economy/ideology first, people second. Mark is right they should look at other states but their arrogance wont allow it. Worst Covid mgmt in Australia",,1348781441144877057
NickCorrigall,2021-01-11T23:58:49.000Z,"If people get to believe that COVID is caused by 5G and the lizard people, I get to believe this man tazed his balls",,1348781439970586624
ivanhoeinstitut,2021-01-11T23:58:48.000Z,"We Can Change | Change is easy, impactful, and immediate when attached to a higher normalization of nature's truth.    method41.com/blog/2021/01/w … #Constitution #Coronavirus #Freedom #GeorgeCarlin #Global #Government #Humanity #USA #WashingtonDC",https://t.co/gWYLhp8qVE https://x.com/hashtag/Constitution?src=hashtag_click https://x.com/hashtag/Coronavirus?src=hashtag_click https://x.com/hashtag/Freedom?src=hashtag_click https://x.com/hashtag/GeorgeCarlin?src=hashtag_click https://x.com/hashtag/Global?src=hashtag_click https://x.com/hashtag/Government?src=hashtag_click https://x.com/hashtag/Humanity?src=hashtag_click https://x.com/hashtag/USA?src=hashtag_click https://x.com/hashtag/WashingtonDC?src=hashtag_click,1348781439106560008
Andy_Wheatley,2021-01-11T23:58:48.000Z,The swivel eyed COVID denying loon force is strong tonight.,,1348781438292914178
RaquelDobson,2021-01-11T23:58:48.000Z,"Ah, but ‘which’ vaccine?...",,1348781435877023744
FUFowlers,2021-01-11T23:58:47.000Z,Putting Covid 19  deaths in UK into historical perspective.....  This looks at the many different (and I do mean many!) ways of comparing  all cause  deaths in 2020 to previous 180 years...... Plenty of charts and comparisons,,1348781435067502599
GinCO06814304,2021-01-11T23:58:47.000Z,Cool story pumpkin.  Now do the 26 deaths due to BLM and antifa,,1348781434681622528
bellacharlie,2021-01-11T23:58:47.000Z,"Yes, they can be a nuisance and steam up glasses but I fail to see why healthy people are so anti mask. Most people are only on a food shop for 1/2 hour getting essential goods, that’s not long, unless you really can’t tolerate a face mask.",,1348781433846984705
taurianarex,2021-01-11T23:58:47.000Z,"first plan of action once COVID is ""over"" is to hit a  @dannydiamondss  concert",https://x.com/dannydiamondss,1348781433578516480
Samara_Salene,2021-01-11T23:58:47.000Z,Ppl over lockdown,,1348781432940990468
WendyWendy77581,2021-01-11T23:58:46.000Z,Healthcare Workers Are Refusing the COVID Vaccine Because No One Is Immune to Bad Ideas  vice.com/en/article/v7m … via  @vicenews,https://t.co/vyKYa8MNPH https://x.com/vicenews,1348781429124194304
EndangeredDogs,2021-01-11T23:58:46.000Z,One of our golden oldie  girls resting up after a busy and relaxing day walk during #lockdown #adoptadog #dogfoster #rescuedogsrock,https://x.com/hashtag/lockdown?src=hashtag_click https://x.com/hashtag/adoptadog?src=hashtag_click https://x.com/hashtag/dogfoster?src=hashtag_click https://x.com/hashtag/rescuedogsrock?src=hashtag_click,1348781428994142217
shegatsby,2021-01-11T23:58:46.000Z,"Search for vaccine online, said Dr. All appts. were in NYC. Nothing in Rochester for my 80-year-old husband—NYC for all—not NY. #nygovcuomo #vaccinateny",https://x.com/hashtag/nygovcuomo?src=hashtag_click https://x.com/hashtag/vaccinateny?src=hashtag_click,1348781428624932864
AlexPeresviet,2021-01-11T23:58:45.000Z,"The manufacturers spoke to the lobbyists about profits, the lobbyists spoke to Biden's controllers and then Biden announced after he's sworn in, another 100 days of mask sales will be mandatory.",,1348781425928056833
HonorHarley,2021-01-11T23:58:45.000Z,Excited for people who think they’re hard for not wearing a mask to either sort their shit out or starve,,1348781424057450498
Vie_matongo,2021-01-11T23:58:45.000Z,"I heard everything, tell people to mask up and sanitize hawu. Covid is personal, the president is on leave but he spends much time in office. Be responsible wena self.",,1348781423189086208
Linaazlina7,2021-01-11T23:58:44.000Z,Yes it's True.Always wearing a mask in public to help slow the spread of #COVID19.Let's do it.#StaySafe#StayHealthy.,https://x.com/hashtag/COVID19?src=hashtag_click,1348781421440102400
RTT_Amherstburg,2021-01-11T23:58:44.000Z,Prue does praise Richmond Terrace Long Term Care Home for its efforts amid the ongoing #COVID19 pandemic.  #Amherstburg,https://x.com/hashtag/COVID19?src=hashtag_click https://x.com/hashtag/Amherstburg?src=hashtag_click,1348781420978823168
CatherineRotteM,2021-01-11T23:58:44.000Z,Full report from  @rtenews  @sharontobin  about the #COVID19 frontline stress in this third wave. Includes my comments on impact on PHN services.  @INMO_IRL  great to get this highlighted. #StayHome  ‘Weekend from hell' - on the frontline of Covid-19  rte.ie/news/coronavir … via  @rte,https://x.com/rtenews https://x.com/sharontobin https://x.com/hashtag/COVID19?src=hashtag_click https://x.com/INMO_IRL https://x.com/hashtag/StayHome?src=hashtag_click https://t.co/kuewt6RQSv https://x.com/rte,1348781420332933121
bffheejin,2021-01-11T23:58:44.000Z,just told dad i wanna stay at home for second yr to build a pc   he didnt say no...,,1348781419003314176
docscott31,2021-01-11T23:58:43.000Z,"I admire your optimism, but why do you think everyone will be vaccinated on time with this Governments track record? And also there are a lot of people who wont get vaccinated. Plus we don't even know if the vaccine works against the new strains.",,1348781417631805444
_linds_linds,2021-01-11T23:58:43.000Z,You trynna be a stay at home dad. My income was your best shot. NEXT,,1348781416662777856
jarzinio53,2021-01-11T23:58:43.000Z,"Merkeydive Police have form when it comes to forgiving their The police didn't object to Atletico Madrid bringing their Covid-19 carrying Fans to Anfailed When, Circa 20,000, of their unclean Fans celebrated outside their ground, in Pubs and in other public spaces Didn't care",,1348781416549670920
BookAddictGrrl,2021-01-11T23:58:43.000Z,"So how is it that ANYONE was allowed on the Senate floor maskless? Wtf! I can't make a move outside my house without a mask and even if I could, I love my friends & family & would NEVER put them in harm's way.  abc7ny.com/nj-covid-updat …",https://t.co/Y90V6slA7x,1348781416251850759
ElloughtonPS,2021-01-11T23:58:43.000Z,"Well done to all our children both at home and in school for yet again rising to the challenges of lockdown. So very proud of you all. Thank you to our parents for your support, patience and understanding.",,1348781415593336839
WendyGoodes,2021-01-11T23:58:42.000Z,"I disagree with the waiting most definitely. I do know that in my area, our Food Bank got flooded with all the extra food that restaurants couldn’t use in the first lockdown. It was sad for them to have to get rid of all their food supplies. It did go to great use.",,1348781414280519681
mrspsaloha,2021-01-11T23:58:42.000Z,@JustinTrudeau  where are the covid vaccines ???,https://x.com/JustinTrudeau,1348781414213427203
Flashma78139552,2021-01-11T23:58:42.000Z,"And why is that Khan? Give us all a clue! How about moving them all out of London? Perhaps making the BAME stay at home completely.  No exercise, only home delivered shopping? Would you like that? What DO you want! Tell us please!",,1348781413173231622
lauren_m1212,2021-01-11T23:58:42.000Z,Trying to sign up for the vaccine and the website keeps crashing,,1348781412284063744
blueyedwonderrr,2021-01-11T23:58:42.000Z,IM GETTING THE VACCINE!,,1348781411805908993
chekerez,2021-01-11T23:58:41.000Z,"Roque makes it sound like the people are beggars who cannot be choosy.. Actually, the vaccine will be funded by loans to be paid for by taxes.. Tingin niyo personal donation niyo yan sa amin?..",,1348781409331146753
mallahadley,2021-01-11T23:58:41.000Z,"@IvankaTrump  Girl, you stay at home. We saw you celebrating with the rest of your crime family as daddy Don incited the white supremacist mob on January 5. And you were complicit.",https://x.com/IvankaTrump,1348781408752259072
brish_ti,2021-01-11T23:58:41.000Z,"Is vaccine rollout stalled in urban areas until we get more Pfizer vaccine later?  Yes. Waiting for shipments, some coming tomorrow, some Wednesday, some Thursday.  ""We at least have a guaranteed number that's coming this week"" but timing is more last minute @CapitalDailyVic",https://x.com/CapitalDailyVic,1348781407250780161
DinkinFlicka10,2021-01-11T23:58:40.000Z,Gonna watch the College Football Championship and either play Majoras Mask or Age of Calamity because I don't foresee this being a close game.,,1348781405774471170
FlaReview,2021-01-11T23:58:40.000Z,"(2/2) “It is why trust in media is at an all-time low, why elections are seen as existential struggles, and why large numbers of health care professionals are refusing to be vaccinated for COVID-19” writes  @PaulGFernandez .",https://x.com/PaulGFernandez,1348781403731861504
gui2190,2021-01-11T23:58:40.000Z,Me during this pandemic,,1348781403702497281
sikkinouza,2021-01-11T23:58:40.000Z,@SNHDflu  I'm trying to figure out what tier I'm in for a COVID vaccine but it's a little unclear. I've been on hold for an hour. Can someone advise?,https://x.com/SNHDflu,1348781402909675521
PipfroschP,2021-01-11T23:58:40.000Z,The problem we are having with vaccine distribution is a good demonstration of why means testing for financial aid doesn't work.,,1348781401877872643
AlexBachII,2021-01-11T23:58:39.000Z,And lockdown proponents should be made to pay for the catastrophic economic destruction they have caused.,,1348781399885697024
Perkywarrior,2021-01-11T23:58:39.000Z,"He and the NorCal Militia are domestic terrorists.  They're mad that the FBI has gone to his home to talk to him.  He threatens elected officials, keeps his bar/restaurant open, threatens business owners who follow state covid mandates.  @anewscafe  keeps close tabs on him..",https://x.com/anewscafe,1348781398853779456
Isysuttie,2021-01-11T23:58:39.000Z,We have to get our kicks where we can in lockdown!,,1348781398698708992
iamahaterx100,2021-01-11T23:58:39.000Z,"Wait I never even thought about radio stations during this whole pandemic... I feel like Americans rely on radio more, probably wrong because I haven’t been in radio in yonks or kept up with the Jones’s.",,1348781398639960066
SinBinVegas,2021-01-11T23:58:39.000Z,"I don't see that happening. In fact, due to quarantine rules he might not even be available.",,1348781398383972352
DangerfieldR,2021-01-11T23:58:38.000Z,How is Red not “can come home but must quarantine for 14 days with testing on arrival and at the end”,,1348781396056162304
datingscams101,2021-01-11T23:58:38.000Z,"London Hughes on To Catch a Dick, Dating, and Filming a Kissing Scene With Bridgerton’s Regé-Jean Page | #dating | #datingcovid | #covid  datingscams101.com/london-hughes- …",https://x.com/hashtag/dating?src=hashtag_click https://x.com/hashtag/datingcovid?src=hashtag_click https://x.com/hashtag/covid?src=hashtag_click https://t.co/RIRIBDIoT6,1348781394969972736
bellevillenewsd,2021-01-11T23:58:37.000Z,St. Clair County reports its fourth deadliest day since the COVID-19 pandemic began  ift.tt/39mJ94j,https://t.co/1ARH7HvNJI,1348781392398852098
Ben57725188,2021-01-11T23:58:37.000Z,"Could it be that those who haven’t been so militant with the social distancing have been exposed enough to build resistance? Same as why supermarket workers haven’t been dropping dead left right and centre? Just a theory, seen no evidence",,1348781392331743237
MichaelRikon,2021-01-11T23:58:37.000Z,"enewspaper.nydailynews.com/infinity/artic … - COVID-19, cold, allergies, flu:",https://t.co/1A1vgcMJQQ,1348781392012959744
CrabbyAshley,2021-01-11T23:58:37.000Z,Idk where you’re from but as far as I know South Carolina has done zero contact tracing. You get notified at work if a “close contact” coworker tests positive or has symptoms and is getting tested and that’s about it.,,1348781391820054528
PasadenaCaD2,2021-01-11T23:58:37.000Z,"Pasadena Council District 2 - January Newsletter: Slow Streets Program, Small Business Covid Relief and more!:  myemail.constantcontact.com/District-2-New …  #pasadena",https://t.co/JoQyhanJPw https://x.com/hashtag/pasadena?src=hashtag_click,1348781391232659456
CFJC_Today,2021-01-11T23:58:37.000Z,Should B.C. follow Quebec by instituting a #COVID19 curfew? | CLICK TO VOTE:  cfjctoday.com/2021/01/11/sho … #Kamloops,https://x.com/hashtag/COVID19?src=hashtag_click https://t.co/46BNbypSCM https://x.com/hashtag/Kamloops?src=hashtag_click,1348781390569951235
folkloreisorare,2021-01-11T23:58:37.000Z,"you are next to the musin industry and not wearing a mask, how dare you",,1348781390305890306
base_thai,2021-01-11T23:58:37.000Z,#Thai Govt forms committee for vaccine rollout bangkokpost.com/thailand/gener …,https://x.com/hashtag/Thai?src=hashtag_click https://t.co/DPvhhzUmlO,1348781390112821249
MacColsonTV,2021-01-11T23:58:37.000Z,Happy Vaccination Day  to one of my best friends! Happy for you!   t.co/3wfKIZ5ceq,https://t.co/3wfKIZ5ceq,1348781390100262915
AlanMBevin,2021-01-11T23:58:37.000Z,CBS reporter forces Nancy Pelosi to own 'obstructing' COVID relief after blaming Republicans  theblaze.com/news/cbs-nancy …,https://t.co/veiRMPJAsU,1348781389987016706
WaterlooOECTA,2021-01-11T23:58:37.000Z,A trustee asked about the implementation of a new curriculum during a pandemic... Not ideal...but we’ve had quite a few successes...we are seeing lots of participation virtually by teachers,,1348781389748056064
