User_name,Datetime,Content,Links,Tweet_ID
honestlyJanie,2021-01-11T23:59:59.000Z,"Yep! January 21st, politicians will tell us we can start reopening!",,1348781736415670272
WinchesterSis83,2021-01-11T23:59:59.000Z,Thanks Amanda. I hope so. It shouldn’t be this difficult to get the vaccine.,,1348781735685750784
jfmezei,2021-01-11T23:59:59.000Z,"One person that emerged in 2020 was  @MurielBowser  , mayor of Washington DC.  I think she earned much respect in 2020.  COVID restrictions, BLM and now the insurrection).",https://x.com/MurielBowser,1348781735522291712
PearDeck,2021-01-11T23:59:59.000Z,"Whether you're teaching virtually, face to face, or in some combination, it's important for you to pause and check in with yourself!  This blog post by guests Mike & Nita Creekmore shares tips for building a self-care recipe to last all year.",,1348781734926708736
marsbotz,2021-01-11T23:59:59.000Z,? what is sans face mask attached to,,1348781734440087553
buckeye777,2021-01-11T23:59:57.000Z,I don’t think we will have a regular season this year. The pandemic will still be here,,1348781727875960832
delicaterey,2021-01-11T23:59:57.000Z,"This is the first birthday where I’m not too excited about it because i can’t do anything cause of the pandemic. Regardless, I’m grateful to be okay at least.",,1348781724797292544
bigSmoothBrain,2021-01-11T23:59:56.000Z,Thinking about how many people live on less than $300 a week and those people apparently don't matter outside of the pandemic (or during even),,1348781724763889664
hwasupreme,2021-01-11T23:59:56.000Z,"Last time Hwasa went MIA she went on a trip with Soojung to Thailand, she probably can’t travel out of SK now cause of covid but I hope she’s going somewhere to relax and rest",,1348781724667432963
o0omar415,2021-01-11T23:59:55.000Z,Dr: you Covid test came back negative Me:,,1348781720267595776
ghenry,2021-01-11T23:59:55.000Z,Not bad thanks. Working away. Hating lockdown. Enjoying  @seradio,https://x.com/seradio,1348781718430494721
the101100,2021-01-11T23:59:55.000Z,"Inception, but instead of ideas, they’re implanting Covid into people",,1348781717549563904
JasonWWalton1,2021-01-11T23:59:51.000Z,"I agree but Ocean County is more red, Mayor of Brick went against Murphy's lockdown bullshit",,1348781702269829120
t0nyyates,2021-01-11T23:59:50.000Z,"Not absolutely clear what is meant here.  But...  the more imminent vaccination is, the greater the motive to lock down and suppress, since a covid19 death postponed is one avoided entirely.  The opposite of what seems to be being suggested.",,1348781699308597248
spike_gum,2021-01-11T23:59:50.000Z,why not just give him a mask ?,,1348781699052625920
ManicVAL,2021-01-11T23:59:50.000Z,Got a big clip with a Jason mask,,1348781695655297024
chayap16,2021-01-11T23:59:49.000Z,You’re welcome   just now by the way of Covid 19 our country closed !!!! and look forward when crisis of Covid 19 gone we welcome you to visit Thailand again,,1348781694564724737
kawaiikpoptrash,2021-01-11T23:59:49.000Z,I need this lockdown to fucking end so I can get THE FUCK OUT OF HERE,,1348781694472617985
a_peterman,2021-01-11T23:59:49.000Z,Nigeria's socioeconomic effects from the pandemic?,,1348781693054828547
fredericks44,2021-01-11T23:59:49.000Z,The democrat COVID miracle has occurred !!,,1348781692379656192
DSGSplashy,2021-01-11T23:59:48.000Z,I got my COVID-19 Test and im Negative. Thank god for that,,1348781691083567113
ZyrylAlyssa,2021-01-11T23:59:48.000Z,Pt. 3 For the past year we have been wanting to develop B2C products for our retail branding team at Outboxd. The pandemic gave us opportunity to set-up our own e-commerce shop at  outboxd.shop,https://t.co/bmw7Km3YxS,1348781689984540678
heonsbee,2021-01-11T23:59:48.000Z,jooheon blue hair lockdown,,1348781689644974081
McMurraySally,2021-01-11T23:59:48.000Z,@Morrisons  Boroughbridge I'm surprised you have anyone in store- with or without a mask- as there is never any stock in the shelves anyway.,https://x.com/Morrisons,1348781688869048320
MSilybum,2021-01-11T23:59:48.000Z,It's only after 8pm when I really start clamouring for a vaccine... where and when???,,1348781688579624966
Mazaratti__,2021-01-11T23:59:48.000Z,Cheers to 21 in a pandemic,,1348781687069499393
wascallywose,2021-01-11T23:59:47.000Z,"Good. You were a gushing fountain of bad medicine, prolonging this horrible pandemic. The fewer people hear from you, the better.",,1348781686520127488
55krissi55,2021-01-11T23:59:47.000Z,Jacob Rees Mogg & Boris Johnson both breaking Lockdown Restrictions & the police take no action against them. It's as though they are trying to deviously encourage the public to break #lockdown rules so they can then unfairly blame the public.  Rules 4 them & Us #coronavirusuk,https://x.com/hashtag/lockdown?src=hashtag_click https://x.com/hashtag/coronavirusuk?src=hashtag_click,1348781684754436099
chandleur,2021-01-11T23:59:47.000Z,"A Riot Amid a Pandemic: Did the Virus, Too, Storm the Capitol?  nytimes.com/2021/01/07/hea …",https://t.co/jcnRrFNSah,1348781684200595457
greglee91,2021-01-11T23:59:47.000Z,"We’re in lockdown, you’ve got the perfect excuse",,1348781683789750280
KelMar84,2021-01-11T23:59:46.000Z,"How many of these families were doing fine before the pandemic and are trying to live off 80% of their normal wage, or were newly self-employed and have been living off savings for 10 months?",,1348781682262945792
MS_Neg,2021-01-11T23:59:46.000Z,Mask on 2021,,1348781679905808387
KaffeHusKatt,2021-01-11T23:59:46.000Z,"That explains it. Until the covid deal, we went from 8:20 being the start of class to a 3:15 dismissal.",,1348781679717056512
MadameHoneyPot,2021-01-11T23:59:45.000Z,i thought this was COVID,,1348781677359853571
poserviolence,2021-01-11T23:59:45.000Z,you still have to backline after covid,,1348781677150150657
CharlieBenavi12,2021-01-11T23:59:45.000Z,Hay covid,,1348781676038672390
brojohnson19,2021-01-11T23:59:45.000Z,Are you part of the squad that decided on lockdowns? Because with a comment like that it sure seems like you work at the Oregon health authority. You have 0 clue about qualification requirements nor how to handle a pandemic.,,1348781675883290624
IsekaiManga1,2021-01-11T23:59:45.000Z,Funny Coronavirus Memes to Get You Through The Stress  action.vanilaworld.com/2021/01/11/fun …,https://t.co/gzLl4UHR37,1348781675728220160
NYNHCARE,2021-01-11T23:59:45.000Z,Or reopening nursing homes for family visits.,,1348781675203993601
peaches_melba,2021-01-11T23:59:44.000Z,"If its true this is happening,  it will be the Councils, mainly Labour, in the areas where children need to be fed by the Govt.  The Govt has provided the Councils with £millions to assist with meals for kids and other emergency Covid funding. Are they cheating hungry kids?",,1348781674021048320
MGRemmele,2021-01-11T23:59:44.000Z,"Got my first covid test today.  I’m no Taiichi Ohno, but they could use someone who understands manufacturing to help speed things up.",,1348781673354317824
NBunddle,2021-01-11T23:59:44.000Z,Japan PM says to consider state of emergency in Tokyo area as covid cases surge  newsbunddle.com/japan-pm-says- …,https://t.co/uaOt3AdHte,1348781672762925056
memphomofo,2021-01-11T23:59:44.000Z,It was Drew They have COVID They breathed on him  x.com/DijakFYE/statu …,https://x.com/DijakFYE/status/1348778941947981824,1348781672016314370
RVoszPhlebotomy,2021-01-11T23:59:44.000Z,Senior Citizens Wanting COVID Vaccine Face 51-Step Online Registration Process  phlebotomycareertraining.org/senior-citizen …,https://t.co/wY11ohhAav,1348781670866976768
jada623,2021-01-11T23:59:43.000Z,I’ve done the COVID training 3 times and it still says I didn’t do it,,1348781670103715842
lilstuffParsons,2021-01-11T23:59:43.000Z,"COVID-19 travel restrictions by state: See testing, quarantine requirements  usatoday.com/story/travel/n … via  @usatoday",https://t.co/pJ3Ipv5qJK https://x.com/usatoday,1348781669650722816
MalissaShriver,2021-01-11T23:59:43.000Z,How #France Is Helping Its #Artists During The Pandemic #Arts & #Culture ⁦ @NPR ⁩ ⁦ @ArtsforBiden ⁩ ⁦ @Americans4Arts ⁩   npr.org/2021/01/11/954 …,https://x.com/hashtag/France?src=hashtag_click https://x.com/hashtag/Artists?src=hashtag_click https://x.com/hashtag/Arts?src=hashtag_click https://x.com/hashtag/Culture?src=hashtag_click https://x.com/NPR https://x.com/ArtsforBiden https://x.com/Americans4Arts https://t.co/O086dJItqv,1348781668635529216
DaleV73,2021-01-11T23:59:43.000Z,A reminder that staff at the Ontario's COVID-19 health table were told to sign a non disclosure agreement if they wanted to be apart it.   We all know why. Because the Ford government isn't following expert advice.,,1348781668170084352
DertGroe,2021-01-11T23:59:43.000Z,"Ducey is okay with killing your kids, and you. rip those school doors open as a pandemic rages, fling your family into the Dowcano!! #ResignDucey #TeacherStrikeAZ #TeacherStrike",https://x.com/hashtag/ResignDucey?src=hashtag_click https://x.com/hashtag/TeacherStrikeAZ?src=hashtag_click https://x.com/hashtag/TeacherStrike?src=hashtag_click,1348781667893141504
PhilipRadbourne,2021-01-11T23:59:43.000Z,"Or even advising which one works best.  Is it best to take the Pfizer, Moderna or the AZ vaccine?",,1348781667134140418
mpelembe,2021-01-11T23:59:43.000Z,Government publishes plan for the largest vaccination programme in British history  jadmelle.blogspot.com/p/uk-business- …,https://t.co/BOPa5YIVkz,1348781666983178241
Lovepeace62Mary,2021-01-11T23:59:42.000Z,There you are guy’s week to late! This is what you should have done last week!! Joe Biden Hunter Biden China = COVID 19,,1348781665582252038
fdjordanjr,2021-01-11T23:59:42.000Z,House Democrat tests positive for COVID-19 after sheltering from mob with mask-refusing Republicans  dailykos.com/story/2021/1/1 …,https://t.co/sIFXfsVc4m,1348781665116557314
BrocqChristine,2021-01-11T23:59:42.000Z,"For anyone who thought it a great idea to disregard SAGE'S advice on Variant B117, especially Mendacious Dick, Le Fondré, Dr M and STAC, this is the advice you blatantly disregarded any subsequent deaths from school transmission are your kills!",,1348781663946498049
CocoTheParrot,2021-01-11T23:59:42.000Z,Coronavirus: Boris Johnson criticised over bike ride seven miles from home  bbc.co.uk/news/uk-politi …,https://t.co/YmM3rL9ulD,1348781663883563008
DistinctToday,2021-01-11T23:59:42.000Z,Gok Wan shares childhood snap of bowl cut hairstyle as he jokes he’ll recreate it in lockdown  distincttoday.net/2021/01/11/gok …,https://t.co/qKHYBFVqJF,1348781663757631489
annaberu,2021-01-11T23:59:42.000Z,And EVERYONE knows of someone who has died where covid has been put as cause of death and they have died from something else,,1348781663325741056
scottbraddock,2021-01-11T23:59:42.000Z,A covid test will now be required to enter the Texas Capitol on opening day #txlege,https://x.com/hashtag/txlege?src=hashtag_click,1348781663271137283
blueskyradios99,2021-01-11T23:59:42.000Z,"Senator Brown said on MSNBC, while in the emergency lockdown during the Capitol terroristic attack-  SENATOR LINDSEY GRAHAM-  Took off his mask and SCREAMED at a Capitol Police officer about not protecting him sufficiently-  Maybe the Senator forgot about his own part in this?",,1348781663120224264
eusela13,2021-01-11T23:59:42.000Z,So the revolution has begun but its not white vs black but WHITE TRUMP'S SUPPORTERS VS AMERICA!   AMERICA WILL SURVIVE COVID 19!  AMERICA WILL JAIL TERRORISTS!   AMERICA WILL STAY UNITED!   AMERICA IS FREE TO REAL AMERICANS! NOT POSERS THAT HATE THEIR OWN PEOPLE!,,1348781662516047872
kak00ntz,2021-01-11T23:59:41.000Z,at a quick scroll I honestly thought this was a pic of the coronavirus,,1348781660960120832
YesIamAPirate,2021-01-11T23:59:41.000Z,I have one due in April,,1348781658686816263
mg_oxana,2021-01-11T23:59:41.000Z,"I will never understand why Is so difficult make gambian people understand this virus is real,is here and make them use mask.I will loss my voice telling people at the hospital all day to put the mask  please. (Is all world with this mask problem.)",,1348781658661662720
Ewingsports,2021-01-11T23:59:41.000Z,"Feel for the skaters. The world champs last March in Montreal were one of the first int'l events brought down by COVID, and Cdns haven't had the chance to compete since.",,1348781658481295372
gouravk,2021-01-11T23:59:41.000Z,Wtf ! Which means it will be a luck of draw for hcws on whether get the tested Oxford vaccine or the untested bharat biotech vaccine?,,1348781658414014464
LoriSux,2021-01-11T23:59:40.000Z,"After 11 days in quarantine, we got a text from DHHS last night saying our quarantine has been lifted.  I'm all for following the rules and the go hard, go early approach. But I can't tell you how frustrated I am, having used up all my work leave sitting in my house.",,1348781657638125568
yagunamja,2021-01-11T23:59:40.000Z,"Questioning media fear mongering, over reaction, unreasonable shutdowns, lost jobs, etc... Is. Not. Denying. Covid. Exists.",,1348781657420042241
pastorbillyshaw,2021-01-11T23:59:40.000Z,"UK 12/20/2020 Estimates that 80% are asymptomatic were too high, & have been revised down to 17% - 20%. It’s also unclear to what extent asymptomatic people transmit SARS-CoV-2. No test of infectiousness is currently available for routine use.”  doi.org/10.1136/bmj.m4 …",https://t.co/2dXiSfaxSS,1348781656535162880
danny47291,2021-01-11T23:59:40.000Z,"Straight up dude. I say this since beginning you can tell how much common sense people lack and stupidity. We fighting 2 pandemics covid, stupid of some people",,1348781656497262593
eean,2021-01-11T23:59:40.000Z,"they should add ""people who've already had COVID-19"" to this study",,1348781655402500098
freyasflorence,2021-01-11T23:59:40.000Z,Coronavirus: Italy goes back under regional tier system  thelocal.it/20210111/coron … via  @TheLocalItaly,https://t.co/7yOSTPOLNx https://x.com/TheLocalItaly,1348781654991458304
LowCountryNoles,2021-01-11T23:59:39.000Z,Then she needs to look for another job.  My company has been hiring like crazy since this pandemic started and we cannot hire fast enough.  There are jobs out there,,1348781649656504321
JohnMcKellar2,2021-01-11T23:59:38.000Z,"Recorded hours ago... January 11, 2021.  Mother Miriam compares current global pandemic to the Flood of Noah.  #COVID19  @JoeBiden  @KamalaHarris  @DNC  @michaelcoren youtu.be/gCIZvVGA2-E via  @YouTube",https://x.com/hashtag/COVID19?src=hashtag_click https://x.com/JoeBiden https://x.com/KamalaHarris https://x.com/DNC https://x.com/michaelcoren https://t.co/g8jS5rPoPn https://x.com/YouTube,1348781647177658368
Ray96307983,2021-01-11T23:59:38.000Z,"Got a pandemic going on, businesses shutdown,  folks without paychecks, kids not in school, and I could go on & on and this idiot spends time writing a bill like this.",,1348781646032629764
retsebez,2021-01-11T23:59:38.000Z,More than welcome to come for burgers & fries I will save one for you...Covid has taken over..I live it and breath it every day at the hospital..it takes over people's lives. I agree it will be interesting what they come up with. Hope the games don't stop. Money will be a factor,,1348781645550256130
weirdworldnews0,2021-01-11T23:59:37.000Z,I hear that there is a lot of wastage. In Israel young people go at the end of the vaccination sessions and have any remaining unused vaccines instead of wasting them. We should do that here.,,1348781643230834690
KENS5,2021-01-11T23:59:37.000Z,BCSO: 45-year-old inmate dies in hospital after testing positive for coronavirus  kens5.com/article/news/h …,https://t.co/7l7lj6xJjm,1348781641376923649
vrachelv9,2021-01-11T23:59:37.000Z,And yet months later we’re still waiting for a functioning covid app. Where’s the outrage?,,1348781641234149379
uncanny_anatomy,2021-01-11T23:59:36.000Z,"sometimes i forget about how much a true robbery of life this pandemic is dude. like id be in my last musical right now, looking forward to a trip to disney and my senior prom. id have already had a junior prom, and had been on a trip to dc. fuck man",,1348781637631430661
UsuallyRanting,2021-01-11T23:59:31.000Z,"What do you fucking care? If it's not Covid you don't give a shit.  We've lost everything good or joyful in your name, for your gargantuan bureaucracy. And all as you lapped up applause, discounts and played politics to make yourselves the only thing that mattered.  #NotClapping.",https://x.com/hashtag/NotClapping?src=hashtag_click,1348781619801448448
JuliaSp68139555,2021-01-11T23:59:31.000Z,@DrLeanaWen   It doesn’t seem possible to me that all of the people who get Covid-19 are not wearing masks. Could it be that cloth masks are ineffective?  Should #Biden enact the #DPA to make N95 masks for the public?,https://x.com/DrLeanaWen https://x.com/hashtag/Biden?src=hashtag_click https://x.com/hashtag/DPA?src=hashtag_click,1348781618824163329
chungheejin,2021-01-11T23:59:31.000Z,Maybe COVID-19 vaccine will be free for South Koreans.,,1348781618496892928
Herkorin,2021-01-11T23:59:31.000Z,"Hi Mr President, your main job is to accelerate the vaccine deployment so this nightmare can end ASAP, best of luck !!",,1348781618094370818
Victoria_Nkatha,2021-01-11T23:59:31.000Z,"Come to think of it, if there is anything ladies really have saved during the pandemic, is the cash we spend on makeup honestly.",,1348781617515548673
SurajShah_,2021-01-11T23:59:31.000Z,"If Stanley Johnson got his second vaccine dose as per Pfizer’s recommendations, then so should everyone else.",,1348781616911572998
vparishu,2021-01-11T23:59:31.000Z,VIDEO: Biden reveals who is on his ‘top priority’ list for coronavirus aid – here’s who is NOT on the list  dennismichaellynch.com/video-biden-re …,https://t.co/w1HgQz1flJ,1348781616777359360
NJ_WhatExit,2021-01-11T23:59:31.000Z,"While businesses are going bankrupt, kids are now 10 months without full time in person school, MVC and unemployment are still a mess, we have one man rule, and a failed vaccine roll out; THIS is what the NJ legislature decides to spend its time on.",,1348781616081076226
SherriDouville,2021-01-11T23:59:30.000Z,"2(2)  @trishgreenhalgh  says “Solutions to pandemic will be interdisciplinary & be informed by chemistry (the composition of air), physics (the flow of air) & architecture (design of airier buildings),” System driving this nascent if even exists in U.S.  x.com/trishgreenhalg …",https://x.com/trishgreenhalgh https://x.com/trishgreenhalgh/status/1347647053988470785?s=21,1348781614717829120
BlackBelted,2021-01-11T23:59:30.000Z,Basically a 3 day death toll from your Covid guidance and leadership  t.co/A9OHqQD0nU,https://t.co/A9OHqQD0nU,1348781613178630145
JohnDrakeCooper,2021-01-11T23:59:30.000Z,"May they all get CoViD19 (SARS-CoV-2) and live, but be unable to ever speak or run again",,1348781613023256578
franzicake,2021-01-11T23:59:30.000Z,"I have a disability, I’m wearing a mask, I saw a woman complaining about masks whilst smoking a cigarette. I am suicidal through loneliness, wear a bloody mask to help get this under control , I’m fed up with the excuses",,1348781612637560832
WillyCoburn,2021-01-11T23:59:30.000Z,"@MiCocina_TexMex  My wife, date night after 3+ months locked up on quarantine. Waiting for shredded cheese as it's the only way she can eat fajitas. We've asked 4 people, going on 18 minutes now. Just unreal at Allen, TX location. We gotta quit blaming #covid19 for crappy service.",https://x.com/MiCocina_TexMex https://x.com/hashtag/covid19?src=hashtag_click,1348781612079734785
kateysheppy,2021-01-11T23:59:30.000Z,"""Dumb, rich, and white about covid"" is so descriptive lol  That's really too bad to hear. I'm only in my 3rd year of teaching. Moving to LA next year, wonder what that will be like.",,1348781612037599232
supersoftgrunge,2021-01-11T23:59:29.000Z,today at work an elderly man asked me if i had a gun on me after he thanked me for wearing a mask,,1348781611496714245
67Joolz,2021-01-11T23:59:29.000Z,"So, we got the government and the sage psychos banging on and on about social distancing, talk of being banned from speaking to each other in supermarkets.......But we now  have an advert with people playing tonsil tennis with a creme egg.",,1348781608728457219
WilliamJWills,2021-01-11T23:59:28.000Z,Country needed COVID relief for 8 months but she didn’t act and neither did  @ColinAllredTX  these multi millionaire legislators have no idea the pain they have caused,https://x.com/ColinAllredTX,1348781607197487105
peaceterry,2021-01-11T23:59:28.000Z,"Yup, that’s why for profit LTC homes have the highest death counts and why the For-Profit US healthCare system has more COVID-19 cases & more death than any country on the globe including India & China. Carl has been drinking the Kool-Aid or was it  hydroxychloroquine? #COVID19US",https://x.com/hashtag/COVID19US?src=hashtag_click,1348781605469515777
nashvilleBob1,2021-01-11T23:59:28.000Z,"Due to Covid BS my gym time hasn’t existed since before Christmas... at least my diet has prevailed, and I’m still getting some reading done... book of Daniel",,1348781604777250817
asapbarroso,2021-01-11T23:59:28.000Z,my ex must have caught covid and lost their taste bc tf is that downgrade,,1348781603758157826
ninetysx,2021-01-11T23:59:27.000Z,"But this is what I meant, that when they were together she accumulated a ton of sox merch with his number so the tag could’ve been from then? Idk  Also I thought fathers weren’t allowed in delivery due to covid anyway? At least they’re not here",,1348781602135011329
leemancasey,2021-01-11T23:59:27.000Z,"Colt Clark and the Quarantine Kids play ""Gimme Shelter""  youtu.be/FU_arNEQ8lM via  @YouTube",https://t.co/flxVUKrlDv https://x.com/YouTube,1348781599937224704
reopenpa,2021-01-11T23:59:26.000Z,There's risk in everything and we can't look at this just through the lens of epidemiology / preventing a virus from spreading. I don't care if I catch covid. And I tell everyone I know that. So they can decide for themselves if they want to risk prolonged close contact with me.,,1348781598414696448
joannem94981348,2021-01-11T23:59:26.000Z,Nothing to do with mask people are being made to stay at home and their rights are severely impacted it is against human rights laws to isolate people,,1348781598179786752
TCreatedplayer,2021-01-11T23:59:26.000Z,Covid messing up middle school sports . I am about to find an AAU team now to play.  Soon as I get going school going to be like okay we can practice now,,1348781597974274051
D_W00D,2021-01-11T23:59:26.000Z,Bama by 30....the Heisman mask with that get up. Whew,,1348781596426465280
sad_cowboy420,2021-01-11T23:59:26.000Z,I want to endlessly harass the school district for making my dad go back to work before getting the vaccine,,1348781595302391808
artharo88,2021-01-11T23:59:26.000Z,"Whats this there to think about, recalling a governor in the middle of a pandemic is not very smart. People are putting wealth before health. And the Rams can wipe the floor with the Raiders. Better luck next year",,1348781595197468672
mikeinthevalley,2021-01-11T23:59:25.000Z,"100% but with the entire world fighting for the vaccine I think everyone knew this was going to be the case. Listening to the extensive review that they and other bodies did, I feel confident in this approach and I was decidedly against this approach as last as last week.",,1348781590801907713
Gammin7,2021-01-11T23:59:24.000Z,"With such a dangerous and contagious virus, maybe stop quaranting in the CBD.   QLDs a big state with many islands. What are they thinking?  Also might help to not let quarantine workers catch the train to work.  Just a though..what'd you reckon?  #brisbanelockdown",https://x.com/hashtag/brisbanelockdown?src=hashtag_click,1348781590361509893
swkhoo,2021-01-11T23:59:24.000Z,"Do some research. Up to now the only vaccine available is the Pfizer one which is quite fragile. It has to be stored at minus 72, can only be moved a maximum of 5 times from leaving the production facility and has to be used with two hours after defrosting.",,1348781590298681344
MikeMoody334,2021-01-11T23:59:24.000Z,Thought them top ones was Covid,,1348781589942005764
Deej75335827,2021-01-11T23:59:24.000Z,"#WAKEUPDOUG vaccinate,look at CUOMO (NY) tweet. ""We simply cannot stay closed until the vaccine hits critical mass. The cost is too high. We will have nothing left to open. We must reopen the economy""     @JohnTory  @epidemic  @fordnation  @JustinTrudeau  @CPHO_Canada  @GeneralHillier",https://x.com/hashtag/WAKEUPDOUG?src=hashtag_click https://x.com/JohnTory https://x.com/epidemic https://x.com/fordnation https://x.com/JustinTrudeau https://x.com/CPHO_Canada https://x.com/GeneralHillier,1348781589300453384
ArchieHicoxGB,2021-01-11T23:59:24.000Z,One only has to look at the vaccination debacle - the EU is blocking individual states from procuring vaccines whilst the big dogs like Germany does what it wants. It's a typical failure of the EU - when their backs are up they drop the idea of solidarity and do what they want.,,1348781589296242688
kaitlin_nichole,2021-01-11T23:59:24.000Z,“New COVID-19 strain first discovered in UK now identified in Indiana”   great.,,1348781589015224327
TIFFY_CUTE,2021-01-11T23:59:24.000Z,@trixiemattel  @brittany_broski  so I realize we’re in a pandemic but I really hope y’all make another collab soon... I really need a good laugh,https://x.com/trixiemattel https://x.com/brittany_broski,1348781588977381376
colonelcrystal1,2021-01-11T23:59:24.000Z,Biden’s team is crazy! This us racial discrimination.   Patriots need to go to Court ASAP!  Will they also discriminate with regard to the administration of the vaccine?  Atrocious! This is no longer America!,,1348781588390301696
